number,value,datetime_start,datetime_complete,duration,params_batch_size,params_dist1,params_iseed,params_l2_penalty_choice,params_l2_penalty_nz,params_lr,params_lr_anneal_start,params_nhid1,params_scale_heur1,params_scale_mult1,params_squash,user_attrs_avg_fit_criteria,state,avg_fit_criteria
0,0.8239516615867615,2025-09-02 03:15:46.148247,2025-09-02 03:23:10.197470,0 days 00:07:24.049223,100,normal,8,zero,,0.012611815565767931,2659,832,old,1.1017912259422258,logistic,0.009468626976013184,COMPLETE,0.009468626976013184
1,0.839629065990448,2025-09-02 03:23:10.198014,2025-09-02 04:02:06.188944,0 days 00:38:55.990930,20,uniform,6,nz,2.0547199328558857e-07,0.16396997761073914,743,192,old,1.2225775747269245,logistic,0.001936793327331543,COMPLETE,0.001936793327331543
2,0.1134677454829216,2025-09-02 04:02:06.189895,2025-09-02 04:09:30.617222,0 days 00:07:24.427327,100,uniform,5,zero,,9.506281571106352e-05,1011,288,Glorot,,logistic,0.013033914566040038,COMPLETE,0.013033914566040038
3,0.6250483989715576,2025-09-02 04:09:30.617720,2025-09-02 04:48:35.312043,0 days 00:39:04.694323,20,uniform,8,nz,3.340579416277081e-05,2.1049515830306782e-06,798,992,Glorot,,tanh,0.013118958473205567,COMPLETE,0.013118958473205567
4,0.8183065056800842,2025-09-02 04:48:35.313407,2025-09-02 04:55:56.221542,0 days 00:07:20.908135,100,normal,8,zero,,0.005680937610553498,2579,496,Glorot,,tanh,0.010936522483825683,COMPLETE,0.010936522483825683
5,0.8178065061569214,2025-09-02 04:55:56.222644,2025-09-02 05:31:28.467146,0 days 00:35:32.244502,20,normal,7,zero,,0.040058969243291886,2604,992,Glorot,,logistic,0.0074651241302490234,COMPLETE,0.0074651241302490234
6,0.1134677454829216,2025-09-02 05:31:28.467567,2025-09-02 05:38:32.702749,0 days 00:07:04.235182,100,uniform,8,zero,,1.2460411629798946e-05,6359,416,Glorot,,logistic,0.012998247146606445,COMPLETE,0.012998247146606445
7,0.5993387341499329,2025-09-02 05:38:32.703177,2025-09-02 05:45:36.369817,0 days 00:07:03.666640,100,normal,5,zero,,6.369821113063238e-06,9757,720,old,0.5115210082666259,tanh,0.013143968582153321,COMPLETE,0.013143968582153321
8,0.5541774272918701,2025-09-02 05:45:36.370260,2025-09-02 06:20:25.880003,0 days 00:34:49.509743,20,uniform,6,zero,,4.4654883954691955e-06,3564,416,old,0.6601759155814514,tanh,0.012976813316345214,COMPLETE,0.012976813316345214
9,0.7931451797485352,2025-09-02 06:20:25.880428,2025-09-02 06:27:52.403645,0 days 00:07:26.523217,100,uniform,8,nz,1.5621204728163365e-06,0.0036346950323246753,538,928,Glorot,,tanh,0.012632083892822266,COMPLETE,0.012632083892822266
10,0.6056451797485352,2025-09-02 06:27:52.404076,2025-09-02 07:04:59.883455,0 days 00:37:07.479379,20,uniform,5,nz,5.7833085248908403e-08,0.0007135089719871662,487,576,Glorot,,tanh,0.013048982620239258,COMPLETE,0.013048982620239258
11,0.6257903456687928,2025-09-02 07:04:59.883889,2025-09-02 07:39:47.079754,0 days 00:34:47.195865,20,normal,8,zero,,0.00043340174043252305,365,976,old,0.273941419851531,tanh,0.013093876838684081,COMPLETE,0.013093876838684081
12,0.7728387475013733,2025-09-02 07:39:47.080588,2025-09-02 07:46:40.165105,0 days 00:06:53.084517,100,uniform,5,zero,,0.006036687230540028,518,496,old,0.8331442788576597,logistic,0.011593031883239745,COMPLETE,0.011593031883239745
13,0.1134677454829216,2025-09-02 07:46:40.165944,2025-09-02 07:54:05.540395,0 days 00:07:25.374451,100,uniform,7,nz,1.367989792242663e-08,7.091274531602468e-06,1569,384,Glorot,,logistic,0.013120627403259278,COMPLETE,0.013120627403259278
14,0.6128548622131348,2025-09-02 07:54:05.541133,2025-09-02 08:01:07.826815,0 days 00:07:02.285682,100,normal,5,zero,,0.013094244682014585,301,160,old,1.3330847803202919,logistic,0.009721922874450683,COMPLETE,0.009721922874450683
15,0.5920645475387574,2025-09-02 08:01:07.827651,2025-09-02 08:08:30.974385,0 days 00:07:23.146734,100,normal,6,nz,1.2134601472469401e-05,0.0002887138756286331,121,592,old,0.33709258675285036,tanh,0.013113713264465332,COMPLETE,0.013113713264465332
16,0.8151290774345398,2025-09-02 08:08:30.975131,2025-09-02 08:15:32.977657,0 days 00:07:02.002526,100,uniform,7,zero,,0.0856956409647669,1799,352,Glorot,,logistic,0.003285121917724609,COMPLETE,0.003285121917724609
17,0.5887580990791321,2025-09-02 08:15:32.978508,2025-09-02 08:22:31.592536,0 days 00:06:58.614028,100,uniform,5,zero,,9.318544447640828e-06,368,576,Glorot,,tanh,0.013099360466003417,COMPLETE,0.013099360466003417
18,0.6950806856155396,2025-09-02 08:22:31.592998,2025-09-02 08:29:32.017947,0 days 00:07:00.424949,100,uniform,5,zero,,0.00026913942522638486,9984,928,old,1.1287749591948544,logistic,0.01278517246246338,COMPLETE,0.01278517246246338
19,0.8219032764434815,2025-09-02 08:29:32.018372,2025-09-02 09:06:35.001757,0 days 00:37:02.983385,20,uniform,7,nz,0.006148641099918832,0.022461343267204566,8862,832,old,0.4495867877664373,logistic,3.957748413085938e-06,COMPLETE,3.957748413085938e-06
20,0.8222419857978821,2025-09-02 09:06:35.002674,2025-09-02 09:43:40.424177,0 days 00:37:05.421503,20,uniform,6,nz,5.557110625815338e-07,0.062353013069039,677,160,old,1.831668473152785,logistic,0.0030028820037841797,COMPLETE,0.0030028820037841797
21,0.8565967917442322,2025-09-02 09:43:40.424613,2025-09-02 10:20:45.020659,0 days 00:37:04.596046,20,uniform,6,nz,5.153576760984552e-07,0.09589647568677481,1121,144,old,1.9183461633656709,tanh,0.000657200813293457,COMPLETE,0.000657200813293457
22,0.6454193949699402,2025-09-02 10:20:45.021259,2025-09-02 10:27:48.353825,0 days 00:07:03.332566,100,normal,8,zero,,0.0015092844103890717,1548,688,old,1.98050919623712,logistic,0.012539815902709962,COMPLETE,0.012539815902709962
23,0.8194194078445435,2025-09-02 10:27:48.354508,2025-09-02 11:04:49.059888,0 days 00:37:00.705380,20,uniform,5,nz,4.4088641373266654e-07,0.0021247778912376887,3042,240,old,1.4878120520428406,tanh,0.01035609245300293,COMPLETE,0.01035609245300293
24,0.824871015548706,2025-09-02 11:04:49.060769,2025-09-02 11:12:16.328136,0 days 00:07:27.267367,100,uniform,6,nz,4.107926771428859e-07,0.13729256691621694,235,144,old,1.1762593203074507,tanh,0.005029511451721191,COMPLETE,0.005029511451721191
25,0.634435498714447,2025-09-02 11:12:16.328575,2025-09-02 11:19:42.642724,0 days 00:07:26.314149,100,uniform,6,nz,3.77681264198061e-07,0.008505811597810442,124,192,old,1.5882964000193227,tanh,0.012137770652770996,COMPLETE,0.012137770652770996
26,0.8879194021224975,2025-09-02 11:19:42.643174,2025-09-02 11:56:49.902182,0 days 00:37:07.259008,20,uniform,8,nz,2.1702319532250016e-07,0.37196315722336704,934,304,old,1.3438840113856203,tanh,0.0004718542098999023,COMPLETE,0.0004718542098999023
27,0.8165484309196472,2025-09-02 11:56:49.903038,2025-09-02 12:33:58.288522,0 days 00:37:08.385484,20,uniform,8,nz,3.867509935904888e-08,0.039696983909928506,725,368,old,1.6395596324551855,tanh,0.00903780460357666,COMPLETE,0.00903780460357666
28,0.8595484018325805,2025-09-02 12:33:58.288965,2025-09-02 13:10:59.006674,0 days 00:37:00.717709,20,uniform,6,nz,2.7624093769943563e-06,0.07749421505543225,2774,336,old,1.97644656278248,tanh,0.0010296821594238282,COMPLETE,0.0010296821594238282
29,0.8946935892105102,2025-09-02 13:10:59.007136,2025-09-02 13:47:58.602693,0 days 00:36:59.595557,20,uniform,6,nz,1.52675787926409e-05,0.18620153474671644,3840,576,old,1.9958554655270515,tanh,0.0003078460693359375,COMPLETE,0.0003078460693359375
30,0.8355968117713928,2025-09-02 13:47:58.603151,2025-09-02 13:55:26.393142,0 days 00:07:27.789991,100,uniform,6,nz,0.00011543317817841956,0.17994908538775442,2340,640,old,1.9986121290875039,tanh,0.002105522155761719,COMPLETE,0.002105522155761719
31,0.855564534664154,2025-09-02 13:55:26.393985,2025-09-02 14:32:24.734117,0 days 00:36:58.340132,20,uniform,6,nz,6.542349870587113e-06,0.06534626784679717,4004,416,Glorot,,tanh,0.0013851404190063476,COMPLETE,0.0013851404190063476
32,0.0978064551949501,2025-09-02 14:32:24.734977,2025-09-02 15:07:14.847205,0 days 00:34:50.112228,20,uniform,6,zero,,0.9171567137909503,1437,432,old,1.9798288716940413,tanh,,COMPLETE,
33,0.8974677801132203,2025-09-02 15:07:14.847879,2025-09-02 15:44:14.508484,0 days 00:36:59.660605,20,uniform,8,nz,4.785064978452858e-06,0.197461717067809,9467,608,old,1.9503840017914382,tanh,0.0028371810913085938,COMPLETE,0.0028371810913085938
34,0.8933387517929077,2025-09-02 15:44:14.508959,2025-09-02 16:21:12.184262,0 days 00:36:57.675303,20,uniform,8,nz,1.4067318068003004e-05,0.14924172348255987,4566,656,old,1.995926298681249,tanh,0.0001486063003540039,COMPLETE,0.0001486063003540039
35,0.8882258534431458,2025-09-02 16:21:12.184721,2025-09-02 16:58:14.173865,0 days 00:37:01.989144,20,uniform,8,nz,0.00010151099730093916,0.23759750303468455,8736,576,old,1.6966586156317105,tanh,0.01786980628967285,COMPLETE,0.01786980628967285
36,0.8807419896125793,2025-09-02 16:58:14.175975,2025-09-02 17:35:16.320422,0 days 00:37:02.144447,20,uniform,8,nz,0.0002702979337521633,0.21457981950103006,9916,848,old,1.7110326886400553,tanh,0.028022408485412598,COMPLETE,0.028022408485412598
37,0.8605967879295349,2025-09-02 17:35:16.321258,2025-09-02 18:09:59.726000,0 days 00:34:43.404742,20,normal,8,zero,,0.5028551653897474,6740,544,old,1.9969225014478549,tanh,0.0018006086349487305,COMPLETE,0.0018006086349487305
38,0.8945806860923767,2025-09-02 18:09:59.726425,2025-09-02 18:47:04.973244,0 days 00:37:05.246819,20,uniform,8,nz,5.663505247302117e-05,0.07991214655358354,7976,480,old,1.6883833364260237,tanh,0.00032153129577636717,COMPLETE,0.00032153129577636717
39,0.8879677891731262,2025-09-02 18:47:04.973946,2025-09-02 19:24:19.650454,0 days 00:37:14.676508,20,uniform,8,nz,2.546752005075019e-05,0.14799935745827303,4892,704,Glorot,,logistic,0.00031599998474121096,COMPLETE,0.00031599998474121096
40,0.8575000166893005,2025-09-02 19:24:19.650897,2025-09-02 19:31:44.120424,0 days 00:07:24.469527,100,normal,8,nz,2.4079852029477e-05,0.342276294235334,6087,704,old,1.7119892535486316,tanh,0.00023856163024902344,COMPLETE,0.00023856163024902344
41,0.2537096917629242,2025-09-02 19:31:44.121098,2025-09-02 20:08:47.409447,0 days 00:37:03.288349,20,uniform,7,nz,0.00023236723789531226,0.5927152764286865,4403,512,old,1.7217653157305506,tanh,,COMPLETE,
42,0.8803387641906738,2025-09-02 20:08:47.409908,2025-09-02 20:45:43.225933,0 days 00:36:55.816025,20,uniform,8,nz,3.18631627462941e-05,0.06010481546425326,8290,256,old,1.7447800225924563,tanh,0.00017893314361572266,COMPLETE,0.00017893314361572266
43,0.8984677791595459,2025-09-02 20:45:43.231280,2025-09-02 21:22:53.686368,0 days 00:37:10.455088,20,normal,8,nz,3.5769084190768393e-05,0.2112965267044973,5844,656,Glorot,,tanh,0.002483630180358887,COMPLETE,0.002483630180358887
44,0.8261290788650513,2025-09-02 21:22:53.686824,2025-09-02 22:00:03.735361,0 days 00:37:10.048537,20,normal,7,nz,1.1637936911006851e-05,0.046854134000389284,2361,656,Glorot,,tanh,0.004462695121765137,COMPLETE,0.004462695121765137
45,0.8074516296386719,2025-09-02 22:00:03.735810,2025-09-02 22:37:08.424363,0 days 00:37:04.688553,20,normal,8,nz,1.6958139173481265e-05,0.013247492554967205,6639,496,Glorot,,tanh,0.00449831485748291,COMPLETE,0.00449831485748291
46,0.8242903709411621,2025-09-02 22:37:08.424800,2025-09-02 22:44:29.283843,0 days 00:07:20.859043,100,uniform,8,nz,1.4124334533849216e-05,0.005294308908841388,8417,608,old,1.942140536905498,logistic,0.008537387847900391,COMPLETE,0.008537387847900391
47,0.8958387494087219,2025-09-02 22:44:29.284292,2025-09-02 23:21:34.311284,0 days 00:37:05.026992,20,uniform,6,nz,1.6318756491590208e-05,0.15263669744435335,6696,608,old,1.9875107654271928,logistic,0.00030858516693115233,COMPLETE,0.00030858516693115233
48,0.8704516291618347,2025-09-02 23:21:34.311749,2025-09-02 23:58:38.741838,0 days 00:37:04.430089,20,uniform,6,nz,0.0001957196261456884,0.6128058317671509,4873,720,old,1.9974378110691586,logistic,0.016593503952026366,COMPLETE,0.016593503952026366
49,0.8834194064140319,2025-09-02 23:58:38.743121,2025-09-03 00:35:40.983804,0 days 00:37:02.240683,20,normal,8,nz,1.3344486843060092e-05,0.10093947671858446,3869,944,Glorot,,tanh,0.0018965482711791992,COMPLETE,0.0018965482711791992
50,0.846274220943451,2025-09-03 00:35:40.984258,2025-09-03 01:12:40.771756,0 days 00:36:59.787498,20,normal,6,nz,5.624714306743781e-05,0.060439249719350704,8979,576,old,1.5972446505563163,logistic,0.00012726783752441405,COMPLETE,0.00012726783752441405
51,0.8142581224441529,2025-09-03 01:12:40.772213,2025-09-03 01:47:34.511523,0 days 00:34:53.739310,20,uniform,8,zero,,0.008219566868196911,2882,736,old,1.988580160189134,tanh,0.010879254341125489,COMPLETE,0.010879254341125489
52,0.0978064551949501,2025-09-03 01:47:34.511995,2025-09-03 02:24:25.580899,0 days 00:36:51.068904,20,normal,8,nz,7.94232052483622e-06,0.7192670586056142,1916,688,old,1.9912165584741268,tanh,,COMPLETE,
53,0.8912097215652466,2025-09-03 02:24:25.581353,2025-09-03 03:01:38.189037,0 days 00:37:12.607684,20,uniform,5,nz,7.225750266091523e-06,0.13659492639407056,4937,704,old,1.9957392814833999,tanh,0.00020248889923095702,COMPLETE,0.00020248889923095702
54,0.8670967936515808,2025-09-03 03:01:38.189465,2025-09-03 03:38:38.297765,0 days 00:37:00.108300,20,uniform,6,nz,2.9252068965697828e-05,0.3058704649190149,3007,672,old,1.9931055948070024,tanh,0.0008525848388671875,COMPLETE,0.0008525848388671875
55,0.0978064551949501,2025-09-03 03:38:38.299065,2025-09-03 04:15:27.087388,0 days 00:36:48.788323,20,normal,8,nz,5.044674873702887e-06,0.8170479222947427,3293,608,Glorot,,tanh,,COMPLETE,
56,0.5707258343696594,2025-09-03 04:15:27.087831,2025-09-03 04:52:29.452641,0 days 00:37:02.364810,20,uniform,8,nz,7.416567771093584e-05,5.1795293846561654e-05,4022,496,old,1.6939287340603593,tanh,0.01314542293548584,COMPLETE,0.01314542293548584
57,0.8256129503250123,2025-09-03 04:52:29.453095,2025-09-03 04:59:28.527324,0 days 00:06:59.074229,100,uniform,8,zero,,0.09246046492327983,9031,528,old,1.9932970391383087,tanh,0.0028434514999389647,COMPLETE,0.0028434514999389647
58,0.8177742481231689,2025-09-03 04:59:28.527758,2025-09-03 05:06:56.041110,0 days 00:07:27.513352,100,uniform,7,nz,4.9609670383223135e-06,0.00693759131101811,2675,640,Glorot,,tanh,0.011186599731445312,COMPLETE,0.011186599731445312
59,0.7846129417419434,2025-09-03 05:06:56.041845,2025-09-03 05:43:54.516475,0 days 00:36:58.474630,20,uniform,5,nz,3.6409901031674175e-05,0.34218200239870455,3091,464,old,1.6862649013008078,logistic,0.00118408203125,COMPLETE,0.00118408203125
60,0.865790331363678,2025-09-03 05:43:54.516942,2025-09-03 06:18:42.300033,0 days 00:34:47.783091,20,uniform,6,zero,,0.04985198702142427,9191,640,old,1.7704089817976298,tanh,0.002251553535461426,COMPLETE,0.002251553535461426
61,0.8090484142303467,2025-09-03 06:18:42.300881,2025-09-03 06:55:46.867526,0 days 00:37:04.566645,20,uniform,5,nz,5.744842665713052e-06,0.005488437669567889,7706,864,old,1.9533478269611735,tanh,0.00998384952545166,COMPLETE,0.00998384952545166
62,0.0978064551949501,2025-09-03 06:55:46.867965,2025-09-03 07:32:51.003383,0 days 00:37:04.135418,20,uniform,5,nz,6.064208742715132e-06,0.6902459149071866,1929,832,old,1.9969652707510053,tanh,,COMPLETE,
63,0.8460806727409362,2025-09-03 07:32:51.004305,2025-09-03 07:40:13.320240,0 days 00:07:22.315935,100,normal,8,nz,4.202089711387344e-06,0.1579623314322276,4884,608,Glorot,,logistic,0.00044200420379638674,COMPLETE,0.00044200420379638674
64,0.8522419571876526,2025-09-03 07:40:13.321169,2025-09-03 07:47:36.113141,0 days 00:07:22.791972,100,uniform,8,nz,2.176165220708391e-05,0.14670204844277493,8994,480,Glorot,,tanh,0.0016231060028076172,COMPLETE,0.0016231060028076172
65,0.8942903637886047,2025-09-03 07:47:36.113568,2025-09-03 08:22:25.146687,0 days 00:34:49.033119,20,uniform,7,zero,,0.1739684268238513,4951,416,old,1.9985722765949823,logistic,0.00034444332122802735,COMPLETE,0.00034444332122802735
66,0.8470484137535095,2025-09-03 08:22:25.147613,2025-09-03 08:57:09.696163,0 days 00:34:44.548550,20,uniform,7,zero,,0.24477994748815923,923,416,old,1.9986690792453243,logistic,0.0010200738906860352,COMPLETE,0.0010200738906860352
67,0.880129086971283,2025-09-03 08:57:09.696938,2025-09-03 09:32:05.516629,0 days 00:34:55.819691,20,uniform,7,zero,,0.10537654999167205,5836,544,old,1.7440612462097242,logistic,0.00029659271240234375,COMPLETE,0.00029659271240234375
68,0.8684516310691833,2025-09-03 09:32:05.517068,2025-09-03 10:06:52.341469,0 days 00:34:46.824401,20,uniform,7,zero,,0.08173432455962219,6320,432,Glorot,,logistic,0.00016450881958007812,COMPLETE,0.00016450881958007812
69,0.8710000395774842,2025-09-03 10:06:52.341903,2025-09-03 10:43:42.882861,0 days 00:36:50.540958,20,normal,7,nz,0.00029606177170405604,0.5019408091413899,2390,208,old,1.9955472959122642,logistic,0.13219258785247803,COMPLETE,0.13219258785247803
70,0.8249677896499634,2025-09-03 10:43:42.883313,2025-09-03 11:20:38.672077,0 days 00:36:55.788764,20,uniform,6,nz,0.0008338640308961353,0.0038547567378798184,6944,464,old,1.7343496622128705,logistic,0.0071593523025512695,COMPLETE,0.0071593523025512695
71,0.8016451716423034,2025-09-03 11:20:38.673074,2025-09-03 11:57:30.575107,0 days 00:36:51.902033,20,normal,5,nz,2.3810394583349583e-06,0.019237598267443423,4169,576,old,1.9829826824441399,tanh,0.00639495849609375,COMPLETE,0.00639495849609375
72,0.8332419753074646,2025-09-03 11:57:30.576029,2025-09-03 12:04:55.536845,0 days 00:07:24.960816,100,uniform,7,nz,3.0106950330868784e-06,0.0565776933799573,8521,160,old,1.993564524855386,logistic,1.6355514526367186e-05,COMPLETE,1.6355514526367186e-05
73,0.8679032444953918,2025-09-03 12:04:55.537270,2025-09-03 12:41:53.959555,0 days 00:36:58.422285,20,normal,6,nz,3.295550017445529e-05,0.04715913489991032,9860,752,Glorot,,tanh,0.0024113893508911134,COMPLETE,0.0024113893508911134
74,0.8580000162124634,2025-09-03 12:41:53.960002,2025-09-03 12:49:26.092941,0 days 00:07:32.132939,100,uniform,8,nz,2.313342024628157e-05,0.2564292983057718,2532,416,old,1.9739490523511065,tanh,0.001314997673034668,COMPLETE,0.001314997673034668
75,0.0978064551949501,2025-09-03 12:49:26.093390,2025-09-03 13:24:03.074262,0 days 00:34:36.980872,20,uniform,5,zero,,0.7288040856094814,2120,736,old,0.7087592144663892,tanh,,COMPLETE,
76,0.8183226346969604,2025-09-03 13:24:03.075173,2025-09-03 13:58:49.852384,0 days 00:34:46.777211,20,uniform,8,zero,,0.01474122290524585,5191,352,old,1.9992690333613978,logistic,0.005302715301513672,COMPLETE,0.005302715301513672
77,0.7113548755645752,2025-09-03 13:58:49.852828,2025-09-03 14:35:54.255308,0 days 00:37:04.402480,20,uniform,8,nz,1.6191891339683268e-06,0.39743254815622214,9805,656,old,1.6865601755226296,logistic,0.0017771244049072266,COMPLETE,0.0017771244049072266
78,0.740790331363678,2025-09-03 14:35:54.255752,2025-09-03 15:10:29.935122,0 days 00:34:35.679370,20,uniform,7,zero,,0.0015080724192630306,3886,144,old,1.736060531628265,logistic,0.006902718544006347,COMPLETE,0.006902718544006347
79,0.9020968079566956,2025-09-03 15:10:29.935890,2025-09-03 15:47:22.828611,0 days 00:36:52.892721,20,uniform,8,nz,4.078248581952483e-05,0.1878162843505446,9838,640,Glorot,,tanh,0.004753828048706055,COMPLETE,0.004753828048706055
80,0.893725848197937,2025-09-03 15:47:22.829071,2025-09-03 16:24:23.130277,0 days 00:37:00.301206,20,uniform,8,nz,0.00014738271267103394,0.19712396304675295,2040,672,Glorot,,tanh,0.00018608570098876953,COMPLETE,0.00018608570098876953
81,0.8653064608573914,2025-09-03 16:24:23.130724,2025-09-03 17:01:26.440416,0 days 00:37:03.309692,20,uniform,8,nz,0.00018101624437118075,0.04100123735592047,9116,896,Glorot,,tanh,0.002011227607727051,COMPLETE,0.002011227607727051
82,0.8427419662475586,2025-09-03 17:01:26.440885,2025-09-03 17:38:27.262950,0 days 00:37:00.822065,20,uniform,8,nz,0.008463568353554312,0.38721074009173917,7624,592,Glorot,,tanh,0.005232596397399902,COMPLETE,0.005232596397399902
83,0.6471129357814789,2025-09-03 17:38:27.263651,2025-09-03 18:15:19.022054,0 days 00:36:51.758403,20,uniform,6,nz,0.00012378405943944682,0.35123887031886325,1121,544,Glorot,,logistic,0.001265573501586914,COMPLETE,0.001265573501586914
84,0.8664193749427795,2025-09-03 18:15:19.022489,2025-09-03 18:52:18.068151,0 days 00:36:59.045662,20,uniform,8,nz,0.0001134096277153852,0.14222291257514136,1252,576,Glorot,,tanh,0.001226520538330078,COMPLETE,0.001226520538330078
85,0.8411129355430603,2025-09-03 18:52:18.068576,2025-09-03 19:27:04.707173,0 days 00:34:46.638597,20,normal,8,zero,,0.03321687988991565,8771,704,Glorot,,tanh,0.003517341613769531,COMPLETE,0.003517341613769531
86,0.8687258124351501,2025-09-03 19:27:04.707897,2025-09-03 19:34:02.535975,0 days 00:06:57.828078,100,uniform,7,zero,,0.22249615329581965,4005,304,old,1.4479302401785028,logistic,0.0001178741455078125,COMPLETE,0.0001178741455078125
87,0.8172097325325012,2025-09-03 19:34:02.536792,2025-09-03 20:11:03.986296,0 days 00:37:01.449504,20,uniform,5,nz,7.834470322377398e-05,0.000931322797099139,9397,560,Glorot,,tanh,0.011566543579101562,COMPLETE,0.011566543579101562
88,0.5944193705916405,2025-09-03 20:11:03.986740,2025-09-03 20:45:50.891154,0 days 00:34:46.904414,20,uniform,6,zero,,0.8579651745205013,3819,384,old,1.6608536549380497,logistic,0.002650880813598633,COMPLETE,0.002650880813598633
89,0.0978064551949501,2025-09-03 20:45:50.891590,2025-09-03 21:22:48.529327,0 days 00:36:57.637737,20,uniform,8,nz,5.734682409768582e-05,0.6496348049726113,3401,640,old,1.7152913108806613,tanh,,COMPLETE,
90,0.8134677886962891,2025-09-03 21:22:48.530258,2025-09-03 21:59:51.959135,0 days 00:37:03.428877,20,uniform,6,nz,5.409662085312455e-05,0.01636594682353371,1234,944,Glorot,,tanh,0.01139373779296875,COMPLETE,0.01139373779296875
91,0.0978064551949501,2025-09-03 21:59:51.960061,2025-09-03 22:36:50.517428,0 days 00:36:58.557367,20,uniform,7,nz,1.0275317118560351e-05,0.7388948901461254,1466,928,Glorot,,tanh,,COMPLETE,
