number,value,datetime_start,datetime_complete,duration,params_batch_size,params_colnorm_thresh,params_dist1,params_iseed,params_l2_penalty_choice,params_l2_penalty_nz,params_lr,params_lr_anneal_start,params_nhid1,params_nhid2,params_nhid3,params_pca_energy,params_preproc,params_scale_heur1,params_scale_mult1,params_squash,user_attrs_avg_fit_criteria,user_attrs_ed_cl1_mean,user_attrs_ed_cl2_mean,user_attrs_ed_cl3_mean,state,avg_fit_criteria,ed_cl1_mean,ed_cl2_mean,ed_cl3_mean
112,0.5024857103824616,2025-08-25 20:46:11.555160,2025-08-25 20:52:15.411421,0 days 00:06:03.856261,100,1.7441656182229607e-05,normal,5,zero,,0.0006707518306306594,499,624,576,192,,colnorm,Glorot,,tanh,0.013142522176106772,0.01308286190032959,0.0131483793258667,0.013196325302124024,COMPLETE,0.013142522176106772,0.01308286190032959,0.0131483793258667,0.013196325302124024
113,0.10000000149011612,2025-08-25 20:52:15.411689,2025-08-25 21:24:02.727599,0 days 00:31:47.315910,20,,uniform,5,zero,,0.28515435148771523,2149,720,304,1008,0.7902953685970416,pca,old,1.9391985264658271,tanh,,,,,COMPLETE,,,,
114,0.4709999978542328,2025-08-25 21:24:02.729794,2025-08-25 21:31:18.001023,0 days 00:07:15.271229,100,,normal,5,zero,,0.001234042288951053,5868,112,48,384,0.7471181705245546,pca,old,1.4661189703538995,logistic,0.013109962145487467,0.013140153884887696,0.013103270530700683,0.013086462020874023,COMPLETE,0.013109962145487467,0.013140153884887696,0.013103270530700683,0.013086462020874023
115,0.5665428519248963,2025-08-25 21:31:18.001280,2025-08-25 21:38:27.234005,0 days 00:07:09.232725,100,0.00021678771507405815,uniform,5,zero,,0.011841837603657143,3072,160,848,560,,colnorm,old,1.2288533631939245,logistic,0.01131885051727295,0.010488653182983398,0.012217020988464356,0.011250877380371093,COMPLETE,0.01131885051727295,0.010488653182983398,0.012217020988464356,0.011250877380371093
116,0.34727142453193666,2025-08-25 21:38:27.234316,2025-08-25 21:46:05.127850,0 days 00:07:37.893534,100,,normal,5,nz,2.122958772556124e-05,0.00011245497648023927,4640,496,592,784,,raw,Glorot,,tanh,0.013081359863281251,0.012888121604919433,0.013164043426513672,0.013191914558410645,COMPLETE,0.013081359863281251,0.012888121604919433,0.013164043426513672,0.013191914558410645
117,0.4784857153892517,2025-08-25 21:46:05.128148,2025-08-25 22:20:50.331933,0 days 00:34:45.203785,20,,normal,6,zero,,1.3212306887204596e-05,291,928,320,96,,raw,Glorot,,tanh,0.012756808598836262,0.013002467155456544,0.013003897666931153,0.012264060974121093,COMPLETE,0.012756808598836262,0.013002467155456544,0.013003897666931153,0.012264060974121093
118,0.10000000149011612,2025-08-25 22:20:50.332765,2025-08-25 22:56:43.072497,0 days 00:35:52.739732,20,,normal,6,zero,,0.6676236259928471,4506,304,192,560,,raw,old,1.072007186941979,tanh,,,,,COMPLETE,,,,
119,0.8683857083320617,2025-08-25 22:56:43.072859,2025-08-25 23:32:20.072894,0 days 00:35:37.000035,20,,normal,7,zero,,0.003597926709130101,2116,992,512,880,0.9606516766746219,pca,old,1.0710534244543415,tanh,0.012338519096374512,0.012530326843261719,0.012212181091308593,0.012273049354553223,COMPLETE,0.012338519096374512,0.012530326843261719,0.012212181091308593,0.012273049354553223
120,0.8610428452491761,2025-08-25 23:32:20.073876,2025-08-25 23:38:20.398542,0 days 00:06:00.324666,100,3.788581142616804e-09,uniform,8,zero,,0.006463893771225853,1594,144,896,528,,colnorm,old,1.9268954932258746,tanh,0.012036689122517902,0.011391305923461914,0.012621212005615234,0.012097549438476563,COMPLETE,0.012036689122517902,0.011391305923461914,0.012621212005615234,0.012097549438476563
121,0.8789714097976684,2025-08-25 23:38:20.398827,2025-08-26 00:09:32.982415,0 days 00:31:12.583588,20,,normal,6,nz,1.0680722288043689e-08,0.12364702955414512,195,752,112,272,0.9140263804633988,pca,old,1.4949664316646865,tanh,0.009784412384033204,0.010429835319519043,0.008914899826049805,0.010008502006530761,COMPLETE,0.009784412384033204,0.010429835319519043,0.008914899826049805,0.010008502006530761
122,0.5975142836570739,2025-08-26 00:09:32.984062,2025-08-26 00:40:40.224850,0 days 00:31:07.240788,20,3.182651168708131e-08,uniform,7,nz,0.0009172583772937015,8.532298090996893e-05,374,592,688,256,,colnorm,Glorot,,tanh,0.013069605827331543,0.01328883171081543,0.013162350654602051,0.012757635116577149,COMPLETE,0.013069605827331543,0.01328883171081543,0.013162350654602051,0.012757635116577149
123,0.5192714214324952,2025-08-26 00:40:40.227194,2025-08-26 00:46:41.927814,0 days 00:06:01.700620,100,9.551899663881542e-06,normal,8,zero,,0.0020179188305637146,491,144,240,368,,colnorm,Glorot,,tanh,0.012813631693522134,0.012564325332641601,0.012856245040893555,0.01302032470703125,COMPLETE,0.012813631693522134,0.012564325332641601,0.012856245040893555,0.01302032470703125
124,0.7729714155197144,2025-08-26 00:46:41.929225,2025-08-26 01:16:22.487935,0 days 00:29:40.558710,20,0.0009335783146413682,normal,5,zero,,0.0002524963632971082,9970,32,608,720,,colnorm,old,0.8206984998141482,tanh,0.012047910690307617,0.010826826095581055,0.012537050247192382,0.012779855728149414,COMPLETE,0.012047910690307617,0.010826826095581055,0.012537050247192382,0.012779855728149414
125,0.8519000053405762,2025-08-26 01:16:22.489916,2025-08-26 01:22:17.429918,0 days 00:05:54.940002,100,,normal,7,zero,,0.05966882465794208,130,336,480,832,,raw,old,0.9057823807953762,tanh,0.012100044886271158,0.011282753944396973,0.012196016311645509,0.012821364402770995,COMPLETE,0.012100044886271158,0.011282753944396973,0.012196016311645509,0.012821364402770995
126,0.7994428515434265,2025-08-26 01:22:17.430174,2025-08-26 01:28:21.307791,0 days 00:06:03.877617,100,5.388129518308598e-07,uniform,8,zero,,0.0007985675440229626,6175,784,320,928,,colnorm,old,0.5598299165511067,tanh,0.012736852963765463,0.01283435821533203,0.012601351737976075,0.012774848937988281,COMPLETE,0.012736852963765463,0.01283435821533203,0.012601351737976075,0.012774848937988281
127,0.6107999920845032,2025-08-26 01:28:21.308117,2025-08-26 01:34:40.470537,0 days 00:06:19.162420,100,1.9189470902339894e-06,uniform,6,nz,1.0848962800032886e-05,1.7275482847827764e-05,1004,224,352,848,,colnorm,old,0.8360967564015054,tanh,0.01281443436940511,0.012564301490783691,0.01303846836090088,0.012840533256530761,COMPLETE,0.01281443436940511,0.012564301490783691,0.01303846836090088,0.012840533256530761
