number,value,datetime_start,datetime_complete,duration,params_batch_size,params_colnorm_thresh,params_dist1,params_iseed,params_l2_penalty_choice,params_l2_penalty_nz,params_lr,params_lr_anneal_start,params_nhid1,params_nhid2,params_nhid3,params_pca_energy,params_preproc,params_scale_heur1,params_scale_mult1,params_squash,user_attrs_avg_fit_criteria,user_attrs_ed_cl1_mean,user_attrs_ed_cl2_mean,user_attrs_ed_cl3_mean,state,avg_fit_criteria,ed_cl1_mean,ed_cl2_mean,ed_cl3_mean
0,0.10000000149011612,2025-08-24 10:50:03.024381,2025-08-24 11:21:43.387799,0 days 00:31:40.363418,20,,uniform,6,nz,2.408891693835518e-07,1.9068306386240476e-05,800,80,288,512,,raw,Glorot,,logistic,0.01302327315012614,0.012913894653320313,0.013140177726745606,0.0130157470703125,COMPLETE,0.01302327315012614,0.012913894653320313,0.013140177726745606,0.0130157470703125
1,0.5641857147216797,2025-08-24 11:21:43.389573,2025-08-24 11:28:04.882094,0 days 00:06:21.492521,100,,uniform,6,nz,0.0002069877935427099,4.532045798669679e-05,803,224,512,384,,raw,Glorot,,tanh,0.012992183367411295,0.012985777854919434,0.01315927505493164,0.012831497192382812,COMPLETE,0.012992183367411295,0.012985777854919434,0.01315927505493164,0.012831497192382812
2,0.5647857069969178,2025-08-24 11:28:04.882433,2025-08-24 11:58:07.847161,0 days 00:30:02.964728,20,,normal,6,zero,,0.003593917669469153,294,432,16,96,0.7614531005141727,pca,old,0.755934832754835,tanh,0.009377582867940267,0.012708806991577148,0.004679298400878907,0.010744643211364747,COMPLETE,0.009377582867940267,0.012708806991577148,0.004679298400878907,0.010744643211364747
3,0.8307142734527588,2025-08-24 11:58:07.847545,2025-08-24 12:04:12.676906,0 days 00:06:04.829361,100,,normal,5,zero,,0.04669620740529656,5948,352,336,320,,raw,old,1.0291345330938984,logistic,0.005163399378458659,0.0021316051483154298,0.006203007698059082,0.007155585289001465,COMPLETE,0.005163399378458659,0.0021316051483154298,0.006203007698059082,0.007155585289001465
4,0.15972856879234315,2025-08-24 12:04:12.677232,2025-08-24 12:10:37.297184,0 days 00:06:24.619952,100,,normal,5,nz,5.8733668003591766e-08,0.0006009208989093564,129,80,368,848,,raw,old,0.9564623006105633,logistic,0.013152575492858887,0.01296091079711914,0.013309192657470704,0.013187623023986817,COMPLETE,0.013152575492858887,0.01296091079711914,0.013309192657470704,0.013187623023986817
5,0.874657130241394,2025-08-24 12:10:37.297457,2025-08-24 12:16:48.025678,0 days 00:06:10.728221,100,,normal,6,zero,,0.020672492838662945,4902,48,560,832,0.92848781305588,pca,old,0.9947535368647515,tanh,0.009394152959187826,0.004845857620239258,0.011374545097351075,0.011962056159973145,COMPLETE,0.009394152959187826,0.004845857620239258,0.011374545097351075,0.011962056159973145
6,0.23774285912513732,2025-08-24 12:16:48.025937,2025-08-24 12:22:57.810106,0 days 00:06:09.784169,100,,normal,8,zero,,0.902290355038375,303,160,32,544,0.531811142849276,pca,Glorot,,tanh,,,,,COMPLETE,,,,
7,0.11578571647405625,2025-08-24 12:22:57.810401,2025-08-24 12:29:31.675983,0 days 00:06:33.865582,100,,uniform,8,nz,1.7286821158315726e-07,7.984786193040815e-05,2976,944,32,704,0.5603162141530791,pca,Glorot,,logistic,0.013071441650390625,0.013194751739501954,0.012936019897460937,0.013083553314208985,COMPLETE,0.013071441650390625,0.013194751739501954,0.012936019897460937,0.013083553314208985
8,0.6459857106208802,2025-08-24 12:29:31.677398,2025-08-24 12:59:46.371431,0 days 00:30:14.694033,20,1.0252773110077433e-06,normal,5,zero,,0.010819702277292158,2651,960,400,672,,colnorm,old,0.7176438958158204,logistic,0.01140735149383545,0.012183523178100586,0.010873103141784668,0.011165428161621093,COMPLETE,0.01140735149383545,0.012183523178100586,0.010873103141784668,0.011165428161621093
9,0.7900142788887023,2025-08-24 12:59:46.371812,2025-08-24 13:06:13.554401,0 days 00:06:27.182589,100,,uniform,8,nz,3.0495251798820325e-05,0.07968268616303291,1813,208,320,256,,raw,old,1.432827266708205,tanh,0.007046834627787272,0.0012024879455566407,0.009824299812316894,0.010113716125488281,COMPLETE,0.007046834627787272,0.0012024879455566407,0.009824299812316894,0.010113716125488281
10,0.5912857174873352,2025-08-24 13:06:13.554668,2025-08-24 13:36:36.440068,0 days 00:30:22.885400,20,,normal,7,zero,,9.278261226540327e-05,117,112,672,320,0.9177342805737674,pca,Glorot,,tanh,0.013029718399047853,0.012831664085388184,0.013156723976135255,0.013100767135620117,COMPLETE,0.013029718399047853,0.012831664085388184,0.013156723976135255,0.013100767135620117
11,0.33759999871253965,2025-08-24 13:36:36.442546,2025-08-24 13:42:55.557861,0 days 00:06:19.115315,100,,normal,6,nz,1.5178620982137476e-05,6.138743611911215e-05,6294,912,336,912,,raw,old,0.4880602306015901,tanh,0.013164893786112465,0.01301422119140625,0.0130967378616333,0.013383722305297852,COMPLETE,0.013164893786112465,0.01301422119140625,0.0130967378616333,0.013383722305297852
12,0.7339571237564086,2025-08-24 13:42:55.558180,2025-08-24 14:12:43.040828,0 days 00:29:47.482648,20,,normal,6,zero,,0.037881959609401966,7519,160,176,64,,raw,Glorot,,logistic,0.001181793212890625,0.0020930290222167967,0.0011899471282958984,0.00026240348815917967,COMPLETE,0.001181793212890625,0.0020930290222167967,0.0011899471282958984,0.00026240348815917967
13,0.10000000149011612,2025-08-24 14:12:43.041189,2025-08-24 14:19:05.851743,0 days 00:06:22.810554,100,,normal,7,nz,0.004083646289694694,0.00017587308626797383,3552,896,736,112,0.934529193152835,pca,Glorot,,logistic,0.012989997863769531,0.013082385063171387,0.012974429130554199,0.012913179397583009,COMPLETE,0.012989997863769531,0.013082385063171387,0.012974429130554199,0.012913179397583009
14,0.7684571385383606,2025-08-24 14:19:05.851993,2025-08-24 14:48:54.140172,0 days 00:29:48.288179,20,,normal,6,zero,,0.3044525615065604,204,704,176,352,0.5043995553501397,pca,Glorot,,tanh,0.009247183799743652,0.009951066970825196,0.007275509834289551,0.010514974594116211,COMPLETE,0.009247183799743652,0.009951066970825196,0.007275509834289551,0.010514974594116211
15,0.521014267206192,2025-08-24 14:48:54.140549,2025-08-24 15:20:09.366281,0 days 00:31:15.225732,20,,uniform,6,nz,4.5217557451024084e-07,0.00024928315599298995,515,512,176,752,,raw,old,1.1709311779111824,tanh,0.013173675537109375,0.013153886795043946,0.01321718692779541,0.01314995288848877,COMPLETE,0.013173675537109375,0.013153886795043946,0.01321718692779541,0.01314995288848877
16,0.6069714188575744,2025-08-24 15:20:09.367724,2025-08-24 15:26:05.756138,0 days 00:05:56.388414,100,,uniform,6,zero,,0.00034912391835984966,2655,1008,352,736,,raw,Glorot,,tanh,0.012956372896830241,0.01301429271697998,0.012884378433227539,0.012970447540283203,COMPLETE,0.012956372896830241,0.01301429271697998,0.012884378433227539,0.012970447540283203
17,0.21421428322792052,2025-08-24 15:26:05.756994,2025-08-24 15:57:16.035680,0 days 00:31:10.278686,20,,normal,6,nz,0.003098891758417325,0.0008440164593981861,1301,912,880,240,0.5561063925658498,pca,old,0.5462544338135313,logistic,0.013208611806233722,0.013292145729064942,0.01305091381072998,0.01328277587890625,COMPLETE,0.013208611806233722,0.013292145729064942,0.01305091381072998,0.01328277587890625
18,0.10000000149011612,2025-08-24 15:57:16.036054,2025-08-24 16:28:27.291394,0 days 00:31:11.255340,20,,uniform,7,nz,0.0012361063948476514,0.00017047912451343645,270,480,992,624,,raw,Glorot,,logistic,0.01316184997558594,0.013174653053283691,0.013205313682556152,0.01310558319091797,COMPLETE,0.01316184997558594,0.013174653053283691,0.013205313682556152,0.01310558319091797
19,0.10000000149011612,2025-08-24 16:28:27.293265,2025-08-24 16:57:58.549645,0 days 00:29:31.256380,20,,normal,8,zero,,0.8186484618563397,3702,224,896,720,,raw,Glorot,,logistic,0.004544401168823243,0.00753014087677002,0.0008645534515380859,0.0052385091781616214,COMPLETE,0.004544401168823243,0.00753014087677002,0.0008645534515380859,0.0052385091781616214
20,0.6215571403503418,2025-08-24 16:57:58.551166,2025-08-24 17:04:11.970016,0 days 00:06:13.418850,100,,uniform,6,nz,0.0002247144159652352,0.5824613263289332,1377,96,176,32,,raw,Glorot,,logistic,0.009666490554809571,0.01866590976715088,0.0001325845718383789,0.010200977325439453,COMPLETE,0.009666490554809571,0.01866590976715088,0.0001325845718383789,0.010200977325439453
21,0.6474142670631409,2025-08-24 17:04:11.970272,2025-08-24 17:10:28.305683,0 days 00:06:16.335411,100,,uniform,6,nz,0.0031762322412963125,0.0008525836944886396,895,656,352,992,,raw,old,0.8825031528075136,tanh,0.012999629974365235,0.012868118286132813,0.013101530075073243,0.013029241561889648,COMPLETE,0.012999629974365235,0.012868118286132813,0.013101530075073243,0.013029241561889648
22,0.15214285552501677,2025-08-24 17:10:28.306005,2025-08-24 17:16:31.697299,0 days 00:06:03.391294,100,1.1440763747069189e-09,uniform,6,zero,,0.0013572916218580562,286,1008,1008,560,,colnorm,old,0.6363168365090601,logistic,0.013091715176900227,0.013129520416259765,0.0130645751953125,0.013081049919128418,COMPLETE,0.013091715176900227,0.013129520416259765,0.0130645751953125,0.013081049919128418
23,0.38609999418258667,2025-08-24 17:16:31.697569,2025-08-24 17:22:30.955250,0 days 00:05:59.257681,100,,normal,8,zero,,4.3061830079117834e-05,102,96,800,16,0.9535186884098954,pca,old,0.4229283393084612,tanh,0.012292043368021649,0.012795400619506837,0.012988543510437012,0.011092185974121094,COMPLETE,0.012292043368021649,0.012795400619506837,0.012988543510437012,0.011092185974121094
24,0.5858999967575074,2025-08-24 17:22:30.955583,2025-08-24 17:53:49.782180,0 days 00:31:18.826597,20,5.659468770678343e-08,normal,7,nz,2.972205680742184e-07,6.15282914558757e-06,3796,128,800,288,,colnorm,Glorot,,tanh,0.013184873263041179,0.01292269229888916,0.013512682914733887,0.013119244575500488,COMPLETE,0.013184873263041179,0.01292269229888916,0.013512682914733887,0.013119244575500488
25,0.30239999294281006,2025-08-24 17:53:49.782544,2025-08-24 18:23:32.134253,0 days 00:29:42.351709,20,,normal,5,zero,,0.001237123628998651,4732,752,992,160,,raw,Glorot,,logistic,0.01311508814493815,0.013221979141235352,0.013164854049682618,0.012958431243896484,COMPLETE,0.01311508814493815,0.013221979141235352,0.013164854049682618,0.012958431243896484
26,0.10000000149011612,2025-08-24 18:23:32.135067,2025-08-24 18:54:45.523571,0 days 00:31:13.388504,20,,uniform,6,nz,0.00025273534942158024,1.5444453286934103e-06,443,832,48,704,0.5000924595149698,pca,old,1.6974991883625365,logistic,0.013330411911010741,0.013154315948486327,0.013686370849609376,0.013150548934936524,COMPLETE,0.013330411911010741,0.013154315948486327,0.013686370849609376,0.013150548934936524
27,0.6349714279174805,2025-08-24 18:54:45.524352,2025-08-24 19:25:55.912735,0 days 00:31:10.388383,20,,uniform,5,nz,2.8653067848446513e-08,0.13594321102820803,100,64,960,832,0.5315053238870611,pca,Glorot,,logistic,0.009538793563842773,0.005142092704772949,0.011911273002624512,0.01156301498413086,COMPLETE,0.009538793563842773,0.005142092704772949,0.011911273002624512,0.01156301498413086
28,0.10000000149011612,2025-08-24 19:25:55.914649,2025-08-24 19:32:12.235279,0 days 00:06:16.320630,100,,uniform,8,nz,2.195171270562009e-06,0.00019975831193664464,686,64,592,192,,raw,Glorot,,logistic,0.013001640637715658,0.012754178047180176,0.01313033103942871,0.013120412826538086,COMPLETE,0.013001640637715658,0.012754178047180176,0.01313033103942871,0.013120412826538086
29,0.25795714259147645,2025-08-24 19:32:12.235612,2025-08-24 19:38:29.285923,0 days 00:06:17.050311,100,,uniform,8,nz,1.1354612839945856e-05,5.104214441669944e-05,474,816,576,16,,raw,old,1.84336145631759,tanh,0.012582961718241373,0.012932205200195312,0.013145852088928222,0.011670827865600586,COMPLETE,0.012582961718241373,0.012932205200195312,0.013145852088928222,0.011670827865600586
30,0.5610857129096984,2025-08-24 19:38:29.286187,2025-08-24 20:09:42.904391,0 days 00:31:13.618204,20,,normal,5,nz,3.4666480400355086e-05,3.0590198493981793e-06,1159,1024,560,320,0.5285715720343376,pca,Glorot,,tanh,0.013122018178304037,0.01296985149383545,0.013238334655761718,0.013157868385314941,COMPLETE,0.013122018178304037,0.01296985149383545,0.013238334655761718,0.013157868385314941
31,0.4062142789363861,2025-08-24 20:09:42.906527,2025-08-24 20:15:42.177180,0 days 00:05:59.270653,100,,normal,7,zero,,0.0013178595061205047,329,544,624,736,,raw,Glorot,,tanh,0.013084006309509276,0.013013052940368652,0.013115882873535156,0.013123083114624023,COMPLETE,0.013084006309509276,0.013013052940368652,0.013115882873535156,0.013123083114624023
32,0.13270000070333482,2025-08-24 20:15:42.177433,2025-08-24 20:21:38.679095,0 days 00:05:56.501662,100,,normal,5,zero,,8.060709675998e-05,273,592,848,816,,raw,Glorot,,logistic,0.013014435768127441,0.012946438789367676,0.013173246383666992,0.012923622131347656,COMPLETE,0.013014435768127441,0.012946438789367676,0.013173246383666992,0.012923622131347656
33,0.25652857422828673,2025-08-24 20:21:38.679422,2025-08-24 20:27:41.169485,0 days 00:06:02.490063,100,,uniform,5,zero,,0.3881631908547999,550,656,768,480,0.8360361547567354,pca,old,0.34952059690438664,tanh,,,,,COMPLETE,,,,
34,0.4337999939918518,2025-08-24 20:27:41.169750,2025-08-24 20:33:38.897587,0 days 00:05:57.727837,100,,normal,5,zero,,1.5698573371230564e-06,9702,16,848,784,0.9554456629821021,pca,old,0.8219145201736515,tanh,0.012125293413798014,0.010220503807067871,0.013123035430908203,0.013032341003417968,COMPLETE,0.012125293413798014,0.010220503807067871,0.013123035430908203,0.013032341003417968
35,0.21608571261167525,2025-08-24 20:33:38.897851,2025-08-24 21:03:30.608417,0 days 00:29:51.710566,20,0.00023030123347169337,uniform,5,zero,,0.00022925779841068158,7530,624,304,272,,colnorm,Glorot,,logistic,0.013028415044148763,0.013199710845947265,0.012830328941345216,0.013055205345153809,COMPLETE,0.013028415044148763,0.013199710845947265,0.012830328941345216,0.013055205345153809
36,0.10000000149011612,2025-08-24 21:03:30.609273,2025-08-24 21:09:45.881098,0 days 00:06:15.271825,100,,uniform,6,nz,0.007026571679037962,0.5761867715961069,345,480,560,336,0.9027008437002731,pca,Glorot,,logistic,0.012995290756225584,0.012926983833312988,0.01321272850036621,0.012846159934997558,COMPLETE,0.012995290756225584,0.012926983833312988,0.01321272850036621,0.012846159934997558
37,0.789042866230011,2025-08-24 21:09:45.881400,2025-08-24 21:15:46.164405,0 days 00:06:00.283005,100,,uniform,8,zero,,0.04691042508931178,325,320,656,880,,raw,old,0.7969697448675397,logistic,0.011058330535888672,0.010861063003540039,0.011550521850585938,0.010763406753540039,COMPLETE,0.011058330535888672,0.010861063003540039,0.011550521850585938,0.010763406753540039
38,0.10000000149011612,2025-08-24 21:15:46.164706,2025-08-24 21:21:45.660063,0 days 00:05:59.495357,100,1.3392800430171726e-07,uniform,7,zero,,5.181088778462791e-05,1530,624,768,64,,colnorm,old,0.5361051597480313,logistic,0.01298228104909261,0.013241910934448242,0.012793326377868652,0.012911605834960937,COMPLETE,0.01298228104909261,0.013241910934448242,0.012793326377868652,0.012911605834960937
39,0.13275714367628097,2025-08-24 21:21:45.660327,2025-08-24 21:53:01.001484,0 days 00:31:15.341157,20,,uniform,6,nz,2.7074231357934203e-07,2.7495142582401574e-05,3457,528,320,288,,raw,old,0.9842803384827483,logistic,0.013101728757222493,0.01322016716003418,0.013056421279907226,0.013028597831726075,COMPLETE,0.013101728757222493,0.01322016716003418,0.013056421279907226,0.013028597831726075
40,0.10000000149011612,2025-08-24 21:53:01.001862,2025-08-24 22:22:47.368013,0 days 00:29:46.366151,20,,uniform,7,zero,,7.1487242727983216e-06,669,400,672,560,0.733548195301683,pca,Glorot,,logistic,0.013165680567423503,0.013065409660339356,0.013190007209777832,0.01324162483215332,COMPLETE,0.013165680567423503,0.013065409660339356,0.013190007209777832,0.01324162483215332
41,0.10000000149011612,2025-08-24 22:22:47.368387,2025-08-24 22:29:03.205293,0 days 00:06:15.836906,100,,uniform,5,nz,2.172158274853957e-05,4.971380801717752e-05,489,848,896,752,0.6078982381999125,pca,old,1.570720193391757,logistic,0.013149531682332356,0.01308753490447998,0.013165450096130371,0.013195610046386719,COMPLETE,0.013149531682332356,0.01308753490447998,0.013165450096130371,0.013195610046386719
42,0.10004285871982574,2025-08-24 22:29:03.205561,2025-08-24 22:35:04.298712,0 days 00:06:01.093151,100,,normal,6,zero,,5.05629522128911e-05,628,704,16,912,,raw,old,1.6729318569045701,logistic,0.013407206535339356,0.013390517234802246,0.013930892944335938,0.012900209426879883,COMPLETE,0.013407206535339356,0.013390517234802246,0.013930892944335938,0.012900209426879883
43,0.8018571257591247,2025-08-24 22:35:04.298998,2025-08-24 22:41:05.141349,0 days 00:06:00.842351,100,,uniform,7,zero,,0.004181806786036181,9187,128,272,528,0.5725305842963468,pca,old,0.6347679358457043,tanh,0.010556300481160482,0.008409810066223145,0.011311817169189452,0.011947274208068848,COMPLETE,0.010556300481160482,0.008409810066223145,0.011311817169189452,0.011947274208068848
44,0.5847857117652893,2025-08-24 22:41:05.141663,2025-08-24 23:12:36.260425,0 days 00:31:31.118762,20,,uniform,7,nz,2.560791683250174e-08,6.497661227159869e-05,996,448,944,160,0.878173217327606,pca,Glorot,,tanh,0.01304780642191569,0.013096094131469727,0.013091540336608887,0.012955784797668457,COMPLETE,0.01304780642191569,0.013096094131469727,0.013091540336608887,0.012955784797668457
45,0.8566999912261963,2025-08-24 23:12:36.260808,2025-08-24 23:43:52.820249,0 days 00:31:16.559441,20,,uniform,6,nz,4.2668947270063475e-06,0.009261598751419355,1303,240,864,224,0.7526980705455009,pca,old,1.2313563468120658,tanh,0.01148533821105957,0.01070401668548584,0.012398958206176758,0.011353039741516113,COMPLETE,0.01148533821105957,0.01070401668548584,0.012398958206176758,0.011353039741516113
46,0.5992714285850524,2025-08-24 23:43:52.821458,2025-08-24 23:50:12.848192,0 days 00:06:20.026734,100,,uniform,5,nz,3.29024119804691e-08,1.2532733251536745e-06,125,224,896,592,0.9280040816529784,pca,old,1.95298129373683,tanh,0.01313188870747884,0.013355183601379394,0.012927532196044922,0.013112950325012206,COMPLETE,0.01313188870747884,0.013355183601379394,0.012927532196044922,0.013112950325012206
47,0.6167285680770874,2025-08-24 23:50:12.848520,2025-08-24 23:56:15.471933,0 days 00:06:02.623413,100,,normal,5,zero,,0.00011442100841843391,306,128,672,816,0.7013913968225263,pca,old,1.2743207063277995,tanh,0.01290123462677002,0.012388944625854492,0.013229894638061523,0.013084864616394043,COMPLETE,0.01290123462677002,0.012388944625854492,0.013229894638061523,0.013084864616394043
48,0.8793285608291626,2025-08-24 23:56:15.472671,2025-08-25 00:27:25.537832,0 days 00:31:10.065161,20,1.5213799637263695e-05,normal,7,nz,0.00010849668078145311,0.04064835377827358,383,576,496,1008,,colnorm,Glorot,,tanh,0.012128957112630208,0.011715173721313477,0.012070107460021972,0.012601590156555176,COMPLETE,0.012128957112630208,0.011715173721313477,0.012070107460021972,0.012601590156555176
49,0.10000000149011612,2025-08-25 00:27:25.538689,2025-08-25 00:58:46.825428,0 days 00:31:21.286739,20,,uniform,6,nz,0.0007388299612462084,2.6838463465390414e-05,258,192,128,848,,raw,Glorot,,logistic,0.0129591703414917,0.012823724746704101,0.012879228591918946,0.01317455768585205,COMPLETE,0.0129591703414917,0.012823724746704101,0.012879228591918946,0.01317455768585205
50,0.7959142804145813,2025-08-25 00:58:46.825823,2025-08-25 01:30:00.193154,0 days 00:31:13.367331,20,,uniform,8,nz,1.908237513615749e-06,0.009531024033067244,2537,288,272,80,,raw,old,0.27563829445908666,tanh,0.008922203381856283,0.007932043075561524,0.011132407188415527,0.007702159881591797,COMPLETE,0.008922203381856283,0.007932043075561524,0.011132407188415527,0.007702159881591797
51,0.8643857121467591,2025-08-25 01:30:00.193516,2025-08-25 01:36:23.081981,0 days 00:06:22.888465,100,,normal,8,nz,0.0005657840674477493,0.034360924836067806,2216,336,48,592,0.899069644786243,pca,Glorot,,logistic,0.0040583054224650065,0.006245636940002441,-0.0001263856887817383,0.006055665016174316,COMPLETE,0.0040583054224650065,0.006245636940002441,-0.0001263856887817383,0.006055665016174316
52,0.7119571328163147,2025-08-25 01:36:23.082281,2025-08-25 02:07:35.107374,0 days 00:31:12.025093,20,,normal,8,nz,1.4738360525117118e-05,0.01606188977318872,768,832,896,544,,raw,Glorot,,logistic,0.011818782488505047,0.0122955322265625,0.012404680252075195,0.010756134986877441,COMPLETE,0.011818782488505047,0.0122955322265625,0.012404680252075195,0.010756134986877441
53,0.10000000149011612,2025-08-25 02:07:35.109044,2025-08-25 02:14:00.723254,0 days 00:06:25.614210,100,6.415696825107625e-08,uniform,6,nz,1.463798032767135e-05,1.8880093046200602e-05,4520,656,624,544,,colnorm,old,0.33226944075447534,logistic,0.013137984275817869,0.013067173957824706,0.013088750839233398,0.013258028030395507,COMPLETE,0.013137984275817869,0.013067173957824706,0.013088750839233398,0.013258028030395507
54,0.487928581237793,2025-08-25 02:14:00.723527,2025-08-25 02:20:00.408059,0 days 00:05:59.684532,100,1.751843747942396e-08,normal,5,zero,,0.00039626846541448643,137,272,768,32,,colnorm,Glorot,,tanh,0.012857898076375324,0.012778306007385254,0.013188672065734864,0.01260671615600586,COMPLETE,0.012857898076375324,0.012778306007385254,0.013188672065734864,0.01260671615600586
