number,value,datetime_start,datetime_complete,duration,params_batch_size,params_dist1,params_iseed,params_l2_penalty_choice,params_l2_penalty_nz,params_lr,params_lr_anneal_start,params_nhid1,params_scale_heur1,params_scale_mult1,params_squash,user_attrs_avg_fit_criteria,state,avg_fit_criteria
93,0.7034839153289795,2025-09-03 11:45:44.520356,2025-09-03 11:52:39.798396,0 days 00:06:55.278040,100,uniform,6,zero,,3.8119316753755817e-06,1910,672,old,0.23483470721403713,tanh,0.013042974472045898,COMPLETE,0.013042974472045898
94,0.947967791557312,2025-09-03 11:52:39.798870,2025-09-03 12:29:17.427882,0 days 00:36:37.629012,20,uniform,7,nz,4.816686828617448e-07,0.03330887626095184,895,384,Glorot,,tanh,0.008582544326782227,COMPLETE,0.008582544326782227
95,0.8306613326072693,2025-09-03 12:29:17.428346,2025-09-03 12:36:10.074351,0 days 00:06:52.646005,100,normal,8,zero,,0.0002997657084618961,1223,816,old,0.6444303612007551,tanh,0.013068175315856934,COMPLETE,0.013068175315856934
96,0.7218871235847473,2025-09-03 12:36:10.075115,2025-09-03 12:42:58.735407,0 days 00:06:48.660292,100,normal,8,zero,,0.00011333293684010681,2494,480,old,1.4060152735110083,tanh,0.013100051879882812,COMPLETE,0.013100051879882812
97,0.28666130304336546,2025-09-03 12:42:58.736143,2025-09-03 12:49:51.687032,0 days 00:06:52.950889,100,normal,6,zero,,0.0004082968492166491,243,640,old,0.7659148680723962,logistic,0.013097810745239257,COMPLETE,0.013097810745239257
98,0.7083871364593506,2025-09-03 12:49:51.687764,2025-09-03 13:26:38.113968,0 days 00:36:46.426204,20,uniform,7,nz,3.179195841092528e-07,1.1493145431478937e-06,582,928,old,1.418800479316152,tanh,0.013102984428405762,COMPLETE,0.013102984428405762
99,0.4018548548221588,2025-09-03 13:26:38.114725,2025-09-03 13:33:25.897667,0 days 00:06:47.782942,100,uniform,6,zero,,5.420115942374636e-05,3098,736,old,1.2675963941982775,logistic,0.013040494918823243,COMPLETE,0.013040494918823243
100,0.7179355144500732,2025-09-03 13:33:25.898688,2025-09-03 14:08:08.705944,0 days 00:34:42.807256,20,normal,8,zero,,0.00013698275185491097,447,768,Glorot,,tanh,0.01311190128326416,COMPLETE,0.01311190128326416
101,0.9525645613670349,2025-09-03 14:08:08.706398,2025-09-03 14:44:19.042789,0 days 00:36:10.336391,20,uniform,7,nz,0.0013339363451747054,0.232732958898802,5221,560,old,1.6956026258498504,logistic,0.1094012975692749,COMPLETE,0.1094012975692749
102,0.935322642326355,2025-09-03 14:44:19.043243,2025-09-03 15:21:00.483363,0 days 00:36:41.440120,20,normal,7,nz,3.57904820688488e-08,0.007468755184724273,2711,640,old,1.2440546606501794,tanh,0.011005711555480958,COMPLETE,0.011005711555480958
103,0.6926774382591248,2025-09-03 15:21:00.484197,2025-09-03 15:55:12.974808,0 days 00:34:12.490611,20,normal,7,zero,,2.6655385399799217e-06,218,672,old,0.4349971289619389,tanh,0.012974858283996582,COMPLETE,0.012974858283996582
104,0.8256452083587646,2025-09-03 15:55:12.975590,2025-09-03 16:29:39.514330,0 days 00:34:26.538740,20,normal,5,zero,,0.0007598233933892904,299,928,old,0.7028677242712036,tanh,0.013059878349304199,COMPLETE,0.013059878349304199
105,0.8233226180076599,2025-09-03 16:29:39.515117,2025-09-03 16:36:28.937484,0 days 00:06:49.422367,100,normal,8,zero,,0.0007831629199118197,2157,704,Glorot,,logistic,0.012436628341674805,COMPLETE,0.012436628341674805
106,0.8317742347717285,2025-09-03 16:36:28.938292,2025-09-03 16:43:45.599938,0 days 00:07:16.661646,100,normal,6,nz,3.15330053191246e-06,0.001059371185105108,558,464,old,1.19781690806589,tanh,0.012815022468566894,COMPLETE,0.012815022468566894
107,0.9255483984947205,2025-09-03 16:43:45.600401,2025-09-03 17:18:02.480659,0 days 00:34:16.880258,20,uniform,6,zero,,0.2703483449173535,126,240,Glorot,,logistic,0.004245090484619141,COMPLETE,0.004245090484619141
108,0.574709701538086,2025-09-03 17:18:02.481114,2025-09-03 17:52:40.086499,0 days 00:34:37.605385,20,uniform,5,zero,,4.860546742134252e-05,8910,432,old,0.7621867768501387,logistic,0.012983059883117676,COMPLETE,0.012983059883117676
109,0.11329032629728317,2025-09-03 17:52:40.086954,2025-09-03 17:59:30.849798,0 days 00:06:50.762844,100,uniform,6,zero,,1.933586992443853e-06,1687,848,Glorot,,logistic,0.013076233863830566,COMPLETE,0.013076233863830566
110,0.09835484176874161,2025-09-03 17:59:30.850252,2025-09-03 18:33:27.809654,0 days 00:33:56.959402,20,uniform,6,zero,,0.5469440389712815,1472,464,old,0.3383535171692128,tanh,,COMPLETE,
111,0.9700161576271057,2025-09-03 18:33:27.810107,2025-09-03 18:40:26.399105,0 days 00:06:58.588998,100,uniform,8,zero,,0.21601493879012862,2106,736,Glorot,,tanh,0.004763364791870117,COMPLETE,0.004763364791870117
112,0.6513709902763367,2025-09-03 18:40:26.399569,2025-09-03 18:47:25.529845,0 days 00:06:59.130276,100,uniform,7,zero,,2.25792790653684e-06,2544,240,Glorot,,tanh,0.013047051429748536,COMPLETE,0.013047051429748536
113,0.9749032497406006,2025-09-03 18:47:25.531078,2025-09-03 19:22:13.111561,0 days 00:34:47.580483,20,normal,8,zero,,0.06907828351779671,5086,560,Glorot,,tanh,0.0027808427810668947,COMPLETE,0.0027808427810668947
114,0.7177903532981873,2025-09-03 19:22:13.112334,2025-09-03 19:29:10.480187,0 days 00:06:57.367853,100,normal,8,zero,,0.00025320557310478027,136,784,Glorot,,tanh,0.013123393058776855,COMPLETE,0.013123393058776855
115,0.7142419695854187,2025-09-03 19:29:10.480650,2025-09-03 19:36:06.131940,0 days 00:06:55.651290,100,uniform,6,zero,,1.386920631604054e-05,9880,640,Glorot,,tanh,0.013095378875732422,COMPLETE,0.013095378875732422
116,0.30454840064048766,2025-09-03 19:36:06.132405,2025-09-03 19:42:57.925119,0 days 00:06:51.792714,100,uniform,6,zero,,3.133419821744876e-05,3118,912,Glorot,,logistic,0.013121771812438964,COMPLETE,0.013121771812438964
117,0.8419032573699952,2025-09-03 19:42:57.925570,2025-09-03 19:49:47.925309,0 days 00:06:49.999739,100,uniform,7,zero,,0.004522859030733574,158,384,Glorot,,tanh,0.012599682807922364,COMPLETE,0.012599682807922364
118,0.9658226132392883,2025-09-03 19:49:47.925752,2025-09-03 19:57:07.313048,0 days 00:07:19.387296,100,normal,6,nz,2.898382419333067e-05,0.6409937071185792,614,432,old,1.8746984264429962,tanh,0.0012515068054199218,COMPLETE,0.0012515068054199218
119,0.9204355001449585,2025-09-03 19:57:07.313849,2025-09-03 20:31:23.303298,0 days 00:34:15.989449,20,uniform,7,zero,,0.007668071404506788,593,128,old,1.2023728574056394,tanh,0.009760022163391113,COMPLETE,0.009760022163391113
120,0.11251613348722458,2025-09-03 20:31:23.304063,2025-09-03 20:38:45.834193,0 days 00:07:22.530130,100,uniform,7,nz,1.2058345380104415e-05,1.2412046261132901e-06,169,864,old,1.882699819479407,logistic,0.013060712814331054,COMPLETE,0.013060712814331054
121,0.681661319732666,2025-09-03 20:38:45.834931,2025-09-03 20:46:05.576429,0 days 00:07:19.741498,100,uniform,7,nz,3.7308740142297057e-07,1.9719157796371668e-05,1375,288,old,0.7577100466502358,tanh,0.013135623931884766,COMPLETE,0.013135623931884766
122,0.9380484461784363,2025-09-03 20:46:05.577229,2025-09-03 21:20:27.717782,0 days 00:34:22.140553,20,normal,8,zero,,0.11600881292548788,907,976,Glorot,,logistic,0.006729626655578613,COMPLETE,0.006729626655578613
123,0.6837742269039154,2025-09-03 21:20:27.718222,2025-09-03 21:27:47.906769,0 days 00:07:20.188547,100,normal,5,nz,4.697728527313415e-06,0.4584432792130238,266,800,Glorot,,logistic,0.0029799699783325194,COMPLETE,0.0029799699783325194
124,0.6578871130943298,2025-09-03 21:27:47.907236,2025-09-03 22:02:06.385379,0 days 00:34:18.478143,20,uniform,6,zero,,3.3646525728742393e-06,856,224,old,0.8940634567567625,tanh,0.012794995307922363,COMPLETE,0.012794995307922363
125,0.25775807201862333,2025-09-03 22:02:06.385831,2025-09-03 22:36:39.714181,0 days 00:34:33.328350,20,normal,6,zero,,4.1826558277637744e-05,8816,192,Glorot,,logistic,0.012837791442871093,COMPLETE,0.012837791442871093
126,0.09835484176874161,2025-09-03 22:36:39.714647,2025-09-03 22:43:36.984049,0 days 00:06:57.269402,100,uniform,6,zero,,0.880860908605907,3390,672,old,1.0776604182147944,tanh,,COMPLETE,
127,0.6567258358001709,2025-09-03 22:43:36.984505,2025-09-03 23:18:29.648893,0 days 00:34:52.664388,20,normal,7,zero,,4.2019452092243035e-05,555,208,Glorot,,tanh,0.013044333457946778,COMPLETE,0.013044333457946778
