number,value,datetime_start,datetime_complete,duration,params_batch_size,params_colnorm_thresh,params_dist1,params_iseed,params_l2_penalty_choice,params_l2_penalty_nz,params_lr,params_lr_anneal_start,params_nhid1,params_pca_energy,params_preproc,params_scale_heur1,params_scale_mult1,params_squash,user_attrs_avg_fit_criteria,state,avg_fit_criteria
0,0.3808064699172974,2025-08-23 05:23:41.972287,2025-08-23 05:27:57.678336,0 days 00:04:15.706049,20,,normal,8,nz,1.5463788579841117e-06,0.00016653461936159484,1323,832,,raw,Glorot,,tanh,0.01305243968963623,COMPLETE,0.01305243968963623
1,0.48116130828857423,2025-08-23 05:27:57.680050,2025-08-23 05:29:08.166708,0 days 00:01:10.486658,100,,uniform,8,nz,1.9236748753487186e-08,2.0547199328558902e-05,7073,592,0.6584180610844357,pca,Glorot,,tanh,0.013126635551452636,COMPLETE,0.013126635551452636
2,0.09798387438058853,2025-08-23 05:29:08.168733,2025-08-23 05:30:13.260530,0 days 00:01:05.091797,100,,normal,5,zero,,0.5659923651826084,3833,128,,raw,old,1.9857466391390506,tanh,,COMPLETE,
3,0.4659355044364929,2025-08-23 05:30:13.260842,2025-08-23 05:35:03.898073,0 days 00:04:50.637231,20,,uniform,8,zero,,0.0004181759315680524,1673,496,0.7936518167319924,pca,old,0.7411550703865422,logistic,0.01305086612701416,COMPLETE,0.01305086612701416
4,0.7489677548408509,2025-08-23 05:35:03.900013,2025-08-23 05:35:52.413038,0 days 00:00:48.513025,100,0.0005111785038494985,uniform,6,zero,,0.01772932380115616,3920,496,,colnorm,Glorot,,logistic,0.008997869491577149,COMPLETE,0.008997869491577149
5,0.7794193863868714,2025-08-23 05:35:52.414639,2025-08-23 05:40:01.314778,0 days 00:04:08.900139,20,,uniform,7,nz,2.754579187431946e-08,0.04731325254594746,1576,272,0.9395345807573379,pca,Glorot,,tanh,0.003452968597412109,COMPLETE,0.003452968597412109
6,0.112693552672863,2025-08-23 05:40:01.316484,2025-08-23 05:40:51.657517,0 days 00:00:50.341033,100,,uniform,8,nz,4.347699888300888e-07,0.002194664177038812,147,1024,,raw,Glorot,,logistic,0.013021492958068847,COMPLETE,0.013021492958068847
7,0.7749677777290345,2025-08-23 05:40:51.660281,2025-08-23 05:41:40.234837,0 days 00:00:48.574556,100,0.00030649167289104257,normal,5,zero,,0.0816998127615149,1228,688,,colnorm,Glorot,,tanh,0.005633115768432617,COMPLETE,0.005633115768432617
8,0.7567903757095337,2025-08-23 05:41:40.235108,2025-08-23 05:42:31.511630,0 days 00:00:51.276522,100,,uniform,7,nz,0.0002645568202790849,0.02422873547786384,891,720,0.8913677959876881,pca,old,0.8538315683484765,tanh,0.011528372764587402,COMPLETE,0.011528372764587402
9,0.45953227281570436,2025-08-23 05:42:31.511858,2025-08-23 05:43:20.748453,0 days 00:00:49.236595,100,,uniform,7,zero,,3.170750300370449e-06,3320,656,0.9406161231694635,pca,old,0.8029927440054692,tanh,0.013034605979919433,COMPLETE,0.013034605979919433
10,0.8291290760040283,2025-08-23 05:43:20.748751,2025-08-23 05:47:33.718130,0 days 00:04:12.969379,20,,normal,8,nz,0.002551744641784246,0.03420715013038941,7313,368,0.936638035172104,pca,old,1.3715103262460462,tanh,0.002982330322265625,COMPLETE,0.002982330322265625
11,0.3012741982936859,2025-08-23 05:47:33.718450,2025-08-23 05:48:19.048040,0 days 00:00:45.329590,100,,uniform,5,zero,,0.002472295306383974,2075,64,,raw,old,0.2686955279215667,tanh,0.013523125648498535,COMPLETE,0.013523125648498535
12,0.8258548855781556,2025-08-23 05:48:19.048277,2025-08-23 05:52:14.221743,0 days 00:03:55.173466,20,,normal,8,zero,,0.12633115655273697,7996,496,,raw,old,1.2383117176396174,tanh,0.0018297910690307617,COMPLETE,0.0018297910690307617
13,0.7768226146697998,2025-08-23 05:52:14.222078,2025-08-23 05:53:03.062872,0 days 00:00:48.840794,100,0.00026396605532175534,normal,8,zero,,0.0856956409647669,1799,288,,colnorm,old,1.2920153892124882,logistic,0.002803516387939453,COMPLETE,0.002803516387939453
14,0.7870967984199524,2025-08-23 05:53:03.063093,2025-08-23 05:56:58.333268,0 days 00:03:55.270175,20,1.9234441996304963e-05,normal,5,zero,,0.1914526965665586,1879,192,,colnorm,Glorot,,logistic,-0.0001583099365234375,COMPLETE,-0.0001583099365234375
15,0.7480645418167114,2025-08-23 05:56:58.335258,2025-08-23 06:01:09.381265,0 days 00:04:11.046007,20,1.2471437960535648e-06,normal,5,nz,1.3116339985565845e-05,0.002599150833651273,8061,416,,colnorm,Glorot,,tanh,0.01083388328552246,COMPLETE,0.01083388328552246
16,0.11456452012062072,2025-08-23 06:01:09.381540,2025-08-23 06:01:55.550739,0 days 00:00:46.169199,100,4.664316241584911e-07,uniform,6,zero,,0.00030045263597290177,531,32,,colnorm,Glorot,,logistic,0.012209415435791016,COMPLETE,0.012209415435791016
17,0.29069356322288514,2025-08-23 06:01:55.550980,2025-08-23 06:02:45.174835,0 days 00:00:49.623855,100,,uniform,5,nz,0.0020148539176503438,0.004266449491975976,3210,464,,raw,old,0.6801332526612567,logistic,0.012926077842712403,COMPLETE,0.012926077842712403
18,0.7446935534477234,2025-08-23 06:02:45.175082,2025-08-23 06:06:56.289595,0 days 00:04:11.114513,20,6.917979271942646e-07,normal,6,nz,6.192186988258287e-07,0.0030403110046740844,7268,928,,colnorm,Glorot,,logistic,0.01109452247619629,COMPLETE,0.01109452247619629
19,0.758709728717804,2025-08-23 06:06:56.289911,2025-08-23 06:11:04.343001,0 days 00:04:08.053090,20,0.0002913468031487346,uniform,6,nz,1.265187772100772e-08,0.10035093057105589,548,256,,colnorm,old,0.2772973808283531,logistic,0.006947374343872071,COMPLETE,0.006947374343872071
20,0.7601613402366638,2025-08-23 06:11:04.343286,2025-08-23 06:15:02.289642,0 days 00:03:57.946356,20,,normal,8,zero,,0.010380337279685294,6874,688,,raw,old,1.49020452407454,tanh,0.00890660285949707,COMPLETE,0.00890660285949707
21,0.7268871188163757,2025-08-23 06:15:02.289913,2025-08-23 06:19:00.048810,0 days 00:03:57.758897,20,1.0895284441423112e-09,normal,5,zero,,0.008347127334096774,1301,176,,colnorm,Glorot,,logistic,0.0071486949920654295,COMPLETE,0.0071486949920654295
22,0.44269357323646547,2025-08-23 06:19:00.049095,2025-08-23 06:23:08.255676,0 days 00:04:08.206581,20,,normal,8,nz,0.00180794048733025,0.021721771897450753,5260,464,0.517117910674237,pca,old,1.36232924348388,tanh,0.001787257194519043,COMPLETE,0.001787257194519043
23,0.7427258133888245,2025-08-23 06:23:08.255955,2025-08-23 06:27:02.721218,0 days 00:03:54.465263,20,2.5121261485131696e-08,uniform,5,zero,,0.2944585225587344,637,224,,colnorm,Glorot,,tanh,0.00013687610626220704,COMPLETE,0.00013687610626220704
24,0.09798387438058853,2025-08-23 06:27:02.721483,2025-08-23 06:31:00.035472,0 days 00:03:57.313989,20,,uniform,8,zero,,0.2914474014398684,9715,432,,raw,old,1.6369911378155324,tanh,,COMPLETE,
25,0.7721774578094482,2025-08-23 06:31:00.035757,2025-08-23 06:34:55.902332,0 days 00:03:55.866575,20,,normal,5,zero,,0.22242176732040927,7420,368,0.7436911781262683,pca,old,1.1722914866764322,logistic,7.991790771484375e-05,COMPLETE,7.991790771484375e-05
26,0.7403064608573914,2025-08-23 06:34:55.902589,2025-08-23 06:38:43.598680,0 days 00:03:47.696091,20,,normal,8,zero,,0.00171624312383316,7735,80,0.9800239731695349,pca,old,1.2048899213319764,tanh,0.007813382148742675,COMPLETE,0.007813382148742675
27,0.8152581095695496,2025-08-23 06:38:43.598908,2025-08-23 06:42:38.932331,0 days 00:03:55.333423,20,,normal,6,zero,,0.16780264708481435,1414,304,0.7846322994562924,pca,Glorot,,logistic,0.00012564659118652344,COMPLETE,0.00012564659118652344
28,0.09798387438058853,2025-08-23 06:42:38.932648,2025-08-23 06:46:37.106715,0 days 00:03:58.174067,20,,normal,8,zero,,0.4556641264256633,1266,336,0.8062761526645443,pca,Glorot,,logistic,,COMPLETE,
29,0.09798387438058853,2025-08-23 06:46:37.106987,2025-08-23 06:50:32.149607,0 days 00:03:55.042620,20,,normal,6,zero,,0.19351684942339686,685,784,0.8427004075494813,pca,Glorot,,logistic,,COMPLETE,
30,0.6708709836006165,2025-08-23 06:50:32.149829,2025-08-23 06:54:32.280346,0 days 00:04:00.130517,20,,normal,6,nz,0.007395778600378908,0.0302403230170818,2880,64,0.6588796042307223,pca,Glorot,,logistic,-7.092952728271484e-05,COMPLETE,-7.092952728271484e-05
31,0.7998709797859191,2025-08-23 06:54:32.280657,2025-08-23 06:58:26.966147,0 days 00:03:54.685490,20,,normal,6,zero,,0.2947123143423652,523,144,0.8183020070638285,pca,Glorot,,logistic,-5.7697296142578125e-05,COMPLETE,-5.7697296142578125e-05
32,0.7270967960357666,2025-08-23 06:58:26.968154,2025-08-23 07:02:15.126306,0 days 00:03:48.158152,20,,normal,6,zero,,0.010792814997058923,616,96,0.8156635948111851,pca,Glorot,,tanh,0.008053421974182129,COMPLETE,0.008053421974182129
33,0.7540000438690185,2025-08-23 07:02:15.126542,2025-08-23 07:06:08.056939,0 days 00:03:52.930397,20,,normal,6,zero,,0.2107601207216795,262,208,0.8547807105656137,pca,old,1.675774579195929,logistic,0.002231597900390625,COMPLETE,0.002231597900390625
34,0.6202580690383911,2025-08-23 07:06:08.057224,2025-08-23 07:06:56.747940,0 days 00:00:48.690716,100,,normal,6,zero,,0.002023959953176117,1577,304,0.7618783161169348,pca,Glorot,,logistic,0.011637306213378907,COMPLETE,0.011637306213378907
35,0.09798387438058853,2025-08-23 07:06:56.748234,2025-08-23 07:11:05.728115,0 days 00:04:08.979881,20,,normal,6,nz,4.666314313749841e-05,0.749432590052121,7823,144,,raw,old,1.1306295867510097,tanh,,COMPLETE,
36,0.8004193663597107,2025-08-23 07:11:05.728398,2025-08-23 07:15:01.873671,0 days 00:03:56.145273,20,,normal,6,zero,,0.267266305600044,520,176,0.8663366313817382,pca,Glorot,,logistic,0.0007920980453491211,COMPLETE,0.0007920980453491211
37,0.09798387438058853,2025-08-23 07:15:01.873934,2025-08-23 07:18:58.902604,0 days 00:03:57.028670,20,,normal,8,zero,,0.2345965975600609,1556,400,,raw,Glorot,,tanh,,COMPLETE,
38,0.7890967965126038,2025-08-23 07:18:58.904341,2025-08-23 07:19:50.846529,0 days 00:00:51.942188,100,,normal,6,nz,9.887602202626604e-05,0.2787465063201228,5313,528,0.9964549486023166,pca,old,1.620274601073389,tanh,8.75234603881836e-05,COMPLETE,8.75234603881836e-05
39,0.7979354977607727,2025-08-23 07:19:50.846766,2025-08-23 07:23:49.734799,0 days 00:03:58.888033,20,1.9435337948924992e-08,normal,6,zero,,0.1621081997314598,9930,672,,colnorm,old,1.1192014531246253,tanh,-1.6307830810546876e-05,COMPLETE,-1.6307830810546876e-05
40,0.7827419638633728,2025-08-23 07:23:49.736791,2025-08-23 07:24:36.891743,0 days 00:00:47.154952,100,,normal,7,zero,,0.0271579007665128,5857,416,,raw,old,1.9338806354270637,tanh,0.006026577949523926,COMPLETE,0.006026577949523926
41,0.758274245262146,2025-08-23 07:24:36.891976,2025-08-23 07:28:33.465833,0 days 00:03:56.573857,20,,normal,5,zero,,0.2691804797628595,135,176,0.868874375320114,pca,Glorot,,logistic,0.0037518978118896485,COMPLETE,0.0037518978118896485
42,0.6634838938713074,2025-08-23 07:28:33.466103,2025-08-23 07:29:21.057082,0 days 00:00:47.590979,100,,normal,6,zero,,0.03427760501867541,145,128,0.8602784308606358,pca,Glorot,,logistic,0.007378315925598145,COMPLETE,0.007378315925598145
43,0.7704193949699402,2025-08-23 07:29:21.057313,2025-08-23 07:30:09.442754,0 days 00:00:48.385441,100,,normal,8,zero,,0.16035619886430713,8553,464,0.7399458318144267,pca,Glorot,,tanh,5.729198455810547e-05,COMPLETE,5.729198455810547e-05
44,0.8178387641906738,2025-08-23 07:30:09.443073,2025-08-23 07:34:05.886982,0 days 00:03:56.443909,20,,normal,6,zero,,0.07594966086223608,7300,320,,raw,Glorot,,logistic,0.0006533384323120118,COMPLETE,0.0006533384323120118
45,0.7531290769577026,2025-08-23 07:34:05.887263,2025-08-23 07:37:59.939420,0 days 00:03:54.052157,20,,normal,6,zero,,0.044368765090396126,2927,208,,raw,Glorot,,logistic,0.002203965187072754,COMPLETE,0.002203965187072754
46,0.7867419600486756,2025-08-23 07:37:59.941249,2025-08-23 07:41:54.638122,0 days 00:03:54.696873,20,5.939954692928114e-06,normal,7,zero,,0.078447647128964,9868,208,,colnorm,Glorot,,logistic,8.797645568847656e-06,COMPLETE,8.797645568847656e-06
47,0.8009193658828735,2025-08-23 07:41:54.638424,2025-08-23 07:46:03.096869,0 days 00:04:08.458445,20,,normal,8,nz,0.009386612722547922,0.02848589333283223,9299,336,0.9253515258435352,pca,Glorot,,tanh,0.06815168857574463,COMPLETE,0.06815168857574463
48,0.7972580790519714,2025-08-23 07:46:03.097161,2025-08-23 07:50:15.315743,0 days 00:04:12.218582,20,,normal,8,nz,0.009682662833858052,0.12050989930643388,4583,432,0.9976311109593325,pca,Glorot,,tanh,0.13335926532745362,COMPLETE,0.13335926532745362
49,0.7317258238792419,2025-08-23 07:50:15.316031,2025-08-23 07:54:13.020646,0 days 00:03:57.704615,20,,uniform,6,zero,,0.005175674411284082,7269,656,,raw,Glorot,,logistic,0.007899117469787598,COMPLETE,0.007899117469787598
50,0.7396129131317138,2025-08-23 07:54:13.020944,2025-08-23 07:58:21.543516,0 days 00:04:08.522572,20,,normal,6,nz,0.0006018886177433526,0.004171298343368015,2923,496,,raw,Glorot,,tanh,0.010611200332641601,COMPLETE,0.010611200332641601
51,0.7082419753074646,2025-08-23 07:58:21.543799,2025-08-23 08:02:18.589398,0 days 00:03:57.045599,20,,normal,8,nz,0.009764412610561856,0.0019500999509125992,8186,16,0.9041814009742962,pca,Glorot,,tanh,0.001954817771911621,COMPLETE,0.001954817771911621
52,0.09798387438058853,2025-08-23 08:02:18.589666,2025-08-23 08:06:18.535897,0 days 00:03:59.946231,20,2.6991331639134138e-09,normal,8,nz,0.0005435135620564526,0.34640553472558566,6456,512,,colnorm,old,1.4005831073860449,logistic,,COMPLETE,
53,0.7547903776168823,2025-08-23 08:06:18.536207,2025-08-23 08:10:14.871304,0 days 00:03:56.335097,20,,uniform,6,zero,,0.03653182528561606,1157,304,0.917342276775159,pca,Glorot,,logistic,0.006365847587585449,COMPLETE,0.006365847587585449
54,0.8360000371932983,2025-08-23 08:10:14.873054,2025-08-23 08:14:12.052772,0 days 00:03:57.179718,20,,normal,6,zero,,0.26785617290871927,5218,480,,raw,old,1.0127227071866125,logistic,0.0011094570159912109,COMPLETE,0.0011094570159912109
55,0.8058709859848022,2025-08-23 08:14:12.054546,2025-08-23 08:18:09.696259,0 days 00:03:57.641713,20,,normal,6,zero,,0.29851578203722456,5555,688,,raw,old,0.998269615786094,logistic,0.0032791376113891603,COMPLETE,0.0032791376113891603
56,0.7895322799682617,2025-08-23 08:18:09.696557,2025-08-23 08:22:07.886117,0 days 00:03:58.189560,20,,normal,6,zero,,0.055924482797961535,8535,832,,raw,old,1.0271176129697155,logistic,0.0031868934631347655,COMPLETE,0.0031868934631347655
57,0.8366613268852234,2025-08-23 08:22:07.886394,2025-08-23 08:26:04.825939,0 days 00:03:56.939545,20,,normal,6,zero,,0.18145374465394268,7905,352,,raw,old,1.0081053482564746,logistic,0.0008682012557983398,COMPLETE,0.0008682012557983398
58,0.838532292842865,2025-08-23 08:26:04.827607,2025-08-23 08:30:01.580788,0 days 00:03:56.753181,20,,uniform,6,zero,,0.41161099166847903,8835,304,,raw,old,1.0656869282101922,logistic,0.004299831390380859,COMPLETE,0.004299831390380859
59,0.8025000095367432,2025-08-23 08:30:01.581107,2025-08-23 08:33:48.350470,0 days 00:03:46.769363,20,,uniform,6,zero,,0.1284459539328761,2347,128,,raw,old,1.0541046750860874,logistic,4.0149688720703126e-05,COMPLETE,4.0149688720703126e-05
60,0.7815322875976562,2025-08-23 08:33:48.350732,2025-08-23 08:34:35.887472,0 days 00:00:47.536740,100,,normal,6,zero,,0.06859547818367785,7755,160,,raw,old,1.1319182835885768,logistic,0.00035293102264404296,COMPLETE,0.00035293102264404296
61,0.7514839053153992,2025-08-23 08:34:35.887701,2025-08-23 08:38:33.812771,0 days 00:03:57.925070,20,,uniform,5,zero,,0.02965083900971732,6660,304,,raw,old,0.9792538806410571,logistic,0.0035434961318969727,COMPLETE,0.0035434961318969727
62,0.5912580832839012,2025-08-23 08:38:33.813028,2025-08-23 08:42:34.158062,0 days 00:04:00.345034,20,,uniform,6,zero,,0.7889121687805805,7877,432,,raw,old,1.2596272682742815,logistic,0.004459786415100098,COMPLETE,0.004459786415100098
63,0.7621613383293152,2025-08-23 08:42:34.158348,2025-08-23 08:46:22.253741,0 days 00:03:48.095393,20,,normal,7,zero,,0.026820965160589717,7009,96,,raw,old,0.9834714288991205,logistic,0.0004906415939331055,COMPLETE,0.0004906415939331055
64,0.7203871250152588,2025-08-23 08:46:22.254027,2025-08-23 08:50:36.857535,0 days 00:04:14.603508,20,,normal,7,nz,1.1146790860960646e-05,0.688730902201332,2871,448,,raw,old,1.3302609918424873,logistic,0.002516031265258789,COMPLETE,0.002516031265258789
65,0.8185645580291748,2025-08-23 08:50:36.857860,2025-08-23 08:54:36.054467,0 days 00:03:59.196607,20,,normal,6,zero,,0.059497087958614775,4668,272,,raw,old,0.9961491007637726,tanh,0.0024681806564331053,COMPLETE,0.0024681806564331053
66,0.6226290345191956,2025-08-23 08:54:36.054757,2025-08-23 08:58:36.498999,0 days 00:04:00.444242,20,,uniform,7,zero,,0.1502876538137094,8015,368,0.5860240585055793,pca,old,0.9541010368648566,logistic,-2.5272369384765625e-05,COMPLETE,-2.5272369384765625e-05
67,0.8143871426582336,2025-08-23 08:58:36.499230,2025-08-23 09:02:38.522774,0 days 00:04:02.023544,20,,normal,6,zero,,0.09320857392241012,1875,160,,raw,old,0.8929815405633115,tanh,0.0005239963531494141,COMPLETE,0.0005239963531494141
68,0.7476129055023193,2025-08-23 09:02:38.523105,2025-08-23 09:03:27.555985,0 days 00:00:49.032880,100,,normal,6,zero,,0.008922376003361262,9768,224,,raw,Glorot,,tanh,0.007074785232543945,COMPLETE,0.007074785232543945
69,0.802483880519867,2025-08-23 09:03:27.556231,2025-08-23 09:07:30.442266,0 days 00:04:02.886035,20,,normal,8,zero,,0.056267160695688934,8126,368,,raw,old,0.8132701164848903,logistic,0.001147913932800293,COMPLETE,0.001147913932800293
70,0.09798387438058853,2025-08-23 09:07:30.442546,2025-08-23 09:11:31.436485,0 days 00:04:00.993939,20,,normal,5,zero,,0.5953745623520547,6464,672,,raw,old,1.1472778279415161,tanh,,COMPLETE,
71,0.7900967955589294,2025-08-23 09:11:31.436764,2025-08-23 09:15:32.106275,0 days 00:04:00.669511,20,,normal,6,zero,,0.06235942374779847,4589,160,,raw,old,0.7728770567218858,logistic,0.00020987987518310546,COMPLETE,0.00020987987518310546
72,0.8225968241691589,2025-08-23 09:15:32.106574,2025-08-23 09:19:30.760966,0 days 00:03:58.654392,20,,normal,8,zero,,0.15821882502677506,4215,240,,raw,old,1.1738392629180685,tanh,0.0007008552551269531,COMPLETE,0.0007008552551269531
73,0.09798387438058853,2025-08-23 09:19:30.761260,2025-08-23 09:23:30.240801,0 days 00:03:59.479541,20,,normal,8,zero,,0.4763446801320551,3124,144,,raw,old,1.2151068843332258,tanh,,COMPLETE,
74,0.09798387438058853,2025-08-23 09:23:30.241068,2025-08-23 09:27:31.470801,0 days 00:04:01.229733,20,,normal,6,zero,,0.32905501547028326,9002,336,,raw,Glorot,,tanh,,COMPLETE,
75,0.7916613101959229,2025-08-23 09:27:31.471108,2025-08-23 09:31:30.095831,0 days 00:03:58.624723,20,1.0809595055192178e-07,uniform,6,zero,,0.10252662817506268,5295,208,,colnorm,old,1.1199449218419606,tanh,-0.00018444061279296876,COMPLETE,-0.00018444061279296876
76,0.6479839086532593,2025-08-23 09:31:30.096119,2025-08-23 09:32:21.699131,0 days 00:00:51.603012,100,,uniform,8,nz,3.734637573391394e-05,0.005204833652614653,4080,336,0.6349751993527406,pca,old,0.9164129471436442,tanh,0.011284995079040527,COMPLETE,0.011284995079040527
77,0.7170484185218811,2025-08-23 09:32:21.699368,2025-08-23 09:36:32.725524,0 days 00:04:11.026156,20,,normal,8,nz,0.00022512326748292189,0.002014624492631497,4031,256,,raw,old,1.3292213001416662,tanh,0.009222626686096191,COMPLETE,0.009222626686096191
78,0.6775161385536194,2025-08-23 09:36:32.725801,2025-08-23 09:40:42.284129,0 days 00:04:09.558328,20,,normal,6,nz,4.123842983783068e-06,0.012394627862618674,5884,192,0.6495315284054555,pca,old,1.2768351686818964,tanh,0.0055492639541625975,COMPLETE,0.0055492639541625975
79,0.4578709781169891,2025-08-23 09:40:42.284463,2025-08-23 09:44:45.381939,0 days 00:04:03.097476,20,,normal,8,zero,,0.0880271285056372,1177,656,0.5294910048973094,pca,old,0.5846384919603593,tanh,0.006443309783935547,COMPLETE,0.006443309783935547
80,0.8184516668319702,2025-08-23 09:44:45.382215,2025-08-23 09:45:33.632029,0 days 00:00:48.249814,100,,uniform,6,zero,,0.32124856057993584,2233,192,,raw,Glorot,,logistic,0.0003854036331176758,COMPLETE,0.0003854036331176758
81,0.7283548593521119,2025-08-23 09:45:33.633744,2025-08-23 09:49:22.341484,0 days 00:03:48.707740,20,,normal,5,zero,,0.0026496425659922464,6472,64,,raw,Glorot,,tanh,0.004611754417419433,COMPLETE,0.004611754417419433
82,0.09798387438058853,2025-08-23 09:49:22.343307,2025-08-23 09:53:22.622129,0 days 00:04:00.278822,20,,normal,7,zero,,0.5369107615312858,9042,320,,raw,old,0.9760185398573918,tanh,,COMPLETE,
83,0.78151615858078,2025-08-23 09:53:22.622409,2025-08-23 09:54:10.730029,0 days 00:00:48.107620,100,,uniform,6,zero,,0.45196493992638087,567,336,,raw,Glorot,,logistic,0.001447439193725586,COMPLETE,0.001447439193725586
84,0.7687097191810608,2025-08-23 09:54:10.730263,2025-08-23 09:54:57.177899,0 days 00:00:46.447636,100,,uniform,7,zero,,0.09307866517462315,2748,112,,raw,Glorot,,logistic,0.0005387067794799805,COMPLETE,0.0005387067794799805
85,0.7817258358001709,2025-08-23 09:54:57.178137,2025-08-23 09:58:57.016958,0 days 00:03:59.838821,20,2.08270446158178e-05,normal,8,zero,,0.10277796380359837,3838,336,,colnorm,old,1.3692427402640068,tanh,0.0001321077346801758,COMPLETE,0.0001321077346801758
86,0.7141613245010376,2025-08-23 09:58:57.017236,2025-08-23 09:59:42.568030,0 days 00:00:45.550794,100,,uniform,6,zero,,0.03124085419476741,3846,16,,raw,Glorot,,logistic,0.001455545425415039,COMPLETE,0.001455545425415039
87,0.7505322813987731,2025-08-23 09:59:42.568324,2025-08-23 10:03:42.336377,0 days 00:03:59.768053,20,,normal,5,zero,,0.04076589972210536,4401,592,,raw,Glorot,,logistic,0.004433107376098633,COMPLETE,0.004433107376098633
88,0.7581936001777649,2025-08-23 10:03:42.336663,2025-08-23 10:04:30.733943,0 days 00:00:48.397280,100,,normal,5,zero,,0.05502952213884558,6189,224,,raw,Glorot,,logistic,0.0017498493194580077,COMPLETE,0.0017498493194580077
