number,value,datetime_start,datetime_complete,duration,params_batch_size,params_dist1,params_iseed,params_l2_penalty_choice,params_l2_penalty_nz,params_lr,params_lr_anneal_start,params_nhid1,params_scale_heur1,params_scale_mult1,params_squash,user_attrs_avg_fit_criteria,state,avg_fit_criteria
93,0.4930645227432251,2025-09-03 11:17:19.257539,2025-09-03 11:24:06.966682,0 days 00:06:47.709143,100,uniform,6,zero,,3.8119316753755817e-06,1910,672,old,0.23483470721403713,tanh,0.01304314136505127,COMPLETE,0.01304314136505127
94,0.7598871469497681,2025-09-03 11:24:06.967099,2025-09-03 12:00:16.372303,0 days 00:36:09.405204,20,uniform,7,nz,4.816686828617448e-07,0.03330887626095184,895,384,Glorot,,tanh,0.008775877952575683,COMPLETE,0.008775877952575683
95,0.6057419538497925,2025-09-03 12:00:16.372745,2025-09-03 12:06:58.953510,0 days 00:06:42.580765,100,normal,8,zero,,0.0002997657084618961,1223,816,old,0.6444303612007551,tanh,0.013110637664794922,COMPLETE,0.013110637664794922
96,0.5235322833061218,2025-09-03 12:06:58.953923,2025-09-03 12:13:44.702494,0 days 00:06:45.748571,100,normal,8,zero,,0.00011333293684010681,2494,480,old,1.4060152735110083,tanh,0.013148045539855957,COMPLETE,0.013148045539855957
97,0.1183871015906334,2025-09-03 12:13:44.702929,2025-09-03 12:20:39.467980,0 days 00:06:54.765051,100,normal,6,zero,,0.0004082968492166491,243,640,old,0.7659148680723962,logistic,0.013097405433654785,COMPLETE,0.013097405433654785
98,0.49320969581604,2025-09-03 12:20:39.468885,2025-09-03 12:56:46.950167,0 days 00:36:07.481282,20,uniform,7,nz,3.179195841092528e-07,1.1493145431478937e-06,582,928,old,1.418800479316152,tanh,0.013102984428405762,COMPLETE,0.013102984428405762
99,0.1318548411130905,2025-09-03 12:56:46.950931,2025-09-03 13:03:36.168161,0 days 00:06:49.217230,100,uniform,6,zero,,5.420115942374636e-05,3098,736,old,1.2675963941982775,logistic,0.013039922714233399,COMPLETE,0.013039922714233399
100,0.5210000336170196,2025-09-03 13:03:36.168591,2025-09-03 13:37:46.426419,0 days 00:34:10.257828,20,normal,8,zero,,0.00013698275185491097,447,768,Glorot,,tanh,0.01311028003692627,COMPLETE,0.01311028003692627
101,0.7883709907531739,2025-09-03 13:37:46.426835,2025-09-03 14:13:48.383209,0 days 00:36:01.956374,20,uniform,7,nz,0.0013339363451747054,0.232732958898802,5221,560,old,1.6956026258498504,logistic,0.09326097965240479,COMPLETE,0.09326097965240479
102,0.7471290469169617,2025-09-03 14:13:48.383966,2025-09-03 14:50:07.345829,0 days 00:36:18.961863,20,normal,7,nz,3.57904820688488e-08,0.007468755184724273,2711,640,old,1.2440546606501794,tanh,0.01108705997467041,COMPLETE,0.01108705997467041
103,0.4702096939086914,2025-09-03 14:50:07.346269,2025-09-03 15:23:58.117725,0 days 00:33:50.771456,20,normal,7,zero,,2.6655385399799217e-06,218,672,old,0.4349971289619389,tanh,0.012974882125854492,COMPLETE,0.012974882125854492
104,0.6017096996307373,2025-09-03 15:23:58.118144,2025-09-03 15:58:17.268353,0 days 00:34:19.150209,20,normal,5,zero,,0.0007598233933892904,299,928,old,0.7028677242712036,tanh,0.013086557388305664,COMPLETE,0.013086557388305664
105,0.5774032592773437,2025-09-03 15:58:17.269303,2025-09-03 16:05:06.088298,0 days 00:06:48.818995,100,normal,8,zero,,0.0007831629199118197,2157,704,Glorot,,logistic,0.012845087051391601,COMPLETE,0.012845087051391601
106,0.5931613206863403,2025-09-03 16:05:06.088715,2025-09-03 16:12:38.999558,0 days 00:07:32.910843,100,normal,6,nz,3.15330053191246e-06,0.001059371185105108,558,464,old,1.19781690806589,tanh,0.01297459602355957,COMPLETE,0.01297459602355957
107,0.7444838762283326,2025-09-03 16:12:38.999984,2025-09-03 16:46:32.987978,0 days 00:33:53.987994,20,uniform,6,zero,,0.2703483449173535,126,240,Glorot,,logistic,0.005315756797790528,COMPLETE,0.005315756797790528
108,0.29530646204948424,2025-09-03 16:46:32.988752,2025-09-03 17:20:25.008977,0 days 00:33:52.020225,20,uniform,5,zero,,4.860546742134252e-05,8910,432,old,0.7621867768501387,logistic,0.013002753257751465,COMPLETE,0.013002753257751465
109,0.112693552672863,2025-09-03 17:20:25.009418,2025-09-03 17:27:21.165969,0 days 00:06:56.156551,100,uniform,6,zero,,1.933586992443853e-06,1687,848,Glorot,,logistic,0.013076329231262207,COMPLETE,0.013076329231262207
110,0.09798387438058853,2025-09-03 17:27:21.166691,2025-09-03 18:01:08.466244,0 days 00:33:47.299553,20,uniform,6,zero,,0.5469440389712815,1472,464,old,0.3383535171692128,tanh,,COMPLETE,
111,0.8187581181526185,2025-09-03 18:01:08.466665,2025-09-03 18:08:04.853690,0 days 00:06:56.387025,100,uniform,8,zero,,0.21601493879012862,2106,736,Glorot,,tanh,0.0016356468200683593,COMPLETE,0.0016356468200683593
112,0.42393550276756287,2025-09-03 18:08:04.854109,2025-09-03 18:14:54.885545,0 days 00:06:50.031436,100,uniform,7,zero,,2.25792790653684e-06,2544,240,Glorot,,tanh,0.013047027587890624,COMPLETE,0.013047027587890624
113,0.820483922958374,2025-09-03 18:14:54.886420,2025-09-03 18:48:45.158841,0 days 00:33:50.272421,20,normal,8,zero,,0.06907828351779671,5086,560,Glorot,,tanh,0.0008524894714355469,COMPLETE,0.0008524894714355469
114,0.5059838950634002,2025-09-03 18:48:45.159263,2025-09-03 18:55:33.537094,0 days 00:06:48.377831,100,normal,8,zero,,0.00025320557310478027,136,784,Glorot,,tanh,0.013123059272766113,COMPLETE,0.013123059272766113
115,0.5121935844421387,2025-09-03 18:55:33.537824,2025-09-03 19:02:20.810450,0 days 00:06:47.272626,100,uniform,6,zero,,1.386920631604054e-05,9880,640,Glorot,,tanh,0.013096785545349121,COMPLETE,0.013096785545349121
116,0.11754838973283768,2025-09-03 19:02:20.810869,2025-09-03 19:09:03.934139,0 days 00:06:43.123270,100,uniform,6,zero,,3.133419821744876e-05,3118,912,Glorot,,logistic,0.013121724128723145,COMPLETE,0.013121724128723145
117,0.6126613140106201,2025-09-03 19:09:03.934917,2025-09-03 19:15:45.911684,0 days 00:06:41.976767,100,uniform,7,zero,,0.004522859030733574,158,384,Glorot,,tanh,0.012780570983886718,COMPLETE,0.012780570983886718
118,0.8014032363891601,2025-09-03 19:15:45.912099,2025-09-03 19:23:20.576576,0 days 00:07:34.664477,100,normal,6,nz,2.898382419333067e-05,0.6409937071185792,614,432,old,1.8746984264429962,tanh,0.0001008749008178711,COMPLETE,0.0001008749008178711
119,0.7448548436164856,2025-09-03 19:23:20.576992,2025-09-03 19:57:36.434156,0 days 00:34:15.857164,20,uniform,7,zero,,0.007668071404506788,593,128,old,1.2023728574056394,tanh,0.010529589653015137,COMPLETE,0.010529589653015137
120,0.112693552672863,2025-09-03 19:57:36.434601,2025-09-03 20:04:51.364699,0 days 00:07:14.930098,100,uniform,7,nz,1.2058345380104415e-05,1.2412046261132901e-06,169,864,old,1.882699819479407,logistic,0.013060712814331054,COMPLETE,0.013060712814331054
121,0.44191937446594237,2025-09-03 20:04:51.365118,2025-09-03 20:12:04.632555,0 days 00:07:13.267437,100,uniform,7,nz,3.7308740142297057e-07,1.9719157796371668e-05,1375,288,old,0.7577100466502358,tanh,0.013134908676147462,COMPLETE,0.013134908676147462
122,0.7472096800804138,2025-09-03 20:12:04.633333,2025-09-03 20:46:04.863176,0 days 00:34:00.229843,20,normal,8,zero,,0.11600881292548788,907,976,Glorot,,logistic,0.0072365283966064455,COMPLETE,0.0072365283966064455
123,0.4258548438549042,2025-09-03 20:46:04.863607,2025-09-03 20:53:21.313018,0 days 00:07:16.449411,100,normal,5,nz,4.697728527313415e-06,0.4584432792130238,266,800,Glorot,,logistic,0.0017519712448120118,COMPLETE,0.0017519712448120118
124,0.4170322775840759,2025-09-03 20:53:21.313449,2025-09-03 21:27:28.121037,0 days 00:34:06.807588,20,uniform,6,zero,,3.3646525728742393e-06,856,224,old,0.8940634567567625,tanh,0.012794971466064453,COMPLETE,0.012794971466064453
125,0.11609677821397782,2025-09-03 21:27:28.121465,2025-09-03 22:01:49.125826,0 days 00:34:21.004361,20,normal,6,zero,,4.1826558277637744e-05,8816,192,Glorot,,logistic,0.012849664688110352,COMPLETE,0.012849664688110352
126,0.09798387438058853,2025-09-03 22:01:49.126585,2025-09-03 22:08:37.246638,0 days 00:06:48.120053,100,uniform,6,zero,,0.880860908605907,3390,672,old,1.0776604182147944,tanh,,COMPLETE,
127,0.42654840350151063,2025-09-03 22:08:37.247381,2025-09-03 22:42:36.599331,0 days 00:33:59.351950,20,normal,7,zero,,4.2019452092243035e-05,555,208,Glorot,,tanh,0.013044285774230956,COMPLETE,0.013044285774230956
