number,value,datetime_start,datetime_complete,duration,params_batch_size,params_dist1,params_iseed,params_l2_penalty_choice,params_l2_penalty_nz,params_lr,params_lr_anneal_start,params_nhid1,params_nhid2,params_nhid3,params_scale_heur1,params_scale_mult1,params_squash,user_attrs_avg_fit_criteria,user_attrs_ed_cl1_mean,user_attrs_ed_cl2_mean,user_attrs_ed_cl3_mean,state,avg_fit_criteria,ed_cl1_mean,ed_cl2_mean,ed_cl3_mean
0,0.12731666614611944,2025-09-02 09:19:08.867386,2025-09-02 09:48:56.643069,0 days 00:29:47.775683,20,uniform,8,nz,0.001976273939677935,0.01888913897506274,548,832,368,368,Glorot,,logistic,0.011050767368740505,0.012739062309265137,0.012519637743631998,0.007893602053324381,COMPLETE,0.011050767368740505,0.012739062309265137,0.012519637743631998,0.007893602053324381
1,0.07381666451692581,2025-09-02 09:48:56.643572,2025-09-02 10:16:20.110135,0 days 00:27:23.466563,20,normal,6,zero,,7.287875536659331e-06,2558,976,720,480,Glorot,,tanh,0.01308131217956543,0.01307539145151774,0.013118823369344076,0.013049721717834473,COMPLETE,0.01308131217956543,0.01307539145151774,0.013118823369344076,0.013049721717834473
2,0.07075000057617824,2025-09-02 10:16:20.110567,2025-09-02 10:21:54.955820,0 days 00:05:34.845253,100,normal,5,nz,0.005659923651826091,0.0024869546064083107,103,736,656,608,Glorot,,logistic,0.013127009073893229,0.013124426205952963,0.013085047403971354,0.013171553611755371,COMPLETE,0.013127009073893229,0.013124426205952963,0.013085047403971354,0.013171553611755371
3,0.045449999471505485,2025-09-02 10:21:54.956466,2025-09-02 10:48:44.209302,0 days 00:26:49.252836,20,uniform,5,zero,,4.392996964391159e-06,286,304,464,176,old,1.048938561776662,logistic,0.013063894377814399,0.013175328572591146,0.012939969698588053,0.013076384862263998,COMPLETE,0.013063894377814399,0.013175328572591146,0.012939969698588053,0.013076384862263998
4,0.09281666328509648,2025-09-02 10:48:44.209725,2025-09-02 10:54:24.636425,0 days 00:05:40.426700,100,uniform,8,nz,2.2013739783605834e-08,0.0014768815514442635,7994,688,768,256,Glorot,,logistic,0.01210100120968289,0.012928525606791178,0.013101418813069662,0.010273059209187826,COMPLETE,0.01210100120968289,0.012928525606791178,0.013101418813069662,0.010273059209187826
5,0.15671666463216147,2025-09-02 10:54:24.637102,2025-09-02 11:00:01.053491,0 days 00:05:36.416389,100,normal,8,nz,0.00017344787323769035,0.3329779126931672,5727,624,1008,256,old,1.0240609680153696,logistic,0.004913171132405599,0.01415411631266276,8.118152618408203e-05,0.0005042155583699545,COMPLETE,0.004913171132405599,0.01415411631266276,8.118152618408203e-05,0.0005042155583699545
6,0.07068333278099696,2025-09-02 11:00:01.054168,2025-09-02 11:06:00.599415,0 days 00:05:59.545247,100,normal,6,nz,2.5689072709426117e-05,5.276847581147895e-05,221,384,256,432,Glorot,,tanh,0.012990037600199381,0.013108928998311361,0.012891809145609537,0.012969374656677246,COMPLETE,0.012990037600199381,0.013108928998311361,0.012891809145609537,0.012969374656677246
7,0.17505000034968057,2025-09-02 11:06:00.599836,2025-09-02 11:11:26.362998,0 days 00:05:25.763162,100,normal,7,zero,,0.045402977968456694,3669,192,416,784,old,0.39496068952891183,logistic,0.0026843282911512586,0.0018033981323242188,0.0026613871256510415,0.0035881996154785156,COMPLETE,0.0026843282911512586,0.0018033981323242188,0.0026613871256510415,0.0035881996154785156
8,0.0779666652282079,2025-09-02 11:11:26.363424,2025-09-02 11:16:49.588668,0 days 00:05:23.225244,100,uniform,7,zero,,1.9670000815753223e-05,2947,1024,864,624,old,1.7685618590876564,logistic,0.013019389576382106,0.013049642244974772,0.01297609011332194,0.01303243637084961,COMPLETE,0.013019389576382106,0.013049642244974772,0.01297609011332194,0.01303243637084961
9,0.16378332674503326,2025-09-02 11:16:49.589095,2025-09-02 11:22:24.180823,0 days 00:05:34.591728,100,normal,7,nz,0.004713238483750317,0.026455682027908503,179,528,144,448,Glorot,,tanh,0.012083000606960721,0.012705047925313314,0.012210845947265625,0.011333107948303223,COMPLETE,0.012083000606960721,0.012705047925313314,0.012210845947265625,0.011333107948303223
10,0.13723333179950714,2025-09-02 11:22:24.181239,2025-09-02 11:50:38.420429,0 days 00:28:14.239190,20,uniform,5,nz,1.7399719380673092e-06,0.0060518290943611325,550,784,768,160,old,1.3898853516952139,tanh,0.012339459525214301,0.012962261835734049,0.013097246487935385,0.01095887025197347,COMPLETE,0.012339459525214301,0.012962261835734049,0.013097246487935385,0.01095887025197347
11,0.06749999895691872,2025-09-02 11:50:38.420851,2025-09-02 11:56:02.343595,0 days 00:05:23.922744,100,normal,6,zero,,0.00018131133577534945,391,688,448,320,Glorot,,logistic,0.013130956225925023,0.013032039006551107,0.013178348541259766,0.013182481129964193,COMPLETE,0.013130956225925023,0.013032039006551107,0.013178348541259766,0.013182481129964193
12,0.11096666504939397,2025-09-02 11:56:02.346652,2025-09-02 12:01:21.394976,0 days 00:05:19.048324,100,uniform,8,zero,,0.002472295306383974,2075,224,384,176,old,0.2686955279215667,tanh,0.011708047654893665,0.01281130313873291,0.01272126038869222,0.00959157943725586,COMPLETE,0.011708047654893665,0.01281130313873291,0.01272126038869222,0.00959157943725586
13,0.15479999780654907,2025-09-02 12:01:21.395668,2025-09-02 12:29:34.449180,0 days 00:28:13.053512,20,uniform,8,nz,1.784055631279747e-08,0.0028909398708427706,5014,896,784,752,old,0.2558892770414504,logistic,0.011691146426730685,0.012826840082804361,0.012563109397888184,0.009683489799499512,COMPLETE,0.011691146426730685,0.012826840082804361,0.012563109397888184,0.009683489799499512
14,0.16829999287923178,2025-09-02 12:29:34.449616,2025-09-02 12:34:52.198664,0 days 00:05:17.749048,100,normal,8,zero,,0.00700610875534594,456,592,912,784,Glorot,,tanh,0.01292113463083903,0.013094544410705566,0.012945612271626791,0.012723247210184732,COMPLETE,0.01292113463083903,0.013094544410705566,0.012945612271626791,0.012723247210184732
15,0.05739999935030937,2025-09-02 12:34:52.200003,2025-09-02 12:40:12.123080,0 days 00:05:19.923077,100,normal,6,zero,,9.318544447640828e-06,368,608,304,272,old,0.4837215553624952,logistic,0.013083404964870876,0.013135075569152832,0.013202349344889322,0.012912789980570475,COMPLETE,0.013083404964870876,0.013135075569152832,0.013202349344889322,0.012912789980570475
16,0.07218333333730698,2025-09-02 12:40:12.123835,2025-09-02 13:06:31.261664,0 days 00:26:19.137829,20,uniform,5,zero,,4.481465560938961e-06,450,928,160,832,old,1.9993692687863487,tanh,0.013110452228122287,0.013128876686096191,0.0131455659866333,0.01305691401163737,COMPLETE,0.013110452228122287,0.013128876686096191,0.0131455659866333,0.01305691401163737
17,0.073983334004879,2025-09-02 13:06:31.262341,2025-09-02 13:11:50.119323,0 days 00:05:18.856982,100,normal,5,zero,,1.357272557085702e-06,1626,992,592,304,old,1.000636396400883,tanh,0.013045125537448458,0.013086676597595215,0.013134121894836426,0.012914578119913736,COMPLETE,0.013045125537448458,0.013086676597595215,0.013134121894836426,0.012914578119913736
18,0.07068333029747009,2025-09-02 13:11:50.119753,2025-09-02 13:39:05.389753,0 days 00:27:15.270000,20,normal,5,zero,,0.00047629753700197336,299,912,736,192,old,0.9803391648118072,tanh,0.013152321179707846,0.013167063395182291,0.013056476910909018,0.013233423233032227,COMPLETE,0.013152321179707846,0.013167063395182291,0.013056476910909018,0.013233423233032227
19,0.17013332744439444,2025-09-02 13:39:05.390524,2025-09-02 13:44:46.046120,0 days 00:05:40.655596,100,normal,8,zero,,0.00812939806214599,457,352,768,704,Glorot,,tanh,0.012704041269090442,0.012571414311726889,0.01301415761311849,0.012526551882425943,COMPLETE,0.012704041269090442,0.012571414311726889,0.01301415761311849,0.012526551882425943
20,0.0626999984184901,2025-09-02 13:44:46.046550,2025-09-02 13:50:16.572561,0 days 00:05:30.526011,100,normal,6,zero,,0.0010659387498002082,1944,144,464,656,old,0.6253214399079573,logistic,0.012989706463283962,0.01300374666849772,0.01307833194732666,0.012887040774027506,COMPLETE,0.012989706463283962,0.01300374666849772,0.01307833194732666,0.012887040774027506
21,0.18654999633630118,2025-09-02 13:50:16.573315,2025-09-02 13:55:40.843313,0 days 00:05:24.269998,100,normal,8,zero,,0.011165170526562336,445,288,1008,880,Glorot,,tanh,0.012726479106479222,0.012621164321899414,0.012894709904988607,0.012663563092549643,COMPLETE,0.012726479106479222,0.012621164321899414,0.012894709904988607,0.012663563092549643
22,0.21388333042462668,2025-09-02 13:55:40.844055,2025-09-02 14:01:14.826920,0 days 00:05:33.982865,100,normal,7,zero,,0.4703436211943229,4229,208,480,864,old,0.5855436462786153,tanh,0.00010150008731418185,7.716814676920573e-05,0.00020472208658854166,2.2610028584798176e-05,COMPLETE,0.00010150008731418185,7.716814676920573e-05,0.00020472208658854166,2.2610028584798176e-05
23,0.18066666026910147,2025-09-02 14:01:14.827787,2025-09-02 14:06:48.993405,0 days 00:05:34.165618,100,normal,7,zero,,0.3573052330723529,4288,320,208,880,old,0.6132828112379977,logistic,0.0002523793114556207,2.3523966471354168e-05,-7.2320302327473956e-06,0.0007408459981282552,COMPLETE,0.0002523793114556207,2.3523966471354168e-05,-7.2320302327473956e-06,0.0007408459981282552
24,0.1930999904870987,2025-09-02 14:06:48.993820,2025-09-02 14:12:11.747577,0 days 00:05:22.753757,100,uniform,7,zero,,0.6499464491506096,4460,448,304,960,old,0.7119662043040669,tanh,0.0029377804862128366,3.6954879760742188e-06,3.608067830403646e-05,0.008773565292358398,COMPLETE,0.0029377804862128366,3.6954879760742188e-06,3.608067830403646e-05,0.008773565292358398
25,0.19979999462763467,2025-09-02 14:12:11.747998,2025-09-02 14:17:48.039831,0 days 00:05:36.291833,100,uniform,7,nz,5.464233613178555e-07,0.2366356591415457,906,224,368,976,old,0.7402052845588852,tanh,0.001435014936659071,0.0012775262196858723,0.0013240575790405273,0.0017034610112508137,COMPLETE,0.001435014936659071,0.0012775262196858723,0.0013240575790405273,0.0017034610112508137
26,0.1703666647275289,2025-09-02 14:17:48.040563,2025-09-02 14:23:32.340999,0 days 00:05:44.300436,100,uniform,7,nz,1.2304653476958266e-06,0.10673461250931558,347,224,400,1024,old,0.7630393434537154,tanh,0.006432917382982043,0.005533854166666667,0.00533906618754069,0.00842583179473877,COMPLETE,0.006432917382982043,0.005533854166666667,0.00533906618754069,0.00842583179473877
27,0.009999999776482582,2025-09-02 14:23:32.341453,2025-09-02 14:29:04.107400,0 days 00:05:31.765947,100,uniform,7,zero,,0.9252824924398607,2514,672,416,848,old,0.7493558333538008,tanh,,,,,COMPLETE,,,,
28,0.21209998925526938,2025-09-02 14:29:04.108226,2025-09-02 14:56:16.485946,0 days 00:27:12.377720,20,uniform,7,zero,,0.04452607441386087,4398,320,336,1024,old,0.6973653700565259,tanh,0.001770946714613173,0.001681208610534668,0.0017056465148925781,0.0019259850184122722,COMPLETE,0.001770946714613173,0.001681208610534668,0.0017056465148925781,0.0019259850184122722
29,0.19273332754770914,2025-09-02 14:56:16.486383,2025-09-02 15:22:40.629514,0 days 00:26:24.143131,20,uniform,7,zero,,0.00211257089101996,3182,416,304,960,Glorot,,tanh,0.01249604754977756,0.01234440008799235,0.012689312299092611,0.01245443026224772,COMPLETE,0.01249604754977756,0.01234440008799235,0.012689312299092611,0.01245443026224772
30,0.22459999223550162,2025-09-02 15:22:40.629938,2025-09-02 15:49:23.043116,0 days 00:26:42.413178,20,normal,7,zero,,0.11598922475171783,3487,432,704,960,old,0.7076445593075555,tanh,0.0011431111229790582,0.0010680357615152996,0.0018781026204427083,0.0004831949869791667,COMPLETE,0.0011431111229790582,0.0010680357615152996,0.0018781026204427083,0.0004831949869791667
31,0.2098833272854487,2025-09-02 15:49:23.043851,2025-09-02 16:16:06.747883,0 days 00:26:43.704032,20,normal,7,zero,,0.02901664530632362,5122,496,544,1024,old,0.7152904387098364,tanh,0.0031797091166178384,0.002559622128804525,0.003028432528177897,0.003951072692871094,COMPLETE,0.0031797091166178384,0.002559622128804525,0.003028432528177897,0.003951072692871094
32,0.22783332566420236,2025-09-02 16:16:06.748646,2025-09-02 16:42:39.022208,0 days 00:26:32.273562,20,normal,7,zero,,0.1780137967383491,4296,592,752,1008,old,0.6616530411966719,tanh,0.0006963279512193467,0.00048681100209554035,0.0014589627583821614,0.00014321009318033853,COMPLETE,0.0006963279512193467,0.00048681100209554035,0.0014589627583821614,0.00014321009318033853
33,0.009999999776482582,2025-09-02 16:42:39.022897,2025-09-02 17:09:00.192149,0 days 00:26:21.169252,20,normal,7,zero,,0.9396830397853011,1779,256,944,976,Glorot,,tanh,,,,,COMPLETE,,,,
34,0.20354999601840973,2025-09-02 17:09:00.192597,2025-09-02 17:37:45.477393,0 days 00:28:45.284796,20,uniform,8,nz,4.1711171486290765e-05,0.030020791292167903,4332,416,416,912,old,0.5557324024684777,tanh,0.0031545162200927734,0.00259403387705485,0.002764145533243815,0.004105369249979655,COMPLETE,0.0031545162200927734,0.00259403387705485,0.002764145533243815,0.004105369249979655
35,0.2057833323876063,2025-09-02 17:37:45.477833,2025-09-02 17:43:04.723744,0 days 00:05:19.245911,100,normal,5,zero,,0.6456617844394429,3273,480,848,816,old,0.6346251640797435,tanh,0.0016360680262247722,2.3285547892252605e-05,0.00040594736735026043,0.004478971163431804,COMPLETE,0.0016360680262247722,2.3285547892252605e-05,0.00040594736735026043,0.004478971163431804
36,0.19244999686876932,2025-09-02 17:43:04.724169,2025-09-02 18:09:28.491086,0 days 00:26:23.766917,20,uniform,5,zero,,0.011464043409944268,2659,304,672,1008,old,0.7184677286146602,tanh,0.00873426596323649,0.007939696311950684,0.008726557095845541,0.009536544481913248,COMPLETE,0.00873426596323649,0.007939696311950684,0.008726557095845541,0.009536544481913248
37,0.1688499997059504,2025-09-02 18:09:28.491757,2025-09-02 18:38:05.237775,0 days 00:28:36.746018,20,normal,7,nz,1.0468857528240305e-05,0.009009258351430077,983,624,1008,848,old,0.5107048302748675,tanh,0.011797083748711482,0.012088735898335775,0.01210176944732666,0.011200745900472006,COMPLETE,0.011797083748711482,0.012088735898335775,0.01210176944732666,0.011200745900472006
38,0.23323332766691843,2025-09-02 18:38:05.238210,2025-09-02 19:04:48.477359,0 days 00:26:43.239149,20,normal,6,zero,,0.11300007019653888,8982,800,848,960,old,0.878164505974369,tanh,0.0004955530166625977,0.00039005279541015625,0.0010511080423990886,4.549821217854818e-05,COMPLETE,0.0004955530166625977,0.00039005279541015625,0.0010511080423990886,4.549821217854818e-05
39,0.009999999776482582,2025-09-02 19:04:48.478650,2025-09-02 19:31:53.602495,0 days 00:27:05.123845,20,normal,6,zero,,0.4929174913146222,6009,816,864,928,old,1.2256711116707497,tanh,,,,,COMPLETE,,,,
40,0.20065000156561533,2025-09-02 19:31:53.603224,2025-09-02 19:58:31.291393,0 days 00:26:37.688169,20,normal,8,zero,,0.03945391227899599,1976,208,848,960,old,0.9955755784213782,logistic,0.007433997260199652,0.005743066469828288,0.00916131337483724,0.007397611935933431,COMPLETE,0.007433997260199652,0.005743066469828288,0.00916131337483724,0.007397611935933431
41,0.19468332330385843,2025-09-02 19:58:31.291823,2025-09-02 20:25:33.352241,0 days 00:27:02.060418,20,uniform,7,zero,,0.052797800943738,2046,368,336,896,old,0.7442316614747126,logistic,0.005819651815626357,0.00559226671854655,0.005608558654785156,0.006258130073547363,COMPLETE,0.005819651815626357,0.00559226671854655,0.005608558654785156,0.006258130073547363
42,0.14309999346733093,2025-09-02 20:25:33.352684,2025-09-02 20:31:16.515609,0 days 00:05:43.162925,100,normal,7,zero,,0.003566738301053748,8388,208,688,720,old,0.7841104280335129,tanh,0.008787009451124402,0.0077820618947347,0.009671211242675781,0.008907755215962728,COMPLETE,0.008787009451124402,0.0077820618947347,0.009671211242675781,0.008907755215962728
43,0.1964833289384842,2025-09-02 20:31:16.516365,2025-09-02 20:36:31.898948,0 days 00:05:15.382583,100,normal,7,zero,,0.029014326398984807,2104,816,864,992,old,0.8650641679780061,tanh,0.007921894391377768,0.007599830627441406,0.007700641949971517,0.008465210596720377,COMPLETE,0.007921894391377768,0.007599830627441406,0.007700641949971517,0.008465210596720377
44,0.20639999210834503,2025-09-02 20:36:31.899731,2025-09-02 21:02:56.330120,0 days 00:26:24.430389,20,uniform,7,zero,,0.07697907205318116,1556,800,752,896,Glorot,,tanh,0.004072123103671604,0.0036901235580444336,0.004793087641398112,0.0037331581115722656,COMPLETE,0.004072123103671604,0.0036901235580444336,0.004793087641398112,0.0037331581115722656
45,0.21901666124661764,2025-09-02 21:02:56.330566,2025-09-02 21:29:44.771738,0 days 00:26:48.441172,20,normal,8,zero,,0.13221059229780682,3608,208,208,736,old,0.6099855887671168,tanh,0.0005322032504611545,0.0005823373794555664,0.0007992585500081381,0.00021501382191975912,COMPLETE,0.0005322032504611545,0.0005823373794555664,0.0007992585500081381,0.00021501382191975912
46,0.18481666346391043,2025-09-02 21:29:44.772162,2025-09-02 21:56:10.068279,0 days 00:26:25.296117,20,normal,8,zero,,0.014151996179382642,7708,288,176,528,old,0.4549123791915294,tanh,0.003434048758612739,0.0028874874114990234,0.002666314442952474,0.004748344421386719,COMPLETE,0.003434048758612739,0.0028874874114990234,0.002666314442952474,0.004748344421386719
47,0.1638166606426239,2025-09-02 21:56:10.068709,2025-09-02 22:01:31.769610,0 days 00:05:21.700901,100,normal,5,zero,,0.017244959446569015,4956,192,400,912,Glorot,,tanh,0.003924700948927138,0.0024199088414510093,0.0030445257822672525,0.006309668223063151,COMPLETE,0.003924700948927138,0.0024199088414510093,0.0030445257822672525,0.006309668223063151
48,0.19961666564146677,2025-09-02 22:01:31.770457,2025-09-02 22:06:54.032091,0 days 00:05:22.261634,100,normal,7,zero,,0.16275379768542783,1059,208,544,944,old,1.0053930846549324,tanh,0.0021652777989705405,0.0016674200693766277,0.0018831491470336914,0.0029452641805013022,COMPLETE,0.0021652777989705405,0.0016674200693766277,0.0018831491470336914,0.0029452641805013022
49,0.20268332461516061,2025-09-02 22:06:54.032824,2025-09-02 22:33:10.586145,0 days 00:26:16.553321,20,normal,8,zero,,0.28245211028180106,784,288,256,800,old,0.4810945312040136,tanh,0.00183664427863227,0.00176695982615153,0.002507885297139486,0.0012350877126057942,COMPLETE,0.00183664427863227,0.00176695982615153,0.002507885297139486,0.0012350877126057942
50,0.21428332726160684,2025-09-02 22:33:10.586587,2025-09-02 22:59:26.739536,0 days 00:26:16.152949,20,uniform,8,zero,,0.21918294185194298,5224,144,448,720,Glorot,,tanh,0.00061696105533176,0.00014011065165201822,0.0003101030985514323,0.0014006694157918294,COMPLETE,0.00061696105533176,0.00014011065165201822,0.0003101030985514323,0.0014006694157918294
51,0.009999999776482582,2025-09-02 22:59:26.740399,2025-09-02 23:26:50.476929,0 days 00:27:23.736530,20,uniform,8,zero,,0.4750656681291236,2413,288,640,768,Glorot,,tanh,,,,,COMPLETE,,,,
52,0.19556666413942972,2025-09-02 23:26:50.477366,2025-09-02 23:54:01.295400,0 days 00:27:10.818034,20,uniform,8,zero,,0.01759311384673639,4576,144,400,480,Glorot,,logistic,0.005825016233656141,0.004857897758483887,0.007889191309611002,0.004727959632873535,COMPLETE,0.005825016233656141,0.004857897758483887,0.007889191309611002,0.004727959632873535
53,0.23441665867964426,2025-09-02 23:54:01.295827,2025-09-03 00:21:48.542786,0 days 00:27:47.246959,20,normal,6,nz,1.4055175295203893e-07,0.13479039132010112,8533,304,864,976,old,0.5726511157636197,tanh,0.00030293729570176866,0.0002678235371907552,0.0006229877471923828,1.800060272216797e-05,COMPLETE,0.00030293729570176866,0.0002678235371907552,0.0006229877471923828,1.800060272216797e-05
54,0.009999999776482582,2025-09-03 00:21:48.543523,2025-09-03 00:49:55.200686,0 days 00:28:06.657163,20,normal,6,nz,1.714376722584332e-07,0.3758623161989274,5962,288,464,928,old,0.9891025356282398,tanh,,,,,COMPLETE,,,,
55,0.2216499944527944,2025-09-03 00:49:55.201541,2025-09-03 01:18:07.387218,0 days 00:28:12.185677,20,uniform,6,nz,1.025957411502292e-08,0.018640440219298702,9410,560,960,1024,old,0.20783039489722094,tanh,0.003772113058302138,0.0030257701873779297,0.0037790139516194663,0.004511555035909017,COMPLETE,0.003772113058302138,0.0030257701873779297,0.0037790139516194663,0.004511555035909017
56,0.21518332759539285,2025-09-03 01:18:07.387651,2025-09-03 01:23:38.627710,0 days 00:05:31.240059,100,normal,6,nz,1.1742541418152443e-08,0.05771363482892024,4369,176,976,912,old,0.23588884606901367,tanh,0.0025553438398573133,0.001720706621805827,0.002172708511352539,0.0037726163864135742,COMPLETE,0.0025553438398573133,0.001720706621805827,0.002172708511352539,0.0037726163864135742
57,0.009999999776482582,2025-09-03 01:23:38.628163,2025-09-03 01:50:16.707455,0 days 00:26:38.079292,20,normal,7,zero,,0.4361329415514439,1083,688,768,880,old,0.2309193746048981,tanh,,,,,COMPLETE,,,,
58,0.009999999776482582,2025-09-03 01:50:16.708359,2025-09-03 02:18:16.609683,0 days 00:27:59.901324,20,uniform,6,nz,1.471466897356e-07,0.42637662002847687,8970,288,928,832,old,0.20897382782379484,tanh,,,,,COMPLETE,,,,
59,0.19629999498526254,2025-09-03 02:18:16.610449,2025-09-03 02:46:09.828649,0 days 00:27:53.218200,20,uniform,8,nz,1.011770315762377e-08,0.015117644485805855,2760,640,992,944,old,1.506541115261403,tanh,0.007928066783481175,0.006956060727437337,0.008460601170857748,0.008367538452148438,COMPLETE,0.007928066783481175,0.006956060727437337,0.008460601170857748,0.008367538452148438
