number,value,datetime_start,datetime_complete,duration,params_batch_size,params_dist1,params_iseed,params_l2_penalty_choice,params_l2_penalty_nz,params_lr,params_lr_anneal_start,params_nhid1,params_nhid2,params_nhid3,params_scale_heur1,params_scale_mult1,params_squash,user_attrs_avg_fit_criteria,user_attrs_ed_cl1_mean,user_attrs_ed_cl2_mean,user_attrs_ed_cl3_mean,state,avg_fit_criteria,ed_cl1_mean,ed_cl2_mean,ed_cl3_mean
0,0.7504032452901205,2025-09-02 23:56:51.314900,2025-09-03 00:27:39.915325,0 days 00:30:48.600425,20,uniform,8,nz,0.001976273939677935,0.01888913897506274,548,832,368,368,Glorot,,logistic,0.011353439754909938,0.01231849193572998,0.012519041697184244,0.009222785631815592,COMPLETE,0.011353439754909938,0.01231849193572998,0.012519041697184244,0.009222785631815592
1,0.44606415430704754,2025-09-03 00:27:39.915732,2025-09-03 00:55:21.917072,0 days 00:27:42.001340,20,normal,6,zero,,7.287875536659331e-06,2558,976,720,480,Glorot,,tanh,0.013123273849487305,0.013113141059875488,0.01309374968210856,0.013162930806477865,COMPLETE,0.013123273849487305,0.013113141059875488,0.01309374968210856,0.013162930806477865
2,0.3381766776243846,2025-09-03 00:55:21.918811,2025-09-03 01:01:18.508743,0 days 00:05:56.589932,100,normal,5,nz,0.005659923651826091,0.0024869546064083107,103,736,656,608,Glorot,,logistic,0.013129221068488225,0.013155976931254068,0.013116955757141113,0.013114730517069498,COMPLETE,0.013129221068488225,0.013155976931254068,0.013116955757141113,0.013114730517069498
3,0.1127258042494456,2025-09-03 01:01:18.509121,2025-09-03 01:29:08.730292,0 days 00:27:50.221171,20,uniform,5,zero,,4.392996964391159e-06,286,304,464,176,old,1.048938561776662,logistic,0.013069325023227267,0.012968937555948893,0.013079007466634115,0.013160030047098795,COMPLETE,0.013069325023227267,0.012968937555948893,0.013079007466634115,0.013160030047098795
4,0.7372419635454813,2025-09-03 01:29:08.730680,2025-09-03 01:35:02.832858,0 days 00:05:54.102178,100,uniform,8,nz,2.2013739783605834e-08,0.0014768815514442635,7994,688,768,256,Glorot,,logistic,0.011842277314927844,0.012732505798339844,0.012895305951436361,0.009899020195007324,COMPLETE,0.011842277314927844,0.012732505798339844,0.012895305951436361,0.009899020195007324
5,0.799370805422465,2025-09-03 01:35:02.833733,2025-09-03 01:40:59.687066,0 days 00:05:56.853333,100,normal,8,nz,0.00017344787323769035,0.3329779126931672,5727,624,1008,256,old,1.0240609680153696,logistic,0.0026289357079399955,0.00713046391805013,0.0007625818252563477,-6.238619486490886e-06,COMPLETE,0.0026289357079399955,0.00713046391805013,0.0007625818252563477,-6.238619486490886e-06
6,0.39588700731595355,2025-09-03 01:40:59.687833,2025-09-03 01:46:55.386945,0 days 00:05:55.699112,100,normal,6,nz,2.5689072709426117e-05,5.276847581147895e-05,221,384,256,432,Glorot,,tanh,0.01309086216820611,0.012949069341023764,0.013190269470214844,0.01313324769337972,COMPLETE,0.01309086216820611,0.012949069341023764,0.013190269470214844,0.01313324769337972
7,0.8140967686971029,2025-09-03 01:46:55.387339,2025-09-03 01:52:33.128146,0 days 00:05:37.740807,100,normal,7,zero,,0.045402977968456694,3669,192,416,784,old,0.39496068952891183,logistic,0.00651701291402181,0.005628148714701335,0.005687634150187175,0.00823525587717692,COMPLETE,0.00651701291402181,0.005628148714701335,0.005687634150187175,0.00823525587717692
8,0.11279031882683437,2025-09-03 01:52:33.128853,2025-09-03 01:58:10.828089,0 days 00:05:37.699236,100,uniform,7,zero,,1.9670000815753223e-05,2947,1024,864,624,old,1.7685618590876564,logistic,0.01308747132619222,0.013079245885213217,0.013135155042012533,0.013048013051350912,COMPLETE,0.01308747132619222,0.013079245885213217,0.013135155042012533,0.013048013051350912
9,0.756483773390452,2025-09-03 01:58:10.828497,2025-09-03 02:04:05.543494,0 days 00:05:54.714997,100,normal,7,nz,0.004713238483750317,0.026455682027908503,179,528,144,448,Glorot,,tanh,0.01207858986324734,0.0121840238571167,0.012051622072855631,0.012000123659769693,COMPLETE,0.01207858986324734,0.0121840238571167,0.012051622072855631,0.012000123659769693
10,0.7544516523679098,2025-09-03 02:04:05.543874,2025-09-03 02:33:25.090312,0 days 00:29:19.546438,20,uniform,5,nz,1.7399719380673092e-06,0.0060518290943611325,550,784,768,160,old,1.3898853516952139,tanh,0.012440350320604114,0.01276091734568278,0.012924631436665853,0.011635502179463705,COMPLETE,0.012440350320604114,0.01276091734568278,0.012924631436665853,0.011635502179463705
11,0.11274193227291107,2025-09-03 02:33:25.090717,2025-09-03 02:39:01.133805,0 days 00:05:36.043088,100,normal,6,zero,,0.00018131133577534945,391,688,448,320,Glorot,,logistic,0.013001932038201228,0.013073166211446127,0.012897610664367676,0.013035019238789877,COMPLETE,0.013001932038201228,0.013073166211446127,0.012897610664367676,0.013035019238789877
12,0.7674999833106995,2025-09-03 02:39:01.134202,2025-09-03 02:44:34.788418,0 days 00:05:33.654216,100,uniform,8,zero,,0.002472295306383974,2075,224,384,176,old,0.2686955279215667,tanh,0.012162513203091092,0.012969295183817545,0.012692530949910482,0.010825713475545248,COMPLETE,0.012162513203091092,0.012969295183817545,0.012692530949910482,0.010825713475545248
13,0.8085806568463644,2025-09-03 02:44:34.788791,2025-09-03 03:13:53.095223,0 days 00:29:18.306432,20,uniform,8,nz,1.784055631279747e-08,0.0028909398708427706,5014,896,784,752,old,0.2558892770414504,logistic,0.012229151195949977,0.012796680132548014,0.012490312258402506,0.011400461196899414,COMPLETE,0.012229151195949977,0.012796680132548014,0.012490312258402506,0.011400461196899414
14,0.7442580461502075,2025-09-03 03:13:53.102701,2025-09-03 03:19:26.221028,0 days 00:05:33.118327,100,normal,8,zero,,0.00700610875534594,456,592,912,784,Glorot,,tanh,0.012861821386549207,0.012745817502339682,0.01294259230295817,0.012897054354349772,COMPLETE,0.012861821386549207,0.012745817502339682,0.01294259230295817,0.012897054354349772
15,0.11269354820251465,2025-09-03 03:19:26.221410,2025-09-03 03:24:58.244485,0 days 00:05:32.023075,100,normal,6,zero,,9.318544447640828e-06,368,608,304,272,old,0.4837215553624952,logistic,0.013091007868448893,0.013071815172831217,0.013156612714131674,0.013044595718383789,COMPLETE,0.013091007868448893,0.013071815172831217,0.013156612714131674,0.013044595718383789
16,0.3928062816460927,2025-09-03 03:24:58.245141,2025-09-03 03:52:55.681277,0 days 00:27:57.436136,20,uniform,5,zero,,4.481465560938961e-06,450,928,160,832,old,1.9993692687863487,tanh,0.013094716601901585,0.013103802998860678,0.013032158215840658,0.013148188591003418,COMPLETE,0.013094716601901585,0.013103802998860678,0.013032158215840658,0.013148188591003418
17,0.39417706926663715,2025-09-03 03:52:55.688486,2025-09-03 03:58:32.901564,0 days 00:05:37.213078,100,normal,5,zero,,1.357272557085702e-06,1626,992,592,304,old,1.000636396400883,tanh,0.013089285956488715,0.013098796208699545,0.013136823972066244,0.013032237688700357,COMPLETE,0.013089285956488715,0.013098796208699545,0.013136823972066244,0.013032237688700357
18,0.4387575387954712,2025-09-03 03:58:32.902268,2025-09-03 04:26:16.743155,0 days 00:27:43.840887,20,normal,5,zero,,0.00047629753700197336,299,912,736,192,old,0.9803391648118072,tanh,0.013131419817606607,0.013061801592508951,0.013121724128723145,0.013210733731587728,COMPLETE,0.013131419817606607,0.013061801592508951,0.013121724128723145,0.013210733731587728
19,0.8255967696507772,2025-09-03 04:26:16.744017,2025-09-03 04:55:41.057411,0 days 00:29:24.313394,20,uniform,8,nz,1.3911845869625818e-08,0.005226421886733568,6103,896,976,560,old,0.21738266587211047,logistic,0.011284073193868002,0.012389341990152994,0.011840144793192545,0.009622732798258463,COMPLETE,0.011284073193868002,0.012389341990152994,0.011840144793192545,0.009622732798258463
20,0.6829676628112793,2025-09-03 04:55:41.057794,2025-09-03 05:01:16.247947,0 days 00:05:35.190153,100,normal,6,zero,,0.0010659387498002082,1944,144,464,656,old,0.6027981408370584,logistic,0.01283313168419732,0.013002673784891764,0.01277923583984375,0.012717485427856445,COMPLETE,0.01283313168419732,0.013002673784891764,0.01277923583984375,0.012717485427856445
21,0.8317903478940328,2025-09-03 05:01:16.248649,2025-09-03 05:30:42.460294,0 days 00:29:26.211645,20,uniform,8,nz,1.1387784728834778e-08,0.009253215886896813,4476,1008,944,304,old,0.21020807708245232,logistic,0.01030653052859836,0.01226202646891276,0.0116347074508667,0.007022857666015625,COMPLETE,0.01030653052859836,0.01226202646891276,0.0116347074508667,0.007022857666015625
22,0.0979838694135348,2025-09-03 05:30:42.460691,2025-09-03 05:36:14.875506,0 days 00:05:32.414815,100,normal,7,zero,,0.4703436211943229,4229,208,480,864,old,0.22433440244603844,tanh,,,,,COMPLETE,,,,
23,0.7633225123087565,2025-09-03 05:36:14.875879,2025-09-03 06:05:31.573236,0 days 00:29:16.697357,20,uniform,6,nz,3.024042005450068e-07,0.0014347848552919906,2509,976,928,160,old,0.21602310110290912,logistic,0.011723173989189995,0.013075550397237143,0.013013521830240885,0.009080449740091959,COMPLETE,0.011723173989189995,0.013075550397237143,0.013013521830240885,0.009080449740091959
24,0.7577903072039286,2025-09-03 06:05:31.573647,2025-09-03 06:11:08.728757,0 days 00:05:37.155110,100,normal,5,zero,,0.0060038958728953085,4815,448,288,928,old,0.6338951015648272,logistic,0.011056489414638944,0.011395891507466635,0.010622700055440268,0.011150876681009928,COMPLETE,0.011056489414638944,0.011395891507466635,0.010622700055440268,0.011150876681009928
25,0.41724565128485364,2025-09-03 06:11:08.729150,2025-09-03 06:38:51.409361,0 days 00:27:42.680211,20,normal,7,zero,,0.2277600076918671,5708,480,256,752,old,0.5442183452071427,logistic,0.0022152529822455514,0.0026104052861531577,0.0024872620900472007,0.0015480915705362956,COMPLETE,0.0022152529822455514,0.0026104052861531577,0.0024872620900472007,0.0015480915705362956
26,0.8334354360898336,2025-09-03 06:38:51.410534,2025-09-03 07:06:40.658341,0 days 00:27:49.247807,20,uniform,8,zero,,0.04123240581227863,3534,1024,736,304,old,0.22107122112527072,logistic,0.00810416539510091,0.010054945945739746,0.00922850767771403,0.005029042561848958,COMPLETE,0.00810416539510091,0.010054945945739746,0.00922850767771403,0.005029042561848958
27,0.8323064645131429,2025-09-03 07:06:40.658721,2025-09-03 07:34:29.918241,0 days 00:27:49.259520,20,normal,7,zero,,0.03158674992525858,3984,992,800,224,old,0.24127149023631644,logistic,0.008012599415249294,0.010089635848999023,0.009841362635294596,0.004106799761454265,COMPLETE,0.008012599415249294,0.010089635848999023,0.009841362635294596,0.004106799761454265
28,0.8256128827730814,2025-09-03 07:34:29.919159,2025-09-03 08:02:25.656603,0 days 00:27:55.737444,20,normal,6,zero,,0.11220961958713967,1376,752,624,304,old,0.2190266233343047,logistic,0.00784668657514784,0.00891272226969401,0.009839296340942383,0.004788041114807129,COMPLETE,0.00784668657514784,0.00891272226969401,0.009839296340942383,0.004788041114807129
29,0.8349032600720724,2025-09-03 08:02:25.657003,2025-09-03 08:30:12.578068,0 days 00:27:46.921065,20,normal,7,zero,,0.12272257560798026,9360,976,784,448,Glorot,,logistic,0.002484904395209418,0.0014751752217610676,0.004362742106119792,0.0016167958577473958,COMPLETE,0.002484904395209418,0.0014751752217610676,0.004362742106119792,0.0016167958577473958
30,0.8223709464073181,2025-09-03 08:30:12.578479,2025-09-03 08:58:00.588412,0 days 00:27:48.009933,20,normal,7,zero,,0.11162010161015865,4842,960,816,560,Glorot,,tanh,0.004171874788072375,0.002961834271748861,0.006470441818237305,0.003083348274230957,COMPLETE,0.004171874788072375,0.002961834271748861,0.006470441818237305,0.003083348274230957
31,0.8324354688326517,2025-09-03 08:58:00.588799,2025-09-03 09:03:38.810163,0 days 00:05:38.221364,100,normal,7,zero,,0.08394425123768874,6981,944,832,384,Glorot,,logistic,0.004329548941718207,0.004571278889973958,0.005020340283711751,0.0033970276514689126,COMPLETE,0.004329548941718207,0.004571278889973958,0.005020340283711751,0.0033970276514689126
32,0.8253387014071146,2025-09-03 09:03:38.811117,2025-09-03 09:31:28.334802,0 days 00:27:49.523685,20,uniform,8,zero,,0.15795044731990251,2026,1008,448,192,old,0.7442157494263976,logistic,0.005503667725457086,0.006761590639750163,0.00747831662495931,0.0022710959116617837,COMPLETE,0.005503667725457086,0.006761590639750163,0.00747831662495931,0.0022710959116617837
33,0.8251612583796183,2025-09-03 09:31:28.335730,2025-09-03 09:37:04.738763,0 days 00:05:36.403033,100,normal,7,zero,,0.20887662324131445,4180,672,928,320,Glorot,,logistic,0.002722647455003526,0.0019355614980061848,0.004499077796936035,0.0017333030700683594,COMPLETE,0.002722647455003526,0.0019355614980061848,0.004499077796936035,0.0017333030700683594
34,0.79429030418396,2025-09-03 09:37:04.739570,2025-09-03 10:04:53.004628,0 days 00:27:48.265058,20,normal,7,zero,,0.00529913239115301,3967,784,880,176,old,0.7996266143220239,logistic,0.010041673978169758,0.011682073275248209,0.012309432029724121,0.006133516629536946,COMPLETE,0.010041673978169758,0.011682073275248209,0.012309432029724121,0.006133516629536946
35,0.8341612617174784,2025-09-03 10:04:53.005386,2025-09-03 10:32:42.743569,0 days 00:27:49.738183,20,normal,8,zero,,0.04132485178964373,9240,880,640,528,Glorot,,logistic,0.004817499054802788,0.004252513249715169,0.005002260208129883,0.0051977237065633135,COMPLETE,0.004817499054802788,0.004252513249715169,0.005002260208129883,0.0051977237065633135
36,0.8323064645131429,2025-09-03 10:32:42.744468,2025-09-03 11:00:29.649897,0 days 00:27:46.905429,20,normal,8,zero,,0.0317652729373472,9549,880,656,448,Glorot,,logistic,0.005231923527187772,0.004996101061503093,0.005759874979654948,0.0049397945404052734,COMPLETE,0.005231923527187772,0.004996101061503093,0.005759874979654948,0.0049397945404052734
37,0.7913710077603658,2025-09-03 11:00:29.650296,2025-09-03 11:28:16.751050,0 days 00:27:47.100754,20,normal,7,zero,,0.002544974828371794,9642,944,928,544,Glorot,,logistic,0.011238839891221786,0.011645833651224772,0.012111941973368326,0.009958744049072266,COMPLETE,0.011238839891221786,0.011645833651224772,0.012111941973368326,0.009958744049072266
38,0.8297580679257711,2025-09-03 11:28:16.751926,2025-09-03 11:33:49.490679,0 days 00:05:32.738753,100,normal,8,zero,,0.12583582179607725,4364,928,976,768,Glorot,,logistic,0.005311475859747994,0.0043390194574991865,0.0055866241455078125,0.0060087839762369795,COMPLETE,0.005311475859747994,0.0043390194574991865,0.0055866241455078125,0.0060087839762369795
39,0.7873871127764384,2025-09-03 11:33:49.491085,2025-09-03 12:03:00.426311,0 days 00:29:10.935226,20,normal,5,nz,1.1605767529918994e-05,0.002748309015732894,8718,720,624,752,Glorot,,logistic,0.011497696240743002,0.011504530906677246,0.011946876843770346,0.011041680971781412,COMPLETE,0.011497696240743002,0.011504530906677246,0.011946876843770346,0.011041680971781412
40,0.826741894086202,2025-09-03 12:03:00.426702,2025-09-03 12:08:32.892886,0 days 00:05:32.466184,100,normal,7,zero,,0.0774446701805451,5549,976,416,320,Glorot,,logistic,0.004122138023376465,0.005564371744791667,0.003672321637471517,0.003129720687866211,COMPLETE,0.004122138023376465,0.005564371744791667,0.003672321637471517,0.003129720687866211
41,0.8392096757888794,2025-09-03 12:08:32.893751,2025-09-03 12:36:23.848191,0 days 00:27:50.954440,20,uniform,7,zero,,0.12296632610600329,7608,976,640,496,old,0.6664587479561388,logistic,0.0033716890547010633,0.0026650031407674155,0.004838903745015462,0.0026111602783203125,COMPLETE,0.0033716890547010633,0.0026650031407674155,0.004838903745015462,0.0026111602783203125
42,0.8130806883176168,2025-09-03 12:36:23.848927,2025-09-03 13:04:17.491888,0 days 00:27:53.642961,20,uniform,7,zero,,0.00642759150187072,9838,1008,608,768,old,1.416753786456397,logistic,0.009893165694342718,0.010051250457763672,0.01003281275431315,0.009595433870951334,COMPLETE,0.009893165694342718,0.010051250457763672,0.01003281275431315,0.009595433870951334
43,0.8153871099154154,2025-09-03 13:04:17.492753,2025-09-03 13:32:05.815058,0 days 00:27:48.322305,20,uniform,8,zero,,0.2004034274509473,2761,992,880,144,Glorot,,tanh,0.0032581885655721034,0.0027348995208740234,0.006779710451761882,0.00025995572408040363,COMPLETE,0.0032581885655721034,0.0027348995208740234,0.006779710451761882,0.00025995572408040363
44,0.5938402613004049,2025-09-03 13:32:05.815456,2025-09-03 13:59:52.895384,0 days 00:27:47.079928,20,uniform,7,zero,,0.27865302620951166,2778,976,576,480,Glorot,,logistic,0.0009722444746229384,0.0014938513437906902,0.0003637870152791341,0.001059095064798991,COMPLETE,0.0009722444746229384,0.0014938513437906902,0.0003637870152791341,0.001059095064798991
45,0.0979838694135348,2025-09-03 13:59:52.896536,2025-09-03 14:27:40.232026,0 days 00:27:47.335490,20,normal,8,zero,,0.5057142527304989,5504,1024,640,320,old,0.7584662635509877,tanh,,,,,COMPLETE,,,,
46,0.8321290413538615,2025-09-03 14:27:40.232410,2025-09-03 14:55:10.991851,0 days 00:27:30.759441,20,uniform,7,zero,,0.013399244202938707,8984,912,480,288,old,0.689915140781698,tanh,0.008450852500067817,0.009349544843037924,0.008403698603312174,0.007599314053853353,COMPLETE,0.008450852500067817,0.009349544843037924,0.008403698603312174,0.007599314053853353
47,0.8303225636482239,2025-09-03 14:55:10.992238,2025-09-03 15:00:45.739225,0 days 00:05:34.746987,100,uniform,8,zero,,0.18289056744292348,4624,864,768,352,old,1.3998293351943718,logistic,0.002965092658996582,0.0030886332194010415,0.003768324851989746,0.0020383199055989585,COMPLETE,0.002965092658996582,0.0030886332194010415,0.003768324851989746,0.0020383199055989585
48,0.8484999934832255,2025-09-03 15:00:45.739973,2025-09-03 15:06:16.151679,0 days 00:05:30.411706,100,normal,5,zero,,0.08464141783535714,9247,752,736,560,Glorot,,tanh,0.004752357800801595,0.0037622451782226562,0.00490109125773112,0.005593736966451009,COMPLETE,0.004752357800801595,0.0037622451782226562,0.00490109125773112,0.005593736966451009
49,0.84737096230189,2025-09-03 15:06:16.152074,2025-09-03 15:11:48.202055,0 days 00:05:32.049981,100,uniform,5,zero,,0.17655175169083012,9760,960,672,368,old,1.0806922792888398,tanh,0.0019029511345757379,0.0021739800771077475,0.0020380020141601562,0.0014968713124593098,COMPLETE,0.0019029511345757379,0.0021739800771077475,0.0020380020141601562,0.0014968713124593098
50,0.8508709669113159,2025-09-03 15:11:48.202445,2025-09-03 15:17:23.568262,0 days 00:05:35.365817,100,uniform,5,zero,,0.0770137919754147,9815,816,912,432,old,1.185524570619816,tanh,0.005365610122680664,0.004794398943583171,0.005726138750712077,0.005576292673746745,COMPLETE,0.005365610122680664,0.004794398943583171,0.005726138750712077,0.005576292673746745
51,0.8260644872983297,2025-09-03 15:17:23.569158,2025-09-03 15:22:54.827970,0 days 00:05:31.258812,100,uniform,5,zero,,0.35586125691220527,6471,864,800,512,Glorot,,tanh,0.0011734300189548067,0.0005452235539754232,0.002436677614847819,0.0005383888880411783,COMPLETE,0.0011734300189548067,0.0005452235539754232,0.002436677614847819,0.0005383888880411783
52,0.8395967682202657,2025-09-03 15:22:54.828769,2025-09-03 15:28:26.967073,0 days 00:05:32.138304,100,normal,5,zero,,0.046134581363901084,9898,656,1008,432,old,1.2258553967976353,tanh,0.006785458988613553,0.0050877730051676435,0.007856488227844238,0.007412115732828776,COMPLETE,0.006785458988613553,0.0050877730051676435,0.007856488227844238,0.007412115732828776
53,0.8433870871861776,2025-09-03 15:28:26.967914,2025-09-03 15:34:00.775097,0 days 00:05:33.807183,100,normal,5,zero,,0.061055034883427506,8201,720,832,400,old,1.237111905063735,tanh,0.00593064890967475,0.00466763973236084,0.006652235984802246,0.006472071011861165,COMPLETE,0.00593064890967475,0.00466763973236084,0.006652235984802246,0.006472071011861165
54,0.738967776298523,2025-09-03 15:34:00.776014,2025-09-03 15:39:35.383189,0 days 00:05:34.607175,100,normal,5,zero,,0.0017295417900210178,9688,688,1024,368,old,1.218952491100652,tanh,0.011766486697726779,0.011724630991617838,0.012462536493937174,0.011112292607625326,COMPLETE,0.011766486697726779,0.011724630991617838,0.012462536493937174,0.011112292607625326
55,0.8156773845354716,2025-09-03 15:39:35.384041,2025-09-03 15:45:10.426500,0 days 00:05:35.042459,100,normal,5,zero,,0.022551445658030304,5507,800,608,736,Glorot,,tanh,0.010112841924031576,0.009092132250467936,0.010091543197631836,0.011154850323994955,COMPLETE,0.010112841924031576,0.009092132250467936,0.010091543197631836,0.011154850323994955
56,0.8395321766535441,2025-09-03 15:45:10.427248,2025-09-03 15:50:46.111559,0 days 00:05:35.684311,100,uniform,7,zero,,0.2547434064792482,8737,944,896,384,old,1.1545374014401673,tanh,0.0014268557230631511,0.0012100934982299805,0.002440770467122396,0.0006297032038370768,COMPLETE,0.0014268557230631511,0.0012100934982299805,0.002440770467122396,0.0006297032038370768
57,0.8248386780420939,2025-09-03 15:50:46.112396,2025-09-03 15:56:20.438263,0 days 00:05:34.325867,100,uniform,6,zero,,0.03286488335255236,3311,912,608,320,old,1.2455770883411745,tanh,0.009828911887274848,0.00980075200398763,0.010220090548197428,0.009465893109639486,COMPLETE,0.009828911887274848,0.00980075200398763,0.010220090548197428,0.009465893109639486
58,0.0979838694135348,2025-09-03 15:56:20.438668,2025-09-03 16:01:53.411223,0 days 00:05:32.972555,100,uniform,7,zero,,0.7745282786749261,8900,640,896,288,old,1.1981743257654067,tanh,,,,,COMPLETE,,,,
