number,value,datetime_start,datetime_complete,duration,params_batch_size,params_colnorm_thresh,params_dist1,params_iseed,params_l2_penalty_choice,params_l2_penalty_nz,params_lr,params_lr_anneal_start,params_nhid1,params_nhid2,params_nhid3,params_pca_energy,params_preproc,params_scale_heur1,params_scale_mult1,params_squash,user_attrs_avg_fit_criteria,user_attrs_ed_cl1_mean,user_attrs_ed_cl2_mean,user_attrs_ed_cl3_mean,state,avg_fit_criteria,ed_cl1_mean,ed_cl2_mean,ed_cl3_mean
0,0.10000000149011612,2025-08-24 10:50:03.945166,2025-08-24 11:17:38.688182,0 days 00:27:34.743016,20,,uniform,6,nz,2.408891693835518e-07,1.9068306386240476e-05,800,80,288,512,,raw,Glorot,,logistic,0.012935797373453775,0.012770390510559082,0.013157129287719727,0.01287987232208252,COMPLETE,0.012935797373453775,0.012770390510559082,0.013157129287719727,0.01287987232208252
1,0.19231666326522828,2025-08-24 11:17:38.689729,2025-08-24 11:23:12.188971,0 days 00:05:33.499242,100,,uniform,6,nz,0.0002069877935427099,4.532045798669679e-05,803,224,512,384,,raw,Glorot,,tanh,0.012971464792887369,0.012865233421325683,0.012908220291137695,0.01314094066619873,COMPLETE,0.012971464792887369,0.012865233421325683,0.012908220291137695,0.01314094066619873
2,0.19246666729450226,2025-08-24 11:23:12.189313,2025-08-24 11:49:24.899356,0 days 00:26:12.710043,20,,normal,6,zero,,0.003593917669469153,294,432,16,96,0.7614531005141727,pca,old,0.755934832754835,tanh,0.012383166948954263,0.013088440895080567,0.011709308624267578,0.012351751327514648,COMPLETE,0.012383166948954263,0.013088440895080567,0.011709308624267578,0.012351751327514648
3,0.180649995803833,2025-08-24 11:49:24.899757,2025-08-24 11:54:42.637941,0 days 00:05:17.738184,100,,normal,5,zero,,0.04669620740529656,5948,352,336,320,,raw,old,1.0291345330938984,logistic,0.009974304835001627,0.007699370384216309,0.010342764854431152,0.011880779266357422,COMPLETE,0.009974304835001627,0.007699370384216309,0.010342764854431152,0.011880779266357422
4,0.10000000149011612,2025-08-24 11:54:42.638261,2025-08-24 12:00:15.625254,0 days 00:05:32.986993,100,,normal,5,nz,5.8733668003591766e-08,0.0006009208989093564,129,80,368,848,,raw,old,0.9564623006105633,logistic,0.013102507591247559,0.012831377983093261,0.013230371475219726,0.013245773315429688,COMPLETE,0.013102507591247559,0.012831377983093261,0.013230371475219726,0.013245773315429688
5,0.45643332600593567,2025-08-24 12:00:15.625604,2025-08-24 12:05:45.494784,0 days 00:05:29.869180,100,,normal,6,zero,,0.020672492838662945,4902,48,560,832,0.92848781305588,pca,old,0.9947535368647515,tanh,0.009159668286641437,0.0043318748474121095,0.01101994514465332,0.012127184867858886,COMPLETE,0.009159668286641437,0.0043318748474121095,0.01101994514465332,0.012127184867858886
6,0.311516660451889,2025-08-24 12:05:45.495128,2025-08-24 12:11:14.559403,0 days 00:05:29.064275,100,,normal,8,zero,,0.902290355038375,303,160,32,544,0.531811142849276,pca,Glorot,,tanh,0.004445497194925944,0.0015688180923461915,0.0006035089492797852,0.011164164543151856,COMPLETE,0.004445497194925944,0.0015688180923461915,0.0006035089492797852,0.011164164543151856
7,0.11556666493415832,2025-08-24 12:11:14.559790,2025-08-24 12:16:59.170779,0 days 00:05:44.610989,100,,uniform,8,nz,1.7286821158315726e-07,7.984786193040815e-05,2976,944,32,704,0.5603162141530791,pca,Glorot,,logistic,0.013071378072102865,0.013194727897644042,0.012935948371887208,0.013083457946777344,COMPLETE,0.013071378072102865,0.013194727897644042,0.012935948371887208,0.013083457946777344
8,0.1617499977350235,2025-08-24 12:16:59.172295,2025-08-24 12:43:27.637972,0 days 00:26:28.465677,20,1.0252773110077433e-06,normal,5,zero,,0.010819702277292158,2651,960,400,672,,colnorm,old,0.7176438958158204,logistic,0.013059210777282714,0.013076114654541015,0.01295034885406494,0.013151168823242188,COMPLETE,0.013059210777282714,0.013076114654541015,0.01295034885406494,0.013151168823242188
9,0.15544999837875367,2025-08-24 12:43:27.638385,2025-08-24 12:49:05.145938,0 days 00:05:37.507553,100,,uniform,8,nz,3.0495251798820325e-05,0.07968268616303291,1813,208,320,256,,raw,old,1.432827266708205,tanh,0.012108985582987467,0.011013174057006836,0.012591290473937988,0.012722492218017578,COMPLETE,0.012108985582987467,0.011013174057006836,0.012591290473937988,0.012722492218017578
10,0.23578333258628845,2025-08-24 12:49:05.146327,2025-08-24 13:15:33.199780,0 days 00:26:28.053453,20,,normal,7,zero,,9.278261226540327e-05,117,112,672,320,0.9177342805737674,pca,Glorot,,tanh,0.013012536366780599,0.013018441200256348,0.012916207313537598,0.013102960586547852,COMPLETE,0.013012536366780599,0.013018441200256348,0.012916207313537598,0.013102960586547852
11,0.22943333089351653,2025-08-24 13:15:33.201992,2025-08-24 13:21:07.909303,0 days 00:05:34.707311,100,,normal,6,nz,1.5178620982137476e-05,6.138743611911215e-05,6294,912,336,912,,raw,old,0.4880602306015901,tanh,0.013150548934936524,0.013122749328613282,0.013190913200378417,0.01313798427581787,COMPLETE,0.013150548934936524,0.013122749328613282,0.013190913200378417,0.01313798427581787
12,0.1764666646718979,2025-08-24 13:21:07.911091,2025-08-24 13:47:30.103833,0 days 00:26:22.192742,20,,normal,6,zero,,0.037881959609401966,7519,160,176,64,,raw,Glorot,,logistic,0.00840761661529541,0.0070170402526855465,0.00949687957763672,0.008708930015563965,COMPLETE,0.00840761661529541,0.0070170402526855465,0.00949687957763672,0.008708930015563965
13,0.10000000149011612,2025-08-24 13:47:30.104226,2025-08-24 13:53:18.678754,0 days 00:05:48.574528,100,,normal,7,nz,0.004083646289694694,0.00017587308626797383,3552,896,736,112,0.934529193152835,pca,Glorot,,logistic,0.013099050521850586,0.013157486915588379,0.012990188598632813,0.013149476051330567,COMPLETE,0.013099050521850586,0.013157486915588379,0.012990188598632813,0.013149476051330567
14,0.30964999198913573,2025-08-24 13:53:18.679081,2025-08-24 14:19:37.860023,0 days 00:26:19.180942,20,,normal,6,zero,,0.3044525615065604,204,704,176,352,0.5043995553501397,pca,Glorot,,tanh,0.011408329010009766,0.011718535423278808,0.01086130142211914,0.011645150184631348,COMPLETE,0.011408329010009766,0.011718535423278808,0.01086130142211914,0.011645150184631348
15,0.19744999706745148,2025-08-24 14:19:37.860428,2025-08-24 14:47:31.406276,0 days 00:27:53.545848,20,,uniform,6,nz,4.5217557451024084e-07,0.00024928315599298995,515,512,176,752,,raw,old,1.1709311779111824,tanh,0.013083489735921225,0.012994146347045899,0.013187599182128907,0.013068723678588866,COMPLETE,0.013083489735921225,0.012994146347045899,0.013187599182128907,0.013068723678588866
16,0.20526666343212127,2025-08-24 14:47:31.406677,2025-08-24 14:52:47.211940,0 days 00:05:15.805263,100,,uniform,6,zero,,0.00034912391835984966,2655,1008,352,736,,raw,Glorot,,tanh,0.013103318214416506,0.013225150108337403,0.012916278839111329,0.013168525695800782,COMPLETE,0.013103318214416506,0.013225150108337403,0.012916278839111329,0.013168525695800782
17,0.1632166638970375,2025-08-24 14:52:47.213895,2025-08-24 15:20:38.308406,0 days 00:27:51.094511,20,,normal,6,nz,0.003098891758417325,0.0008440164593981861,1301,912,880,240,0.5561063925658498,pca,old,0.5462544338135313,logistic,0.013293019930521647,0.013141202926635741,0.013225841522216796,0.013512015342712402,COMPLETE,0.013293019930521647,0.013141202926635741,0.013225841522216796,0.013512015342712402
18,0.10000000149011612,2025-08-24 15:20:38.308810,2025-08-24 15:49:26.292826,0 days 00:28:47.984016,20,,uniform,7,nz,0.0012361063948476514,0.00017047912451343645,270,480,992,624,,raw,Glorot,,logistic,0.013092120488484701,0.013156676292419433,0.013073134422302245,0.013046550750732421,COMPLETE,0.013092120488484701,0.013156676292419433,0.013073134422302245,0.013046550750732421
19,0.10000000149011612,2025-08-24 15:49:26.293232,2025-08-24 16:15:39.673973,0 days 00:26:13.380741,20,,normal,8,zero,,0.8186484618563397,3702,224,896,720,,raw,Glorot,,logistic,0.0048694690068562824,0.011200022697448731,0.0008059024810791015,0.0026024818420410157,COMPLETE,0.0048694690068562824,0.011200022697448731,0.0008059024810791015,0.0026024818420410157
20,0.17351666390895842,2025-08-24 16:15:39.674365,2025-08-24 16:21:11.378024,0 days 00:05:31.703659,100,,uniform,6,nz,0.0002247144159652352,0.5824613263289332,1377,96,176,32,,raw,Glorot,,logistic,0.002347437540690104,0.004357028007507324,0.00253753662109375,0.0001477479934692383,COMPLETE,0.002347437540690104,0.004357028007507324,0.00253753662109375,0.0001477479934692383
21,0.20498333275318145,2025-08-24 16:21:11.378343,2025-08-24 16:26:44.341741,0 days 00:05:32.963398,100,,uniform,6,nz,0.0031762322412963125,0.0008525836944886396,895,656,352,992,,raw,old,0.8825031528075136,tanh,0.01301695505777995,0.012961816787719727,0.012932896614074707,0.01315615177154541,COMPLETE,0.01301695505777995,0.012961816787719727,0.012932896614074707,0.01315615177154541
22,0.11463333070278167,2025-08-24 16:26:44.343458,2025-08-24 16:32:10.769720,0 days 00:05:26.426262,100,1.1440763747069189e-09,uniform,6,zero,,0.0013572916218580562,286,1008,1008,560,,colnorm,old,0.6363168365090601,logistic,0.013238906860351562,0.013403773307800293,0.01311807632446289,0.013194870948791505,COMPLETE,0.013238906860351562,0.013403773307800293,0.01311807632446289,0.013194870948791505
23,0.20218332707881928,2025-08-24 16:32:10.770833,2025-08-24 16:37:39.035265,0 days 00:05:28.264432,100,,normal,8,zero,,4.3061830079117834e-05,102,96,800,16,0.9535186884098954,pca,old,0.4229283393084612,tanh,0.011405690511067707,0.013115978240966797,0.013167834281921387,0.007933259010314941,COMPLETE,0.011405690511067707,0.013115978240966797,0.013167834281921387,0.007933259010314941
24,0.23961666822433472,2025-08-24 16:37:39.035646,2025-08-24 17:05:35.845479,0 days 00:27:56.809833,20,5.659468770678343e-08,normal,7,nz,2.972205680742184e-07,6.15282914558757e-06,3796,128,800,288,,colnorm,Glorot,,tanh,0.013120063145955404,0.012875914573669434,0.013164520263671875,0.013319754600524902,COMPLETE,0.013120063145955404,0.012875914573669434,0.013164520263671875,0.013319754600524902
25,0.15239999890327455,2025-08-24 17:05:35.845885,2025-08-24 17:31:53.599395,0 days 00:26:17.753510,20,,normal,5,zero,,0.001237123628998651,4732,752,992,160,,raw,Glorot,,logistic,0.012985952695210775,0.013023829460144043,0.013053798675537109,0.012880229949951172,COMPLETE,0.012985952695210775,0.013023829460144043,0.013053798675537109,0.012880229949951172
26,0.10000000149011612,2025-08-24 17:31:53.599788,2025-08-24 17:59:41.475605,0 days 00:27:47.875817,20,,uniform,6,nz,0.00025273534942158024,1.5444453286934103e-06,443,832,48,704,0.5000924595149698,pca,old,1.6974991883625365,logistic,0.013330411911010741,0.013154315948486327,0.013686370849609376,0.013150548934936524,COMPLETE,0.013330411911010741,0.013154315948486327,0.013686370849609376,0.013150548934936524
27,0.19281666576862336,2025-08-24 17:59:41.476295,2025-08-24 18:27:24.839323,0 days 00:27:43.363028,20,,uniform,5,nz,2.8653067848446513e-08,0.13594321102820803,100,64,960,832,0.5315053238870611,pca,Glorot,,logistic,0.012159085273742676,0.010690784454345703,0.012967348098754883,0.012819123268127442,COMPLETE,0.012159085273742676,0.010690784454345703,0.012967348098754883,0.012819123268127442
28,0.10315000116825104,2025-08-24 18:27:24.839956,2025-08-24 18:32:57.745672,0 days 00:05:32.905716,100,,uniform,8,nz,2.195171270562009e-06,0.00019975831193664464,686,64,592,192,,raw,Glorot,,logistic,0.013108181953430177,0.013024568557739258,0.013239169120788574,0.013060808181762695,COMPLETE,0.013108181953430177,0.013024568557739258,0.013239169120788574,0.013060808181762695
29,0.14335000216960908,2025-08-24 18:32:57.746005,2025-08-24 18:38:30.499967,0 days 00:05:32.753962,100,,uniform,8,nz,1.1354612839945856e-05,5.104214441669944e-05,474,816,576,16,,raw,old,1.84336145631759,tanh,0.012216901779174805,0.013054895401000976,0.013143706321716308,0.01045210361480713,COMPLETE,0.012216901779174805,0.013054895401000976,0.013143706321716308,0.01045210361480713
30,0.2301666647195816,2025-08-24 18:38:30.500347,2025-08-24 19:06:14.306501,0 days 00:27:43.806154,20,,normal,5,nz,3.4666480400355086e-05,3.0590198493981793e-06,1159,1024,560,320,0.5285715720343376,pca,Glorot,,tanh,0.013214461008707684,0.013161993026733399,0.013171863555908204,0.013309526443481445,COMPLETE,0.013214461008707684,0.013161993026733399,0.013171863555908204,0.013309526443481445
31,0.22218332886695863,2025-08-24 19:06:14.308290,2025-08-24 19:11:32.678158,0 days 00:05:18.369868,100,,normal,7,zero,,0.0013178595061205047,329,544,624,736,,raw,Glorot,,tanh,0.013223584493001303,0.013147377967834472,0.013131952285766602,0.013391423225402831,COMPLETE,0.013223584493001303,0.013147377967834472,0.013131952285766602,0.013391423225402831
32,0.10000000149011612,2025-08-24 19:11:32.678498,2025-08-24 19:16:47.021713,0 days 00:05:14.343215,100,,normal,5,zero,,8.060709675998e-05,273,592,848,816,,raw,Glorot,,logistic,0.01307074228922526,0.01301558017730713,0.012954926490783692,0.013241720199584962,COMPLETE,0.01307074228922526,0.01301558017730713,0.012954926490783692,0.013241720199584962
33,0.4219333231449127,2025-08-24 19:16:47.022030,2025-08-24 19:22:16.234343,0 days 00:05:29.212313,100,,uniform,5,zero,,0.3881631908547999,550,656,768,480,0.8360361547567354,pca,old,0.34952059690438664,tanh,0.005436301231384277,0.0023093461990356446,0.0071078062057495115,0.0068917512893676754,COMPLETE,0.005436301231384277,0.0023093461990356446,0.0071078062057495115,0.0068917512893676754
34,0.20796666145324708,2025-08-24 19:22:16.234686,2025-08-24 19:27:43.461485,0 days 00:05:27.226799,100,,normal,5,zero,,1.5698573371230564e-06,9702,16,848,784,0.9554456629821021,pca,old,0.8219145201736515,tanh,0.012583613395690918,0.011878156661987304,0.012910890579223632,0.012961792945861816,COMPLETE,0.012583613395690918,0.011878156661987304,0.012910890579223632,0.012961792945861816
35,0.12233333140611649,2025-08-24 19:27:43.461823,2025-08-24 19:54:07.732699,0 days 00:26:24.270876,20,0.00023030123347169337,uniform,5,zero,,0.00022925779841068158,7530,624,304,272,,colnorm,Glorot,,logistic,0.013043793042500815,0.013106250762939453,0.013074398040771484,0.012950730323791505,COMPLETE,0.013043793042500815,0.013106250762939453,0.013074398040771484,0.012950730323791505
36,0.10000000149011612,2025-08-24 19:54:07.734901,2025-08-24 19:59:47.454658,0 days 00:05:39.719757,100,,uniform,6,nz,0.007026571679037962,0.5761867715961069,345,480,560,336,0.9027008437002731,pca,Glorot,,logistic,0.013011805216471354,0.013127541542053223,0.01308283805847168,0.01282503604888916,COMPLETE,0.013011805216471354,0.013127541542053223,0.01308283805847168,0.01282503604888916
37,0.19418332874774932,2025-08-24 19:59:47.455062,2025-08-24 20:05:04.672293,0 days 00:05:17.217231,100,,uniform,8,zero,,0.04691042508931178,325,320,656,880,,raw,old,0.7969697448675397,logistic,0.012869874636332193,0.012857818603515625,0.01291487216949463,0.012836933135986328,COMPLETE,0.012869874636332193,0.012857818603515625,0.01291487216949463,0.012836933135986328
38,0.10000000149011612,2025-08-24 20:05:04.672645,2025-08-24 20:10:28.757528,0 days 00:05:24.084883,100,1.3392800430171726e-07,uniform,7,zero,,5.181088778462791e-05,1530,624,768,64,,colnorm,old,0.5361051597480313,logistic,0.013173762957255046,0.013143396377563477,0.013022375106811524,0.013355517387390136,COMPLETE,0.013173762957255046,0.013143396377563477,0.013022375106811524,0.013355517387390136
39,0.10000000149011612,2025-08-24 20:10:28.757880,2025-08-24 20:38:08.726115,0 days 00:27:39.968235,20,,uniform,6,nz,2.7074231357934203e-07,2.7495142582401574e-05,3457,528,320,288,,raw,old,0.9842803384827483,logistic,0.013235068321228028,0.013163042068481446,0.013208913803100585,0.01333324909210205,COMPLETE,0.013235068321228028,0.013163042068481446,0.013208913803100585,0.01333324909210205
40,0.10000000149011612,2025-08-24 20:38:08.726517,2025-08-24 21:04:32.192520,0 days 00:26:23.466003,20,,uniform,7,zero,,7.1487242727983216e-06,669,400,672,560,0.733548195301683,pca,Glorot,,logistic,0.013120611508687338,0.013080787658691407,0.013223981857299805,0.013057065010070801,COMPLETE,0.013120611508687338,0.013080787658691407,0.013223981857299805,0.013057065010070801
41,0.10000000149011612,2025-08-24 21:04:32.192931,2025-08-24 21:10:55.707604,0 days 00:06:23.514673,100,,uniform,5,nz,2.172158274853957e-05,4.971380801717752e-05,489,848,896,752,0.6078982381999125,pca,old,1.570720193391757,logistic,0.01314839522043864,0.013199234008789062,0.013074731826782227,0.013171219825744629,COMPLETE,0.01314839522043864,0.013199234008789062,0.013074731826782227,0.013171219825744629
42,0.10000000149011612,2025-08-24 21:10:55.707991,2025-08-24 21:17:27.074928,0 days 00:06:31.366937,100,,normal,6,zero,,5.05629522128911e-05,628,704,16,912,,raw,old,1.6729318569045701,logistic,0.013083624839782712,0.013075613975524902,0.01309044361114502,0.013084816932678222,COMPLETE,0.013083624839782712,0.013075613975524902,0.01309044361114502,0.013084816932678222
43,0.32374998927116394,2025-08-24 21:17:27.075276,2025-08-24 21:24:04.265050,0 days 00:06:37.189774,100,,uniform,7,zero,,0.004181806786036181,9187,128,272,528,0.5725305842963468,pca,old,0.6347679358457043,tanh,0.011955825487772624,0.010638689994812012,0.012520933151245117,0.012707853317260742,COMPLETE,0.011955825487772624,0.010638689994812012,0.012520933151245117,0.012707853317260742
44,0.2426833301782608,2025-08-24 21:24:04.265446,2025-08-24 21:55:47.395881,0 days 00:31:43.130435,20,,uniform,7,nz,2.560791683250174e-08,6.497661227159869e-05,996,448,944,160,0.878173217327606,pca,Glorot,,tanh,0.013031355539957682,0.013020181655883789,0.013002777099609375,0.013071107864379882,COMPLETE,0.013031355539957682,0.013020181655883789,0.013002777099609375,0.013071107864379882
45,0.37646666169166565,2025-08-24 21:55:47.396691,2025-08-24 22:24:09.839648,0 days 00:28:22.442957,20,,uniform,6,nz,4.2668947270063475e-06,0.009261598751419355,1303,240,864,224,0.7526980705455009,pca,old,1.2313563468120658,tanh,0.012388014793395997,0.011824226379394532,0.012798380851745606,0.012541437149047851,COMPLETE,0.012388014793395997,0.011824226379394532,0.012798380851745606,0.012541437149047851
46,0.24016666412353516,2025-08-24 22:24:09.840049,2025-08-24 22:29:54.052701,0 days 00:05:44.212652,100,,uniform,5,nz,3.29024119804691e-08,1.2532733251536745e-06,125,224,896,592,0.9280040816529784,pca,old,1.95298129373683,tanh,0.013057406743367514,0.013071227073669433,0.013066935539245605,0.0130340576171875,COMPLETE,0.013057406743367514,0.013071227073669433,0.013066935539245605,0.0130340576171875
47,0.24023333191871643,2025-08-24 22:29:54.053107,2025-08-24 22:35:23.628264,0 days 00:05:29.575157,100,,normal,5,zero,,0.00011442100841843391,306,128,672,816,0.7013913968225263,pca,old,1.2743207063277995,tanh,0.012930893898010255,0.012782764434814454,0.012915825843811036,0.013094091415405273,COMPLETE,0.012930893898010255,0.012782764434814454,0.012915825843811036,0.013094091415405273
48,0.39374999403953553,2025-08-24 22:35:23.628662,2025-08-24 23:03:07.145176,0 days 00:27:43.516514,20,1.5213799637263695e-05,normal,7,nz,0.00010849668078145311,0.04064835377827358,383,576,496,1008,,colnorm,Glorot,,tanh,0.011230111122131348,0.010654687881469727,0.011155200004577637,0.011880445480346679,COMPLETE,0.011230111122131348,0.010654687881469727,0.011155200004577637,0.011880445480346679
49,0.10000000149011612,2025-08-24 23:03:07.145590,2025-08-24 23:30:58.058495,0 days 00:27:50.912905,20,,uniform,6,nz,0.0007388299612462084,2.6838463465390414e-05,258,192,128,848,,raw,Glorot,,logistic,0.01303396224975586,0.013116288185119628,0.012643170356750489,0.01334242820739746,COMPLETE,0.01303396224975586,0.013116288185119628,0.012643170356750489,0.01334242820739746
50,0.18439999520778655,2025-08-24 23:30:58.058886,2025-08-24 23:58:40.932917,0 days 00:27:42.874031,20,,uniform,8,nz,1.908237513615749e-06,0.009531024033067244,2537,288,272,80,,raw,old,0.27563829445908666,tanh,0.012766901652018228,0.012420964241027833,0.012985825538635254,0.012893915176391602,COMPLETE,0.012766901652018228,0.012420964241027833,0.012985825538635254,0.012893915176391602
51,0.3052333235740662,2025-08-24 23:58:40.934422,2025-08-25 00:04:29.362708,0 days 00:05:48.428286,100,,normal,8,nz,0.0005657840674477493,0.034360924836067806,2216,336,48,592,0.899069644786243,pca,Glorot,,logistic,0.006921958923339844,0.00844120979309082,0.002260279655456543,0.010064387321472168,COMPLETE,0.006921958923339844,0.00844120979309082,0.002260279655456543,0.010064387321472168
52,0.256799989938736,2025-08-25 00:04:29.363256,2025-08-25 00:32:15.715477,0 days 00:27:46.352221,20,,normal,8,nz,1.4738360525117118e-05,0.01606188977318872,768,832,896,544,,raw,Glorot,,logistic,0.012987923622131347,0.012961983680725098,0.01294405460357666,0.013057732582092285,COMPLETE,0.012987923622131347,0.012961983680725098,0.01294405460357666,0.013057732582092285
53,0.10000000149011612,2025-08-25 00:32:15.715871,2025-08-25 00:38:01.867141,0 days 00:05:46.151270,100,6.415696825107625e-08,uniform,6,nz,1.463798032767135e-05,1.8880093046200602e-05,4520,656,624,544,,colnorm,old,0.33226944075447534,logistic,0.013225960731506349,0.013308167457580566,0.013203620910644531,0.013166093826293945,COMPLETE,0.013225960731506349,0.013308167457580566,0.013203620910644531,0.013166093826293945
