number,value,datetime_start,datetime_complete,duration,params_batch_size,params_colnorm_thresh,params_dist1,params_iseed,params_l2_penalty_choice,params_l2_penalty_nz,params_lr,params_lr_anneal_start,params_nhid1,params_nhid2,params_nhid3,params_pca_energy,params_preproc,params_scale_heur1,params_scale_mult1,params_squash,user_attrs_avg_fit_criteria,user_attrs_ed_cl1_mean,user_attrs_ed_cl2_mean,user_attrs_ed_cl3_mean,state,avg_fit_criteria,ed_cl1_mean,ed_cl2_mean,ed_cl3_mean
110,0.18818333148956298,2025-08-25 16:08:04.072515,2025-08-25 16:13:38.506277,0 days 00:05:34.433762,100,5.288336900227144e-06,normal,8,nz,0.004320903968442046,0.0009252907055416628,2001,384,240,800,,colnorm,old,1.328324707500852,logistic,0.01297918160756429,0.012885451316833496,0.013175582885742188,0.012876510620117188,COMPLETE,0.01297918160756429,0.012885451316833496,0.013175582885742188,0.012876510620117188
111,0.1721833288669586,2025-08-25 16:13:38.506637,2025-08-25 16:18:50.018161,0 days 00:05:11.511524,100,,normal,8,zero,,1.0018361779415834e-05,1155,48,656,480,,raw,Glorot,,tanh,0.012865185737609863,0.012299323081970214,0.013150215148925781,0.013146018981933594,COMPLETE,0.012865185737609863,0.012299323081970214,0.013150215148925781,0.013146018981933594
112,0.23451665937900543,2025-08-25 16:18:50.018510,2025-08-25 16:24:10.446176,0 days 00:05:20.427666,100,1.7441656182229607e-05,normal,5,zero,,0.0006707518306306594,499,624,576,192,,colnorm,Glorot,,tanh,0.013103874524434407,0.013145828247070312,0.01314244270324707,0.01302335262298584,COMPLETE,0.013103874524434407,0.013145828247070312,0.01314244270324707,0.01302335262298584
113,0.3935833275318146,2025-08-25 16:24:10.447988,2025-08-25 16:50:42.588294,0 days 00:26:32.140306,20,,uniform,5,zero,,0.28515435148771523,2149,720,304,1008,0.7902953685970416,pca,old,1.9391985264658271,tanh,0.002460432052612305,1.3399124145507813e-05,4.38690185546875e-05,0.007324028015136719,COMPLETE,0.002460432052612305,1.3399124145507813e-05,4.38690185546875e-05,0.007324028015136719
114,0.2183333307504654,2025-08-25 16:50:42.588657,2025-08-25 16:56:00.860811,0 days 00:05:18.272154,100,,normal,5,zero,,0.001234042288951053,5868,112,48,384,0.7471181705245546,pca,old,1.4661189703538995,logistic,0.012904302279154461,0.013139009475708008,0.012150287628173828,0.013423609733581542,COMPLETE,0.012904302279154461,0.013139009475708008,0.012150287628173828,0.013423609733581542
115,0.17623333334922792,2025-08-25 16:56:00.861128,2025-08-25 17:01:15.786464,0 days 00:05:14.925336,100,0.00021678771507405815,uniform,5,zero,,0.011841837603657143,3072,160,848,560,,colnorm,old,1.2288533631939245,logistic,0.012899247805277507,0.012571430206298828,0.012993073463439942,0.01313323974609375,COMPLETE,0.012899247805277507,0.012571430206298828,0.012993073463439942,0.01313323974609375
116,0.22411666810512543,2025-08-25 17:01:15.786780,2025-08-25 17:06:38.341100,0 days 00:05:22.554320,100,,normal,5,nz,2.122958772556124e-05,0.00011245497648023927,4640,496,592,784,,raw,Glorot,,tanh,0.013117829958597818,0.0131927490234375,0.012989997863769531,0.013170742988586425,COMPLETE,0.013117829958597818,0.0131927490234375,0.012989997863769531,0.013170742988586425
117,0.1792833298444748,2025-08-25 17:06:38.341456,2025-08-25 17:32:22.092422,0 days 00:25:43.750966,20,,normal,6,zero,,1.3212306887204596e-05,291,928,320,96,,raw,Glorot,,tanh,0.01327653725941976,0.01333165168762207,0.013248324394226074,0.013249635696411133,COMPLETE,0.01327653725941976,0.01333165168762207,0.013248324394226074,0.013249635696411133
118,0.10018333345651627,2025-08-25 17:32:22.092766,2025-08-25 17:57:52.862904,0 days 00:25:30.770138,20,,normal,6,zero,,0.6676236259928471,4506,304,192,560,,raw,old,1.072007186941979,tanh,,,,,COMPLETE,,,,
119,0.41861666440963746,2025-08-25 17:57:52.863576,2025-08-25 18:23:23.337079,0 days 00:25:30.473503,20,,normal,7,zero,,0.003597926709130101,2116,992,512,880,0.9606516766746219,pca,old,1.0710534244543415,tanh,0.012700200080871582,0.012453484535217284,0.01277766227722168,0.012869453430175782,COMPLETE,0.012700200080871582,0.012453484535217284,0.01277766227722168,0.012869453430175782
120,0.4208166658878326,2025-08-25 18:23:23.337756,2025-08-25 18:28:39.811743,0 days 00:05:16.473987,100,3.788581142616804e-09,uniform,8,zero,,0.006463893771225853,1594,144,896,528,,colnorm,old,1.9268954932258746,tanh,0.012381577491760254,0.01197504997253418,0.0126861572265625,0.012483525276184081,COMPLETE,0.012381577491760254,0.01197504997253418,0.0126861572265625,0.012483525276184081
121,0.41826666593551637,2025-08-25 18:28:39.812107,2025-08-25 18:55:45.969099,0 days 00:27:06.156992,20,,normal,6,nz,1.0680722288043689e-08,0.12364702955414512,195,752,112,272,0.9140263804633988,pca,old,1.4949664316646865,tanh,0.008933647473653156,0.009455490112304687,0.007424283027648926,0.00992116928100586,COMPLETE,0.008933647473653156,0.009455490112304687,0.007424283027648926,0.00992116928100586
122,0.24144999980926513,2025-08-25 18:55:45.969468,2025-08-25 19:22:53.326423,0 days 00:27:07.356955,20,3.182651168708131e-08,uniform,7,nz,0.0009172583772937015,8.532298090996893e-05,374,592,688,256,,colnorm,Glorot,,tanh,0.012940939267476399,0.013077306747436523,0.012800955772399902,0.012944555282592774,COMPLETE,0.012940939267476399,0.013077306747436523,0.012800955772399902,0.012944555282592774
123,0.1894333302974701,2025-08-25 19:22:53.326799,2025-08-25 19:28:07.980679,0 days 00:05:14.653880,100,9.551899663881542e-06,normal,8,zero,,0.0020179188305637146,491,144,240,368,,colnorm,Glorot,,tanh,0.013081852595011392,0.012936758995056152,0.012975478172302246,0.013333320617675781,COMPLETE,0.013081852595011392,0.012936758995056152,0.012975478172302246,0.013333320617675781
124,0.3306666612625122,2025-08-25 19:28:07.981033,2025-08-25 19:53:57.303152,0 days 00:25:49.322119,20,0.0009335783146413682,normal,5,zero,,0.0002524963632971082,9970,32,608,720,,colnorm,old,0.8206984998141482,tanh,0.012469172477722168,0.011541152000427246,0.0129103422164917,0.012956023216247559,COMPLETE,0.012469172477722168,0.011541152000427246,0.0129103422164917,0.012956023216247559
125,0.18921666741371154,2025-08-25 19:53:57.303517,2025-08-25 19:59:02.426310,0 days 00:05:05.122793,100,,normal,7,zero,,0.05966882465794208,130,336,480,832,,raw,old,0.9057823807953762,tanh,0.012831981976826987,0.012467217445373536,0.012981390953063965,0.013047337532043457,COMPLETE,0.012831981976826987,0.012467217445373536,0.012981390953063965,0.013047337532043457
126,0.34033332467079164,2025-08-25 19:59:02.426623,2025-08-25 20:04:20.354325,0 days 00:05:17.927702,100,5.388129518308598e-07,uniform,8,zero,,0.0007985675440229626,6175,784,320,928,,colnorm,old,0.5598299165511067,tanh,0.013034955660502117,0.012946367263793945,0.01307370662689209,0.013084793090820312,COMPLETE,0.013034955660502117,0.012946367263793945,0.01307370662689209,0.013084793090820312
127,0.23696666359901428,2025-08-25 20:04:20.354691,2025-08-25 20:09:52.480709,0 days 00:05:32.126018,100,1.9189470902339894e-06,uniform,6,nz,1.0848962800032886e-05,1.7275482847827764e-05,1004,224,352,848,,colnorm,old,0.8360967564015054,tanh,0.013088274002075196,0.012839078903198242,0.01334395408630371,0.013081789016723633,COMPLETE,0.013088274002075196,0.012839078903198242,0.01334395408630371,0.013081789016723633
