number,value,datetime_start,datetime_complete,duration,params_batch_size,params_dist1,params_iseed,params_l2_penalty_choice,params_l2_penalty_nz,params_lr,params_lr_anneal_start,params_nhid1,params_nhid2,params_nhid3,params_scale_heur1,params_scale_mult1,params_squash,user_attrs_avg_fit_criteria,user_attrs_ed_cl1_mean,user_attrs_ed_cl2_mean,user_attrs_ed_cl3_mean,state,avg_fit_criteria,ed_cl1_mean,ed_cl2_mean,ed_cl3_mean
0,0.9430806438128153,2025-09-03 01:23:42.272259,2025-09-03 01:53:26.128436,0 days 00:29:43.856177,20,uniform,8,nz,0.001976273939677935,0.01888913897506274,548,832,368,368,Glorot,,logistic,0.011017600695292154,0.01239931583404541,0.012356440226236979,0.008297046025594076,COMPLETE,0.011017600695292154,0.01239931583404541,0.012356440226236979,0.008297046025594076
1,0.6618548432985941,2025-09-03 01:53:26.128845,2025-09-03 02:20:57.088190,0 days 00:27:30.959345,20,normal,6,zero,,7.287875536659331e-06,2558,976,720,480,Glorot,,tanh,0.013123114903767904,0.01311333974202474,0.013093392054239908,0.013162612915039062,COMPLETE,0.013123114903767904,0.01311333974202474,0.013093392054239908,0.013162612915039062
2,0.5945964058240255,2025-09-03 02:20:57.088587,2025-09-03 02:26:51.591714,0 days 00:05:54.503127,100,normal,5,nz,0.005659923651826091,0.0024869546064083107,103,736,656,608,Glorot,,logistic,0.013130201233757867,0.013142863909403482,0.013136903444925943,0.013110836346944174,COMPLETE,0.013130201233757867,0.013142863909403482,0.013136903444925943,0.013110836346944174
3,0.14182210465272269,2025-09-03 02:26:51.592077,2025-09-03 02:54:13.488569,0 days 00:27:21.896492,20,uniform,5,zero,,4.392996964391159e-06,286,304,464,176,old,1.048938561776662,logistic,0.013069325023227267,0.012968937555948893,0.013079007466634115,0.013160030047098795,COMPLETE,0.013069325023227267,0.012968937555948893,0.013079007466634115,0.013160030047098795
4,0.9260322054227194,2025-09-03 02:54:13.489599,2025-09-03 03:00:01.541153,0 days 00:05:48.051554,100,uniform,8,nz,2.2013739783605834e-08,0.0014768815514442635,7994,688,768,256,Glorot,,logistic,0.011532637808057996,0.01279123624165853,0.012894431749979654,0.008912245432535807,COMPLETE,0.011532637808057996,0.01279123624165853,0.012894431749979654,0.008912245432535807
5,0.9681612849235535,2025-09-03 03:00:01.541545,2025-09-03 03:05:46.439907,0 days 00:05:44.898362,100,normal,8,nz,0.00017344787323769035,0.3329779126931672,5727,624,1008,256,old,1.0240609680153696,logistic,0.0021984842088487414,0.0014150142669677734,0.005122979482014974,5.745887756347656e-05,COMPLETE,0.0021984842088487414,0.0014150142669677734,0.005122979482014974,5.745887756347656e-05
6,0.6169516841570536,2025-09-03 03:05:46.440290,2025-09-03 03:11:35.360286,0 days 00:05:48.919996,100,normal,6,nz,2.5689072709426117e-05,5.276847581147895e-05,221,384,256,432,Glorot,,tanh,0.013092107243008085,0.012950738271077475,0.013191819190979004,0.013133764266967773,COMPLETE,0.013092107243008085,0.012950738271077475,0.013191819190979004,0.013133764266967773
7,0.9689838687578837,2025-09-03 03:11:35.360652,2025-09-03 03:17:06.409619,0 days 00:05:31.048967,100,normal,7,zero,,0.045402977968456694,3669,192,416,784,old,0.39496068952891183,logistic,0.00954518053266737,0.008961081504821777,0.010149280230204264,0.009525179862976074,COMPLETE,0.00954518053266737,0.008961081504821777,0.010149280230204264,0.009525179862976074
8,0.1723541816075643,2025-09-03 03:17:06.410667,2025-09-03 03:22:37.723559,0 days 00:05:31.312892,100,uniform,7,zero,,1.9670000815753223e-05,2947,1024,864,624,old,1.7685618590876564,logistic,0.013087802463107638,0.01307980219523112,0.013135512669881185,0.013048092524210611,COMPLETE,0.013087802463107638,0.01307980219523112,0.013135512669881185,0.013048092524210611
9,0.9489031632741293,2025-09-03 03:22:37.723942,2025-09-03 03:28:28.384035,0 days 00:05:50.660093,100,normal,7,nz,0.004713238483750317,0.026455682027908503,179,528,144,448,Glorot,,tanh,0.012100855509440104,0.012384374936421713,0.012031833330790201,0.011886358261108398,COMPLETE,0.012100855509440104,0.012384374936421713,0.012031833330790201,0.011886358261108398
10,0.9516290227572123,2025-09-03 03:28:28.384415,2025-09-03 03:57:39.337866,0 days 00:29:10.953451,20,uniform,5,nz,1.7399719380673092e-06,0.0060518290943611325,550,784,768,160,old,1.3898853516952139,tanh,0.01241894563039144,0.012850642204284668,0.012935956319173178,0.01147023836771647,COMPLETE,0.01241894563039144,0.012850642204284668,0.012935956319173178,0.01147023836771647
11,0.14719299723704657,2025-09-03 03:57:39.338819,2025-09-03 04:03:11.936499,0 days 00:05:32.597680,100,normal,6,zero,,0.00018131133577534945,391,688,448,320,Glorot,,logistic,0.013003799650404187,0.013072967529296875,0.012898802757263184,0.013039628664652506,COMPLETE,0.013003799650404187,0.013072967529296875,0.012898802757263184,0.013039628664652506
12,0.9659677346547445,2025-09-03 04:03:11.937547,2025-09-03 04:08:42.301080,0 days 00:05:30.363533,100,uniform,8,zero,,0.002472295306383974,2075,224,384,176,old,0.2686955279215667,tanh,0.012460417217678495,0.013117512067159018,0.012885649998982748,0.011378089586893717,COMPLETE,0.012460417217678495,0.013117512067159018,0.012885649998982748,0.011378089586893717
13,0.9700483679771423,2025-09-03 04:08:42.301839,2025-09-03 04:37:55.613090,0 days 00:29:13.311251,20,uniform,8,nz,1.784055631279747e-08,0.0028909398708427706,5014,896,784,752,old,0.2558892770414504,logistic,0.012437939643859863,0.012917121251424154,0.012810826301574707,0.011585871378580729,COMPLETE,0.012437939643859863,0.012917121251424154,0.012810826301574707,0.011585871378580729
14,0.9397741556167603,2025-09-03 04:37:55.613502,2025-09-03 04:43:29.048771,0 days 00:05:33.435269,100,normal,8,zero,,0.00700610875534594,456,592,912,784,Glorot,,tanh,0.01288759708404541,0.012866695721944174,0.012959162394205729,0.012836933135986328,COMPLETE,0.01288759708404541,0.012866695721944174,0.012959162394205729,0.012836933135986328
15,0.11570962518453598,2025-09-03 04:43:29.049152,2025-09-03 04:48:57.200343,0 days 00:05:28.151191,100,normal,6,zero,,9.318544447640828e-06,368,608,304,272,old,0.4837215553624952,logistic,0.013090901904635958,0.013071656227111816,0.013156572977701822,0.013044476509094238,COMPLETE,0.013090901904635958,0.013071656227111816,0.013156572977701822,0.013044476509094238
16,0.6190968751907349,2025-09-03 04:48:57.200710,2025-09-03 05:16:34.176750,0 days 00:27:36.976040,20,uniform,5,zero,,4.481465560938961e-06,450,928,160,832,old,1.9993692687863487,tanh,0.01309461063808865,0.013103723526000977,0.013031999270121256,0.013148109118143717,COMPLETE,0.01309461063808865,0.013103723526000977,0.013031999270121256,0.013148109118143717
17,0.6238870223363241,2025-09-03 05:16:34.177122,2025-09-03 05:22:05.609857,0 days 00:05:31.432735,100,normal,5,zero,,1.357272557085702e-06,1626,992,592,304,old,1.000636396400883,tanh,0.013089246220058866,0.013098835945129395,0.013136744499206543,0.013032158215840658,COMPLETE,0.013089246220058866,0.013098835945129395,0.013136744499206543,0.013032158215840658
18,0.6752898891766866,2025-09-03 05:22:05.610241,2025-09-03 05:49:37.066699,0 days 00:27:31.456458,20,normal,5,zero,,0.00047629753700197336,299,912,736,192,old,0.9803391648118072,tanh,0.013133804003397623,0.013063470522562662,0.013113458951314291,0.013224482536315918,COMPLETE,0.013133804003397623,0.013063470522562662,0.013113458951314291,0.013224482536315918
19,0.9734838604927063,2025-09-03 05:49:37.067388,2025-09-03 06:18:50.268592,0 days 00:29:13.201204,20,uniform,8,nz,1.3911845869625818e-08,0.005226421886733568,6103,896,976,560,old,0.21738266587211047,logistic,0.011869112650553385,0.012739141782124838,0.01259148120880127,0.010276714960734049,COMPLETE,0.011869112650553385,0.012739141782124838,0.01259148120880127,0.010276714960734049
20,0.9779677192370096,2025-09-03 06:18:50.269469,2025-09-03 06:47:49.243197,0 days 00:28:58.973728,20,uniform,8,nz,1.2199588059394355e-08,0.0769650793161218,4928,1024,736,688,old,0.24741824076349528,tanh,0.008823129865858289,0.008345325787862143,0.0092392365137736,0.008884827295939127,COMPLETE,0.008823129865858289,0.008345325787862143,0.0092392365137736,0.008884827295939127
21,0.9785161217053732,2025-09-03 06:47:49.243576,2025-09-03 07:17:11.893584,0 days 00:29:22.650008,20,uniform,8,nz,1.1050555782101909e-08,0.0732601658766065,3972,1024,816,416,old,0.21092727299959588,tanh,0.009215606583489314,0.009209950764973959,0.009888052940368652,0.008548816045125326,COMPLETE,0.009215606583489314,0.009209950764973959,0.009888052940368652,0.008548816045125326
22,0.0983548363049825,2025-09-03 07:17:11.894318,2025-09-03 07:46:09.940175,0 days 00:28:58.045857,20,uniform,8,nz,1.0008105235130407e-08,0.3561370975222723,6039,912,608,528,old,0.22437211919835556,tanh,,,,,COMPLETE,,,,
23,0.8806451161702474,2025-09-03 07:46:09.941095,2025-09-03 08:15:14.734863,0 days 00:29:04.793768,20,normal,8,nz,2.1724727094947852e-07,7.461180237421455e-05,3625,896,816,336,old,0.21604829310903279,tanh,0.013114200698004827,0.013142863909403482,0.013083259264628092,0.01311647891998291,COMPLETE,0.013114200698004827,0.013142863909403482,0.013083259264628092,0.01311647891998291
24,0.9743225574493408,2025-09-03 08:15:14.737199,2025-09-03 08:21:03.241092,0 days 00:05:48.503893,100,uniform,6,nz,1.0717217503998855e-08,0.0896330727305625,1557,928,1008,784,old,0.6893877384582874,tanh,0.012033475769890679,0.011804739634195963,0.01208500067392985,0.012210687001546225,COMPLETE,0.012033475769890679,0.011804739634195963,0.01208500067392985,0.012210687001546225
25,0.600773274898529,2025-09-03 08:21:03.241505,2025-09-03 08:26:53.084374,0 days 00:05:49.842869,100,uniform,6,nz,1.3716432862317632e-07,0.23210393500585524,882,1008,848,912,old,0.6928605699074127,logistic,0.0017036332024468316,0.0033516486485799155,0.0013054211934407551,0.0004538297653198242,COMPLETE,0.0017036332024468316,0.0033516486485799155,0.0013054211934407551,0.0004538297653198242
26,0.9721290071805319,2025-09-03 08:26:53.085190,2025-09-03 08:32:45.390301,0 days 00:05:52.305111,100,uniform,6,nz,1.0809382140996923e-08,0.0670758723724561,2143,848,912,448,Glorot,,tanh,0.011422846052381726,0.01102292537689209,0.01187745730082194,0.011368155479431152,COMPLETE,0.011422846052381726,0.01102292537689209,0.01187745730082194,0.011368155479431152
27,0.9727096358935038,2025-09-03 08:32:45.390671,2025-09-03 08:38:18.817376,0 days 00:05:33.426705,100,normal,6,zero,,0.05360597997431262,2066,976,944,624,old,0.6712031644067326,tanh,0.012033820152282715,0.011825124422709147,0.0122298002243042,0.012046535809834799,COMPLETE,0.012033820152282715,0.011825124422709147,0.0122298002243042,0.012046535809834799
28,0.0983548363049825,2025-09-03 08:38:18.818249,2025-09-03 09:07:30.345464,0 days 00:29:11.527215,20,uniform,6,nz,2.628287110384574e-07,0.47818197882273716,6952,896,1024,752,old,0.6358716304236434,tanh,,,,,COMPLETE,,,,
29,0.0983548363049825,2025-09-03 09:07:30.346166,2025-09-03 09:13:18.272150,0 days 00:05:47.925984,100,uniform,7,nz,1.0410866173663327e-08,0.45530615007920633,1239,1008,1024,768,old,0.6408877058329099,tanh,,,,,COMPLETE,,,,
30,0.9304838180541992,2025-09-03 09:13:18.272880,2025-09-03 09:41:00.481847,0 days 00:27:42.208967,20,uniform,8,zero,,0.0018545118595187854,470,992,912,464,old,0.5052318244161386,tanh,0.012991031010945639,0.013024489084879557,0.013062318166097006,0.012886285781860352,COMPLETE,0.012991031010945639,0.013024489084879557,0.013062318166097006,0.012886285781860352
31,0.9620644847551981,2025-09-03 09:41:00.482792,2025-09-03 10:10:14.767983,0 days 00:29:14.285191,20,uniform,5,nz,1.1886993422027152e-08,0.0007952162528827754,6021,528,848,448,old,0.2155654616891939,logistic,0.01248810026380751,0.013056596120198568,0.012933810551961264,0.011473894119262695,COMPLETE,0.01248810026380751,0.013056596120198568,0.012933810551961264,0.011473894119262695
32,0.974919339021047,2025-09-03 10:10:14.768416,2025-09-03 10:39:24.730330,0 days 00:29:09.961914,20,uniform,8,nz,1.0624835593697424e-08,0.020195418612996972,4434,1008,800,272,old,0.22004389835040766,logistic,0.00993531280093723,0.012091279029846191,0.011652112007141113,0.006062547365824382,COMPLETE,0.00993531280093723,0.012091279029846191,0.011652112007141113,0.006062547365824382
33,0.9688870906829834,2025-09-03 10:39:24.734481,2025-09-03 11:08:36.093989,0 days 00:29:11.359508,20,uniform,5,nz,1.1037019596113844e-08,0.10601147804334372,1428,960,928,240,Glorot,,logistic,0.007768167389763727,0.008991440137227377,0.010759790738423666,0.0035532712936401367,COMPLETE,0.007768167389763727,0.008991440137227377,0.010759790738423666,0.0035532712936401367
34,0.974483847618103,2025-09-03 11:08:36.094374,2025-09-03 11:14:24.633939,0 days 00:05:48.539565,100,uniform,6,nz,1.590411563528284e-07,0.05412188820561779,3714,1024,864,208,old,0.23239493497600297,logistic,0.009381108813815646,0.01211241881052653,0.011472582817077637,0.0045583248138427734,COMPLETE,0.009381108813815646,0.01211241881052653,0.011472582817077637,0.0045583248138427734
35,0.9741612871487936,2025-09-03 11:14:24.634331,2025-09-03 11:20:20.026637,0 days 00:05:55.392306,100,uniform,6,nz,2.803915822846318e-07,0.0648825754609114,3421,816,960,192,old,0.21968078852570655,logistic,0.009107311566670736,0.011689384778340658,0.011438886324564615,0.004193663597106934,COMPLETE,0.009107311566670736,0.011689384778340658,0.011438886324564615,0.004193663597106934
36,0.9738709529240926,2025-09-03 11:20:20.027018,2025-09-03 11:26:15.088794,0 days 00:05:55.061776,100,uniform,7,nz,2.981727676493295e-07,0.01716293074206971,1442,1008,544,400,old,0.20175126940689433,logistic,0.011700060632493762,0.012887239456176758,0.012744744618733725,0.0094681978225708,COMPLETE,0.011700060632493762,0.012887239456176758,0.012744744618733725,0.0094681978225708
37,0.9745161135991415,2025-09-03 11:26:15.089170,2025-09-03 11:55:17.507657,0 days 00:29:02.418487,20,uniform,8,nz,1.7585559295284172e-07,0.07499934669416984,3785,912,832,128,old,0.20032832691435865,logistic,0.00711124473147922,0.00901357332865397,0.010465025901794434,0.0018551349639892578,COMPLETE,0.00711124473147922,0.00901357332865397,0.010465025901794434,0.0018551349639892578
38,0.9745483795801798,2025-09-03 11:55:17.508054,2025-09-03 12:24:10.310291,0 days 00:28:52.802237,20,uniform,8,nz,1.7544096379307932e-07,0.03769833361941534,1970,800,896,128,old,0.20977184115179123,logistic,0.009022858407762315,0.011849045753479004,0.011936187744140625,0.003283341725667318,COMPLETE,0.009022858407762315,0.011849045753479004,0.011936187744140625,0.003283341725667318
39,0.978499968846639,2025-09-03 12:24:10.311263,2025-09-03 12:53:19.966941,0 days 00:29:09.655678,20,normal,7,nz,3.138773677755063e-06,0.024995109306696437,6412,880,864,496,old,0.4697428562989502,tanh,0.010843687587314181,0.010613242785135904,0.01117845376332601,0.010739366213480631,COMPLETE,0.010843687587314181,0.010613242785135904,0.01117845376332601,0.010739366213480631
40,0.9731935063997904,2025-09-03 12:53:19.967659,2025-09-03 13:22:29.876498,0 days 00:29:09.908839,20,normal,7,nz,8.596092432803028e-06,0.004672102523429287,8890,992,752,480,old,0.5970273524592414,tanh,0.012203229798210992,0.01226202646891276,0.012524644533793131,0.011823018391927084,COMPLETE,0.012203229798210992,0.01226202646891276,0.012524644533793131,0.011823018391927084
41,0.9639838536580404,2025-09-03 13:22:29.877329,2025-09-03 13:49:55.735290,0 days 00:27:25.857961,20,uniform,8,zero,,0.001899338455899463,6042,992,576,384,old,0.40542431323143713,logistic,0.011842423015170628,0.012973388036092123,0.012744744618733725,0.009809136390686035,COMPLETE,0.011842423015170628,0.012973388036092123,0.012744744618733725,0.009809136390686035
42,0.9772419134775797,2025-09-03 13:49:55.735683,2025-09-03 14:17:23.576787,0 days 00:27:27.841104,20,uniform,8,zero,,0.043652531118663254,8516,1008,896,288,Glorot,,tanh,0.007977472411261665,0.007836580276489258,0.009126106897989908,0.006969730059305827,COMPLETE,0.007977472411261665,0.007836580276489258,0.009126106897989908,0.006969730059305827
43,0.9770322442054749,2025-09-03 14:17:23.577650,2025-09-03 14:44:56.458292,0 days 00:27:32.880642,20,uniform,8,zero,,0.1829905069037833,7718,896,976,304,Glorot,,tanh,0.0028230084313286678,0.0016608635584513347,0.005644599596659343,0.0011635621388753254,COMPLETE,0.0028230084313286678,0.0016608635584513347,0.005644599596659343,0.0011635621388753254
44,0.9676290154457092,2025-09-03 14:44:56.459115,2025-09-03 15:12:17.888610,0 days 00:27:21.429495,20,uniform,8,zero,,0.00268868733899442,7770,864,896,224,Glorot,,tanh,0.01183244917127821,0.012365023295084635,0.012606183687845865,0.010526140530904135,COMPLETE,0.01183244917127821,0.012365023295084635,0.012606183687845865,0.010526140530904135
45,0.9759999910990397,2025-09-03 15:12:17.888986,2025-09-03 15:41:16.264320,0 days 00:28:58.375334,20,normal,8,nz,4.917394496986648e-06,0.02096271666946105,7149,880,944,672,Glorot,,tanh,0.010726730028788248,0.009896318117777506,0.011131564776102701,0.011152307192484537,COMPLETE,0.010726730028788248,0.009896318117777506,0.011131564776102701,0.011152307192484537
46,0.0983548363049825,2025-09-03 15:41:16.264701,2025-09-03 16:08:47.478250,0 days 00:27:31.213549,20,uniform,7,zero,,0.6057513786215397,3097,784,864,224,Glorot,,tanh,,,,,COMPLETE,,,,
47,0.0983548363049825,2025-09-03 16:08:47.478910,2025-09-03 16:36:28.371372,0 days 00:27:40.892462,20,normal,8,zero,,0.3242996349611954,2204,1024,976,384,Glorot,,tanh,,,,,COMPLETE,,,,
48,0.9745806455612183,2025-09-03 16:36:28.371756,2025-09-03 16:41:59.033024,0 days 00:05:30.661268,100,uniform,8,zero,,0.055726501948655124,6151,976,1024,416,Glorot,,tanh,0.011124783092074925,0.010775526364644369,0.011720975240071615,0.010877847671508789,COMPLETE,0.011124783092074925,0.010775526364644369,0.011720975240071615,0.010877847671508789
49,0.9729838569959005,2025-09-03 16:41:59.033408,2025-09-03 16:47:47.552487,0 days 00:05:48.519079,100,uniform,5,nz,0.00010381092545638646,0.2456791522825677,9857,960,672,720,old,1.3769768976858248,tanh,0.0028788116243150495,0.002578894297281901,0.0028373003005981445,0.003220240275065104,COMPLETE,0.0028788116243150495,0.002578894297281901,0.0028373003005981445,0.003220240275065104
50,0.9784516096115112,2025-09-03 16:47:47.553050,2025-09-03 17:15:30.728374,0 days 00:27:43.175324,20,uniform,8,zero,,0.07866994348981247,9765,768,1024,384,old,0.7735557224408642,tanh,0.006162285804748535,0.004891633987426758,0.008248329162597656,0.005346894264221191,COMPLETE,0.006162285804748535,0.004891633987426758,0.008248329162597656,0.005346894264221191
51,0.0983548363049825,2025-09-03 17:15:30.728747,2025-09-03 17:43:07.074932,0 days 00:27:36.346185,20,uniform,8,zero,,0.33919645565835266,3615,816,1008,448,old,0.8558607631218835,tanh,,,,,COMPLETE,,,,
52,0.9781290292739868,2025-09-03 17:43:07.075316,2025-09-03 18:10:40.464149,0 days 00:27:33.388833,20,normal,8,zero,,0.046835690260754306,9898,608,1024,400,old,0.698130290792233,tanh,0.007669832971360949,0.0062760114669799805,0.009123285611470541,0.007610201835632324,COMPLETE,0.007669832971360949,0.0062760114669799805,0.009123285611470541,0.007610201835632324
53,0.9779838522275289,2025-09-03 18:10:40.464736,2025-09-03 18:38:11.702938,0 days 00:27:31.238202,20,normal,8,zero,,0.06172140839156036,8201,672,848,368,old,0.8574212391380086,tanh,0.006695124838087294,0.005527695020039876,0.008250157038370768,0.006307522455851237,COMPLETE,0.006695124838087294,0.005527695020039876,0.008250157038370768,0.006307522455851237
54,0.9667258063952128,2025-09-03 18:38:11.703340,2025-09-03 19:05:44.275297,0 days 00:27:32.571957,20,normal,5,zero,,0.0017528318418192628,9688,640,1024,336,old,0.8950285571291356,tanh,0.01216382450527615,0.012359420458475748,0.012722174326578775,0.011409878730773926,COMPLETE,0.01216382450527615,0.012359420458475748,0.012722174326578775,0.011409878730773926
55,0.9768548607826233,2025-09-03 19:05:44.275668,2025-09-03 19:33:19.637197,0 days 00:27:35.361529,20,normal,8,zero,,0.02833301383140141,7570,704,704,544,old,0.9078337238134404,tanh,0.00961254702674018,0.008756001790364584,0.010024825731913248,0.010056813557942709,COMPLETE,0.00961254702674018,0.008756001790364584,0.010024825731913248,0.010056813557942709
56,0.972145140171051,2025-09-03 19:33:19.637571,2025-09-03 19:38:52.634078,0 days 00:05:32.996507,100,normal,8,zero,,0.034238274266989506,4144,592,1008,256,old,0.7727440289980181,tanh,0.011325518290201822,0.011410951614379883,0.012342492739359537,0.010223110516866049,COMPLETE,0.011325518290201822,0.011410951614379883,0.012342492739359537,0.010223110516866049
57,0.0983548363049825,2025-09-03 19:38:52.634616,2025-09-03 20:07:52.009589,0 days 00:28:59.374973,20,normal,8,nz,3.240518429404852e-06,0.31764773178812433,1011,976,832,368,old,0.6667882953058719,tanh,,,,,COMPLETE,,,,
58,0.0983548363049825,2025-09-03 20:07:52.009979,2025-09-03 20:35:20.797530,0 days 00:27:28.787551,20,normal,8,zero,,0.6232725177619131,8834,400,864,272,old,1.0602970477296227,tanh,,,,,COMPLETE,,,,
59,0.9762096603711446,2025-09-03 20:35:20.797920,2025-09-03 20:41:07.741823,0 days 00:05:46.943903,100,uniform,8,nz,3.7040401720439102e-06,0.21180382432342582,3351,1024,912,304,old,0.6411440028456636,tanh,0.008799738354153104,0.008780837059020996,0.009418129920959473,0.008200248082478842,COMPLETE,0.008799738354153104,0.008780837059020996,0.009418129920959473,0.008200248082478842
