number,value,datetime_start,datetime_complete,duration,params_batch_size,params_colnorm_thresh,params_dist1,params_iseed,params_l2_penalty_choice,params_l2_penalty_nz,params_lr,params_lr_anneal_start,params_nhid1,params_nhid2,params_nhid3,params_pca_energy,params_preproc,params_scale_heur1,params_scale_mult1,params_squash,user_attrs_avg_fit_criteria,user_attrs_ed_cl1_mean,user_attrs_ed_cl2_mean,user_attrs_ed_cl3_mean,state,avg_fit_criteria,ed_cl1_mean,ed_cl2_mean,ed_cl3_mean
112,0.20753226578235626,2025-08-25 17:55:37.892864,2025-08-25 18:00:58.827765,0 days 00:05:20.934901,100,1.7441656182229607e-05,normal,5,zero,,0.0006707518306306594,499,624,576,192,,colnorm,Glorot,,tanh,0.013221589724222818,0.01316537857055664,0.013024735450744628,0.013474655151367188,COMPLETE,0.013221589724222818,0.01316537857055664,0.013024735450744628,0.013474655151367188
113,0.09835484176874161,2025-08-25 18:00:58.828045,2025-08-25 18:27:14.608047,0 days 00:26:15.780002,20,,uniform,5,zero,,0.28515435148771523,2149,720,304,1008,0.7902953685970416,pca,old,1.9391985264658271,tanh,,,,,COMPLETE,,,,
114,0.11251613348722458,2025-08-25 18:27:14.608408,2025-08-25 18:32:29.890931,0 days 00:05:15.282523,100,,normal,5,zero,,0.001234042288951053,5868,112,48,384,0.7471181705245546,pca,old,1.4661189703538995,logistic,0.012786221504211425,0.012860703468322753,0.012138628959655761,0.013359332084655761,COMPLETE,0.012786221504211425,0.012860703468322753,0.012138628959655761,0.013359332084655761
115,0.11251613348722458,2025-08-25 18:32:29.891201,2025-08-25 18:37:46.391894,0 days 00:05:16.500693,100,0.00021678771507405815,uniform,5,zero,,0.011841837603657143,3072,160,848,560,,colnorm,old,1.2288533631939245,logistic,0.013283069928487143,0.013409852981567383,0.013149690628051759,0.013289666175842286,COMPLETE,0.013283069928487143,0.013409852981567383,0.013149690628051759,0.013289666175842286
116,0.2143709748983383,2025-08-25 18:37:46.392171,2025-08-25 18:43:17.149553,0 days 00:05:30.757382,100,,normal,5,nz,2.122958772556124e-05,0.00011245497648023927,4640,496,592,784,,raw,Glorot,,tanh,0.013111201922098796,0.012917637825012207,0.013211655616760253,0.013204312324523926,COMPLETE,0.013111201922098796,0.012917637825012207,0.013211655616760253,0.013204312324523926
117,0.11251613348722458,2025-08-25 18:43:17.149828,2025-08-25 19:09:24.805125,0 days 00:26:07.655297,20,,normal,6,zero,,1.3212306887204596e-05,291,928,320,96,,raw,Glorot,,tanh,0.012756840387980145,0.013002538681030273,0.013003921508789063,0.012264060974121093,COMPLETE,0.012756840387980145,0.013002538681030273,0.013003921508789063,0.012264060974121093
118,0.09835484176874161,2025-08-25 19:09:24.805463,2025-08-25 19:35:27.399291,0 days 00:26:02.593828,20,,normal,6,zero,,0.6676236259928471,4506,304,192,560,,raw,old,1.072007186941979,tanh,,,,,COMPLETE,,,,
119,0.9317742466926575,2025-08-25 19:35:27.399637,2025-08-25 20:01:17.728932,0 days 00:25:50.329295,20,,normal,7,zero,,0.003597926709130101,2116,992,512,880,0.9606516766746219,pca,old,1.0710534244543415,tanh,0.012399617830912271,0.012481355667114257,0.012278580665588379,0.01243891716003418,COMPLETE,0.012399617830912271,0.012481355667114257,0.012278580665588379,0.01243891716003418
120,0.9288387298583984,2025-08-25 20:01:17.729710,2025-08-25 20:06:36.008420,0 days 00:05:18.278710,100,3.788581142616804e-09,uniform,8,zero,,0.006463893771225853,1594,144,896,528,,colnorm,old,1.9268954932258746,tanh,0.011824512481689453,0.010632944107055665,0.012540745735168456,0.012299847602844239,COMPLETE,0.011824512481689453,0.010632944107055665,0.012540745735168456,0.012299847602844239
121,0.9550323009490966,2025-08-25 20:06:36.008728,2025-08-25 20:34:08.969422,0 days 00:27:32.960694,20,,normal,6,nz,1.0680722288043689e-08,0.12364702955414512,195,752,112,272,0.9140263804633988,pca,old,1.4949664316646865,tanh,0.009485793113708495,0.010175633430480956,0.008485817909240722,0.009795928001403808,COMPLETE,0.009485793113708495,0.010175633430480956,0.008485817909240722,0.009795928001403808
122,0.20620968341827392,2025-08-25 20:34:08.969788,2025-08-25 21:02:12.879598,0 days 00:28:03.909810,20,3.182651168708131e-08,uniform,7,nz,0.0009172583772937015,8.532298090996893e-05,374,592,688,256,,colnorm,Glorot,,tanh,0.012988670667012531,0.01316523551940918,0.012905144691467285,0.012895631790161132,COMPLETE,0.012988670667012531,0.01316523551940918,0.012905144691467285,0.012895631790161132
123,0.34764516949653623,2025-08-25 21:02:12.879947,2025-08-25 21:07:28.643519,0 days 00:05:15.763572,100,9.551899663881542e-06,normal,8,zero,,0.0020179188305637146,491,144,240,368,,colnorm,Glorot,,tanh,0.012951970100402832,0.012746453285217285,0.012947797775268555,0.013161659240722656,COMPLETE,0.012951970100402832,0.012746453285217285,0.012947797775268555,0.013161659240722656
124,0.8382742285728455,2025-08-25 21:07:28.645549,2025-08-25 21:34:55.375943,0 days 00:27:26.730394,20,0.0009335783146413682,normal,5,zero,,0.0002524963632971082,9970,32,608,720,,colnorm,old,0.8206984998141482,tanh,0.011449209849039714,0.00863034725189209,0.012777972221374511,0.01293931007385254,COMPLETE,0.011449209849039714,0.00863034725189209,0.012777972221374511,0.01293931007385254
125,0.894161331653595,2025-08-25 21:34:55.377819,2025-08-25 21:40:23.351238,0 days 00:05:27.973419,100,,normal,7,zero,,0.05966882465794208,130,336,480,832,,raw,old,0.9057823807953762,tanh,0.012256860733032227,0.01172184944152832,0.012188863754272462,0.012859869003295898,COMPLETE,0.012256860733032227,0.01172184944152832,0.012188863754272462,0.012859869003295898
126,0.8686935782432557,2025-08-25 21:40:23.351526,2025-08-25 21:45:43.516658,0 days 00:05:20.165132,100,5.388129518308598e-07,uniform,8,zero,,0.0007985675440229626,6175,784,320,928,,colnorm,old,0.5598299165511067,tanh,0.012754424413045246,0.01304643154144287,0.012558174133300782,0.01265866756439209,COMPLETE,0.012754424413045246,0.01304643154144287,0.012558174133300782,0.01265866756439209
127,0.2206451714038849,2025-08-25 21:45:43.516933,2025-08-25 21:51:16.229984,0 days 00:05:32.713051,100,1.9189470902339894e-06,uniform,6,nz,1.0848962800032886e-05,1.7275482847827764e-05,1004,224,352,848,,colnorm,old,0.8360967564015054,tanh,0.013153425852457682,0.013043856620788575,0.013218426704406738,0.013197994232177735,COMPLETE,0.013153425852457682,0.013043856620788575,0.013218426704406738,0.013197994232177735
