number,value,datetime_start,datetime_complete,duration,params_batch_size,params_colnorm_thresh,params_dist1,params_iseed,params_l2_penalty_choice,params_l2_penalty_nz,params_lr,params_lr_anneal_start,params_nhid1,params_nhid2,params_nhid3,params_pca_energy,params_preproc,params_scale_heur1,params_scale_mult1,params_squash,user_attrs_avg_fit_criteria,user_attrs_ed_cl1_mean,user_attrs_ed_cl2_mean,user_attrs_ed_cl3_mean,state,avg_fit_criteria,ed_cl1_mean,ed_cl2_mean,ed_cl3_mean
0,0.11251613348722458,2025-08-24 10:50:02.864614,2025-08-24 11:23:02.305612,0 days 00:32:59.440998,20,,uniform,6,nz,2.408891693835518e-07,1.9068306386240476e-05,800,80,288,512,,raw,Glorot,,logistic,0.01302330493927002,0.012913894653320313,0.013140177726745606,0.013015842437744141,COMPLETE,0.01302330493927002,0.012913894653320313,0.013140177726745606,0.013015842437744141
1,0.12019355297088623,2025-08-24 11:23:02.309412,2025-08-24 11:29:49.705284,0 days 00:06:47.395872,100,,uniform,6,nz,0.0002069877935427099,4.532045798669679e-05,803,224,512,384,,raw,Glorot,,tanh,0.012992151578267414,0.012985157966613769,0.01315920352935791,0.012832093238830566,COMPLETE,0.012992151578267414,0.012985157966613769,0.01315920352935791,0.012832093238830566
2,0.4727580785751343,2025-08-24 11:29:49.705690,2025-08-24 12:01:24.930029,0 days 00:31:35.224339,20,,normal,6,zero,,0.003593917669469153,294,432,16,96,0.7614531005141727,pca,old,0.755934832754835,tanh,0.012273534138997394,0.012614679336547852,0.012115788459777833,0.012090134620666503,COMPLETE,0.012273534138997394,0.012614679336547852,0.012115788459777833,0.012090134620666503
3,0.8463387489318848,2025-08-24 12:01:24.930429,2025-08-24 12:07:49.097019,0 days 00:06:24.166590,100,,normal,5,zero,,0.04669620740529656,5948,352,336,320,,raw,old,1.0291345330938984,logistic,0.007686487833658853,0.0077179670333862305,0.008324933052062989,0.007016563415527343,COMPLETE,0.007686487833658853,0.0077179670333862305,0.008324933052062989,0.007016563415527343
4,0.11251613348722458,2025-08-24 12:07:49.097337,2025-08-24 12:14:32.318651,0 days 00:06:43.221314,100,,normal,5,nz,5.8733668003591766e-08,0.0006009208989093564,129,80,368,848,,raw,old,0.9564623006105633,logistic,0.013152480125427246,0.012960982322692872,0.013309216499328614,0.013187241554260255,COMPLETE,0.013152480125427246,0.012960982322692872,0.013309216499328614,0.013187241554260255
5,0.9408548951148987,2025-08-24 12:14:32.319046,2025-08-24 12:20:59.956538,0 days 00:06:27.637492,100,,normal,6,zero,,0.020672492838662945,4902,48,560,832,0.92848781305588,pca,old,0.9947535368647515,tanh,0.00904220740000407,0.004789900779724121,0.01070089340209961,0.011635828018188476,COMPLETE,0.00904220740000407,0.004789900779724121,0.01070089340209961,0.011635828018188476
6,0.4430161461234093,2025-08-24 12:20:59.956841,2025-08-24 12:27:23.167950,0 days 00:06:23.211109,100,,normal,8,zero,,0.902290355038375,303,160,32,544,0.531811142849276,pca,Glorot,,tanh,,,,,COMPLETE,,,,
7,0.11251613348722458,2025-08-24 12:27:23.168279,2025-08-24 12:34:06.040726,0 days 00:06:42.872447,100,,uniform,8,nz,1.7286821158315726e-07,7.984786193040815e-05,2976,944,32,704,0.5603162141530791,pca,Glorot,,logistic,0.012476746241251627,0.013277268409729004,0.011025094985961914,0.013127875328063966,COMPLETE,0.012476746241251627,0.013277268409729004,0.011025094985961914,0.013127875328063966
8,0.11251613348722458,2025-08-24 12:34:06.042468,2025-08-24 13:05:43.090494,0 days 00:31:37.048026,20,1.0252773110077433e-06,normal,5,zero,,0.010819702277292158,2651,960,400,672,,colnorm,old,0.7176438958158204,logistic,0.013233947753906248,0.013266777992248536,0.013364791870117188,0.013070273399353027,COMPLETE,0.013233947753906248,0.013266777992248536,0.013364791870117188,0.013070273399353027
9,0.9692419648170472,2025-08-24 13:05:43.091259,2025-08-24 13:12:26.876810,0 days 00:06:43.785551,100,,uniform,8,nz,3.0495251798820325e-05,0.07968268616303291,1813,208,320,256,,raw,old,1.432827266708205,tanh,0.007420245806376138,0.0052631616592407225,0.008664751052856445,0.00833282470703125,COMPLETE,0.007420245806376138,0.0052631616592407225,0.008664751052856445,0.00833282470703125
10,0.35259678959846497,2025-08-24 13:12:26.877220,2025-08-24 13:44:44.200118,0 days 00:32:17.322898,20,,normal,7,zero,,9.278261226540327e-05,117,112,672,320,0.9177342805737674,pca,Glorot,,tanh,0.013136720657348633,0.013150954246520996,0.013073277473449708,0.013185930252075196,COMPLETE,0.013136720657348633,0.013150954246520996,0.013073277473449708,0.013185930252075196
11,0.11251613348722458,2025-08-24 13:44:44.202884,2025-08-24 13:51:31.933685,0 days 00:06:47.730801,100,,normal,6,nz,1.5178620982137476e-05,6.138743611911215e-05,6294,912,336,912,,raw,old,0.4880602306015901,tanh,0.013171148300170897,0.013025784492492675,0.013104057312011719,0.013383603096008301,COMPLETE,0.013171148300170897,0.013025784492492675,0.013104057312011719,0.013383603096008301
12,0.8381774425506592,2025-08-24 13:51:31.934014,2025-08-24 14:23:27.539149,0 days 00:31:55.605135,20,,normal,6,zero,,0.037881959609401966,7519,160,176,64,,raw,Glorot,,logistic,0.0030435244242350257,0.00463719367980957,0.004463577270507812,2.9802322387695312e-05,COMPLETE,0.0030435244242350257,0.00463719367980957,0.004463577270507812,2.9802322387695312e-05
13,0.11251613348722458,2025-08-24 14:23:27.539565,2025-08-24 14:30:13.678044,0 days 00:06:46.138479,100,,normal,7,nz,0.004083646289694694,0.00017587308626797383,3552,896,736,112,0.934529193152835,pca,Glorot,,logistic,0.013194187482198078,0.013224649429321288,0.01316533088684082,0.013192582130432128,COMPLETE,0.013194187482198078,0.013224649429321288,0.01316533088684082,0.013192582130432128
14,0.9696774482727051,2025-08-24 14:30:13.678403,2025-08-24 15:02:02.294133,0 days 00:31:48.615730,20,,normal,6,zero,,0.3044525615065604,204,704,176,352,0.5043995553501397,pca,Glorot,,tanh,0.007924556732177734,0.008503961563110351,0.006157803535461426,0.009111905097961425,COMPLETE,0.007924556732177734,0.008503961563110351,0.006157803535461426,0.009111905097961425
15,0.11251613348722458,2025-08-24 15:02:02.296058,2025-08-24 15:35:43.096118,0 days 00:33:40.800060,20,,uniform,6,nz,4.5217557451024084e-07,0.00024928315599298995,515,512,176,752,,raw,old,1.1709311779111824,tanh,0.013176234563191733,0.013152861595153808,0.013228535652160645,0.013147306442260743,COMPLETE,0.013176234563191733,0.013152861595153808,0.013228535652160645,0.013147306442260743
16,0.253161296248436,2025-08-24 15:35:43.096522,2025-08-24 15:42:04.042566,0 days 00:06:20.946044,100,,uniform,6,zero,,0.00034912391835984966,2655,1008,352,736,,raw,Glorot,,tanh,0.013091039657592776,0.013099312782287598,0.013072395324707031,0.013101410865783692,COMPLETE,0.013091039657592776,0.013099312782287598,0.013072395324707031,0.013101410865783692
17,0.11251613348722458,2025-08-24 15:42:04.043290,2025-08-24 16:15:30.050925,0 days 00:33:26.007635,20,,normal,6,nz,0.003098891758417325,0.0008440164593981861,1301,912,880,240,0.5561063925658498,pca,old,0.5462544338135313,logistic,0.013192200660705566,0.013296771049499511,0.013269543647766113,0.013010287284851074,COMPLETE,0.013192200660705566,0.013296771049499511,0.013269543647766113,0.013010287284851074
18,0.11251613348722458,2025-08-24 16:15:30.052084,2025-08-24 16:48:52.996745,0 days 00:33:22.944661,20,,uniform,7,nz,0.0012361063948476514,0.00017047912451343645,270,480,992,624,,raw,Glorot,,logistic,0.013161683082580566,0.013174748420715332,0.013205385208129883,0.013104915618896484,COMPLETE,0.013161683082580566,0.013174748420715332,0.013205385208129883,0.013104915618896484
19,0.11251613348722458,2025-08-24 16:48:52.999135,2025-08-24 17:21:48.693695,0 days 00:32:55.694560,20,,normal,8,zero,,0.8186484618563397,3702,224,896,720,,raw,Glorot,,logistic,0.002047459284464518,0.005492806434631348,0.00019261837005615234,0.00045695304870605467,COMPLETE,0.002047459284464518,0.005492806434631348,0.00019261837005615234,0.00045695304870605467
20,0.11251613348722458,2025-08-24 17:21:48.694093,2025-08-24 17:28:24.175057,0 days 00:06:35.480964,100,,uniform,6,nz,0.0002247144159652352,0.5824613263289332,1377,96,176,32,,raw,Glorot,,logistic,0.012450114885965985,0.012756824493408203,0.01327047348022461,0.011323046684265137,COMPLETE,0.012450114885965985,0.012756824493408203,0.01327047348022461,0.011323046684265137
21,0.11251613348722458,2025-08-24 17:28:24.175372,2025-08-24 17:35:05.104515,0 days 00:06:40.929143,100,,uniform,6,nz,0.0031762322412963125,0.0008525836944886396,895,656,352,992,,raw,old,0.8825031528075136,tanh,0.013155396779378256,0.012967157363891601,0.013284683227539062,0.013214349746704102,COMPLETE,0.013155396779378256,0.012967157363891601,0.013284683227539062,0.013214349746704102
22,0.11251613348722458,2025-08-24 17:35:05.104929,2025-08-24 17:41:30.639217,0 days 00:06:25.534288,100,1.1440763747069189e-09,uniform,6,zero,,0.0013572916218580562,286,1008,1008,560,,colnorm,old,0.6363168365090601,logistic,0.013152329126993816,0.013186287879943848,0.013169288635253906,0.013101410865783692,COMPLETE,0.013152329126993816,0.013186287879943848,0.013169288635253906,0.013101410865783692
23,0.11251613348722458,2025-08-24 17:41:30.639538,2025-08-24 17:48:02.048906,0 days 00:06:31.409368,100,,normal,8,zero,,4.3061830079117834e-05,102,96,800,16,0.9535186884098954,pca,old,0.4229283393084612,tanh,0.012372684478759765,0.013293576240539551,0.013064980506896973,0.010759496688842773,COMPLETE,0.012372684478759765,0.013293576240539551,0.013064980506896973,0.010759496688842773
24,0.276919361948967,2025-08-24 17:48:02.049304,2025-08-24 18:21:41.870849,0 days 00:33:39.821545,20,5.659468770678343e-08,normal,7,nz,2.972205680742184e-07,6.15282914558757e-06,3796,128,800,288,,colnorm,Glorot,,tanh,0.013130807876586914,0.012781071662902831,0.013128042221069336,0.013483309745788574,COMPLETE,0.013130807876586914,0.012781071662902831,0.013128042221069336,0.013483309745788574
25,0.11251613348722458,2025-08-24 18:21:41.871938,2025-08-24 18:53:46.576482,0 days 00:32:04.704544,20,,normal,5,zero,,0.001237123628998651,4732,752,992,160,,raw,Glorot,,logistic,0.013114682833353679,0.013221478462219239,0.013163948059082031,0.012958621978759766,COMPLETE,0.013114682833353679,0.013221478462219239,0.013163948059082031,0.012958621978759766
26,0.11251613348722458,2025-08-24 18:53:46.576887,2025-08-24 19:27:16.651532,0 days 00:33:30.074645,20,,uniform,6,nz,0.00025273534942158024,1.5444453286934103e-06,443,832,48,704,0.5000924595149698,pca,old,1.6974991883625365,logistic,0.01275628407796224,0.013100147247314453,0.01226494312286377,0.012903761863708497,COMPLETE,0.01275628407796224,0.013100147247314453,0.01226494312286377,0.012903761863708497
27,0.33161291778087615,2025-08-24 19:27:16.654693,2025-08-24 20:00:32.616387,0 days 00:33:15.961694,20,,uniform,5,nz,2.8653067848446513e-08,0.13594321102820803,100,64,960,832,0.5315053238870611,pca,Glorot,,logistic,0.012013077735900879,0.010472297668457031,0.012976932525634765,0.01259000301361084,COMPLETE,0.012013077735900879,0.010472297668457031,0.012976932525634765,0.01259000301361084
28,0.11251613348722458,2025-08-24 20:00:32.619282,2025-08-24 20:07:17.418027,0 days 00:06:44.798745,100,,uniform,8,nz,2.195171270562009e-06,0.00019975831193664464,686,64,592,192,,raw,Glorot,,logistic,0.013001060485839844,0.012754201889038086,0.01313033103942871,0.013118648529052734,COMPLETE,0.013001060485839844,0.012754201889038086,0.01313033103942871,0.013118648529052734
29,0.11251613348722458,2025-08-24 20:07:17.418345,2025-08-24 20:13:59.699764,0 days 00:06:42.281419,100,,uniform,8,nz,1.1354612839945856e-05,5.104214441669944e-05,474,816,576,16,,raw,old,1.84336145631759,tanh,0.012582945823669435,0.012932229042053222,0.013145804405212402,0.011670804023742676,COMPLETE,0.012582945823669435,0.012932229042053222,0.013145804405212402,0.011670804023742676
30,0.3349516212940216,2025-08-24 20:13:59.700171,2025-08-24 20:47:27.316667,0 days 00:33:27.616496,20,,normal,5,nz,3.4666480400355086e-05,3.0590198493981793e-06,1159,1024,560,320,0.5285715720343376,pca,Glorot,,tanh,0.013090070088704428,0.013228940963745116,0.013104748725891114,0.01293652057647705,COMPLETE,0.013090070088704428,0.013228940963745116,0.013104748725891114,0.01293652057647705
31,0.2556451678276062,2025-08-24 20:47:27.317069,2025-08-24 20:53:03.734285,0 days 00:05:36.417216,100,,normal,7,zero,,0.0013178595061205047,329,544,624,736,,raw,Glorot,,tanh,0.013130052884419758,0.013082361221313477,0.013160252571105957,0.013147544860839844,COMPLETE,0.013130052884419758,0.013082361221313477,0.013160252571105957,0.013147544860839844
32,0.11251613348722458,2025-08-24 20:53:03.734571,2025-08-24 20:58:26.393591,0 days 00:05:22.659020,100,,normal,5,zero,,8.060709675998e-05,273,592,848,816,,raw,Glorot,,logistic,0.013014475504557291,0.012946414947509765,0.013173317909240723,0.012923693656921387,COMPLETE,0.013014475504557291,0.012946414947509765,0.013173317909240723,0.012923693656921387
33,0.7982258275151253,2025-08-24 20:58:26.393930,2025-08-24 21:03:52.829803,0 days 00:05:26.435873,100,,uniform,5,zero,,0.3881631908547999,550,656,768,480,0.8360361547567354,pca,old,0.34952059690438664,tanh,,,,,COMPLETE,,,,
34,0.3166935622692108,2025-08-24 21:03:52.830115,2025-08-24 21:09:17.516361,0 days 00:05:24.686246,100,,normal,5,zero,,1.5698573371230564e-06,9702,16,848,784,0.9554456629821021,pca,old,0.8219145201736515,tanh,0.013049928347269694,0.012874245643615723,0.013034701347351074,0.013240838050842285,COMPLETE,0.013049928347269694,0.012874245643615723,0.013034701347351074,0.013240838050842285
35,0.11251613348722458,2025-08-24 21:09:17.516665,2025-08-24 21:36:24.824732,0 days 00:27:07.308067,20,0.00023030123347169337,uniform,5,zero,,0.00022925779841068158,7530,624,304,272,,colnorm,Glorot,,logistic,0.013038182258605957,0.013215088844299316,0.013093161582946777,0.012806296348571777,COMPLETE,0.013038182258605957,0.013215088844299316,0.013093161582946777,0.012806296348571777
36,0.11251613348722458,2025-08-24 21:36:24.825656,2025-08-24 21:42:01.937436,0 days 00:05:37.111780,100,,uniform,6,nz,0.007026571679037962,0.5761867715961069,345,480,560,336,0.9027008437002731,pca,Glorot,,logistic,0.011041116714477538,0.012972211837768555,0.01309511661529541,0.007056021690368652,COMPLETE,0.011041116714477538,0.012972211837768555,0.01309511661529541,0.007056021690368652
37,0.11251613348722458,2025-08-24 21:42:01.937759,2025-08-24 21:47:28.882194,0 days 00:05:26.944435,100,,uniform,8,zero,,0.04691042508931178,325,320,656,880,,raw,old,0.7969697448675397,logistic,0.01319116751352946,0.013066720962524415,0.01340625286102295,0.013100528717041015,COMPLETE,0.01319116751352946,0.013066720962524415,0.01340625286102295,0.013100528717041015
38,0.11251613348722458,2025-08-24 21:47:28.882501,2025-08-24 21:52:55.800768,0 days 00:05:26.918267,100,1.3392800430171726e-07,uniform,7,zero,,5.181088778462791e-05,1530,624,768,64,,colnorm,old,0.5361051597480313,logistic,0.013027119636535646,0.013083219528198242,0.013021230697631836,0.012976908683776855,COMPLETE,0.013027119636535646,0.013083219528198242,0.013021230697631836,0.012976908683776855
39,0.11251613348722458,2025-08-24 21:52:55.801065,2025-08-24 22:21:07.995380,0 days 00:28:12.194315,20,,uniform,6,nz,2.7074231357934203e-07,2.7495142582401574e-05,3457,528,320,288,,raw,old,0.9842803384827483,logistic,0.0131011962890625,0.013220262527465821,0.013056182861328125,0.013027143478393555,COMPLETE,0.0131011962890625,0.013220262527465821,0.013056182861328125,0.013027143478393555
40,0.11251613348722458,2025-08-24 22:21:07.995757,2025-08-24 22:47:56.712736,0 days 00:26:48.716979,20,,uniform,7,zero,,7.1487242727983216e-06,669,400,672,560,0.733548195301683,pca,Glorot,,logistic,0.013100377718607586,0.013168764114379884,0.013087129592895508,0.013045239448547363,COMPLETE,0.013100377718607586,0.013168764114379884,0.013087129592895508,0.013045239448547363
41,0.11251613348722458,2025-08-24 22:47:56.713096,2025-08-24 22:53:34.239148,0 days 00:05:37.526052,100,,uniform,5,nz,2.172158274853957e-05,4.971380801717752e-05,489,848,896,752,0.6078982381999125,pca,old,1.570720193391757,logistic,0.013282044728597004,0.013382029533386231,0.013181400299072266,0.013282704353332519,COMPLETE,0.013282044728597004,0.013382029533386231,0.013181400299072266,0.013282704353332519
42,0.11251613348722458,2025-08-24 22:53:34.239497,2025-08-24 22:59:01.129207,0 days 00:05:26.889710,100,,normal,6,zero,,5.05629522128911e-05,628,704,16,912,,raw,old,1.6729318569045701,logistic,0.013407262166341145,0.013390612602233887,0.013930916786193848,0.012900257110595703,COMPLETE,0.013407262166341145,0.013390612602233887,0.013930916786193848,0.012900257110595703
43,0.9579516530036927,2025-08-24 22:59:01.129506,2025-08-24 23:04:27.191029,0 days 00:05:26.061523,100,,uniform,7,zero,,0.004181806786036181,9187,128,272,528,0.5725305842963468,pca,old,0.6347679358457043,tanh,0.010181665420532227,0.00872802734375,0.010380077362060546,0.011436891555786134,COMPLETE,0.010181665420532227,0.00872802734375,0.010380077362060546,0.011436891555786134
44,0.19512903690338135,2025-08-24 23:04:27.191327,2025-08-24 23:32:48.807939,0 days 00:28:21.616612,20,,uniform,7,nz,2.560791683250174e-08,6.497661227159869e-05,996,448,944,160,0.878173217327606,pca,Glorot,,tanh,0.012949792544047036,0.012811851501464844,0.012792730331420898,0.01324479579925537,COMPLETE,0.012949792544047036,0.012811851501464844,0.012792730331420898,0.01324479579925537
45,0.94840327501297,2025-08-24 23:32:48.808838,2025-08-25 00:00:48.664605,0 days 00:27:59.855767,20,,uniform,6,nz,4.2668947270063475e-06,0.009261598751419355,1303,240,864,224,0.7526980705455009,pca,old,1.2313563468120658,tanh,0.011150185267130533,0.010296821594238281,0.012172579765319824,0.010981154441833497,COMPLETE,0.011150185267130533,0.010296821594238281,0.012172579765319824,0.010981154441833497
46,0.4881935715675354,2025-08-25 00:00:48.665357,2025-08-25 00:06:31.897548,0 days 00:05:43.232191,100,,uniform,5,nz,3.29024119804691e-08,1.2532733251536745e-06,125,224,896,592,0.9280040816529784,pca,old,1.95298129373683,tanh,0.013098033269246419,0.01315007209777832,0.012982487678527832,0.013161540031433105,COMPLETE,0.013098033269246419,0.01315007209777832,0.012982487678527832,0.013161540031433105
47,0.5413709998130798,2025-08-25 00:06:31.897868,2025-08-25 00:11:58.301964,0 days 00:05:26.404096,100,,normal,5,zero,,0.00011442100841843391,306,128,672,816,0.7013913968225263,pca,old,1.2743207063277995,tanh,0.013133001327514647,0.013114309310913086,0.013139581680297852,0.013145112991333007,COMPLETE,0.013133001327514647,0.013114309310913086,0.013139581680297852,0.013145112991333007
48,0.9491290807723999,2025-08-25 00:11:58.302255,2025-08-25 00:39:57.212914,0 days 00:27:58.910659,20,1.5213799637263695e-05,normal,7,nz,0.00010849668078145311,0.04064835377827358,383,576,496,1008,,colnorm,Glorot,,tanh,0.011730480194091798,0.011293959617614747,0.011775779724121093,0.01212170124053955,COMPLETE,0.011730480194091798,0.011293959617614747,0.011775779724121093,0.01212170124053955
49,0.11251613348722458,2025-08-25 00:39:57.213293,2025-08-25 01:08:14.875554,0 days 00:28:17.662261,20,,uniform,6,nz,0.0007388299612462084,2.6838463465390414e-05,258,192,128,848,,raw,Glorot,,logistic,0.012959186236063638,0.012823724746704101,0.012879228591918946,0.013174605369567872,COMPLETE,0.012959186236063638,0.012823724746704101,0.012879228591918946,0.013174605369567872
50,0.9309677720069885,2025-08-25 01:08:14.875933,2025-08-25 01:36:04.457211,0 days 00:27:49.581278,20,,uniform,8,nz,1.908237513615749e-06,0.009531024033067244,2537,288,272,80,,raw,old,0.27563829445908666,tanh,0.00949077606201172,0.011248230934143066,0.010744476318359375,0.006479620933532715,COMPLETE,0.00949077606201172,0.011248230934143066,0.010744476318359375,0.006479620933532715
51,0.8929516553878785,2025-08-25 01:36:04.457601,2025-08-25 01:41:50.362502,0 days 00:05:45.904901,100,,normal,8,nz,0.0005657840674477493,0.034360924836067806,2216,336,48,592,0.899069644786243,pca,Glorot,,logistic,0.004014714558919271,0.0054130077362060545,0.00012974739074707032,0.006501388549804687,COMPLETE,0.004014714558919271,0.0054130077362060545,0.00012974739074707032,0.006501388549804687
52,0.11251613348722458,2025-08-25 01:41:50.362788,2025-08-25 02:09:52.201168,0 days 00:28:01.838380,20,,normal,8,nz,1.4738360525117118e-05,0.01606188977318872,768,832,896,544,,raw,Glorot,,logistic,0.01308004061381022,0.012934184074401856,0.013254451751708984,0.013051486015319825,COMPLETE,0.01308004061381022,0.012934184074401856,0.013254451751708984,0.013051486015319825
53,0.11251613348722458,2025-08-25 02:09:52.203263,2025-08-25 02:15:36.271155,0 days 00:05:44.067892,100,6.415696825107625e-08,uniform,6,nz,1.463798032767135e-05,1.8880093046200602e-05,4520,656,624,544,,colnorm,old,0.33226944075447534,logistic,0.013029011090596516,0.012949061393737794,0.013110685348510741,0.013027286529541016,COMPLETE,0.013029011090596516,0.012949061393737794,0.013110685348510741,0.013027286529541016
54,0.11251613348722458,2025-08-25 02:15:36.271978,2025-08-25 02:21:00.354723,0 days 00:05:24.082745,100,1.751843747942396e-08,normal,5,zero,,0.00039626846541448643,137,272,768,32,,colnorm,Glorot,,tanh,0.013219126065572103,0.013068222999572754,0.013097786903381347,0.013491368293762207,COMPLETE,0.013219126065572103,0.013068222999572754,0.013097786903381347,0.013491368293762207
