number,value,datetime_start,datetime_complete,duration,params_batch_size,params_colnorm_thresh,params_dist1,params_iseed,params_l2_penalty_choice,params_l2_penalty_nz,params_lr,params_lr_anneal_start,params_nhid1,params_pca_energy,params_preproc,params_scale_heur1,params_scale_mult1,params_squash,user_attrs_avg_fit_criteria,state,avg_fit_criteria
0,0.7791129350662231,2025-08-23 05:23:41.899350,2025-08-23 05:24:33.443559,0 days 00:00:51.544209,100,,normal,6,nz,0.005020847175011941,0.28678812614035476,266,80,,raw,old,0.7186620787543885,logistic,0.0010076999664306641,COMPLETE,0.0010076999664306641
1,0.6559677720069885,2025-08-23 05:24:33.445326,2025-08-23 05:28:30.753830,0 days 00:03:57.308504,20,6.404970863644254e-07,uniform,7,zero,,0.002727419843207111,355,224,,colnorm,old,0.7651904189827918,tanh,0.01234290599822998,COMPLETE,0.01234290599822998
2,0.8488871216773987,2025-08-23 05:28:30.755852,2025-08-23 05:29:19.987476,0 days 00:00:49.231624,100,3.6201072407748306e-07,normal,8,zero,,0.5405177223050418,2318,656,,colnorm,old,1.4530888343305441,tanh,-0.00019364356994628907,COMPLETE,-0.00019364356994628907
3,0.11572580933570861,2025-08-23 05:29:19.989143,2025-08-23 05:30:07.605548,0 days 00:00:47.616405,100,,normal,5,zero,,0.0003086104554138934,785,480,,raw,old,0.4979025208384174,tanh,0.01304769515991211,COMPLETE,0.01304769515991211
4,0.8098225831985474,2025-08-23 05:30:07.605798,2025-08-23 05:30:55.847651,0 days 00:00:48.241853,100,,uniform,6,zero,,0.0753316189564453,715,288,,raw,old,0.842727131035182,logistic,0.003974747657775879,COMPLETE,0.003974747657775879
5,0.8108548760414124,2025-08-23 05:30:55.847999,2025-08-23 05:31:45.915765,0 days 00:00:50.067766,100,,normal,7,zero,,0.13862889345041887,116,144,0.9709046340957243,pca,old,1.6080142723828008,logistic,0.004099130630493164,COMPLETE,0.004099130630493164
6,0.6442097187042236,2025-08-23 05:31:45.915988,2025-08-23 05:35:45.718352,0 days 00:03:59.802364,20,,uniform,7,zero,,1.8560837352965355e-06,103,688,0.5841376526836222,pca,Glorot,,tanh,0.013104915618896484,COMPLETE,0.013104915618896484
7,0.8107742309570313,2025-08-23 05:35:45.720237,2025-08-23 05:36:35.640641,0 days 00:00:49.920404,100,,uniform,6,zero,,0.0045466213818785945,5559,256,0.9962788595863201,pca,Glorot,,logistic,0.0071967124938964845,COMPLETE,0.0071967124938964845
8,0.1134677454829216,2025-08-23 05:36:35.643171,2025-08-23 05:40:34.412579,0 days 00:03:58.769408,20,1.3368559695948625e-06,normal,5,zero,,1.7286821158315763e-05,6875,560,,colnorm,Glorot,,logistic,0.013192486763000489,COMPLETE,0.013192486763000489
9,0.3383871138095856,2025-08-23 05:40:34.414673,2025-08-23 05:44:34.287488,0 days 00:03:59.872815,20,3.2487879589717105e-05,uniform,8,nz,1.7289062457084353e-08,0.008683638175257328,196,64,,colnorm,Glorot,,logistic,0.012430214881896972,COMPLETE,0.012430214881896972
10,0.6922903537750245,2025-08-23 05:44:34.287814,2025-08-23 05:48:21.333140,0 days 00:03:47.045326,20,3.7695952432846887e-06,uniform,5,zero,,0.005988265244732958,304,96,,colnorm,Glorot,,tanh,0.010630202293395997,COMPLETE,0.010630202293395997
11,0.37753227949142454,2025-08-23 05:48:21.333446,2025-08-23 05:52:10.692965,0 days 00:03:49.359519,20,,uniform,7,zero,,2.205572604793678e-06,1299,112,0.9177342805737674,pca,Glorot,,tanh,0.012955117225646972,COMPLETE,0.012955117225646972
12,0.8927581071853637,2025-08-23 05:52:10.693239,2025-08-23 05:52:59.844109,0 days 00:00:49.150870,100,,uniform,8,zero,,0.6463670471704025,645,384,0.6854374496447422,pca,old,0.6411968347530046,tanh,0.0016675233840942384,COMPLETE,0.0016675233840942384
13,0.1134677454829216,2025-08-23 05:52:59.844317,2025-08-23 05:53:51.802549,0 days 00:00:51.958232,100,2.4464011566467275e-05,normal,7,nz,6.580761756952406e-06,3.529805211191061e-06,1037,544,,colnorm,old,1.9071709329056934,logistic,0.013089871406555176,COMPLETE,0.013089871406555176
14,0.4538871169090271,2025-08-23 05:53:51.802802,2025-08-23 05:57:50.158309,0 days 00:03:58.355507,20,4.53231249709737e-06,uniform,6,zero,,0.0008232511308055879,1021,416,,colnorm,Glorot,,logistic,0.012719392776489258,COMPLETE,0.012719392776489258
15,0.1134677454829216,2025-08-23 05:57:50.160319,2025-08-23 06:02:02.889224,0 days 00:04:12.728905,20,0.00022796177218519458,normal,5,nz,4.566335943744083e-08,9.86923632335542e-06,483,544,,colnorm,Glorot,,logistic,0.013601326942443847,COMPLETE,0.013601326942443847
16,0.8557258248329163,2025-08-23 06:02:02.889470,2025-08-23 06:02:51.506920,0 days 00:00:48.617450,100,1.189274263546075e-06,uniform,6,zero,,0.025365537259255194,4125,816,,colnorm,old,0.48948637724712935,tanh,0.010896921157836914,COMPLETE,0.010896921157836914
17,0.1134677454829216,2025-08-23 06:02:51.507126,2025-08-23 06:07:02.296842,0 days 00:04:10.789716,20,,uniform,6,nz,1.4593069348259313e-06,4.8725813807672996e-05,872,496,,raw,Glorot,,logistic,0.013333654403686524,COMPLETE,0.013333654403686524
18,0.0978064551949501,2025-08-23 06:07:02.297162,2025-08-23 06:11:14.469208,0 days 00:04:12.172046,20,0.0003658052095178819,uniform,5,nz,2.61432346137729e-05,0.7712091002222098,167,560,,colnorm,old,0.8772453453841234,logistic,,COMPLETE,
19,0.1134677454829216,2025-08-23 06:11:14.469463,2025-08-23 06:12:04.285479,0 days 00:00:49.816016,100,,normal,7,nz,4.271037808365358e-05,1.9595449161099905e-06,6790,112,0.8283523401966375,pca,Glorot,,logistic,0.013195538520812988,COMPLETE,0.013195538520812988
20,0.494887113571167,2025-08-23 06:12:04.285694,2025-08-23 06:17:28.692971,0 days 00:05:24.407277,20,,uniform,7,zero,,0.00029956802319562316,1957,592,0.6083709951450864,pca,Glorot,,logistic,0.012850165367126465,COMPLETE,0.012850165367126465
21,0.1134677454829216,2025-08-23 06:17:28.693242,2025-08-23 06:22:50.199475,0 days 00:05:21.506233,20,8.497871339273834e-07,normal,5,zero,,2.786929921862278e-06,293,1024,,colnorm,old,0.9114986472254265,logistic,0.012882876396179199,COMPLETE,0.012882876396179199
22,0.8270968198776245,2025-08-23 06:22:50.199789,2025-08-23 06:27:17.242415,0 days 00:04:27.042626,20,,normal,5,nz,7.842857048400411e-08,0.02247144159652349,1071,272,,raw,Glorot,,tanh,0.007733845710754394,COMPLETE,0.007733845710754394
23,0.6000322818756103,2025-08-23 06:27:17.242661,2025-08-23 06:31:33.703770,0 days 00:04:16.461109,20,,uniform,8,zero,,0.00013828279283371964,8171,896,0.5079552056222199,pca,Glorot,,logistic,0.012908554077148438,COMPLETE,0.012908554077148438
24,0.2763387203216553,2025-08-23 06:31:33.704043,2025-08-23 06:32:33.148662,0 days 00:00:59.444619,100,1.6627948650580708e-06,normal,7,zero,,0.0013572916218580562,286,640,,colnorm,Glorot,,logistic,0.013157820701599121,COMPLETE,0.013157820701599121
25,0.8258387565612793,2025-08-23 06:32:33.148884,2025-08-23 06:33:23.287085,0 days 00:00:50.138201,100,,uniform,8,nz,3.858423808425208e-06,0.29190611010470696,744,96,0.9535186884098954,pca,Glorot,,tanh,0.00037314891815185545,COMPLETE,0.00037314891815185545
26,0.1134677454829216,2025-08-23 06:33:23.287354,2025-08-23 06:34:11.138965,0 days 00:00:47.851611,100,,normal,5,zero,,0.00027076433920494625,203,512,,raw,Glorot,,logistic,0.012992048263549804,COMPLETE,0.012992048263549804
27,0.1134677454829216,2025-08-23 06:34:11.139192,2025-08-23 06:35:00.911760,0 days 00:00:49.772568,100,,normal,6,zero,,8.177437067311106e-06,126,880,0.8495971274555434,pca,Glorot,,logistic,0.012838482856750488,COMPLETE,0.012838482856750488
28,0.605564534664154,2025-08-23 06:35:00.911977,2025-08-23 06:35:52.263969,0 days 00:00:51.351992,100,5.662291912711977e-08,normal,7,zero,,1.8175550179742918e-06,2310,800,,colnorm,old,1.6535901776344464,tanh,0.013228893280029297,COMPLETE,0.013228893280029297
29,0.1134677454829216,2025-08-23 06:35:52.264190,2025-08-23 06:40:47.810325,0 days 00:04:55.546135,20,7.544527667506924e-06,uniform,7,zero,,2.1255211024653712e-06,2609,720,,colnorm,Glorot,,logistic,0.013089728355407716,COMPLETE,0.013089728355407716
30,0.6647419571876526,2025-08-23 06:40:47.810569,2025-08-23 06:44:47.021776,0 days 00:03:59.211207,20,,uniform,7,zero,,3.0420481909171226e-05,5892,1024,0.5003456763160243,pca,Glorot,,tanh,0.013027119636535644,COMPLETE,0.013027119636535644
31,0.1134677454829216,2025-08-23 06:44:47.022046,2025-08-23 06:48:44.964143,0 days 00:03:57.942097,20,,normal,8,zero,,0.00021951712705620135,200,432,,raw,Glorot,,logistic,0.012938261032104492,COMPLETE,0.012938261032104492
32,0.6052419543266296,2025-08-23 06:48:44.964400,2025-08-23 06:49:34.039331,0 days 00:00:49.074931,100,5.143782444317332e-05,uniform,7,zero,,8.419872737053124e-06,1264,768,,colnorm,old,1.7604849969291174,tanh,0.013253021240234374,COMPLETE,0.013253021240234374
33,0.6766451835632324,2025-08-23 06:49:34.039548,2025-08-23 06:50:22.790234,0 days 00:00:48.750686,100,6.315839996288766e-08,uniform,8,zero,,0.008885188322966437,262,864,,colnorm,old,1.158454344679856,logistic,0.012517762184143067,COMPLETE,0.012517762184143067
34,0.6361613392829895,2025-08-23 06:50:22.790495,2025-08-23 06:51:12.432521,0 days 00:00:49.642026,100,,normal,6,zero,,0.0013178595061205047,329,736,0.7980091449630146,pca,Glorot,,tanh,0.012932944297790527,COMPLETE,0.012932944297790527
35,0.7785645484924316,2025-08-23 06:51:12.432738,2025-08-23 06:55:26.639560,0 days 00:04:14.206822,20,,normal,5,nz,0.0020457025186879554,0.0008907661777157554,5633,592,,raw,Glorot,,tanh,0.011239218711853027,COMPLETE,0.011239218711853027
36,0.5343226075172425,2025-08-23 06:55:26.639838,2025-08-23 06:59:26.305245,0 days 00:03:59.665407,20,,uniform,6,zero,,0.000289020414220305,2510,640,,raw,old,1.7872580074114737,tanh,0.01307990550994873,COMPLETE,0.01307990550994873
37,0.8296129465103149,2025-08-23 06:59:26.306848,2025-08-23 07:03:21.830730,0 days 00:03:55.523882,20,,normal,7,zero,,0.038617909479397895,2406,240,,raw,Glorot,,logistic,0.00211794376373291,COMPLETE,0.00211794376373291
38,0.7209032535552978,2025-08-23 07:03:21.830937,2025-08-23 07:07:35.142151,0 days 00:04:13.311214,20,5.66392477238153e-07,normal,8,nz,2.2300306597582873e-07,0.003956910799827261,385,880,,colnorm,old,1.8086888792032279,logistic,0.012706184387207031,COMPLETE,0.012706184387207031
39,0.1134677454829216,2025-08-23 07:07:35.142463,2025-08-23 07:08:21.152856,0 days 00:00:46.010393,100,,uniform,6,zero,,2.670557841476819e-05,4078,80,,raw,Glorot,,logistic,0.012561750411987305,COMPLETE,0.012561750411987305
40,0.0978064551949501,2025-08-23 07:08:21.153085,2025-08-23 07:09:12.839125,0 days 00:00:51.686040,100,2.2760628803348567e-07,uniform,6,nz,5.255646535131508e-06,0.675245206911214,1213,592,,colnorm,old,1.1325084528478357,logistic,,COMPLETE,
41,0.1134677454829216,2025-08-23 07:09:12.839328,2025-08-23 07:13:23.360485,0 days 00:04:10.521157,20,,normal,8,nz,0.00027096302515269757,6.755891258918345e-06,3527,160,0.628236311918623,pca,Glorot,,logistic,0.012742447853088378,COMPLETE,0.012742447853088378
42,0.8082742094993591,2025-08-23 07:13:23.360750,2025-08-23 07:14:12.441802,0 days 00:00:49.081052,100,1.3193211738078216e-08,uniform,7,zero,,0.04660634921932745,822,304,,colnorm,Glorot,,tanh,0.007486367225646972,COMPLETE,0.007486367225646972
43,0.704612934589386,2025-08-23 07:14:12.442030,2025-08-23 07:14:59.845502,0 days 00:00:47.403472,100,,normal,8,zero,,0.028510631616419233,299,496,,raw,old,1.4602045362651164,logistic,0.009540796279907227,COMPLETE,0.009540796279907227
44,0.8256613373756408,2025-08-23 07:14:59.845713,2025-08-23 07:18:59.695590,0 days 00:03:59.849877,20,1.6102603720059748e-08,normal,7,zero,,0.23382891630134822,237,432,,colnorm,Glorot,,tanh,0.0038393735885620117,COMPLETE,0.0038393735885620117
45,0.1134677454829216,2025-08-23 07:18:59.697533,2025-08-23 07:19:51.646578,0 days 00:00:51.949045,100,,uniform,7,nz,2.172158274853957e-05,4.971380801717752e-05,489,752,0.9300557916705414,pca,old,1.570720193391757,logistic,0.013010668754577636,COMPLETE,0.013010668754577636
46,0.11351613253355027,2025-08-23 07:19:51.646858,2025-08-23 07:23:49.989598,0 days 00:03:58.342740,20,,normal,6,zero,,0.0014352166121342712,578,704,,raw,Glorot,,logistic,0.012904524803161621,COMPLETE,0.012904524803161621
47,0.8076612949371338,2025-08-23 07:23:49.991569,2025-08-23 07:24:39.062886,0 days 00:00:49.071317,100,5.686551670725622e-09,normal,6,zero,,0.14574547360022277,444,816,,colnorm,Glorot,,tanh,0.00799124240875244,COMPLETE,0.00799124240875244
48,0.2511774241924286,2025-08-23 07:24:39.063105,2025-08-23 07:28:34.516106,0 days 00:03:55.453001,20,,normal,6,zero,,0.31593794654852525,199,192,,raw,old,0.9795852210443081,tanh,,COMPLETE,
49,0.824354887008667,2025-08-23 07:28:34.516345,2025-08-23 07:32:34.028037,0 days 00:03:59.511692,20,,uniform,6,zero,,0.014478999776695603,3301,592,,raw,Glorot,,tanh,0.00952906608581543,COMPLETE,0.00952906608581543
50,0.69635488986969,2025-08-23 07:32:34.028308,2025-08-23 07:36:35.475954,0 days 00:04:01.447646,20,,normal,7,nz,0.001367883087079219,0.0015992224831826354,417,576,0.8305571634778848,pca,Glorot,,tanh,0.013000726699829102,COMPLETE,0.013000726699829102
51,0.5365645408630371,2025-08-23 07:36:35.477800,2025-08-23 07:40:49.223239,0 days 00:04:13.745439,20,1.8776734741187351e-06,normal,6,nz,5.921401756691521e-08,3.2902411980469176e-06,315,368,,colnorm,old,0.537490790118223,tanh,0.013196325302124024,COMPLETE,0.013196325302124024
52,0.8266613364219666,2025-08-23 07:40:49.223494,2025-08-23 07:45:01.733740,0 days 00:04:12.510246,20,,uniform,5,nz,1.9712592377567804e-07,0.08237999780283811,1317,672,,raw,old,0.31677426868467073,logistic,0.005821537971496582,COMPLETE,0.005821537971496582
53,0.22762904167175294,2025-08-23 07:45:01.734038,2025-08-23 07:45:54.140514,0 days 00:00:52.406476,100,,normal,8,nz,0.003032927057275183,0.002064925722505891,279,144,0.9220608878872901,pca,old,1.8296397535659579,logistic,0.013503932952880859,COMPLETE,0.013503932952880859
54,0.49529034495353697,2025-08-23 07:45:54.140783,2025-08-23 07:49:52.806726,0 days 00:03:58.665943,20,,normal,6,zero,,4.364350063664588e-06,2385,144,0.5109065798514173,pca,old,1.1246290766943483,tanh,0.013542771339416504,COMPLETE,0.013542771339416504
55,0.8214839220046997,2025-08-23 07:49:52.806940,2025-08-23 07:53:51.713492,0 days 00:03:58.906552,20,,uniform,6,nz,1.908237513615749e-06,0.009531024033067244,2537,80,,raw,old,0.27563829445908666,tanh,0.004836153984069824,COMPLETE,0.004836153984069824
56,0.8494032502174378,2025-08-23 07:53:51.713753,2025-08-23 07:58:04.434054,0 days 00:04:12.720301,20,,normal,8,nz,2.2686734297293006e-07,0.044015123416251516,5285,336,0.899069644786243,pca,Glorot,,logistic,0.0013973712921142578,COMPLETE,0.0013973712921142578
57,0.1134677454829216,2025-08-23 07:58:04.434368,2025-08-23 08:02:02.813726,0 days 00:03:58.379358,20,8.474425126846829e-09,uniform,6,zero,,2.3267466313431546e-06,2508,496,,colnorm,old,0.49831885853583435,logistic,0.013333797454833984,COMPLETE,0.013333797454833984
58,0.11416129469871521,2025-08-23 08:02:02.813940,2025-08-23 08:06:15.019172,0 days 00:04:12.205232,20,,normal,6,nz,1.8880093046200592e-07,8.506886477584808e-05,9312,384,,raw,old,0.2955716745211142,tanh,0.012906956672668456,COMPLETE,0.012906956672668456
59,0.7581613302230835,2025-08-23 08:06:15.019480,2025-08-23 08:10:16.151868,0 days 00:04:01.132388,20,,uniform,5,nz,4.856008981034457e-08,0.027446004592120654,110,64,0.5380208887710339,pca,Glorot,,tanh,0.007180309295654297,COMPLETE,0.007180309295654297
60,0.5486451745033264,2025-08-23 08:10:16.153681,2025-08-23 08:11:05.255550,0 days 00:00:49.101869,100,2.4904386492746227e-07,normal,5,zero,,0.0003194464171832185,9843,592,,colnorm,Glorot,,logistic,0.013015437126159667,COMPLETE,0.013015437126159667
61,0.5403387308120727,2025-08-23 08:11:05.257539,2025-08-23 08:15:05.979295,0 days 00:04:00.721756,20,0.00012128489198477746,uniform,7,zero,,1.8484584489544195e-05,632,544,,colnorm,old,0.423959085886948,tanh,0.013089823722839355,COMPLETE,0.013089823722839355
62,0.7841290593147278,2025-08-23 08:15:05.980635,2025-08-23 08:15:59.030363,0 days 00:00:53.049728,100,,normal,8,nz,2.5236754008824133e-06,0.017500812566383212,291,1008,0.6221741311187055,pca,old,0.37547167088158373,logistic,0.011853289604187012,COMPLETE,0.011853289604187012
63,0.16951613426208495,2025-08-23 08:15:59.030587,2025-08-23 08:16:48.244705,0 days 00:00:49.214118,100,5.794228607829461e-09,normal,6,zero,,0.0013694301399500603,144,992,,colnorm,Glorot,,logistic,0.012931418418884278,COMPLETE,0.012931418418884278
64,0.0978064551949501,2025-08-23 08:16:48.244934,2025-08-23 08:20:47.597001,0 days 00:03:59.352067,20,5.624930936473373e-08,normal,6,zero,,0.2299092964953523,4085,480,,colnorm,Glorot,,logistic,,COMPLETE,
65,0.7886451840400696,2025-08-23 08:20:47.597309,2025-08-23 08:21:39.284702,0 days 00:00:51.687393,100,,normal,8,nz,0.00010117448303144918,0.0015824828278696483,7447,560,0.7207643000146433,pca,Glorot,,logistic,0.01044619083404541,COMPLETE,0.01044619083404541
66,0.5484193682670593,2025-08-23 08:21:39.284931,2025-08-23 08:25:38.648088,0 days 00:03:59.363157,20,,normal,6,zero,,0.0062942794473880076,178,432,0.9635306762764995,pca,Glorot,,logistic,0.012813735008239745,COMPLETE,0.012813735008239745
67,0.818290364742279,2025-08-23 08:25:38.649821,2025-08-23 08:29:46.521411,0 days 00:04:07.871590,20,,normal,7,nz,3.83410000719568e-08,0.8998828949752957,280,208,,raw,old,1.4121636882810773,logistic,0.0033498048782348634,COMPLETE,0.0033498048782348634
68,0.8315322995185852,2025-08-23 08:29:46.523244,2025-08-23 08:33:59.856839,0 days 00:04:13.333595,20,1.6514020850636604e-05,uniform,6,nz,1.6919226390788936e-06,0.029120432139338345,8411,864,,colnorm,old,0.4097929964164301,logistic,0.008800387382507324,COMPLETE,0.008800387382507324
69,0.5959516406059265,2025-08-23 08:33:59.857099,2025-08-23 08:34:51.348081,0 days 00:00:51.490982,100,,normal,5,nz,4.946237180283475e-07,3.629260674519555e-05,1627,368,0.5447326219797635,pca,Glorot,,tanh,0.013225913047790527,COMPLETE,0.013225913047790527
70,0.8564516305923462,2025-08-23 08:34:51.348300,2025-08-23 08:39:03.573513,0 days 00:04:12.225213,20,1.8998574299556565e-06,normal,5,nz,2.6377843786993484e-05,0.2079803493818124,3980,640,,colnorm,Glorot,,tanh,0.0005265474319458008,COMPLETE,0.0005265474319458008
71,0.8436774492263794,2025-08-23 08:39:03.573766,2025-08-23 08:43:01.641747,0 days 00:03:58.067981,20,,normal,7,zero,,0.09664203736424475,1907,144,0.7301287849936867,pca,Glorot,,tanh,0.00047304630279541013,COMPLETE,0.00047304630279541013
72,0.8066129207611084,2025-08-23 08:43:01.642032,2025-08-23 08:43:53.652198,0 days 00:00:52.010166,100,4.207878122546038e-09,uniform,5,nz,0.00018155148692324314,0.03984443155062022,3827,832,,colnorm,old,1.8998109343399925,tanh,0.006003093719482422,COMPLETE,0.006003093719482422
73,0.114145165681839,2025-08-23 08:43:53.652396,2025-08-23 08:44:44.689589,0 days 00:00:51.037193,100,,normal,8,nz,5.272265441403007e-06,0.00024266163128750429,188,576,,raw,Glorot,,tanh,0.01335761547088623,COMPLETE,0.01335761547088623
74,0.6121774315834045,2025-08-23 08:44:44.689857,2025-08-23 08:48:56.574226,0 days 00:04:11.884369,20,0.00022365943243466224,uniform,7,nz,0.001036660908766282,0.46613504001648925,1720,304,,colnorm,old,1.2458446602157183,tanh,1.5521049499511717e-05,COMPLETE,1.5521049499511717e-05
75,0.117709681391716,2025-08-23 08:48:56.574443,2025-08-23 08:49:45.919322,0 days 00:00:49.344879,100,,uniform,6,nz,0.0017739514609055758,3.4572239646567794e-06,6448,32,0.7828921161599743,pca,Glorot,,logistic,0.012414979934692382,COMPLETE,0.012414979934692382
76,0.8249194025993347,2025-08-23 08:49:45.919554,2025-08-23 08:53:45.459102,0 days 00:03:59.539548,20,1.0830850649386334e-07,uniform,8,zero,,0.022318938788123494,1279,608,,colnorm,old,0.7851688960347685,logistic,0.009476232528686523,COMPLETE,0.009476232528686523
77,0.7439032316207885,2025-08-23 08:53:45.459379,2025-08-23 08:54:37.741218,0 days 00:00:52.281839,100,,normal,7,nz,1.5551139170468825e-07,0.0039509825139392215,435,1024,0.7259795689462522,pca,old,1.7259387861118338,logistic,0.012314677238464355,COMPLETE,0.012314677238464355
78,0.7800322890281677,2025-08-23 08:54:37.741443,2025-08-23 08:55:26.214676,0 days 00:00:48.473233,100,6.862365405731616e-07,normal,7,zero,,0.005523938552884372,499,432,,colnorm,Glorot,,tanh,0.01200864315032959,COMPLETE,0.01200864315032959
79,0.6144677519798278,2025-08-23 08:55:26.214900,2025-08-23 08:56:15.315525,0 days 00:00:49.100625,100,,normal,7,zero,,0.0002997657084618961,1223,800,0.9226718983705813,pca,old,0.6444303612007551,tanh,0.013110733032226563,COMPLETE,0.013110733032226563
80,0.8814032793045044,2025-08-23 08:56:15.315735,2025-08-23 08:57:04.036435,0 days 00:00:48.720700,100,2.7305701283776972e-08,uniform,8,zero,,0.22752807734610944,1440,528,,colnorm,old,0.739658355926474,tanh,0.0051719903945922855,COMPLETE,0.0051719903945922855
81,0.8031290411949158,2025-08-23 08:57:04.036654,2025-08-23 08:57:52.105395,0 days 00:00:48.068741,100,7.698088393318814e-08,normal,5,zero,,0.03293547698396798,3749,448,,colnorm,Glorot,,tanh,0.004974675178527832,COMPLETE,0.004974675178527832
82,0.13762904107570648,2025-08-23 08:57:52.105663,2025-08-23 09:02:02.901147,0 days 00:04:10.795484,20,,uniform,7,nz,5.719200901848992e-07,0.00302353028482557,545,368,,raw,Glorot,,logistic,0.01285243034362793,COMPLETE,0.01285243034362793
83,0.7671613335609436,2025-08-23 09:02:02.901365,2025-08-23 09:05:59.691340,0 days 00:03:56.789975,20,,uniform,5,zero,,0.012347585205237686,1014,560,,raw,old,1.846507010932338,logistic,0.00833723545074463,COMPLETE,0.00833723545074463
84,0.7520000338554382,2025-08-23 09:05:59.691641,2025-08-23 09:09:57.357571,0 days 00:03:57.665930,20,,normal,6,zero,,0.0005770654742582456,4586,976,,raw,old,1.0590325655622437,tanh,0.012594819068908691,COMPLETE,0.012594819068908691
