number,value,datetime_start,datetime_complete,duration,params_batch_size,params_colnorm_thresh,params_dist1,params_iseed,params_l2_penalty_choice,params_l2_penalty_nz,params_lr,params_lr_anneal_start,params_nhid1,params_nhid2,params_nhid3,params_pca_energy,params_preproc,params_scale_heur1,params_scale_mult1,params_squash,user_attrs_avg_fit_criteria,user_attrs_ed_cl1_mean,user_attrs_ed_cl2_mean,user_attrs_ed_cl3_mean,state,avg_fit_criteria,ed_cl1_mean,ed_cl2_mean,ed_cl3_mean
111,0.112693552672863,2025-08-25 07:30:45.897169,2025-08-25 07:36:31.964233,0 days 00:05:46.067064,100,,uniform,8,nz,6.257482377351269e-07,0.014377620252639068,2314,752,1024,32,0.8235242763009855,pca,old,0.584145458705761,logistic,0.012632425626118979,0.013021326065063477,0.013030672073364257,0.011845278739929199,COMPLETE,0.012632425626118979,0.013021326065063477,0.013030672073364257,0.011845278739929199
112,0.544887113571167,2025-08-25 07:36:31.965934,2025-08-25 07:42:21.961753,0 days 00:05:49.995819,100,0.0007595279557228237,uniform,6,nz,1.0588871002317852e-06,0.1300315491179441,2493,960,784,320,,colnorm,old,0.5502013683604676,logistic,0.011362449328104653,0.01200571060180664,0.011834669113159179,0.010246968269348145,COMPLETE,0.011362449328104653,0.01200571060180664,0.011834669113159179,0.010246968269348145
113,0.112693552672863,2025-08-25 07:42:21.963612,2025-08-25 07:48:06.866051,0 days 00:05:44.902439,100,2.4620055160258858e-08,uniform,8,nz,9.575382912981095e-08,0.009729302165044553,4436,128,224,48,,colnorm,Glorot,,logistic,0.012928676605224608,0.012655687332153321,0.013241338729858398,0.01288900375366211,COMPLETE,0.012928676605224608,0.012655687332153321,0.013241338729858398,0.01288900375366211
114,0.7942258238792419,2025-08-25 07:48:06.868330,2025-08-25 07:53:53.950757,0 days 00:05:47.082427,100,,uniform,8,nz,1.5946714295169556e-06,0.46113823058531217,2211,416,848,112,0.8254636801425087,pca,old,0.5109146080486795,logistic,0.0012151400248209636,7.348060607910156e-05,0.0034025907516479492,0.00016934871673583983,COMPLETE,0.0012151400248209636,7.348060607910156e-05,0.0034025907516479492,0.00016934871673583983
115,0.112693552672863,2025-08-25 07:53:53.951122,2025-08-25 07:59:41.515943,0 days 00:05:47.564821,100,,uniform,8,nz,0.007914549390088326,0.4029848727096064,5608,224,448,176,0.8317618271587853,pca,Glorot,,logistic,0.46738994121551514,0.46738994121551514,0.46738994121551514,0.46738994121551514,COMPLETE,0.46738994121551514,0.46738994121551514,0.46738994121551514,0.46738994121551514
116,0.8407580971717834,2025-08-25 07:59:41.517999,2025-08-25 08:05:32.181354,0 days 00:05:50.663355,100,,uniform,8,nz,4.288303421914083e-06,0.4314617627905468,7278,624,688,128,0.8352865527637298,pca,Glorot,,logistic,0.0002899646759033203,1.175403594970703e-05,0.00028853416442871095,0.000569605827331543,COMPLETE,0.0002899646759033203,1.175403594970703e-05,0.00028853416442871095,0.000569605827331543
117,0.6829677805304527,2025-08-25 08:05:32.181664,2025-08-25 08:34:12.901330,0 days 00:28:40.719666,20,,uniform,8,nz,2.8290034550512043e-06,0.8589430940326509,3847,528,624,176,0.87315808542061,pca,old,0.7014718101261845,logistic,0.0014247655868530275,0.002527761459350586,0.0010071516036987305,0.0007393836975097656,COMPLETE,0.0014247655868530275,0.002527761459350586,0.0010071516036987305,0.0007393836975097656
118,0.8345000386238098,2025-08-25 08:34:12.903341,2025-08-25 08:40:00.228121,0 days 00:05:47.324780,100,,uniform,8,nz,3.6263461397600296e-06,0.41240776832544046,3200,848,976,160,0.7831781547114547,pca,Glorot,,logistic,0.0011452913284301757,0.00018854141235351561,0.0026785612106323244,0.0005687713623046875,COMPLETE,0.0011452913284301757,0.00018854141235351561,0.0026785612106323244,0.0005687713623046875
119,0.8274032711982727,2025-08-25 08:40:00.229783,2025-08-25 08:45:45.402060,0 days 00:05:45.172277,100,,uniform,5,nz,2.06989901504377e-06,0.039793758811674664,9757,768,592,384,0.770318115216234,pca,Glorot,,tanh,0.006165631612141928,0.004196619987487793,0.006999611854553223,0.007300662994384766,COMPLETE,0.006165631612141928,0.004196619987487793,0.006999611854553223,0.007300662994384766
120,0.7998387217521667,2025-08-25 08:45:45.402356,2025-08-25 08:51:34.476037,0 days 00:05:49.073681,100,,uniform,5,nz,3.2926477174475326e-06,0.03177072628481336,4435,720,496,304,0.7603704035671128,pca,Glorot,,tanh,0.006959780057271322,0.005908465385437012,0.008132600784301757,0.006838274002075195,COMPLETE,0.006959780057271322,0.005908465385437012,0.008132600784301757,0.006838274002075195
121,0.12862903773784637,2025-08-25 08:51:34.476355,2025-08-25 08:57:25.205129,0 days 00:05:50.728774,100,,uniform,8,nz,7.731303915922259e-07,0.07284186990969328,918,960,816,208,0.7653346899364089,pca,Glorot,,logistic,0.012839825948079427,0.013152146339416504,0.012980270385742187,0.01238706111907959,COMPLETE,0.012839825948079427,0.013152146339416504,0.012980270385742187,0.01238706111907959
122,0.5468548625707627,2025-08-25 08:57:25.205482,2025-08-25 09:03:14.504178,0 days 00:05:49.298696,100,,normal,8,nz,1.6910423202845651e-06,0.5316838426444052,8648,832,656,240,0.7734811760724326,pca,Glorot,,logistic,0.0013070265452067057,0.0022001266479492188,0.00028107166290283205,0.0014398813247680664,COMPLETE,0.0013070265452067057,0.0022001266479492188,0.00028107166290283205,0.0014398813247680664
123,0.09798387438058853,2025-08-25 09:03:14.505014,2025-08-25 09:31:50.838614,0 days 00:28:36.333600,20,,uniform,5,nz,1.472446553619201e-06,0.4936718674846427,6770,896,976,432,,raw,Glorot,,tanh,,,,,COMPLETE,,,,
124,0.7417258143424987,2025-08-25 09:31:50.838994,2025-08-25 09:37:38.743172,0 days 00:05:47.904178,100,,normal,6,nz,4.027496328599707e-06,0.3252077472587594,863,512,848,128,0.7815523136711637,pca,old,0.2019987969733914,logistic,0.006726773579915365,0.007396793365478516,0.009199929237365723,0.0035835981369018556,COMPLETE,0.006726773579915365,0.007396793365478516,0.009199929237365723,0.0035835981369018556
125,0.8405161619186401,2025-08-25 09:37:38.744965,2025-08-25 09:43:07.160244,0 days 00:05:28.415279,100,,uniform,5,zero,,0.059829533108431754,7781,768,800,672,0.7892209046890972,pca,Glorot,,tanh,0.00673369566599528,0.003639483451843262,0.007388019561767578,0.009173583984375,COMPLETE,0.00673369566599528,0.003639483451843262,0.007388019561767578,0.009173583984375
126,0.829032301902771,2025-08-25 09:43:07.160554,2025-08-25 09:48:37.662004,0 days 00:05:30.501450,100,,uniform,5,zero,,0.07830192615974516,3936,624,544,816,0.766508864590043,pca,Glorot,,tanh,0.006500609715779621,0.003351759910583496,0.005772614479064941,0.010377454757690429,COMPLETE,0.006500609715779621,0.003351759910583496,0.005772614479064941,0.010377454757690429
127,0.7677258491516114,2025-08-25 09:48:37.662290,2025-08-25 09:54:05.171592,0 days 00:05:27.509302,100,,uniform,5,zero,,0.3601620634414769,6479,704,912,800,0.683753289297632,pca,Glorot,,tanh,0.002299030621846517,0.00015285015106201172,-0.00015535354614257813,0.006899595260620117,COMPLETE,0.002299030621846517,0.00015285015106201172,-0.00015535354614257813,0.006899595260620117
