number,value,datetime_start,datetime_complete,duration,params_batch_size,params_colnorm_thresh,params_dist1,params_iseed,params_l2_penalty_choice,params_l2_penalty_nz,params_lr,params_lr_anneal_start,params_nhid1,params_nhid2,params_nhid3,params_pca_energy,params_preproc,params_scale_heur1,params_scale_mult1,params_squash,user_attrs_avg_fit_criteria,user_attrs_ed_cl1_mean,user_attrs_ed_cl2_mean,user_attrs_ed_cl3_mean,state,avg_fit_criteria,ed_cl1_mean,ed_cl2_mean,ed_cl3_mean
0,0.112693552672863,2025-08-24 10:50:01.479736,2025-08-24 10:55:43.262394,0 days 00:05:41.782658,100,,normal,8,nz,2.8332666515127185e-08,0.001043515710351857,106,832,992,912,,raw,Glorot,,logistic,0.013022700945536295,0.013055992126464844,0.012874031066894531,0.013138079643249511,COMPLETE,0.013022700945536295,0.013055992126464844,0.012874031066894531,0.013138079643249511
1,0.112693552672863,2025-08-24 10:55:43.264098,2025-08-24 11:01:04.763390,0 days 00:05:21.499292,100,,uniform,6,zero,,2.284837598099766e-06,233,896,448,832,,raw,old,1.8367687261504506,logistic,0.013075621922810872,0.012977027893066406,0.013243484497070312,0.013006353378295898,COMPLETE,0.013075621922810872,0.012977027893066406,0.013243484497070312,0.013006353378295898
2,0.112693552672863,2025-08-24 11:01:04.765115,2025-08-24 11:06:30.926200,0 days 00:05:26.161085,100,1.0979545731115338e-09,uniform,6,zero,,0.00019674545664986347,128,640,944,816,,colnorm,old,0.5522153215986169,tanh,0.013184801737467446,0.01311795711517334,0.01324012279510498,0.013196325302124024,COMPLETE,0.013184801737467446,0.01311795711517334,0.01324012279510498,0.013196325302124024
3,0.6913226127624512,2025-08-24 11:06:30.928576,2025-08-24 11:33:35.095142,0 days 00:27:04.166566,20,1.6410052678123524e-06,normal,5,zero,,0.09683714003316882,1848,16,320,448,,colnorm,Glorot,,logistic,0.004989075660705567,0.0005052328109741211,0.00608670711517334,0.008375287055969238,COMPLETE,0.004989075660705567,0.0005052328109741211,0.00608670711517334,0.008375287055969238
4,0.112693552672863,2025-08-24 11:33:35.095518,2025-08-24 11:38:56.400337,0 days 00:05:21.304819,100,,uniform,5,zero,,9.000040972326552e-05,243,800,736,816,,raw,old,1.91145773015142,logistic,0.013234734535217285,0.01307218074798584,0.013296389579772949,0.013335633277893066,COMPLETE,0.013234734535217285,0.01307218074798584,0.013296389579772949,0.013335633277893066
5,0.1170161321759224,2025-08-24 11:38:56.400638,2025-08-24 11:44:39.287915,0 days 00:05:42.887277,100,3.934854551086919e-06,normal,7,nz,2.5689072709426117e-05,5.276847581147895e-05,221,304,160,352,,colnorm,Glorot,,tanh,0.013113625844319661,0.012916922569274902,0.01329045295715332,0.013133502006530762,COMPLETE,0.013113625844319661,0.012916922569274902,0.01329045295715332,0.013133502006530762
6,0.5442742109298706,2025-08-24 11:44:39.289395,2025-08-24 11:50:09.789171,0 days 00:05:30.499776,100,,normal,7,zero,,0.008948220794904321,1367,576,288,1008,0.5712176866709087,pca,old,1.8459256038847829,tanh,0.01247259775797526,0.012227082252502441,0.012436914443969726,0.012753796577453614,COMPLETE,0.01247259775797526,0.012227082252502441,0.012436914443969726,0.012753796577453614
7,0.8002258181571961,2025-08-24 11:50:09.789467,2025-08-24 12:18:19.549324,0 days 00:28:09.759857,20,1.5719798915188787e-07,uniform,5,nz,7.135089719871652e-06,0.11046538250437803,2652,336,896,224,,colnorm,old,1.0886287623448017,tanh,0.004227733612060546,0.002589893341064453,0.008011198043823243,0.0020821094512939453,COMPLETE,0.004227733612060546,0.002589893341064453,0.008011198043823243,0.0020821094512939453
8,0.112693552672863,2025-08-24 12:18:19.549702,2025-08-24 12:24:03.815133,0 days 00:05:44.265431,100,,uniform,6,nz,1.1366707462439177e-05,1.7638895995727322e-06,755,624,112,832,,raw,old,1.4900201948996412,logistic,0.012937641143798828,0.013075304031372071,0.012648749351501464,0.013088870048522949,COMPLETE,0.012937641143798828,0.013075304031372071,0.012648749351501464,0.013088870048522949
9,0.112693552672863,2025-08-24 12:24:03.815421,2025-08-24 12:29:31.994066,0 days 00:05:28.178645,100,,uniform,5,zero,,2.738175791324914e-06,2000,16,960,896,0.6867118536767687,pca,Glorot,,logistic,0.013144151369730633,0.013043951988220216,0.013222312927246094,0.013166189193725586,COMPLETE,0.013144151369730633,0.013043951988220216,0.013222312927246094,0.013166189193725586
10,0.3225322663784027,2025-08-24 12:29:31.994338,2025-08-24 12:35:00.125938,0 days 00:05:28.131600,100,,uniform,7,zero,,0.002472295306383974,2075,112,320,64,0.7991185925525833,pca,old,0.2686955279215667,tanh,0.012833714485168457,0.013068318367004395,0.012661027908325195,0.012771797180175782,COMPLETE,0.012833714485168457,0.013068318367004395,0.012661027908325195,0.012771797180175782
11,0.1097580686211586,2025-08-24 12:35:00.126232,2025-08-24 12:40:40.423237,0 days 00:05:40.297005,100,,uniform,8,nz,2.4683800823808475e-05,0.5116031278834187,2319,496,880,688,,raw,Glorot,,logistic,,,,,COMPLETE,,,,
12,0.09798387438058853,2025-08-24 12:40:40.423575,2025-08-24 13:07:47.890897,0 days 00:27:07.467322,20,3.467309368910586e-08,normal,8,zero,,0.8326898905156366,728,720,928,1008,,colnorm,old,0.7145798120320814,tanh,,,,,COMPLETE,,,,
13,0.112693552672863,2025-08-24 13:07:47.891271,2025-08-24 13:13:14.162350,0 days 00:05:26.271079,100,,normal,6,zero,,0.0016713216495823414,6001,176,304,560,,raw,Glorot,,logistic,0.013012703259785971,0.013129878044128417,0.012807583808898926,0.013100647926330566,COMPLETE,0.013012703259785971,0.013129878044128417,0.012807583808898926,0.013100647926330566
14,0.112693552672863,2025-08-24 13:13:14.162674,2025-08-24 13:41:36.926777,0 days 00:28:22.764103,20,,uniform,7,nz,0.006961990992360462,0.001311633998556584,259,1024,416,912,,raw,Glorot,,logistic,0.01308581829071045,0.012959980964660644,0.01331171989440918,0.012985754013061523,COMPLETE,0.01308581829071045,0.012959980964660644,0.01331171989440918,0.012985754013061523
15,0.112693552672863,2025-08-24 13:41:36.928920,2025-08-24 13:46:59.801229,0 days 00:05:22.872309,100,1.2825638415243462e-08,uniform,8,zero,,0.08126110512979882,1033,640,432,384,,colnorm,old,0.7711479402733286,logistic,0.012975406646728515,0.013109493255615234,0.012989997863769531,0.01282672882080078,COMPLETE,0.012975406646728515,0.013109493255615234,0.012989997863769531,0.01282672882080078
16,0.8002419471740723,2025-08-24 13:46:59.801932,2025-08-24 13:52:45.412104,0 days 00:05:45.610172,100,,normal,5,nz,0.00019496797863316573,0.38950375706027657,4917,288,544,112,0.8767718604951436,pca,old,1.0225972650027455,logistic,0.0036826610565185553,0.00012824535369873046,0.005364131927490234,0.0055556058883666996,COMPLETE,0.0036826610565185553,0.00012824535369873046,0.005364131927490234,0.0055556058883666996
17,0.112693552672863,2025-08-24 13:52:45.412448,2025-08-24 13:58:31.609793,0 days 00:05:46.197345,100,,uniform,5,nz,6.681893158912448e-05,0.029530260809657753,6627,544,720,320,,raw,Glorot,,logistic,0.013222130139668782,0.013316917419433593,0.01336078643798828,0.012988686561584473,COMPLETE,0.013222130139668782,0.013316917419433593,0.01336078643798828,0.012988686561584473
18,0.112693552672863,2025-08-24 13:58:31.610107,2025-08-24 14:04:16.682805,0 days 00:05:45.072698,100,5.649235024409567e-09,normal,5,nz,1.2137831108849462e-07,0.00035584027141143896,189,992,32,704,,colnorm,Glorot,,logistic,0.013011948267618817,0.013045763969421387,0.012740397453308105,0.013249683380126952,COMPLETE,0.013011948267618817,0.013045763969421387,0.012740397453308105,0.013249683380126952
19,0.112693552672863,2025-08-24 14:04:16.683108,2025-08-24 14:31:11.598090,0 days 00:26:54.914982,20,,normal,8,zero,,1.656880448632194e-05,2154,720,272,944,,raw,Glorot,,logistic,0.01320080757141113,0.013195490837097168,0.013303637504577637,0.013103294372558593,COMPLETE,0.01320080757141113,0.013195490837097168,0.013303637504577637,0.013103294372558593
20,0.7690000414848328,2025-08-24 14:31:11.598465,2025-08-24 14:36:53.375261,0 days 00:05:41.776796,100,,normal,5,nz,0.0008218604965845548,0.09230881632014575,2962,112,464,192,0.9862158845029989,pca,old,1.1203562976833445,tanh,0.00040547053019205736,0.00016036033630371094,0.0009392023086547852,0.00011684894561767579,COMPLETE,0.00040547053019205736,0.00016036033630371094,0.0009392023086547852,0.00011684894561767579
21,0.7590484380722046,2025-08-24 14:36:53.375557,2025-08-24 15:05:21.245387,0 days 00:28:27.869830,20,0.0005860400898280002,uniform,5,nz,0.0008626022181846835,0.007618008877376423,2146,112,688,272,,colnorm,old,1.1840284880189698,tanh,0.010579299926757811,0.009102869033813476,0.011790919303894042,0.010844111442565918,COMPLETE,0.010579299926757811,0.009102869033813476,0.011790919303894042,0.010844111442565918
22,0.733774209022522,2025-08-24 15:05:21.246819,2025-08-24 15:11:07.595104,0 days 00:05:46.348285,100,,normal,5,nz,0.0003176091416307724,0.0223531142302019,1581,352,608,208,0.9727821557365688,pca,old,1.1211355783027463,tanh,0.009514403343200683,0.008703279495239257,0.010758161544799805,0.009081768989562988,COMPLETE,0.009514403343200683,0.008703279495239257,0.010758161544799805,0.009081768989562988
23,0.8045000076293946,2025-08-24 15:11:07.595416,2025-08-24 15:16:52.971511,0 days 00:05:45.376095,100,,normal,8,nz,1.7549150445791699e-06,0.27113779507277774,9942,320,544,208,0.9113180737210502,pca,old,1.0652692174251057,logistic,0.0005704323450724285,0.0002673149108886719,0.0008457660675048828,0.0005982160568237304,COMPLETE,0.0005704323450724285,0.0002673149108886719,0.0008457660675048828,0.0005982160568237304
24,0.7724032640457154,2025-08-24 15:16:52.971816,2025-08-24 15:22:38.354165,0 days 00:05:45.382349,100,,normal,8,nz,8.353781732663133e-07,0.09743301464448911,4120,496,256,224,0.8324495656550186,pca,old,0.9600260900187213,logistic,0.0017320076624552409,0.0008676052093505859,0.0019954442977905273,0.0023329734802246095,COMPLETE,0.0017320076624552409,0.0008676052093505859,0.0019954442977905273,0.0023329734802246095
25,0.7553548693656922,2025-08-24 15:22:38.355041,2025-08-24 15:51:08.542510,0 days 00:28:30.187469,20,,normal,8,nz,1.5862041502308126e-06,0.19441467590334874,5022,288,640,112,,raw,old,1.2365016050456141,logistic,0.0035030603408813476,0.0028449535369873048,0.005792498588562012,0.0018717288970947266,COMPLETE,0.0035030603408813476,0.0028449535369873048,0.005792498588562012,0.0018717288970947266
26,0.7643226265907288,2025-08-24 15:51:08.542905,2025-08-24 16:19:36.517966,0 days 00:28:27.975061,20,4.8604335879942536e-05,uniform,8,nz,2.4481433139119853e-06,0.14133489539342114,5059,560,928,64,,colnorm,old,0.950226540035759,tanh,0.0012357393900553385,0.0006815910339355469,0.003043985366821289,-1.8358230590820312e-05,COMPLETE,0.0012357393900553385,0.0006815910339355469,0.003043985366821289,-1.8358230590820312e-05
27,0.6520967945456505,2025-08-24 16:19:36.518362,2025-08-24 16:25:23.570548,0 days 00:05:47.052186,100,,normal,8,nz,2.720671741197716e-06,0.30258864730360874,9991,272,1008,288,0.8691351649299298,pca,old,1.3832937824976124,logistic,0.0025713284810384117,0.0021429538726806642,0.0038738250732421875,0.001697206497192383,COMPLETE,0.0025713284810384117,0.0021429538726806642,0.0038738250732421875,0.001697206497192383
28,0.5299839049577713,2025-08-24 16:25:23.572337,2025-08-24 16:30:53.887721,0 days 00:05:30.315384,100,,normal,5,zero,,0.955530570377776,2094,416,576,128,0.8794017512496043,pca,old,0.9008979492283923,logistic,,,,,COMPLETE,,,,
29,0.8078709959983825,2025-08-24 16:30:53.889123,2025-08-24 16:59:17.014563,0 days 00:28:23.125440,20,,normal,5,nz,4.7725160287781117e-05,0.41460285999340235,5216,288,496,208,0.7497432491505985,pca,Glorot,,logistic,0.00226139227549235,-3.9649009704589846e-05,0.0010022878646850585,0.005821537971496582,COMPLETE,0.00226139227549235,-3.9649009704589846e-05,0.0010022878646850585,0.005821537971496582
30,0.749419367313385,2025-08-24 16:59:17.014940,2025-08-24 17:27:42.385518,0 days 00:28:25.370578,20,,normal,5,nz,0.00013325509276498608,0.08501345927078906,2552,320,432,272,0.7386485733160716,pca,Glorot,,logistic,0.0038590987523396806,0.0022252798080444336,0.005423974990844726,0.003928041458129883,COMPLETE,0.0038590987523396806,0.0022252798080444336,0.005423974990844726,0.003928041458129883
31,0.8184193968772888,2025-08-24 17:27:42.385910,2025-08-24 17:34:18.467751,0 days 00:06:36.081841,100,,normal,5,nz,2.173101557335479e-05,0.49195305803403727,6884,224,496,192,0.8537003258178508,pca,old,1.318284271172868,logistic,0.0012149969736735026,0.00023038387298583983,0.0003180742263793945,0.0030965328216552733,COMPLETE,0.0012149969736735026,0.00023038387298583983,0.0003180742263793945,0.0030965328216552733
32,0.7633710145950318,2025-08-24 17:34:18.468039,2025-08-24 17:40:57.327416,0 days 00:06:38.859377,100,,normal,7,nz,6.891083109351832e-05,0.05299798059954684,7896,160,240,320,0.8617068021094235,pca,Glorot,,logistic,0.0025818586349487306,0.000487828254699707,0.0029874563217163084,0.004270291328430176,COMPLETE,0.0025818586349487306,0.000487828254699707,0.0029874563217163084,0.004270291328430176
33,0.7115806698799133,2025-08-24 17:40:57.327721,2025-08-24 17:46:37.976991,0 days 00:05:40.649270,100,2.8525242149278346e-05,normal,5,nz,5.6217285958970655e-05,0.06500563164066132,6004,368,576,384,,colnorm,old,1.4608916281150295,logistic,0.0034159024556477866,0.0009339094161987304,0.004907655715942383,0.004406142234802246,COMPLETE,0.0034159024556477866,0.0009339094161987304,0.004907655715942383,0.004406142234802246
34,0.8298064947128296,2025-08-24 17:46:37.977829,2025-08-24 17:53:25.724915,0 days 00:06:47.747086,100,,normal,8,nz,3.9377341094040605e-05,0.8686235054546119,6572,272,528,48,0.8717192164958872,pca,Glorot,,logistic,0.0008535305658976238,7.05718994140625e-05,0.0016122102737426759,0.0008778095245361329,COMPLETE,0.0008535305658976238,7.05718994140625e-05,0.0016122102737426759,0.0008778095245361329
35,0.7503226041793823,2025-08-24 17:53:25.725203,2025-08-24 18:27:42.397798,0 days 00:34:16.672595,20,,uniform,5,nz,1.106216175563657e-05,0.019944830369786108,8075,656,496,368,0.7509321916597796,pca,old,1.5551593691112449,logistic,0.006541299819946288,0.0056519746780395504,0.007306528091430664,0.0066653966903686525,COMPLETE,0.006541299819946288,0.0056519746780395504,0.007306528091430664,0.0066653966903686525
36,0.801903235912323,2025-08-24 18:27:42.398745,2025-08-24 18:59:21.918738,0 days 00:31:39.519993,20,,normal,7,zero,,0.32728789607173536,6743,144,368,64,0.8855383461339587,pca,Glorot,,logistic,0.0003853241602579753,0.00029118061065673827,0.00012021064758300781,0.0007445812225341797,COMPLETE,0.0003853241602579753,0.00029118061065673827,0.00012021064758300781,0.0007445812225341797
37,0.7936935663223267,2025-08-24 18:59:21.919122,2025-08-24 19:06:16.061576,0 days 00:06:54.142454,100,8.060084948250418e-07,normal,8,nz,4.964789103568104e-06,0.4910695510508197,5640,208,512,96,,colnorm,Glorot,,logistic,0.00042085647583007814,-0.00026977062225341797,0.0009470939636230469,0.0005852460861206054,COMPLETE,0.00042085647583007814,-0.00026977062225341797,0.0009470939636230469,0.0005852460861206054
38,0.8026774287223816,2025-08-24 19:06:16.063636,2025-08-24 19:13:03.571732,0 days 00:06:47.508096,100,,normal,8,nz,2.4043616530216826e-05,0.12400369220704652,6801,48,480,144,0.7872226480233185,pca,old,0.44871138509180053,logistic,0.0009894450505574545,-0.0001401662826538086,0.0020592212677001953,0.0010492801666259766,COMPLETE,0.0009894450505574545,-0.0001401662826538086,0.0020592212677001953,0.0010492801666259766
39,0.112693552672863,2025-08-24 19:13:03.572049,2025-08-24 19:44:33.231385,0 days 00:31:29.659336,20,,uniform,8,nz,1.8219251012103052e-07,0.004129826266804493,4235,256,656,128,0.9113399816419567,pca,Glorot,,logistic,0.013221240043640137,0.013209676742553711,0.013048529624938965,0.013405513763427735,COMPLETE,0.013221240043640137,0.013209676742553711,0.013048529624938965,0.013405513763427735
40,0.7930161476135253,2025-08-24 19:44:33.231788,2025-08-24 19:51:10.052264,0 days 00:06:36.820476,100,,uniform,5,zero,,0.7256215135331828,4276,80,544,48,0.7838069081453694,pca,Glorot,,logistic,-6.903807322184243e-05,-6.153583526611329e-05,-0.0003402471542358398,0.00019466876983642578,COMPLETE,-6.903807322184243e-05,-6.153583526611329e-05,-0.0003402471542358398,0.00019466876983642578
41,0.112693552672863,2025-08-24 19:51:10.054210,2025-08-24 19:57:55.906404,0 days 00:06:45.852194,100,,normal,8,nz,2.53321813450945e-05,0.007283081036326334,1453,16,336,192,0.7784344126932716,pca,old,0.2777840728542371,logistic,0.012638529141743978,0.012064099311828613,0.013036727905273438,0.012814760208129883,COMPLETE,0.012638529141743978,0.012064099311828613,0.013036727905273438,0.012814760208129883
42,0.8279677867889405,2025-08-24 19:57:55.908341,2025-08-24 20:04:52.211766,0 days 00:06:56.303425,100,,uniform,8,nz,2.4531163361873304e-05,0.4513850411367776,6601,304,240,96,0.8066868414514176,pca,Glorot,,logistic,0.0005761543909708659,-8.759498596191406e-05,7.79867172241211e-05,0.0017380714416503906,COMPLETE,0.0005761543909708659,-8.759498596191406e-05,7.79867172241211e-05,0.0017380714416503906
43,0.25229033529758454,2025-08-24 20:04:52.212636,2025-08-24 20:11:46.273609,0 days 00:06:54.060973,100,,uniform,8,nz,2.4834609900072686e-05,0.5237435051371537,5670,512,128,240,0.8695244287919489,pca,Glorot,,logistic,,,,,COMPLETE,,,,
44,0.7659193992614746,2025-08-24 20:11:46.273993,2025-08-24 20:18:15.819769,0 days 00:06:29.545776,100,,normal,8,nz,2.5788214904428086e-05,0.5750033297003915,7007,464,640,112,0.8403677079111533,pca,Glorot,,tanh,6.817181905110679e-05,-0.00031855106353759763,0.00010192394256591797,0.000421142578125,COMPLETE,6.817181905110679e-05,-0.00031855106353759763,0.00010192394256591797,0.000421142578125
45,0.112693552672863,2025-08-24 20:18:15.820061,2025-08-24 20:24:02.043727,0 days 00:05:46.223666,100,,uniform,8,zero,,0.021902328256399126,7449,160,368,96,,raw,Glorot,,logistic,0.013097000122070315,0.013095617294311523,0.012908840179443359,0.013286542892456055,COMPLETE,0.013097000122070315,0.013095617294311523,0.012908840179443359,0.013286542892456055
46,0.24367743134498596,2025-08-24 20:24:02.044084,2025-08-24 20:51:30.557257,0 days 00:27:28.513173,20,,normal,5,zero,,0.9532221154166993,8628,512,848,240,0.6843784010546804,pca,Glorot,,logistic,0.005463361740112305,0.009875869750976563,0.002443218231201172,0.00407099723815918,COMPLETE,0.005463361740112305,0.009875869750976563,0.002443218231201172,0.00407099723815918
47,0.7753871321678162,2025-08-24 20:51:30.557664,2025-08-24 20:57:15.663817,0 days 00:05:45.106153,100,,uniform,6,nz,5.259940254786277e-06,0.13205324312993882,6304,496,544,288,0.893086248571639,pca,old,1.45812099444259,logistic,0.001604604721069336,0.00015249252319335938,0.0027273893356323242,0.0019339323043823242,COMPLETE,0.001604604721069336,0.00015249252319335938,0.0027273893356323242,0.0019339323043823242
48,0.112693552672863,2025-08-24 20:57:15.664137,2025-08-24 21:02:46.752580,0 days 00:05:31.088443,100,,normal,8,zero,,0.9900449745584433,4635,128,432,272,0.8000455677273478,pca,Glorot,,logistic,0.0037968317667643227,0.006010103225708008,0.0004287242889404297,0.004951667785644531,COMPLETE,0.0037968317667643227,0.006010103225708008,0.0004287242889404297,0.004951667785644531
49,0.09798387438058853,2025-08-24 21:02:46.752863,2025-08-24 21:31:03.714213,0 days 00:28:16.961350,20,0.0005387233852943401,normal,6,nz,7.300682447209617e-05,0.40256798337054067,8265,96,512,320,,colnorm,Glorot,,tanh,,,,,COMPLETE,,,,
50,0.112693552672863,2025-08-24 21:31:03.714594,2025-08-24 21:59:33.514053,0 days 00:28:29.799459,20,,normal,6,nz,1.7410235339250146e-08,0.633071170080135,3259,224,448,432,0.899816819945272,pca,old,1.4112929383028705,logistic,0.003557713826497396,0.00827043056488037,0.0006488323211669922,0.0017538785934448243,COMPLETE,0.003557713826497396,0.00827043056488037,0.0006488323211669922,0.0017538785934448243
51,0.48622581362724304,2025-08-24 21:59:33.514457,2025-08-24 22:05:18.208426,0 days 00:05:44.693969,100,,normal,8,nz,2.9512033154860853e-05,0.026445760307940838,7677,96,560,32,0.7569636163016341,pca,Glorot,,logistic,0.0055916150410970054,0.005623912811279297,0.010581398010253906,0.0005695343017578125,COMPLETE,0.0055916150410970054,0.005623912811279297,0.010581398010253906,0.0005695343017578125
52,0.2786290407180786,2025-08-24 22:05:18.209263,2025-08-24 22:33:32.339645,0 days 00:28:14.130382,20,,normal,5,nz,1.8636401077295784e-05,0.08054983907314268,8231,512,496,112,,raw,Glorot,,logistic,0.01024627685546875,0.011242079734802245,0.011466240882873536,0.008030509948730469,COMPLETE,0.01024627685546875,0.011242079734802245,0.011466240882873536,0.008030509948730469
53,0.7979193687438965,2025-08-24 22:33:32.340023,2025-08-24 22:39:16.391479,0 days 00:05:44.051456,100,,uniform,8,nz,1.1488259022284194e-05,0.5030224343641158,1855,128,384,80,0.7840421117941895,pca,old,0.4975277177882127,logistic,0.0005662282307942708,0.00042421817779541015,0.0011827945709228516,9.167194366455078e-05,COMPLETE,0.0005662282307942708,0.00042421817779541015,0.0011827945709228516,9.167194366455078e-05
54,0.5895967960357666,2025-08-24 22:39:16.391812,2025-08-24 22:44:58.291672,0 days 00:05:41.899860,100,,uniform,6,nz,3.858028253623174e-05,0.04498185981573663,4178,128,464,64,0.802532348575238,pca,Glorot,,logistic,0.005884051322937012,0.005948209762573242,0.009607219696044922,0.002096724510192871,COMPLETE,0.005884051322937012,0.005948209762573242,0.009607219696044922,0.002096724510192871
