number,value,datetime_start,datetime_complete,duration,params_batch_size,params_colnorm_thresh,params_dist1,params_iseed,params_l2_penalty_choice,params_l2_penalty_nz,params_lr,params_lr_anneal_start,params_nhid1,params_pca_energy,params_preproc,params_scale_heur1,params_scale_mult1,params_squash,state
0,0.5435344179471334,2025-08-19 16:21:29.163760,2025-08-19 16:25:10.503363,0 days 00:03:41.339603,20,,normal,8,nz,1.5463788579841117e-06,0.00016653461936159484,1323,832,,raw,Glorot,,tanh,COMPLETE
1,0.5065000653266907,2025-08-19 16:25:10.503970,2025-08-19 16:25:53.308378,0 days 00:00:42.804408,100,,uniform,8,nz,1.9236748753487186e-08,2.0547199328558902e-05,7073,592,0.6584180610844357,pca,Glorot,,tanh,COMPLETE
2,0.7969139019648234,2025-08-19 16:25:53.308588,2025-08-19 16:26:33.196291,0 days 00:00:39.887703,100,,normal,5,zero,,0.5659923651826084,3833,128,,raw,old,1.9857466391390506,tanh,COMPLETE
3,0.5279308954874674,2025-08-19 16:26:33.196801,2025-08-19 16:29:47.254597,0 days 00:03:14.057796,20,,uniform,8,zero,,0.0004181759315680524,1673,496,0.7936518167319924,pca,old,0.7411550703865422,logistic,COMPLETE
4,0.5872583587964376,2025-08-19 16:29:47.259283,2025-08-19 16:30:27.785590,0 days 00:00:40.526307,100,0.0005111785038494985,uniform,6,zero,,0.01772932380115616,3920,496,,colnorm,Glorot,,logistic,COMPLETE
5,0.8249826232592264,2025-08-19 16:30:27.785832,2025-08-19 16:33:52.775949,0 days 00:03:24.990117,20,,uniform,7,nz,2.754579187431946e-08,0.04731325254594746,1576,272,0.9395345807573379,pca,Glorot,,tanh,COMPLETE
6,0.5140172839164734,2025-08-19 16:33:52.779603,2025-08-19 16:34:34.955878,0 days 00:00:42.176275,100,,uniform,8,nz,4.347699888300888e-07,0.002194664177038812,147,1024,,raw,Glorot,,logistic,COMPLETE
7,0.8045172691345215,2025-08-19 16:34:34.956191,2025-08-19 16:35:16.257458,0 days 00:00:41.301267,100,0.00030649167289104257,normal,5,zero,,0.0816998127615149,1228,688,,colnorm,Glorot,,tanh,COMPLETE
8,0.7507758140563965,2025-08-19 16:35:16.257859,2025-08-19 16:35:59.100829,0 days 00:00:42.842970,100,,uniform,7,nz,0.0002645568202790849,0.02422873547786384,891,720,0.8913677959876881,pca,old,0.8538315683484765,tanh,COMPLETE
9,0.5089310805002848,2025-08-19 16:35:59.101318,2025-08-19 16:36:39.023588,0 days 00:00:39.922270,100,,uniform,7,zero,,3.170750300370449e-06,3320,656,0.9406161231694635,pca,old,0.8029927440054692,tanh,COMPLETE
10,0.8456380764643351,2025-08-19 16:36:39.023890,2025-08-19 16:40:05.209410,0 days 00:03:26.185520,20,,normal,8,nz,0.002551744641784246,0.03420715013038941,7313,368,0.936638035172104,pca,old,1.3715103262460462,tanh,COMPLETE
11,0.5149654746055603,2025-08-19 16:40:05.212664,2025-08-19 16:40:44.344146,0 days 00:00:39.131482,100,,uniform,5,zero,,0.002472295306383974,2075,64,,raw,old,0.2686955279215667,tanh,COMPLETE
12,0.7748618523279825,2025-08-19 16:40:44.344463,2025-08-19 16:43:56.578826,0 days 00:03:12.234363,20,,normal,8,zero,,0.12633115655273697,7996,496,,raw,old,1.2383117176396174,tanh,COMPLETE
13,0.7363448341687521,2025-08-19 16:43:56.579336,2025-08-19 16:44:36.795289,0 days 00:00:40.215953,100,0.00026396605532175534,normal,8,zero,,0.0856956409647669,1799,288,,colnorm,old,1.2920153892124882,logistic,COMPLETE
14,0.8032242655754089,2025-08-19 16:44:36.795766,2025-08-19 16:47:50.065446,0 days 00:03:13.269680,20,1.9234441996304963e-05,normal,5,zero,,0.1914526965665586,1879,192,,colnorm,Glorot,,logistic,COMPLETE
15,0.6919482747713724,2025-08-19 16:47:50.065979,2025-08-19 16:51:12.666785,0 days 00:03:22.600806,20,1.2471437960535648e-06,normal,5,nz,1.3116339985565845e-05,0.002599150833651273,8061,416,,colnorm,Glorot,,tanh,COMPLETE
16,0.5972587068875631,2025-08-19 16:51:12.670035,2025-08-19 16:54:32.087027,0 days 00:03:19.416992,20,,uniform,7,nz,0.00942013057585862,0.7951350324458333,1666,400,0.9994765855364893,pca,Glorot,,tanh,COMPLETE
17,0.7623965938886007,2025-08-19 16:54:32.097134,2025-08-19 16:57:51.515164,0 days 00:03:19.418030,20,,uniform,5,nz,0.0008446065137405351,0.019500772470995777,5629,224,0.8453481293823546,pca,old,1.6141249876472938,tanh,COMPLETE
18,0.5821380019187927,2025-08-19 16:57:51.515639,2025-08-19 17:01:08.955892,0 days 00:03:17.440253,20,,normal,8,nz,1.2380799136897e-08,0.01628867801122086,8927,416,0.54680849579514,pca,old,1.595453026887686,tanh,COMPLETE
19,0.5289482275644938,2025-08-19 17:01:08.956357,2025-08-19 17:04:24.475572,0 days 00:03:15.519215,20,,uniform,6,nz,0.009639207774279644,0.0063686700838055605,362,16,0.9863224867010605,pca,Glorot,,tanh,COMPLETE
20,0.529051661491394,2025-08-19 17:04:24.476020,2025-08-19 17:07:25.771500,0 days 00:03:01.295480,20,,uniform,7,zero,,0.0016902435615452642,3660,16,0.7600278081285218,pca,Glorot,,tanh,COMPLETE
21,0.776206910610199,2025-08-19 17:07:25.771978,2025-08-19 17:08:04.126175,0 days 00:00:38.354197,100,2.5006713132784543e-09,normal,5,zero,,0.1820551231888667,803,880,,colnorm,Glorot,,tanh,COMPLETE
22,0.7931378483772278,2025-08-19 17:08:04.126618,2025-08-19 17:08:43.026377,0 days 00:00:38.899759,100,,normal,5,zero,,0.0389956698919132,1393,320,0.875081049904634,pca,Glorot,,tanh,COMPLETE
23,0.5819998780886332,2025-08-19 17:08:43.026574,2025-08-19 17:09:21.461500,0 days 00:00:38.434926,100,1.1928268566674063e-07,normal,6,zero,,0.003863235920649125,591,608,,colnorm,Glorot,,tanh,COMPLETE
24,0.5775000850359598,2025-08-19 17:09:21.461920,2025-08-19 17:12:39.660247,0 days 00:03:18.198327,20,,uniform,7,nz,9.12133668933247e-05,0.010368163525940312,2810,144,,raw,Glorot,,logistic,COMPLETE
25,0.7665517528851827,2025-08-19 17:12:39.660725,2025-08-19 17:15:57.788801,0 days 00:03:18.128076,20,8.302603956920953e-06,uniform,5,nz,1.6059883335916526e-07,0.07964937982170818,570,656,,colnorm,Glorot,,tanh,COMPLETE
26,0.6402414639790853,2025-08-19 17:15:57.789262,2025-08-19 17:19:13.615544,0 days 00:03:15.826282,20,,normal,7,nz,8.58384219763682e-06,0.009477770760581794,7342,96,0.8935875102158602,pca,old,1.248108542467212,logistic,COMPLETE
27,0.7564998070398966,2025-08-19 17:19:13.616014,2025-08-19 17:19:54.423533,0 days 00:00:40.807519,100,,normal,7,nz,1.1145998915794457e-08,0.23437758646250859,1007,800,,raw,Glorot,,tanh,COMPLETE
28,0.7702590227127075,2025-08-19 17:19:54.423836,2025-08-19 17:20:32.357741,0 days 00:00:37.933905,100,,uniform,5,zero,,0.22834367706067613,835,688,,raw,Glorot,,tanh,COMPLETE
29,0.5170345306396484,2025-08-19 17:20:32.358092,2025-08-19 17:21:10.993286,0 days 00:00:38.635194,100,0.0008795071701931075,normal,5,zero,,8.426407870504551e-05,3250,736,,colnorm,Glorot,,logistic,COMPLETE
30,0.6297587553660074,2025-08-19 17:21:10.993729,2025-08-19 17:24:26.775410,0 days 00:03:15.781681,20,1.2513975001540644e-05,uniform,7,nz,0.0004146834812290588,0.014225847931312312,857,64,,colnorm,Glorot,,tanh,COMPLETE
31,0.638034443060557,2025-08-19 17:24:26.776309,2025-08-19 17:27:32.180083,0 days 00:03:05.403774,20,2.3223277573337248e-05,normal,5,zero,,0.0465956607586981,1433,320,,colnorm,Glorot,,logistic,COMPLETE
32,0.6080517570177714,2025-08-19 17:27:32.180843,2025-08-19 17:28:14.764449,0 days 00:00:42.583606,100,,uniform,7,nz,5.261637618689771e-07,0.007062700598632587,1280,192,0.9925872110075498,pca,Glorot,,tanh,COMPLETE
33,0.8315860629081726,2025-08-19 17:28:14.764913,2025-08-19 17:31:22.918735,0 days 00:03:08.153822,20,1.8030656423355598e-05,normal,5,zero,,0.3777517651314561,6754,240,,colnorm,old,1.9535520591996793,logistic,COMPLETE
34,0.8251036008199056,2025-08-19 17:31:22.919474,2025-08-19 17:34:30.130252,0 days 00:03:07.210778,20,,uniform,5,zero,,0.2980810339049786,9489,160,,raw,old,1.952142595290311,logistic,COMPLETE
35,0.8226204911867777,2025-08-19 17:34:30.130726,2025-08-19 17:37:33.976443,0 days 00:03:03.845717,20,5.333485222826273e-08,uniform,5,zero,,0.5429465089137406,8179,112,,colnorm,old,1.9768115556648762,logistic,COMPLETE
36,0.8353966474533081,2025-08-19 17:37:33.981708,2025-08-19 17:40:38.172153,0 days 00:03:04.190445,20,,normal,5,zero,,0.596757779200988,7624,288,,raw,old,1.9794060004039304,logistic,COMPLETE
37,0.8353103597958883,2025-08-19 17:40:38.172884,2025-08-19 17:43:41.677038,0 days 00:03:03.504154,20,,normal,6,zero,,0.08661972451624791,5101,272,,raw,old,1.988849998056197,logistic,COMPLETE
38,0.8396552205085754,2025-08-19 17:43:41.677493,2025-08-19 17:46:48.134065,0 days 00:03:06.456572,20,,normal,6,zero,,0.09444535947013513,6877,368,,raw,old,1.9934359182645787,logistic,COMPLETE
39,0.8158965706825256,2025-08-19 17:46:48.134524,2025-08-19 17:50:08.611887,0 days 00:03:20.477363,20,,normal,6,nz,6.86099045886798e-05,0.07209278365836637,2731,144,,raw,old,1.977116731837773,logistic,COMPLETE
40,0.8310000499089559,2025-08-19 17:50:08.612774,2025-08-19 17:53:12.877263,0 days 00:03:04.264489,20,,normal,6,zero,,0.04839458047157304,9682,288,,raw,Glorot,,logistic,COMPLETE
41,0.841206967830658,2025-08-19 17:53:12.878194,2025-08-19 17:56:16.606882,0 days 00:03:03.728688,20,,normal,7,zero,,0.23476550805680313,7784,320,,raw,old,1.9913947874253521,logistic,COMPLETE
42,0.8371034463246664,2025-08-19 17:56:16.607335,2025-08-19 17:59:21.179503,0 days 00:03:04.572168,20,,normal,7,zero,,0.13368387823179373,7558,288,,raw,old,1.9395590610034423,logistic,COMPLETE
43,0.7489999532699585,2025-08-19 17:59:21.182443,2025-08-19 18:02:25.780782,0 days 00:03:04.598339,20,,normal,7,zero,,0.013261070846158764,6280,496,,raw,old,1.676466755003935,logistic,COMPLETE
44,0.7609653870264689,2025-08-19 18:02:25.781227,2025-08-19 18:05:42.410179,0 days 00:03:16.628952,20,,normal,7,nz,0.0017236590315145457,0.48368958903563186,8692,336,,raw,old,1.993866047772714,logistic,COMPLETE
45,0.8285347024599711,2025-08-19 18:05:42.412886,2025-08-19 18:06:20.039214,0 days 00:00:37.626328,100,,normal,5,zero,,0.13013513279202138,7253,304,,raw,old,1.708925027999472,logistic,COMPLETE
46,0.7026381095250448,2025-08-19 18:06:20.039420,2025-08-19 18:09:23.969682,0 days 00:03:03.930262,20,,normal,7,zero,,0.6576306521833658,4967,400,0.6689168444516127,pca,old,1.9905145842104592,logistic,COMPLETE
47,0.8262930909792582,2025-08-19 18:09:23.970135,2025-08-19 18:12:31.297804,0 days 00:03:07.327669,20,,normal,7,zero,,0.2639410014659581,4124,128,,raw,old,1.6653301839143926,logistic,COMPLETE
48,0.8374484578768412,2025-08-19 18:12:31.298258,2025-08-19 18:15:36.463387,0 days 00:03:05.165129,20,,normal,5,zero,,0.1133334177013292,9369,480,,raw,old,1.9956577029133766,logistic,COMPLETE
49,0.5550862749417623,2025-08-19 18:15:36.463862,2025-08-19 18:18:39.893190,0 days 00:03:03.429328,20,,normal,7,zero,,0.0006522097651832193,8085,32,,raw,old,1.9941162759266415,tanh,COMPLETE
50,0.8255000114440918,2025-08-19 18:18:39.893645,2025-08-19 18:21:44.858878,0 days 00:03:04.965233,20,,uniform,5,zero,,0.08615113975455817,4421,720,,raw,Glorot,,logistic,COMPLETE
51,0.8365862568219503,2025-08-19 18:21:44.860999,2025-08-19 18:24:51.021371,0 days 00:03:06.160372,20,,normal,5,zero,,0.02864982561679645,9529,720,,raw,old,1.9680647851162338,logistic,COMPLETE
52,0.8161723812421163,2025-08-19 18:24:51.023507,2025-08-19 18:28:10.074352,0 days 00:03:19.050845,20,,normal,5,nz,2.6997629390628556e-05,0.017497302162395627,8855,976,,raw,old,1.9962788322085028,logistic,COMPLETE
53,0.8405689199765524,2025-08-19 18:28:10.078004,2025-08-19 18:31:15.654358,0 days 00:03:05.576354,20,,normal,5,zero,,0.008163401614763787,8495,672,,raw,Glorot,,tanh,COMPLETE
54,0.6202758351961771,2025-08-19 18:31:15.654829,2025-08-19 18:34:22.049313,0 days 00:03:06.394484,20,,normal,5,zero,,0.0009308553333608308,8189,656,,raw,Glorot,,tanh,COMPLETE
55,0.6081379254659017,2025-08-19 18:34:22.049791,2025-08-19 18:37:41.969482,0 days 00:03:19.919691,20,3.543807998541489e-09,normal,8,nz,0.0074335954882799185,0.07748106203977483,4021,320,,colnorm,old,1.562711928297113,tanh,COMPLETE
56,0.7503967682520548,2025-08-19 18:37:41.973874,2025-08-19 18:40:47.079272,0 days 00:03:05.105398,20,,uniform,6,zero,,0.24359711927199282,6913,624,0.7486125097178281,pca,old,1.6001842987426955,logistic,COMPLETE
57,0.5183621048927307,2025-08-19 18:40:47.079727,2025-08-19 18:43:51.194033,0 days 00:03:04.114306,20,,normal,8,zero,,0.00042632971491582557,2339,672,0.5496345251852142,pca,old,1.726359599156913,tanh,COMPLETE
58,0.5602585077285767,2025-08-19 18:43:51.194504,2025-08-19 18:44:28.572881,0 days 00:00:37.378377,100,,normal,6,zero,,0.0017732247118471818,5212,672,,raw,old,1.9939619967529147,logistic,COMPLETE
59,0.5610172351201376,2025-08-19 18:44:28.573237,2025-08-19 18:47:46.648488,0 days 00:03:18.075251,20,,normal,8,nz,0.00019188369836587737,0.0019126860503835175,5132,480,,raw,old,1.70069630610306,logistic,COMPLETE
60,0.8034653266270956,2025-08-19 18:47:46.650786,2025-08-19 18:48:24.249365,0 days 00:00:37.598579,100,,uniform,7,zero,,0.6706651562406926,1454,384,,raw,old,1.2031105897868188,logistic,COMPLETE
61,0.7572929660479227,2025-08-19 18:48:24.249794,2025-08-19 18:51:30.135205,0 days 00:03:05.885411,20,,uniform,5,zero,,0.003655671842656369,5387,912,,raw,old,1.9850752432888432,tanh,COMPLETE
62,0.7431206703186035,2025-08-19 18:51:30.135688,2025-08-19 18:54:36.423411,0 days 00:03:06.287723,20,,normal,5,zero,,0.0734056742826385,8047,960,0.7946564210687812,pca,old,1.9820294787578392,logistic,COMPLETE
63,0.8195172548294067,2025-08-19 18:54:36.423875,2025-08-19 18:57:41.452325,0 days 00:03:05.028450,20,,normal,6,zero,,0.024845611167488617,1560,752,,raw,Glorot,,tanh,COMPLETE
64,0.5608793497085571,2025-08-19 18:57:41.452781,2025-08-19 18:58:22.114221,0 days 00:00:40.661440,100,,normal,5,nz,0.0007375403281282578,0.0008186297193264277,3027,432,0.7071881176317486,pca,old,1.7627219306889415,tanh,COMPLETE
65,0.7753623127937317,2025-08-19 18:58:22.114423,2025-08-19 19:01:26.272002,0 days 00:03:04.157579,20,,normal,7,zero,,0.3725617172159404,6569,624,,raw,Glorot,,tanh,COMPLETE
66,0.5076207121213278,2025-08-19 19:01:26.272454,2025-08-19 19:04:34.348028,0 days 00:03:08.075574,20,,normal,5,zero,,0.00023811175312724682,4265,528,,raw,old,0.5556015187817201,logistic,COMPLETE
67,0.6481378078460693,2025-08-19 19:04:34.348476,2025-08-19 19:05:12.827824,0 days 00:00:38.479348,100,,normal,5,zero,,0.0026228874927837365,7463,960,0.8381134638587614,pca,Glorot,,tanh,COMPLETE
68,0.7577413121859232,2025-08-19 19:05:12.828253,2025-08-19 19:08:16.504264,0 days 00:03:03.676011,20,,normal,5,zero,,0.01414134001306737,7666,736,,raw,Glorot,,logistic,COMPLETE
69,0.829310397307078,2025-08-19 19:08:16.506299,2025-08-19 19:08:54.089507,0 days 00:00:37.583208,100,,normal,5,zero,,0.15900602437377587,3639,864,,raw,old,1.9982042036961156,logistic,COMPLETE
70,0.8066205581029257,2025-08-19 19:08:54.089953,2025-08-19 19:12:01.879931,0 days 00:03:07.789978,20,,uniform,7,zero,,0.06151019823455682,4083,288,,raw,old,1.7543016206487716,tanh,COMPLETE
71,0.8172587752342224,2025-08-19 19:12:01.881529,2025-08-19 19:15:09.084034,0 days 00:03:07.202505,20,,normal,5,zero,,0.7029152467332176,1883,496,,raw,old,1.9903526808288112,logistic,COMPLETE
72,0.5618448654810587,2025-08-19 19:15:09.084484,2025-08-19 19:15:50.726739,0 days 00:00:41.642255,100,,uniform,8,nz,8.04397696618112e-06,0.005204833652614653,4080,336,0.6279540534204896,pca,old,1.9343186691383265,tanh,COMPLETE
73,0.8388448158899943,2025-08-19 19:15:50.727098,2025-08-19 19:18:55.345751,0 days 00:03:04.618653,20,,normal,5,zero,,0.184750677770845,9353,400,,raw,old,1.9846084614700579,logistic,COMPLETE
74,0.7497413158416748,2025-08-19 19:18:55.346207,2025-08-19 19:22:03.963817,0 days 00:03:08.617610,20,,normal,5,zero,,0.010554959130105573,9134,736,,raw,old,1.319992799924399,logistic,COMPLETE
75,0.7116554975509644,2025-08-19 19:22:03.966678,2025-08-19 19:25:23.150252,0 days 00:03:19.183574,20,,normal,5,nz,0.008565900778110312,0.07788292920502093,1666,576,,raw,Glorot,,tanh,COMPLETE
76,0.7726724147796631,2025-08-19 19:25:23.150721,2025-08-19 19:28:30.946060,0 days 00:03:07.795339,20,2.6218760995354237e-07,uniform,5,zero,,0.006653894918427271,5214,656,,colnorm,Glorot,,tanh,COMPLETE
77,0.8301033775011698,2025-08-19 19:28:30.946515,2025-08-19 19:31:35.870485,0 days 00:03:04.923970,20,,normal,8,zero,,0.4849355994126326,5853,384,,raw,old,1.996463694523647,logistic,COMPLETE
78,0.72341388463974,2025-08-19 19:31:35.873144,2025-08-19 19:34:41.269051,0 days 00:03:05.395907,20,,normal,5,zero,,0.5562625832772062,9638,464,,raw,old,1.733319176295558,tanh,COMPLETE
79,0.8025173743565878,2025-08-19 19:34:41.273241,2025-08-19 19:37:46.127606,0 days 00:03:04.854365,20,1.0564786267425226e-09,normal,5,zero,,0.006145840500921782,9444,944,,colnorm,old,0.9225910405424322,tanh,COMPLETE
