number,value,datetime_start,datetime_complete,duration,params_batch_size,params_dist1,params_iseed,params_l2_penalty_choice,params_l2_penalty_nz,params_lr,params_lr_anneal_start,params_ncode,params_nhid1,params_nhid2,params_nhid3,params_scale_heur1,params_scale_mult1,params_squash,user_attrs_ed_cl1_mean,user_attrs_ed_cl2_mean,user_attrs_ed_cl3_mean,user_attrs_ed_cl4_mean,user_attrs_ed_cl5_mean,user_attrs_ed_cl6_mean,user_attrs_ed_cl7_mean,user_attrs_ed_overall_mean,user_attrs_val_recon_loss_mean,user_attrs_val_recon_loss_std,state
0,0.8983945449193319,2025-09-02 03:15:48.942212,2025-09-02 03:19:17.708995,0 days 00:03:28.766783,512,normal,8,nz,2.8332666515127185e-08,0.00016653461936159484,1323,848,832,368,368,Glorot,,tanh,0.013107697168986002,0.013011018435160318,0.013088583946228027,0.013097802797953287,0.013254364331563314,0.013027667999267578,0.013056357701619467,0.013091927482968283,0.8983945449193319,0.0033833149148152918,COMPLETE
1,0.8420405586560568,2025-09-02 03:19:17.709506,2025-09-02 03:23:34.407474,0 days 00:04:16.697968,512,normal,6,zero,,0.00044961887272172035,6583,912,832,416,640,old,1.8647617315080172,logistic,0.013123830159505209,0.013239661852518717,0.01316372553507487,0.013060212135314941,0.013120532035827637,0.013013283411661783,0.01307666301727295,0.013113986878168015,0.8420405586560568,0.007500534327478477,COMPLETE
2,0.7929328083992004,2025-09-02 03:23:34.407994,2025-09-02 03:26:16.304742,0 days 00:02:41.896748,512,normal,6,zero,,0.005616945781998589,902,128,224,672,640,old,0.7134517280441177,logistic,0.01280514399210612,0.013050595919291178,0.013021310170491537,0.01290567715962728,0.013141314188639322,0.013124028841654459,0.012258291244506836,0.012900908788045248,0.7929328083992004,0.0034862984541974085,COMPLETE
3,0.4586818317572276,2025-09-02 03:26:16.305238,2025-09-02 03:31:35.642303,0 days 00:05:19.337065,256,normal,6,zero,,0.005680937610553498,2579,496,224,336,944,Glorot,,tanh,0.01285703976949056,0.013230443000793457,0.013094663619995117,0.01305532455444336,0.013034184773763021,0.0130464235941569,0.010261853535970053,0.012654276121230353,0.4586818317572276,0.003675498017424559,COMPLETE
4,1.0320918957392375,2025-09-02 03:31:35.642799,2025-09-02 03:36:59.554068,0 days 00:05:23.911269,256,normal,7,nz,0.00332977912693167,7.637327239040629e-06,114,176,576,608,864,Glorot,,logistic,0.013084769248962402,0.013036290804545084,0.013102412223815918,0.013456384340922037,0.013103961944580078,0.013143618901570639,0.01304924488067627,0.01313952604929606,1.0320918957392375,0.002978094829101246,COMPLETE
5,1.0424423615137737,2025-09-02 03:36:59.555054,2025-09-02 03:44:15.093283,0 days 00:07:15.538229,256,uniform,5,zero,,2.754579187431952e-06,128,944,944,768,784,Glorot,,tanh,0.013029535611470541,0.013104875882466635,0.013013164202372232,0.013087789217631022,0.0130233367284139,0.013078808784484863,0.013098200162251791,0.013062244369870139,1.0424423615137737,0.010421433912657868,COMPLETE
6,0.8961014747619629,2025-09-02 03:44:15.094070,2025-09-02 03:49:57.725542,0 days 00:05:42.631472,256,uniform,5,zero,,0.010155970644048225,323,624,128,944,1008,old,1.9540912485570676,logistic,0.013311465581258139,0.013033707936604818,0.013143777847290039,0.013146638870239258,0.013108293215433756,0.012982726097106934,0.012278358141581217,0.013000709669930596,0.8961014747619629,0.004688142257236839,COMPLETE
7,1.02105979124705,2025-09-02 03:49:57.726014,2025-09-02 04:03:07.403688,0 days 00:13:09.677674,100,uniform,8,zero,,1.9670000815753223e-05,2947,624,928,1024,864,old,1.7685618590876564,logistic,0.01310269037882487,0.01310733954111735,0.01314846674601237,0.013018210728963217,0.013191938400268555,0.013104478518168131,0.013092994689941406,0.013109445571899416,1.02105979124705,0.006340442539210666,COMPLETE
8,0.7234199444452921,2025-09-02 04:03:07.404143,2025-09-02 04:08:25.433263,0 days 00:05:18.029120,256,normal,5,nz,0.00022322339992933733,0.004226725354450022,160,432,448,784,560,Glorot,,tanh,0.013070305188496908,0.012985905011494955,0.013071457544962565,0.013056317965189615,0.013063391049702963,0.013090093930562338,0.012967785199483236,0.013043607984270367,0.7234199444452921,0.018749171023775456,COMPLETE
9,0.2465322514375051,2025-09-02 04:08:25.434035,2025-09-02 04:21:32.202683,0 days 00:13:06.768648,100,normal,5,zero,,0.7942211358209026,557,592,432,192,816,Glorot,,tanh,0.010966340700785318,0.011708458264668783,0.012358983357747396,0.012357115745544434,0.012044946352640787,0.007925669352213541,0.003742694854736328,0.010157744089762371,0.2465322514375051,0.015302156645912014,COMPLETE
10,1.031559427579244,2025-09-02 04:21:32.203129,2025-09-02 04:27:15.069526,0 days 00:05:42.866397,512,normal,7,nz,6.886891123861803e-07,7.091274531602468e-06,1569,464,720,816,976,old,0.2755374402164064,logistic,0.013041218121846518,0.013131141662597656,0.013013760248819986,0.013088425000508627,0.013036608695983887,0.013044595718383789,0.013103206952412924,0.013065565200079055,1.031559427579244,0.003019326130687985,COMPLETE
11,0.3452295958995819,2025-09-02 04:27:15.069990,2025-09-02 04:40:21.266061,0 days 00:13:06.196071,100,uniform,5,zero,,0.02326891288009884,2421,672,720,288,848,Glorot,,logistic,0.01295610268910726,0.012886563936869303,0.012988090515136719,0.013027509053548178,0.013078649838765463,0.0130538543065389,0.008671243985493978,0.01238028776077997,0.3452295958995819,0.008635222221401364,COMPLETE
12,0.3530169030030568,2025-09-02 04:40:21.266510,2025-09-02 04:42:56.263906,0 days 00:02:34.997396,512,normal,8,zero,,0.02099343416883146,6412,160,736,192,496,Glorot,,logistic,0.012990156809488932,0.012734134991963705,0.013031601905822754,0.013260841369628906,0.013001720110575357,0.012499054272969564,0.008580168088277182,0.012299668221246628,0.3530169030030568,0.0031337592025959616,COMPLETE
13,0.8503573139508566,2025-09-02 04:42:56.264347,2025-09-02 05:50:36.318142,0 days 01:07:40.053795,20,uniform,7,nz,0.00043594559063739585,0.00023118032388802064,2676,512,224,384,1024,Glorot,,tanh,0.01320183277130127,0.013200481732686361,0.013054966926574707,0.013027230898539225,0.012989004453023275,0.013106624285380045,0.0131455659866333,0.013103672436305456,0.8503573139508566,0.003998921961481154,COMPLETE
14,0.5876569549242655,2025-09-02 05:50:36.318593,2025-09-02 05:56:07.221482,0 days 00:05:30.902889,256,normal,5,zero,,0.00026913942522638486,9984,160,752,608,928,Glorot,,tanh,0.013042211532592773,0.013091405232747396,0.013136466344197592,0.012642463048299154,0.013079365094502768,0.013127525647481283,0.013049483299255371,0.013024131457010906,0.5876569549242655,0.009583849557449547,COMPLETE
15,0.27194106578826904,2025-09-02 05:56:07.221950,2025-09-02 07:02:18.611119,0 days 01:06:11.389169,20,normal,5,zero,,0.004324441653743999,8502,912,992,592,304,old,0.23980012043331808,tanh,0.012999574343363443,0.013058066368103027,0.012963374455769857,0.013000090916951498,0.012681126594543457,0.012655059496561686,0.011525630950927734,0.01269756044660296,0.27194106578826904,0.007784374499724692,COMPLETE
16,0.2693142394224803,2025-09-02 07:02:18.611566,2025-09-02 07:07:20.877011,0 days 00:05:02.265445,512,normal,6,zero,,0.02941609772629461,1486,864,928,832,416,Glorot,,tanh,0.01292264461517334,0.012927969296773275,0.013053576151529947,0.013028462727864584,0.012822906176249186,0.0127943754196167,0.01164849599202474,0.012742632911318824,0.2693142394224803,0.002074669069683239,COMPLETE
17,0.3859242796897888,2025-09-02 07:07:20.877455,2025-09-02 07:11:10.709532,0 days 00:03:49.832077,512,uniform,8,zero,,0.019496797863316546,2803,128,640,1024,288,old,0.7474767295818554,logistic,0.013059576352437338,0.013091007868448893,0.012970407803853353,0.0131074587504069,0.013044993082682291,0.01292423407236735,0.009558399518330893,0.012536582492646718,0.3859242796897888,0.0021908782667121505,COMPLETE
18,0.1908103475968043,2025-09-02 07:11:10.710306,2025-09-02 08:18:50.166211,0 days 01:07:39.455905,20,uniform,8,nz,7.912564278229206e-06,0.5338198303764419,1880,976,944,816,352,Glorot,,tanh,0.01065997282663981,0.011475125948588053,0.01151899496714274,0.012181440989176432,0.009100516637166342,0.007503986358642578,0.0028743743896484375,0.0093306303024292,0.1908103475968043,0.005077764806985123,COMPLETE
19,0.1993665248155594,2025-09-02 08:18:50.166689,2025-09-02 09:26:49.658830,0 days 01:07:59.492141,20,uniform,8,nz,4.913054928253148e-06,0.10473797977329813,1494,656,784,736,560,Glorot,,tanh,0.011831521987915039,0.012445529301961264,0.012593865394592285,0.012778957684834799,0.012339472770690918,0.011854608853658041,0.007979075113932291,0.011689004443940663,0.1993665248155594,0.002690016195878579,COMPLETE
20,0.24822541574637094,2025-09-02 09:26:49.659594,2025-09-02 10:35:19.164354,0 days 01:08:29.504760,20,uniform,8,nz,5.135502300560386e-06,0.5529241977447701,598,896,960,880,432,Glorot,,logistic,0.012179096539815268,0.012585997581481934,0.012652834256490072,0.012774785359700521,0.01215533415476481,0.0121230681737264,0.005516727765401204,0.011426834833054315,0.24822541574637094,0.013463341468120081,COMPLETE
21,0.21794748306274414,2025-09-02 10:35:19.164820,2025-09-02 10:48:40.843272,0 days 00:13:21.678452,100,normal,5,zero,,0.7827708696931902,931,336,448,384,960,Glorot,,tanh,0.010365525881449381,0.011565089225769043,0.012289086977640787,0.01220846176147461,0.011689265569051107,0.008202433586120605,0.002546985944112142,0.00983812127794538,0.21794748306274414,0.00780323113709701,COMPLETE
22,0.15989584724108377,2025-09-02 10:48:40.844378,2025-09-02 10:54:39.410155,0 days 00:05:58.565777,256,uniform,8,zero,,0.3618638154745876,1247,608,880,688,656,Glorot,,tanh,0.011510570844014486,0.01212930679321289,0.012429277102152506,0.012410879135131836,0.011879881223042807,0.011193513870239258,0.007458885510762532,0.011287473496936618,0.15989584724108377,0.00214825990132627,COMPLETE
23,0.41787952184677124,2025-09-02 10:54:39.410606,2025-09-02 11:01:10.543150,0 days 00:06:31.132544,256,uniform,8,zero,,0.006509462385517838,702,480,1024,944,480,Glorot,,tanh,0.013088742891947428,0.01311182975769043,0.013024012247721354,0.012956579526265463,0.013116161028544107,0.013031562169392904,0.0127717653910319,0.013014379001799083,0.41787952184677124,0.0033427073147294637,COMPLETE
24,0.19145148992538452,2025-09-02 11:01:10.543598,2025-09-02 12:09:04.727669,0 days 01:07:54.184071,20,uniform,5,nz,1.1337762539466132e-05,0.32513081878599875,2013,720,800,704,160,Glorot,,tanh,0.010742704073588053,0.011642694473266602,0.01107633113861084,0.012079238891601562,0.006840904553731282,0.007655580838521321,0.003930926322937012,0.009138340041750955,0.19145148992538452,0.007200989705823853,COMPLETE
25,0.22787347435951233,2025-09-02 12:09:04.728502,2025-09-02 13:17:15.093522,0 days 01:08:10.365020,20,uniform,5,nz,2.182510736347723e-05,0.40648417823700495,4324,752,736,480,256,Glorot,,logistic,0.009921669960021973,0.010153452555338541,0.010291457176208496,0.011937737464904785,0.007883548736572266,0.00748598575592041,0.0008101463317871094,0.008354856854393368,0.22787347435951233,0.006797957223254063,COMPLETE
26,0.21373391151428223,2025-09-02 13:17:15.094331,2025-09-02 13:22:53.040110,0 days 00:05:37.945779,256,uniform,6,zero,,0.757667097091857,1848,288,864,608,864,Glorot,,tanh,0.011016329129536947,0.011590043703715006,0.011952042579650879,0.011272867520650228,0.011172850926717123,0.007734020551045735,0.0034422477086385093,0.009740057445707774,0.21373391151428223,0.007976351491562507,COMPLETE
27,0.16790775458017984,2025-09-02 13:22:53.040570,2025-09-02 14:30:55.367967,0 days 01:08:02.327397,20,uniform,8,nz,8.062814824102687e-07,0.1173597993333195,4363,992,1008,848,320,old,1.2279501246017381,tanh,0.011352062225341797,0.011987884839375814,0.011813124020894369,0.012506405512491861,0.010169227917989096,0.01022942860921224,0.006345033645629883,0.010629023824419295,0.16790775458017984,0.0024476866895956234,COMPLETE
28,0.17025674879550934,2025-09-02 14:30:55.368441,2025-09-02 15:38:30.452125,0 days 01:07:35.083684,20,uniform,7,nz,2.1367873217996776e-07,0.10500911065998253,3730,1024,1008,1008,336,old,1.2491328727852755,tanh,0.011595726013183594,0.012150168418884277,0.011993130048116049,0.012588739395141602,0.010694344838460287,0.010979811350504557,0.007047295570373535,0.011007030804951986,0.17025674879550934,0.0015402821920015616,COMPLETE
29,0.1607122172911962,2025-09-02 15:38:30.452604,2025-09-02 16:41:05.702888,0 days 01:02:35.250284,20,uniform,7,zero,,0.37087013473990016,2358,976,1024,928,640,old,1.2621776287114828,tanh,0.01104736328125,0.011821269989013672,0.01208949089050293,0.012252370516459147,0.010242740313212076,0.008596698443094889,0.004279375076293945,0.01004704407283238,0.1607122172911962,0.0008105851336912296,COMPLETE
30,0.20020156602064768,2025-09-02 16:41:05.703592,2025-09-02 17:43:56.516308,0 days 01:02:50.812716,20,uniform,8,zero,,0.029624777964031783,3730,928,800,736,1008,old,1.2427639989688959,tanh,0.012377460797627768,0.012548367182413736,0.012907067934672037,0.012750069300333658,0.012708187103271484,0.012375553448994955,0.00899334748586019,0.012094293321881973,0.20020156602064768,0.003263468007405247,COMPLETE
31,0.2548738519350688,2025-09-02 17:43:56.516781,2025-09-02 17:49:10.996021,0 days 00:05:14.479240,512,uniform,8,nz,9.636304352256093e-08,0.013642350908322626,7337,960,1024,896,240,old,1.1918620643534388,tanh,0.01292415459950765,0.012984593709309896,0.013090848922729492,0.012999256451924643,0.012520432472229004,0.01267707347869873,0.01158591111501058,0.012683181535629999,0.2548738519350688,0.0035869137705159203,COMPLETE
32,0.1829151858886083,2025-09-02 17:49:10.996496,2025-09-02 18:51:40.624475,0 days 01:02:29.627979,20,uniform,7,zero,,0.1052003419641314,1646,688,992,832,656,old,1.367038799318522,tanh,0.012012124061584473,0.012480060259501139,0.012457648913065592,0.012672066688537598,0.012295802434285482,0.011847456296284994,0.008545160293579102,0.011758616992405482,0.1829151858886083,0.001649355550767149,COMPLETE
33,0.19584461053212485,2025-09-02 18:51:40.624942,2025-09-02 19:56:33.850879,0 days 01:04:53.225937,20,uniform,7,nz,1.1416774588689147e-08,0.5159853350866414,8370,912,928,960,416,old,1.051026867547501,tanh,0.007902701695760092,0.00969835122426351,0.008448123931884766,0.010346810022989908,0.006518165270487468,0.003818511962890625,0.0003815889358520508,0.006730607577732631,0.19584461053212485,0.0028604582094594383,COMPLETE
34,0.35994699597358704,2025-09-02 19:56:33.851582,2025-09-02 21:02:07.940226,0 days 01:05:34.088644,20,normal,7,nz,3.1652792558301186e-07,0.0038695719751748,2233,928,848,1024,416,Glorot,,tanh,0.01303255558013916,0.01303879419962565,0.01304630438486735,0.012987494468688965,0.013002236684163412,0.01295316219329834,0.012426654497782389,0.012926743144080752,0.35994699597358704,0.003093751357471372,COMPLETE
35,0.4579582214355469,2025-09-02 21:02:07.941004,2025-09-02 22:06:56.097929,0 days 01:04:48.156925,20,uniform,8,nz,3.125414347577083e-07,0.004731495191393933,2769,976,912,768,288,old,1.3142201739351138,logistic,0.013054807980855307,0.013089656829833984,0.013224562009175619,0.013041456540425619,0.013452927271525065,0.012994011243184408,0.011567910512288412,0.012917904626755487,0.4579582214355469,0.002794096227551744,COMPLETE
36,0.25922341148058575,2025-09-02 22:06:56.098429,2025-09-02 22:14:04.642471,0 days 00:07:08.544042,512,uniform,6,zero,,0.8658626730786844,3189,992,976,992,864,old,1.3639733681808606,tanh,0.010459025700887045,0.011308391888936361,0.011113564173380533,0.01152940591176351,0.010213295618693033,0.008124788602193197,0.002477844556172689,0.009318045207432337,0.25922341148058575,0.00662393538014522,COMPLETE
37,0.1899416446685791,2025-09-02 22:14:04.642943,2025-09-02 22:26:31.986665,0 days 00:12:27.343722,100,uniform,8,zero,,0.05686751259387813,2492,944,864,976,352,old,1.117906424848543,tanh,0.012554605801900228,0.012742320696512857,0.012799541155497232,0.012881994247436523,0.012230992317199707,0.01226186752319336,0.009437163670857748,0.012129783630371092,0.1899416446685791,0.0025932377185391062,COMPLETE
38,0.17921841641267142,2025-09-02 22:26:31.987455,2025-09-02 22:31:14.470641,0 days 00:04:42.483186,512,uniform,8,zero,,0.14613997448380933,1905,800,912,544,560,Glorot,,tanh,0.01208945115407308,0.01259458065032959,0.012538313865661621,0.012779593467712402,0.012443900108337402,0.011724432309468588,0.008936444918314615,0.011872388067699616,0.17921841641267142,0.0024518300655509005,COMPLETE
39,0.22261606653531393,2025-09-02 22:31:14.471116,2025-09-02 23:36:04.072347,0 days 01:04:49.601231,20,normal,8,nz,4.4218038665133814e-07,0.046675321469113774,2103,912,1024,832,224,old,1.5274861445687595,tanh,0.01244505246480306,0.012694994608561197,0.012828230857849121,0.012876947720845541,0.012300968170166016,0.012144923210144043,0.009942968686421713,0.012176297959827243,0.22261606653531393,0.0030000772277190744,COMPLETE
40,0.153966024518013,2025-09-02 23:36:04.072826,2025-09-02 23:42:04.439688,0 days 00:06:00.366862,256,normal,8,zero,,0.602689215252678,2655,624,736,768,688,Glorot,,tanh,0.010475436846415201,0.011699318885803223,0.011856834093729654,0.012075225512186686,0.010245561599731445,0.008115132649739584,0.0035262107849121094,0.009713388624645413,0.153966024518013,0.004663864492744564,COMPLETE
41,0.2271462231874466,2025-09-02 23:42:04.440155,2025-09-02 23:47:14.225761,0 days 00:05:09.785606,256,normal,8,zero,,0.8750421466376248,4700,464,656,624,752,Glorot,,tanh,0.008547067642211914,0.009916067123413086,0.010431210199991861,0.010064800580342611,0.009334961573282877,0.0049112240473429365,0.0006167888641357422,0.007688874290103003,0.2271462231874466,0.002833656350089763,COMPLETE
42,0.14266541600227356,2025-09-02 23:47:14.226536,2025-09-02 23:54:37.031232,0 days 00:07:22.804696,256,uniform,8,zero,,0.22084308745229195,2321,896,768,1024,832,Glorot,,tanh,0.011243065198262533,0.01214611530303955,0.012359062830607096,0.01251081625620524,0.012059847513834635,0.011718074480692545,0.006793498992919922,0.011261497225080217,0.14266541600227356,0.0020620841282043517,COMPLETE
43,0.18088598549365997,2025-09-02 23:54:37.031711,2025-09-03 00:02:32.153593,0 days 00:07:55.121882,256,uniform,5,zero,,0.5532914358749341,706,1008,640,1024,960,old,0.7330816494247974,tanh,0.012348214785257975,0.012648264567057291,0.012736876805623373,0.012786388397216797,0.01228026549021403,0.011692484219868978,0.0067691802978515625,0.01160881065187,0.18088598549365997,0.009770028583726468,COMPLETE
44,0.1707213173309962,2025-09-03 00:02:32.154094,2025-09-03 00:10:28.689333,0 days 00:07:56.535239,256,uniform,8,zero,,0.10403386019553934,3982,768,1008,1024,800,Glorot,,logistic,0.012386282285054525,0.01272579034169515,0.01283252239227295,0.012907783190409342,0.012682874997456869,0.012420058250427246,0.0056447188059488935,0.011657147180466426,0.1707213173309962,0.0023995451184059867,COMPLETE
45,0.13537023464838663,2025-09-03 00:10:28.690107,2025-09-03 00:24:18.567073,0 days 00:13:49.876966,100,normal,8,zero,,0.0984685313825545,4723,944,944,928,928,Glorot,,tanh,0.011455575625101725,0.012165307998657227,0.012475411097208658,0.012624581654866537,0.012113054593404135,0.011553128560384115,0.007370710372924805,0.011393967128935313,0.13537023464838663,0.0021905008056472197,COMPLETE
46,0.12348081419865291,2025-09-03 00:24:18.567537,2025-09-03 00:36:49.289903,0 days 00:12:30.722366,100,normal,8,zero,,0.11788071753976179,8002,976,880,816,912,Glorot,,tanh,0.010446786880493164,0.011588613192240397,0.012009620666503906,0.012288689613342285,0.011573314666748047,0.010547757148742676,0.005828499794006348,0.01061189742315383,0.12348081419865291,0.0021386571204762878,COMPLETE
47,0.13393363853295645,2025-09-03 00:36:49.290386,2025-09-03 00:50:00.596215,0 days 00:13:11.305829,100,normal,8,zero,,0.19296416545874984,3306,1008,976,752,720,Glorot,,tanh,0.010994791984558105,0.011661807696024576,0.012175877888997396,0.012356956799825033,0.011449575424194336,0.010705351829528809,0.006693164507548015,0.010862503732953754,0.13393363853295645,0.001994517223847166,COMPLETE
48,0.7841710050900778,2025-09-03 00:50:00.596697,2025-09-03 01:03:07.467595,0 days 00:13:06.870898,100,normal,8,nz,0.009784499204002936,0.4835117977167736,9207,992,864,880,832,Glorot,,tanh,0.00025351842244466144,2589.2049153645835,7400.205078125,0.037842233975728355,5169.204915364583,181161.54166666666,175578752.0,25110724.599238753,0.7841710050900778,0.005755696466506685,COMPLETE
49,0.5611859560012817,2025-09-03 01:03:07.468099,2025-09-03 01:15:32.497728,0 days 00:12:25.029629,100,normal,8,zero,,0.00033007054078922743,5229,992,784,896,880,Glorot,,tanh,0.01306478182474772,0.012995084126790365,0.013097286224365234,0.013080954551696777,0.013115406036376953,0.013095736503601074,0.013001640637715658,0.013064412843613397,0.5611859560012817,0.003875067949062523,COMPLETE
50,0.14980307718118033,2025-09-03 01:15:32.498195,2025-09-03 01:22:13.912235,0 days 00:06:41.414040,256,normal,8,zero,,0.531614837143003,2454,976,576,976,688,Glorot,,tanh,0.010107477506001791,0.011817296346028646,0.012078205744425455,0.01235047976175944,0.01085519790649414,0.010044097900390625,0.0036603212356567383,0.010130439485822405,0.14980307718118033,0.0014018401171523684,COMPLETE
51,0.14728370805581412,2025-09-03 01:22:13.912703,2025-09-03 01:28:17.538868,0 days 00:06:03.626165,256,normal,8,zero,,0.228405520441561,4566,944,464,864,816,Glorot,,tanh,0.00977309544881185,0.011696537335713705,0.012063980102539062,0.012338638305664062,0.01157069206237793,0.01094369093577067,0.003928343454996745,0.010330711092267719,0.14728370805581412,0.00186346143925238,COMPLETE
