number,value,datetime_start,datetime_complete,duration,params_batch_size,params_colnorm_thresh,params_dist1,params_iseed,params_l2_penalty_choice,params_l2_penalty_nz,params_lr,params_lr_anneal_start,params_nhid1,params_nhid2,params_nhid3,params_pca_energy,params_preproc,params_scale_heur1,params_scale_mult1,params_squash,user_attrs_avg_fit_criteria,user_attrs_ed_cl1_mean,user_attrs_ed_cl2_mean,user_attrs_ed_cl3_mean,state,avg_fit_criteria,ed_cl1_mean,ed_cl2_mean,ed_cl3_mean
111,0.14934999942779542,2025-08-25 13:05:58.389742,2025-08-25 13:11:22.737068,0 days 00:05:24.347326,100,1.0187264963907783e-09,normal,7,zero,,0.0626276469777774,746,48,880,224,,colnorm,old,0.8316869014798695,tanh,0.007884383201599121,0.004729843139648438,0.011002182960510254,0.007921123504638672,COMPLETE,0.007884383201599121,0.004729843139648438,0.011002182960510254,0.007921123504638672
112,0.16163333058357238,2025-08-25 13:11:22.738775,2025-08-25 13:17:13.859175,0 days 00:05:51.120400,100,,normal,6,nz,8.30549403193437e-08,0.02844167544119254,1560,32,1024,784,0.8399879060363752,pca,old,0.8685152237227773,tanh,0.00908961296081543,0.0038622617721557617,0.011390352249145507,0.012016224861145019,COMPLETE,0.00908961296081543,0.0038622617721557617,0.011390352249145507,0.012016224861145019
113,0.19318332970142366,2025-08-25 13:17:13.860605,2025-08-25 13:22:47.567934,0 days 00:05:33.707329,100,,normal,6,zero,,0.031044787087079893,5411,368,960,352,0.8497249724628575,pca,old,0.9351320489786287,tanh,0.0030188878377278646,0.0016535520553588867,0.005368542671203613,0.002034568786621094,COMPLETE,0.0030188878377278646,0.0016535520553588867,0.005368542671203613,0.002034568786621094
114,0.1872333288192749,2025-08-25 13:22:47.568258,2025-08-25 13:28:19.831082,0 days 00:05:32.262824,100,,normal,6,zero,,0.26383356133214253,657,80,976,480,0.8291269028726224,pca,old,0.9064355171448625,tanh,0.0020906766255696613,0.0013060569763183594,0.0035991668701171875,0.0013668060302734375,COMPLETE,0.0020906766255696613,0.0013060569763183594,0.0035991668701171875,0.0013668060302734375
115,0.14159999787807465,2025-08-25 13:28:19.831408,2025-08-25 13:33:53.920857,0 days 00:05:34.089449,100,,uniform,6,zero,,0.02310219800675998,9756,560,672,336,0.817974174834467,pca,old,0.9308797899498406,tanh,0.0017564694086710613,0.0012087821960449219,0.002569699287414551,0.0014909267425537109,COMPLETE,0.0017564694086710613,0.0012087821960449219,0.002569699287414551,0.0014909267425537109
116,0.2015999972820282,2025-08-25 13:33:53.921497,2025-08-25 13:39:25.450378,0 days 00:05:31.528881,100,,normal,6,zero,,0.26457167644683793,3146,384,912,464,0.8379383112851385,pca,old,0.9154959426941666,tanh,0.0001227140426635742,0.000289463996887207,0.0003038644790649414,-0.00022518634796142578,COMPLETE,0.0001227140426635742,0.000289463996887207,0.0003038644790649414,-0.00022518634796142578
117,0.19573333263397216,2025-08-25 13:39:25.450671,2025-08-25 13:44:54.789469,0 days 00:05:29.338798,100,,normal,6,zero,,0.042285454238230165,2334,400,928,496,0.8346366360718251,pca,old,0.9216664010804414,tanh,0.006186286608378093,0.0040610313415527345,0.008018207550048829,0.006479620933532715,COMPLETE,0.006186286608378093,0.0040610313415527345,0.008018207550048829,0.006479620933532715
118,0.1629333347082138,2025-08-25 13:44:54.789818,2025-08-25 13:50:25.376261,0 days 00:05:30.586443,100,,normal,6,zero,,0.008028477185727549,6613,320,1024,320,0.8169736077298263,pca,old,0.9529337407323841,tanh,0.010346444447835286,0.008968663215637208,0.011850762367248534,0.010219907760620118,COMPLETE,0.010346444447835286,0.008968663215637208,0.011850762367248534,0.010219907760620118
119,0.19316666722297668,2025-08-25 13:50:25.376526,2025-08-25 13:55:55.680481,0 days 00:05:30.303955,100,,normal,6,zero,,0.503373565396327,2321,496,896,512,0.8332816119672526,pca,old,0.6729445209692666,tanh,4.3686230977376306e-05,4.7135353088378904e-05,8.363723754882813e-05,2.86102294921875e-07,COMPLETE,4.3686230977376306e-05,4.7135353088378904e-05,8.363723754882813e-05,2.86102294921875e-07
120,0.011749999783933162,2025-08-25 13:55:55.680825,2025-08-25 14:01:15.889358,0 days 00:05:20.208533,100,,normal,6,zero,,0.425990166150394,7013,400,608,592,,raw,old,0.577369147649726,tanh,0.011136047045389811,0.008431577682495117,0.012392616271972657,0.01258394718170166,COMPLETE,0.011136047045389811,0.008431577682495117,0.012392616271972657,0.01258394718170166
121,0.19464999735355376,2025-08-25 14:01:15.891241,2025-08-25 14:06:48.866969,0 days 00:05:32.975728,100,,normal,6,zero,,0.3247402884112052,4085,368,752,768,0.8321711043976341,pca,Glorot,,tanh,0.00012920697530110679,6.403923034667969e-05,-0.00010609626770019531,0.00042967796325683595,COMPLETE,0.00012920697530110679,6.403923034667969e-05,-0.00010609626770019531,0.00042967796325683595
122,0.1350666642189026,2025-08-25 14:06:48.867320,2025-08-25 14:12:13.281445,0 days 00:05:24.414125,100,1.165946940104363e-08,normal,6,zero,,0.07421907557912251,2082,368,624,1008,,colnorm,Glorot,,tanh,0.004028344154357911,0.0013289213180541991,0.005013155937194824,0.005742955207824707,COMPLETE,0.004028344154357911,0.0013289213180541991,0.005013155937194824,0.005742955207824707
123,0.15653333067893982,2025-08-25 14:12:13.281711,2025-08-25 14:17:45.718079,0 days 00:05:32.436368,100,,normal,6,zero,,0.013891120971664202,4330,48,448,544,0.8199913690000324,pca,Glorot,,tanh,0.008107972145080565,0.0034215688705444337,0.009725618362426757,0.011176729202270507,COMPLETE,0.008107972145080565,0.0034215688705444337,0.009725618362426757,0.011176729202270507
124,0.18126666247844697,2025-08-25 14:17:45.718418,2025-08-25 14:23:15.792777,0 days 00:05:30.074359,100,,normal,6,zero,,0.6855761833444188,2758,432,608,800,0.8140605785384998,pca,Glorot,,tanh,0.0002639611562093099,9.005069732666015e-05,0.00024170875549316405,0.0004601240158081055,COMPLETE,0.0002639611562093099,9.005069732666015e-05,0.00024170875549316405,0.0004601240158081055
125,0.18291666507720947,2025-08-25 14:23:15.793114,2025-08-25 14:28:45.963237,0 days 00:05:30.170123,100,,normal,6,zero,,0.576921873396734,2304,480,928,352,0.8192241230377182,pca,old,0.6186354558615115,tanh,0.0001344442367553711,0.00018570423126220703,0.00015866756439208984,5.896091461181641e-05,COMPLETE,0.0001344442367553711,0.00018570423126220703,0.00015866756439208984,5.896091461181641e-05
126,0.17803333401679994,2025-08-25 14:28:45.963804,2025-08-25 14:34:19.639582,0 days 00:05:33.675778,100,,normal,6,zero,,0.07964049285950259,4196,624,1008,928,0.8243499858848946,pca,old,0.678264796012684,tanh,0.0012834628423055014,0.0007338762283325195,0.0020393610000610353,0.0010771512985229491,COMPLETE,0.0012834628423055014,0.0007338762283325195,0.0020393610000610353,0.0010771512985229491
127,0.015783333219587803,2025-08-25 14:34:19.639916,2025-08-25 14:39:51.298355,0 days 00:05:31.658439,100,,uniform,6,zero,,0.003306239911903967,480,32,992,768,0.8482220422654144,pca,old,0.7790881541729784,logistic,0.01365671952565511,0.014901542663574218,0.012948918342590331,0.013119697570800781,COMPLETE,0.01365671952565511,0.014901542663574218,0.012948918342590331,0.013119697570800781
