number,value,datetime_start,datetime_complete,duration,params_batch_size,params_colnorm_thresh,params_dist1,params_iseed,params_l2_penalty_choice,params_l2_penalty_nz,params_lr,params_lr_anneal_start,params_nhid1,params_nhid2,params_nhid3,params_pca_energy,params_preproc,params_scale_heur1,params_scale_mult1,params_squash,user_attrs_avg_fit_criteria,user_attrs_ed_cl1_mean,user_attrs_ed_cl2_mean,user_attrs_ed_cl3_mean,state,avg_fit_criteria,ed_cl1_mean,ed_cl2_mean,ed_cl3_mean
54,0.12711666226387025,2025-08-24 22:06:44.074015,2025-08-24 22:12:28.572287,0 days 00:05:44.498272,100,,uniform,5,nz,0.00010179923193164696,0.5350480161238091,3067,304,368,128,0.9919296251171136,pca,old,1.922776265682479,logistic,0.000616757074991862,-2.5153160095214844e-05,0.000719141960144043,0.0011562824249267579,COMPLETE,0.000616757074991862,-2.5153160095214844e-05,0.000719141960144043,0.0011562824249267579
55,0.05071666613221169,2025-08-24 22:12:28.572659,2025-08-24 22:17:47.583130,0 days 00:05:19.010471,100,,normal,5,zero,,0.022680547368968903,5620,528,880,432,,raw,Glorot,,tanh,0.011360549926757812,0.009434866905212402,0.01227574348449707,0.012371039390563965,COMPLETE,0.011360549926757812,0.009434866905212402,0.01227574348449707,0.012371039390563965
56,0.041333332657814026,2025-08-24 22:17:47.583392,2025-08-24 22:45:40.873431,0 days 00:27:53.290039,20,,normal,5,nz,4.79640176065774e-05,0.037050936164693786,2316,400,960,304,0.8432082475412936,pca,old,1.5125619618868809,logistic,0.011451443036397299,0.011423802375793457,0.012189984321594238,0.010740542411804199,COMPLETE,0.011451443036397299,0.011423802375793457,0.012189984321594238,0.010740542411804199
57,0.15831666588783264,2025-08-24 22:45:40.873834,2025-08-24 23:12:09.717315,0 days 00:26:28.843481,20,4.0527290344842514e-08,normal,7,zero,,0.32701825942779,9430,320,864,672,,colnorm,old,0.6689819423502026,logistic,0.002593398094177246,-0.0001432180404663086,0.00047855377197265626,0.007444858551025391,COMPLETE,0.002593398094177246,-0.0001432180404663086,0.00047855377197265626,0.007444858551025391
58,0.009999999776482582,2025-08-24 23:12:09.717703,2025-08-24 23:17:55.750994,0 days 00:05:46.033291,100,,normal,5,nz,0.0011120537498923561,0.9780674349412851,3999,144,336,224,0.8062196995161921,pca,Glorot,,logistic,0.005224307378133138,0.012547469139099121,0.0010487556457519532,0.0020766973495483397,COMPLETE,0.005224307378133138,0.012547469139099121,0.0010487556457519532,0.0020766973495483397
59,0.05731666684150696,2025-08-24 23:17:55.751345,2025-08-24 23:23:31.276363,0 days 00:05:35.525018,100,,normal,7,nz,3.5507683102427844e-05,0.011207146921831602,9935,480,928,640,,raw,Glorot,,tanh,0.01166826089223226,0.010008454322814941,0.012441110610961915,0.012555217742919922,COMPLETE,0.01166826089223226,0.010008454322814941,0.012441110610961915,0.012555217742919922
60,0.09504999704658985,2025-08-24 23:23:31.277160,2025-08-24 23:29:20.721115,0 days 00:05:49.443955,100,,normal,7,nz,1.5471431172072098e-05,0.8811186841923797,1579,240,1024,480,0.6263467942088418,pca,old,1.3206739243368868,logistic,0.001817965507507324,0.0018983602523803711,0.0015687227249145507,0.0019868135452270506,COMPLETE,0.001817965507507324,0.0018983602523803711,0.0015687227249145507,0.0019868135452270506
61,0.009999999776482582,2025-08-24 23:29:20.721399,2025-08-24 23:57:00.641857,0 days 00:27:39.920458,20,2.13690992942864e-07,normal,8,nz,1.6001172425603138e-05,0.3024056375644882,9836,736,960,400,,colnorm,Glorot,,tanh,,,,,COMPLETE,,,,
62,0.15404999852180482,2025-08-24 23:57:00.642237,2025-08-25 00:02:42.913563,0 days 00:05:42.271326,100,1.824120261102155e-07,uniform,5,nz,1.3775478071314813e-05,0.07294758766930015,6490,448,1008,112,,colnorm,old,0.9361910510745526,tanh,0.0018775304158528646,0.0006927490234375,0.0042626380920410155,0.0006772041320800781,COMPLETE,0.0018775304158528646,0.0006927490234375,0.0042626380920410155,0.0006772041320800781
63,0.17109999656677247,2025-08-25 00:02:42.914233,2025-08-25 00:30:27.087750,0 days 00:27:44.173517,20,,uniform,5,nz,1.545853583466083e-05,0.031776000554897925,1815,400,800,192,0.9070642403060699,pca,Glorot,,tanh,0.00680849552154541,0.005837702751159668,0.009638738632202149,0.004949045181274414,COMPLETE,0.00680849552154541,0.005837702751159668,0.009638738632202149,0.004949045181274414
64,0.1697833299636841,2025-08-25 00:30:27.088155,2025-08-25 00:35:54.655929,0 days 00:05:27.567774,100,1.190037861035407e-07,normal,8,zero,,0.6792148715715145,3501,736,816,448,,colnorm,Glorot,,tanh,-2.1513303120930983e-05,8.571147918701172e-05,-0.00026090145111083983,0.00011065006256103516,COMPLETE,-2.1513303120930983e-05,8.571147918701172e-05,-0.00026090145111083983,0.00011065006256103516
65,0.16399999856948852,2025-08-25 00:35:54.656295,2025-08-25 00:41:27.242743,0 days 00:05:32.586448,100,,normal,5,zero,,0.5672336184459342,4111,320,928,864,0.804152400575976,pca,old,1.157085471072616,logistic,0.0007239659627278645,-0.00012369155883789061,-0.0001369476318359375,0.0024325370788574217,COMPLETE,0.0007239659627278645,-0.00012369155883789061,-0.0001369476318359375,0.0024325370788574217
66,0.08823333084583282,2025-08-25 00:41:27.243011,2025-08-25 01:09:32.202702,0 days 00:28:04.959691,20,6.923314187090054e-08,uniform,6,nz,1.8595571386542526e-05,0.11501382966571161,426,272,1008,16,,colnorm,old,0.9966179007553825,tanh,0.007245469093322754,0.007145547866821289,0.010891413688659668,0.0036994457244873048,COMPLETE,0.007245469093322754,0.007145547866821289,0.010891413688659668,0.0036994457244873048
67,0.0976666659116745,2025-08-25 01:09:32.203098,2025-08-25 01:15:08.506142,0 days 00:05:36.303044,100,6.737287954918618e-07,normal,7,zero,,0.08091241590237123,7476,704,784,368,,colnorm,Glorot,,logistic,0.0016261418660481772,0.00016546249389648438,0.004030680656433106,0.0006822824478149414,COMPLETE,0.0016261418660481772,0.00016546249389648438,0.004030680656433106,0.0006822824478149414
68,0.16466666162014007,2025-08-25 01:15:08.506467,2025-08-25 01:20:39.901160,0 days 00:05:31.394693,100,,uniform,7,zero,,0.5486347134947138,3991,240,992,544,0.9280621130822464,pca,old,1.2397826102126055,logistic,0.0004022677739461263,-0.00028002262115478516,-9.565353393554687e-05,0.0015824794769287109,COMPLETE,0.0004022677739461263,-0.00028002262115478516,-9.565353393554687e-05,0.0015824794769287109
69,0.1362999975681305,2025-08-25 01:20:39.901792,2025-08-25 01:26:27.820066,0 days 00:05:47.918274,100,,normal,5,nz,0.0001446384882037767,0.2913992878148592,6395,512,704,16,0.629358368166805,pca,old,0.852919734277315,logistic,0.00013051827748616538,5.323886871337891e-05,0.0006530046463012696,-0.00031468868255615237,COMPLETE,0.00013051827748616538,5.323886871337891e-05,0.0006530046463012696,-0.00031468868255615237
70,0.13704999685287475,2025-08-25 01:26:27.820383,2025-08-25 01:57:51.741183,0 days 00:31:23.920800,20,,normal,7,nz,1.2713942311629356e-05,0.0019962919604238705,8072,192,784,464,0.8137333247676962,pca,old,0.22014626140158033,tanh,0.011974374453226725,0.011728119850158692,0.012434625625610351,0.011760377883911132,COMPLETE,0.011974374453226725,0.011728119850158692,0.012434625625610351,0.011760377883911132
71,0.1729833334684372,2025-08-25 01:57:51.741581,2025-08-25 02:25:52.078625,0 days 00:28:00.337044,20,,uniform,5,nz,1.343258061306197e-05,0.04180278195257795,947,304,832,272,0.9198497343237417,pca,Glorot,,tanh,0.00879528522491455,0.007466578483581543,0.010683321952819824,0.008235955238342285,COMPLETE,0.00879528522491455,0.007466578483581543,0.010683321952819824,0.008235955238342285
72,0.18778333365917205,2025-08-25 02:25:52.080524,2025-08-25 02:31:21.181345,0 days 00:05:29.100821,100,,normal,7,zero,,0.5644821085547012,1225,160,944,464,0.9312640300629941,pca,old,1.1625189065293435,tanh,0.00048039754231770835,0.00028078556060791017,0.0005698919296264649,0.00059051513671875,COMPLETE,0.00048039754231770835,0.00028078556060791017,0.0005698919296264649,0.00059051513671875
73,0.12326666414737701,2025-08-25 02:31:21.181665,2025-08-25 02:36:53.767288,0 days 00:05:32.585623,100,,normal,7,zero,,0.008791883796154417,2137,128,720,368,0.931726708446264,pca,old,1.2737502144778308,tanh,0.011444751421610513,0.01024022102355957,0.012428975105285645,0.011665058135986329,COMPLETE,0.011444751421610513,0.01024022102355957,0.012428975105285645,0.011665058135986329
74,0.14134999811649324,2025-08-25 02:36:53.767580,2025-08-25 03:04:47.045341,0 days 00:27:53.277761,20,,uniform,8,nz,0.00023339210861315893,0.04229975174591324,317,304,976,432,0.9281938613199695,pca,Glorot,,tanh,0.01183304786682129,0.011110758781433106,0.012531805038452148,0.011856579780578613,COMPLETE,0.01183304786682129,0.011110758781433106,0.012531805038452148,0.011856579780578613
75,0.1828833281993866,2025-08-25 03:04:47.045733,2025-08-25 03:31:17.444916,0 days 00:26:30.399183,20,,normal,7,zero,,0.0965493187710852,1492,288,592,480,0.9240665804710563,pca,Glorot,,tanh,0.001322038968404134,0.0008389711380004883,0.002250003814697266,0.0008771419525146484,COMPLETE,0.001322038968404134,0.0008389711380004883,0.002250003814697266,0.0008771419525146484
76,0.009999999776482582,2025-08-25 03:31:17.445309,2025-08-25 03:57:44.804464,0 days 00:26:27.359155,20,,normal,7,zero,,0.8629976478679292,1297,368,512,304,0.9908808533559968,pca,Glorot,,tanh,,,,,COMPLETE,,,,
77,0.21359999775886535,2025-08-25 03:57:44.804852,2025-08-25 04:03:15.334836,0 days 00:05:30.529984,100,,normal,5,zero,,0.28856870602521273,350,160,992,432,0.9102460370678593,pca,old,1.2158627835706477,tanh,0.004510656992594402,0.002057790756225586,0.0069176673889160155,0.004556512832641602,COMPLETE,0.004510656992594402,0.002057790756225586,0.0069176673889160155,0.004556512832641602
78,0.17764999866485595,2025-08-25 04:03:15.335182,2025-08-25 04:08:44.080103,0 days 00:05:28.744921,100,,normal,5,zero,,0.1275944534267589,366,144,992,368,0.9339385778408863,pca,old,1.4275710479805095,tanh,0.009064348538716634,0.006060934066772461,0.011113405227661133,0.010018706321716309,COMPLETE,0.009064348538716634,0.006060934066772461,0.011113405227661133,0.010018706321716309
79,0.16159999668598174,2025-08-25 04:08:44.080868,2025-08-25 04:14:11.030822,0 days 00:05:26.949954,100,3.6401887954121123e-09,uniform,6,zero,,0.05054085274340691,9646,560,912,576,,colnorm,Glorot,,tanh,0.0024974664052327474,0.0008944034576416016,0.004679441452026367,0.0019185543060302734,COMPLETE,0.0024974664052327474,0.0008944034576416016,0.004679441452026367,0.0019185543060302734
80,0.14171666502952576,2025-08-25 04:14:11.031170,2025-08-25 04:41:57.352403,0 days 00:27:46.321233,20,,normal,5,nz,3.668866495941944e-08,0.30629898373241665,8340,176,1024,352,0.9324875695907486,pca,old,1.3214349403163081,tanh,-2.31027603149414e-05,-3.862380981445312e-06,6.206035614013672e-05,-0.00012750625610351561,COMPLETE,-2.31027603149414e-05,-3.862380981445312e-06,6.206035614013672e-05,-0.00012750625610351561
81,0.17219999730587005,2025-08-25 04:41:57.352794,2025-08-25 04:47:27.834955,0 days 00:05:30.482161,100,,normal,5,zero,,0.44109445839175104,136,32,976,352,0.9482925020499702,pca,old,1.5388684551276919,tanh,0.007358614603678385,0.003018474578857422,0.010142183303833008,0.008915185928344727,COMPLETE,0.007358614603678385,0.003018474578857422,0.010142183303833008,0.008915185928344727
82,0.15198333263397218,2025-08-25 04:47:27.835287,2025-08-25 04:52:51.477282,0 days 00:05:23.641995,100,3.4931047411822876e-06,normal,7,zero,,0.2527646836808546,8633,624,880,768,,colnorm,old,1.393670251400205,logistic,0.0009086052576700848,0.00027091503143310546,0.000234222412109375,0.0022206783294677736,COMPLETE,0.0009086052576700848,0.00027091503143310546,0.000234222412109375,0.0022206783294677736
83,0.16918332874774933,2025-08-25 04:52:51.477558,2025-08-25 05:19:07.485597,0 days 00:26:16.008039,20,,normal,7,zero,,0.005672398954601178,6612,272,512,736,0.9344477340609464,pca,Glorot,,tanh,0.009807372093200683,0.007646393775939941,0.010543918609619141,0.011231803894042968,COMPLETE,0.009807372093200683,0.007646393775939941,0.010543918609619141,0.011231803894042968
84,0.17818333208560944,2025-08-25 05:19:07.485983,2025-08-25 05:24:36.783605,0 days 00:05:29.297622,100,,uniform,5,zero,,0.038472438019463644,1133,160,992,688,0.9244463443090023,pca,old,1.4139511594123872,tanh,0.009867604573567708,0.006923747062683105,0.011223578453063964,0.011455488204956055,COMPLETE,0.009867604573567708,0.006923747062683105,0.011223578453063964,0.011455488204956055
85,0.009999999776482582,2025-08-25 05:24:36.783870,2025-08-25 05:50:48.522944,0 days 00:26:11.739074,20,,normal,7,zero,,0.9552972201552975,2303,288,944,288,0.888050418373902,pca,old,1.2630395500567657,tanh,,,,,COMPLETE,,,,
86,0.12939999997615814,2025-08-25 05:50:48.523337,2025-08-25 05:56:17.349503,0 days 00:05:28.826166,100,,uniform,5,zero,,0.006352608973427796,3428,32,928,688,0.903525383163808,pca,old,1.2922428421777639,tanh,0.011139663060506184,0.008307790756225586,0.012426972389221191,0.012684226036071777,COMPLETE,0.011139663060506184,0.008307790756225586,0.012426972389221191,0.012684226036071777
87,0.1847499966621399,2025-08-25 05:56:17.349766,2025-08-25 06:01:44.565921,0 days 00:05:27.216155,100,,normal,7,zero,,0.5781804062125431,709,160,960,688,0.9760999091203792,pca,old,1.592960473717265,tanh,0.0004845539728800456,0.00023975372314453126,0.0008951902389526367,0.00031871795654296874,COMPLETE,0.0004845539728800456,0.00023975372314453126,0.0008951902389526367,0.00031871795654296874
88,0.06735000014305115,2025-08-25 06:01:44.566591,2025-08-25 06:07:52.462231,0 days 00:06:07.895640,100,,normal,8,zero,,0.01333700332889603,312,192,624,768,0.9920073140172342,pca,old,1.848897485880929,tanh,0.012759836514790854,0.012504959106445312,0.012857913970947266,0.012916636466979981,COMPLETE,0.012759836514790854,0.012504959106445312,0.012857913970947266,0.012916636466979981
89,0.14493333399295807,2025-08-25 06:07:52.462556,2025-08-25 06:13:22.359795,0 days 00:05:29.897239,100,,normal,7,zero,,0.036982233553684914,526,192,992,656,0.9540799198648658,pca,old,1.6385793026467101,tanh,0.011590178807576498,0.009982085227966309,0.012473535537719727,0.012314915657043457,COMPLETE,0.011590178807576498,0.009982085227966309,0.012473535537719727,0.012314915657043457
90,0.19126666188240052,2025-08-25 06:13:22.361420,2025-08-25 06:39:40.103286,0 days 00:26:17.741866,20,1.0270387176373655e-09,normal,7,zero,,0.09186150129540586,9402,512,928,240,,colnorm,Glorot,,tanh,0.00016106764475504556,0.00010809898376464843,0.0003123760223388672,6.27279281616211e-05,COMPLETE,0.00016106764475504556,0.00010809898376464843,0.0003123760223388672,6.27279281616211e-05
91,0.1365499973297119,2025-08-25 06:39:40.105231,2025-08-25 06:45:10.226583,0 days 00:05:30.121352,100,,normal,7,zero,,0.28650433745336396,673,112,1008,32,0.9999955810021103,pca,Glorot,,tanh,0.0030906995137532554,0.0011472702026367188,0.0060004711151123045,0.0021243572235107424,COMPLETE,0.0030906995137532554,0.0011472702026367188,0.0060004711151123045,0.0021243572235107424
92,0.01478333305567503,2025-08-25 06:45:10.226974,2025-08-25 07:11:20.549768,0 days 00:26:10.322794,20,,normal,7,zero,,0.280324986780308,2698,448,976,448,,raw,Glorot,,tanh,0.01172200043996175,0.010253429412841797,0.012759089469909668,0.01215348243713379,COMPLETE,0.01172200043996175,0.010253429412841797,0.012759089469909668,0.01215348243713379
93,0.14731666147708894,2025-08-25 07:11:20.551231,2025-08-25 07:37:57.352533,0 days 00:26:36.801302,20,1.0188687670939906e-09,normal,7,zero,,0.059092676767714035,5937,368,736,48,,colnorm,Glorot,,tanh,0.0010017871856689454,0.00035176277160644533,0.0019272804260253907,0.000726318359375,COMPLETE,0.0010017871856689454,0.00035176277160644533,0.0019272804260253907,0.000726318359375
94,0.030799999460577966,2025-08-25 07:37:57.354442,2025-08-25 07:43:15.172321,0 days 00:05:17.817879,100,,normal,6,zero,,0.4146358886215714,459,336,832,720,,raw,old,1.579228852155663,tanh,0.011397194862365722,0.008727240562438964,0.012634682655334472,0.01282966136932373,COMPLETE,0.011397194862365722,0.008727240562438964,0.012634682655334472,0.01282966136932373
95,0.2118000030517578,2025-08-25 07:43:15.174050,2025-08-25 08:09:36.900823,0 days 00:26:21.726773,20,1.7657868917183051e-09,normal,7,zero,,0.11955512085102213,7896,784,992,400,,colnorm,Glorot,,tanh,0.00025473435719807944,0.00011920928955078125,0.0002949237823486328,0.0003500699996948242,COMPLETE,0.00025473435719807944,0.00011920928955078125,0.0002949237823486328,0.0003500699996948242
96,0.009999999776482582,2025-08-25 08:09:36.902715,2025-08-25 08:37:08.661771,0 days 00:27:31.759056,20,1.1971994602383164e-09,normal,5,zero,,0.5199236577350833,7418,624,576,368,,colnorm,Glorot,,tanh,,,,,COMPLETE,,,,
97,0.10956666469573975,2025-08-25 08:37:08.663999,2025-08-25 09:05:33.878013,0 days 00:28:25.214014,20,1.5537938563906885e-09,normal,7,zero,,0.023661129792475883,2008,880,976,480,,colnorm,Glorot,,tanh,0.007209277153015136,0.007442069053649902,0.009218955039978027,0.00496680736541748,COMPLETE,0.007209277153015136,0.007442069053649902,0.009218955039978027,0.00496680736541748
98,0.19973333179950714,2025-08-25 09:05:33.879258,2025-08-25 09:32:01.210563,0 days 00:26:27.331305,20,1.0783466935679313e-09,normal,7,zero,,0.1014850466140898,7752,608,976,272,,colnorm,Glorot,,tanh,0.0004572312037150065,0.0006072759628295898,0.000651860237121582,0.00011255741119384766,COMPLETE,0.0004572312037150065,0.0006072759628295898,0.000651860237121582,0.00011255741119384766
99,0.1333666682243347,2025-08-25 09:32:01.210966,2025-08-25 09:58:31.090829,0 days 00:26:29.879863,20,1.1382870607659977e-09,uniform,7,zero,,0.1281261038118204,4381,688,880,48,,colnorm,Glorot,,tanh,0.00042688846588134766,0.0003377676010131836,0.0009961366653442384,-5.323886871337891e-05,COMPLETE,0.00042688846588134766,0.0003377676010131836,0.0009961366653442384,-5.323886871337891e-05
100,0.10666666477918625,2025-08-25 09:58:31.091646,2025-08-25 10:24:53.110026,0 days 00:26:22.018380,20,1.0895493933727152e-09,normal,6,zero,,0.013255641349452035,4834,464,928,240,,colnorm,old,0.6707456075394461,tanh,0.005928564071655274,0.005689001083374024,0.009513640403747558,0.0025830507278442384,COMPLETE,0.005928564071655274,0.005689001083374024,0.009513640403747558,0.0025830507278442384
101,0.1174166664481163,2025-08-25 10:24:53.110936,2025-08-25 10:51:12.239383,0 days 00:26:19.128447,20,1.715888992515001e-09,normal,7,zero,,0.013347203428853932,7898,624,1008,336,,colnorm,Glorot,,tanh,0.005091794331868489,0.00419609546661377,0.008591222763061523,0.002488064765930176,COMPLETE,0.005091794331868489,0.00419609546661377,0.008591222763061523,0.002488064765930176
102,0.18018333315849305,2025-08-25 10:51:12.240125,2025-08-25 10:56:41.555148,0 days 00:05:29.315023,100,6.0841288548309e-09,normal,7,zero,,0.6265928481514,5211,656,976,832,,colnorm,Glorot,,tanh,0.00012551148732503257,0.00022099018096923828,8.625984191894532e-05,6.928443908691407e-05,COMPLETE,0.00012551148732503257,0.00022099018096923828,8.625984191894532e-05,6.928443908691407e-05
103,0.009999999776482582,2025-08-25 10:56:41.555484,2025-08-25 11:23:09.668215,0 days 00:26:28.112731,20,,normal,8,zero,,0.4576909746410998,6784,624,944,416,0.9927041202556375,pca,Glorot,,tanh,,,,,COMPLETE,,,,
104,0.15566666424274445,2025-08-25 11:23:09.669510,2025-08-25 11:28:36.536077,0 days 00:05:26.866567,100,8.811124414633401e-09,normal,7,zero,,0.04728998780313457,8364,672,992,752,,colnorm,Glorot,,tanh,0.003498180707295736,0.0011127948760986327,0.005744552612304688,0.0036371946334838867,COMPLETE,0.003498180707295736,0.0011127948760986327,0.005744552612304688,0.0036371946334838867
105,0.20123333036899566,2025-08-25 11:28:36.536410,2025-08-25 11:54:59.849935,0 days 00:26:23.313525,20,,normal,5,zero,,0.13319114961650358,991,192,512,720,0.8640547360246842,pca,Glorot,,tanh,0.0020737489064534508,0.0005626916885375976,0.001981377601623535,0.003677177429199219,COMPLETE,0.0020737489064534508,0.0005626916885375976,0.001981377601623535,0.003677177429199219
106,0.12433333098888397,2025-08-25 11:54:59.851275,2025-08-25 12:21:34.499392,0 days 00:26:34.648117,20,,normal,5,zero,,0.019860857557116186,495,128,624,672,0.8606807724925896,pca,Glorot,,tanh,0.011831100781758625,0.01057450771331787,0.012359046936035156,0.012559747695922852,COMPLETE,0.011831100781758625,0.01057450771331787,0.012359046936035156,0.012559747695922852
107,0.2251666635274887,2025-08-25 12:21:34.500462,2025-08-25 12:27:06.899500,0 days 00:05:32.399038,100,,normal,6,zero,,0.1198755697314852,871,144,1008,560,0.8557256164192281,pca,old,0.9126700105378239,tanh,0.004764588673909506,0.001987266540527344,0.006751918792724609,0.005554580688476562,COMPLETE,0.004764588673909506,0.001987266540527344,0.006751918792724609,0.005554580688476562
108,0.15244999527931213,2025-08-25 12:27:06.900203,2025-08-25 12:32:35.698554,0 days 00:05:28.798351,100,,normal,7,zero,,0.006128328643740369,9182,832,832,192,0.8409675465539866,pca,Glorot,,tanh,0.009668548901875814,0.010768651962280273,0.011229538917541504,0.007007455825805664,COMPLETE,0.009668548901875814,0.010768651962280273,0.011229538917541504,0.007007455825805664
109,0.18358333110809327,2025-08-25 12:32:35.699311,2025-08-25 12:38:01.259789,0 days 00:05:25.560478,100,1.0042855591477373e-09,normal,7,zero,,0.8604573479500457,603,160,976,304,,colnorm,old,0.8592245183670266,tanh,0.0005396366119384766,0.0005281448364257812,0.0005953073501586914,0.000495457649230957,COMPLETE,0.0005396366119384766,0.0005281448364257812,0.0005953073501586914,0.000495457649230957
110,0.1818999946117401,2025-08-25 12:38:01.260477,2025-08-25 13:05:58.388636,0 days 00:27:57.128159,20,1.1811404693807968e-08,uniform,7,nz,1.9804444411261233e-07,0.48102682959009885,7573,688,1008,416,,colnorm,Glorot,,logistic,0.0023147980372111004,0.00011014938354492188,0.0003445148468017578,0.0064897298812866214,COMPLETE,0.0023147980372111004,0.00011014938354492188,0.0003445148468017578,0.0064897298812866214
