number,value,datetime_start,datetime_complete,duration,params_batch_size,params_dist1,params_iseed,params_l2_penalty_choice,params_l2_penalty_nz,params_lr,params_lr_anneal_start,params_nhid1,params_nhid2,params_nhid3,params_scale_heur1,params_scale_mult1,params_squash,user_attrs_avg_fit_criteria,user_attrs_ed_cl1_mean,user_attrs_ed_cl2_mean,user_attrs_ed_cl3_mean,state,avg_fit_criteria,ed_cl1_mean,ed_cl2_mean,ed_cl3_mean
0,0.30988673369089764,2025-09-02 23:56:48.407308,2025-09-03 00:02:37.766463,0 days 00:05:49.359155,100,normal,6,zero,,5.356407332044644e-05,6592,1008,608,576,old,0.3186854244306292,logistic,0.013114333152770996,0.01311635971069336,0.013107379277547201,0.013119260470072428,COMPLETE,0.013114333152770996,0.01311635971069336,0.013107379277547201,0.013119260470072428
1,0.7171128789583842,2025-09-03 00:02:37.767083,2025-09-03 00:30:31.686088,0 days 00:27:53.919005,20,uniform,6,zero,,0.0001567986483730631,4737,944,240,592,old,1.0593220787328592,tanh,0.012984964582655164,0.012932260831197103,0.012975136439005533,0.013047496477762857,COMPLETE,0.012984964582655164,0.012932260831197103,0.012975136439005533,0.013047496477762857
2,0.708903173605601,2025-09-03 00:30:31.686806,2025-09-03 00:36:05.176092,0 days 00:05:33.489286,100,uniform,7,zero,,0.0013722625337799393,674,544,784,496,Glorot,,tanh,0.012996474901835123,0.012880166371663412,0.013096968332926432,0.013012290000915527,COMPLETE,0.012996474901835123,0.012880166371663412,0.013096968332926432,0.013012290000915527
3,0.7440645098686218,2025-09-03 00:36:05.176538,2025-09-03 01:03:38.070990,0 days 00:27:32.894452,20,uniform,6,zero,,0.0005997611974489836,3042,400,656,336,old,0.7557205831361038,tanh,0.012890126970079208,0.0130006472269694,0.012901584307352701,0.012768149375915527,COMPLETE,0.012890126970079208,0.0130006472269694,0.012901584307352701,0.012768149375915527
4,0.11269354820251465,2025-09-03 01:03:38.071418,2025-09-03 01:09:29.971565,0 days 00:05:51.900147,100,uniform,8,zero,,1.7536174426962524e-06,5638,832,848,592,Glorot,,logistic,0.013100915484958226,0.01311477025349935,0.013058145840962728,0.013129830360412598,COMPLETE,0.013100915484958226,0.01311477025349935,0.013058145840962728,0.013129830360412598
5,0.11269354820251465,2025-09-03 01:09:29.971991,2025-09-03 01:15:01.399494,0 days 00:05:31.427503,100,uniform,6,zero,,2.152766956463615e-06,1208,864,512,672,Glorot,,logistic,0.013094305992126465,0.013071974118550619,0.013119896252950033,0.013091047604878744,COMPLETE,0.013094305992126465,0.013071974118550619,0.013119896252950033,0.013091047604878744
6,0.837048351764679,2025-09-03 01:15:01.399929,2025-09-03 01:20:49.780041,0 days 00:05:48.380112,100,normal,6,nz,1.0224729613848469e-07,0.18205624505890625,6579,640,272,832,old,0.50438191405769,tanh,0.0022477308909098306,0.001988371213277181,0.0010389089584350586,0.0037159125010172525,COMPLETE,0.0022477308909098306,0.001988371213277181,0.0010389089584350586,0.0037159125010172525
7,0.7792418996493021,2025-09-03 01:20:49.780780,2025-09-03 01:26:41.376852,0 days 00:05:51.596072,100,uniform,6,nz,0.009022903550383762,0.015141727048604519,713,160,384,864,old,1.1444957061835375,tanh,0.01024847560458713,0.009551763534545898,0.010299603144327799,0.010894060134887695,COMPLETE,0.01024847560458713,0.009551763534545898,0.010299603144327799,0.010894060134887695
8,0.11269354820251465,2025-09-03 01:26:41.377673,2025-09-03 01:32:17.558772,0 days 00:05:36.181099,100,normal,8,zero,,1.5227745153472545e-06,2210,544,816,912,old,1.8392842177188289,logistic,0.013126518991258407,0.013153076171875,0.013120690981547037,0.01310578982035319,COMPLETE,0.013126518991258407,0.013153076171875,0.013120690981547037,0.01310578982035319
9,0.39214517672856647,2025-09-03 01:32:17.559215,2025-09-03 01:38:06.650418,0 days 00:05:49.091203,100,uniform,8,zero,,2.4890096121810022e-05,796,272,288,448,Glorot,,tanh,0.012990673383076986,0.012998024622599283,0.012902259826660156,0.013071735699971518,COMPLETE,0.012990673383076986,0.012998024622599283,0.012902259826660156,0.013071735699971518
10,0.1579994112253189,2025-09-03 01:38:06.651114,2025-09-03 02:05:54.741969,0 days 00:27:48.090855,20,uniform,7,zero,,0.5398843157707236,705,800,976,672,Glorot,,logistic,0.01990452077653673,0.011716564496358236,0.03875116507212321,0.009245832761128744,COMPLETE,0.01990452077653673,0.011716564496358236,0.03875116507212321,0.009245832761128744
11,0.7294192910194397,2025-09-03 02:05:54.742745,2025-09-03 02:34:26.610740,0 days 00:28:31.867995,20,uniform,6,zero,,0.005988265244732958,304,352,656,208,Glorot,,tanh,0.012649509641859269,0.012503584225972494,0.012835820515950521,0.012609124183654785,COMPLETE,0.012649509641859269,0.012503584225972494,0.012835820515950521,0.012609124183654785
12,0.5636489788691202,2025-09-03 02:34:26.611512,2025-09-03 03:03:39.348237,0 days 00:29:12.736725,20,uniform,7,nz,2.3466263143751017e-05,0.23561379107592156,130,896,512,928,old,1.0236779743730906,tanh,,,,,COMPLETE,,,,
13,0.36966174840927124,2025-09-03 03:03:39.350503,2025-09-03 03:33:11.626045,0 days 00:29:32.275542,20,uniform,8,nz,0.0024972077447578873,2.2761240438210415e-06,308,224,160,784,old,0.7922891789961719,tanh,0.013006475236680774,0.013007044792175293,0.012893319129943848,0.013119061787923178,COMPLETE,0.013006475236680774,0.013007044792175293,0.012893319129943848,0.013119061787923178
14,0.11269354820251465,2025-09-03 03:33:11.626479,2025-09-03 03:39:14.675017,0 days 00:06:03.048538,100,uniform,8,nz,5.149664340041313e-08,9.272568606532535e-06,127,608,160,976,Glorot,,logistic,0.013289888699849447,0.013038436571756998,0.013731718063354492,0.01309951146443685,COMPLETE,0.013289888699849447,0.013038436571756998,0.013731718063354492,0.01309951146443685
15,0.8197742104530334,2025-09-03 03:39:14.675843,2025-09-03 04:08:50.019660,0 days 00:29:35.343817,20,uniform,7,nz,1.0723096225196348e-05,0.1638137370229068,5541,128,1024,160,old,1.7020616944920801,logistic,0.0020723740259806314,6.937980651855469e-05,0.005741119384765625,0.00040662288665771484,COMPLETE,0.0020723740259806314,6.937980651855469e-05,0.005741119384765625,0.00040662288665771484
16,0.7879194815953573,2025-09-03 04:08:50.020426,2025-09-03 04:36:11.439328,0 days 00:27:21.418902,20,uniform,5,zero,,0.057265109303175826,126,832,304,560,old,0.2702596726554056,logistic,0.012190937995910645,0.0128554900487264,0.012356797854105631,0.011360526084899902,COMPLETE,0.012190937995910645,0.0128554900487264,0.012356797854105631,0.011360526084899902
17,0.8227419058481852,2025-09-03 04:36:11.440182,2025-09-03 04:42:06.507870,0 days 00:05:55.067688,100,uniform,6,nz,9.611097681268518e-06,0.05713327666925594,2944,800,224,880,old,1.1225846061944966,tanh,0.00817622078789605,0.008406360944112143,0.00588377316792806,0.01023852825164795,COMPLETE,0.00817622078789605,0.008406360944112143,0.00588377316792806,0.01023852825164795
18,0.35399975379308063,2025-09-03 04:42:06.508314,2025-09-03 04:48:01.181395,0 days 00:05:54.673081,100,uniform,7,nz,7.353420094970839e-05,0.0006768682345316936,355,992,352,336,old,0.20766867979710768,logistic,0.013112650977240667,0.013141671816507975,0.013082623481750488,0.013113657633463541,COMPLETE,0.013112650977240667,0.013141671816507975,0.013082623481750488,0.013113657633463541
19,0.5645162463188171,2025-09-03 04:48:01.181835,2025-09-03 05:18:34.571383,0 days 00:30:33.389548,20,normal,7,nz,0.000695555700756957,4.454657309615775e-05,7150,768,880,448,Glorot,,tanh,0.013129923078748917,0.013107498486836752,0.013147473335266113,0.01313479741414388,COMPLETE,0.013129923078748917,0.013107498486836752,0.013147473335266113,0.01313479741414388
20,0.11269354820251465,2025-09-03 05:18:34.571823,2025-09-03 05:24:13.492486,0 days 00:05:38.920663,100,normal,8,zero,,4.8684447001665524e-05,242,224,928,896,Glorot,,logistic,0.013082358572218152,0.013123154640197754,0.013078570365905762,0.013045350710550943,COMPLETE,0.013082358572218152,0.013123154640197754,0.013078570365905762,0.013045350710550943
21,0.7030483682950338,2025-09-03 05:24:13.493274,2025-09-03 05:55:07.820986,0 days 00:30:54.327712,20,normal,8,nz,1.997339734132248e-07,0.00017577045838828472,6452,960,992,160,old,0.8348477899736664,tanh,0.012878007358974881,0.013012091318766275,0.013054092725118002,0.012567838033040365,COMPLETE,0.012878007358974881,0.013012091318766275,0.013054092725118002,0.012567838033040365
22,0.7540000478426615,2025-09-03 05:55:07.821430,2025-09-03 06:22:32.303960,0 days 00:27:24.482530,20,uniform,8,zero,,0.015258444911270038,662,896,208,304,old,1.7513600951408292,logistic,0.011351373460557727,0.012445926666259766,0.0120469331741333,0.009561260541280111,COMPLETE,0.011351373460557727,0.012445926666259766,0.0120469331741333,0.009561260541280111
23,0.11269354820251465,2025-09-03 06:22:32.304703,2025-09-03 06:28:41.443634,0 days 00:06:09.138931,100,normal,6,nz,0.002310508554631245,2.993279432713497e-06,212,240,576,448,old,1.457383949023868,logistic,0.012910842895507812,0.012623111406962076,0.013087232907613119,0.013022184371948242,COMPLETE,0.012910842895507812,0.012623111406962076,0.013087232907613119,0.013022184371948242
24,0.38550681124130887,2025-09-03 06:28:41.444073,2025-09-03 06:34:46.759133,0 days 00:06:05.315060,100,normal,7,nz,8.174523490234683e-06,0.8661912331013609,198,464,544,368,Glorot,,logistic,0.004447142283121745,0.0030798117319742837,0.008301099141438803,0.0019605159759521484,COMPLETE,0.004447142283121745,0.0030798117319742837,0.008301099141438803,0.0019605159759521484
25,0.0979838694135348,2025-09-03 06:34:46.759586,2025-09-03 07:02:02.747224,0 days 00:27:15.987638,20,normal,6,zero,,0.3982962611175414,5335,240,464,560,old,1.2518275415538762,tanh,,,,,COMPLETE,,,,
26,0.5275159279505411,2025-09-03 07:02:02.747648,2025-09-03 07:07:33.363157,0 days 00:05:30.615509,100,normal,6,zero,,0.00016234830431242263,3158,688,736,960,old,0.2544550137741095,logistic,0.01310053136613634,0.013098955154418945,0.01312708854675293,0.013075550397237143,COMPLETE,0.01310053136613634,0.013098955154418945,0.01312708854675293,0.013075550397237143
27,0.15587096412976584,2025-09-03 07:07:33.363898,2025-09-03 07:38:07.866608,0 days 00:30:34.502710,20,normal,8,nz,1.1833946707195962e-05,0.0004153238551851028,176,944,192,832,Glorot,,logistic,0.013101961877610946,0.013138294219970703,0.0131227175394694,0.01304487387339274,COMPLETE,0.013101961877610946,0.013138294219970703,0.0131227175394694,0.01304487387339274
28,0.11269354820251465,2025-09-03 07:38:07.867380,2025-09-03 07:43:42.472125,0 days 00:05:34.604745,100,normal,8,zero,,0.00027076433920494625,203,480,272,576,Glorot,,logistic,0.01301717758178711,0.013126651446024576,0.012859741846720377,0.013065139452616373,COMPLETE,0.01301717758178711,0.013126651446024576,0.012859741846720377,0.013065139452616373
29,0.8238386909166971,2025-09-03 07:43:42.472555,2025-09-03 08:12:49.696885,0 days 00:29:07.224330,20,normal,6,nz,0.0005702005920390691,0.023827197087659714,8278,688,336,912,Glorot,,logistic,0.0031250317891438804,0.0032581090927124023,0.0020061333974202475,0.004110852877298991,COMPLETE,0.0031250317891438804,0.0032581090927124023,0.0020061333974202475,0.004110852877298991
30,0.8129999836285909,2025-09-03 08:12:49.697686,2025-09-03 08:18:39.062136,0 days 00:05:49.364450,100,uniform,8,nz,3.8729565246854525e-05,0.061244587609138076,6595,272,128,576,Glorot,,tanh,0.003294070561726888,0.0020685593287150064,0.0014979044596354167,0.006315747896830241,COMPLETE,0.003294070561726888,0.0020685593287150064,0.0014979044596354167,0.006315747896830241
31,0.7987581888834635,2025-09-03 08:18:39.062567,2025-09-03 08:24:17.611734,0 days 00:05:38.549167,100,normal,5,zero,,0.17865334533642033,668,352,880,144,Glorot,,logistic,0.006048467424180772,0.006037195523579915,0.009553352991739908,0.0025548537572224936,COMPLETE,0.006048467424180772,0.006037195523579915,0.009553352991739908,0.0025548537572224936
32,0.6913224856058756,2025-09-03 08:24:17.612444,2025-09-03 08:53:26.160824,0 days 00:29:08.548380,20,normal,8,nz,3.042048190917116e-07,0.0024865729443567025,230,848,352,432,old,1.9863089596180703,tanh,0.012988660070631241,0.012972593307495117,0.013035019238789877,0.012958367665608725,COMPLETE,0.012988660070631241,0.012972593307495117,0.013035019238789877,0.012958367665608725
33,0.11662897219260533,2025-09-03 08:53:26.161287,2025-09-03 08:59:28.144577,0 days 00:06:01.983290,100,uniform,5,nz,2.195171270562009e-06,0.00019975831193664464,686,176,640,288,Glorot,,logistic,0.013158440589904785,0.013461947441101074,0.01309033234914144,0.012923041979471842,COMPLETE,0.013158440589904785,0.013461947441101074,0.01309033234914144,0.012923041979471842
34,0.8201128840446472,2025-09-03 08:59:28.145010,2025-09-03 09:05:49.510704,0 days 00:06:21.365694,100,normal,8,nz,2.2657139148687036e-08,0.03027486441882579,6990,864,336,336,Glorot,,tanh,0.007891138394673666,0.007727146148681641,0.007349729537963867,0.008596539497375488,COMPLETE,0.007891138394673666,0.007727146148681641,0.007349729537963867,0.008596539497375488
35,0.6955644488334656,2025-09-03 09:05:49.511142,2025-09-03 09:35:31.628877,0 days 00:29:42.117735,20,normal,5,nz,2.7516835917045693e-07,0.001648673030222091,397,864,480,256,Glorot,,tanh,0.012916670905219184,0.012978037198384603,0.013031244277954102,0.012740731239318848,COMPLETE,0.012916670905219184,0.012978037198384603,0.013031244277954102,0.012740731239318848
36,0.42570974429448444,2025-09-03 09:35:31.629324,2025-09-03 09:41:24.630902,0 days 00:05:53.001578,100,normal,5,nz,0.00015885258702399706,1.6206287536814295e-05,834,304,416,624,Glorot,,tanh,0.01312602890862359,0.013193885485331217,0.013099233309427897,0.013084967931111654,COMPLETE,0.01312602890862359,0.013193885485331217,0.013099233309427897,0.013084967931111654
37,0.7594999670982361,2025-09-03 09:41:24.631827,2025-09-03 10:10:33.636611,0 days 00:29:09.004784,20,normal,6,nz,0.0006021016068328207,0.002672805938968097,1994,592,352,272,Glorot,,tanh,0.012247429953681098,0.012318094571431478,0.012491981188456217,0.0119322141011556,COMPLETE,0.012247429953681098,0.012318094571431478,0.012491981188456217,0.0119322141011556
38,0.11269354820251465,2025-09-03 10:10:33.637361,2025-09-03 10:39:58.266661,0 days 00:29:24.629300,20,normal,8,nz,0.00010775411320059774,6.805852402341672e-06,1032,576,912,416,Glorot,,logistic,0.01311502191755507,0.013056397438049316,0.013152321179707846,0.013136347134908041,COMPLETE,0.01311502191755507,0.013056397438049316,0.013152321179707846,0.013136347134908041
39,0.0979838694135348,2025-09-03 10:39:58.267116,2025-09-03 11:07:23.795234,0 days 00:27:25.528118,20,normal,8,zero,,0.39771077034005853,3448,640,928,496,old,1.3132163224601643,tanh,,,,,COMPLETE,,,,
40,0.379789799451828,2025-09-03 11:07:23.796039,2025-09-03 11:12:55.816620,0 days 00:05:32.020581,100,normal,8,zero,,1.5698573371230564e-06,9702,128,864,816,old,0.8219145201736515,tanh,0.013300352626376681,0.013706207275390625,0.01309061050415039,0.01310424009958903,COMPLETE,0.013300352626376681,0.013706207275390625,0.01309061050415039,0.01310424009958903
41,0.7938708861668905,2025-09-03 11:12:55.817287,2025-09-03 11:18:45.422039,0 days 00:05:49.604752,100,uniform,5,nz,0.0009110543562389147,0.10750221368169545,280,480,912,512,Glorot,,tanh,0.010439528359307185,0.009626229604085287,0.011362393697102865,0.010329961776733398,COMPLETE,0.010439528359307185,0.009626229604085287,0.011362393697102865,0.010329961776733398
42,0.11269354820251465,2025-09-03 11:18:45.422939,2025-09-03 11:24:35.553969,0 days 00:05:50.131030,100,normal,6,nz,7.320179215276121e-05,7.5614720036398e-05,395,816,336,160,Glorot,,logistic,0.013139989640977649,0.013087828954060873,0.012927889823913574,0.013404250144958496,COMPLETE,0.013139989640977649,0.013087828954060873,0.012927889823913574,0.013404250144958496
43,0.22727405528227487,2025-09-03 11:24:35.554404,2025-09-03 11:53:42.312011,0 days 00:29:06.757607,20,normal,5,nz,4.2831403318406515e-08,7.320545430414094e-05,1787,256,672,1008,old,0.5843026141208169,logistic,0.013084544075859919,0.012958844502766928,0.013152082761128744,0.013142704963684082,COMPLETE,0.013084544075859919,0.012958844502766928,0.013152082761128744,0.013142704963684082
44,0.800580620765686,2025-09-03 11:53:42.312760,2025-09-03 11:59:21.601091,0 days 00:05:39.288331,100,uniform,5,zero,,0.3495227066565261,434,352,256,352,old,1.5931392804841342,tanh,0.005412856737772624,0.004897912343343099,0.005934715270996094,0.005405942598978679,COMPLETE,0.005412856737772624,0.004897912343343099,0.005934715270996094,0.005405942598978679
45,0.7929998636245728,2025-09-03 11:59:21.601516,2025-09-03 12:05:22.280266,0 days 00:06:00.678750,100,normal,6,zero,,0.04660634921932745,822,864,624,288,old,0.9152953952572318,logistic,0.009391413794623481,0.010747432708740234,0.011142333348592123,0.006284475326538086,COMPLETE,0.009391413794623481,0.010747432708740234,0.011142333348592123,0.006284475326538086
46,0.8276935617129008,2025-09-03 12:05:22.280692,2025-09-03 12:34:55.437598,0 days 00:29:33.156906,20,uniform,8,nz,3.34117930895899e-07,0.015873832288492918,3051,848,496,272,old,0.2695637448948679,tanh,0.010547757148742676,0.011528372764587402,0.010729749997456869,0.009385148684183756,COMPLETE,0.010547757148742676,0.011528372764587402,0.010729749997456869,0.009385148684183756
47,0.11269354820251465,2025-09-03 12:34:55.438348,2025-09-03 13:02:31.431167,0 days 00:27:35.992819,20,uniform,7,zero,,7.1487242727983216e-06,669,464,720,608,Glorot,,logistic,0.013055059644911026,0.013070225715637207,0.012927373250325521,0.013167579968770346,COMPLETE,0.013055059644911026,0.013070225715637207,0.012927373250325521,0.013167579968770346
48,0.11269354820251465,2025-09-03 13:02:31.431607,2025-09-03 13:29:48.527158,0 days 00:27:17.095551,20,uniform,5,zero,,2.4308960196274913e-06,126,800,512,848,Glorot,,logistic,0.013107405768500434,0.013020992279052734,0.013196706771850586,0.013104518254597982,COMPLETE,0.013107405768500434,0.013020992279052734,0.013196706771850586,0.013104518254597982
49,0.35606486598650616,2025-09-03 13:29:48.527589,2025-09-03 13:35:35.518925,0 days 00:05:46.991336,100,normal,7,nz,1.4352166121342692e-05,1.1966687479748012e-06,5918,832,624,128,old,1.4257564348107672,tanh,0.013086782561408149,0.013036847114562988,0.013139923413594564,0.013083577156066895,COMPLETE,0.013086782561408149,0.013036847114562988,0.013139923413594564,0.013083577156066895
50,0.7794355352719625,2025-09-03 13:35:35.519678,2025-09-03 13:41:25.890578,0 days 00:05:50.370900,100,normal,6,nz,0.001457454736002227,0.21160224376284129,194,224,576,992,old,1.6088539450127053,logistic,0.008630567126803927,0.006769140561421712,0.010089516639709473,0.0090330441792806,COMPLETE,0.008630567126803927,0.006769140561421712,0.010089516639709473,0.0090330441792806
51,0.741225798924764,2025-09-03 13:41:25.891347,2025-09-03 13:46:55.593433,0 days 00:05:29.702086,100,uniform,7,zero,,0.04151311311433025,179,336,672,1008,Glorot,,logistic,0.012494153446621366,0.012257933616638184,0.012680610020955404,0.012543916702270508,COMPLETE,0.012494153446621366,0.012257933616638184,0.012680610020955404,0.012543916702270508
52,0.27362820506095886,2025-09-03 13:46:55.594582,2025-09-03 13:52:27.697923,0 days 00:05:32.103341,100,normal,6,zero,,0.0023929342013616533,136,464,624,304,old,0.8598728365286314,logistic,0.013040953212314181,0.013091484705607096,0.01305091381072998,0.012980461120605469,COMPLETE,0.013040953212314181,0.013091484705607096,0.01305091381072998,0.012980461120605469
53,0.7859354416529337,2025-09-03 13:52:27.698354,2025-09-03 14:21:08.235727,0 days 00:28:40.537373,20,uniform,7,nz,4.2668947270063475e-06,0.009261598751419355,1303,320,880,304,old,1.2313563468120658,tanh,0.011580838097466363,0.01123515764872233,0.012331684430440268,0.01117567221323649,COMPLETE,0.011580838097466363,0.01123515764872233,0.012331684430440268,0.01117567221323649
54,0.0979838694135348,2025-09-03 14:21:08.236523,2025-09-03 14:26:55.682109,0 days 00:05:47.445586,100,uniform,5,nz,8.31077302228011e-06,0.4813700483996191,1231,512,624,704,old,1.9672054349234172,tanh,,,,,COMPLETE,,,,
55,0.7826128602027893,2025-09-03 14:26:55.682534,2025-09-03 14:32:42.981565,0 days 00:05:47.299031,100,normal,5,nz,0.00019006782132274585,0.05359253345877439,522,352,288,240,old,1.3724297036915887,logistic,0.00875499513414171,0.009733001391092936,0.010529041290283203,0.006002942721048991,COMPLETE,0.00875499513414171,0.009733001391092936,0.010529041290283203,0.006002942721048991
56,0.20108042657375336,2025-09-03 14:32:42.981990,2025-09-03 15:00:32.053717,0 days 00:27:49.071727,20,uniform,5,zero,,0.00010348067306111351,2474,864,624,384,Glorot,,logistic,0.013096915351019965,0.013110836346944174,0.0130995512008667,0.013080358505249023,COMPLETE,0.013096915351019965,0.013110836346944174,0.0130995512008667,0.013080358505249023
57,0.0979838694135348,2025-09-03 15:00:32.054664,2025-09-03 15:06:20.661733,0 days 00:05:48.607069,100,normal,7,nz,1.1558246302447937e-07,0.6730722602095177,6716,816,816,384,Glorot,,tanh,,,,,COMPLETE,,,,
58,0.0979838694135348,2025-09-03 15:06:20.662187,2025-09-03 15:36:04.125887,0 days 00:29:43.463700,20,normal,6,nz,0.0011173324204572746,0.4074483605699022,4192,720,640,512,Glorot,,tanh,,,,,COMPLETE,,,,
59,0.8038225372632345,2025-09-03 15:36:04.126331,2025-09-03 16:03:37.346199,0 days 00:27:33.219868,20,uniform,6,zero,,0.016396335761273445,2504,176,944,384,Glorot,,tanh,0.0088273286819458,0.006203929583231608,0.01101072629292806,0.009267330169677734,COMPLETE,0.0088273286819458,0.006203929583231608,0.01101072629292806,0.009267330169677734
