number,value,datetime_start,datetime_complete,duration,params_batch_size,params_colnorm_thresh,params_dist1,params_iseed,params_l2_penalty_choice,params_l2_penalty_nz,params_lr,params_lr_anneal_start,params_nhid1,params_pca_energy,params_preproc,params_scale_heur1,params_scale_mult1,params_squash,state
0,0.921999971071879,2025-08-19 16:21:29.151167,2025-08-19 16:25:03.612989,0 days 00:03:34.461822,20,1.2792932594071815e-07,normal,7,zero,,0.009371172320220453,946,544,,colnorm,Glorot,,tanh,COMPLETE
1,0.9179193377494812,2025-08-19 16:25:03.613580,2025-08-19 16:28:25.271874,0 days 00:03:21.658294,20,,uniform,6,zero,,0.09309533992243334,239,864,0.8334015827321564,pca,Glorot,,logistic,COMPLETE
2,0.747129221757253,2025-08-19 16:28:25.272387,2025-08-19 16:31:45.274931,0 days 00:03:20.002544,20,,normal,5,zero,,2.982889242224652e-05,1269,432,0.6843604236856253,pca,old,0.6965942073035493,tanh,COMPLETE
3,0.9198387265205383,2025-08-19 16:31:45.275431,2025-08-19 16:35:17.503160,0 days 00:03:32.227729,20,,uniform,6,nz,1.7885536267599673e-06,0.029443051758387913,1145,192,0.6714305700919312,pca,Glorot,,logistic,COMPLETE
4,0.8910644849141439,2025-08-19 16:35:17.503673,2025-08-19 16:38:55.625925,0 days 00:03:38.122252,20,,normal,7,nz,8.793583131496145e-07,0.0032051611983101146,1327,592,,raw,old,1.0543404859946486,tanh,COMPLETE
5,0.7173225482304891,2025-08-19 16:38:55.626432,2025-08-19 16:42:18.977724,0 days 00:03:23.351292,20,9.651006002269215e-05,uniform,8,zero,,2.658642117919635e-05,109,960,,colnorm,Glorot,,tanh,COMPLETE
6,0.9509032368659973,2025-08-19 16:42:18.978231,2025-08-19 16:45:49.633752,0 days 00:03:30.655521,20,1.3008224822480903e-09,uniform,6,nz,1.4080681483802386e-06,0.7165104572145266,304,352,,colnorm,Glorot,,tanh,COMPLETE
7,0.1125161275267601,2025-08-19 16:45:49.634235,2025-08-19 16:49:20.760343,0 days 00:03:31.126108,20,,uniform,7,nz,2.4126044932298733e-08,1.0604049392537988e-05,2793,912,,raw,Glorot,,logistic,COMPLETE
8,0.833016057809194,2025-08-19 16:49:20.760834,2025-08-19 16:52:40.413056,0 days 00:03:19.652222,20,,normal,7,zero,,0.001191472078696568,118,704,0.7135878018429013,pca,Glorot,,tanh,COMPLETE
9,0.8839354316393534,2025-08-19 16:52:40.413540,2025-08-19 16:53:21.510301,0 days 00:00:41.096761,100,,uniform,8,zero,,0.037286599313884415,433,656,,raw,Glorot,,logistic,COMPLETE
10,0.9421935280164083,2025-08-19 16:53:21.510503,2025-08-19 16:54:04.786505,0 days 00:00:43.276002,100,3.6607128469578873e-09,uniform,6,nz,0.005831032890174605,0.5839050342321213,6016,32,,colnorm,old,1.9642422911357693,tanh,COMPLETE
11,0.9482257763544718,2025-08-19 16:54:04.786958,2025-08-19 16:54:47.146167,0 days 00:00:42.359209,100,2.832893877863696e-09,uniform,6,nz,0.003121491500376621,0.5348390044947976,8318,32,,colnorm,old,1.9081088759074012,tanh,COMPLETE
12,0.9615483085314432,2025-08-19 16:54:47.146389,2025-08-19 16:55:31.132701,0 days 00:00:43.986312,100,1.2900183720138943e-09,uniform,6,nz,0.002404442560812741,0.8590921732954782,6683,272,,colnorm,old,1.8260725060635443,tanh,COMPLETE
13,0.7078224619229635,2025-08-19 16:55:31.133151,2025-08-19 16:56:14.077940,0 days 00:00:42.944789,100,2.3585583299245772e-09,uniform,6,nz,0.00010975275446934468,1.1822908853860045e-06,407,384,,colnorm,old,1.4335249567028507,tanh,COMPLETE
14,0.9689516226450602,2025-08-19 16:56:14.078402,2025-08-19 16:57:02.247344,0 days 00:00:48.168942,100,2.4858607475605904e-07,uniform,5,nz,3.882405483753169e-05,0.5802216690932867,3086,272,,colnorm,old,1.499272595203329,tanh,COMPLETE
15,0.7824676632881165,2025-08-19 16:57:02.247769,2025-08-19 16:57:51.014271,0 days 00:00:48.766502,100,9.159487420898244e-07,uniform,5,nz,0.00021141357690061536,0.00020813873802548696,3550,208,,colnorm,old,1.499660763322899,tanh,COMPLETE
16,0.9666451811790466,2025-08-19 16:57:51.014481,2025-08-19 16:58:34.811173,0 days 00:00:43.796692,100,5.741415781149248e-05,uniform,5,nz,0.00010840486333622696,0.16267944210485574,3289,224,,colnorm,old,1.4864546915597803,tanh,COMPLETE
17,0.9632742007573446,2025-08-19 16:58:34.811560,2025-08-19 16:59:16.910352,0 days 00:00:42.098792,100,0.0004701034319500732,uniform,5,nz,4.564262189640543e-05,0.11452069596832033,2749,144,,colnorm,old,1.330089910611851,tanh,COMPLETE
18,0.9565483729044596,2025-08-19 16:59:16.910771,2025-08-19 16:59:59.952880,0 days 00:00:43.042109,100,1.1811426621367877e-05,normal,5,nz,1.2364882007129925e-05,0.11119051988108744,4319,448,,colnorm,old,0.922462448453996,logistic,COMPLETE
19,0.9077258110046387,2025-08-19 16:59:59.953315,2025-08-19 17:00:40.189555,0 days 00:00:40.236240,100,,uniform,5,nz,0.00043518447924179965,0.01152615079767305,2026,304,,raw,old,0.211562492962316,tanh,COMPLETE
20,0.6522098183631897,2025-08-19 17:00:40.189731,2025-08-19 17:01:23.447148,0 days 00:00:43.257417,100,1.0779135755555389e-07,uniform,5,nz,1.009151330196384e-05,0.00039407251085511866,648,96,,colnorm,old,1.5944758252986944,tanh,COMPLETE
21,0.9641290307044983,2025-08-19 17:01:23.447567,2025-08-19 17:02:05.803544,0 days 00:00:42.355977,100,0.0007509993559576678,uniform,5,nz,4.496777614314477e-05,0.14776764566163597,1872,160,,colnorm,old,1.358472293671352,tanh,COMPLETE
22,0.9666451613108317,2025-08-19 17:02:05.803969,2025-08-19 17:02:47.596210,0 days 00:00:41.792241,100,0.000862341048780128,uniform,5,nz,3.388070129877865e-05,0.19356226101505317,2041,272,,colnorm,old,1.2529256146208305,tanh,COMPLETE
23,0.9704031944274902,2025-08-19 17:02:47.596476,2025-08-19 17:03:29.791287,0 days 00:00:42.194811,100,3.854756255576163e-05,uniform,5,nz,0.00047651797355046055,0.23259552495865482,4910,272,,colnorm,old,1.1921931721351144,tanh,COMPLETE
24,0.9592258334159851,2025-08-19 17:03:29.791618,2025-08-19 17:04:12.060581,0 days 00:00:42.268963,100,2.882391840433339e-05,uniform,5,nz,0.0007285683121338914,0.038672260618784454,4469,448,,colnorm,old,1.728410136831912,tanh,COMPLETE
25,0.9713870882987976,2025-08-19 17:04:12.060963,2025-08-19 17:04:54.336312,0 days 00:00:42.275349,100,2.3775350703139808e-06,uniform,5,nz,0.0007914853389672656,0.26743832741151236,9808,256,,colnorm,old,1.1308819085510353,tanh,COMPLETE
26,0.9461451570192972,2025-08-19 17:04:54.336731,2025-08-19 17:05:37.214505,0 days 00:00:42.877774,100,2.0362601028597132e-06,normal,8,nz,0.0012720686481048527,0.010711632315885393,9311,336,,colnorm,old,0.7754015803093235,tanh,COMPLETE
27,0.9152580499649048,2025-08-19 17:05:37.214693,2025-08-19 17:06:19.931921,0 days 00:00:42.717228,100,2.8135332734487133e-06,uniform,5,nz,0.009401600527674721,0.32667120430342,5812,112,,colnorm,old,1.1519497151251685,logistic,COMPLETE
28,0.9035161137580872,2025-08-19 17:06:19.932341,2025-08-19 17:07:01.754688,0 days 00:00:41.822347,100,,uniform,5,nz,0.0003667599028181559,0.002899275759418412,9815,496,,raw,old,0.9668931391773541,tanh,COMPLETE
29,0.9642741878827413,2025-08-19 17:07:01.755150,2025-08-19 17:07:42.801681,0 days 00:00:41.046531,100,,normal,5,zero,,0.04391718301228166,4513,544,0.979953611327937,pca,old,0.45347650377847215,tanh,COMPLETE
30,0.9543548425038656,2025-08-19 17:07:42.801940,2025-08-19 17:08:25.584921,0 days 00:00:42.782981,100,2.1493778736165417e-07,uniform,5,nz,0.0008260887912654126,0.01873499086138364,7191,256,,colnorm,old,1.1874715674742076,tanh,COMPLETE
31,0.968064546585083,2025-08-19 17:08:25.585276,2025-08-19 17:09:08.835875,0 days 00:00:43.250599,100,6.526352194892447e-05,uniform,5,nz,0.00013065602008593998,0.31240385421923905,2672,224,,colnorm,old,1.6322413284219248,tanh,COMPLETE
32,0.9689516226450602,2025-08-19 17:09:08.836292,2025-08-19 17:09:50.770991,0 days 00:00:41.934699,100,1.0304465911247218e-05,uniform,5,nz,0.00010465695736886327,0.3123350653154104,5252,400,,colnorm,old,1.5801821498269333,tanh,COMPLETE
33,0.963016132513682,2025-08-19 17:09:50.771406,2025-08-19 17:10:33.561328,0 days 00:00:42.789922,100,1.3244771097878074e-05,uniform,5,nz,2.2561080870199656e-05,0.05902481988895065,5648,400,,colnorm,old,1.6928407412723783,tanh,COMPLETE
34,0.969870944817861,2025-08-19 17:10:33.561746,2025-08-19 17:11:13.796605,0 days 00:00:40.234859,100,,uniform,5,zero,,0.28260460197216586,4604,320,0.567281529015301,pca,old,1.0807597348195217,logistic,COMPLETE
35,0.8883870442708334,2025-08-19 17:11:13.796784,2025-08-19 17:11:53.463854,0 days 00:00:39.667070,100,,uniform,7,zero,,0.004281604686090265,3811,336,0.5292506381233748,pca,old,0.8188433446208669,logistic,COMPLETE
36,0.9567257960637411,2025-08-19 17:11:53.464225,2025-08-19 17:12:32.605488,0 days 00:00:39.141263,100,,normal,8,zero,,0.920613702515667,843,80,0.5539916545159359,pca,old,1.0574539785844141,logistic,COMPLETE
37,0.9682096441586813,2025-08-19 17:12:32.605736,2025-08-19 17:15:43.533396,0 days 00:03:10.927660,20,,uniform,5,zero,,0.07791818387963627,7351,816,0.5950414666292395,pca,Glorot,,logistic,COMPLETE
38,0.9568548599878947,2025-08-19 17:15:43.534734,2025-08-19 17:16:24.711582,0 days 00:00:41.176848,100,,uniform,5,zero,,0.20098003523776306,1365,176,0.8373996369842986,pca,old,1.2873725495253905,logistic,COMPLETE
39,0.97309676806132,2025-08-19 17:16:24.711770,2025-08-19 17:19:38.357337,0 days 00:03:13.645567,20,,normal,5,zero,,0.3467482404120836,2584,512,0.804339952279493,pca,Glorot,,logistic,COMPLETE
40,0.9200645089149475,2025-08-19 17:19:38.358020,2025-08-19 17:22:52.396322,0 days 00:03:14.038302,20,,normal,7,zero,,0.019040948952258763,1755,560,0.8112190682956492,pca,Glorot,,logistic,COMPLETE
41,0.9708709716796875,2025-08-19 17:22:52.397108,2025-08-19 17:26:03.414365,0 days 00:03:11.017257,20,,normal,5,zero,,0.5216662194999531,2851,624,0.9388144977728664,pca,Glorot,,logistic,COMPLETE
42,0.970693568388621,2025-08-19 17:26:03.414809,2025-08-19 17:29:13.431176,0 days 00:03:10.016367,20,,normal,5,zero,,0.4137991768845495,5150,640,0.9867711778421826,pca,Glorot,,logistic,COMPLETE
43,0.949854850769043,2025-08-19 17:29:13.431973,2025-08-19 17:32:22.714530,0 days 00:03:09.282557,20,,normal,5,zero,,0.0847341249734626,2351,736,0.9806883721579379,pca,Glorot,,logistic,COMPLETE
44,0.9694999853769938,2025-08-19 17:32:22.714968,2025-08-19 17:35:30.113205,0 days 00:03:07.398237,20,,normal,8,zero,,0.3480326950537756,1493,624,0.920061640963721,pca,Glorot,,logistic,COMPLETE
45,0.9657419323921204,2025-08-19 17:35:30.113650,2025-08-19 17:38:41.450824,0 days 00:03:11.337174,20,,normal,5,zero,,0.950309924656426,1043,752,0.9093550596501092,pca,Glorot,,logistic,COMPLETE
46,0.9727741877237955,2025-08-19 17:38:41.451596,2025-08-19 17:41:53.704604,0 days 00:03:12.253008,20,,normal,7,zero,,0.4648018802609979,7869,688,0.9116176907648551,pca,Glorot,,logistic,COMPLETE
47,0.9723064303398132,2025-08-19 17:41:53.705036,2025-08-19 17:45:03.995242,0 days 00:03:10.290206,20,,normal,7,zero,,0.4950400436925959,8571,1024,0.8968667321489832,pca,Glorot,,logistic,COMPLETE
48,0.7201290925343832,2025-08-19 17:45:03.995687,2025-08-19 17:48:11.707480,0 days 00:03:07.711793,20,,normal,7,zero,,3.9848040545201374e-05,7306,1024,0.9136178806919493,pca,Glorot,,logistic,COMPLETE
49,0.9727741678555807,2025-08-19 17:48:11.708161,2025-08-19 17:51:19.885588,0 days 00:03:08.177427,20,,normal,7,zero,,0.5634335974560951,9981,880,0.873136811377032,pca,Glorot,,logistic,COMPLETE
50,0.946854849656423,2025-08-19 17:51:19.886022,2025-08-19 17:54:30.141000,0 days 00:03:10.254978,20,,normal,7,zero,,0.023735729571099817,9899,912,0.7868164746162135,pca,Glorot,,logistic,COMPLETE
51,0.9713225563367208,2025-08-19 17:54:30.141767,2025-08-19 17:57:44.764581,0 days 00:03:14.622814,20,,normal,7,zero,,0.6254203704278125,8556,816,0.8764645074446594,pca,Glorot,,logistic,COMPLETE
52,0.9669515689214071,2025-08-19 17:57:44.765025,2025-08-19 18:00:59.684709,0 days 00:03:14.919684,20,,normal,7,zero,,0.9807506706770448,8282,832,0.8749295718315607,pca,Glorot,,logistic,COMPLETE
53,0.973016103108724,2025-08-19 18:00:59.685143,2025-08-19 18:04:10.259947,0 days 00:03:10.574804,20,,normal,7,zero,,0.5294304903756588,8205,1008,0.8840074582632572,pca,Glorot,,logistic,COMPLETE
54,0.9718386928240458,2025-08-19 18:04:10.260971,2025-08-19 18:07:36.815931,0 days 00:03:26.554960,20,,normal,7,zero,,0.1306145827065786,6463,1024,0.8607605665349662,pca,Glorot,,logistic,COMPLETE
55,0.9168225725491842,2025-08-19 18:07:36.818287,2025-08-19 18:10:48.970209,0 days 00:03:12.151922,20,,normal,7,zero,,0.11426721486111396,154,1024,0.8687131137905897,pca,Glorot,,logistic,COMPLETE
56,0.9740806221961975,2025-08-19 18:10:48.970651,2025-08-19 18:13:59.209343,0 days 00:03:10.238692,20,,normal,7,zero,,0.5364188195092662,7053,944,0.7558720670743738,pca,Glorot,,logistic,COMPLETE
57,0.9740322629610697,2025-08-19 18:13:59.209788,2025-08-19 18:17:07.353621,0 days 00:03:08.143833,20,,normal,7,zero,,0.4666590820871928,6452,944,0.7615891933943684,pca,Glorot,,logistic,COMPLETE
58,0.9283225536346436,2025-08-19 18:17:07.354071,2025-08-19 18:20:15.072102,0 days 00:03:07.718031,20,,normal,7,zero,,0.060337513600587,3981,960,,raw,Glorot,,logistic,COMPLETE
59,0.9742419322331747,2025-08-19 18:20:15.072542,2025-08-19 18:23:27.986420,0 days 00:03:12.913878,20,,normal,7,zero,,0.18555364165815996,6539,912,0.7614361897927066,pca,Glorot,,logistic,COMPLETE
60,0.9742419123649597,2025-08-19 18:23:27.986864,2025-08-19 18:26:49.134364,0 days 00:03:21.147500,20,,normal,7,zero,,0.16389567497470522,6428,944,0.7654329183983114,pca,Glorot,,logistic,COMPLETE
61,0.9735322594642639,2025-08-19 18:26:49.134792,2025-08-19 18:29:58.809213,0 days 00:03:09.674421,20,,normal,7,zero,,0.1669371449260037,6046,960,0.7550682683483634,pca,Glorot,,logistic,COMPLETE
62,0.9740644693374634,2025-08-19 18:29:58.809662,2025-08-19 18:33:11.610628,0 days 00:03:12.800966,20,,normal,7,zero,,0.1799932455083593,6065,944,0.7743669161389813,pca,Glorot,,logistic,COMPLETE
63,0.9739354650179545,2025-08-19 18:33:11.611069,2025-08-19 18:36:21.295599,0 days 00:03:09.684530,20,,normal,7,zero,,0.18129023337273206,6008,960,0.7657261196297133,pca,Glorot,,logistic,COMPLETE
64,0.9741774002710978,2025-08-19 18:36:21.296033,2025-08-19 18:39:31.723307,0 days 00:03:10.427274,20,,normal,7,zero,,0.17689835136390325,6293,960,0.7572731961200976,pca,Glorot,,logistic,COMPLETE
65,0.9515967766443888,2025-08-19 18:39:31.723740,2025-08-19 18:42:40.729530,0 days 00:03:09.005790,20,,normal,7,zero,,0.062289601852204536,3411,896,0.75283495557827,pca,Glorot,,logistic,COMPLETE
66,0.9215806325276693,2025-08-19 18:42:40.729978,2025-08-19 18:45:51.808843,0 days 00:03:11.078865,20,,normal,7,zero,,0.03282212032268745,6515,960,,raw,Glorot,,logistic,COMPLETE
67,0.16728999217351279,2025-08-19 18:45:51.809292,2025-08-19 18:49:04.470713,0 days 00:03:12.661421,20,,normal,7,zero,,1.4617813358299158e-06,5354,848,0.7176528636466839,pca,Glorot,,logistic,COMPLETE
68,0.9134677251180013,2025-08-19 18:49:04.471163,2025-08-19 18:52:16.829793,0 days 00:03:12.358630,20,,normal,6,zero,,0.006545703865010814,4242,928,0.7761943590599991,pca,Glorot,,logistic,COMPLETE
69,0.8816934823989868,2025-08-19 18:52:16.830254,2025-08-19 18:55:35.941055,0 days 00:03:19.110801,20,,normal,7,zero,,0.0007473085855384435,6238,992,0.7201414758462227,pca,Glorot,,logistic,COMPLETE
70,0.9715967377026876,2025-08-19 18:55:35.941512,2025-08-19 18:58:47.759084,0 days 00:03:11.817572,20,,normal,7,zero,,0.20353171642602771,3715,784,0.6813649387721101,pca,Glorot,,logistic,COMPLETE
71,0.9718225598335266,2025-08-19 18:58:47.759529,2025-08-19 19:01:56.512285,0 days 00:03:08.752756,20,,normal,7,zero,,0.125517841134182,6359,944,0.7462295750758917,pca,Glorot,,logistic,COMPLETE
72,0.9737741748491923,2025-08-19 19:01:56.512716,2025-08-19 19:05:15.333585,0 days 00:03:18.820869,20,,normal,7,zero,,0.16537063312354602,5863,976,0.7518243212988471,pca,Glorot,,logistic,COMPLETE
73,0.9651774168014526,2025-08-19 19:05:15.334022,2025-08-19 19:08:27.926751,0 days 00:03:12.592729,20,,normal,7,zero,,0.08729258877034296,4896,864,0.7750493929264555,pca,Glorot,,logistic,COMPLETE
74,0.9589677254358927,2025-08-19 19:08:27.927202,2025-08-19 19:11:39.795279,0 days 00:03:11.868077,20,,normal,7,zero,,0.05012637249870975,6838,992,0.7334277300962654,pca,Glorot,,logistic,COMPLETE
75,0.9742419123649597,2025-08-19 19:11:39.795716,2025-08-19 19:14:50.426559,0 days 00:03:10.630843,20,,normal,7,zero,,0.20174626980693347,5538,912,0.6977138140122162,pca,Glorot,,logistic,COMPLETE
76,0.9271612564722697,2025-08-19 19:14:50.426992,2025-08-19 19:18:10.070064,0 days 00:03:19.643072,20,,normal,7,zero,,0.23315060147511282,514,912,,raw,Glorot,,logistic,COMPLETE
77,0.9586451450983683,2025-08-19 19:18:10.070501,2025-08-19 19:21:21.249646,0 days 00:03:11.179145,20,,normal,6,zero,,0.08509243256741367,3238,880,0.6904170933974353,pca,Glorot,,logistic,COMPLETE
78,0.9746773838996887,2025-08-19 19:21:21.250084,2025-08-19 19:24:34.270913,0 days 00:03:13.020829,20,,normal,7,zero,,0.23690860415825493,7281,928,0.8138870347525912,pca,Glorot,,logistic,COMPLETE
79,0.9712903102238973,2025-08-19 19:24:34.271362,2025-08-19 19:27:49.949535,0 days 00:03:15.678173,20,,normal,7,zero,,0.6901187836919555,7442,928,0.6445840327798459,pca,Glorot,,logistic,COMPLETE
