number,value,datetime_start,datetime_complete,duration,params_batch_size,params_colnorm_thresh,params_dist1,params_iseed,params_l2_penalty_choice,params_l2_penalty_nz,params_lr,params_lr_anneal_start,params_nhid1,params_pca_energy,params_preproc,params_scale_heur1,params_scale_mult1,params_squash,user_attrs_avg_fit_criteria,state,avg_fit_criteria
0,0.07721666544675827,2025-08-24 10:57:00.737148,2025-08-24 11:15:51.532763,0 days 00:18:50.795615,20,,normal,8,nz,1.5463788579841117e-06,0.00016653461936159484,1323,832,,raw,Glorot,,tanh,0.013045477867126464,COMPLETE,0.013045477867126464
1,0.06748333126306534,2025-08-24 11:15:51.534532,2025-08-24 11:19:53.437348,0 days 00:04:01.902816,100,,uniform,8,nz,1.9236748753487186e-08,2.0547199328558902e-05,7073,592,0.6584180610844357,pca,Glorot,,tanh,0.013213086128234863,COMPLETE,0.013213086128234863
2,0.0103666665032506,2025-08-24 11:19:53.437666,2025-08-24 11:23:29.293206,0 days 00:03:35.855540,100,,normal,5,zero,,0.5659923651826084,3833,128,,raw,old,1.9857466391390506,tanh,0.008798670768737794,COMPLETE,0.008798670768737794
3,0.07049999982118607,2025-08-24 11:23:29.293537,2025-08-24 11:41:33.270700,0 days 00:18:03.977163,20,,uniform,8,zero,,0.0004181759315680524,1673,496,0.7936518167319924,pca,old,0.7411550703865422,logistic,0.013218092918395995,COMPLETE,0.013218092918395995
4,0.20343333184719087,2025-08-24 11:41:33.271072,2025-08-24 11:45:16.971342,0 days 00:03:43.700270,100,0.0005111785038494985,uniform,6,zero,,0.01772932380115616,3920,496,,colnorm,Glorot,,logistic,0.006657266616821289,COMPLETE,0.006657266616821289
5,0.20480000078678132,2025-08-24 11:45:16.971616,2025-08-24 12:04:05.203598,0 days 00:18:48.231982,20,,uniform,7,nz,2.754579187431946e-08,0.04731325254594746,1576,272,0.9395345807573379,pca,Glorot,,tanh,0.0014631271362304688,COMPLETE,0.0014631271362304688
6,0.07698333114385605,2025-08-24 12:04:05.203976,2025-08-24 12:07:53.460827,0 days 00:03:48.256851,100,,uniform,8,nz,4.347699888300888e-07,0.002194664177038812,147,1024,,raw,Glorot,,logistic,0.01298837661743164,COMPLETE,0.01298837661743164
7,0.20236666798591613,2025-08-24 12:07:53.462494,2025-08-24 12:11:35.976930,0 days 00:03:42.514436,100,0.00030649167289104257,normal,5,zero,,0.0816998127615149,1228,688,,colnorm,Glorot,,tanh,0.001076483726501465,COMPLETE,0.001076483726501465
8,0.21421666145324708,2025-08-24 12:11:35.977196,2025-08-24 12:15:33.174041,0 days 00:03:57.196845,100,,uniform,7,nz,0.0002645568202790849,0.02422873547786384,891,720,0.8913677959876881,pca,old,0.8538315683484765,tanh,0.010146999359130859,COMPLETE,0.010146999359130859
9,0.06655000001192093,2025-08-24 12:15:33.174371,2025-08-24 12:19:20.657922,0 days 00:03:47.483551,100,,uniform,7,zero,,3.170750300370449e-06,3320,656,0.9406161231694635,pca,old,0.8029927440054692,tanh,0.013100814819335938,COMPLETE,0.013100814819335938
10,0.22404999732971193,2025-08-24 12:19:20.658158,2025-08-24 12:38:20.909841,0 days 00:19:00.251683,20,,normal,8,nz,0.002551744641784246,0.03420715013038941,7313,368,0.936638035172104,pca,old,1.3715103262460462,tanh,0.00015268325805664062,COMPLETE,0.00015268325805664062
11,0.0972166657447815,2025-08-24 12:38:20.910214,2025-08-24 12:41:55.253734,0 days 00:03:34.343520,100,,uniform,5,zero,,0.002472295306383974,2075,64,,raw,old,0.2686955279215667,tanh,0.010091280937194825,COMPLETE,0.010091280937194825
12,0.012116666696965695,2025-08-24 12:41:55.254043,2025-08-24 12:59:45.488768,0 days 00:17:50.234725,20,,normal,8,zero,,0.12633115655273697,7996,496,,raw,old,1.2383117176396174,tanh,0.011678481101989746,COMPLETE,0.011678481101989746
13,0.22163332998752594,2025-08-24 12:59:45.489144,2025-08-24 13:03:29.822827,0 days 00:03:44.333683,100,0.00026396605532175534,normal,8,zero,,0.0856956409647669,1799,288,,colnorm,old,1.2920153892124882,logistic,0.0007654190063476563,COMPLETE,0.0007654190063476563
14,0.17981666326522827,2025-08-24 13:03:29.823100,2025-08-24 13:21:19.678240,0 days 00:17:49.855140,20,1.9234441996304963e-05,normal,5,zero,,0.1914526965665586,1879,192,,colnorm,Glorot,,logistic,0.00027062892913818357,COMPLETE,0.00027062892913818357
15,0.20721666812896727,2025-08-24 13:21:19.680922,2025-08-24 13:40:16.239246,0 days 00:18:56.558324,20,1.2471437960535648e-06,normal,5,nz,1.3116339985565845e-05,0.002599150833651273,8061,416,,colnorm,Glorot,,tanh,0.00980672836303711,COMPLETE,0.00980672836303711
16,0.027899999544024466,2025-08-24 13:40:16.239636,2025-08-24 13:43:56.226650,0 days 00:03:39.987014,100,4.664316241584911e-07,uniform,6,zero,,0.00030045263597290177,531,32,,colnorm,Glorot,,logistic,0.01163949966430664,COMPLETE,0.01163949966430664
17,0.15736666619777678,2025-08-24 13:43:56.227465,2025-08-24 13:47:39.704130,0 days 00:03:43.476665,100,,uniform,5,nz,0.0020148539176503438,0.004266449491975976,3210,464,,raw,old,0.6801332526612567,logistic,0.009757137298583985,COMPLETE,0.009757137298583985
18,0.17461666464805603,2025-08-24 13:47:39.704398,2025-08-24 14:06:24.283540,0 days 00:18:44.579142,20,6.917979271942646e-07,normal,6,nz,6.192186988258287e-07,0.0030403110046740844,7268,928,,colnorm,Glorot,,logistic,0.011211562156677245,COMPLETE,0.011211562156677245
19,0.1997999966144562,2025-08-24 14:06:24.283919,2025-08-24 14:25:05.540775,0 days 00:18:41.256856,20,0.0002913468031487346,uniform,6,nz,1.265187772100772e-08,0.10035093057105589,548,256,,colnorm,old,0.2772973808283531,logistic,0.0036380529403686524,COMPLETE,0.0036380529403686524
20,0.1841999977827072,2025-08-24 14:25:05.541156,2025-08-24 14:28:47.016817,0 days 00:03:41.475661,100,1.2900430342543819e-09,normal,8,zero,,0.044334662456748275,1441,112,,colnorm,old,1.49020452407454,logistic,0.002108144760131836,COMPLETE,0.002108144760131836
21,0.2048333317041397,2025-08-24 14:28:47.017166,2025-08-24 14:32:46.133156,0 days 00:03:59.115990,100,,uniform,7,nz,0.0003179747627901083,0.095373289988913,1037,576,0.9906088554764183,pca,old,1.243606096121123,tanh,0.0005053043365478516,COMPLETE,0.0005053043365478516
22,0.16519999802112578,2025-08-24 14:32:46.133430,2025-08-24 14:51:31.994525,0 days 00:18:45.861095,20,,normal,8,nz,0.0022385222825265475,0.01215317922019255,2096,160,0.8024374233032245,pca,old,1.481877818363898,tanh,0.0032718420028686524,COMPLETE,0.0032718420028686524
23,0.18961666524410248,2025-08-24 14:51:31.996109,2025-08-24 15:10:23.973103,0 days 00:18:51.976994,20,,normal,7,nz,0.009639207774279644,0.062093614651436646,259,912,0.8514236859053572,pca,old,1.0973613862451599,tanh,0.003473043441772461,COMPLETE,0.003473043441772461
24,0.07234999984502792,2025-08-24 15:10:23.973491,2025-08-24 15:29:14.309338,0 days 00:18:50.335847,20,,normal,7,nz,7.47310629428377e-05,0.18800640223052412,6703,592,0.5048577395154206,pca,old,1.119499644047357,tanh,-0.00029075145721435547,COMPLETE,-0.00029075145721435547
25,0.19459999799728395,2025-08-24 15:29:14.309714,2025-08-24 15:47:48.462363,0 days 00:18:34.152649,20,,normal,5,nz,7.475087271468498e-05,0.11393292463653847,7258,256,0.8741072801161015,pca,old,1.6290123038280349,logistic,-0.0003965854644775391,COMPLETE,-0.0003965854644775391
26,0.1360999971628189,2025-08-24 15:47:48.463165,2025-08-24 15:51:34.721267,0 days 00:03:46.258102,100,,uniform,7,zero,,0.005077927368809295,923,1008,0.6984022480628465,pca,old,0.9837479957121109,tanh,0.013034248352050781,COMPLETE,0.013034248352050781
27,0.1855166643857956,2025-08-24 15:51:34.721543,2025-08-24 15:55:17.151414,0 days 00:03:42.429871,100,2.181767277311185e-08,uniform,8,zero,,0.3198040421693568,5113,448,,colnorm,old,1.4485685279031035,logistic,0.0001207113265991211,COMPLETE,0.0001207113265991211
28,0.13191666603088378,2025-08-24 15:55:17.151743,2025-08-24 15:59:04.927319,0 days 00:03:47.775576,100,,uniform,5,nz,0.0003410282490765386,0.03178740567746861,669,832,,raw,old,1.0655344796537836,tanh,0.010707545280456542,COMPLETE,0.010707545280456542
29,0.165666663646698,2025-08-24 15:59:04.927636,2025-08-24 16:17:09.671772,0 days 00:18:04.744136,20,,uniform,6,nz,0.009367534867803708,0.0011945414265020814,6169,576,0.9892544999885212,pca,old,1.600018390619878,tanh,0.010493803024291991,COMPLETE,0.010493803024291991
30,0.05513333305716515,2025-08-24 16:17:09.672146,2025-08-24 16:20:55.269567,0 days 00:03:45.597421,100,,normal,8,nz,2.9194937535851777e-05,0.054893258853012286,8028,240,,raw,old,0.8247049368084041,logistic,0.003679919242858887,COMPLETE,0.003679919242858887
31,0.07396666556596757,2025-08-24 16:20:55.269830,2025-08-24 16:39:50.356672,0 days 00:18:55.086842,20,,normal,5,nz,2.2843647723584595e-05,1.48062590314145e-05,6209,368,0.8579470908381457,pca,Glorot,,tanh,0.013113951683044434,COMPLETE,0.013113951683044434
32,0.1640999972820282,2025-08-24 16:39:50.358619,2025-08-24 16:58:51.082936,0 days 00:19:00.724317,20,6.734891016824343e-06,normal,5,nz,0.00031500318902583086,0.004171924025158516,1092,512,,colnorm,Glorot,,tanh,0.012194275856018066,COMPLETE,0.012194275856018066
33,0.09043333232402802,2025-08-24 16:58:51.083327,2025-08-24 17:17:44.555510,0 days 00:18:53.472183,20,7.4012006050646014e-06,normal,5,nz,9.15564917998517e-06,0.0002648450454171302,7300,272,,colnorm,Glorot,,tanh,0.012832307815551757,COMPLETE,0.012832307815551757
34,0.2179833322763443,2025-08-24 17:17:44.555902,2025-08-24 17:21:32.976256,0 days 00:03:48.420354,100,,normal,8,zero,,0.10765343039203203,2380,368,0.7618783161169348,pca,Glorot,,logistic,0.00044562816619873045,COMPLETE,0.00044562816619873045
35,0.17219999730587005,2025-08-24 17:21:32.976583,2025-08-24 17:25:19.057194,0 days 00:03:46.080611,100,,normal,8,zero,,0.031614300029206475,1784,464,0.7449264480417711,pca,Glorot,,logistic,0.007933092117309571,COMPLETE,0.007933092117309571
36,0.22793333232402802,2025-08-24 17:25:19.057779,2025-08-24 17:29:01.234827,0 days 00:03:42.177048,100,0.0009333267328992243,normal,7,zero,,0.03777697081559364,1302,400,,colnorm,old,1.2319813309957088,tanh,0.004168558120727539,COMPLETE,0.004168558120727539
37,0.1688166618347168,2025-08-24 17:29:01.235094,2025-08-24 17:46:51.501470,0 days 00:17:50.266376,20,0.000976732324121247,normal,7,zero,,0.10186171454332935,1949,352,,colnorm,old,1.3135424772287583,tanh,0.000320124626159668,COMPLETE,0.000320124626159668
38,0.07396666705608368,2025-08-24 17:46:51.501833,2025-08-24 17:50:34.388146,0 days 00:03:42.886313,100,5.655577650741995e-05,normal,7,zero,,0.0005024934787315115,2240,432,,colnorm,Glorot,,tanh,0.013146018981933594,COMPLETE,0.013146018981933594
39,0.07383333295583724,2025-08-24 17:50:34.388417,2025-08-24 17:54:17.968859,0 days 00:03:43.580442,100,0.0008857215983769424,uniform,7,zero,,0.0019181452822137671,670,304,,colnorm,old,1.702946010216217,tanh,0.012798905372619629,COMPLETE,0.012798905372619629
40,0.22858332991600036,2025-08-24 17:54:17.969181,2025-08-24 17:58:10.682246,0 days 00:03:52.713065,100,2.123717135252003e-05,normal,7,nz,0.005951002728821136,0.02286961786163366,5174,448,,colnorm,old,1.327251087836496,tanh,6.473064422607422e-05,COMPLETE,6.473064422607422e-05
41,0.21543332934379578,2025-08-24 17:58:10.682521,2025-08-24 18:02:03.892351,0 days 00:03:53.209830,100,4.4451985851010634e-05,normal,7,nz,0.008526278847505281,0.03452568097376257,6645,288,,colnorm,old,1.3254378202592052,tanh,-9.930133819580078e-05,COMPLETE,-9.930133819580078e-05
42,0.2348499983549118,2025-08-24 18:02:03.892670,2025-08-24 18:05:43.679637,0 days 00:03:39.786967,100,6.621843354139093e-05,normal,7,zero,,0.06540806933968653,2189,464,,colnorm,old,1.3144568277909716,logistic,0.0014781713485717773,COMPLETE,0.0014781713485717773
43,0.09171666651964187,2025-08-24 18:05:43.680901,2025-08-24 18:09:28.312089,0 days 00:03:44.631188,100,,normal,7,zero,,0.3054066926318827,1936,432,0.597231436510964,pca,old,1.3173507081182112,tanh,0.00025949478149414065,COMPLETE,0.00025949478149414065
44,0.061933332681655885,2025-08-24 18:09:28.312403,2025-08-24 18:13:09.960990,0 days 00:03:41.648587,100,5.375070872481169e-05,normal,7,zero,,0.001418028961650969,607,496,,colnorm,old,1.3113918799398478,logistic,0.012794899940490722,COMPLETE,0.012794899940490722
45,0.19153333008289336,2025-08-24 18:13:09.961637,2025-08-24 18:16:50.970871,0 days 00:03:41.009234,100,5.436582275785528e-05,normal,6,zero,,0.042898092166376106,2463,336,,colnorm,old,1.3101725644401452,tanh,0.0009797096252441406,COMPLETE,0.0009797096252441406
46,0.009999999776482582,2025-08-24 18:16:50.971208,2025-08-24 18:20:32.940218,0 days 00:03:41.969010,100,0.0007825100982694936,normal,7,zero,,0.6192783697091839,2801,432,,colnorm,Glorot,,logistic,,COMPLETE,
47,0.21525000035762787,2025-08-24 18:20:32.940485,2025-08-24 18:39:19.947887,0 days 00:18:47.007402,20,,normal,8,nz,0.009386612722547922,0.02848589333283223,9299,336,0.9952433744533979,pca,Glorot,,tanh,0.00019872188568115234,COMPLETE,0.00019872188568115234
48,0.009999999776482582,2025-08-24 18:39:19.948240,2025-08-24 18:43:10.804618,0 days 00:03:50.856378,100,4.2140654191192245e-05,normal,6,nz,0.0009180298297331016,0.9418035202366948,2785,320,,colnorm,old,1.313028015488672,logistic,,COMPLETE,
49,0.2325666666030884,2025-08-24 18:43:10.804930,2025-08-24 18:46:51.423107,0 days 00:03:40.618177,100,5.0991075653154396e-05,normal,5,zero,,0.05363044244467369,3409,608,,colnorm,old,1.3151957706338422,logistic,0.0010819196701049804,COMPLETE,0.0010819196701049804
50,0.07419999837875366,2025-08-24 18:46:51.423451,2025-08-24 18:50:23.245246,0 days 00:03:31.821795,100,,normal,7,zero,,0.10366594599160889,1383,352,,raw,old,1.438444079620808,logistic,0.004858970642089844,COMPLETE,0.004858970642089844
51,0.2225666642189026,2025-08-24 18:50:23.245509,2025-08-24 18:54:02.017093,0 days 00:03:38.771584,100,4.987612914346182e-05,normal,7,zero,,0.030619054655958294,2129,560,,colnorm,old,1.2480503787254018,tanh,0.0029210329055786135,COMPLETE,0.0029210329055786135
52,0.18746666312217714,2025-08-24 18:54:02.017419,2025-08-24 18:57:41.384989,0 days 00:03:39.367570,100,1.783961556524677e-05,normal,5,zero,,0.09083989606404656,7154,576,,colnorm,old,1.2145802353558675,logistic,0.00015475749969482422,COMPLETE,0.00015475749969482422
53,0.2132999986410141,2025-08-24 18:57:41.385274,2025-08-24 19:01:33.974011,0 days 00:03:52.588737,100,3.879318253611682e-05,normal,7,nz,0.0008842531380435772,0.057510826564669715,2293,832,,colnorm,old,1.205734028546611,tanh,0.00021548271179199218,COMPLETE,0.00021548271179199218
54,0.19318332970142366,2025-08-24 19:01:33.975609,2025-08-24 19:05:14.054244,0 days 00:03:40.078635,100,2.9370618381943445e-05,normal,7,zero,,0.010154328232670316,1214,656,,colnorm,old,1.427096971093853,tanh,0.011902499198913574,COMPLETE,0.011902499198913574
55,0.18524999618530275,2025-08-24 19:05:14.054913,2025-08-24 19:08:53.329347,0 days 00:03:39.274434,100,3.8082003812432506e-05,uniform,5,zero,,0.003212233450547002,3748,624,,colnorm,old,1.9675747513487836,tanh,0.012045502662658691,COMPLETE,0.012045502662658691
56,0.16748333275318145,2025-08-24 19:08:53.329661,2025-08-24 19:12:35.326353,0 days 00:03:41.996692,100,5.010314694745941e-05,normal,6,zero,,0.01645594274168616,1301,720,,colnorm,old,1.084493988070481,logistic,0.010775375366210937,COMPLETE,0.010775375366210937
57,0.2175666630268097,2025-08-24 19:12:35.326621,2025-08-24 19:30:12.287852,0 days 00:17:36.961231,20,8.668489268602493e-06,normal,7,zero,,0.08055076948511752,2613,736,,colnorm,old,1.2547742903568488,logistic,7.750988006591797e-05,COMPLETE,7.750988006591797e-05
58,0.0987833321094513,2025-08-24 19:30:12.288213,2025-08-24 19:48:14.490502,0 days 00:18:02.202289,20,,normal,8,nz,0.008976071111416562,0.0009971865519968679,6044,576,0.586745433285437,pca,old,1.460829982457085,tanh,0.012348270416259766,COMPLETE,0.012348270416259766
59,0.16811666190624236,2025-08-24 19:48:14.492477,2025-08-24 19:52:00.519123,0 days 00:03:46.026646,100,,normal,5,zero,,0.16694295372352014,1085,672,0.7037689770930136,pca,old,1.1620328368443613,logistic,0.0004379749298095703,COMPLETE,0.0004379749298095703
60,0.009999999776482582,2025-08-24 19:52:00.519455,2025-08-24 19:55:42.935211,0 days 00:03:42.415756,100,0.0008576027383990788,normal,7,zero,,0.6456016783428306,2163,624,,colnorm,old,1.454201836163097,logistic,,COMPLETE,
61,0.20534999966621398,2025-08-24 19:55:42.937164,2025-08-24 19:59:36.417749,0 days 00:03:53.480585,100,0.0001953193961775673,normal,5,nz,0.000645967910965684,0.02225257737124515,1105,288,,colnorm,old,1.215452314393084,tanh,0.0077561140060424805,COMPLETE,0.0077561140060424805
62,0.009999999776482582,2025-08-24 19:59:36.418087,2025-08-24 20:18:14.878336,0 days 00:18:38.460249,20,0.00016983386096874385,normal,8,nz,0.0007564025061343786,0.9280101696980524,5076,192,,colnorm,old,1.3304952101254193,tanh,,COMPLETE,
63,0.06331666558980942,2025-08-24 20:18:14.878700,2025-08-24 20:22:07.505996,0 days 00:03:52.627296,100,0.00018269183796285637,normal,8,nz,0.009805758387542503,0.0018433020358219268,1878,400,,colnorm,old,1.1539173817868824,logistic,0.012692737579345702,COMPLETE,0.012692737579345702
64,0.06864999979734421,2025-08-24 20:22:07.506693,2025-08-24 20:25:54.117865,0 days 00:03:46.611172,100,,normal,7,zero,,0.00027001081126918285,5674,256,0.8586423766812004,pca,old,1.4644562528333702,logistic,0.012973451614379882,COMPLETE,0.012973451614379882
65,0.18653333485126494,2025-08-24 20:25:54.118123,2025-08-24 20:29:49.683209,0 days 00:03:55.565086,100,,normal,8,nz,3.1440165311285756e-06,0.024008192870823078,8330,304,0.8877683727628807,pca,old,1.0708114939332811,tanh,0.0005659103393554687,COMPLETE,0.0005659103393554687
66,0.2248666614294052,2025-08-24 20:29:49.683532,2025-08-24 20:33:28.207576,0 days 00:03:38.524044,100,0.00020199906493943647,normal,8,zero,,0.058943368065047186,844,448,,colnorm,old,1.370746911155009,tanh,0.003693079948425293,COMPLETE,0.003693079948425293
67,0.2182166635990143,2025-08-24 20:33:28.207841,2025-08-24 20:37:08.543560,0 days 00:03:40.335719,100,0.00015939593629441984,normal,8,zero,,0.0926289131182159,377,304,,colnorm,old,1.5735420720793525,tanh,0.005274224281311035,COMPLETE,0.005274224281311035
68,0.17463333308696746,2025-08-24 20:37:08.543885,2025-08-24 20:40:46.694964,0 days 00:03:38.151079,100,0.000126816489722398,normal,7,zero,,0.15157069209377325,2906,368,,colnorm,old,1.4245083589675418,tanh,0.0001561880111694336,COMPLETE,0.0001561880111694336
69,0.223266664147377,2025-08-24 20:40:46.695248,2025-08-24 20:44:25.386781,0 days 00:03:38.691533,100,8.627784234383456e-06,normal,8,zero,,0.008288433658455607,4120,624,,colnorm,old,1.2635606191206288,tanh,0.009298014640808105,COMPLETE,0.009298014640808105
70,0.09568333178758621,2025-08-24 20:44:25.387108,2025-08-24 20:48:05.366884,0 days 00:03:39.979776,100,2.1364225339501184e-06,normal,8,zero,,0.0004755272136987668,2178,944,,colnorm,old,1.5601026927820676,tanh,0.013058018684387208,COMPLETE,0.013058018684387208
71,0.20871666371822356,2025-08-24 20:48:05.367168,2025-08-24 20:51:43.741364,0 days 00:03:38.374196,100,6.551456127916168e-06,normal,8,zero,,0.012855868397353953,1554,560,,colnorm,old,1.158739400527517,tanh,0.01089930534362793,COMPLETE,0.01089930534362793
72,0.13633333146572113,2025-08-24 20:51:43.741700,2025-08-24 20:55:21.667727,0 days 00:03:37.926027,100,1.09127646987418e-05,normal,7,zero,,0.009843826385772352,636,128,,colnorm,old,1.2227936638772188,tanh,0.010218405723571777,COMPLETE,0.010218405723571777
73,0.1426499992609024,2025-08-24 20:55:21.668010,2025-08-24 20:59:11.162717,0 days 00:03:49.494707,100,5.6864952600514864e-05,normal,8,nz,0.00031375137069725634,0.0005750789267759394,9567,544,,colnorm,old,1.323410866489319,tanh,0.012704777717590331,COMPLETE,0.012704777717590331
74,0.1373999983072281,2025-08-24 20:59:11.163516,2025-08-24 21:02:49.785942,0 days 00:03:38.622426,100,5.3596679262806555e-06,normal,8,zero,,0.0015287688510268397,9220,816,,colnorm,Glorot,,logistic,0.01214151382446289,COMPLETE,0.01214151382446289
75,0.1544666677713394,2025-08-24 21:02:49.786222,2025-08-24 21:20:18.026239,0 days 00:17:28.240017,20,,normal,8,zero,,0.3354911406395407,6150,208,0.752102616398455,pca,old,0.9287032189825282,tanh,0.00010547637939453124,COMPLETE,0.00010547637939453124
76,0.1300499975681305,2025-08-24 21:20:18.026592,2025-08-24 21:38:48.798744,0 days 00:18:30.772152,20,,uniform,8,nz,0.001193377445289223,0.2509273584242826,6984,368,0.6279540534204896,pca,old,1.3753649673264206,tanh,0.00035474300384521487,COMPLETE,0.00035474300384521487
77,0.1996999979019165,2025-08-24 21:38:48.799094,2025-08-24 21:42:27.867837,0 days 00:03:39.068743,100,0.0009069705603059252,uniform,7,zero,,0.22226626397314295,2192,624,,colnorm,old,0.5369935324870864,tanh,0.0002739429473876953,COMPLETE,0.0002739429473876953
78,0.19903333485126495,2025-08-24 21:42:27.868102,2025-08-24 22:00:43.228793,0 days 00:18:15.360691,20,,normal,6,nz,1.667028095807808e-07,0.012394627862618674,5884,192,0.9711444326893157,pca,old,1.077552092108644,tanh,0.0021914243698120117,COMPLETE,0.0021914243698120117
79,0.030883333086967467,2025-08-24 22:00:43.229150,2025-08-24 22:04:13.667438,0 days 00:03:30.438288,100,,normal,8,zero,,0.248243619443159,1597,400,,raw,old,1.4428942487980583,tanh,0.008302402496337891,COMPLETE,0.008302402496337891
80,0.22086666226387025,2025-08-24 22:04:13.667688,2025-08-24 22:07:51.524320,0 days 00:03:37.856632,100,6.176233053789611e-05,uniform,8,zero,,0.03650358930677824,787,448,,colnorm,Glorot,,tanh,0.007985877990722656,COMPLETE,0.007985877990722656
81,0.17350000143051147,2025-08-24 22:07:51.524670,2025-08-24 22:11:29.565807,0 days 00:03:38.041137,100,0.0003264451882196193,uniform,7,zero,,0.012873340068330193,2833,512,,colnorm,old,1.27835285964286,logistic,0.009395313262939454,COMPLETE,0.009395313262939454
