number,value,datetime_start,datetime_complete,duration,params_batch_size,params_dist1,params_iseed,params_l2_penalty_choice,params_l2_penalty_nz,params_lr,params_lr_anneal_start,params_nhid1,params_scale_heur1,params_scale_mult1,params_squash,user_attrs_avg_fit_criteria,state,avg_fit_criteria
0,0.5716290473937988,2025-09-02 08:49:10.215975,2025-09-02 08:56:17.206078,0 days 00:07:06.990103,100,normal,8,zero,,0.012611815565767931,2659,832,old,1.1017912259422258,logistic,0.011249303817749023,COMPLETE,0.011249303817749023
1,0.8602258205413819,2025-09-02 08:56:17.206936,2025-09-02 09:32:38.781011,0 days 00:36:21.574075,20,uniform,6,nz,2.0547199328558857e-07,0.16396997761073914,743,192,old,1.2225775747269245,logistic,9.844303131103515e-05,COMPLETE,9.844303131103515e-05
2,0.11462903469800949,2025-09-02 09:32:38.781768,2025-09-02 09:39:26.779359,0 days 00:06:47.997591,100,uniform,5,zero,,9.506281571106352e-05,1011,288,Glorot,,logistic,0.013035225868225097,COMPLETE,0.013035225868225097
3,0.35866129994392393,2025-09-02 09:39:26.780070,2025-09-02 10:15:06.622724,0 days 00:35:39.842654,20,uniform,8,nz,3.340579416277081e-05,2.1049515830306782e-06,798,992,Glorot,,tanh,0.013118934631347657,COMPLETE,0.013118934631347657
4,0.6409355282783509,2025-09-02 10:15:06.623343,2025-09-02 10:21:54.566488,0 days 00:06:47.943145,100,normal,8,zero,,0.005680937610553498,2579,496,Glorot,,tanh,0.011495661735534669,COMPLETE,0.011495661735534669
5,0.8576613068580627,2025-09-02 10:21:54.567208,2025-09-02 10:56:04.453975,0 days 00:34:09.886767,20,normal,7,zero,,0.040058969243291886,2604,992,Glorot,,logistic,0.0035547733306884764,COMPLETE,0.0035547733306884764
6,0.11467742174863815,2025-09-02 10:56:04.455026,2025-09-02 11:02:45.752424,0 days 00:06:41.297398,100,uniform,8,zero,,1.2460411629798946e-05,6359,416,Glorot,,logistic,0.012998151779174804,COMPLETE,0.012998151779174804
7,0.34682260155677797,2025-09-02 11:02:45.752823,2025-09-02 11:09:30.322589,0 days 00:06:44.569766,100,normal,5,zero,,6.369821113063238e-06,9757,720,old,0.5115210082666259,tanh,0.013143348693847656,COMPLETE,0.013143348693847656
8,0.35269356369972227,2025-09-02 11:09:30.323012,2025-09-02 11:44:39.875090,0 days 00:35:09.552078,20,uniform,6,zero,,4.4654883954691955e-06,3564,416,old,0.6601759155814514,tanh,0.012977170944213866,COMPLETE,0.012977170944213866
9,0.5279839038848877,2025-09-02 11:44:39.875492,2025-09-02 11:51:47.498864,0 days 00:07:07.623372,100,uniform,8,nz,1.5621204728163365e-06,0.0036346950323246753,538,928,Glorot,,tanh,0.012945103645324706,COMPLETE,0.012945103645324706
10,0.4090645372867584,2025-09-02 11:51:47.499289,2025-09-02 12:27:50.672275,0 days 00:36:03.172986,20,uniform,5,nz,5.7833085248908403e-08,0.0007135089719871662,487,576,Glorot,,tanh,0.013062024116516113,COMPLETE,0.013062024116516113
11,0.4141613066196442,2025-09-02 12:27:50.672688,2025-09-02 13:01:58.703855,0 days 00:34:08.031167,20,normal,8,zero,,0.00043340174043252305,365,976,old,0.273941419851531,tanh,0.013091444969177246,COMPLETE,0.013091444969177246
12,0.513016152381897,2025-09-02 13:01:58.704265,2025-09-02 13:08:45.938226,0 days 00:06:47.233961,100,uniform,5,zero,,0.006036687230540028,518,496,old,0.8331442788576597,logistic,0.012172079086303711,COMPLETE,0.012172079086303711
13,0.11366129368543625,2025-09-02 13:08:45.938986,2025-09-02 13:15:55.637746,0 days 00:07:09.698760,100,uniform,7,nz,1.367989792242663e-08,7.091274531602468e-06,1569,384,Glorot,,logistic,0.013120579719543456,COMPLETE,0.013120579719543456
14,0.4679032385349274,2025-09-02 13:15:55.638564,2025-09-02 13:22:41.644826,0 days 00:06:46.006262,100,normal,5,zero,,0.013094244682014585,301,160,old,1.3330847803202919,logistic,0.009917521476745605,COMPLETE,0.009917521476745605
15,0.348870986700058,2025-09-02 13:22:41.645495,2025-09-02 13:29:49.652726,0 days 00:07:08.007231,100,normal,6,nz,1.2134601472469401e-05,0.0002887138756286331,121,592,old,0.33709258675285036,tanh,0.013112521171569825,COMPLETE,0.013112521171569825
16,0.8561290502548218,2025-09-02 13:29:49.655803,2025-09-02 13:36:40.764948,0 days 00:06:51.109145,100,uniform,7,zero,,0.0856956409647669,1799,352,Glorot,,logistic,0.00037841796875,COMPLETE,0.00037841796875
17,0.35250001549720766,2025-09-02 13:36:40.765348,2025-09-02 13:43:29.031643,0 days 00:06:48.266295,100,uniform,5,zero,,9.318544447640828e-06,368,576,Glorot,,tanh,0.013099336624145507,COMPLETE,0.013099336624145507
18,0.4882419466972351,2025-09-02 13:43:29.032061,2025-09-02 13:50:20.170138,0 days 00:06:51.138077,100,uniform,5,zero,,0.00026913942522638486,9984,928,old,1.1287749591948544,logistic,0.012822508811950684,COMPLETE,0.012822508811950684
19,0.5500322699546814,2025-09-02 13:50:20.170534,2025-09-02 14:26:53.100773,0 days 00:36:32.930239,20,uniform,7,nz,0.006148641099918832,0.022461343267204566,8862,832,old,0.4495867877664373,logistic,1.6450881958007812e-05,COMPLETE,1.6450881958007812e-05
20,0.887516176700592,2025-09-02 14:26:53.101441,2025-09-02 15:00:42.961348,0 days 00:33:49.859907,20,normal,7,zero,,0.03583206056834735,4580,928,Glorot,,logistic,0.001845073699951172,COMPLETE,0.001845073699951172
21,0.6156129121780396,2025-09-02 15:00:42.962061,2025-09-02 15:37:51.995229,0 days 00:37:09.033168,20,uniform,6,nz,5.252946755452934e-07,0.08356597610241695,526,160,old,1.9670174025241536,logistic,0.003152346611022949,COMPLETE,0.003152346611022949
22,0.6037903487682342,2025-09-02 15:37:51.995919,2025-09-02 16:11:49.048696,0 days 00:33:57.052777,20,normal,7,zero,,0.20956801691395088,1778,976,Glorot,,logistic,0.0006449222564697266,COMPLETE,0.0006449222564697266
23,0.5405161499977111,2025-09-02 16:11:49.049098,2025-09-02 16:45:35.555299,0 days 00:33:46.506201,20,normal,5,zero,,0.0009247464203711671,7338,848,Glorot,,logistic,0.012203168869018555,COMPLETE,0.012203168869018555
24,0.9028064846992493,2025-09-02 16:45:35.555704,2025-09-02 17:20:20.823296,0 days 00:34:45.267592,20,normal,5,zero,,0.06793630192755795,1150,864,Glorot,,tanh,0.004023861885070801,COMPLETE,0.004023861885070801
25,0.4331129193305969,2025-09-02 17:20:20.823698,2025-09-02 17:54:24.122759,0 days 00:34:03.299061,20,normal,5,zero,,0.0008370923697461518,438,752,Glorot,,tanh,0.013093948364257812,COMPLETE,0.013093948364257812
26,0.9076613187789917,2025-09-02 17:54:24.123490,2025-09-02 18:30:47.612021,0 days 00:36:23.488531,20,normal,5,nz,9.625839068869515e-05,0.39393606635173734,1120,768,Glorot,,tanh,0.001182222366333008,COMPLETE,0.001182222366333008
27,0.9038548707962036,2025-09-02 18:30:47.612819,2025-09-02 19:06:51.351917,0 days 00:36:03.739098,20,normal,5,nz,0.0003442164622650645,0.16641413255872406,1016,736,old,1.6809488144070026,tanh,0.0001502513885498047,COMPLETE,0.0001502513885498047
28,0.9018871307373046,2025-09-02 19:06:51.352326,2025-09-02 19:42:34.229197,0 days 00:35:42.876871,20,normal,5,nz,0.0004811959979466496,0.09549955652768553,1439,720,old,1.6614209894546956,tanh,0.00029864311218261717,COMPLETE,0.00029864311218261717
29,0.5649516224861145,2025-09-02 19:42:34.229936,2025-09-02 20:18:28.253896,0 days 00:35:54.023960,20,normal,5,nz,0.0003097160154690618,0.05280417253933138,324,768,Glorot,,logistic,0.011175417900085449,COMPLETE,0.011175417900085449
30,0.9075968027114868,2025-09-02 20:18:28.254812,2025-09-02 20:25:40.848742,0 days 00:07:12.593930,100,normal,5,nz,0.00011574139992128508,0.21235273386500333,1316,768,Glorot,,tanh,0.0012767314910888672,COMPLETE,0.0012767314910888672
31,0.8501935720443725,2025-09-02 20:25:40.849346,2025-09-02 20:32:50.622029,0 days 00:07:09.772683,100,normal,5,nz,0.00011455768044238861,0.036747923261099665,859,512,Glorot,,tanh,0.005923557281494141,COMPLETE,0.005923557281494141
32,0.8943064928054809,2025-09-02 20:32:50.622434,2025-09-02 21:08:53.612691,0 days 00:36:02.990257,20,normal,7,nz,0.00031181185080016453,0.1425591044136933,431,672,Glorot,,tanh,0.002538919448852539,COMPLETE,0.002538919448852539
33,0.8795323133468628,2025-09-02 21:08:53.613433,2025-09-02 21:16:06.352946,0 days 00:07:12.739513,100,normal,5,nz,3.959173234933045e-05,0.01631470465230166,3980,992,Glorot,,tanh,0.00646822452545166,COMPLETE,0.00646822452545166
34,0.9231613039970398,2025-09-02 21:16:06.353350,2025-09-02 21:50:22.172958,0 days 00:34:15.819608,20,normal,5,zero,,0.19406357842853708,2461,848,Glorot,,tanh,0.0001049041748046875,COMPLETE,0.0001049041748046875
35,0.09972580820322037,2025-09-02 21:50:22.173977,2025-09-02 22:26:23.816452,0 days 00:36:01.642475,20,normal,5,nz,0.0011636075244564818,0.6657022949511276,770,768,Glorot,,tanh,,COMPLETE,
36,0.857241952419281,2025-09-02 22:26:23.816860,2025-09-02 23:00:03.502163,0 days 00:33:39.685303,20,normal,8,zero,,0.008275303440904193,6461,848,old,1.6742204748490717,tanh,0.005857777595520019,COMPLETE,0.005857777595520019
37,0.8763710141181946,2025-09-02 23:00:03.502569,2025-09-02 23:36:04.573812,0 days 00:36:01.071243,20,normal,8,nz,3.113704854755337e-05,0.012046112897407773,3070,832,Glorot,,tanh,0.006603622436523437,COMPLETE,0.006603622436523437
38,0.5878709822893142,2025-09-02 23:36:04.574245,2025-09-02 23:42:48.831656,0 days 00:06:44.257411,100,normal,5,zero,,0.8721326163225402,2551,928,Glorot,,tanh,,COMPLETE,
39,0.5477096915245057,2025-09-02 23:42:48.832286,2025-09-02 23:50:03.073536,0 days 00:07:14.241250,100,normal,5,nz,0.005845868557262084,0.17631281355528405,1770,800,Glorot,,logistic,3.509521484375e-05,COMPLETE,3.509521484375e-05
40,0.8881935954093934,2025-09-02 23:50:03.074176,2025-09-02 23:57:18.126939,0 days 00:07:15.052763,100,normal,6,nz,0.00013892117562317312,0.1591079124425647,1715,672,old,1.8786403334036716,tanh,0.0006438016891479493,COMPLETE,0.0006438016891479493
41,0.9221129179000854,2025-09-02 23:57:18.127570,2025-09-03 00:31:15.626929,0 days 00:33:57.499359,20,uniform,5,zero,,0.25033105617981344,2029,896,Glorot,,tanh,3.8456916809082034e-05,COMPLETE,3.8456916809082034e-05
42,0.9265967845916748,2025-09-03 00:31:15.627900,2025-09-03 01:06:06.280077,0 days 00:34:50.652177,20,uniform,5,zero,,0.17167204490083596,4554,976,Glorot,,tanh,5.474090576171875e-05,COMPLETE,5.474090576171875e-05
43,0.9168548583984375,2025-09-03 01:06:06.280486,2025-09-03 01:40:03.650152,0 days 00:33:57.369666,20,uniform,5,zero,,0.03961928919616338,5796,1008,Glorot,,tanh,0.0027120351791381837,COMPLETE,0.0027120351791381837
44,0.9137742161750794,2025-09-03 01:40:03.650972,2025-09-03 02:14:15.583546,0 days 00:34:11.932574,20,uniform,5,zero,,0.023610200699906696,8386,1008,Glorot,,tanh,0.003503274917602539,COMPLETE,0.003503274917602539
45,0.9042580962181092,2025-09-03 02:14:15.583957,2025-09-03 02:47:49.266968,0 days 00:33:33.683011,20,uniform,5,zero,,0.016895849742119714,6929,976,Glorot,,tanh,0.004595899581909179,COMPLETE,0.004595899581909179
46,0.9193709850311279,2025-09-03 02:47:49.267679,2025-09-03 03:21:52.418722,0 days 00:34:03.151043,20,uniform,6,zero,,0.2760047206703143,1669,816,Glorot,,tanh,3.7384033203125e-05,COMPLETE,3.7384033203125e-05
47,0.835532295703888,2025-09-03 03:21:52.419137,2025-09-03 03:56:03.093630,0 days 00:34:10.674493,20,uniform,6,zero,,0.021383251555258286,910,640,Glorot,,tanh,0.008049535751342773,COMPLETE,0.008049535751342773
48,0.9231290459632874,2025-09-03 03:56:03.094060,2025-09-03 04:32:41.872636,0 days 00:36:38.778576,20,uniform,6,nz,1.5402812308338338e-08,0.19913189499189377,2367,960,Glorot,,tanh,0.00015904903411865235,COMPLETE,0.00015904903411865235
49,0.9208709836006165,2025-09-03 04:32:41.873332,2025-09-03 05:09:17.305107,0 days 00:36:35.431775,20,uniform,6,nz,1.4113515824180505e-08,0.29443866253814954,1937,960,Glorot,,tanh,0.00014798641204833985,COMPLETE,0.00014798641204833985
50,0.8548709869384765,2025-09-03 05:09:17.307256,2025-09-03 05:46:05.586271,0 days 00:36:48.279015,20,uniform,6,nz,1.0792007749004303e-08,0.020052153812516422,1056,912,Glorot,,tanh,0.008585596084594726,COMPLETE,0.008585596084594726
51,0.9280967831611633,2025-09-03 05:46:05.586683,2025-09-03 06:22:13.165307,0 days 00:36:07.578624,20,uniform,6,nz,1.2537858715688679e-08,0.10571825598313642,5324,992,Glorot,,tanh,0.00048234462738037107,COMPLETE,0.00048234462738037107
52,0.9216290473937988,2025-09-03 06:22:13.166758,2025-09-03 06:58:00.756390,0 days 00:35:47.589632,20,normal,6,nz,1.9451223895705454e-08,0.07970296092725394,4474,880,Glorot,,tanh,0.0009963035583496094,COMPLETE,0.0009963035583496094
53,0.9096129298210144,2025-09-03 06:58:00.757042,2025-09-03 07:33:59.262062,0 days 00:35:58.505020,20,normal,6,nz,1.1127693253337822e-07,0.31383712774553024,4644,832,Glorot,,tanh,0.002788090705871582,COMPLETE,0.002788090705871582
54,0.09972580820322037,2025-09-03 07:33:59.262792,2025-09-03 08:07:55.013868,0 days 00:33:55.751076,20,uniform,5,zero,,0.5551725112915533,2315,752,old,0.9017428182570936,tanh,,COMPLETE,
55,0.8113064885139465,2025-09-03 08:07:55.014290,2025-09-03 08:15:10.868993,0 days 00:07:15.854703,100,uniform,6,nz,1.0371465736052497e-08,0.0045232277454288925,4252,992,old,1.2941748957283943,tanh,0.010832881927490235,COMPLETE,0.010832881927490235
56,0.9229032397270203,2025-09-03 08:15:10.869407,2025-09-03 08:22:20.187423,0 days 00:07:09.318016,100,uniform,6,nz,1.6353646596162606e-07,0.33877598811035786,6530,992,Glorot,,tanh,0.0001899242401123047,COMPLETE,0.0001899242401123047
57,0.3985161453485489,2025-09-03 08:22:20.192965,2025-09-03 08:29:29.268582,0 days 00:07:09.075617,100,uniform,6,nz,4.6738652054742806e-07,0.5358311372967917,2767,896,Glorot,,logistic,0.0030426740646362304,COMPLETE,0.0030426740646362304
58,0.31227420419454577,2025-09-03 08:29:29.269377,2025-09-03 09:03:09.391880,0 days 00:33:40.122503,20,uniform,5,zero,,0.45791521053561146,3524,960,Glorot,,logistic,0.0031998872756958006,COMPLETE,0.0031998872756958006
59,0.9222419500350952,2025-09-03 09:03:09.392800,2025-09-03 09:10:25.698535,0 days 00:07:16.305735,100,uniform,6,nz,4.6974363058953393e-07,0.21875436769584686,9800,960,Glorot,,tanh,0.00048468112945556643,COMPLETE,0.00048468112945556643
60,0.9231290459632874,2025-09-03 09:10:25.699193,2025-09-03 09:17:12.549518,0 days 00:06:46.850325,100,uniform,6,zero,,0.6273527796647869,6718,1008,Glorot,,tanh,0.0018962860107421876,COMPLETE,0.0018962860107421876
61,0.9030322909355164,2025-09-03 09:17:12.550226,2025-09-03 09:24:01.268812,0 days 00:06:48.718586,100,uniform,6,zero,,0.0573097142094303,5867,880,Glorot,,tanh,0.003401970863342285,COMPLETE,0.003401970863342285
62,0.8987581014633179,2025-09-03 09:24:01.269615,2025-09-03 09:31:14.990900,0 days 00:07:13.721285,100,uniform,8,nz,2.7423864307601544e-07,0.045247137837288925,5870,880,Glorot,,tanh,0.0037427186965942384,COMPLETE,0.0037427186965942384
63,0.09972580820322037,2025-09-03 09:31:14.991317,2025-09-03 09:38:22.159851,0 days 00:07:07.168534,100,uniform,6,nz,3.4618393209881933e-07,0.9764055921986514,9074,928,Glorot,,tanh,,COMPLETE,
64,0.09972580820322037,2025-09-03 09:38:22.160865,2025-09-03 10:12:08.366959,0 days 00:33:46.206094,20,normal,8,zero,,0.6376753487837479,1476,784,Glorot,,tanh,,COMPLETE,
65,0.9294032454490662,2025-09-03 10:12:08.367361,2025-09-03 10:48:43.151859,0 days 00:36:34.784498,20,uniform,6,nz,1.8562994178944103e-07,0.14338527448998015,9648,912,Glorot,,tanh,4.177093505859375e-05,COMPLETE,4.177093505859375e-05
66,0.9201451778411865,2025-09-03 10:48:43.152278,2025-09-03 11:24:25.415581,0 days 00:35:42.263303,20,uniform,6,nz,8.138588758681034e-08,0.04340195736340233,8922,864,Glorot,,tanh,0.0013833999633789062,COMPLETE,0.0013833999633789062
67,0.746096807718277,2025-09-03 11:24:25.416553,2025-09-03 11:31:12.454987,0 days 00:06:47.038434,100,uniform,6,zero,,0.18223368694677483,9058,976,Glorot,,logistic,0.0008170366287231446,COMPLETE,0.0008170366287231446
68,0.09972580820322037,2025-09-03 11:31:12.455388,2025-09-03 12:07:12.964880,0 days 00:36:00.509492,20,uniform,6,nz,9.599981992055087e-08,0.505309663615244,7325,800,old,1.9970125428303782,tanh,,COMPLETE,
69,0.9254354953765869,2025-09-03 12:07:12.965670,2025-09-03 12:43:13.064183,0 days 00:36:00.098513,20,uniform,8,nz,1.0469858389990203e-08,0.21438062940322344,3676,960,Glorot,,tanh,5.5861473083496096e-05,COMPLETE,5.5861473083496096e-05
70,0.5655806690454483,2025-09-03 12:43:13.064615,2025-09-03 13:20:14.325895,0 days 00:37:01.261280,20,uniform,8,nz,1.0784036595744282e-08,0.41404069553204403,3329,912,Glorot,,tanh,,COMPLETE,
71,0.09972580820322037,2025-09-03 13:20:14.326614,2025-09-03 13:27:22.368839,0 days 00:07:08.042225,100,uniform,6,zero,,0.9184467448275976,4248,832,old,0.7910481954709916,tanh,,COMPLETE,
72,0.8029677510261536,2025-09-03 13:27:22.369259,2025-09-03 14:03:32.101725,0 days 00:36:09.732466,20,uniform,8,nz,1.080350637787874e-08,0.013061745506314542,6335,912,Glorot,,logistic,0.0049048662185668945,COMPLETE,0.0049048662185668945
73,0.902564549446106,2025-09-03 14:03:32.102164,2025-09-03 14:40:32.894220,0 days 00:37:00.792056,20,uniform,5,nz,7.381184731360426e-08,0.035325139044695655,2406,960,Glorot,,tanh,0.004684925079345703,COMPLETE,0.004684925079345703
74,0.8878387570381164,2025-09-03 14:40:32.894631,2025-09-03 15:17:05.560069,0 days 00:36:32.665438,20,uniform,8,nz,6.839443618525271e-08,0.02923434128565442,1294,912,old,1.4553581615616051,tanh,0.006645488739013672,COMPLETE,0.006645488739013672
75,0.912290346622467,2025-09-03 15:17:05.560855,2025-09-03 15:54:00.062370,0 days 00:36:54.501515,20,uniform,7,nz,1.0008258619565287e-08,0.041184322165075296,4624,800,Glorot,,tanh,0.002257561683654785,COMPLETE,0.002257561683654785
76,0.49427421391010284,2025-09-03 15:54:00.063157,2025-09-03 16:31:14.267278,0 days 00:37:14.204121,20,uniform,6,nz,8.855377423703595e-08,0.4054741746534465,2784,928,Glorot,,logistic,0.006700825691223144,COMPLETE,0.006700825691223144
77,0.9263871073722839,2025-09-03 16:31:14.268289,2025-09-03 17:06:04.418301,0 days 00:34:50.150012,20,normal,5,zero,,0.16957117619749384,9020,704,Glorot,,tanh,0.0001559734344482422,COMPLETE,0.0001559734344482422
78,0.5714193940162658,2025-09-03 17:06:04.419024,2025-09-03 17:40:44.637457,0 days 00:34:40.218433,20,normal,5,zero,,0.0014761192591804448,5401,352,Glorot,,tanh,0.012008428573608398,COMPLETE,0.012008428573608398
79,0.9204193711280823,2025-09-03 17:40:44.637856,2025-09-03 18:15:14.403304,0 days 00:34:29.765448,20,normal,5,zero,,0.0320801788251038,4463,592,old,0.24482678225902588,tanh,0.0026444196701049805,COMPLETE,0.0026444196701049805
80,0.922225821018219,2025-09-03 18:15:14.404192,2025-09-03 18:49:32.452650,0 days 00:34:18.048458,20,normal,5,zero,,0.17152584731224463,6134,560,Glorot,,tanh,6.127357482910156e-05,COMPLETE,6.127357482910156e-05
81,0.9183225989341736,2025-09-03 18:49:32.453064,2025-09-03 18:56:31.882916,0 days 00:06:59.429852,100,uniform,7,zero,,0.3660467957627758,3239,928,Glorot,,tanh,0.0003437519073486328,COMPLETE,0.0003437519073486328
82,0.9255967855453491,2025-09-03 18:56:31.883326,2025-09-03 19:30:51.140374,0 days 00:34:19.257048,20,normal,5,zero,,0.21872506800372948,3366,1024,Glorot,,tanh,5.1903724670410154e-05,COMPLETE,5.1903724670410154e-05
83,0.9284839034080505,2025-09-03 19:30:51.140965,2025-09-03 20:05:16.478185,0 days 00:34:25.337220,20,normal,5,zero,,0.10928807530269471,9680,848,Glorot,,tanh,4.4679641723632814e-05,COMPLETE,4.4679641723632814e-05
84,0.9277258276939392,2025-09-03 20:05:16.478883,2025-09-03 20:39:34.149349,0 days 00:34:17.670466,20,normal,5,zero,,0.11910045650464388,7536,944,Glorot,,tanh,0.00010693073272705078,COMPLETE,0.00010693073272705078
85,0.6479839086532593,2025-09-03 20:39:34.150026,2025-09-03 21:13:35.559209,0 days 00:34:01.409183,20,normal,5,zero,,0.001795174068129388,5435,992,Glorot,,tanh,0.012333226203918458,COMPLETE,0.012333226203918458
86,0.9281935691833496,2025-09-03 21:13:35.559881,2025-09-03 21:47:45.208811,0 days 00:34:09.648930,20,normal,5,zero,,0.2104491711735656,6634,1008,Glorot,,tanh,0.0003283500671386719,COMPLETE,0.0003283500671386719
87,0.09972580820322037,2025-09-03 21:47:45.210113,2025-09-03 22:24:25.946212,0 days 00:36:40.736099,20,normal,5,nz,1.734430168621454e-06,0.6683316504102249,9498,800,Glorot,,tanh,,COMPLETE,
88,0.8847581148147583,2025-09-03 22:24:25.946628,2025-09-03 22:59:11.309587,0 days 00:34:45.362959,20,normal,7,zero,,0.38402851212581063,7140,848,Glorot,,tanh,0.0026554107666015626,COMPLETE,0.0026554107666015626
89,0.9109355092048645,2025-09-03 22:59:11.310019,2025-09-03 23:33:33.362554,0 days 00:34:22.052535,20,normal,6,zero,,0.024642914650870977,6557,960,Glorot,,tanh,0.0036418676376342774,COMPLETE,0.0036418676376342774
90,0.9243387222290039,2025-09-03 23:33:33.362975,2025-09-04 00:07:58.924915,0 days 00:34:25.561940,20,normal,5,zero,,0.24212463973328757,6643,864,old,0.8598100296914786,tanh,0.0010809898376464844,COMPLETE,0.0010809898376464844
91,0.09972580820322037,2025-09-04 00:07:58.925619,2025-09-04 00:42:16.342781,0 days 00:34:17.417162,20,normal,5,zero,,0.7579561492789518,3845,1008,old,0.8607504599381745,tanh,,COMPLETE,
92,0.9240000128746033,2025-09-04 00:42:16.343499,2025-09-04 01:16:41.665727,0 days 00:34:25.322228,20,normal,5,zero,,0.07410238090632018,7875,848,Glorot,,tanh,0.0004745960235595703,COMPLETE,0.0004745960235595703
93,0.12853226363658904,2025-09-04 01:16:41.666363,2025-09-04 01:51:04.142488,0 days 00:34:22.476125,20,normal,5,zero,,0.7847453345698702,8314,896,Glorot,,logistic,,COMPLETE,
94,0.8763065099716186,2025-09-04 01:51:04.143188,2025-09-04 02:26:12.462818,0 days 00:35:08.319630,20,normal,5,zero,,0.3854697455897204,9163,1024,Glorot,,tanh,0.0014209270477294922,COMPLETE,0.0014209270477294922
95,0.9063387393951416,2025-09-04 02:26:12.463253,2025-09-04 03:00:34.173426,0 days 00:34:21.710173,20,normal,8,zero,,0.02120479561986774,6875,816,Glorot,,tanh,0.003347444534301758,COMPLETE,0.003347444534301758
96,0.8741290688514709,2025-09-04 03:00:34.173829,2025-09-04 03:07:41.571942,0 days 00:07:07.398113,100,uniform,5,zero,,0.02228251687495331,4362,512,Glorot,,tanh,0.0028572320938110352,COMPLETE,0.0028572320938110352
