number,value,datetime_start,datetime_complete,duration,params_batch_size,params_colnorm_thresh,params_dist1,params_iseed,params_l2_penalty_choice,params_l2_penalty_nz,params_lr,params_lr_anneal_start,params_nhid1,params_pca_energy,params_preproc,params_scale_heur1,params_scale_mult1,params_squash,state
0,0.5502241055170695,2025-08-19 16:21:29.238964,2025-08-19 16:22:26.539636,0 days 00:00:57.300672,100,0.0005015058627345243,normal,5,nz,1.9938526575766294e-07,0.0013988145471403844,5531,304,,colnorm,old,1.6472283931159761,logistic,COMPLETE
1,0.7793102065722147,2025-08-19 16:22:26.540203,2025-08-19 16:25:54.244089,0 days 00:03:27.703886,20,,normal,8,nz,6.877379343359302e-05,0.03117393614738109,8207,816,,raw,old,0.4861052828154749,tanh,COMPLETE
2,0.5578964749972025,2025-08-19 16:25:54.244598,2025-08-19 16:26:36.257753,0 days 00:00:42.013155,100,,uniform,7,nz,2.8837666056323094e-05,0.05584004428936968,177,896,,raw,Glorot,,logistic,COMPLETE
3,0.56541375319163,2025-08-19 16:26:36.258142,2025-08-19 16:30:03.748935,0 days 00:03:27.490793,20,1.931279575416009e-05,normal,7,nz,2.3283305951025803e-06,0.008815247512245055,352,592,,colnorm,old,0.41207716520709325,tanh,COMPLETE
4,0.5188620289166769,2025-08-19 16:30:03.749444,2025-08-19 16:33:14.542607,0 days 00:03:10.793163,20,,normal,8,zero,,0.0008738429616059043,296,16,,raw,Glorot,,tanh,COMPLETE
5,0.5259655316670736,2025-08-19 16:33:14.543093,2025-08-19 16:33:55.000502,0 days 00:00:40.457409,100,,uniform,7,nz,2.96110731335575e-05,2.7513191399501455e-06,1091,736,,raw,old,0.3986592672283056,tanh,COMPLETE
6,0.6899481813112894,2025-08-19 16:33:55.000862,2025-08-19 16:34:35.419817,0 days 00:00:40.418955,100,,uniform,7,nz,1.3508086655014222e-07,0.0035097551565349723,7129,704,,raw,old,1.889718202304746,tanh,COMPLETE
7,0.5237758557001749,2025-08-19 16:34:35.420073,2025-08-19 16:37:37.261250,0 days 00:03:01.841177,20,0.00033275493075422173,uniform,5,zero,,0.006020585537797632,304,48,,colnorm,Glorot,,logistic,COMPLETE
8,0.5537757873535156,2025-08-19 16:37:37.261629,2025-08-19 16:40:52.666803,0 days 00:03:15.405174,20,1.1844936008312047e-07,uniform,6,nz,0.00026595611945480095,0.0014314257148109512,189,512,,colnorm,Glorot,,tanh,COMPLETE
9,0.5102069775263468,2025-08-19 16:40:52.667203,2025-08-19 16:44:05.934601,0 days 00:03:13.267398,20,,normal,8,nz,6.668824711695306e-08,0.0001556791765662257,703,656,,raw,old,1.08261114817213,logistic,COMPLETE
10,0.5331377188364664,2025-08-19 16:44:05.935001,2025-08-19 16:47:08.753411,0 days 00:03:02.818410,20,,normal,8,zero,,0.7029878256216784,2632,864,0.6324965326471377,pca,old,0.8347158049216962,tanh,COMPLETE
11,0.7186892429987589,2025-08-19 16:47:08.755149,2025-08-19 16:47:48.449853,0 days 00:00:39.694704,100,,uniform,6,nz,0.005974030173616986,0.13290699530474032,9874,976,,raw,old,1.9739783666322608,tanh,COMPLETE
12,0.5620858271916708,2025-08-19 16:47:48.450124,2025-08-19 16:48:29.071174,0 days 00:00:40.621050,100,,uniform,6,nz,0.0061381967919813644,0.5753345671960548,3240,1008,0.9133781840630818,pca,old,1.3959309741284658,tanh,COMPLETE
13,0.7358616590499878,2025-08-19 16:48:29.071488,2025-08-19 16:49:08.086093,0 days 00:00:39.014605,100,,normal,6,nz,0.006922334525359859,0.0701074372272309,9953,1008,,raw,old,0.8422526684611005,tanh,COMPLETE
14,0.8117757042249044,2025-08-19 16:49:08.086459,2025-08-19 16:49:47.175169,0 days 00:00:39.088710,100,,normal,6,nz,0.00036365552235649633,0.0483799408158832,2785,816,,raw,old,0.8112567196027518,tanh,COMPLETE
15,0.525534431139628,2025-08-19 16:49:47.175447,2025-08-19 16:52:51.322129,0 days 00:03:04.146682,20,,normal,8,zero,,4.24952812334243e-05,2111,448,,raw,old,0.20969156343394824,tanh,COMPLETE
16,0.8040171066919962,2025-08-19 16:52:51.326716,2025-08-19 16:53:32.379128,0 days 00:00:41.052412,100,,normal,8,nz,0.000552240843233654,0.017726919010000335,4555,784,0.9776469311905671,pca,old,0.6871700099052621,tanh,COMPLETE
17,0.7939310471216837,2025-08-19 16:53:32.379511,2025-08-19 16:54:13.278739,0 days 00:00:40.899228,100,,normal,6,nz,0.00044799353901495484,0.020108761926641096,4074,304,0.9969974266842345,pca,old,0.8500354129390305,tanh,COMPLETE
18,0.7121728459993998,2025-08-19 16:54:13.278932,2025-08-19 16:54:51.177344,0 days 00:00:37.898412,100,,normal,5,zero,,0.22040673756826393,1530,784,0.7648975995251047,pca,Glorot,,logistic,COMPLETE
19,0.554655134677887,2025-08-19 16:54:51.177680,2025-08-19 16:55:32.928944,0 days 00:00:41.751264,100,,normal,8,nz,0.0006708267076662029,0.00026626992907165644,691,608,0.8148084663979913,pca,old,1.1406684542999241,tanh,COMPLETE
20,0.49879300594329834,2025-08-19 16:55:32.929327,2025-08-19 16:56:13.882337,0 days 00:00:40.953010,100,,normal,6,nz,1.6532821860744293e-06,4.883813720291941e-06,1842,400,0.6096847749896523,pca,old,0.6647729868112232,tanh,COMPLETE
21,0.7779654860496521,2025-08-19 16:56:13.882622,2025-08-19 16:56:54.876611,0 days 00:00:40.993989,100,,normal,6,nz,0.0007522660597156329,0.017497776122039413,3956,224,0.9980409960984288,pca,old,0.9896211291158944,tanh,COMPLETE
22,0.7929138541221619,2025-08-19 16:56:54.876922,2025-08-19 16:57:35.977352,0 days 00:00:41.100430,100,,normal,6,nz,0.00022354670426516743,0.019303649217085144,4409,176,0.9876847626357249,pca,old,0.7431089031162234,tanh,COMPLETE
23,0.7826723655064901,2025-08-19 16:57:35.977734,2025-08-19 16:58:16.943216,0 days 00:00:40.965482,100,,normal,6,nz,0.0012314484874454811,0.15077601677370722,5737,368,0.9099371860513995,pca,old,0.61452671657327,tanh,COMPLETE
24,0.6528620521227518,2025-08-19 16:58:16.943598,2025-08-19 16:58:58.084662,0 days 00:00:41.141064,100,,normal,6,nz,5.918242334357447e-06,0.005080987941896603,2927,528,0.8570065056376944,pca,old,1.3228687965280068,tanh,COMPLETE
25,0.6229311227798462,2025-08-19 16:58:58.084935,2025-08-19 16:59:39.410242,0 days 00:00:41.325307,100,,normal,6,nz,0.00013622454343676355,0.022830128562691336,1144,928,0.6926195148454688,pca,old,0.910073037442257,tanh,COMPLETE
26,0.5642927487691244,2025-08-19 16:59:39.410551,2025-08-19 17:00:20.386952,0 days 00:00:40.976401,100,,normal,8,nz,0.0015563835039127292,0.3002235046425762,4328,144,0.505662124250548,pca,Glorot,,tanh,COMPLETE
27,0.7273446122805277,2025-08-19 17:00:20.387350,2025-08-19 17:00:58.804181,0 days 00:00:38.416831,100,,normal,5,zero,,0.059827625272763765,2114,288,0.9308693753839905,pca,old,0.5824431449741985,logistic,COMPLETE
28,0.6682241956392924,2025-08-19 17:00:58.804378,2025-08-19 17:01:39.630674,0 days 00:00:40.826296,100,,normal,6,nz,3.6387265606176914e-05,0.002740998056086765,5796,816,0.8623869579629837,pca,old,1.2134242294384658,tanh,COMPLETE
29,0.53003458182017,2025-08-19 17:01:39.631013,2025-08-19 17:02:20.320131,0 days 00:00:40.689118,100,1.1198116178420074e-09,normal,5,nz,1.6547332437477806e-08,0.0005435188089123088,3690,304,,colnorm,old,1.0061272697386432,logistic,COMPLETE
30,0.6489826639493307,2025-08-19 17:02:20.320509,2025-08-19 17:03:01.082229,0 days 00:00:40.761720,100,1.0044707455457436e-07,normal,8,nz,0.00041366770050931136,0.010450242502537198,1638,720,,colnorm,old,0.7503785618519782,tanh,COMPLETE
31,0.8131206830342611,2025-08-19 17:03:01.082425,2025-08-19 17:03:41.891794,0 days 00:00:40.809369,100,,normal,6,nz,0.00016525457528407625,0.027993960929447118,5214,176,0.9852752492087211,pca,old,0.7264610339352253,tanh,COMPLETE
32,0.756982704003652,2025-08-19 17:03:41.892135,2025-08-19 17:04:22.556004,0 days 00:00:40.663869,100,,normal,6,nz,0.002539229534078354,0.04088329019635079,5656,96,0.9987531007823627,pca,old,0.5397943321373065,tanh,COMPLETE
33,0.8259827097256979,2025-08-19 17:04:22.556376,2025-08-19 17:05:02.947485,0 days 00:00:40.391109,100,,normal,6,nz,9.971322690944897e-05,0.08583034229051673,2563,256,0.9516373214308009,pca,old,0.7296182838739886,tanh,COMPLETE
34,0.8258964618047079,2025-08-19 17:05:02.947674,2025-08-19 17:05:43.252242,0 days 00:00:40.304568,100,,normal,6,nz,7.335533349807167e-05,0.08435595404451647,2498,224,0.932867308263318,pca,old,0.7014199311388167,tanh,COMPLETE
35,0.7351896564165751,2025-08-19 17:05:43.252591,2025-08-19 17:06:22.322449,0 days 00:00:39.069858,100,,normal,6,nz,9.171499761050509e-05,0.09900118056864164,2433,112,,raw,old,0.24856242086116692,tanh,COMPLETE
36,0.7986897627512614,2025-08-19 17:06:22.322703,2025-08-19 17:07:03.200300,0 days 00:00:40.877597,100,,normal,6,nz,1.2751760277684191e-05,0.3710951324547078,815,240,0.9263710877835962,pca,Glorot,,tanh,COMPLETE
37,0.5666550993919373,2025-08-19 17:07:03.200599,2025-08-19 17:07:42.488566,0 days 00:00:39.287967,100,,normal,7,nz,9.188183900643732e-06,0.04767837954133631,1363,192,,raw,old,0.36917599887870156,logistic,COMPLETE
38,0.5544482866923014,2025-08-19 17:07:42.488948,2025-08-19 17:08:19.311960,0 days 00:00:36.823012,100,,uniform,6,zero,,0.0019478527272023842,7189,64,,raw,old,0.9546985664480949,tanh,COMPLETE
39,0.6534828742345175,2025-08-19 17:08:19.312225,2025-08-19 17:11:35.302109,0 days 00:03:15.989884,20,1.3828918608402494e-09,normal,7,nz,7.676932102214185e-05,0.7414859046783504,461,368,,colnorm,Glorot,,tanh,COMPLETE
40,0.7010345657666525,2025-08-19 17:11:35.302498,2025-08-19 17:12:15.756349,0 days 00:00:40.453851,100,,normal,6,nz,0.00015548147629917836,0.009013603432210807,2940,496,0.8411827677171645,pca,old,0.7735085471573732,tanh,COMPLETE
41,0.8183446526527405,2025-08-19 17:12:15.756652,2025-08-19 17:12:56.320799,0 days 00:00:40.564147,100,,normal,8,nz,5.3152886625838945e-05,0.10453676517682682,7158,256,0.9478965885637938,pca,old,0.6592749730963798,tanh,COMPLETE
42,0.7412068446477255,2025-08-19 17:12:56.321189,2025-08-19 17:13:36.203871,0 days 00:00:39.882682,100,,normal,6,nz,3.018212913259452e-05,0.1724640292097772,119,256,0.9405543396372669,pca,old,0.5641576300967622,tanh,COMPLETE
43,0.7914309501647949,2025-08-19 17:13:36.204148,2025-08-19 17:14:15.514968,0 days 00:00:39.310820,100,,normal,6,nz,7.208887410220538e-05,0.0907340921199707,6310,160,0.8803737739476765,pca,old,0.48950341349986215,tanh,COMPLETE
44,0.7106895049413046,2025-08-19 17:14:15.515285,2025-08-19 17:14:55.560847,0 days 00:00:40.045562,100,,uniform,7,nz,1.8445475746538993e-05,0.03683580264718964,7942,16,0.9503569016495322,pca,old,0.6957532849488433,tanh,COMPLETE
45,0.7998103102048238,2025-08-19 17:14:55.561229,2025-08-19 17:18:08.891702,0 days 00:03:13.330473,20,,normal,8,nz,5.097506007818509e-06,0.3739139736071671,3387,352,,raw,old,0.46465758975853794,tanh,COMPLETE
46,0.7407069404919943,2025-08-19 17:18:08.892567,2025-08-19 17:18:47.805097,0 days 00:00:38.912530,100,,normal,6,zero,,0.10477273371205166,2263,208,0.8132677173024317,pca,old,0.3798293390347745,logistic,COMPLETE
47,0.7870517174402872,2025-08-19 17:18:47.805300,2025-08-19 17:19:27.472133,0 days 00:00:39.666833,100,,uniform,5,nz,5.61933669283737e-05,0.008613279992778916,5098,448,,raw,Glorot,,tanh,COMPLETE
48,0.7265346050262451,2025-08-19 17:19:27.472519,2025-08-19 17:22:41.209248,0 days 00:03:13.736729,20,4.874239697052919e-06,normal,8,nz,1.263572816416465e-06,0.23042842461716317,8515,96,,colnorm,old,0.8675648856787761,tanh,COMPLETE
49,0.7659655809402466,2025-08-19 17:22:41.209651,2025-08-19 17:23:21.597668,0 days 00:00:40.388017,100,,normal,6,nz,0.00023870268728659133,0.03498297106139033,2690,256,0.8875657373322918,pca,old,1.049266721326162,tanh,COMPLETE
50,0.8105690479278564,2025-08-19 17:23:21.597973,2025-08-19 17:23:58.971832,0 days 00:00:37.373859,100,,uniform,6,zero,,0.848863789771228,1876,656,,raw,old,0.7823061165849833,tanh,COMPLETE
51,0.8252069552739462,2025-08-19 17:23:58.972201,2025-08-19 17:24:36.214949,0 days 00:00:37.242748,100,,uniform,6,zero,,0.47815704454978564,1943,656,,raw,old,0.773071994482595,tanh,COMPLETE
52,0.8311208089192709,2025-08-19 17:24:36.215215,2025-08-19 17:25:13.896815,0 days 00:00:37.681600,100,,uniform,6,zero,,0.4595421181579452,1295,864,,raw,old,0.616690964291875,tanh,COMPLETE
53,0.8367932438850403,2025-08-19 17:25:13.897126,2025-08-19 17:25:51.426348,0 days 00:00:37.529222,100,,uniform,6,zero,,0.4624574800391731,1267,672,,raw,old,0.6315656863774836,tanh,COMPLETE
54,0.8333793679873148,2025-08-19 17:25:51.426700,2025-08-19 17:26:28.437095,0 days 00:00:37.010395,100,,uniform,6,zero,,0.5402775779038411,1229,592,,raw,old,0.6189081451095182,tanh,COMPLETE
55,0.8320690989494324,2025-08-19 17:26:28.437307,2025-08-19 17:27:04.538160,0 days 00:00:36.100853,100,,uniform,6,zero,,0.4910369962488951,1234,592,,raw,old,0.48439514555232227,tanh,COMPLETE
56,0.8078793883323669,2025-08-19 17:27:04.538528,2025-08-19 17:27:41.336863,0 days 00:00:36.798335,100,,uniform,6,zero,,0.97871391992532,938,592,,raw,old,1.6863268656351926,tanh,COMPLETE
57,0.7728619575500488,2025-08-19 17:27:41.337224,2025-08-19 17:30:42.782111,0 days 00:03:01.444887,20,,uniform,6,zero,,0.5188610115047555,1253,560,,raw,old,0.505827830519731,logistic,COMPLETE
58,0.7718964417775472,2025-08-19 17:30:42.782510,2025-08-19 17:31:19.939470,0 days 00:00:37.156960,100,,uniform,6,zero,,0.2543608622470222,578,688,,raw,Glorot,,tanh,COMPLETE
59,0.5119309425354004,2025-08-19 17:31:19.939732,2025-08-19 17:31:57.244034,0 days 00:00:37.304302,100,,uniform,6,zero,,1.0177992750828248e-06,1390,864,,raw,old,0.3519903098606299,tanh,COMPLETE
60,0.6755167841911316,2025-08-19 17:31:57.244359,2025-08-19 17:32:34.583561,0 days 00:00:37.339202,100,,uniform,6,zero,,0.17881299396777006,993,768,,raw,old,0.2877839796571607,tanh,COMPLETE
61,0.8293621937433878,2025-08-19 17:32:34.583929,2025-08-19 17:33:11.781168,0 days 00:00:37.197239,100,,uniform,6,zero,,0.47711131078156954,1629,624,,raw,old,0.6094372610744778,tanh,COMPLETE
62,0.8268967072168986,2025-08-19 17:33:11.781389,2025-08-19 17:33:49.060633,0 days 00:00:37.279244,100,,uniform,6,zero,,0.529564353865446,1612,624,,raw,old,0.6328523433771023,tanh,COMPLETE
63,0.8298104604085287,2025-08-19 17:33:49.060997,2025-08-19 17:34:26.118053,0 days 00:00:37.057056,100,,uniform,6,zero,,0.5545865093665774,1569,640,,raw,old,0.43009688627890824,tanh,COMPLETE
64,0.8291035294532776,2025-08-19 17:34:26.118413,2025-08-19 17:35:03.127699,0 days 00:00:37.009286,100,,uniform,6,zero,,0.43448441047153086,1576,624,,raw,old,0.423034785834566,tanh,COMPLETE
65,0.7327408393224081,2025-08-19 17:35:03.127910,2025-08-19 17:35:40.315079,0 days 00:00:37.187169,100,,uniform,6,zero,,0.32622334392884894,1118,560,,raw,old,0.4415461003947973,tanh,COMPLETE
66,0.8129483064015707,2025-08-19 17:35:40.315492,2025-08-19 17:36:17.766057,0 days 00:00:37.450565,100,,uniform,6,zero,,0.9126477111895932,866,688,,raw,old,0.3338541634345312,tanh,COMPLETE
67,0.8325003584225973,2025-08-19 17:36:17.766260,2025-08-19 17:36:54.930443,0 days 00:00:37.164183,100,,uniform,5,zero,,0.5327148900963812,722,752,,raw,old,0.4423938714602065,tanh,COMPLETE
68,0.526810348033905,2025-08-19 17:36:54.930804,2025-08-19 17:37:32.056896,0 days 00:00:37.126092,100,,uniform,5,zero,,2.641547294482431e-05,696,752,,raw,old,0.5940498867501929,tanh,COMPLETE
69,0.6432755788167318,2025-08-19 17:37:32.057167,2025-08-19 17:40:35.386108,0 days 00:03:03.328941,20,,uniform,5,zero,,0.6139400302271203,408,848,,raw,old,0.5379957788309206,logistic,COMPLETE
70,0.7667762041091919,2025-08-19 17:40:35.386503,2025-08-19 17:41:12.086918,0 days 00:00:36.700415,100,,uniform,5,zero,,0.2573391010786554,801,720,,raw,Glorot,,tanh,COMPLETE
71,0.7945170601209005,2025-08-19 17:41:12.087285,2025-08-19 17:41:48.490221,0 days 00:00:36.402936,100,,uniform,5,zero,,0.4104715177666916,1228,624,,raw,old,0.4417618425798264,tanh,COMPLETE
72,0.7240513563156128,2025-08-19 17:41:48.490478,2025-08-19 17:42:25.335458,0 days 00:00:36.844980,100,,uniform,6,zero,,0.19521442806937941,1666,576,,raw,old,0.26528115292601157,tanh,COMPLETE
73,0.8101206024487814,2025-08-19 17:42:25.335756,2025-08-19 17:43:01.932962,0 days 00:00:36.597206,100,,uniform,7,zero,,0.5816665019846816,1469,512,,raw,old,0.4297386081086517,tanh,COMPLETE
74,0.7290862003962199,2025-08-19 17:43:01.933354,2025-08-19 17:43:39.422070,0 days 00:00:37.488716,100,,uniform,6,zero,,0.3360730925317722,1043,656,,raw,old,0.5182887876733713,tanh,COMPLETE
75,0.7124998370806376,2025-08-19 17:43:39.422277,2025-08-19 17:44:17.187567,0 days 00:00:37.765290,100,,uniform,5,zero,,0.13678379124391676,614,928,,raw,old,0.6113130056861179,tanh,COMPLETE
76,0.8222068548202515,2025-08-19 17:44:17.187944,2025-08-19 17:44:54.599340,0 days 00:00:37.411396,100,,uniform,6,zero,,0.6780358340209552,1333,480,,raw,old,0.41231044294877994,tanh,COMPLETE
77,0.7207416693369547,2025-08-19 17:44:54.599690,2025-08-19 17:45:32.076797,0 days 00:00:37.477107,100,,uniform,6,zero,,0.15743249492104072,1752,800,,raw,old,0.3067555302915495,tanh,COMPLETE
78,0.7811546723047892,2025-08-19 17:45:32.077020,2025-08-19 17:46:08.895279,0 days 00:00:36.818259,100,,uniform,6,zero,,0.41544912994496325,1104,544,,raw,old,0.48903305559562976,tanh,COMPLETE
79,0.8029656211535136,2025-08-19 17:46:08.895646,2025-08-19 17:46:46.153832,0 days 00:00:37.258186,100,,uniform,6,zero,,0.9304015866922672,2038,608,,raw,old,0.20399568092316575,tanh,COMPLETE
