number,value,datetime_start,datetime_complete,duration,params_batch_size,params_colnorm_thresh,params_dist1,params_iseed,params_l2_penalty_choice,params_l2_penalty_nz,params_lr,params_lr_anneal_start,params_nhid1,params_pca_energy,params_preproc,params_scale_heur1,params_scale_mult1,params_squash,user_attrs_avg_fit_criteria,state,avg_fit_criteria
0,0.7227742195129394,2025-08-23 05:23:42.241581,2025-08-23 05:27:57.107664,0 days 00:04:14.866083,20,,normal,8,nz,1.5463788579841117e-06,0.00016653461936159484,1323,832,,raw,Glorot,,tanh,0.013052415847778321,COMPLETE,0.013052415847778321
1,0.7178548693656921,2025-08-23 05:27:57.109603,2025-08-23 05:28:49.169022,0 days 00:00:52.059419,100,,uniform,8,nz,1.9236748753487186e-08,2.0547199328558902e-05,7073,592,0.6584180610844357,pca,Glorot,,tanh,0.013090395927429199,COMPLETE,0.013090395927429199
2,0.801645179092884,2025-08-23 05:28:49.170965,2025-08-23 05:29:35.166488,0 days 00:00:45.995523,100,,normal,5,zero,,0.5659923651826084,3833,128,,raw,old,1.9857466391390506,tanh,,COMPLETE,
3,0.6414355278015137,2025-08-23 05:29:35.166747,2025-08-23 05:33:49.268419,0 days 00:04:14.101672,20,,uniform,8,zero,,0.0004181759315680524,1673,496,0.7936518167319924,pca,old,0.7411550703865422,logistic,0.013111758232116699,COMPLETE,0.013111758232116699
4,0.9286935687065124,2025-08-23 05:33:49.270441,2025-08-23 05:34:40.608075,0 days 00:00:51.337634,100,0.0005111785038494985,uniform,6,zero,,0.01772932380115616,3920,496,,colnorm,Glorot,,logistic,0.008339190483093261,COMPLETE,0.008339190483093261
5,0.9631129384040833,2025-08-23 05:34:40.609849,2025-08-23 05:38:53.996918,0 days 00:04:13.387069,20,,uniform,7,nz,2.754579187431946e-08,0.04731325254594746,1576,272,0.9395345807573379,pca,Glorot,,tanh,0.004752516746520996,COMPLETE,0.004752516746520996
6,0.2006451666355133,2025-08-23 05:38:53.998756,2025-08-23 05:39:51.600527,0 days 00:00:57.601771,100,,uniform,8,nz,4.347699888300888e-07,0.002194664177038812,147,1024,,raw,Glorot,,logistic,0.013021516799926757,COMPLETE,0.013021516799926757
7,0.9631613254547119,2025-08-23 05:39:51.603189,2025-08-23 05:40:41.595333,0 days 00:00:49.992144,100,0.00030649167289104257,normal,5,zero,,0.0816998127615149,1228,688,,colnorm,Glorot,,tanh,0.008454489707946777,COMPLETE,0.008454489707946777
8,0.9368710279464721,2025-08-23 05:40:41.597364,2025-08-23 05:41:34.756608,0 days 00:00:53.159244,100,,uniform,7,nz,0.0002645568202790849,0.02422873547786384,891,720,0.8913677959876881,pca,old,0.8538315683484765,tanh,0.011588859558105468,COMPLETE,0.011588859558105468
9,0.7037097215652466,2025-08-23 05:41:34.756843,2025-08-23 05:42:24.233665,0 days 00:00:49.476822,100,,uniform,7,zero,,3.170750300370449e-06,3320,656,0.9406161231694635,pca,old,0.8029927440054692,tanh,0.0132584810256958,COMPLETE,0.0132584810256958
10,0.9715322852134705,2025-08-23 05:42:24.233964,2025-08-23 05:46:37.627238,0 days 00:04:13.393274,20,,normal,8,nz,0.002551744641784246,0.03420715013038941,7313,368,0.936638035172104,pca,old,1.3715103262460462,tanh,0.004483246803283691,COMPLETE,0.004483246803283691
11,0.7907096982002259,2025-08-23 05:46:37.627561,2025-08-23 05:47:23.218808,0 days 00:00:45.591247,100,,uniform,5,zero,,0.002472295306383974,2075,64,,raw,old,0.2686955279215667,tanh,0.009249043464660645,COMPLETE,0.009249043464660645
12,0.9778871178627014,2025-08-23 05:47:23.219034,2025-08-23 05:51:19.197581,0 days 00:03:55.978547,20,,normal,8,zero,,0.12633115655273697,7996,496,,raw,old,1.2383117176396174,tanh,0.0027458667755126953,COMPLETE,0.0027458667755126953
13,0.9541290760040283,2025-08-23 05:51:19.197920,2025-08-23 05:52:08.021596,0 days 00:00:48.823676,100,0.00026396605532175534,normal,8,zero,,0.0856956409647669,1799,288,,colnorm,old,1.2920153892124882,logistic,0.003357410430908203,COMPLETE,0.003357410430908203
14,0.966741967201233,2025-08-23 05:52:08.021827,2025-08-23 05:56:03.597200,0 days 00:03:55.575373,20,1.9234441996304963e-05,normal,5,zero,,0.1914526965665586,1879,192,,colnorm,Glorot,,logistic,0.0002195596694946289,COMPLETE,0.0002195596694946289
15,0.933935546875,2025-08-23 05:56:03.599088,2025-08-23 06:00:14.427070,0 days 00:04:10.827982,20,1.2471437960535648e-06,normal,5,nz,1.3116339985565845e-05,0.002599150833651273,8061,416,,colnorm,Glorot,,tanh,0.01067807674407959,COMPLETE,0.01067807674407959
16,0.15453226417303084,2025-08-23 06:00:14.427353,2025-08-23 06:01:00.571761,0 days 00:00:46.144408,100,4.664316241584911e-07,uniform,6,zero,,0.00030045263597290177,531,32,,colnorm,Glorot,,logistic,0.01367201805114746,COMPLETE,0.01367201805114746
17,0.7790484189987182,2025-08-23 06:01:00.571990,2025-08-23 06:01:50.237015,0 days 00:00:49.665025,100,,uniform,5,nz,0.0020148539176503438,0.004266449491975976,3210,464,,raw,old,0.6801332526612567,logistic,0.00976390838623047,COMPLETE,0.00976390838623047
18,0.9192419528961182,2025-08-23 06:01:50.237233,2025-08-23 06:06:00.630688,0 days 00:04:10.393455,20,6.917979271942646e-07,normal,6,nz,6.192186988258287e-07,0.0030403110046740844,7268,928,,colnorm,Glorot,,logistic,0.010961699485778808,COMPLETE,0.010961699485778808
19,0.9406452178955078,2025-08-23 06:06:00.631001,2025-08-23 06:10:59.979048,0 days 00:04:59.348047,20,0.0002913468031487346,uniform,6,nz,1.265187772100772e-08,0.10035093057105589,548,256,,colnorm,old,0.2772973808283531,logistic,0.005863046646118164,COMPLETE,0.005863046646118164
20,0.9553064942359925,2025-08-23 06:10:59.979322,2025-08-23 06:15:13.862899,0 days 00:04:13.883577,20,,normal,8,zero,,0.010380337279685294,6874,688,,raw,old,1.49020452407454,tanh,0.008518433570861817,COMPLETE,0.008518433570861817
21,0.9108871221542358,2025-08-23 06:15:13.863156,2025-08-23 06:19:12.203276,0 days 00:03:58.340120,20,1.0895284441423112e-09,normal,5,zero,,0.008347127334096774,1301,176,,colnorm,Glorot,,logistic,0.00643610954284668,COMPLETE,0.00643610954284668
22,0.9644516468048095,2025-08-23 06:19:12.203585,2025-08-23 06:23:24.772407,0 days 00:04:12.568822,20,,normal,8,nz,0.00180794048733025,0.021721771897450753,5260,464,0.517117910674237,pca,old,1.36232924348388,tanh,0.00027680397033691406,COMPLETE,0.00027680397033691406
23,0.9638548731803894,2025-08-23 06:23:24.772673,2025-08-23 06:27:19.055367,0 days 00:03:54.282694,20,2.5121261485131696e-08,uniform,5,zero,,0.2944585225587344,637,224,,colnorm,Glorot,,tanh,0.0005092859268188476,COMPLETE,0.0005092859268188476
24,0.8017742112278938,2025-08-23 06:27:19.055635,2025-08-23 06:31:17.390975,0 days 00:03:58.335340,20,,uniform,8,zero,,0.2914474014398684,9715,432,,raw,old,1.6369911378155324,tanh,,COMPLETE,
25,0.9739516377449036,2025-08-23 06:31:17.391270,2025-08-23 06:35:14.032955,0 days 00:03:56.641685,20,,normal,5,zero,,0.22242176732040927,7420,368,0.7436911781262683,pca,old,1.1722914866764322,logistic,0.00038595199584960936,COMPLETE,0.00038595199584960936
26,0.9669677734375,2025-08-23 06:35:14.033222,2025-08-23 06:39:09.521751,0 days 00:03:55.488529,20,,normal,5,zero,,0.030464200701036847,9354,240,0.7434343328530566,pca,old,1.1674810558604098,logistic,0.0006824016571044921,COMPLETE,0.0006824016571044921
27,0.9517742395401001,2025-08-23 06:39:09.521984,2025-08-23 06:43:05.891060,0 days 00:03:56.369076,20,,normal,7,zero,,0.03714985948427787,6236,432,,raw,old,1.1853041808819964,logistic,0.002823281288146973,COMPLETE,0.002823281288146973
28,0.09835484176874161,2025-08-23 06:43:05.891319,2025-08-23 06:46:54.536319,0 days 00:03:48.645000,20,,uniform,5,zero,,0.2422172257176509,3964,512,0.8020309875899346,pca,old,1.1640224002571167,logistic,,COMPLETE,
29,0.9638387441635132,2025-08-23 06:46:54.536608,2025-08-23 06:50:50.095343,0 days 00:03:55.558735,20,1.898848391364699e-08,normal,8,zero,,0.2788545270277527,4441,224,,colnorm,old,1.6132238199476983,tanh,-8.187294006347656e-05,COMPLETE,-8.187294006347656e-05
30,0.8956129431724549,2025-08-23 06:50:50.095612,2025-08-23 06:51:40.041883,0 days 00:00:49.946271,100,,normal,8,nz,0.007395778600378908,0.12100788384248427,8158,352,,raw,old,1.1574389901327717,logistic,0.0007896900177001953,COMPLETE,0.0007896900177001953
31,0.7159677743911743,2025-08-23 06:51:40.042112,2025-08-23 06:55:34.972022,0 days 00:03:54.929910,20,,normal,5,zero,,0.00015377934522435292,6529,224,0.7112357072635118,pca,old,1.148253467602919,logistic,0.012942051887512207,COMPLETE,0.012942051887512207
32,0.9711290597915649,2025-08-23 06:55:34.972286,2025-08-23 06:59:31.650817,0 days 00:03:56.678531,20,,normal,6,zero,,0.11796547449443377,6633,320,0.7403542465565208,pca,old,1.25786524822785,logistic,-0.00029861927032470703,COMPLETE,-0.00029861927032470703
33,0.9594355225563049,2025-08-23 06:59:31.652883,2025-08-23 07:03:42.272436,0 days 00:04:10.619553,20,,normal,6,nz,9.007226001137875e-05,0.05803382313988087,3161,384,0.9992738162808836,pca,Glorot,,logistic,0.002776432037353516,COMPLETE,0.002776432037353516
34,0.9696774482727051,2025-08-23 07:03:42.272707,2025-08-23 07:07:38.093692,0 days 00:03:55.820985,20,,normal,6,zero,,0.11114057812552834,4006,656,0.6416432054945264,pca,old,1.4189158042922554,logistic,0.0010500192642211915,COMPLETE,0.0010500192642211915
35,0.09835484176874161,2025-08-23 07:07:38.093957,2025-08-23 07:11:46.419811,0 days 00:04:08.325854,20,,normal,6,nz,4.666314313749841e-05,0.749432590052121,7823,144,,raw,old,1.3748460576128836,tanh,,COMPLETE,
36,0.9569839119911194,2025-08-23 07:11:46.420108,2025-08-23 07:15:40.678404,0 days 00:03:54.258296,20,6.33045612809057e-06,normal,6,zero,,0.018981901628385714,8592,240,,colnorm,old,1.0656829877073124,logistic,0.0024384260177612305,COMPLETE,0.0024384260177612305
37,0.9756129264831543,2025-08-23 07:15:40.678671,2025-08-23 07:19:36.659191,0 days 00:03:55.980520,20,,normal,8,zero,,0.2345965975600609,1556,400,,raw,Glorot,,tanh,0.002364778518676758,COMPLETE,0.002364778518676758
38,0.9010806798934936,2025-08-23 07:19:36.660963,2025-08-23 07:23:33.360375,0 days 00:03:56.699412,20,,normal,8,zero,,0.0023952417557972987,2648,432,,raw,Glorot,,tanh,0.010854053497314452,COMPLETE,0.010854053497314452
39,0.9719193816184998,2025-08-23 07:23:33.362012,2025-08-23 07:27:29.656279,0 days 00:03:56.294267,20,,normal,8,zero,,0.3824324617024802,2675,304,,raw,Glorot,,logistic,0.0028397560119628905,COMPLETE,0.0028397560119628905
40,0.8748387575149537,2025-08-23 07:27:29.656547,2025-08-23 07:31:23.287303,0 days 00:03:53.630756,20,,normal,8,zero,,0.7628980472384495,1538,256,,raw,Glorot,,logistic,0.0023870229721069335,COMPLETE,0.0023870229721069335
41,0.9617903590202331,2025-08-23 07:31:23.287528,2025-08-23 07:32:10.340265,0 days 00:00:47.052737,100,,uniform,8,zero,,0.0801667941019477,7079,368,,raw,Glorot,,logistic,0.0013994216918945313,COMPLETE,0.0013994216918945313
42,0.974129056930542,2025-08-23 07:32:10.340473,2025-08-23 07:36:07.758841,0 days 00:03:57.418368,20,,uniform,6,zero,,0.06893540342840679,2554,384,,raw,Glorot,,tanh,0.004124951362609863,COMPLETE,0.004124951362609863
43,0.09835484176874161,2025-08-23 07:36:07.760782,2025-08-23 07:40:20.047779,0 days 00:04:12.286997,20,,uniform,6,nz,6.2006951025738276e-06,0.39890995965499704,7217,368,,raw,Glorot,,tanh,,COMPLETE,
44,0.9161774396896363,2025-08-23 07:40:20.048104,2025-08-23 07:44:18.511470,0 days 00:03:58.463366,20,,uniform,6,zero,,0.006041804135495775,2603,592,,raw,Glorot,,tanh,0.011005568504333495,COMPLETE,0.011005568504333495
45,0.09835484176874161,2025-08-23 07:44:18.511705,2025-08-23 07:48:26.751519,0 days 00:04:08.239814,20,,normal,8,nz,3.882191397184677e-07,0.8834730554196797,2720,288,,raw,Glorot,,tanh,,COMPLETE,
46,0.09835484176874161,2025-08-23 07:48:26.751768,2025-08-23 07:52:22.925731,0 days 00:03:56.173963,20,,uniform,6,zero,,0.7060641756343013,1571,320,0.5915928229641508,pca,Glorot,,tanh,,COMPLETE,
47,0.9217742085456848,2025-08-23 07:52:22.926033,2025-08-23 07:56:19.353808,0 days 00:03:56.427775,20,,normal,6,zero,,0.04991647597540031,301,496,,raw,Glorot,,tanh,0.010444569587707519,COMPLETE,0.010444569587707519
48,0.9729193806648254,2025-08-23 07:56:19.354072,2025-08-23 08:00:17.470290,0 days 00:03:58.116218,20,,normal,5,zero,,0.09540428634088968,1576,528,,raw,old,1.8774385502310182,tanh,0.004653382301330567,COMPLETE,0.004653382301330567
49,0.9149032473564148,2025-08-23 08:00:17.470534,2025-08-23 08:04:14.417937,0 days 00:03:56.947403,20,,normal,5,zero,,0.04262450402765799,746,640,,raw,old,1.9842624889187253,logistic,0.007139468193054199,COMPLETE,0.007139468193054199
50,0.09835484176874161,2025-08-23 08:04:14.418231,2025-08-23 08:08:11.041333,0 days 00:03:56.623102,20,,normal,5,zero,,0.616398654262992,1498,640,0.5209400495115339,pca,old,1.77889498693819,tanh,,COMPLETE,
51,0.9689839005470275,2025-08-23 08:08:11.041608,2025-08-23 08:12:07.665188,0 days 00:03:56.623580,20,,normal,7,zero,,0.06350559083700433,1268,400,0.8264287631544128,pca,Glorot,,tanh,0.005687308311462402,COMPLETE,0.005687308311462402
52,0.09835484176874161,2025-08-23 08:12:07.667069,2025-08-23 08:12:55.441760,0 days 00:00:47.774691,100,,normal,8,zero,,0.9540104226630308,8300,608,,raw,old,1.7721112290910797,tanh,,COMPLETE,
53,0.9723871231079102,2025-08-23 08:12:55.441970,2025-08-23 08:16:52.380507,0 days 00:03:56.938537,20,,normal,8,zero,,0.2336533792706319,781,800,,raw,Glorot,,tanh,0.007102799415588379,COMPLETE,0.007102799415588379
54,0.9633064866065979,2025-08-23 08:16:52.380779,2025-08-23 08:20:49.338640,0 days 00:03:56.957861,20,,normal,5,zero,,0.0783435747436657,1117,752,,raw,Glorot,,tanh,0.008750438690185547,COMPLETE,0.008750438690185547
55,0.9742580890655518,2025-08-23 08:20:49.338908,2025-08-23 08:24:44.998464,0 days 00:03:55.659556,20,,normal,8,zero,,0.28359270645620904,1126,944,,raw,Glorot,,tanh,0.006861162185668945,COMPLETE,0.006861162185668945
56,0.09835484176874161,2025-08-23 08:24:44.998684,2025-08-23 08:28:40.099871,0 days 00:03:55.101187,20,,uniform,7,zero,,0.5159450279311726,1449,480,,raw,Glorot,,tanh,,COMPLETE,
57,0.9768387317657471,2025-08-23 08:28:40.101731,2025-08-23 08:32:36.464758,0 days 00:03:56.363027,20,,normal,5,zero,,0.10447097198700052,3962,400,,raw,old,1.748065929092927,tanh,0.0018102645874023438,COMPLETE,0.0018102645874023438
58,0.09835484176874161,2025-08-23 08:32:36.465038,2025-08-23 08:36:32.918835,0 days 00:03:56.453797,20,,normal,5,zero,,0.7189342653788717,5025,160,,raw,old,1.6301354757747635,tanh,,COMPLETE,
59,0.09835484176874161,2025-08-23 08:36:32.919117,2025-08-23 08:40:29.396096,0 days 00:03:56.476979,20,,normal,8,zero,,0.6366696355128166,9657,448,,raw,old,0.8690822430127124,tanh,,COMPLETE,
60,0.9699838995933533,2025-08-23 08:40:29.396343,2025-08-23 08:41:16.420021,0 days 00:00:47.023678,100,,normal,8,zero,,0.08563063490541642,1959,448,,raw,Glorot,,tanh,0.005561208724975586,COMPLETE,0.005561208724975586
61,0.9548710107803344,2025-08-23 08:41:16.420250,2025-08-23 08:45:14.881387,0 days 00:03:58.461137,20,1.1920218284154202e-09,normal,8,zero,,0.07732911574738285,1092,944,,colnorm,old,1.9980429121982737,tanh,0.007514500617980957,COMPLETE,0.007514500617980957
62,0.9673871278762818,2025-08-23 08:45:14.881678,2025-08-23 08:49:24.039617,0 days 00:04:09.157939,20,7.680032334974391e-08,normal,5,nz,2.0535391010374204e-05,0.15806113728993237,4283,400,,colnorm,old,1.9918447925749758,logistic,0.00019316673278808595,COMPLETE,0.00019316673278808595
63,0.09835484176874161,2025-08-23 08:49:24.039896,2025-08-23 08:53:19.978018,0 days 00:03:55.938122,20,,normal,6,zero,,0.5483405846874078,674,992,0.6498519397196094,pca,Glorot,,tanh,,COMPLETE,
64,0.9004839062690735,2025-08-23 08:53:19.978282,2025-08-23 08:57:15.829165,0 days 00:03:55.850883,20,,normal,7,zero,,0.0041122774208140365,1215,400,,raw,old,1.740486597857768,tanh,0.010827779769897461,COMPLETE,0.010827779769897461
65,0.09835484176874161,2025-08-23 08:57:15.829449,2025-08-23 09:01:09.523883,0 days 00:03:53.694434,20,,normal,6,zero,,0.5653643156161369,3727,256,,raw,Glorot,,tanh,,COMPLETE,
66,0.09835484176874161,2025-08-23 09:01:09.524163,2025-08-23 09:05:06.843522,0 days 00:03:57.319359,20,9.425163189665444e-06,normal,8,zero,,0.4980297067583355,426,384,,colnorm,Glorot,,tanh,,COMPLETE,
67,0.9772580862045288,2025-08-23 09:05:06.843778,2025-08-23 09:09:04.019261,0 days 00:03:57.175483,20,,normal,5,zero,,0.1508664935208804,3226,592,,raw,old,1.7749743094026673,tanh,0.0030150651931762696,COMPLETE,0.0030150651931762696
68,0.9002742290496826,2025-08-23 09:09:04.019549,2025-08-23 09:09:54.114914,0 days 00:00:50.095365,100,,normal,5,nz,0.00017903601582494738,0.0025784561543791174,3203,560,,raw,old,1.561182287025993,tanh,0.011626601219177246,COMPLETE,0.011626601219177246
69,0.9649032592773438,2025-08-23 09:09:54.115133,2025-08-23 09:13:49.721990,0 days 00:03:55.606857,20,,normal,6,zero,,0.019413731469453892,4726,448,,raw,old,1.6170676412386553,tanh,0.0061560869216918945,COMPLETE,0.0061560869216918945
70,0.5785645321011543,2025-08-23 09:13:49.722249,2025-08-23 09:17:45.358084,0 days 00:03:55.635835,20,,normal,5,zero,,0.5032655108692359,9351,928,,raw,old,0.8169967510459524,logistic,0.0001354217529296875,COMPLETE,0.0001354217529296875
71,0.9760806679725647,2025-08-23 09:17:45.358332,2025-08-23 09:21:31.742718,0 days 00:03:46.384386,20,,normal,5,zero,,0.1667215190607793,1727,576,,raw,old,1.8375940409296576,tanh,0.0035551309585571287,COMPLETE,0.0035551309585571287
72,0.9715968012809754,2025-08-23 09:21:31.743001,2025-08-23 09:22:19.609801,0 days 00:00:47.866800,100,,uniform,8,zero,,0.1465240304092366,1583,944,,raw,Glorot,,tanh,0.007883906364440918,COMPLETE,0.007883906364440918
73,0.9752742171287536,2025-08-23 09:22:19.610020,2025-08-23 09:26:13.543404,0 days 00:03:53.933384,20,,normal,5,zero,,0.20330709422697624,4705,464,0.813064499549462,pca,Glorot,,logistic,0.00035688877105712893,COMPLETE,0.00035688877105712893
74,0.9636451959609985,2025-08-23 09:26:13.543686,2025-08-23 09:30:08.939817,0 days 00:03:55.396131,20,,normal,5,zero,,0.02356030592211301,9358,656,0.8617142683735778,pca,Glorot,,logistic,0.005450129508972168,COMPLETE,0.005450129508972168
75,0.9224032402038574,2025-08-23 09:30:08.940100,2025-08-23 09:34:05.232768,0 days 00:03:56.292668,20,,uniform,5,zero,,0.006361475350374451,4040,832,,raw,old,1.809433657663334,tanh,0.01092672348022461,COMPLETE,0.01092672348022461
76,0.9383548974990845,2025-08-23 09:34:05.233063,2025-08-23 09:37:51.283814,0 days 00:03:46.050751,20,,normal,5,zero,,0.007068912678568377,5054,576,,raw,old,1.7492784348417492,tanh,0.009763669967651368,COMPLETE,0.009763669967651368
77,0.9257258176803589,2025-08-23 09:37:51.284033,2025-08-23 09:41:48.424706,0 days 00:03:57.140673,20,,normal,6,zero,,0.06476019988616138,2018,1008,,raw,Glorot,,logistic,0.0060482978820800785,COMPLETE,0.0060482978820800785
78,0.9757097005844116,2025-08-23 09:41:48.424973,2025-08-23 09:45:58.109224,0 days 00:04:09.684251,20,,uniform,5,nz,1.994276403630898e-07,0.24514205929582783,4068,640,,raw,old,1.9709600263565288,tanh,0.0038424253463745115,COMPLETE,0.0038424253463745115
79,0.09835484176874161,2025-08-23 09:45:58.111010,2025-08-23 09:50:07.975766,0 days 00:04:09.864756,20,,normal,7,nz,2.152875284343961e-07,0.5058390687179869,5666,1008,,raw,Glorot,,tanh,,COMPLETE,
80,0.9760645389556885,2025-08-23 09:50:07.977772,2025-08-23 09:54:16.925575,0 days 00:04:08.947803,20,,uniform,5,nz,1.1172905154557317e-08,0.11887502481398413,2326,528,,raw,old,1.9840430705480392,tanh,0.004250168800354004,COMPLETE,0.004250168800354004
81,0.9674193859100342,2025-08-23 09:54:16.925852,2025-08-23 09:58:26.974417,0 days 00:04:10.048565,20,,uniform,8,nz,2.0742542605780096e-08,0.14082524631830245,826,896,,raw,old,1.9902671534000964,tanh,0.008129048347473144,COMPLETE,0.008129048347473144
82,0.9760484099388123,2025-08-23 09:58:26.974675,2025-08-23 10:02:35.658842,0 days 00:04:08.684167,20,,uniform,5,nz,1.2300629426164055e-07,0.26179181530728346,3599,432,,raw,old,1.9929981746341028,tanh,0.001998305320739746,COMPLETE,0.001998305320739746
83,0.9756935715675354,2025-08-23 10:02:35.659134,2025-08-23 10:06:44.455949,0 days 00:04:08.796815,20,,uniform,5,nz,8.125054590013508e-08,0.24853656503679158,1480,464,,raw,old,1.9842147407071022,tanh,0.002854657173156738,COMPLETE,0.002854657173156738
84,0.09835484176874161,2025-08-23 10:06:44.456224,2025-08-23 10:10:53.483394,0 days 00:04:09.027170,20,,uniform,5,nz,1.262976287023645e-07,0.4091866182984729,3235,624,,raw,old,1.9901496553837013,tanh,,COMPLETE,
85,0.9723709940910339,2025-08-23 10:10:53.483645,2025-08-23 10:15:03.211520,0 days 00:04:09.727875,20,,uniform,5,nz,1.0070379647332817e-07,0.22199215183551782,563,336,,raw,old,1.9807705334682728,tanh,0.003293752670288086,COMPLETE,0.003293752670288086
86,0.9748548626899719,2025-08-23 10:15:03.211819,2025-08-23 10:19:11.268131,0 days 00:04:08.056312,20,,uniform,5,nz,1.2698350803131615e-08,0.17197359552134642,3676,480,,raw,old,1.998314212251647,logistic,0.0005753517150878906,COMPLETE,0.0005753517150878906
87,0.09835484176874161,2025-08-23 10:19:11.269921,2025-08-23 10:23:20.038164,0 days 00:04:08.768243,20,,normal,6,nz,1.564040205509301e-07,0.8191420485860818,2962,816,,raw,old,1.988535944070931,tanh,,COMPLETE,
88,0.9767742156982422,2025-08-23 10:23:20.039933,2025-08-23 10:27:29.787845,0 days 00:04:09.747912,20,,uniform,7,nz,1.5492387428819474e-07,0.15214823171754366,4952,336,,raw,old,1.8024016821570543,tanh,0.0018378734588623048,COMPLETE,0.0018378734588623048
89,0.9596129417419433,2025-08-23 10:27:29.789771,2025-08-23 10:31:36.953101,0 days 00:04:07.163330,20,,uniform,7,nz,1.4180755222960865e-07,0.028802341716334456,2130,192,,raw,old,1.7744736366339933,tanh,0.0046025276184082035,COMPLETE,0.0046025276184082035
90,0.09835484176874161,2025-08-23 10:31:36.953370,2025-08-23 10:35:46.045996,0 days 00:04:09.092626,20,,uniform,5,nz,1.2678589256001113e-07,0.8412659501135094,1565,336,0.532994426631861,pca,old,1.7912292811276824,tanh,,COMPLETE,
