number,value,datetime_start,datetime_complete,duration,params_batch_size,params_colnorm_thresh,params_dist1,params_iseed,params_l2_penalty_choice,params_l2_penalty_nz,params_lr,params_lr_anneal_start,params_nhid1,params_pca_energy,params_preproc,params_scale_heur1,params_scale_mult1,params_squash,state
0,0.8273387352625529,2025-08-19 16:21:29.391456,2025-08-19 16:22:27.729533,0 days 00:00:58.338077,100,2.9406142633852467e-07,normal,6,zero,,0.18176667537706265,174,288,,colnorm,old,1.3520195936842876,logistic,COMPLETE
1,0.11388710637887318,2025-08-19 16:22:27.730097,2025-08-19 16:26:10.977078,0 days 00:03:43.246981,20,1.6639856025071866e-05,uniform,8,nz,0.008186209455255396,1.7644047764563767e-05,5099,384,,colnorm,old,1.7745620959097825,logistic,COMPLETE
2,0.817177395025889,2025-08-19 16:26:10.977634,2025-08-19 16:29:53.239999,0 days 00:03:42.262365,20,,uniform,7,nz,3.4661209326928015e-08,0.10209977803265802,316,416,0.9461171991611468,pca,Glorot,,tanh,COMPLETE
3,0.8234032789866129,2025-08-19 16:29:53.244329,2025-08-19 16:30:36.458404,0 days 00:00:43.214075,100,0.0006643553562078559,uniform,6,zero,,0.038411337309611784,196,800,,colnorm,old,0.8724251633437441,tanh,COMPLETE
4,0.6606128613154093,2025-08-19 16:30:36.458900,2025-08-19 16:34:18.747558,0 days 00:03:42.288658,20,,normal,7,nz,7.500079347974363e-06,6.335199784332638e-06,110,992,0.858856416114397,pca,Glorot,,tanh,COMPLETE
5,0.113467738032341,2025-08-19 16:34:18.749307,2025-08-19 16:35:00.781806,0 days 00:00:42.032499,100,2.9593169402091133e-05,normal,7,zero,,1.1877417261405927e-05,3679,320,,colnorm,Glorot,,logistic,COMPLETE
6,0.5908709168434143,2025-08-19 16:35:00.782292,2025-08-19 16:38:42.038324,0 days 00:03:41.256032,20,,normal,8,nz,1.0901244843471063e-06,0.0010037225083948287,265,736,0.6931184968335371,pca,Glorot,,logistic,COMPLETE
7,0.11358064164717992,2025-08-19 16:38:42.040926,2025-08-19 16:41:59.097764,0 days 00:03:17.056838,20,,normal,6,zero,,0.00016531010151238062,112,592,,raw,Glorot,,tanh,COMPLETE
8,0.8426932891209921,2025-08-19 16:41:59.098218,2025-08-19 16:45:18.040799,0 days 00:03:18.942581,20,,uniform,8,zero,,0.2963601619950499,579,976,,raw,Glorot,,tanh,COMPLETE
9,0.825435479482015,2025-08-19 16:45:18.041236,2025-08-19 16:48:33.251496,0 days 00:03:15.210260,20,,normal,7,zero,,0.026155452727442755,1750,592,,raw,old,1.0616748424310383,logistic,COMPLETE
10,0.17804711808760962,2025-08-19 16:48:33.254725,2025-08-19 16:49:12.807697,0 days 00:00:39.552972,100,,uniform,5,zero,,0.7595727975117981,737,48,,raw,Glorot,,tanh,COMPLETE
11,0.8750806252161661,2025-08-19 16:49:12.807915,2025-08-19 16:49:54.619465,0 days 00:00:41.811550,100,5.954671520019689e-09,uniform,8,zero,,0.9887198985029343,775,176,,colnorm,old,0.2165297782614113,logistic,COMPLETE
12,0.113467738032341,2025-08-19 16:49:54.619869,2025-08-19 16:50:34.634462,0 days 00:00:40.014593,100,,uniform,8,zero,,0.0028142043498755646,778,48,,raw,old,0.3889598304674372,logistic,COMPLETE
13,0.866741935412089,2025-08-19 16:50:34.634872,2025-08-19 16:51:15.523336,0 days 00:00:40.888464,100,1.0834554087678474e-09,uniform,8,zero,,0.8807033238344367,1538,928,,colnorm,old,0.2817300172195903,tanh,COMPLETE
14,0.8285806179046631,2025-08-19 16:51:15.523765,2025-08-19 16:51:56.363871,0 days 00:00:40.840106,100,1.025559607868256e-09,uniform,8,zero,,0.008074992784382107,1798,192,,colnorm,old,0.22110150634303222,tanh,COMPLETE
15,0.8872096737225851,2025-08-19 16:51:56.364069,2025-08-19 16:52:37.379517,0 days 00:00:41.015448,100,1.066754414253623e-09,uniform,5,zero,,0.7573098776287306,1661,720,,colnorm,old,0.6040859409819651,logistic,COMPLETE
16,0.11362903316815694,2025-08-19 16:52:37.379937,2025-08-19 16:53:18.274562,0 days 00:00:40.894625,100,3.909816562815391e-08,uniform,5,zero,,0.00012712870750848854,2805,720,,colnorm,old,0.6649182676166856,logistic,COMPLETE
17,0.113467738032341,2025-08-19 16:53:18.274976,2025-08-19 16:53:58.759858,0 days 00:00:40.484882,100,1.9316603529955014e-08,uniform,5,zero,,1.345329650453474e-06,452,496,,colnorm,old,0.6398649980916531,logistic,COMPLETE
18,0.8124677141507467,2025-08-19 16:53:58.760052,2025-08-19 16:54:42.406729,0 days 00:00:43.646677,100,1.9947234249897297e-08,uniform,5,nz,0.006744313249627538,0.017679145491219298,1150,192,,colnorm,old,0.5760522134453063,logistic,COMPLETE
19,0.8241774439811707,2025-08-19 16:54:42.407139,2025-08-19 16:55:23.521665,0 days 00:00:41.114526,100,3.1586741999495138e-09,uniform,5,zero,,0.08379974790132022,5937,848,,colnorm,old,1.494474521247752,logistic,COMPLETE
20,0.8232257962226868,2025-08-19 16:55:23.522106,2025-08-19 16:56:04.579823,0 days 00:00:41.057717,100,,uniform,5,zero,,0.007299475940990329,2791,624,0.5094420850596734,pca,old,0.8429872797153313,logistic,COMPLETE
21,0.8654516140619913,2025-08-19 16:56:04.580103,2025-08-19 16:56:45.237207,0 days 00:00:40.657104,100,1.1267649265650314e-09,uniform,8,zero,,0.9162686802576934,1288,880,,colnorm,old,0.30114324114478813,tanh,COMPLETE
22,0.8793870608011881,2025-08-19 16:56:45.237559,2025-08-19 16:57:26.467193,0 days 00:00:41.229634,100,6.204795277194071e-09,uniform,8,zero,,0.38114358739093507,1772,928,,colnorm,old,0.20024490800482803,logistic,COMPLETE
23,0.8666451176007589,2025-08-19 16:57:26.467628,2025-08-19 16:58:07.233068,0 days 00:00:40.765440,100,1.3449550242810132e-08,uniform,8,zero,,0.22679844035670332,2706,720,,colnorm,old,0.45351640394702797,logistic,COMPLETE
24,0.8841290275255839,2025-08-19 16:58:07.233547,2025-08-19 16:58:47.979756,0 days 00:00:40.746209,100,2.569315893867091e-07,uniform,8,zero,,0.33119776170799203,8748,1024,,colnorm,old,0.5335222997188738,logistic,COMPLETE
25,0.8481289943059286,2025-08-19 16:58:47.979964,2025-08-19 16:59:28.527836,0 days 00:00:40.547872,100,3.5342938800325087e-07,uniform,8,zero,,0.0984122700033705,8173,992,,colnorm,old,0.8355941184930589,logistic,COMPLETE
26,0.883048415184021,2025-08-19 16:59:28.528237,2025-08-19 17:00:11.803970,0 days 00:00:43.275733,100,1.5559640493268108e-07,uniform,5,nz,1.506987795102807e-08,0.32234866553132613,9194,1024,,colnorm,old,0.49957246275041217,logistic,COMPLETE
27,0.8136774301528931,2025-08-19 17:00:11.804428,2025-08-19 17:00:55.088135,0 days 00:00:43.283707,100,2.755053333921776e-06,uniform,5,nz,1.0341685542870698e-08,0.04371618387285111,9839,1024,,colnorm,old,0.5289160271130067,logistic,COMPLETE
28,0.8285645445187887,2025-08-19 17:00:55.088610,2025-08-19 17:01:38.683397,0 days 00:00:43.594787,100,1.9061811597487668e-07,uniform,5,nz,2.6438692358703413e-07,0.00997556398463839,6232,784,,colnorm,old,1.0163638714039414,logistic,COMPLETE
29,0.8940000335375468,2025-08-19 17:01:38.683830,2025-08-19 17:02:23.333647,0 days 00:00:44.649817,100,,normal,6,nz,0.00016364199229385287,0.2189634374870176,4739,880,0.6433925899581999,pca,old,0.7105729620467194,logistic,COMPLETE
30,0.805709719657898,2025-08-19 17:02:23.333922,2025-08-19 17:03:07.666835,0 days 00:00:44.332913,100,,normal,6,nz,0.00024953891668570705,0.002668638731901994,4708,656,0.6347666241761294,pca,old,0.7486301299177782,logistic,COMPLETE
31,0.901016116142273,2025-08-19 17:03:07.667190,2025-08-19 17:03:51.761515,0 days 00:00:44.094325,100,,normal,6,nz,0.00010786008264910033,0.183304068210502,7721,896,0.5486012406900301,pca,old,0.4596129100580672,logistic,COMPLETE
32,0.8668548464775085,2025-08-19 17:03:51.761920,2025-08-19 17:04:36.596742,0 days 00:00:44.834822,100,,normal,6,nz,0.00015599914621756134,0.12585986377347474,4136,864,0.5333183083695336,pca,old,0.6908867556737345,logistic,COMPLETE
33,0.8989677429199219,2025-08-19 17:04:36.597185,2025-08-19 17:05:21.960664,0 days 00:00:45.363479,100,,normal,6,nz,0.00010625451634814159,0.19351986224566123,7396,928,0.6302912126202526,pca,old,0.4438901200917814,logistic,COMPLETE
34,0.8329838911692301,2025-08-19 17:05:21.960876,2025-08-19 17:06:07.364037,0 days 00:00:45.403161,100,,normal,6,nz,0.00013779519003468142,0.05706430191891339,6610,784,0.6278176234897659,pca,old,0.3823173618136153,logistic,COMPLETE
35,0.8883548776308695,2025-08-19 17:06:07.364482,2025-08-19 17:06:52.756965,0 days 00:00:45.392483,100,,normal,6,nz,0.0006586908044001922,0.20528060743982163,5155,864,0.5934357391163496,pca,old,0.9600449368743404,logistic,COMPLETE
36,0.8911935687065125,2025-08-19 17:06:52.757436,2025-08-19 17:10:23.452289,0 days 00:03:30.694853,20,,normal,6,nz,0.0005836725234328207,0.15744640874828159,3676,912,0.5879732703721878,pca,old,1.1955217114705288,logistic,COMPLETE
37,0.8223709662755331,2025-08-19 17:10:23.452742,2025-08-19 17:13:55.647237,0 days 00:03:32.194495,20,,normal,6,nz,3.541359774488414e-05,0.029822574994981033,3616,928,0.7172666888495179,pca,old,1.2270110218802697,logistic,COMPLETE
38,0.6548548142115275,2025-08-19 17:13:55.649757,2025-08-19 17:17:26.364126,0 days 00:03:30.714369,20,,normal,6,nz,0.0011041187051987777,0.00010584252550602167,7266,816,0.5852044047218534,pca,Glorot,,logistic,COMPLETE
39,0.8342741926511129,2025-08-19 17:17:26.365647,2025-08-19 17:20:58.002991,0 days 00:03:31.637344,20,,normal,6,nz,1.7969026489970818e-05,0.060578691816098214,3421,928,0.6562003213527287,pca,Glorot,,logistic,COMPLETE
40,0.827354888121287,2025-08-19 17:20:58.003427,2025-08-19 17:24:29.235242,0 days 00:03:31.231815,20,,normal,6,nz,5.5279753326647045e-05,0.017446928145314317,2289,464,0.7847605177804095,pca,old,1.2475511729074586,logistic,COMPLETE
41,0.8815967639287313,2025-08-19 17:24:29.236219,2025-08-19 17:27:58.615826,0 days 00:03:29.379607,20,,normal,6,nz,0.0007797305129303906,0.10898900512536643,5044,896,0.5701483473660022,pca,old,0.9613233900327308,logistic,COMPLETE
42,0.8948548833529154,2025-08-19 17:27:58.616255,2025-08-19 17:31:27.293257,0 days 00:03:28.677002,20,,normal,6,nz,0.0008270393109229542,0.17582986156558372,4979,832,0.5891638420798638,pca,old,1.1359053027756691,logistic,COMPLETE
43,0.8955000042915344,2025-08-19 17:31:27.294195,2025-08-19 17:34:57.669251,0 days 00:03:30.375056,20,,normal,6,nz,0.0011341246399560318,0.4577318103768708,4253,816,0.5632770375538482,pca,old,1.4917736537309787,logistic,COMPLETE
44,0.8598870635032654,2025-08-19 17:34:57.669718,2025-08-19 17:38:29.327528,0 days 00:03:31.657810,20,,normal,6,nz,0.002359375354181907,0.4663871815940296,7075,816,0.5171816461481588,pca,old,1.5545357555120605,logistic,COMPLETE
45,0.9141290187835693,2025-08-19 17:38:29.328614,2025-08-19 17:42:00.730014,0 days 00:03:31.401400,20,,normal,7,nz,8.749422081620919e-05,0.5074303463045993,5614,672,0.5591491507201787,pca,Glorot,,logistic,COMPLETE
46,0.849709689617157,2025-08-19 17:42:00.730497,2025-08-19 17:45:32.552420,0 days 00:03:31.821923,20,,normal,7,nz,3.3781787146822717e-06,0.4920464494297986,5937,672,0.5552870697082373,pca,Glorot,,tanh,COMPLETE
47,0.7257258693377177,2025-08-19 17:45:32.553329,2025-08-19 17:49:06.282183,0 days 00:03:33.728854,20,,normal,7,nz,5.509202518734219e-05,0.0002505066665873466,8278,560,0.5030424917676507,pca,Glorot,,logistic,COMPLETE
48,0.8277096350987753,2025-08-19 17:49:06.282645,2025-08-19 17:52:35.648304,0 days 00:03:29.365659,20,,normal,7,nz,0.0003074849840338547,0.15443957500972066,148,768,0.5623375105629048,pca,Glorot,,logistic,COMPLETE
49,0.8661773204803467,2025-08-19 17:52:35.649191,2025-08-19 17:56:05.412482,0 days 00:03:29.763291,20,,normal,7,nz,0.0023494231939815207,0.47881416643332203,2275,672,,raw,Glorot,,tanh,COMPLETE
50,0.36059680581092834,2025-08-19 17:56:05.412935,2025-08-19 17:59:38.314061,0 days 00:03:32.901126,20,,normal,6,nz,0.0020226192992873543,2.809316266720387e-05,4273,960,0.6068190876627734,pca,Glorot,,logistic,COMPLETE
51,0.8796128829320272,2025-08-19 17:59:38.315526,2025-08-19 18:03:09.152785,0 days 00:03:30.837259,20,,normal,6,nz,0.00010737050076442793,0.20181297936811302,5291,832,0.6679285524307824,pca,old,1.935485479483583,logistic,COMPLETE
52,0.8820967872937521,2025-08-19 18:03:09.153238,2025-08-19 18:06:40.402474,0 days 00:03:31.249236,20,,normal,6,nz,0.0003697852376521628,0.07015893665355681,7560,768,0.6175564385349425,pca,Glorot,,logistic,COMPLETE
53,0.9078225692113241,2025-08-19 18:06:40.402930,2025-08-19 18:10:12.667672,0 days 00:03:32.264742,20,,normal,6,nz,7.403439590447205e-05,0.5851159740573182,3207,960,0.5521403038714191,pca,old,1.4259501563879213,logistic,COMPLETE
54,0.904532273610433,2025-08-19 18:10:12.670487,2025-08-19 18:13:44.126070,0 days 00:03:31.455583,20,,normal,6,nz,1.879624917161633e-05,0.5767443401320013,3174,976,0.5529360385480513,pca,old,1.444616052099037,logistic,COMPLETE
55,0.9044354756673177,2025-08-19 18:13:44.126535,2025-08-19 18:17:15.133111,0 days 00:03:31.006576,20,,normal,7,nz,1.61220182506397e-05,0.5843444324590439,3048,976,0.5442043883838253,pca,old,1.456368062034169,logistic,COMPLETE
56,0.8772419889767965,2025-08-19 18:17:15.133592,2025-08-19 18:20:48.058938,0 days 00:03:32.925346,20,,normal,7,nz,1.0454680634784509e-05,0.6226706895168558,2413,976,,raw,Glorot,,logistic,COMPLETE
57,0.8178225557009379,2025-08-19 18:20:48.059402,2025-08-19 18:24:20.607327,0 days 00:03:32.547925,20,,normal,7,nz,2.2906262891660868e-05,0.9159307627039015,3069,976,0.5526318845554474,pca,old,1.644199719476532,tanh,COMPLETE
58,0.844870944817861,2025-08-19 18:24:20.607778,2025-08-19 18:27:54.553762,0 days 00:03:33.945984,20,,normal,7,nz,5.044825317400815e-06,0.2956259686238415,382,304,0.5319270039416873,pca,old,1.3614101153814797,logistic,COMPLETE
59,0.8721290429433187,2025-08-19 18:27:54.554214,2025-08-19 18:31:30.059088,0 days 00:03:35.504874,20,,normal,7,nz,2.241213000909339e-06,0.6659320116077262,3189,384,0.9994615742623809,pca,old,1.3679225052340056,logistic,COMPLETE
60,0.8322096864382426,2025-08-19 18:31:30.059568,2025-08-19 18:35:03.032797,0 days 00:03:32.973229,20,,normal,7,nz,6.110875458820849e-05,0.04152135062864795,5919,944,0.5410571446644544,pca,old,1.8272001369944388,logistic,COMPLETE
61,0.9029031991958618,2025-08-19 18:35:03.033239,2025-08-19 18:38:35.762310,0 days 00:03:32.729071,20,,normal,6,nz,1.9982575038961875e-05,0.3842196926206145,4135,992,0.5616160590893833,pca,old,1.488788717600204,logistic,COMPLETE
62,0.8929193615913391,2025-08-19 18:38:35.762779,2025-08-19 18:42:07.357262,0 days 00:03:31.594483,20,,normal,6,nz,1.2115059085254159e-05,0.9781540966520426,1426,1008,0.5305400595428736,pca,old,1.6577541767021866,logistic,COMPLETE
63,0.8901935418446859,2025-08-19 18:42:07.357746,2025-08-19 18:45:39.204406,0 days 00:03:31.846660,20,,normal,6,nz,2.7720956940308653e-05,0.315207959292283,9979,960,0.7953210644563343,pca,old,1.4298934255917806,logistic,COMPLETE
64,0.8370000123977661,2025-08-19 18:45:39.208492,2025-08-19 18:49:11.806974,0 days 00:03:32.598482,20,,normal,6,nz,7.78200708718471e-05,0.09954527491774712,2022,992,0.5605867524023438,pca,old,1.6179483373383854,logistic,COMPLETE
65,0.8906935652097067,2025-08-19 18:49:11.811787,2025-08-19 18:52:43.027109,0 days 00:03:31.215322,20,,normal,7,nz,6.737385808581955e-06,0.619629718418318,4085,896,,raw,old,1.3287133246904308,logistic,COMPLETE
66,0.8902903397878011,2025-08-19 18:52:43.027572,2025-08-19 18:56:13.921105,0 days 00:03:30.893533,20,,normal,6,nz,3.4276265993624914e-05,0.4176987210276732,983,960,0.516227119852014,pca,old,1.7950986858999536,logistic,COMPLETE
67,0.8835161526997884,2025-08-19 18:56:13.925519,2025-08-19 18:59:46.360694,0 days 00:03:32.435175,20,,normal,6,nz,3.5479979123490464e-07,0.23099080008573217,2926,1024,0.5002011883006282,pca,old,1.450317434254337,tanh,COMPLETE
68,0.7723386685053507,2025-08-19 18:59:46.361151,2025-08-19 19:03:17.816338,0 days 00:03:31.455187,20,,normal,7,nz,0.00021958522558300248,0.000927477636328108,2010,912,0.5985511268989995,pca,old,1.6962834276587342,logistic,COMPLETE
69,0.8839839100837708,2025-08-19 19:03:17.816788,2025-08-19 19:04:01.383598,0 days 00:00:43.566810,100,,normal,6,nz,1.5565605496192526e-05,0.1321549906738687,5722,864,0.5407314388314073,pca,Glorot,,logistic,COMPLETE
70,0.8867419560750326,2025-08-19 19:04:01.383883,2025-08-19 19:07:32.146739,0 days 00:03:30.762856,20,,normal,6,nz,9.549928732154056e-05,0.3049084053142724,8051,992,0.8819033976306517,pca,old,1.5741935302262406,logistic,COMPLETE
71,0.9023225903511047,2025-08-19 19:07:32.148824,2025-08-19 19:11:03.876044,0 days 00:03:31.727220,20,,normal,6,nz,3.136702262825037e-05,0.6080289761957816,3845,736,0.5786479008896026,pca,old,1.4803970563590614,logistic,COMPLETE
72,0.9030322829882304,2025-08-19 19:11:03.879335,2025-08-19 19:14:36.434540,0 days 00:03:32.555205,20,,normal,6,nz,3.975409077869769e-05,0.6757851275034827,3791,560,0.5763220318325809,pca,old,1.5279348924041332,logistic,COMPLETE
73,0.8983064889907837,2025-08-19 19:14:36.434999,2025-08-19 19:18:07.085182,0 days 00:03:30.650183,20,,normal,6,nz,3.789549768963252e-05,0.9913479911362736,3932,592,0.5748037767976626,pca,old,1.2984498296095457,logistic,COMPLETE
74,0.8959354758262634,2025-08-19 19:18:07.085634,2025-08-19 19:21:41.641401,0 days 00:03:34.555767,20,,normal,6,nz,1.9047837619969962e-05,0.5448530368478668,2579,544,0.611442900462169,pca,old,1.5212235491651018,logistic,COMPLETE
75,0.9065967798233032,2025-08-19 19:21:41.641845,2025-08-19 19:25:15.659902,0 days 00:03:34.018057,20,,normal,6,nz,4.401587431475141e-05,0.6532621684703291,3380,640,0.5351135739225628,pca,old,1.4263748724738887,logistic,COMPLETE
76,0.9018709659576416,2025-08-19 19:25:15.662873,2025-08-19 19:28:46.862106,0 days 00:03:31.199233,20,,normal,6,nz,8.694418058483812e-06,0.6182158692672922,3383,480,0.5276489280291858,pca,old,1.4197613709354848,logistic,COMPLETE
77,0.8913064201672872,2025-08-19 19:28:46.862553,2025-08-19 19:32:18.566398,0 days 00:03:31.703845,20,,normal,7,nz,4.062224536196236e-05,0.38119654461651026,1965,640,0.5798513221833083,pca,old,1.7031932711997149,logistic,COMPLETE
78,0.8855161666870117,2025-08-19 19:32:18.566850,2025-08-19 19:35:44.652056,0 days 00:03:26.085206,20,,normal,6,nz,1.5359855382148383e-06,0.25606484613996106,4549,704,,raw,old,1.4037203137392806,logistic,COMPLETE
79,0.113467738032341,2025-08-19 19:35:44.652502,2025-08-19 19:39:16.102685,0 days 00:03:31.450183,20,,normal,6,nz,4.994381364664769e-06,1.1661023473863843e-06,2781,608,0.5461345734789375,pca,old,1.4740025281268108,logistic,COMPLETE
