number,value,datetime_start,datetime_complete,duration,params_batch_size,params_colnorm_thresh,params_dist1,params_iseed,params_l2_penalty_choice,params_l2_penalty_nz,params_lr,params_lr_anneal_start,params_nhid1,params_pca_energy,params_preproc,params_scale_heur1,params_scale_mult1,params_squash,state
0,0.15645158290863037,2025-08-19 16:21:29.192825,2025-08-19 16:22:26.144375,0 days 00:00:56.951550,100,,uniform,8,zero,,0.00010624115019039674,791,976,0.5109387416541811,pca,Glorot,,logistic,COMPLETE
1,0.3017904261747996,2025-08-19 16:22:26.144885,2025-08-19 16:26:06.806740,0 days 00:03:40.661855,20,,uniform,6,nz,1.5715594266053464e-06,3.190542595020643e-05,8970,688,0.8902637930636884,pca,Glorot,,tanh,COMPLETE
2,0.3310483694076538,2025-08-19 16:26:06.807241,2025-08-19 16:26:51.977806,0 days 00:00:45.170565,100,0.0004318284821572131,uniform,8,nz,3.9539261067094547e-08,0.002938578559398914,1764,272,,colnorm,Glorot,,logistic,COMPLETE
3,0.27541933457056683,2025-08-19 16:26:51.978095,2025-08-19 16:30:18.910261,0 days 00:03:26.932166,20,,normal,7,zero,,0.7351929422461655,497,912,0.9410932208396139,pca,old,1.2768119707272114,tanh,COMPLETE
4,0.36799997091293335,2025-08-19 16:30:18.912758,2025-08-19 16:33:45.768201,0 days 00:03:26.855443,20,,normal,6,zero,,0.0004965248396994324,6061,896,0.7678690962926887,pca,old,1.5082164851242772,tanh,COMPLETE
5,0.11235483984152476,2025-08-19 16:33:45.769764,2025-08-19 16:37:23.112756,0 days 00:03:37.342992,20,,uniform,5,nz,7.96262750161857e-08,1.5731688462957297e-05,472,864,0.8660516437835124,pca,Glorot,,logistic,COMPLETE
6,0.1126451591650645,2025-08-19 16:37:23.113241,2025-08-19 16:38:07.415824,0 days 00:00:44.302583,100,,uniform,5,nz,2.2903548075193835e-05,0.0007082954891003924,1698,608,,raw,old,1.283731772971168,logistic,COMPLETE
7,0.11237096786499023,2025-08-19 16:38:07.416275,2025-08-19 16:41:30.090903,0 days 00:03:22.674628,20,,normal,7,zero,,1.2854120634415107e-06,1962,304,0.6835434113303137,pca,Glorot,,logistic,COMPLETE
8,0.40751614173253375,2025-08-19 16:41:30.091424,2025-08-19 16:42:14.556905,0 days 00:00:44.465481,100,2.275186829683668e-05,uniform,6,nz,2.5477478674910893e-08,0.7157658760648006,1897,128,,colnorm,Glorot,,tanh,COMPLETE
9,0.3892258008321126,2025-08-19 16:42:14.557338,2025-08-19 16:42:58.587997,0 days 00:00:44.030659,100,,normal,7,nz,4.147015284053079e-05,0.055513640637851046,1461,256,0.9141014996325332,pca,old,1.8771129702661193,logistic,COMPLETE
10,0.4556935330231984,2025-08-19 16:42:58.588202,2025-08-19 16:43:42.710615,0 days 00:00:44.122413,100,4.768579688457349e-07,uniform,6,nz,0.009965952027558869,0.9258086784227568,190,48,,colnorm,Glorot,,tanh,COMPLETE
11,0.3967902461687724,2025-08-19 16:43:42.710991,2025-08-19 16:44:25.620121,0 days 00:00:42.909130,100,3.994979195967868e-07,uniform,6,nz,0.004377690099394908,0.3922772384313133,105,16,,colnorm,Glorot,,tanh,COMPLETE
12,0.34343541661898297,2025-08-19 16:44:25.620486,2025-08-19 16:45:07.996940,0 days 00:00:42.376454,100,1.2142579997639663e-05,uniform,6,nz,0.004219260995435911,0.03880419059099133,108,16,,colnorm,Glorot,,tanh,COMPLETE
13,0.38398388028144836,2025-08-19 16:45:07.997127,2025-08-19 16:45:51.072695,0 days 00:00:43.075568,100,2.6364008402700804e-09,uniform,6,nz,0.00027971825446404335,0.048106394118015004,250,160,,colnorm,Glorot,,tanh,COMPLETE
14,0.3909676472345988,2025-08-19 16:45:51.073064,2025-08-19 16:46:33.874512,0 days 00:00:42.801448,100,1.2963136914087391e-06,uniform,6,nz,6.205557829270688e-07,0.9295156312207182,4015,432,,colnorm,Glorot,,tanh,COMPLETE
15,0.29183868567148846,2025-08-19 16:46:33.874884,2025-08-19 16:47:15.347279,0 days 00:00:41.472395,100,,uniform,6,nz,1.0640339216044464e-08,0.008469186769222696,252,128,,raw,Glorot,,tanh,COMPLETE
16,0.4896291196346283,2025-08-19 16:47:15.347666,2025-08-19 16:47:57.854483,0 days 00:00:42.506817,100,2.9343521973036635e-05,uniform,6,nz,0.000286087789130519,0.14356296270835828,3263,448,,colnorm,Glorot,,tanh,COMPLETE
17,0.4874354998270671,2025-08-19 16:47:57.854681,2025-08-19 16:48:40.801682,0 days 00:00:42.947001,100,7.31663782913069e-08,uniform,8,nz,0.0005777856204231036,0.06729410343662064,3562,432,,colnorm,Glorot,,tanh,COMPLETE
18,0.3894031345844269,2025-08-19 16:48:40.802044,2025-08-19 16:49:22.249948,0 days 00:00:41.447904,100,1.35152585464881e-08,normal,8,zero,,0.01352021145771815,3329,448,,colnorm,old,0.20511411604631036,tanh,COMPLETE
19,0.4310159186522166,2025-08-19 16:49:22.250145,2025-08-19 16:50:05.481147,0 days 00:00:43.231002,100,,uniform,8,nz,0.0003924004665629251,0.14019557272561445,3354,688,,raw,Glorot,,tanh,COMPLETE
20,0.38503217697143555,2025-08-19 16:50:05.481516,2025-08-19 16:50:48.023154,0 days 00:00:42.541638,100,6.644398953168405e-08,uniform,8,nz,0.00043961454698101686,0.0038824353420652763,8896,544,,colnorm,Glorot,,tanh,COMPLETE
21,0.4651774962743123,2025-08-19 16:50:48.023542,2025-08-19 16:51:31.360934,0 days 00:00:43.337392,100,4.41218608076854e-07,uniform,5,nz,0.009901516933355342,0.19470091043522703,972,384,,colnorm,Glorot,,tanh,COMPLETE
22,0.5096128582954407,2025-08-19 16:51:31.361127,2025-08-19 16:52:14.292956,0 days 00:00:42.931829,100,7.491294894612581e-06,uniform,5,nz,0.0008382218206876498,0.15612635911752903,950,384,,colnorm,Glorot,,tanh,COMPLETE
23,0.48546767234802246,2025-08-19 16:52:14.293316,2025-08-19 16:52:56.557698,0 days 00:00:42.264382,100,2.5433937839626195e-05,uniform,5,nz,8.827130308793979e-05,0.13092104593605772,5238,528,,colnorm,Glorot,,tanh,COMPLETE
24,0.403677374124527,2025-08-19 16:52:56.558072,2025-08-19 16:53:39.270803,0 days 00:00:42.712731,100,0.00014947337950489,uniform,5,nz,0.0012104927904103937,0.01717417277639472,2477,384,,colnorm,Glorot,,tanh,COMPLETE
25,0.5237581133842468,2025-08-19 16:53:39.270989,2025-08-19 16:54:22.397297,0 days 00:00:43.126308,100,3.2990648778754965e-06,uniform,5,nz,0.0012099753498429591,0.16446947112444135,683,624,,colnorm,Glorot,,tanh,COMPLETE
26,0.3799999952316284,2025-08-19 16:54:22.397670,2025-08-19 16:55:02.573201,0 days 00:00:40.175531,100,,normal,5,zero,,0.24250842960842858,678,752,,raw,old,0.4663319800234592,tanh,COMPLETE
27,0.37409674127896625,2025-08-19 16:55:02.573736,2025-08-19 16:58:45.562708,0 days 00:03:42.988972,20,5.039228999369125e-06,uniform,5,nz,7.81265744567651e-06,0.0026675452557790996,1131,608,,colnorm,Glorot,,tanh,COMPLETE
28,0.38135481874148053,2025-08-19 16:58:45.563092,2025-08-19 16:59:28.486241,0 days 00:00:42.923149,100,6.645224408548978e-05,uniform,5,nz,0.0001238778518308973,0.020240205371093847,457,768,,colnorm,Glorot,,tanh,COMPLETE
29,0.15280640125274658,2025-08-19 16:59:28.486619,2025-08-19 17:00:09.126334,0 days 00:00:40.639715,100,4.284809999555717e-06,uniform,5,zero,,0.00028948716421210453,719,320,,colnorm,Glorot,,logistic,COMPLETE
30,0.37730645140012103,2025-08-19 17:00:09.126530,2025-08-19 17:00:50.804947,0 days 00:00:41.678417,100,,uniform,5,nz,0.0018539460531473773,0.09393410669443406,971,560,,raw,Glorot,,tanh,COMPLETE
31,0.4912741978963216,2025-08-19 17:00:50.805301,2025-08-19 17:01:34.527429,0 days 00:00:43.722128,100,8.482882554340734e-08,uniform,8,nz,0.0011386264445132051,0.26558671517071225,2626,464,,colnorm,Glorot,,tanh,COMPLETE
32,0.5013386706511179,2025-08-19 17:01:34.527704,2025-08-19 17:02:17.026212,0 days 00:00:42.498508,100,4.037282949596397e-06,uniform,8,nz,0.0016536620309585896,0.3271713286993642,1279,480,,colnorm,Glorot,,tanh,COMPLETE
33,0.48261276880900067,2025-08-19 17:02:17.026517,2025-08-19 17:02:59.962604,0 days 00:00:42.936087,100,1.2396772424646338e-06,uniform,8,nz,0.0015461710109824815,0.4501658225549805,1291,608,,colnorm,Glorot,,tanh,COMPLETE
34,0.4364676574865977,2025-08-19 17:02:59.962992,2025-08-19 17:06:31.610358,0 days 00:03:31.647366,20,2.971422921903222e-06,uniform,8,nz,0.001227127826247328,0.3301331178923355,591,224,,colnorm,Glorot,,tanh,COMPLETE
35,0.46291937430699664,2025-08-19 17:06:31.610775,2025-08-19 17:07:13.972727,0 days 00:00:42.361952,100,7.512201663334466e-08,uniform,8,nz,0.00012668287414143207,0.034061609772420426,2502,496,,colnorm,Glorot,,tanh,COMPLETE
36,0.11235483984152476,2025-08-19 17:07:13.972924,2025-08-19 17:10:27.940560,0 days 00:03:13.967636,20,4.6239401448426595e-06,normal,8,zero,,8.782534925405944e-05,347,352,,colnorm,old,0.7254769041672187,logistic,COMPLETE
37,0.21462901930014291,2025-08-19 17:10:27.944198,2025-08-19 17:11:10.835479,0 days 00:00:42.891281,100,,uniform,7,nz,0.003417955096805022,0.007624185688976917,993,992,0.5023338775049709,pca,Glorot,,tanh,COMPLETE
38,0.5052903493245443,2025-08-19 17:11:10.835767,2025-08-19 17:11:54.037437,0 days 00:00:43.201670,100,2.4781224417440454e-07,uniform,8,nz,2.8325829762615386e-06,0.2885405134321084,781,704,,colnorm,Glorot,,tanh,COMPLETE
39,0.3187580903371175,2025-08-19 17:11:54.037742,2025-08-19 17:15:06.981952,0 days 00:03:12.944210,20,,normal,5,zero,,0.001472532139131082,373,816,0.6521720359850953,pca,old,1.9433344820858869,logistic,COMPLETE
40,0.4913708468278249,2025-08-19 17:15:06.982702,2025-08-19 17:15:49.771167,0 days 00:00:42.788465,100,9.675159455998767e-06,uniform,8,nz,2.3199959555165686e-06,0.4371789742589422,834,688,,colnorm,Glorot,,tanh,COMPLETE
41,0.48364516099294025,2025-08-19 17:15:49.771533,2025-08-19 17:16:34.926775,0 days 00:00:45.155242,100,9.864954956943757e-06,uniform,8,nz,2.2418957149437086e-06,0.5457556789590926,587,672,,colnorm,Glorot,,tanh,COMPLETE
42,0.22556450963020325,2025-08-19 17:16:34.927150,2025-08-19 17:17:18.287530,0 days 00:00:43.360380,100,1.9349064570984578e-06,uniform,8,nz,2.7912041889512498e-06,3.5582879249847543e-06,873,672,,colnorm,Glorot,,tanh,COMPLETE
43,0.4904838601748149,2025-08-19 17:17:18.287905,2025-08-19 17:18:01.847191,0 days 00:00:43.559286,100,2.629767293719944e-07,uniform,8,nz,2.698294205937147e-07,0.08744484455851324,1298,736,,colnorm,Glorot,,tanh,COMPLETE
44,0.5029677450656891,2025-08-19 17:18:01.847393,2025-08-19 17:18:44.670892,0 days 00:00:42.823499,100,9.701293619691051e-06,uniform,7,nz,6.365214302664224e-06,0.4882141400895921,799,864,,colnorm,Glorot,,tanh,COMPLETE
45,0.544225811958313,2025-08-19 17:18:44.671259,2025-08-19 17:19:27.257993,0 days 00:00:42.586734,100,0.0008827029197258249,uniform,7,nz,1.8166724168815387e-05,0.9385935639772983,1434,928,,colnorm,Glorot,,logistic,COMPLETE
46,0.5690645575523376,2025-08-19 17:19:27.258199,2025-08-19 17:20:10.320355,0 days 00:00:43.062156,100,,uniform,7,nz,1.8240384636674543e-05,0.803159088493846,1644,880,0.7702962568662336,pca,Glorot,,logistic,COMPLETE
47,0.43170981605847675,2025-08-19 17:20:10.320729,2025-08-19 17:23:35.794628,0 days 00:03:25.473899,20,,normal,7,nz,1.6579312051507543e-05,0.8996611863600724,1513,1024,0.7872656986736838,pca,old,0.8469916773497731,logistic,COMPLETE
48,0.32774197061856586,2025-08-19 17:23:35.795025,2025-08-19 17:24:21.174592,0 days 00:00:45.379567,100,,uniform,7,nz,6.0791688902036106e-05,0.03375853678961675,2076,944,0.6207517662212081,pca,Glorot,,logistic,COMPLETE
49,0.5175161560376486,2025-08-19 17:24:21.174789,2025-08-19 17:25:11.886114,0 days 00:00:50.711325,100,,uniform,7,nz,7.164818471670742e-07,0.15606846106119301,1670,864,0.8215148476305312,pca,Glorot,,logistic,COMPLETE
50,0.4317257801691691,2025-08-19 17:25:11.886495,2025-08-19 17:25:52.028786,0 days 00:00:40.142291,100,,uniform,7,zero,,0.10483887849769746,1680,896,0.8222621734475821,pca,Glorot,,logistic,COMPLETE
51,0.5440645813941956,2025-08-19 17:25:52.029035,2025-08-19 17:26:35.816994,0 days 00:00:43.787959,100,,uniform,7,nz,3.6037129714115945e-07,0.9704975196214597,2032,816,0.9976012786820125,pca,Glorot,,logistic,COMPLETE
52,0.5456612507502238,2025-08-19 17:26:35.817376,2025-08-19 17:27:19.019547,0 days 00:00:43.202171,100,,uniform,7,nz,1.5885139458380607e-07,0.9870522692489788,2137,832,0.9812680683064343,pca,Glorot,,logistic,COMPLETE
53,0.5495644609133402,2025-08-19 17:27:19.019845,2025-08-19 17:28:04.009610,0 days 00:00:44.989765,100,,uniform,7,nz,1.1608391606775179e-07,0.9659176169767003,2111,832,0.9582006801460274,pca,Glorot,,logistic,COMPLETE
54,0.5443548361460367,2025-08-19 17:28:04.009993,2025-08-19 17:28:47.812427,0 days 00:00:43.802434,100,,uniform,7,nz,8.560466935476116e-08,0.9922281708405626,2027,816,0.9874848824633845,pca,Glorot,,logistic,COMPLETE
55,0.546129047870636,2025-08-19 17:28:47.812810,2025-08-19 17:29:31.553726,0 days 00:00:43.740916,100,,uniform,7,nz,8.473615193725905e-08,0.9423480724173747,2115,800,0.9997032211211154,pca,Glorot,,logistic,COMPLETE
56,0.5542581478754679,2025-08-19 17:29:31.553916,2025-08-19 17:30:15.717405,0 days 00:00:44.163489,100,,uniform,7,nz,7.662929900542382e-08,0.6015578811578156,2184,816,0.9928342878057844,pca,Glorot,,logistic,COMPLETE
57,0.5485967795054117,2025-08-19 17:30:15.717795,2025-08-19 17:30:59.280475,0 days 00:00:43.562680,100,,uniform,7,nz,7.969388321255376e-08,0.5919838112664967,4364,816,0.9966499788812304,pca,Glorot,,logistic,COMPLETE
58,0.5543064475059509,2025-08-19 17:30:59.280760,2025-08-19 17:31:43.097145,0 days 00:00:43.816385,100,,uniform,7,nz,9.673409770882584e-08,0.5596156101386361,4708,784,0.9623890754065235,pca,old,1.629809796669567,logistic,COMPLETE
59,0.5729677478472391,2025-08-19 17:31:43.097448,2025-08-19 17:32:26.391398,0 days 00:00:43.293950,100,,normal,7,nz,3.315635684796844e-08,0.5442169156942996,5168,784,0.9436202922719886,pca,old,1.6152035194129,logistic,COMPLETE
60,0.5691774288813273,2025-08-19 17:32:26.391782,2025-08-19 17:35:56.835562,0 days 00:03:30.443780,20,,normal,7,nz,2.791205883021182e-08,0.5792751694171756,5049,944,0.943222235372914,pca,old,1.622410233388167,logistic,COMPLETE
61,0.5650484164555868,2025-08-19 17:35:56.836318,2025-08-19 17:39:25.637998,0 days 00:03:28.801680,20,,normal,7,nz,2.2748188483351632e-08,0.5811367022555067,5043,960,0.9408258962419713,pca,old,1.6211050548148846,logistic,COMPLETE
62,0.5788548191388448,2025-08-19 17:39:25.638401,2025-08-19 17:42:57.140682,0 days 00:03:31.502281,20,,normal,7,nz,2.65270383555961e-08,0.2300757071781395,7601,960,0.9370115068384978,pca,old,1.626660512172434,logistic,COMPLETE
63,0.5030160943667094,2025-08-19 17:42:57.141069,2025-08-19 17:46:27.050761,0 days 00:03:29.909692,20,,normal,7,nz,3.0550026920587416e-08,0.0595755007573583,7737,992,0.9337305702724973,pca,old,1.6377499200846362,logistic,COMPLETE
64,0.5792258183161417,2025-08-19 17:46:27.052697,2025-08-19 17:49:53.490764,0 days 00:03:26.438067,20,,normal,7,nz,1.3267240334569295e-08,0.21879713013216665,6214,960,0.9141858438729968,pca,old,1.6062201200040649,logistic,COMPLETE
65,0.5834677219390869,2025-08-19 17:49:53.491167,2025-08-19 17:53:23.524828,0 days 00:03:30.033661,20,,normal,7,nz,1.180716706672419e-08,0.2519896222969857,6386,944,0.9037051742617926,pca,old,1.5925347846387303,logistic,COMPLETE
66,0.5790484348932902,2025-08-19 17:53:23.525221,2025-08-19 17:56:58.135774,0 days 00:03:34.610553,20,,normal,7,nz,1.7032585214825152e-08,0.22269678885579167,6353,960,0.8909456855566742,pca,old,1.5921127821912229,logistic,COMPLETE
67,0.5883225798606873,2025-08-19 17:56:58.143754,2025-08-19 18:00:25.068108,0 days 00:03:26.924354,20,,normal,7,nz,1.0905526523944639e-08,0.24047956684023308,6312,1024,0.8763873368551977,pca,old,1.4746181839165349,logistic,COMPLETE
68,0.5828709999720255,2025-08-19 18:00:25.068500,2025-08-19 18:03:42.045910,0 days 00:03:16.977410,20,,normal,7,zero,,0.21068175025687744,6631,1024,0.8782431597506574,pca,old,1.491172160836527,logistic,COMPLETE
69,0.5825806061426798,2025-08-19 18:03:42.046305,2025-08-19 18:06:57.945544,0 days 00:03:15.899239,20,,normal,7,zero,,0.19305777883245823,6412,1024,0.8739329161465244,pca,old,1.4268062212121508,logistic,COMPLETE
70,0.5193225542704264,2025-08-19 18:06:57.951542,2025-08-19 18:10:23.176790,0 days 00:03:25.225248,20,,normal,7,zero,,0.07011029472380843,6307,1024,0.8710486305770128,pca,old,1.3887933406555013,logistic,COMPLETE
71,0.5836451848347982,2025-08-19 18:10:23.178728,2025-08-19 18:13:38.588449,0 days 00:03:15.409721,20,,normal,7,zero,,0.2023218405716713,9778,976,0.8966976161480485,pca,old,1.4799057608149908,logistic,COMPLETE
72,0.5846290787061056,2025-08-19 18:13:38.588843,2025-08-19 18:16:53.351045,0 days 00:03:14.762202,20,,normal,7,zero,,0.22765918426688228,9726,992,0.8952297067077208,pca,old,1.444360675501632,logistic,COMPLETE
73,0.4687741895516713,2025-08-19 18:16:53.351427,2025-08-19 18:20:07.153018,0 days 00:03:13.801591,20,,normal,7,zero,,0.023768624738111744,9683,992,0.8645735736331678,pca,old,1.4111667747649477,logistic,COMPLETE
74,0.5347258249918619,2025-08-19 18:20:07.155005,2025-08-19 18:23:23.510479,0 days 00:03:16.355474,20,,normal,7,zero,,0.10821419708987423,6536,912,0.8982942232137217,pca,old,1.4482649503288945,logistic,COMPLETE
75,0.5292420188585917,2025-08-19 18:23:23.510871,2025-08-19 18:26:37.814915,0 days 00:03:14.304044,20,,normal,7,zero,,0.18982833767433588,7609,1008,,raw,old,1.7954464242911494,logistic,COMPLETE
76,0.5187902847925822,2025-08-19 18:26:37.815298,2025-08-19 18:29:51.863922,0 days 00:03:14.048624,20,,normal,6,zero,,0.05248906291286406,8443,976,0.8405801525894644,pca,old,1.275850354846848,logistic,COMPLETE
77,0.5850967963536581,2025-08-19 18:29:51.865966,2025-08-19 18:33:06.859774,0 days 00:03:14.993808,20,,normal,7,zero,,0.28721754583611275,5873,912,0.8990064599015234,pca,old,1.4828142590186484,logistic,COMPLETE
78,0.5846774180730184,2025-08-19 18:33:06.863868,2025-08-19 18:36:21.995185,0 days 00:03:15.131317,20,,normal,7,zero,,0.31839596224850325,3877,912,0.9081453629018484,pca,old,1.4407368499699835,logistic,COMPLETE
79,0.580403208732605,2025-08-19 18:36:21.995559,2025-08-19 18:39:42.400612,0 days 00:03:20.405053,20,,normal,7,zero,,0.3248497156846046,9910,912,0.8651884100395398,pca,old,1.3989241655470095,logistic,COMPLETE
