number,value,datetime_start,datetime_complete,duration,params_batch_size,params_colnorm_thresh,params_dist1,params_iseed,params_l2_penalty_choice,params_l2_penalty_nz,params_lr,params_lr_anneal_start,params_nhid1,params_pca_energy,params_preproc,params_scale_heur1,params_scale_mult1,params_squash,state
0,0.9364193479220072,2025-08-19 16:21:29.284100,2025-08-19 16:25:15.261371,0 days 00:03:45.977271,20,,uniform,7,zero,,0.02832015499559863,635,928,0.9254981014199591,pca,Glorot,,tanh,COMPLETE
1,0.6870483557383219,2025-08-19 16:25:15.261928,2025-08-19 16:29:01.825882,0 days 00:03:46.563954,20,3.384798363774911e-07,normal,7,nz,0.0017161617331398983,0.0008451692067230293,274,704,,colnorm,old,0.20701366339848234,tanh,COMPLETE
2,0.9401129285494486,2025-08-19 16:29:01.826430,2025-08-19 16:32:34.986463,0 days 00:03:33.160033,20,2.147542830565444e-09,normal,5,zero,,0.00574495138528705,7551,896,,colnorm,Glorot,,tanh,COMPLETE
3,0.1639197071393331,2025-08-19 16:32:34.986980,2025-08-19 16:36:09.347012,0 days 00:03:34.360032,20,,uniform,6,zero,,1.89988351237406e-05,378,688,0.9945058624174061,pca,old,1.865358277466792,logistic,COMPLETE
4,0.9224031964937845,2025-08-19 16:36:09.347543,2025-08-19 16:39:57.221738,0 days 00:03:47.874195,20,0.00036901478744868284,normal,8,nz,1.5729299906094828e-08,0.0028997691031122,4034,912,,colnorm,old,0.9714429748553166,tanh,COMPLETE
5,0.7344678441683451,2025-08-19 16:39:57.222254,2025-08-19 16:40:43.480933,0 days 00:00:46.258679,100,1.2027795676198203e-08,normal,6,nz,2.3281451616132915e-07,1.618873832133687e-05,533,960,,colnorm,old,1.0986451139692879,tanh,COMPLETE
6,0.7304999828338623,2025-08-19 16:40:43.481141,2025-08-19 16:44:10.285112,0 days 00:03:26.803971,20,,normal,7,zero,,8.910386066509292e-05,3583,160,,raw,Glorot,,tanh,COMPLETE
7,0.9331773718198141,2025-08-19 16:44:10.285622,2025-08-19 16:47:38.394694,0 days 00:03:28.109072,20,,uniform,7,zero,,0.06949025895569286,4020,16,0.9211118676220769,pca,old,1.9765110686056533,logistic,COMPLETE
8,0.9325483640034994,2025-08-19 16:47:38.395205,2025-08-19 16:48:22.108027,0 days 00:00:43.712822,100,,uniform,8,zero,,0.06015237215748322,281,752,0.8350079495101004,pca,Glorot,,tanh,COMPLETE
9,0.7821935812632242,2025-08-19 16:48:22.108516,2025-08-19 16:51:49.947507,0 days 00:03:27.838991,20,,normal,5,zero,,0.0021212789174433035,1284,848,,raw,old,0.949124582697388,logistic,COMPLETE
10,0.9052742918332418,2025-08-19 16:51:49.947966,2025-08-19 16:52:35.882878,0 days 00:00:45.934912,100,1.2213165764339904e-09,normal,5,nz,0.006176761530367452,0.6592532033662343,8412,400,,colnorm,Glorot,,logistic,COMPLETE
11,0.8993064363797506,2025-08-19 16:52:35.883371,2025-08-19 16:56:00.123798,0 days 00:03:24.240427,20,,uniform,5,zero,,0.023644967883386134,104,1024,0.5428069138760795,pca,Glorot,,tanh,COMPLETE
12,0.9499032298723856,2025-08-19 16:56:00.124235,2025-08-19 16:59:23.720585,0 days 00:03:23.596350,20,,uniform,5,zero,,0.6306223571000258,1167,512,0.69347653500262,pca,Glorot,,tanh,COMPLETE
13,0.9475806752840678,2025-08-19 16:59:23.723958,2025-08-19 17:02:46.038263,0 days 00:03:22.314305,20,5.250450846596609e-06,uniform,5,zero,,0.6867740695838094,1651,512,,colnorm,Glorot,,tanh,COMPLETE
14,0.9505806763966879,2025-08-19 17:02:46.038723,2025-08-19 17:06:07.117432,0 days 00:03:21.078709,20,,uniform,5,zero,,0.9162432103392901,1422,480,,raw,Glorot,,tanh,COMPLETE
15,0.9722581108411154,2025-08-19 17:06:07.117876,2025-08-19 17:06:47.898584,0 days 00:00:40.780708,100,,uniform,5,zero,,0.9357633026014627,2011,352,,raw,Glorot,,tanh,COMPLETE
16,0.9708225925763448,2025-08-19 17:06:47.898778,2025-08-19 17:07:28.709051,0 days 00:00:40.810273,100,,uniform,5,zero,,0.15559846517191922,2117,304,,raw,Glorot,,tanh,COMPLETE
17,0.9649677276611328,2025-08-19 17:07:28.709465,2025-08-19 17:08:09.813442,0 days 00:00:41.103977,100,,uniform,5,zero,,0.0969565559398676,2381,288,,raw,Glorot,,tanh,COMPLETE
18,0.336419016122818,2025-08-19 17:08:09.813707,2025-08-19 17:08:54.236529,0 days 00:00:44.422822,100,,uniform,8,nz,2.5980136482493708e-05,0.0002786896811415464,2381,288,,raw,Glorot,,logistic,COMPLETE
19,0.9580645163853964,2025-08-19 17:08:54.236873,2025-08-19 17:09:35.189629,0 days 00:00:40.952756,100,,uniform,6,zero,,0.18190494121577205,647,336,,raw,Glorot,,tanh,COMPLETE
20,0.6454026301701864,2025-08-19 17:09:35.190042,2025-08-19 17:10:16.328245,0 days 00:00:41.138203,100,,uniform,5,zero,,1.1714203743113883e-06,2504,144,,raw,Glorot,,tanh,COMPLETE
21,0.9734999934832255,2025-08-19 17:10:16.328518,2025-08-19 17:10:56.663191,0 days 00:00:40.334673,100,,uniform,5,zero,,0.2088004545548046,2305,256,,raw,Glorot,,tanh,COMPLETE
22,0.9763548374176025,2025-08-19 17:10:56.663564,2025-08-19 17:11:37.964629,0 days 00:00:41.301065,100,,uniform,5,zero,,0.2538854101581299,5268,208,,raw,Glorot,,tanh,COMPLETE
23,0.9290806651115417,2025-08-19 17:11:37.965041,2025-08-19 17:12:18.658389,0 days 00:00:40.693348,100,,uniform,5,zero,,0.011339805674266274,6534,192,,raw,Glorot,,tanh,COMPLETE
24,0.9753064513206482,2025-08-19 17:12:18.658640,2025-08-19 17:12:59.128618,0 days 00:00:40.469978,100,,uniform,5,zero,,0.16453266518366955,5637,400,,raw,Glorot,,tanh,COMPLETE
25,0.9399999976158142,2025-08-19 17:12:59.128953,2025-08-19 17:13:40.198399,0 days 00:00:41.069446,100,,uniform,5,zero,,0.0184485121468527,5024,64,,raw,Glorot,,tanh,COMPLETE
26,0.9772580663363138,2025-08-19 17:13:40.198819,2025-08-19 17:14:21.445893,0 days 00:00:41.247074,100,,uniform,5,zero,,0.3218665994498396,9334,608,,raw,Glorot,,tanh,COMPLETE
27,0.964258054892222,2025-08-19 17:14:21.446354,2025-08-19 17:15:05.307649,0 days 00:00:43.861295,100,,uniform,6,nz,1.8249088256205893e-05,0.24964763624974434,5721,592,,raw,Glorot,,logistic,COMPLETE
28,0.9671290318171183,2025-08-19 17:15:05.307837,2025-08-19 17:15:45.906429,0 days 00:00:40.598592,100,,uniform,8,zero,,0.05187398875056825,9268,416,,raw,Glorot,,tanh,COMPLETE
29,0.9371128877003988,2025-08-19 17:15:45.906837,2025-08-19 17:16:26.887807,0 days 00:00:40.980970,100,,uniform,7,zero,,0.030335719439550202,3275,640,,raw,Glorot,,tanh,COMPLETE
30,0.9212903181711832,2025-08-19 17:16:26.888063,2025-08-19 17:17:07.674135,0 days 00:00:40.786072,100,,uniform,5,zero,,0.008402868837225012,9527,576,,raw,Glorot,,tanh,COMPLETE
31,0.9760483900705973,2025-08-19 17:17:07.674482,2025-08-19 17:17:48.271242,0 days 00:00:40.596760,100,,uniform,5,zero,,0.277517173988658,5697,192,,raw,Glorot,,tanh,COMPLETE
32,0.9770806431770325,2025-08-19 17:17:48.271653,2025-08-19 17:18:29.034497,0 days 00:00:40.762844,100,,uniform,5,zero,,0.32150177466963686,5898,208,,raw,Glorot,,tanh,COMPLETE
33,0.9738387068112692,2025-08-19 17:18:29.034754,2025-08-19 17:19:09.812682,0 days 00:00:40.777928,100,,uniform,5,zero,,0.30213811862343554,7047,96,,raw,Glorot,,tanh,COMPLETE
34,0.9763548572858175,2025-08-19 17:19:09.813016,2025-08-19 17:19:50.813710,0 days 00:00:41.000694,100,,uniform,5,zero,,0.3875452300832186,4623,224,,raw,old,0.25934085176593147,tanh,COMPLETE
35,0.9517096678415934,2025-08-19 17:19:50.814120,2025-08-19 17:20:34.414446,0 days 00:00:43.600326,100,,uniform,7,nz,4.286349562285866e-07,0.03803710142811,4761,224,,raw,old,0.2748071567873625,tanh,COMPLETE
36,0.9222419460614523,2025-08-19 17:20:34.414632,2025-08-19 17:21:15.581341,0 days 00:00:41.166709,100,0.0007091957096950565,normal,5,zero,,0.004589508478542176,3178,96,,colnorm,old,0.6184749203632751,tanh,COMPLETE
37,0.5135161677996317,2025-08-19 17:21:15.581711,2025-08-19 17:21:56.497071,0 days 00:00:40.915360,100,,uniform,6,zero,,0.0007721306081705936,873,768,,raw,old,1.4530722850509639,logistic,COMPLETE
38,0.9720645348230997,2025-08-19 17:21:56.497503,2025-08-19 17:22:40.255783,0 days 00:00:43.758280,100,,normal,5,nz,0.0003511348569813917,0.10325164678054623,9990,448,,raw,old,0.6504328944725657,tanh,COMPLETE
39,0.9223224918047587,2025-08-19 17:22:40.256052,2025-08-19 17:23:21.893314,0 days 00:00:41.637262,100,,uniform,8,zero,,0.35848215557566093,4399,16,0.5159443364363516,pca,old,1.412155075634418,tanh,COMPLETE
40,0.6954514781634012,2025-08-19 17:23:21.893668,2025-08-19 17:24:03.171557,0 days 00:00:41.277889,100,9.086842850821672e-06,normal,7,zero,,2.479514105865869e-05,6699,144,,colnorm,old,0.5880750554312915,tanh,COMPLETE
41,0.9778225819269816,2025-08-19 17:24:03.172015,2025-08-19 17:24:43.836617,0 days 00:00:40.664602,100,,uniform,5,zero,,0.47257747879284967,7176,208,,raw,old,1.430688101650552,tanh,COMPLETE
42,0.9766290386517843,2025-08-19 17:24:43.836902,2025-08-19 17:25:24.864071,0 days 00:00:41.027169,100,,uniform,5,zero,,0.44745297520603466,7677,224,,raw,old,1.4608128883391567,tanh,COMPLETE
43,0.9776935378710429,2025-08-19 17:25:24.864419,2025-08-19 17:26:05.492746,0 days 00:00:40.628327,100,,uniform,5,zero,,0.4660043941851151,7611,352,,raw,old,1.516842526198297,tanh,COMPLETE
44,0.9718225797017416,2025-08-19 17:26:05.493164,2025-08-19 17:26:46.031689,0 days 00:00:40.538525,100,,uniform,5,zero,,0.08639157100348716,7520,368,,raw,old,1.549131288933295,tanh,COMPLETE
45,0.9738387068112692,2025-08-19 17:26:46.031874,2025-08-19 17:27:28.096890,0 days 00:00:42.065016,100,,uniform,5,zero,,0.502061564056865,7613,560,0.6950406802967458,pca,old,1.6771241147685916,logistic,COMPLETE
46,0.9671774307886759,2025-08-19 17:27:28.097335,2025-08-19 17:28:11.818115,0 days 00:00:43.720780,100,,uniform,5,nz,9.955429547668198e-07,0.10517860363241016,3639,672,,raw,old,1.2512947423087408,tanh,COMPLETE
47,0.9486936132113138,2025-08-19 17:28:11.818534,2025-08-19 17:31:34.863145,0 days 00:03:23.044611,20,9.16888142807639e-08,normal,6,zero,,0.8886754649870976,125,256,,colnorm,old,1.7097203900891698,tanh,COMPLETE
48,0.976903239885966,2025-08-19 17:31:34.864034,2025-08-19 17:32:15.797072,0 days 00:00:40.933038,100,,uniform,5,zero,,0.5009099460470938,8048,784,,raw,old,1.301246185646127,tanh,COMPLETE
49,0.9544032017389933,2025-08-19 17:32:15.797518,2025-08-19 17:32:57.238517,0 days 00:00:41.440999,100,,uniform,8,zero,,0.05255165547239453,9903,752,0.6376171584448477,pca,old,1.2706167024345962,logistic,COMPLETE
50,0.9526774287223816,2025-08-19 17:32:57.238949,2025-08-19 17:36:18.393968,0 days 00:03:21.155019,20,,uniform,5,zero,,0.9993062702413547,3074,864,,raw,old,1.2747262833387463,tanh,COMPLETE
51,0.9767096638679504,2025-08-19 17:36:18.394417,2025-08-19 17:36:59.195780,0 days 00:00:40.801363,100,,uniform,5,zero,,0.4716056711616707,8070,816,,raw,old,1.5798291210325996,tanh,COMPLETE
52,0.9766612847646078,2025-08-19 17:36:59.196201,2025-08-19 17:37:40.223145,0 days 00:00:41.026944,100,,uniform,5,zero,,0.5221544365867357,6204,816,,raw,old,1.6605499416849567,tanh,COMPLETE
53,0.9745161533355713,2025-08-19 17:37:40.223341,2025-08-19 17:38:21.440417,0 days 00:00:41.217076,100,,uniform,5,zero,,0.14301557516471675,8087,960,,raw,old,1.5870146413089703,tanh,COMPLETE
54,0.9773870905240377,2025-08-19 17:38:21.440838,2025-08-19 17:39:01.513039,0 days 00:00:40.072201,100,,uniform,5,zero,,0.5408004419024558,8454,800,,raw,old,1.3288587926056885,tanh,COMPLETE
55,0.9716290632883707,2025-08-19 17:39:01.513466,2025-08-19 17:39:42.388712,0 days 00:00:40.875246,100,,uniform,5,zero,,0.1406258043084987,4071,720,,raw,old,1.1333890466514056,tanh,COMPLETE
56,0.9166128834088644,2025-08-19 17:39:42.388898,2025-08-19 17:40:22.896227,0 days 00:00:40.507329,100,,uniform,5,zero,,0.07001402911173943,376,1024,,raw,old,1.3438701026943922,tanh,COMPLETE
57,0.9706935485204061,2025-08-19 17:40:22.896647,2025-08-19 17:43:42.379185,0 days 00:03:19.482538,20,,uniform,7,zero,,0.638772517264652,6464,608,,raw,old,1.179656199941839,tanh,COMPLETE
58,0.7189354499181112,2025-08-19 17:43:42.380120,2025-08-19 17:44:26.547102,0 days 00:00:44.166982,100,4.9472814765433896e-05,normal,5,nz,1.106096741147044e-08,1.9145155270155873e-06,5103,960,,colnorm,old,1.011607460649525,tanh,COMPLETE
59,0.9311774174372355,2025-08-19 17:44:26.547532,2025-08-19 17:45:06.604301,0 days 00:00:40.056769,100,,uniform,5,zero,,0.014506990287767998,8974,704,,raw,old,1.793374279406794,tanh,COMPLETE
60,0.9716290235519409,2025-08-19 17:45:06.604732,2025-08-19 17:45:48.086893,0 days 00:00:41.482161,100,,uniform,5,zero,,0.19138751832770148,6679,896,0.7880322138091012,pca,old,1.401879254754568,logistic,COMPLETE
61,0.9771613081296285,2025-08-19 17:45:48.087081,2025-08-19 17:46:28.282185,0 days 00:00:40.195104,100,,uniform,5,zero,,0.42629546743298047,8595,784,,raw,old,1.5168536235967773,tanh,COMPLETE
62,0.976758082707723,2025-08-19 17:46:28.282629,2025-08-19 17:47:09.764968,0 days 00:00:41.482339,100,,uniform,5,zero,,0.2817369308989549,8470,800,,raw,old,1.5137148298497027,tanh,COMPLETE
63,0.9775484005610148,2025-08-19 17:47:09.765160,2025-08-19 17:47:50.730310,0 days 00:00:40.965150,100,,uniform,5,zero,,0.7061655761181534,5918,544,,raw,old,1.3235170702528385,tanh,COMPLETE
64,0.9755484064420065,2025-08-19 17:47:50.730722,2025-08-19 17:48:31.986303,0 days 00:00:41.255581,100,,uniform,5,zero,,0.8119669296395357,5661,528,,raw,old,1.7980672119950467,tanh,COMPLETE
65,0.9745322664578756,2025-08-19 17:48:31.986566,2025-08-19 17:49:13.020510,0 days 00:00:41.033944,100,,uniform,6,zero,,0.22269367979001095,3791,640,,raw,old,1.1617850465109072,tanh,COMPLETE
66,0.7517420252164205,2025-08-19 17:49:13.020852,2025-08-19 17:49:54.041441,0 days 00:00:41.020589,100,,uniform,5,zero,,0.0002095359790616742,1744,480,,raw,Glorot,,tanh,COMPLETE
67,0.9753870964050293,2025-08-19 17:49:54.041852,2025-08-19 17:50:34.632930,0 days 00:00:40.591078,100,,uniform,8,zero,,0.3487143442394754,2724,304,,raw,old,0.8994943198581296,tanh,COMPLETE
68,0.9749354918797811,2025-08-19 17:50:34.633208,2025-08-19 17:53:56.365016,0 days 00:03:21.731808,20,,uniform,5,zero,,0.11790356274490206,4409,528,,raw,Glorot,,tanh,COMPLETE
69,0.9532580574353536,2025-08-19 17:53:56.365914,2025-08-19 17:54:37.010200,0 days 00:00:40.644286,100,,uniform,5,zero,,0.03763036417486381,5772,448,,raw,old,1.3759696941628963,tanh,COMPLETE
70,0.9783064524332682,2025-08-19 17:54:37.010401,2025-08-19 17:55:20.702692,0 days 00:00:43.692291,100,,uniform,5,nz,0.00015341351777115744,0.6163475467611558,7190,336,,raw,Glorot,,tanh,COMPLETE
71,0.9773064851760864,2025-08-19 17:55:20.703122,2025-08-19 17:56:03.747250,0 days 00:00:43.044128,100,,uniform,5,nz,0.00021869548312728384,0.6797663065108847,6848,368,,raw,Glorot,,tanh,COMPLETE
72,0.9768871267636617,2025-08-19 17:56:03.747522,2025-08-19 17:56:47.099524,0 days 00:00:43.352002,100,,uniform,5,nz,0.0003010321138538272,0.718355680247858,7047,256,,raw,Glorot,,tanh,COMPLETE
73,0.9738548994064331,2025-08-19 17:56:47.099866,2025-08-19 17:57:30.691953,0 days 00:00:43.592087,100,,uniform,5,nz,0.00010928542220641495,0.9868026209450707,8991,368,,raw,Glorot,,tanh,COMPLETE
74,0.9775806466738383,2025-08-19 17:57:30.692375,2025-08-19 17:58:14.140307,0 days 00:00:43.447932,100,,uniform,5,nz,3.2120655273459377e-06,0.6552147972641841,5115,336,,raw,Glorot,,tanh,COMPLETE
75,0.9760161439577738,2025-08-19 17:58:14.140584,2025-08-19 17:58:57.408829,0 days 00:00:43.268245,100,,uniform,5,nz,3.683748380517066e-06,0.19968307208878944,7040,320,,raw,Glorot,,tanh,COMPLETE
76,0.9781935413678488,2025-08-19 17:58:57.409177,2025-08-19 17:59:41.000069,0 days 00:00:43.590892,100,,uniform,7,nz,6.641263322663117e-05,0.6483973691784328,5032,400,,raw,Glorot,,tanh,COMPLETE
77,0.9781774282455444,2025-08-19 17:59:41.000486,2025-08-19 18:00:24.460494,0 days 00:00:43.460008,100,,uniform,7,nz,7.837973569212044e-05,0.6059551393671695,4965,400,,raw,Glorot,,tanh,COMPLETE
78,0.8644837935765585,2025-08-19 18:00:24.460764,2025-08-19 18:01:09.156615,0 days 00:00:44.695851,100,6.808466897587843e-08,normal,7,nz,4.1608540736475255e-05,0.0012363844781127854,5001,432,,colnorm,Glorot,,logistic,COMPLETE
79,0.9779999653498331,2025-08-19 18:01:09.156993,2025-08-19 18:01:53.772490,0 days 00:00:44.615497,100,,uniform,7,nz,5.215683411057629e-06,0.6279708207355593,4220,336,,raw,Glorot,,tanh,COMPLETE
