number,value,datetime_start,datetime_complete,duration,params_batch_size,params_colnorm_thresh,params_dist1,params_iseed,params_l2_penalty_choice,params_l2_penalty_nz,params_lr,params_lr_anneal_start,params_nhid1,params_pca_energy,params_preproc,params_scale_heur1,params_scale_mult1,params_squash,user_attrs_avg_fit_criteria,state,avg_fit_criteria
0,0.33371666073799133,2025-08-24 10:57:10.620771,2025-08-24 11:18:32.785507,0 days 00:21:22.164736,20,,normal,8,nz,1.5463788579841117e-06,0.00016653461936159484,1323,832,,raw,Glorot,,tanh,0.013165545463562012,COMPLETE,0.013165545463562012
1,0.27556666135787966,2025-08-24 11:18:32.787663,2025-08-24 11:22:58.758208,0 days 00:04:25.970545,100,,uniform,8,nz,1.9236748753487186e-08,2.0547199328558902e-05,7073,592,0.6584180610844357,pca,Glorot,,tanh,0.013457250595092774,COMPLETE,0.013457250595092774
2,0.10013333261013031,2025-08-24 11:22:58.758683,2025-08-24 11:27:05.371408,0 days 00:04:06.612725,100,,normal,5,zero,,0.5659923651826084,3833,128,,raw,old,1.9857466391390506,tanh,0.01195671558380127,COMPLETE,0.01195671558380127
3,0.3162833273410797,2025-08-24 11:27:05.371753,2025-08-24 11:47:26.662267,0 days 00:20:21.290514,20,,uniform,8,zero,,0.0004181759315680524,1673,496,0.7936518167319924,pca,old,0.7411550703865422,logistic,0.012819814682006835,COMPLETE,0.012819814682006835
4,0.48681666851043703,2025-08-24 11:47:26.662720,2025-08-24 11:51:36.058392,0 days 00:04:09.395672,100,0.0005111785038494985,uniform,6,zero,,0.01772932380115616,3920,496,,colnorm,Glorot,,logistic,0.005399918556213379,COMPLETE,0.005399918556213379
5,0.40703333020210264,2025-08-24 11:51:36.058737,2025-08-24 12:12:51.363780,0 days 00:21:15.305043,20,,uniform,7,nz,2.754579187431946e-08,0.04731325254594746,1576,272,0.9395345807573379,pca,Glorot,,tanh,0.0023144960403442385,COMPLETE,0.0023144960403442385
6,0.315583336353302,2025-08-24 12:12:51.364241,2025-08-24 12:17:07.094086,0 days 00:04:15.729845,100,,uniform,8,nz,4.347699888300888e-07,0.002194664177038812,147,1024,,raw,Glorot,,logistic,0.013050532341003418,COMPLETE,0.013050532341003418
7,0.44563332200050354,2025-08-24 12:17:07.095810,2025-08-24 12:21:17.404513,0 days 00:04:10.308703,100,0.00030649167289104257,normal,5,zero,,0.0816998127615149,1228,688,,colnorm,Glorot,,tanh,0.003143620491027832,COMPLETE,0.003143620491027832
8,0.4518666625022888,2025-08-24 12:21:17.405206,2025-08-24 12:25:44.806223,0 days 00:04:27.401017,100,,uniform,7,nz,0.0002645568202790849,0.02422873547786384,891,720,0.8913677959876881,pca,old,0.8538315683484765,tanh,0.010024094581604004,COMPLETE,0.010024094581604004
9,0.25236666202545166,2025-08-24 12:25:44.806599,2025-08-24 12:30:04.780081,0 days 00:04:19.973482,100,,uniform,7,zero,,3.170750300370449e-06,3320,656,0.9406161231694635,pca,old,0.8029927440054692,tanh,0.013123798370361327,COMPLETE,0.013123798370361327
10,0.4256833255290985,2025-08-24 12:30:04.780463,2025-08-24 12:51:25.507994,0 days 00:21:20.727531,20,,normal,8,nz,0.002551744641784246,0.03420715013038941,7313,368,0.936638035172104,pca,old,1.3715103262460462,tanh,-0.0002619028091430664,COMPLETE,-0.0002619028091430664
11,0.35428333282470703,2025-08-24 12:51:25.508444,2025-08-24 12:55:26.181081,0 days 00:04:00.672637,100,,uniform,5,zero,,0.002472295306383974,2075,64,,raw,old,0.2686955279215667,tanh,0.010097646713256836,COMPLETE,0.010097646713256836
12,0.11200000047683716,2025-08-24 12:55:26.181390,2025-08-24 13:16:12.695540,0 days 00:20:46.514150,20,,normal,8,zero,,0.12633115655273697,7996,496,,raw,old,1.2383117176396174,tanh,,COMPLETE,
13,0.4457166612148285,2025-08-24 13:16:12.698648,2025-08-24 13:20:32.487290,0 days 00:04:19.788642,100,0.00026396605532175534,normal,8,zero,,0.0856956409647669,1799,288,,colnorm,old,1.2920153892124882,logistic,0.0006557226181030274,COMPLETE,0.0006557226181030274
14,0.41111665964126587,2025-08-24 13:20:32.489399,2025-08-24 13:40:46.051871,0 days 00:20:13.562472,20,1.9234441996304963e-05,normal,5,zero,,0.1914526965665586,1879,192,,colnorm,Glorot,,logistic,-1.4567375183105469e-05,COMPLETE,-1.4567375183105469e-05
15,0.46961665749549864,2025-08-24 13:40:46.052326,2025-08-24 14:02:00.565114,0 days 00:21:14.512788,20,1.2471437960535648e-06,normal,5,nz,1.3116339985565845e-05,0.002599150833651273,8061,416,,colnorm,Glorot,,tanh,0.008913302421569824,COMPLETE,0.008913302421569824
16,0.18851666450500487,2025-08-24 14:02:00.565583,2025-08-24 14:06:06.295616,0 days 00:04:05.730033,100,4.664316241584911e-07,uniform,6,zero,,0.00030045263597290177,531,32,,colnorm,Glorot,,logistic,0.011517858505249024,COMPLETE,0.011517858505249024
17,0.4220499932765961,2025-08-24 14:06:06.296567,2025-08-24 14:10:15.136237,0 days 00:04:08.839670,100,,uniform,5,nz,0.0020148539176503438,0.004266449491975976,3210,464,,raw,old,0.6801332526612567,logistic,0.01058356761932373,COMPLETE,0.01058356761932373
18,0.4462833285331726,2025-08-24 14:10:15.137163,2025-08-24 14:31:59.301791,0 days 00:21:44.164628,20,6.917979271942646e-07,normal,6,nz,6.192186988258287e-07,0.0030403110046740844,7268,928,,colnorm,Glorot,,logistic,0.011979913711547852,COMPLETE,0.011979913711547852
19,0.4880333304405212,2025-08-24 14:31:59.302254,2025-08-24 14:53:58.342254,0 days 00:21:59.040000,20,0.0002913468031487346,uniform,6,nz,1.265187772100772e-08,0.10035093057105589,548,256,,colnorm,old,0.2772973808283531,logistic,0.0031738519668579102,COMPLETE,0.0031738519668579102
20,0.455266660451889,2025-08-24 14:53:58.344026,2025-08-24 15:15:05.537193,0 days 00:21:07.193167,20,1.2900430342543819e-09,uniform,6,nz,3.288867011694485e-08,0.04835460667807229,527,96,,colnorm,old,0.22380683596255158,logistic,0.0056733846664428714,COMPLETE,0.0056733846664428714
21,0.4409500002861023,2025-08-24 15:15:05.537669,2025-08-24 15:19:06.727996,0 days 00:04:01.190327,100,0.0009365745157994863,uniform,6,zero,,0.07721521378867975,3716,368,,colnorm,Glorot,,logistic,0.00013766288757324218,COMPLETE,0.00013766288757324218
22,0.38681666254997255,2025-08-24 15:19:06.728370,2025-08-24 15:40:26.630241,0 days 00:21:19.901871,20,1.2324695195957456e-05,normal,5,nz,2.3575301032062464e-05,0.11465432321934435,7902,336,,colnorm,Glorot,,tanh,7.853507995605468e-05,COMPLETE,7.853507995605468e-05
23,0.34219999313354493,2025-08-24 15:40:26.630645,2025-08-24 16:02:15.732714,0 days 00:21:49.102069,20,3.441354790440193e-05,normal,5,nz,1.6927881839547838e-05,0.0006954572943168059,7444,256,,colnorm,old,0.20181278864033558,logistic,0.012919092178344726,COMPLETE,0.012919092178344726
24,0.3750166654586792,2025-08-24 16:02:15.733194,2025-08-24 16:23:38.631340,0 days 00:21:22.898146,20,,uniform,6,nz,1.0206574370481918e-08,0.012453955390191203,476,368,,raw,old,1.684710504944702,tanh,0.011835694313049316,COMPLETE,0.011835694313049316
25,0.398283326625824,2025-08-24 16:23:38.633765,2025-08-24 16:27:42.883199,0 days 00:04:04.249434,100,,uniform,6,zero,,0.0016982249024099724,2081,640,,raw,Glorot,,logistic,0.012589597702026367,COMPLETE,0.012589597702026367
26,0.3161166548728943,2025-08-24 16:27:42.883557,2025-08-24 16:49:35.391620,0 days 00:21:52.508063,20,3.073853194481646e-08,normal,5,nz,8.38567156375167e-06,9.177629635990807e-05,4213,416,,colnorm,Glorot,,tanh,0.013050508499145509,COMPLETE,0.013050508499145509
27,0.444733327627182,2025-08-24 16:49:35.393613,2025-08-24 17:10:46.114511,0 days 00:21:10.720898,20,0.0009844628961629476,uniform,8,nz,3.421422588729936e-07,0.11406844675670222,177,608,,colnorm,old,0.5048876012640595,logistic,0.011791539192199708,COMPLETE,0.011791539192199708
28,0.36249999403953553,2025-08-24 17:10:46.115546,2025-08-24 17:14:58.631149,0 days 00:04:12.515603,100,3.3605824651296023e-06,normal,6,zero,,0.000683184100539881,7651,560,,colnorm,Glorot,,logistic,0.012949252128601074,COMPLETE,0.012949252128601074
29,0.4697833240032196,2025-08-24 17:14:58.631567,2025-08-24 17:37:12.300097,0 days 00:22:13.668530,20,7.66990223115473e-05,normal,6,nz,7.91118387933558e-05,0.0670844500973403,390,512,,colnorm,old,0.9744774863317317,logistic,0.009593534469604491,COMPLETE,0.009593534469604491
30,0.4689833283424377,2025-08-24 17:37:12.300575,2025-08-24 17:58:32.128674,0 days 00:21:19.828099,20,7.359426969649719e-05,normal,7,nz,9.62899713322508e-05,0.0716283418805843,373,544,,colnorm,old,0.9783059185734024,logistic,0.009801244735717774,COMPLETE,0.009801244735717774
31,0.46589999198913573,2025-08-24 17:58:32.129143,2025-08-24 18:02:50.633977,0 days 00:04:18.504834,100,8.64143279243224e-05,normal,6,nz,0.00012102729018380276,0.10327454794330942,350,848,,colnorm,old,0.5360075687912248,logistic,0.01100761890411377,COMPLETE,0.01100761890411377
32,0.4686333239078522,2025-08-24 18:02:50.634372,2025-08-24 18:24:00.536710,0 days 00:21:09.902338,20,0.0008892341389527364,normal,6,zero,,0.1891838339987902,548,560,,colnorm,old,1.025679717689854,logistic,0.0013361454010009765,COMPLETE,0.0013361454010009765
33,0.3940333306789398,2025-08-24 18:24:00.537711,2025-08-24 18:45:13.870904,0 days 00:21:13.333193,20,,normal,6,nz,1.0681235707222493e-05,0.06414255029552848,108,336,,raw,old,0.554927235523211,logistic,0.011426711082458496,COMPLETE,0.011426711082458496
34,0.4585333287715912,2025-08-24 18:45:13.871354,2025-08-24 19:06:50.039422,0 days 00:21:36.168068,20,4.082354639191023e-05,normal,6,nz,7.581035137973102e-05,0.13139538883441965,148,544,,colnorm,old,1.5142866643177106,tanh,0.0075592041015625,COMPLETE,0.0075592041015625
35,0.29788332581520083,2025-08-24 19:06:50.041739,2025-08-24 19:27:51.584395,0 days 00:21:01.542656,20,,uniform,6,nz,5.5327397821748675e-06,0.105227053165318,559,448,0.5139020588763892,pca,old,1.042947214502382,logistic,0.010066914558410644,COMPLETE,0.010066914558410644
36,0.4610666573047638,2025-08-24 19:27:51.585461,2025-08-24 19:32:12.598849,0 days 00:04:21.013388,100,1.7624021487699627e-06,uniform,7,nz,1.3366768926745921e-08,0.060046256442332545,8393,704,,colnorm,Glorot,,logistic,9.331703186035156e-05,COMPLETE,9.331703186035156e-05
37,0.4610666513442993,2025-08-24 19:32:12.600277,2025-08-24 19:52:45.818395,0 days 00:20:33.218118,20,0.00010563746401908212,uniform,6,zero,,0.024836456184841513,7143,592,,colnorm,old,0.46311599083537214,logistic,0.0004701852798461914,COMPLETE,0.0004701852798461914
38,0.46234999895095824,2025-08-24 19:52:45.820282,2025-08-24 19:57:23.007967,0 days 00:04:37.187685,100,0.00013644898880069324,normal,6,nz,0.0004189770856885702,0.003595237054311967,7336,128,,colnorm,Glorot,,tanh,0.007600927352905273,COMPLETE,0.007600927352905273
39,0.31088332533836366,2025-08-24 19:57:23.010146,2025-08-24 20:18:45.260378,0 days 00:21:22.250232,20,0.0009284350289816,normal,6,nz,4.163798344948642e-07,0.004002033847564118,179,768,,colnorm,Glorot,,logistic,0.013047242164611816,COMPLETE,0.013047242164611816
40,0.4848166584968567,2025-08-24 20:18:45.260878,2025-08-24 20:40:38.450715,0 days 00:21:53.189837,20,9.58563190423807e-08,normal,6,nz,3.987772906218213e-05,0.03436785351157581,1307,368,,colnorm,Glorot,,logistic,0.004928016662597656,COMPLETE,0.004928016662597656
41,0.4509833335876465,2025-08-24 20:40:38.451174,2025-08-24 20:57:54.178247,0 days 00:17:15.727073,20,3.80650539420546e-08,normal,6,nz,7.470938357066023e-05,0.047562520069082403,2470,208,,colnorm,Glorot,,logistic,0.0005120515823364257,COMPLETE,0.0005120515823364257
42,0.3272166669368744,2025-08-24 20:57:54.178644,2025-08-24 21:01:16.023448,0 days 00:03:21.844804,100,2.713084917839435e-07,normal,6,nz,2.3529026250142787e-05,0.007189754730064027,309,256,,colnorm,Glorot,,logistic,0.012706971168518067,COMPLETE,0.012706971168518067
43,0.4586833298206329,2025-08-24 21:01:16.023780,2025-08-24 21:16:38.858153,0 days 00:15:22.834373,20,1.1061900367897137e-07,uniform,5,zero,,0.031326644415820594,814,240,,colnorm,old,0.21963967366974343,logistic,0.00940854549407959,COMPLETE,0.00940854549407959
44,0.39039999842643736,2025-08-24 21:16:38.858537,2025-08-24 21:19:53.898815,0 days 00:03:15.040278,100,,uniform,8,zero,,0.010617600249583515,5833,320,0.6899713576159323,pca,Glorot,,logistic,0.008590507507324218,COMPLETE,0.008590507507324218
45,0.3884666621685028,2025-08-24 21:19:53.899723,2025-08-24 21:36:02.430124,0 days 00:16:08.530401,20,,normal,6,nz,2.3001451550741492e-05,0.0013790925684738868,5853,416,,raw,Glorot,,tanh,0.011737179756164551,COMPLETE,0.011737179756164551
46,0.4584333300590515,2025-08-24 21:36:02.430521,2025-08-24 21:52:11.561960,0 days 00:16:09.131439,20,1.0790402431455932e-07,uniform,5,nz,0.000262557887498693,0.004469199812241481,6141,352,,colnorm,Glorot,,logistic,0.00932157039642334,COMPLETE,0.00932157039642334
47,0.35208332538604736,2025-08-24 21:52:11.562353,2025-08-24 22:08:13.681678,0 days 00:16:02.119325,20,,normal,6,nz,3.873153093856561e-06,0.018051474993776566,722,304,0.5876063020301385,pca,Glorot,,tanh,0.011680340766906739,COMPLETE,0.011680340766906739
48,0.4398999989032745,2025-08-24 22:08:13.682068,2025-08-24 22:11:34.289716,0 days 00:03:20.607648,100,2.8224861396127757e-06,uniform,6,nz,7.322338881207568e-06,0.07540434651907044,3072,560,,colnorm,Glorot,,tanh,0.0018432140350341797,COMPLETE,0.0018432140350341797
49,0.4576833248138428,2025-08-24 22:11:34.290004,2025-08-24 22:14:53.024592,0 days 00:03:18.734588,100,0.00011315594785260865,normal,5,nz,1.381160913156228e-08,0.05357192736994643,2294,384,,colnorm,Glorot,,logistic,0.0009255409240722656,COMPLETE,0.0009255409240722656
50,0.4793833255767822,2025-08-24 22:14:53.024921,2025-08-24 22:30:57.709448,0 days 00:16:04.684527,20,0.0002354013504309392,normal,6,nz,8.318055200941528e-05,0.023524171807971197,1446,480,,colnorm,old,0.7524481606860799,logistic,0.00852503776550293,COMPLETE,0.00852503776550293
51,0.34424999356269836,2025-08-24 22:30:57.709842,2025-08-24 22:46:53.333445,0 days 00:15:55.623603,20,,normal,6,nz,9.481187839001379e-05,0.01907539757742837,1605,624,,raw,Glorot,,logistic,0.010252285003662109,COMPLETE,0.010252285003662109
52,0.4051166594028473,2025-08-24 22:46:53.333849,2025-08-24 23:03:03.122202,0 days 00:16:09.788353,20,0.00020323860422519774,normal,6,nz,7.263419701300512e-05,0.004941635707127116,1697,448,,colnorm,old,0.8311280236875863,logistic,0.012283134460449218,COMPLETE,0.012283134460449218
53,0.4302833259105682,2025-08-24 23:03:03.122608,2025-08-24 23:18:26.837267,0 days 00:15:23.714659,20,0.00026421464809209684,uniform,5,zero,,0.00969788562248487,7918,448,,colnorm,Glorot,,tanh,0.00215001106262207,COMPLETE,0.00215001106262207
54,0.48734999299049375,2025-08-24 23:18:26.837664,2025-08-24 23:33:48.051862,0 days 00:15:21.214198,20,0.00016225253700759913,normal,5,zero,,0.0022007971940363894,6626,544,,colnorm,old,0.6825705774101046,tanh,0.011159920692443847,COMPLETE,0.011159920692443847
55,0.45379999876022337,2025-08-24 23:33:48.052753,2025-08-24 23:49:05.853617,0 days 00:15:17.800864,20,0.00015694758433850976,normal,5,zero,,0.0008580413775780669,9323,784,,colnorm,old,0.7402807350175797,tanh,0.012970805168151855,COMPLETE,0.012970805168151855
56,0.3816333293914795,2025-08-24 23:49:05.854007,2025-08-25 00:04:18.642384,0 days 00:15:12.788377,20,,normal,5,zero,,0.00022745862354698587,3156,496,,raw,old,0.695106558544144,tanh,0.012955260276794434,COMPLETE,0.012955260276794434
57,0.39561666250228883,2025-08-25 00:04:18.643134,2025-08-25 00:20:31.616138,0 days 00:16:12.973004,20,0.00019110811189152583,uniform,8,nz,0.00786583560456476,0.0022885335533799614,881,320,,colnorm,old,0.9878074961337227,tanh,0.013180851936340332,COMPLETE,0.013180851936340332
58,0.38564999103546144,2025-08-25 00:20:31.616526,2025-08-25 00:35:54.337952,0 days 00:15:22.721426,20,0.00016865432926244529,normal,5,zero,,0.11730400485325992,6480,288,,colnorm,old,0.5726788610772355,tanh,4.00543212890625e-05,COMPLETE,4.00543212890625e-05
59,0.39861666560173037,2025-08-25 00:35:54.338334,2025-08-25 00:51:18.991414,0 days 00:15:24.653080,20,0.0004981287081275331,normal,7,zero,,0.0006803598391657838,3475,560,,colnorm,old,1.9072289950276606,tanh,0.012795758247375489,COMPLETE,0.012795758247375489
60,0.25364999771118163,2025-08-25 00:51:18.991795,2025-08-25 01:07:39.637552,0 days 00:16:20.645757,20,4.252915021327271e-05,normal,7,nz,0.0008388227176052973,0.00012518921702375346,715,368,,colnorm,Glorot,,logistic,0.012964105606079102,COMPLETE,0.012964105606079102
61,0.2045999974012375,2025-08-25 01:07:39.637948,2025-08-25 01:23:48.505743,0 days 00:16:08.867795,20,,uniform,8,nz,6.458905848935747e-05,0.05762745043831119,887,48,,raw,old,0.571003249184165,logistic,0.00718841552734375,COMPLETE,0.00718841552734375
62,0.2856333315372467,2025-08-25 01:23:48.506134,2025-08-25 01:27:01.635261,0 days 00:03:13.129127,100,6.602698180452701e-07,uniform,6,zero,,0.00195789307638357,604,576,,colnorm,old,0.9746687093378759,logistic,0.013115167617797852,COMPLETE,0.013115167617797852
63,0.4848666608333588,2025-08-25 01:27:01.635545,2025-08-25 01:43:17.106331,0 days 00:16:15.470786,20,2.086767678076423e-05,normal,6,nz,4.7351878251516306e-05,0.24731798729863644,263,272,,colnorm,old,0.770166619178366,logistic,0.0018600702285766601,COMPLETE,0.0018600702285766601
64,0.10000000149011612,2025-08-25 01:43:17.107270,2025-08-25 01:59:22.608133,0 days 00:16:05.500863,20,1.9590494585405648e-05,normal,6,nz,0.0001571655212405066,0.8769391121739165,1160,656,,colnorm,Glorot,,logistic,,COMPLETE,
65,0.4893666684627533,2025-08-25 01:59:22.608520,2025-08-25 02:15:30.514018,0 days 00:16:07.905498,20,2.9653423169204097e-05,normal,6,nz,0.00024009130324137982,0.17349686684342774,335,288,,colnorm,old,0.7969351271325518,logistic,0.002077484130859375,COMPLETE,0.002077484130859375
66,0.314533331990242,2025-08-25 02:15:30.515865,2025-08-25 02:31:18.580022,0 days 00:15:48.064157,20,,normal,5,nz,0.000902789341231527,0.6537307413701904,215,128,0.7948320402381653,pca,old,0.7345084727447136,logistic,,COMPLETE,
67,0.10000000149011612,2025-08-25 02:31:18.580410,2025-08-25 02:34:40.971803,0 days 00:03:22.391393,100,1.2765692464652126e-05,normal,6,nz,2.0212431552282096e-08,0.7975809231521764,1099,272,,colnorm,old,0.7582872234707833,logistic,,COMPLETE,
68,0.4384999930858612,2025-08-25 02:34:40.972137,2025-08-25 02:50:50.491515,0 days 00:16:09.519378,20,1.8251753197804018e-05,normal,6,nz,0.00033760649464656135,0.4020410226050335,406,128,,colnorm,old,0.6609243136371787,logistic,-7.95602798461914e-05,COMPLETE,-7.95602798461914e-05
69,0.4380333244800568,2025-08-25 02:50:50.491923,2025-08-25 03:06:17.354885,0 days 00:15:26.862962,20,9.271379117788709e-09,normal,6,zero,,0.028973112387591614,1197,336,,colnorm,Glorot,,tanh,0.0038596630096435548,COMPLETE,0.0038596630096435548
70,0.10000000149011612,2025-08-25 03:06:17.355283,2025-08-25 03:22:23.146888,0 days 00:16:05.791605,20,0.0006766208351441116,uniform,5,nz,0.0005883176969789767,0.564399054282796,754,448,,colnorm,old,0.7164648566716799,logistic,,COMPLETE,
71,0.4897000014781952,2025-08-25 03:22:23.147274,2025-08-25 03:38:32.171972,0 days 00:16:09.024698,20,2.788517896727957e-05,normal,6,nz,7.5722269258562e-05,0.10295500462471653,704,544,,colnorm,old,0.9494309932188644,logistic,0.002643871307373047,COMPLETE,0.002643871307373047
72,0.45966665744781493,2025-08-25 03:38:32.172366,2025-08-25 03:54:42.140411,0 days 00:16:09.968045,20,1.417445512671344e-05,uniform,6,nz,6.570522413641012e-05,0.0397508990113637,546,416,,colnorm,Glorot,,logistic,0.009716320037841796,COMPLETE,0.009716320037841796
73,0.4881333291530609,2025-08-25 03:54:42.141232,2025-08-25 03:58:01.766087,0 days 00:03:19.624855,100,2.7382417682609856e-05,normal,5,nz,5.4805948899165766e-05,0.42736665013870306,176,432,,colnorm,old,0.8919675143602288,logistic,0.0029531240463256834,COMPLETE,0.0029531240463256834
74,0.16923333406448365,2025-08-25 03:58:01.766425,2025-08-25 04:01:21.981730,0 days 00:03:20.215305,100,9.010054208032367e-06,normal,5,nz,2.49867104466934e-05,0.8146063599517882,462,368,,colnorm,old,1.0432461450765484,logistic,,COMPLETE,
75,0.247133332490921,2025-08-25 04:01:21.982085,2025-08-25 04:04:41.017666,0 days 00:03:19.035581,100,1.217510079779842e-05,normal,5,nz,1.2261713873097261e-07,0.0010043781997596045,173,416,,colnorm,old,0.9348450871270939,logistic,0.013044190406799317,COMPLETE,0.013044190406799317
76,0.4162166595458984,2025-08-25 04:04:41.018003,2025-08-25 04:08:00.347968,0 days 00:03:19.329965,100,2.46418251965648e-05,uniform,5,nz,3.734637573391394e-05,0.11195594850022494,109,496,,colnorm,old,0.8962063792624093,logistic,0.012197422981262206,COMPLETE,0.012197422981262206
77,0.35394999384880066,2025-08-25 04:08:00.348264,2025-08-25 04:11:12.092173,0 days 00:03:11.743909,100,,uniform,6,nz,0.00026414724247216654,0.08001316045189526,256,352,,raw,old,0.8677986550529521,logistic,0.01054527759552002,COMPLETE,0.01054527759552002
78,0.4444166660308838,2025-08-25 04:11:12.092500,2025-08-25 04:26:38.255546,0 days 00:15:26.163046,20,2.4810755745850067e-05,uniform,8,zero,,0.003609122010608438,5766,576,,colnorm,Glorot,,logistic,0.011477398872375488,COMPLETE,0.011477398872375488
79,0.41139999181032183,2025-08-25 04:26:38.255956,2025-08-25 04:29:47.380799,0 days 00:03:09.124843,100,2.7682549904231404e-05,normal,5,zero,,0.449183104650571,186,512,,colnorm,old,0.3575283413959515,logistic,,COMPLETE,
80,0.10000000149011612,2025-08-25 04:29:47.381162,2025-08-25 04:46:01.006547,0 days 00:16:13.625385,20,3.710754927330043e-05,uniform,6,nz,1.298982700763544e-08,0.4870135064012023,915,512,,colnorm,old,1.2359674439865431,tanh,,COMPLETE,
81,0.4212666690349579,2025-08-25 04:46:01.006961,2025-08-25 05:02:11.762239,0 days 00:16:10.755278,20,0.00021836671594643715,normal,7,nz,4.4092485303380704e-05,0.2166602832389487,533,64,,colnorm,old,0.7792586922702974,tanh,0.00020265579223632812,COMPLETE,0.00020265579223632812
