number,value,datetime_start,datetime_complete,duration,params_batch_size,params_dist1,params_iseed,params_l2_penalty_choice,params_l2_penalty_nz,params_lr,params_lr_anneal_start,params_ncode,params_nhid1,params_nhid2,params_nhid3,params_scale_heur1,params_scale_mult1,params_squash,user_attrs_ed_cl1_mean,user_attrs_ed_cl2_mean,user_attrs_ed_cl3_mean,user_attrs_ed_cl4_mean,user_attrs_ed_cl5_mean,user_attrs_ed_cl6_mean,user_attrs_ed_cl7_mean,user_attrs_ed_overall_mean,user_attrs_val_recon_loss_mean,user_attrs_val_recon_loss_std,state
0,0.3079749643802643,2025-09-02 03:15:51.967005,2025-09-02 03:26:36.403064,0 days 00:10:44.436059,100,normal,6,zero,,0.28678812614035476,266,192,1008,608,576,old,0.7186620787543885,logistic,0.012940009435017904,0.01300219694773356,0.013003349304199219,0.012883305549621582,0.012921849886576334,0.01275336742401123,0.0077054500579833984,0.012172789800734747,0.3079749643802643,0.006564573491674222,COMPLETE
1,0.7969218095143636,2025-09-02 03:26:36.403748,2025-09-02 03:32:50.225023,0 days 00:06:13.821275,256,uniform,6,nz,3.005736980965281e-06,0.002727419843207111,355,304,800,736,544,old,0.7651904189827918,tanh,0.012997786204020182,0.013044397036234537,0.013106028238932291,0.013060887654622396,0.013159831364949545,0.013051350911458334,0.012975374857584635,0.013056522323971703,0.7969218095143636,0.01600081939950835,COMPLETE
2,0.958585262298584,2025-09-02 03:32:50.225744,2025-09-02 03:36:36.300408,0 days 00:03:46.074664,512,uniform,5,zero,,0.012516506414049113,127,496,512,704,592,Glorot,,logistic,0.013234933217366537,0.013130267461140951,0.013037006060282389,0.01317286491394043,0.013031999270121256,0.013199806213378906,0.013050675392150879,0.013122507504054479,0.958585262298584,0.013244987136118023,COMPLETE
3,0.40193862716356915,2025-09-02 03:36:36.300935,2025-09-02 03:40:43.434162,0 days 00:04:07.133227,512,uniform,6,nz,0.004311894460840844,0.044606921806839235,3912,240,544,800,560,Glorot,,tanh,0.012313365936279297,0.012363592783610025,0.01087486743927002,0.00942389170328776,0.010683019955952963,0.009604573249816895,1.2556711832682291e-05,0.009325123968578519,0.40193862716356915,0.0016285434796214505,COMPLETE
4,0.349875807762146,2025-09-02 03:40:43.434677,2025-09-02 03:46:52.962658,0 days 00:06:09.527981,256,uniform,6,nz,0.0009348010035975294,0.08459908187981949,3315,720,848,768,256,Glorot,,logistic,0.012762308120727539,0.012913902600606283,0.012900431950887045,0.012915253639221191,0.0126417875289917,0.012143810590108236,0.0004181861877441406,0.010956525802612305,0.349875807762146,0.0012703390648442624,COMPLETE
5,1.0349506934483845,2025-09-02 03:46:52.963194,2025-09-02 03:58:10.783345,0 days 00:11:17.820151,100,normal,5,nz,1.0224729613848469e-07,4.421316033446251e-05,217,272,240,320,640,Glorot,,logistic,0.013045708338419596,0.013148903846740723,0.013059655825297037,0.01307535171508789,0.013172109921773275,0.012965162595113119,0.013328194618225098,0.013113583837236676,1.0349506934483845,0.002599050341740108,COMPLETE
6,0.8739398916562399,2025-09-02 03:58:10.784031,2025-09-02 04:00:34.618083,0 days 00:02:23.834052,512,normal,6,zero,,0.015141727048604519,713,160,160,384,864,Glorot,,logistic,0.013073404630025228,0.01304177443186442,0.013164083162943522,0.013152837753295898,0.013135592142740885,0.013013641039530436,0.01144258181254069,0.012860559281848727,0.8739398916562399,0.013215554187093812,COMPLETE
7,1.034321943918864,2025-09-02 04:00:34.620370,2025-09-02 04:07:15.365545,0 days 00:06:40.745175,512,uniform,7,nz,9.145647612182531e-08,2.6794035197775516e-06,525,912,816,912,672,old,1.4106098531398028,logistic,0.013037800788879395,0.013088226318359375,0.013152798016866049,0.013037840525309244,0.01326457659403483,0.013001600901285807,0.013100663820902506,0.013097643852233888,1.034321943918864,0.0033364702156979814,COMPLETE
8,0.6355946063995361,2025-09-02 04:07:15.366079,2025-09-02 04:13:51.161824,0 days 00:06:35.795745,256,normal,7,nz,0.0001871943431883414,0.003747370883995538,3187,464,960,880,224,old,1.3702309915315387,logistic,0.013084848721822103,0.013041456540425619,0.013310472170511881,0.013115922609965006,0.012913664182027182,0.013007521629333496,0.012231071790059408,0.01295785109202067,0.6355946063995361,0.0019385418611792761,COMPLETE
9,1.0413885513941448,2025-09-02 04:13:51.162250,2025-09-02 04:17:14.042693,0 days 00:03:22.880443,512,uniform,7,zero,,3.559828805613139e-06,6180,1024,512,656,160,old,1.2728884162252707,tanh,0.013222018877665201,0.013083775838216146,0.01321113109588623,0.013077179590861002,0.012943625450134277,0.013152082761128744,0.013020197550455729,0.013101430166335332,1.0413885513941448,0.002123649978422489,COMPLETE
10,1.0189531644185383,2025-09-02 04:17:14.043133,2025-09-02 04:22:06.468150,0 days 00:04:52.425017,256,normal,8,zero,,7.294027543887749e-05,3218,688,656,384,592,old,1.363257397007826,logistic,0.013023893038431803,0.013072570164998373,0.01320334275563558,0.0130538543065389,0.013011495272318522,0.01298352082570394,0.01300795873006185,0.013050947870526994,1.0189531644185383,0.005400900221208745,COMPLETE
11,0.8532654643058777,2025-09-02 04:22:06.468764,2025-09-02 04:27:46.247325,0 days 00:05:39.778561,256,uniform,8,nz,0.0024972077447578873,0.007310176710660118,454,224,672,432,1024,old,1.8001794743913964,logistic,0.012957016626993815,0.012895544370015463,0.013131141662597656,0.013060688972473145,0.012992501258850098,0.013044953346252441,0.012867252031962076,0.012992728324163528,0.8532654643058777,0.02023867224199102,COMPLETE
12,1.0413698355356853,2025-09-02 04:27:46.247902,2025-09-02 05:22:41.590326,0 days 00:54:55.342424,20,normal,8,nz,0.004254112064439847,2.0726919407873168e-06,124,448,608,160,976,Glorot,,tanh,0.013121962547302246,0.013052066167195639,0.013094822565714518,0.013113617897033691,0.013100425402323404,0.012797911961873373,0.01306295394897461,0.013049108641488212,1.0413698355356853,0.004142703877218977,COMPLETE
13,1.0148914257685344,2025-09-02 05:22:41.590741,2025-09-02 05:33:28.861919,0 days 00:10:47.271178,100,normal,7,nz,1.4950164658652627e-07,6.18694946626799e-05,935,864,480,608,928,old,0.3760172191602512,tanh,0.01307666301727295,0.013048688570658365,0.013031522432963053,0.013082464536031088,0.013071298599243164,0.01307364304860433,0.013084689776102701,0.013066995711553663,1.0148914257685344,0.0010305517543812326,COMPLETE
14,0.3605230947335561,2025-09-02 05:33:28.862335,2025-09-02 05:37:30.740029,0 days 00:04:01.877694,512,uniform,8,zero,,0.5206050406650379,936,160,416,928,592,old,0.8171754286269441,tanh,0.01165783405303955,0.012569427490234375,0.012465596199035645,0.01189720630645752,0.012356797854105631,0.012485742568969727,0.007378935813903809,0.011544505755106607,0.3605230947335561,0.0038692730215717916,COMPLETE
15,0.23139051099618277,2025-09-02 05:37:30.740452,2025-09-02 06:30:07.641122,0 days 00:52:36.900670,20,uniform,7,zero,,0.07038461069693253,2496,224,592,848,784,Glorot,,tanh,0.012060602506001791,0.01259299119313558,0.012772281964619955,0.012795408566792807,0.012542287508646647,0.012390772501627604,0.006625612576802571,0.011682850973946708,0.23139051099618277,0.0010445778944868998,COMPLETE
16,1.015712857246399,2025-09-02 06:30:07.642355,2025-09-02 06:35:03.201412,0 days 00:04:55.559057,256,uniform,6,nz,3.4912391835984953e-06,0.00011343857240939616,2655,960,544,368,528,Glorot,,logistic,0.013072689374287924,0.013212482134501139,0.012980143229166666,0.01310280958811442,0.013105114301045736,0.013019323348999023,0.013196746508280436,0.013098472640627907,1.015712857246399,0.00185224709100781,COMPLETE
17,0.3905993700027466,2025-09-02 06:35:03.201825,2025-09-02 06:39:22.925262,0 days 00:04:19.723437,512,normal,7,zero,,0.13984702777160735,280,864,336,512,944,Glorot,,tanh,0.012961347897847494,0.012931585311889648,0.013069788614908854,0.012921571731567383,0.013016581535339355,0.012976924578348795,0.008726994196573893,0.012372113409496491,0.3905993700027466,0.011481082407210866,COMPLETE
18,0.9247277776400248,2025-09-02 06:39:22.925840,2025-09-02 06:44:01.226344,0 days 00:04:38.300504,512,uniform,8,zero,,0.0005645279458462784,8137,960,224,704,960,old,0.77719832383908,tanh,0.012938817342122396,0.013170520464579264,0.013043761253356934,0.013086994489034018,0.013076702753702799,0.013006329536437988,0.012911359469095865,0.013033497901189895,0.9247277776400248,0.004092305197482727,COMPLETE
19,1.0293558438618977,2025-09-02 06:44:01.226757,2025-09-02 06:49:22.924802,0 days 00:05:21.698045,256,normal,8,zero,,1.6752573004292335e-05,5290,896,320,640,976,old,0.8203862668317286,logistic,0.01339582602183024,0.013126492500305176,0.013062675793965658,0.01310276985168457,0.013066927591959635,0.013111035029093424,0.01297008991241455,0.013119402385893323,1.0293558438618977,0.005161905457707555,COMPLETE
20,1.0469588438669841,2025-09-02 06:49:22.925239,2025-09-02 06:51:41.835365,0 days 00:02:18.910126,512,normal,6,zero,,2.993279432713497e-06,212,208,240,576,448,Glorot,,tanh,0.013062318166097006,0.013077418009440104,0.01300982634226481,0.013170878092447916,0.013070384661356607,0.013130704561869303,0.012757102648417154,0.013039804640270417,1.0469588438669841,0.001106672479530265,COMPLETE
21,0.839223841826121,2025-09-02 06:51:41.835773,2025-09-02 07:46:44.477453,0 days 00:55:02.641680,20,normal,6,nz,5.9489511775294635e-08,0.006037702454628343,472,784,544,368,656,old,1.091064919512398,logistic,0.01308584213256836,0.013027389844258627,0.013063470522562662,0.013030330340067545,0.013059894243876139,0.013095458348592123,0.012734611829121908,0.013013856751578193,0.839223841826121,0.011495499848841245,COMPLETE
22,1.0326517422993977,2025-09-02 07:46:44.478057,2025-09-02 08:42:44.981286,0 days 00:56:00.503229,20,uniform,6,nz,6.383400130841037e-06,8.670749413248175e-05,104,960,416,448,992,Glorot,,logistic,0.013066649436950684,0.013053139050801596,0.013092994689941406,0.013096769650777182,0.013140082359313965,0.01310424009958903,0.012939016024271647,0.01307041304452079,1.0326517422993977,0.0018208103770985507,COMPLETE
23,0.2505255937576294,2025-09-02 08:42:44.981706,2025-09-02 08:53:35.130731,0 days 00:10:50.149025,100,uniform,5,nz,2.1360456204059218e-06,0.28551000705087126,6515,800,336,144,448,old,0.5217777191089703,logistic,0.009883721669514975,0.00845956802368164,0.011983036994934082,0.012438813845316568,0.011775533358256022,0.008630712827046713,0.0007868607838948568,0.009136892500377835,0.2505255937576294,0.0015958206868378895,COMPLETE
24,1.0330135822296143,2025-09-02 08:53:35.131161,2025-09-02 08:55:40.135182,0 days 00:02:05.004021,512,normal,5,zero,,1.779299425457281e-05,383,592,128,144,512,old,1.0953085363151955,logistic,0.013266881306966146,0.013118942578633627,0.013077259063720703,0.013085762659708658,0.01312426726023356,0.013799826304117838,0.01273047924041748,0.013171916916256859,1.0330135822296143,0.0019034179104947806,COMPLETE
25,1.0417890548706055,2025-09-02 08:55:40.135574,2025-09-02 09:06:58.102277,0 days 00:11:17.966703,100,uniform,7,nz,0.0005702005920390691,1.4639514365757013e-05,423,528,848,912,400,old,1.1341970532789616,tanh,0.01307070255279541,0.013120611508687338,0.012867450714111328,0.013088266054789225,0.012959440549214682,0.013086597124735514,0.013067881266276041,0.013037278538658506,1.0417890548706055,0.0037036123658913804,COMPLETE
26,0.5271801054477692,2025-09-02 09:06:58.102874,2025-09-02 09:59:50.026602,0 days 00:52:51.923728,20,uniform,8,zero,,0.2871481514809849,100,448,272,128,576,Glorot,,logistic,0.01333153247833252,0.01326298713684082,0.01299734910329183,0.013101855913798014,0.013005296389261881,0.012868404388427734,0.005400300025939941,0.011995389347984678,0.5271801054477692,0.023228997499098805,COMPLETE
27,1.0330384969711304,2025-09-02 09:59:50.027039,2025-09-02 10:02:14.065239,0 days 00:02:24.038200,512,normal,8,zero,,0.0002178273503004652,128,256,144,416,736,old,0.6685596747040621,logistic,0.012925346692403158,0.013196865717569986,0.013120373090108236,0.01302476723988851,0.013078848520914713,0.012941678365071615,0.012963573137919107,0.013035921823410762,1.0330384969711304,0.0040835742771323374,COMPLETE
28,1.0027363300323486,2025-09-02 10:02:14.065665,2025-09-02 10:55:16.623567,0 days 00:53:02.557902,20,uniform,6,zero,,3.0420481909171226e-05,5892,1024,528,896,128,Glorot,,tanh,0.01306601365407308,0.013110796610514322,0.01335295041402181,0.01305548350016276,0.012393315633138021,0.013116399447123209,0.0132905642191569,0.013055074782598586,1.0027363300323486,0.0023660493320079097,COMPLETE
29,0.9721479614575704,2025-09-02 10:55:16.623998,2025-09-02 11:47:40.420086,0 days 00:52:23.796088,20,normal,7,zero,,0.0002520438692546329,6794,496,416,496,464,old,1.334672179660087,logistic,0.013221542040506998,0.013003230094909668,0.013131260871887207,0.01304622491200765,0.01314389705657959,0.01307372252146403,0.012940168380737305,0.013080006554013207,0.9721479614575704,0.0029119128884695245,COMPLETE
30,1.027309815088908,2025-09-02 11:47:40.420502,2025-09-02 11:54:29.558120,0 days 00:06:49.137618,512,uniform,7,nz,1.6486730302220903e-05,0.00021278293670092617,192,384,960,752,960,old,1.6650831421016485,tanh,0.013066371281941732,0.013136903444925943,0.013069987297058105,0.012982686360677084,0.013059337933858236,0.013074914614359537,0.013108928998311361,0.013071304275876,1.027309815088908,0.0018683363418638904,COMPLETE
31,1.0315542221069336,2025-09-02 11:54:29.558690,2025-09-02 12:48:58.866136,0 days 00:54:29.307446,20,normal,6,nz,3.767989982847917e-05,8.41986904154775e-06,661,192,976,336,784,Glorot,,logistic,0.013126095136006674,0.013172586758931478,0.013054490089416504,0.012877186139424643,0.01313932736714681,0.013036370277404785,0.013080318768819174,0.013069482076735724,1.0315542221069336,0.0017741469090348239,COMPLETE
32,1.0453190008799236,2025-09-02 12:48:58.866566,2025-09-02 13:00:50.145412,0 days 00:11:51.278846,100,uniform,8,nz,0.0006021016068328207,1.8504600665283064e-06,604,592,928,416,880,Glorot,,tanh,0.01309661070505778,0.012888550758361816,0.013142863909403482,0.013079444567362467,0.013081073760986328,0.013065218925476074,0.013086835543314615,0.013062942595708938,1.0453190008799236,0.0039456558578374575,COMPLETE
33,1.0083839098612468,2025-09-02 13:00:50.145841,2025-09-02 13:05:53.749552,0 days 00:05:03.603711,256,uniform,8,zero,,0.0004064871860768272,728,320,576,912,416,old,1.1133727133657239,logistic,0.013118704160054525,0.013126174608866373,0.013134916623433432,0.012822429339090982,0.013206084569295248,0.01307209332784017,0.013102968533833822,0.013083338737487791,1.0083839098612468,0.005664075955398495,COMPLETE
34,0.3137790560722351,2025-09-02 13:05:53.750169,2025-09-02 13:09:39.131545,0 days 00:03:45.381376,512,normal,7,zero,,0.4080388969790123,813,976,752,304,192,Glorot,,tanh,0.012303988138834635,0.011961579322814941,0.012259085973103842,0.012716174125671387,0.01224656899770101,0.01172494888305664,0.009379863739013672,0.011798887025742305,0.3137790560722351,0.002751854926484736,COMPLETE
35,0.49816649158795673,2025-09-02 13:09:39.131966,2025-09-02 13:13:03.738451,0 days 00:03:24.606485,512,uniform,5,nz,3.95691079982726e-05,0.11775755469457652,248,464,176,784,704,old,1.0259352429407134,tanh,0.01320044199625651,0.012943704922993978,0.013058304786682129,0.012961347897847494,0.01301431655883789,0.012999773025512695,0.008324027061462402,0.01235741660708473,0.49816649158795673,0.02387931631784307,COMPLETE
36,0.6264794866243998,2025-09-02 13:13:03.739057,2025-09-02 13:17:56.848808,0 days 00:04:53.109751,512,uniform,8,zero,,0.036274503392407495,288,1024,880,320,560,old,1.129578690844106,logistic,0.013057867685953775,0.013146122296651205,0.013033469518025717,0.013090292612711588,0.013135671615600586,0.012876749038696289,0.012013475100199381,0.012907663981119793,0.6264794866243998,0.019897317138604476,COMPLETE
37,0.3446323374907176,2025-09-02 13:17:56.849242,2025-09-02 13:22:05.432439,0 days 00:04:08.583197,512,normal,8,zero,,0.7026571679037953,351,704,800,288,512,Glorot,,tanh,0.012329538663228353,0.01217043399810791,0.012631654739379883,0.012764414151509603,0.012571295102437338,0.011746764183044434,0.010123451550801596,0.012048221769787015,0.3446323374907176,0.0441772099650551,COMPLETE
38,0.7444927295049032,2025-09-02 13:22:05.433047,2025-09-02 13:27:24.198479,0 days 00:05:18.765432,256,uniform,7,nz,8.244328847861404e-07,0.010843892878441716,158,992,560,864,224,Glorot,,tanh,0.013075947761535645,0.013043363889058432,0.01298681894938151,0.013040622075398764,0.012903253237406412,0.013059377670288086,0.012805620829264322,0.012987857773190453,0.7444927295049032,0.025163397526023527,COMPLETE
39,0.5057704349358877,2025-09-02 13:27:24.199119,2025-09-02 13:38:27.906322,0 days 00:11:03.707203,100,normal,7,zero,,0.019469773326576473,266,528,736,864,848,old,1.6439028897719594,tanh,0.013118704160054525,0.013028581937154135,0.01299579938252767,0.012951334317525228,0.013085762659708658,0.013011932373046875,0.012418826421101889,0.012944420178731281,0.5057704349358877,0.013381736384043606,COMPLETE
40,0.3372223873933156,2025-09-02 13:38:27.906745,2025-09-02 13:43:10.545746,0 days 00:04:42.639001,512,uniform,6,nz,3.857174781334696e-07,0.015873832288492918,3051,272,720,848,496,old,0.2695637448948679,tanh,0.013097922007242838,0.012969613075256348,0.013076583544413248,0.013156612714131674,0.012992660204569498,0.012957215309143066,0.010918180147806803,0.012738398143223353,0.3372223873933156,0.003608239600571972,COMPLETE
41,1.0183112223943074,2025-09-02 13:43:10.546179,2025-09-02 14:37:02.821185,0 days 00:53:52.275006,20,uniform,5,nz,3.386321498655938e-06,1.3449992816910692e-05,9201,992,608,304,496,Glorot,,tanh,0.013139605522155762,0.013068318367004395,0.0129087766011556,0.013039986292521158,0.013072570164998373,0.013134161631266275,0.013048251469930014,0.01305881000700451,1.0183112223943074,0.0029510732429969297,COMPLETE
42,0.18928156793117523,2025-09-02 14:37:02.821598,2025-09-02 14:47:37.360854,0 days 00:10:34.539256,100,normal,8,zero,,0.23346488990458916,9881,176,784,304,320,Glorot,,logistic,0.010742902755737305,0.010430137316385904,0.011375665664672852,0.011099616686503092,0.010834336280822754,0.009821057319641113,0.0020871559778849282,0.009484410285949707,0.18928156793117523,0.0010982404208377025,COMPLETE
43,1.0339594682057698,2025-09-02 14:47:37.361279,2025-09-02 14:53:05.694842,0 days 00:05:28.333563,256,normal,6,zero,,5.05629522128911e-05,628,672,736,128,928,Glorot,,tanh,0.013011773427327475,0.013233065605163574,0.013118624687194824,0.013163328170776367,0.013076504071553549,0.013149221738179525,0.013146162033081055,0.013128382819039481,1.0339594682057698,0.00021710090725596943,COMPLETE
44,0.9735304315884908,2025-09-02 14:53:05.695255,2025-09-02 15:03:25.042535,0 days 00:10:19.347280,100,uniform,5,zero,,0.002809133912713851,303,352,928,256,224,Glorot,,logistic,0.013042847315470377,0.01311930020650228,0.012955665588378906,0.013159235318501791,0.012916882832845053,0.013076186180114746,0.013050556182861328,0.013045810517810641,0.9735304315884908,0.006889313100644522,COMPLETE
45,1.037123680114746,2025-09-02 15:03:25.042963,2025-09-02 15:57:31.128623,0 days 00:54:06.085660,20,normal,7,nz,2.3929342013616522e-05,1.4440212061893252e-05,196,816,208,688,816,Glorot,,logistic,0.012777050336201986,0.013070185979207357,0.013141433397928873,0.013099034627278646,0.013144334157307943,0.01304455598195394,0.013062238693237305,0.013048404739016578,1.037123680114746,0.0023801493988034224,COMPLETE
46,0.4407847225666046,2025-09-02 15:57:31.129195,2025-09-02 16:01:36.408049,0 days 00:04:05.278854,256,uniform,7,zero,,0.043674173207084874,1003,816,192,384,752,old,1.8827356407489932,tanh,0.012717564900716146,0.012651681900024414,0.01298662026723226,0.013032674789428711,0.013014435768127441,0.01295475165049235,0.007333199183146159,0.012098704065595356,0.4407847225666046,0.002979114028937973,COMPLETE
47,1.0059412121772766,2025-09-02 16:01:36.408489,2025-09-02 16:06:21.912305,0 days 00:04:45.503816,512,uniform,8,nz,8.31077302228011e-06,0.00010267644470118219,9195,512,608,400,928,old,0.8595999722635594,logistic,0.013136029243469238,0.013126214345296225,0.013050516446431478,0.013101418813069662,0.013061801592508951,0.013041178385416666,0.013080596923828125,0.013085393678574336,1.0059412121772766,0.005388239079436279,COMPLETE
48,0.44605855147043866,2025-09-02 16:06:21.912734,2025-09-02 16:08:27.763431,0 days 00:02:05.850697,512,uniform,5,zero,,0.05359253345877439,522,240,352,288,240,Glorot,,tanh,0.012914101282755533,0.01295173168182373,0.013124028841654459,0.01277303695678711,0.013232986132303873,0.012816627820332846,0.009907205899556478,0.012531388373602003,0.44605855147043866,0.00917625869726916,COMPLETE
49,0.6843005418777466,2025-09-02 16:08:27.763838,2025-09-02 17:01:06.227147,0 days 00:52:38.463309,20,normal,8,zero,,0.0021677280943486516,880,384,624,384,240,Glorot,,tanh,0.013017733891805014,0.01314997673034668,0.013139645258585611,0.013061086336771647,0.012730121612548828,0.013081113497416178,0.012878139813741049,0.013008259591602142,0.6843005418777466,0.004987614300449831,COMPLETE
50,1.0319336255391438,2025-09-02 17:01:06.227579,2025-09-02 17:53:08.559138,0 days 00:52:02.331559,20,uniform,8,zero,,1.1558246302447942e-05,173,736,624,320,688,old,0.9514981945949907,logistic,0.013077696164449057,0.013137340545654297,0.013077219327290853,0.013016939163208008,0.01303259531656901,0.013190150260925293,0.013019045193990072,0.013078712281726657,1.0319336255391438,0.005278925087764054,COMPLETE
