number,value,datetime_start,datetime_complete,duration,params_batch_size,params_dist1,params_iseed,params_l2_penalty_choice,params_l2_penalty_nz,params_lr,params_lr_anneal_start,params_nhid1,params_scale_heur1,params_scale_mult1,params_squash,user_attrs_avg_fit_criteria,state,avg_fit_criteria
92,0.16294999718666076,2025-09-03 07:08:51.682476,2025-09-03 07:15:42.799757,0 days 00:06:51.117281,100,uniform,7,zero,,0.42553326264148966,1434,752,Glorot,,logistic,0.004124927520751953,COMPLETE,0.004124927520751953
93,0.19858333617448806,2025-09-03 07:15:42.800198,2025-09-03 07:22:59.022147,0 days 00:07:16.221949,100,normal,6,nz,1.4037984276411859e-07,0.9275280770652489,3986,752,Glorot,,logistic,,COMPLETE,
94,0.10000000149011612,2025-09-03 07:22:59.022625,2025-09-03 07:29:52.091453,0 days 00:06:53.068828,100,normal,7,zero,,0.47988314421263517,6967,1024,Glorot,,tanh,,COMPLETE,
95,0.5107999920845032,2025-09-03 07:29:52.091879,2025-09-03 07:36:42.733575,0 days 00:06:50.641696,100,uniform,7,zero,,0.16244041660648914,6164,720,Glorot,,logistic,3.5309791564941405e-05,COMPLETE,3.5309791564941405e-05
96,0.49074999094009397,2025-09-03 07:36:42.734028,2025-09-03 08:12:54.473064,0 days 00:36:11.739036,20,uniform,8,nz,1.0314672244552497e-07,0.03539605090911228,6576,784,Glorot,,logistic,0.0014385461807250976,COMPLETE,0.0014385461807250976
97,0.4900499999523163,2025-09-03 08:12:54.473843,2025-09-03 08:20:06.595212,0 days 00:07:12.121369,100,uniform,6,nz,5.465203567970679e-07,0.0603191373055185,2874,992,Glorot,,tanh,0.0032132863998413086,COMPLETE,0.0032132863998413086
98,0.10409999936819077,2025-09-03 08:20:06.595665,2025-09-03 08:26:55.865936,0 days 00:06:49.270271,100,uniform,7,zero,,0.7614762114056063,9728,736,Glorot,,logistic,,COMPLETE,
99,0.5021500051021576,2025-09-03 08:26:55.867614,2025-09-03 08:34:13.183750,0 days 00:07:17.316136,100,uniform,7,nz,2.2346735136354447e-08,0.1463844143619989,2919,864,Glorot,,tanh,0.0010037422180175781,COMPLETE,0.0010037422180175781
100,0.47053332924842833,2025-09-03 08:34:13.184473,2025-09-03 08:41:28.310526,0 days 00:07:15.126053,100,uniform,7,nz,1.1735360183207854e-08,0.005114162796188409,5380,848,Glorot,,tanh,0.010323739051818848,COMPLETE,0.010323739051818848
101,0.5012666523456574,2025-09-03 08:41:28.310975,2025-09-03 08:48:17.383357,0 days 00:06:49.072382,100,uniform,8,zero,,0.09797055534140793,3524,992,Glorot,,tanh,0.0018089771270751952,COMPLETE,0.0018089771270751952
102,0.5053333401679992,2025-09-03 08:48:17.383783,2025-09-03 08:55:11.551323,0 days 00:06:54.167540,100,uniform,8,zero,,0.08769027778035347,7153,880,Glorot,,tanh,0.0008390188217163086,COMPLETE,0.0008390188217163086
103,0.48903332352638246,2025-09-03 08:55:11.551752,2025-09-03 09:02:03.903734,0 days 00:06:52.351982,100,uniform,8,zero,,0.04621907731804279,4908,784,Glorot,,tanh,0.0021750688552856444,COMPLETE,0.0021750688552856444
104,0.10000000149011612,2025-09-03 09:02:03.904175,2025-09-03 09:08:54.404829,0 days 00:06:50.500654,100,uniform,6,zero,,0.8563274185845325,5266,992,Glorot,,tanh,,COMPLETE,
105,0.43190000057220457,2025-09-03 09:08:54.405626,2025-09-03 09:16:13.184715,0 days 00:07:18.779089,100,normal,7,nz,6.262102460992329e-07,0.0049502955280663835,9201,784,Glorot,,logistic,0.01139671802520752,COMPLETE,0.01139671802520752
106,0.5019333243370057,2025-09-03 09:16:13.185162,2025-09-03 09:23:08.468857,0 days 00:06:55.283695,100,uniform,8,zero,,0.09226662156577553,2015,976,old,0.20792733799389107,tanh,0.003623557090759277,COMPLETE,0.003623557090759277
107,0.1827833354473114,2025-09-03 09:23:08.469297,2025-09-03 09:29:58.654203,0 days 00:06:50.184906,100,uniform,8,zero,,0.26973405107753884,2654,976,old,0.260457519606741,tanh,,COMPLETE,
108,0.49704999923706056,2025-09-03 09:29:58.654659,2025-09-03 09:37:13.377236,0 days 00:07:14.722577,100,uniform,7,nz,1.1003393865547256e-07,0.18213187985604617,1486,880,Glorot,,tanh,0.0016137361526489258,COMPLETE,0.0016137361526489258
109,0.48351665735244753,2025-09-03 09:37:13.377684,2025-09-03 09:44:29.892607,0 days 00:07:16.514923,100,uniform,7,nz,1.0600776249236485e-07,0.17796065451951862,586,1024,Glorot,,tanh,0.003934502601623535,COMPLETE,0.003934502601623535
110,0.49513332843780516,2025-09-03 09:44:29.893064,2025-09-03 10:18:39.540690,0 days 00:34:09.647626,20,uniform,7,zero,,0.06151456887439671,4834,736,Glorot,,tanh,0.0011018276214599609,COMPLETE,0.0011018276214599609
111,0.5071166634559632,2025-09-03 10:18:39.541128,2025-09-03 10:25:57.119942,0 days 00:07:17.578814,100,uniform,7,nz,1.617434950719609e-07,0.09682035007722728,5001,944,old,0.2435658238802653,logistic,0.0008888483047485351,COMPLETE,0.0008888483047485351
112,0.22864999771118164,2025-09-03 10:25:57.120387,2025-09-03 10:33:12.879411,0 days 00:07:15.759024,100,uniform,7,nz,1.3832434414453417e-07,0.2644143075147755,3598,976,old,0.24956112640541547,logistic,0.0004891157150268555,COMPLETE,0.0004891157150268555
113,0.426399989426136,2025-09-03 10:33:12.879865,2025-09-03 10:40:30.834653,0 days 00:07:17.954788,100,uniform,7,nz,8.543474376881245e-08,0.460961748039395,2403,704,Glorot,,tanh,,COMPLETE,
114,0.5147333264350891,2025-09-03 10:40:30.835380,2025-09-03 10:47:48.337051,0 days 00:07:17.501671,100,uniform,7,nz,4.661749761445448e-07,0.18280029277861345,7014,912,old,0.26978243157613563,tanh,0.00020074844360351562,COMPLETE,0.00020074844360351562
115,0.10000000149011612,2025-09-03 10:47:48.337966,2025-09-03 10:55:03.594664,0 days 00:07:15.256698,100,uniform,7,nz,9.604672288817017e-07,0.6208872852028946,3852,816,old,0.2164631363280407,tanh,,COMPLETE,
116,0.46146665811538695,2025-09-03 10:55:03.595130,2025-09-03 11:01:55.313662,0 days 00:06:51.718532,100,uniform,5,zero,,0.01304652070765161,3041,880,Glorot,,tanh,0.007390117645263672,COMPLETE,0.007390117645263672
117,0.506333327293396,2025-09-03 11:01:55.314461,2025-09-03 11:35:59.621191,0 days 00:34:04.306730,20,uniform,8,zero,,0.11747159287315295,4100,928,Glorot,,tanh,0.0006217479705810547,COMPLETE,0.0006217479705810547
118,0.36838332414627073,2025-09-03 11:35:59.621628,2025-09-03 12:09:48.153049,0 days 00:33:48.531421,20,uniform,8,zero,,0.00036177894507348967,1700,1024,Glorot,,tanh,0.012990736961364746,COMPLETE,0.012990736961364746
119,0.10000000149011612,2025-09-03 12:09:48.154040,2025-09-03 12:43:57.910444,0 days 00:34:09.756404,20,uniform,8,zero,,0.31259311296075537,8382,864,Glorot,,tanh,,COMPLETE,
120,0.4668500006198883,2025-09-03 12:43:57.911321,2025-09-03 12:50:48.354750,0 days 00:06:50.443429,100,uniform,7,zero,,0.014641392444331592,7839,864,Glorot,,tanh,0.004177594184875488,COMPLETE,0.004177594184875488
121,0.5057000041007995,2025-09-03 12:50:48.355654,2025-09-03 12:58:03.156542,0 days 00:07:14.800888,100,uniform,8,nz,2.66784934031404e-07,0.03722926312233024,7407,1008,old,0.20225067019820428,tanh,0.003491377830505371,COMPLETE,0.003491377830505371
122,0.4395333230495453,2025-09-03 12:58:03.156997,2025-09-03 13:05:23.071447,0 days 00:07:19.914450,100,uniform,8,nz,1.0882307550879858e-06,0.011577500328826764,4489,864,old,0.20509033603602733,logistic,0.010126471519470215,COMPLETE,0.010126471519470215
123,0.44693332314491274,2025-09-03 13:05:23.071910,2025-09-03 13:12:43.397770,0 days 00:07:20.325860,100,uniform,8,nz,5.1228162116678e-07,0.00047847592979897134,7663,880,old,0.42626049307563424,tanh,0.013054990768432617,COMPLETE,0.013054990768432617
124,0.47729999423027036,2025-09-03 13:12:43.398209,2025-09-03 13:19:36.764921,0 days 00:06:53.366712,100,uniform,5,zero,,0.05263304199811586,409,864,old,0.20173317668242452,tanh,0.009665155410766601,COMPLETE,0.009665155410766601
125,0.47521665692329407,2025-09-03 13:19:36.765381,2025-09-03 13:53:45.177092,0 days 00:34:08.411711,20,normal,8,zero,,0.028729486122101133,2257,768,Glorot,,tanh,0.004517579078674316,COMPLETE,0.004517579078674316
126,0.5164000034332276,2025-09-03 13:53:45.177839,2025-09-03 14:00:36.470444,0 days 00:06:51.292605,100,uniform,8,zero,,0.27222205625263113,4106,992,Glorot,,tanh,0.00016014575958251954,COMPLETE,0.00016014575958251954
127,0.5134166598320007,2025-09-03 14:00:36.470897,2025-09-03 14:07:31.031002,0 days 00:06:54.560105,100,uniform,7,zero,,0.10341477147965643,6129,848,old,0.459207935275017,logistic,0.00033066272735595705,COMPLETE,0.00033066272735595705
