number,value,datetime_start,datetime_complete,duration,params_batch_size,params_dist1,params_iseed,params_l2_penalty_choice,params_l2_penalty_nz,params_lr,params_lr_anneal_start,params_nhid1,params_scale_heur1,params_scale_mult1,params_squash,user_attrs_avg_fit_criteria,state,avg_fit_criteria
0,0.4335499942302704,2025-09-02 03:15:56.021813,2025-09-02 03:23:01.736777,0 days 00:07:05.714964,100,normal,8,zero,,0.012611815565767931,2659,832,old,1.1017912259422258,logistic,0.01153116226196289,COMPLETE,0.01153116226196289
1,0.47669999599456786,2025-09-02 03:23:01.737286,2025-09-02 04:00:20.932171,0 days 00:37:19.194885,20,uniform,6,nz,2.0547199328558857e-07,0.16396997761073914,743,192,old,1.2225775747269245,logistic,0.00101926326751709,COMPLETE,0.00101926326751709
2,0.24256666898727416,2025-09-02 04:00:20.932708,2025-09-02 04:07:28.885568,0 days 00:07:07.952860,100,uniform,5,zero,,9.506281571106352e-05,1011,288,Glorot,,logistic,0.01307992935180664,COMPLETE,0.01307992935180664
3,0.2587666571140289,2025-09-02 04:07:28.886078,2025-09-02 04:43:32.110526,0 days 00:36:03.224448,20,uniform,8,nz,3.340579416277081e-05,2.1049515830306782e-06,798,992,Glorot,,tanh,0.013106513023376464,COMPLETE,0.013106513023376464
4,0.4531333327293396,2025-09-02 04:43:32.110978,2025-09-02 04:50:18.180435,0 days 00:06:46.069457,100,normal,8,zero,,0.005680937610553498,2579,496,Glorot,,tanh,0.011788582801818848,COMPLETE,0.011788582801818848
5,0.4722333252429962,2025-09-02 04:50:18.180850,2025-09-02 05:24:11.229618,0 days 00:33:53.048768,20,normal,7,zero,,0.040058969243291886,2604,992,Glorot,,logistic,0.005734562873840332,COMPLETE,0.005734562873840332
6,0.2524333357810974,2025-09-02 05:24:11.230445,2025-09-02 05:30:59.897400,0 days 00:06:48.666955,100,uniform,8,zero,,1.2460411629798946e-05,6359,416,Glorot,,logistic,0.013061809539794921,COMPLETE,0.013061809539794921
7,0.26359999775886533,2025-09-02 05:30:59.897824,2025-09-02 05:37:51.643622,0 days 00:06:51.745798,100,normal,5,zero,,6.369821113063238e-06,9757,720,old,0.5115210082666259,tanh,0.013095736503601074,COMPLETE,0.013095736503601074
8,0.2625333309173584,2025-09-02 05:37:51.644064,2025-09-02 06:11:40.175300,0 days 00:33:48.531236,20,uniform,6,zero,,4.4654883954691955e-06,3564,416,old,0.6601759155814514,tanh,0.013093256950378418,COMPLETE,0.013093256950378418
9,0.39918332695961,2025-09-02 06:11:40.176357,2025-09-02 06:18:53.203600,0 days 00:07:13.027243,100,uniform,8,nz,1.5621204728163365e-06,0.0036346950323246753,538,928,Glorot,,tanh,0.01300961971282959,COMPLETE,0.01300961971282959
10,0.32854999899864196,2025-09-02 06:18:53.204028,2025-09-02 06:54:57.023805,0 days 00:36:03.819777,20,uniform,5,nz,5.7833085248908403e-08,0.0007135089719871662,487,576,Glorot,,tanh,0.013008666038513184,COMPLETE,0.013008666038513184
11,0.3425499975681305,2025-09-02 06:54:57.024228,2025-09-02 07:29:09.670534,0 days 00:34:12.646306,20,normal,8,zero,,0.00043340174043252305,365,976,old,0.273941419851531,tanh,0.013119029998779296,COMPLETE,0.013119029998779296
12,0.38053332567214965,2025-09-02 07:29:09.670971,2025-09-02 07:35:58.562737,0 days 00:06:48.891766,100,uniform,5,zero,,0.006036687230540028,518,496,old,0.8331442788576597,logistic,0.012823343276977539,COMPLETE,0.012823343276977539
13,0.23873333036899566,2025-09-02 07:35:58.563163,2025-09-02 07:43:13.303830,0 days 00:07:14.740667,100,uniform,7,nz,1.367989792242663e-08,7.091274531602468e-06,1569,384,Glorot,,logistic,0.01306898593902588,COMPLETE,0.01306898593902588
14,0.3372166633605957,2025-09-02 07:43:13.304269,2025-09-02 07:50:00.891150,0 days 00:06:47.586881,100,normal,5,zero,,0.013094244682014585,301,160,old,1.3330847803202919,logistic,0.011879301071166993,COMPLETE,0.011879301071166993
15,0.2633999943733215,2025-09-02 07:50:00.892103,2025-09-02 07:57:20.959730,0 days 00:07:20.067627,100,normal,6,nz,1.2134601472469401e-05,0.0002887138756286331,121,592,old,0.33709258675285036,tanh,0.013090920448303223,COMPLETE,0.013090920448303223
16,0.4815999925136566,2025-09-02 07:57:20.960171,2025-09-02 08:04:07.711925,0 days 00:06:46.751754,100,uniform,7,zero,,0.0856956409647669,1799,352,Glorot,,logistic,0.0011306524276733399,COMPLETE,0.0011306524276733399
17,0.25694999396800994,2025-09-02 08:04:07.712352,2025-09-02 08:10:58.600571,0 days 00:06:50.888219,100,uniform,5,zero,,9.318544447640828e-06,368,576,Glorot,,tanh,0.013023114204406739,COMPLETE,0.013023114204406739
18,0.3484999895095825,2025-09-02 08:10:58.601442,2025-09-02 08:17:48.163543,0 days 00:06:49.562101,100,uniform,5,zero,,0.00026913942522638486,9984,928,old,1.1287749591948544,logistic,0.0129441499710083,COMPLETE,0.0129441499710083
19,0.3916999936103821,2025-09-02 08:17:48.164490,2025-09-02 08:53:37.716942,0 days 00:35:49.552452,20,uniform,7,nz,0.006148641099918832,0.022461343267204566,8862,832,old,0.4495867877664373,logistic,3.371238708496094e-05,COMPLETE,3.371238708496094e-05
20,0.2127666652202606,2025-09-02 08:53:37.717695,2025-09-02 09:29:21.310540,0 days 00:35:43.592845,20,uniform,6,nz,5.557110625815338e-07,0.8553545793157464,876,368,old,1.9062151263692741,logistic,0.014072394371032715,COMPLETE,0.014072394371032715
21,0.1792166694998741,2025-09-02 09:29:21.311016,2025-09-02 10:03:18.197751,0 days 00:33:56.886735,20,normal,7,zero,,0.4263388353958704,8676,992,Glorot,,logistic,0.0014570236206054687,COMPLETE,0.0014570236206054687
22,0.49438331723213197,2025-09-02 10:03:18.198197,2025-09-02 10:10:11.116874,0 days 00:06:52.918677,100,uniform,7,zero,,0.3071199067326472,787,560,Glorot,,logistic,0.0007334232330322265,COMPLETE,0.0007334232330322265
23,0.4256666600704193,2025-09-02 10:10:11.117318,2025-09-02 10:17:03.630823,0 days 00:06:52.513505,100,uniform,7,zero,,0.0480290023575437,462,736,Glorot,,logistic,0.011753034591674805,COMPLETE,0.011753034591674805
24,0.3641333281993866,2025-09-02 10:17:03.631648,2025-09-02 10:53:12.365029,0 days 00:36:08.733381,20,uniform,6,nz,0.00018578494857648698,0.002642127435929138,307,304,old,1.5999903293502336,tanh,0.013012433052062988,COMPLETE,0.013012433052062988
25,0.4759499907493591,2025-09-02 10:53:12.366140,2025-09-02 10:59:57.312989,0 days 00:06:44.946849,100,uniform,7,zero,,0.4461903333766245,771,176,Glorot,,logistic,1.1849403381347657e-05,COMPLETE,1.1849403381347657e-05
26,0.3330166608095169,2025-09-02 10:59:57.313412,2025-09-02 11:07:10.904366,0 days 00:07:13.590954,100,uniform,7,nz,4.714291826621601e-07,0.5676645926708933,780,496,Glorot,,tanh,,COMPLETE,
27,0.41688331961631775,2025-09-02 11:07:10.904798,2025-09-02 11:14:01.010048,0 days 00:06:50.105250,100,uniform,7,zero,,0.0037393856086724883,6465,304,Glorot,,logistic,0.011137604713439941,COMPLETE,0.011137604713439941
28,0.1192166656255722,2025-09-02 11:14:01.010869,2025-09-02 11:20:53.265103,0 days 00:06:52.254234,100,uniform,7,zero,,0.5997734682761373,1829,656,old,1.5465396902320876,logistic,0.0008069038391113281,COMPLETE,0.0008069038391113281
29,0.17959999442100524,2025-09-02 11:20:53.265930,2025-09-02 11:27:41.730379,0 days 00:06:48.464449,100,uniform,6,zero,,0.6056875292227931,1123,480,Glorot,,logistic,0.044097065925598145,COMPLETE,0.044097065925598145
30,0.4474999964237213,2025-09-02 11:27:41.730839,2025-09-02 12:01:29.621251,0 days 00:33:47.890412,20,uniform,6,zero,,0.023711908603739555,2498,224,old,1.9940378943371506,logistic,0.004620051383972168,COMPLETE,0.004620051383972168
31,0.47408332824707033,2025-09-02 12:01:29.621677,2025-09-02 12:35:29.675452,0 days 00:34:00.053775,20,uniform,7,zero,,0.21431603997307602,505,320,Glorot,,logistic,0.0022587299346923826,COMPLETE,0.0022587299346923826
32,0.42643333673477174,2025-09-02 12:35:29.676365,2025-09-02 12:42:21.916731,0 days 00:06:52.240366,100,normal,7,zero,,0.04849610847271431,625,160,Glorot,,logistic,0.007450032234191895,COMPLETE,0.007450032234191895
33,0.4913999974727631,2025-09-02 12:42:21.917163,2025-09-02 13:18:13.611376,0 days 00:35:51.694213,20,uniform,5,nz,1.0864082533873283e-08,0.4025954449711572,540,128,Glorot,,logistic,0.0001312255859375,COMPLETE,0.0001312255859375
34,0.3261666685342789,2025-09-02 13:18:13.612014,2025-09-02 13:54:18.201130,0 days 00:36:04.589116,20,normal,5,nz,1.0370351049901808e-08,0.7604353369397849,245,272,Glorot,,tanh,,COMPLETE,
35,0.33214999437332154,2025-09-02 13:54:18.201907,2025-09-02 14:30:17.658899,0 days 00:35:59.456992,20,uniform,5,nz,9.231983002707582e-08,0.021603553925186487,119,208,Glorot,,logistic,0.012276315689086914,COMPLETE,0.012276315689086914
36,0.47463332414627074,2025-09-02 14:30:17.659350,2025-09-02 14:37:30.938384,0 days 00:07:13.279034,100,uniform,5,nz,1.3851156287889407e-08,0.07669517066408582,1652,240,Glorot,,logistic,0.0011913299560546875,COMPLETE,0.0011913299560546875
37,0.4171333372592926,2025-09-02 14:37:30.939285,2025-09-02 15:13:33.368895,0 days 00:36:02.429610,20,uniform,8,nz,7.980783437200292e-07,0.02002361285698574,729,240,Glorot,,logistic,0.010160493850708007,COMPLETE,0.010160493850708007
38,0.45208332538604734,2025-09-02 15:13:33.369360,2025-09-02 15:49:36.712680,0 days 00:36:03.343320,20,normal,7,nz,2.0430610322062692e-07,0.049675559368383554,1252,176,old,1.040976381102477,logistic,0.0033494234085083008,COMPLETE,0.0033494234085083008
39,0.47739999294281005,2025-09-02 15:49:36.713125,2025-09-02 16:25:33.474246,0 days 00:35:56.761121,20,uniform,5,nz,5.100269514642725e-06,0.14547682428213893,521,128,Glorot,,tanh,0.0012964487075805664,COMPLETE,0.0012964487075805664
40,0.4764166593551636,2025-09-02 16:25:33.474688,2025-09-02 16:59:31.650102,0 days 00:33:58.175414,20,uniform,5,zero,,0.05121868195371463,878,320,Glorot,,tanh,0.003827190399169922,COMPLETE,0.003827190399169922
41,0.1678833320736885,2025-09-02 16:59:31.650549,2025-09-02 17:35:32.858200,0 days 00:36:01.207651,20,uniform,5,nz,1.1510310174827791e-05,0.9937500198829876,621,400,Glorot,,logistic,,COMPLETE,
42,0.4790499985218048,2025-09-02 17:35:32.858677,2025-09-02 18:11:26.445313,0 days 00:35:53.586636,20,uniform,5,nz,2.8202136431696503e-06,0.24248777844573435,665,128,old,1.4381709758603656,tanh,0.0004184484481811523,COMPLETE,0.0004184484481811523
43,0.479749995470047,2025-09-02 18:11:26.446008,2025-09-02 18:47:29.783552,0 days 00:36:03.337544,20,uniform,5,nz,7.075018441562516e-06,0.40032098722582904,798,160,old,1.5796430206456165,tanh,4.527568817138672e-05,COMPLETE,4.527568817138672e-05
44,0.4641166627407074,2025-09-02 18:47:29.784472,2025-09-02 18:54:43.155390,0 days 00:07:13.370918,100,uniform,5,nz,0.00031381153449196294,0.37842493497548657,755,192,old,1.5939820051265141,tanh,2.7418136596679688e-06,COMPLETE,2.7418136596679688e-06
45,0.4810333251953125,2025-09-02 18:54:43.155830,2025-09-02 19:30:33.377167,0 days 00:35:50.221337,20,uniform,5,nz,2.4821233850152328e-05,0.162742267446781,749,144,old,1.5352801618445202,logistic,0.0006505489349365234,COMPLETE,0.0006505489349365234
46,0.48896666169166564,2025-09-02 19:30:33.377922,2025-09-02 20:06:23.045486,0 days 00:35:49.667564,20,uniform,5,nz,9.021794679530112e-05,0.22914211998006037,975,160,old,1.7182032366397146,logistic,1.125335693359375e-05,COMPLETE,1.125335693359375e-05
47,0.3103500008583069,2025-09-02 20:06:23.045959,2025-09-02 20:42:23.589041,0 days 00:36:00.543082,20,uniform,5,nz,0.00035288687775932807,0.0017223604981865947,788,384,old,1.9712951216895218,logistic,0.012775540351867676,COMPLETE,0.012775540351867676
48,0.43266666531562803,2025-09-02 20:42:23.589511,2025-09-02 21:18:21.562695,0 days 00:35:57.973184,20,uniform,5,nz,0.00014906660994481392,0.019886075188191722,1714,160,old,1.7207243894289181,logistic,0.006233739852905274,COMPLETE,0.006233739852905274
49,0.48964999318122865,2025-09-02 21:18:21.563140,2025-09-02 21:25:34.918751,0 days 00:07:13.355611,100,uniform,7,nz,9.501204658307976e-05,0.4792458754073445,883,256,old,1.406469533896255,logistic,4.851818084716797e-05,COMPLETE,4.851818084716797e-05
50,0.41783332228660586,2025-09-02 21:25:34.919688,2025-09-02 21:32:47.928929,0 days 00:07:13.009241,100,uniform,7,nz,0.0019849241762446303,0.027605680139188047,491,304,old,1.2773809765999258,logistic,0.010906147956848144,COMPLETE,0.010906147956848144
51,0.44943333268165586,2025-09-02 21:32:47.929386,2025-09-02 22:08:35.765558,0 days 00:35:47.836172,20,uniform,5,nz,7.729667657514092e-05,0.25460851457959954,244,160,old,1.5528264520206707,logistic,0.0032126665115356444,COMPLETE,0.0032126665115356444
52,0.4840833306312561,2025-09-02 22:08:35.766327,2025-09-02 22:15:50.967245,0 days 00:07:15.200918,100,uniform,8,nz,7.955199278191164e-05,0.2486634856710626,856,224,old,1.6331102957619805,logistic,0.0001087188720703125,COMPLETE,0.0001087188720703125
53,0.4734166622161865,2025-09-02 22:15:50.967705,2025-09-02 22:23:08.082616,0 days 00:07:17.114911,100,normal,8,nz,0.00020777654682918402,0.23348510057991792,604,240,old,1.7567707863064252,logistic,0.0004559040069580078,COMPLETE,0.0004559040069580078
54,0.46023333072662354,2025-09-02 22:23:08.083064,2025-09-02 22:58:46.578014,0 days 00:35:38.494950,20,normal,5,nz,0.00013084349768387028,0.037329733497786496,2240,224,Glorot,,logistic,0.0024291038513183593,COMPLETE,0.0024291038513183593
55,0.4344833314418793,2025-09-02 22:58:46.578935,2025-09-02 23:05:58.553036,0 days 00:07:11.974101,100,uniform,8,nz,9.308967878985016e-05,0.058486911751331506,568,336,old,1.7614820775080031,logistic,0.009193944931030273,COMPLETE,0.009193944931030273
56,0.4899333298206329,2025-09-02 23:05:58.553925,2025-09-02 23:13:12.309814,0 days 00:07:13.755889,100,uniform,8,nz,0.0008848180352459445,0.45409606644030287,2485,160,old,1.4037220582922418,logistic,0.05623972415924072,COMPLETE,0.05623972415924072
57,0.4692833244800568,2025-09-02 23:13:12.310580,2025-09-02 23:20:01.349668,0 days 00:06:49.039088,100,uniform,8,zero,,0.37585653712403716,3890,160,old,1.330177666717989,logistic,9.059906005859375e-07,COMPLETE,9.059906005859375e-07
58,0.4684333264827728,2025-09-02 23:20:01.350118,2025-09-02 23:27:15.996113,0 days 00:07:14.645995,100,uniform,7,nz,0.0010378513198458764,0.5696175865756267,2387,304,old,1.3494471678005107,logistic,0.23481953144073486,COMPLETE,0.23481953144073486
59,0.48061665892601013,2025-09-02 23:27:15.996589,2025-09-02 23:34:30.757437,0 days 00:07:14.760848,100,uniform,5,nz,0.0008614345848439331,0.47384862903178737,1383,160,old,1.5050786946117027,logistic,0.026251459121704103,COMPLETE,0.026251459121704103
60,0.4885833263397217,2025-09-02 23:34:30.757883,2025-09-02 23:41:40.749174,0 days 00:07:09.991291,100,uniform,8,nz,9.064259860315988e-05,0.5271204738838914,2745,208,old,1.159276961074878,logistic,7.338523864746094e-05,COMPLETE,7.338523864746094e-05
61,0.4706833243370056,2025-09-02 23:41:40.750056,2025-09-02 23:48:54.542995,0 days 00:07:13.792939,100,uniform,8,nz,0.00010774292827071889,0.09232735528673648,3852,144,old,1.2215238436651719,logistic,-1.1324882507324219e-05,COMPLETE,-1.1324882507324219e-05
62,0.481549996137619,2025-09-02 23:48:54.543881,2025-09-02 23:56:09.371821,0 days 00:07:14.827940,100,uniform,8,nz,6.194627851760204e-05,0.44119148320245627,1192,192,Glorot,,logistic,4.076957702636719e-06,COMPLETE,4.076957702636719e-06
63,0.49126666188240053,2025-09-02 23:56:09.372290,2025-09-03 00:03:23.736977,0 days 00:07:14.364687,100,uniform,8,nz,6.619618519369156e-05,0.17611609766241776,5551,384,old,1.1639724359356143,tanh,-4.76837158203125e-08,COMPLETE,-4.76837158203125e-08
64,0.16283333003520967,2025-09-03 00:03:23.737914,2025-09-03 00:10:13.136173,0 days 00:06:49.398259,100,normal,7,zero,,0.45271828931545494,889,752,Glorot,,logistic,0.0006952047348022461,COMPLETE,0.0006952047348022461
65,0.4805833280086517,2025-09-03 00:10:13.139163,2025-09-03 00:44:02.783596,0 days 00:33:49.644433,20,uniform,8,zero,,0.2713250556642005,482,144,old,1.058528069354056,logistic,0.000546574592590332,COMPLETE,0.000546574592590332
66,0.48996666073799133,2025-09-03 00:44:02.784031,2025-09-03 01:20:02.706513,0 days 00:35:59.922482,20,normal,8,nz,5.736669249150164e-05,0.04673946592173863,9609,400,old,1.013940876471878,tanh,0.0002429485321044922,COMPLETE,0.0002429485321044922
67,0.4856833219528198,2025-09-03 01:20:02.707341,2025-09-03 01:56:02.781482,0 days 00:36:00.074141,20,normal,8,nz,1.1252702044509968e-08,0.046785795645220035,7124,448,old,0.9318335584667679,tanh,0.0005873441696166992,COMPLETE,0.0005873441696166992
68,0.4956666588783264,2025-09-03 01:56:02.781938,2025-09-03 02:03:15.512162,0 days 00:07:12.730224,100,uniform,8,nz,0.002125357814126822,0.12746182014280832,3858,400,old,0.8346556138934186,tanh,0.10031797885894775,COMPLETE,0.10031797885894775
69,0.4329333245754242,2025-09-03 02:03:15.513935,2025-09-03 02:10:30.488800,0 days 00:07:14.974865,100,uniform,8,nz,0.007207955658795906,0.06001479261263307,9541,480,old,0.6637330601786671,tanh,0.0033286571502685546,COMPLETE,0.0033286571502685546
70,0.4428500056266785,2025-09-03 02:10:30.489260,2025-09-03 02:17:43.771011,0 days 00:07:13.281751,100,uniform,6,nz,0.005412486759470948,0.04567620325453174,3819,352,old,0.8259286429940704,tanh,0.00806429386138916,COMPLETE,0.00806429386138916
71,0.10000000149011612,2025-09-03 02:17:43.771481,2025-09-03 02:24:34.032001,0 days 00:06:50.260520,100,uniform,8,zero,,0.702429102852504,5817,400,old,0.8523362590010852,tanh,,COMPLETE,
72,0.4637166619300842,2025-09-03 02:24:34.033123,2025-09-03 02:58:24.436037,0 days 00:33:50.402914,20,normal,7,zero,,0.4357832085254581,6650,128,old,0.9793641242321091,tanh,0.003818821907043457,COMPLETE,0.003818821907043457
73,0.35174999833106996,2025-09-03 02:58:24.436487,2025-09-03 03:05:38.091276,0 days 00:07:13.654789,100,normal,8,nz,0.0011479592587845338,0.0002526024398631274,4445,368,old,1.0564078158114634,tanh,0.012857413291931153,COMPLETE,0.012857413291931153
74,0.46976666450500487,2025-09-03 03:05:38.092084,2025-09-03 03:12:51.841523,0 days 00:07:13.749439,100,uniform,8,nz,0.0013937965007038463,0.010451337402468284,2417,416,Glorot,,tanh,0.008147430419921876,COMPLETE,0.008147430419921876
75,0.4584666609764099,2025-09-03 03:12:51.841950,2025-09-03 03:20:06.682594,0 days 00:07:14.840644,100,normal,7,nz,3.0674629873271675e-05,0.029157232538872715,7352,304,old,1.2084930331464785,tanh,0.0006631135940551758,COMPLETE,0.0006631135940551758
76,0.46106666326522827,2025-09-03 03:20:06.683029,2025-09-03 03:56:07.277567,0 days 00:36:00.594538,20,uniform,7,nz,0.0005820522419839282,0.0014651839908730387,5360,448,old,0.7185687727412682,tanh,0.012120795249938966,COMPLETE,0.012120795249938966
77,0.10000000149011612,2025-09-03 03:56:07.278015,2025-09-03 04:03:22.378597,0 days 00:07:15.100582,100,uniform,8,nz,1.3240225647472753e-08,0.8451283771224717,3716,208,old,1.2087723781573125,tanh,,COMPLETE,
78,0.4756499946117401,2025-09-03 04:03:22.379034,2025-09-03 04:39:33.087638,0 days 00:36:10.708604,20,normal,6,nz,3.4584413183474224e-05,0.014687995855863688,5091,560,old,0.9242005679772182,tanh,0.003411531448364258,COMPLETE,0.003411531448364258
79,0.4813166558742523,2025-09-03 04:39:33.091730,2025-09-03 05:15:36.357219,0 days 00:36:03.265489,20,normal,8,nz,0.0004499489039535237,0.024865895487528256,8814,384,old,1.2869532179247736,logistic,5.016326904296875e-05,COMPLETE,5.016326904296875e-05
80,0.48896666169166564,2025-09-03 05:15:36.357677,2025-09-03 05:22:55.322270,0 days 00:07:18.964593,100,normal,8,nz,3.419527702999513e-05,0.22533375457544746,2686,384,old,0.6956644816260245,tanh,5.171298980712891e-05,COMPLETE,5.171298980712891e-05
81,0.4731666624546051,2025-09-03 05:22:55.322749,2025-09-03 05:59:01.668789,0 days 00:36:06.346040,20,normal,8,nz,2.1791703629374904e-05,0.26501436281244567,9936,368,Glorot,,tanh,0.007239222526550293,COMPLETE,0.007239222526550293
82,0.4713999927043915,2025-09-03 05:59:01.669256,2025-09-03 06:06:17.017816,0 days 00:07:15.348560,100,normal,8,nz,2.599201945475659e-05,0.21338926250709458,7999,240,old,0.5309599919242419,tanh,-2.9802322387695312e-06,COMPLETE,-2.9802322387695312e-06
83,0.4952166676521301,2025-09-03 06:06:17.018531,2025-09-03 06:13:10.095781,0 days 00:06:53.077250,100,uniform,7,zero,,0.13958924781473786,2243,656,Glorot,,logistic,0.0006106853485107422,COMPLETE,0.0006106853485107422
84,0.5062500059604644,2025-09-03 06:13:10.096216,2025-09-03 06:20:02.809833,0 days 00:06:52.713617,100,uniform,7,zero,,0.13740738349458073,3403,800,Glorot,,logistic,0.00038847923278808596,COMPLETE,0.00038847923278808596
85,0.20496666431427002,2025-09-03 06:20:02.810617,2025-09-03 06:26:53.508984,0 days 00:06:50.698367,100,uniform,8,zero,,0.39680433796015,5866,784,Glorot,,logistic,0.0010595083236694335,COMPLETE,0.0010595083236694335
86,0.5072999954223633,2025-09-03 06:26:53.509929,2025-09-03 06:33:46.079358,0 days 00:06:52.569429,100,uniform,7,zero,,0.23730031311501987,2681,928,Glorot,,tanh,0.0005402326583862305,COMPLETE,0.0005402326583862305
87,0.41793332695961,2025-09-03 06:33:46.080037,2025-09-03 06:40:34.576273,0 days 00:06:48.496236,100,uniform,7,zero,,0.004221973060351624,4588,1024,Glorot,,logistic,0.01244370937347412,COMPLETE,0.01244370937347412
88,0.10000000149011612,2025-09-03 06:40:34.576708,2025-09-03 06:47:25.978609,0 days 00:06:51.401901,100,uniform,7,zero,,0.7298779998705637,1253,896,Glorot,,tanh,,COMPLETE,
89,0.5098999977111817,2025-09-03 06:47:25.979046,2025-09-03 06:54:14.083454,0 days 00:06:48.104408,100,uniform,7,zero,,0.19193943692559967,3966,736,Glorot,,logistic,4.3439865112304685e-05,COMPLETE,4.3439865112304685e-05
90,0.5198166608810425,2025-09-03 06:54:14.083887,2025-09-03 07:01:33.863072,0 days 00:07:19.779185,100,uniform,7,nz,9.610575880809985e-08,0.2811412807031924,7554,704,Glorot,,logistic,0.00029702186584472655,COMPLETE,0.00029702186584472655
91,0.2546666651964188,2025-09-03 07:01:33.863531,2025-09-03 07:08:51.681658,0 days 00:07:17.818127,100,uniform,7,nz,7.958372461589507e-08,0.7253299536738121,8908,624,Glorot,,logistic,0.0011816978454589843,COMPLETE,0.0011816978454589843
