number,value,datetime_start,datetime_complete,duration,params_batch_size,params_colnorm_thresh,params_dist1,params_iseed,params_l2_penalty_choice,params_l2_penalty_nz,params_lr,params_lr_anneal_start,params_nhid1,params_nhid2,params_nhid3,params_pca_energy,params_preproc,params_scale_heur1,params_scale_mult1,params_squash,user_attrs_avg_fit_criteria,user_attrs_ed_cl1_mean,user_attrs_ed_cl2_mean,user_attrs_ed_cl3_mean,state,avg_fit_criteria,ed_cl1_mean,ed_cl2_mean,ed_cl3_mean
112,0.11280645579099655,2025-08-25 16:55:50.959759,2025-08-25 17:01:21.608874,0 days 00:05:30.649115,100,1.7441656182229607e-05,normal,5,zero,,0.0006707518306306594,499,624,576,192,,colnorm,Glorot,,tanh,0.01314404805501302,0.013085603713989258,0.013145661354064942,0.013200879096984863,COMPLETE,0.01314404805501302,0.013085603713989258,0.013145661354064942,0.013200879096984863
113,0.73275808095932,2025-08-25 17:01:21.609175,2025-08-25 17:28:31.218840,0 days 00:27:09.609665,20,,uniform,5,zero,,0.28515435148771523,2149,720,304,1008,0.7902953685970416,pca,old,1.9391985264658271,tanh,0.0016408602396647135,-3.926753997802734e-05,0.0001346588134765625,0.004827189445495606,COMPLETE,0.0016408602396647135,-3.926753997802734e-05,0.0001346588134765625,0.004827189445495606
114,0.112693552672863,2025-08-25 17:28:31.219233,2025-08-25 17:33:57.631729,0 days 00:05:26.412496,100,,normal,5,zero,,0.001234042288951053,5868,112,48,384,0.7471181705245546,pca,old,1.4661189703538995,logistic,0.012999367713928222,0.013178825378417969,0.012744760513305664,0.013074517250061035,COMPLETE,0.012999367713928222,0.013178825378417969,0.012744760513305664,0.013074517250061035
115,0.112693552672863,2025-08-25 17:33:57.632014,2025-08-25 17:39:24.589412,0 days 00:05:26.957398,100,0.00021678771507405815,uniform,5,zero,,0.011841837603657143,3072,160,848,560,,colnorm,old,1.2288533631939245,logistic,0.013181535402933757,0.013465142250061036,0.013197946548461913,0.01288151741027832,COMPLETE,0.013181535402933757,0.013465142250061036,0.013197946548461913,0.01288151741027832
116,0.112693552672863,2025-08-25 17:39:24.589707,2025-08-25 17:45:05.587920,0 days 00:05:40.998213,100,,normal,5,nz,2.122958772556124e-05,0.00011245497648023927,4640,496,592,784,,raw,Glorot,,tanh,0.013110748926798504,0.01291651725769043,0.013211464881896973,0.013204264640808105,COMPLETE,0.013110748926798504,0.01291651725769043,0.013211464881896973,0.013204264640808105
117,0.112693552672863,2025-08-25 17:45:05.588277,2025-08-25 18:12:06.453976,0 days 00:27:00.865699,20,,normal,6,zero,,1.3212306887204596e-05,291,928,320,96,,raw,Glorot,,tanh,0.012756840387980145,0.013002538681030273,0.013003921508789063,0.012264060974121093,COMPLETE,0.012756840387980145,0.013002538681030273,0.013003921508789063,0.012264060974121093
118,0.09798387438058853,2025-08-25 18:12:06.454895,2025-08-25 18:39:13.039512,0 days 00:27:06.584617,20,,normal,6,zero,,0.6676236259928471,4506,304,192,560,,raw,old,1.072007186941979,tanh,,,,,COMPLETE,,,,
119,0.7424838781356812,2025-08-25 18:39:13.039879,2025-08-25 19:05:31.385289,0 days 00:26:18.345410,20,,normal,7,zero,,0.003597926709130101,2116,992,512,880,0.9606516766746219,pca,old,1.0710534244543415,tanh,0.01269520918528239,0.012700390815734864,0.01270744800567627,0.012677788734436035,COMPLETE,0.01269520918528239,0.012700390815734864,0.01270744800567627,0.012677788734436035
120,0.7251613140106201,2025-08-25 19:05:31.386151,2025-08-25 19:10:55.054178,0 days 00:05:23.668027,100,3.788581142616804e-09,uniform,8,zero,,0.006463893771225853,1594,144,896,528,,colnorm,old,1.9268954932258746,tanh,0.012153275807698568,0.011540389060974121,0.012690353393554687,0.012229084968566895,COMPLETE,0.012153275807698568,0.011540389060974121,0.012690353393554687,0.012229084968566895
121,0.7680806875228882,2025-08-25 19:10:55.054502,2025-08-25 19:38:45.584471,0 days 00:27:50.529969,20,,normal,6,nz,1.0680722288043689e-08,0.12364702955414512,195,752,112,272,0.9140263804633988,pca,old,1.4949664316646865,tanh,0.008211445808410643,0.008705377578735352,0.0068803071975708004,0.009048652648925782,COMPLETE,0.008211445808410643,0.008705377578735352,0.0068803071975708004,0.009048652648925782
122,0.11358064860105514,2025-08-25 19:38:45.584853,2025-08-25 20:06:25.547046,0 days 00:27:39.962193,20,3.182651168708131e-08,uniform,7,nz,0.0009172583772937015,8.532298090996893e-05,374,592,688,256,,colnorm,Glorot,,tanh,0.013069462776184081,0.0132889986038208,0.013162350654602051,0.012757039070129395,COMPLETE,0.013069462776184081,0.0132889986038208,0.013162350654602051,0.012757039070129395
123,0.18208065629005432,2025-08-25 20:06:25.547431,2025-08-25 20:11:48.390190,0 days 00:05:22.842759,100,9.551899663881542e-06,normal,8,zero,,0.0020179188305637146,491,144,240,368,,colnorm,Glorot,,tanh,0.013211019833882648,0.013221096992492676,0.01314547061920166,0.013266491889953613,COMPLETE,0.013211019833882648,0.013221096992492676,0.01314547061920166,0.013266491889953613
124,0.5458064794540405,2025-08-25 20:11:48.390531,2025-08-25 20:38:19.216935,0 days 00:26:30.826404,20,0.0009335783146413682,normal,5,zero,,0.0002524963632971082,9970,32,608,720,,colnorm,old,0.8206984998141482,tanh,0.012280400594075522,0.011184477806091308,0.012701010704040528,0.012955713272094726,COMPLETE,0.012280400594075522,0.011184477806091308,0.012701010704040528,0.012955713272094726
125,0.6371129274368286,2025-08-25 20:38:19.217317,2025-08-25 20:43:34.928991,0 days 00:05:15.711674,100,,normal,7,zero,,0.05966882465794208,130,336,480,832,,raw,old,0.9057823807953762,tanh,0.01249705950419108,0.012043642997741699,0.012409043312072755,0.01303849220275879,COMPLETE,0.01249705950419108,0.012043642997741699,0.012409043312072755,0.01303849220275879
126,0.5762096881866455,2025-08-25 20:43:34.929285,2025-08-25 20:48:58.307348,0 days 00:05:23.378063,100,5.388129518308598e-07,uniform,8,zero,,0.0007985675440229626,6175,784,320,928,,colnorm,old,0.5598299165511067,tanh,0.012870375315348306,0.01287529468536377,0.012844014167785644,0.012891817092895507,COMPLETE,0.012870375315348306,0.01287529468536377,0.012844014167785644,0.012891817092895507
127,0.11379032582044601,2025-08-25 20:48:58.307635,2025-08-25 20:54:35.847327,0 days 00:05:37.539692,100,1.9189470902339894e-06,uniform,6,nz,1.0848962800032886e-05,1.7275482847827764e-05,1004,224,352,848,,colnorm,old,0.8360967564015054,tanh,0.012814394632975262,0.012564277648925782,0.013038349151611329,0.012840557098388671,COMPLETE,0.012814394632975262,0.012564277648925782,0.013038349151611329,0.012840557098388671
