number,value,datetime_start,datetime_complete,duration,params_batch_size,params_colnorm_thresh,params_dist1,params_iseed,params_l2_penalty_choice,params_l2_penalty_nz,params_lr,params_lr_anneal_start,params_nhid1,params_nhid2,params_nhid3,params_pca_energy,params_preproc,params_scale_heur1,params_scale_mult1,params_squash,user_attrs_avg_fit_criteria,user_attrs_ed_cl1_mean,user_attrs_ed_cl2_mean,user_attrs_ed_cl3_mean,state,avg_fit_criteria,ed_cl1_mean,ed_cl2_mean,ed_cl3_mean
0,0.112693552672863,2025-08-24 10:50:01.586303,2025-08-24 11:18:28.092838,0 days 00:28:26.506535,20,,uniform,6,nz,2.408891693835518e-07,1.9068306386240476e-05,800,80,288,512,,raw,Glorot,,logistic,0.013023296991984049,0.012913894653320313,0.013140201568603516,0.01301579475402832,COMPLETE,0.013023296991984049,0.012913894653320313,0.013140201568603516,0.01301579475402832
1,0.112693552672863,2025-08-24 11:18:28.094961,2025-08-24 11:24:11.996981,0 days 00:05:43.902020,100,,uniform,6,nz,0.0002069877935427099,4.532045798669679e-05,803,224,512,384,,raw,Glorot,,tanh,0.012992159525553387,0.01298518180847168,0.01315913200378418,0.012832164764404297,COMPLETE,0.012992159525553387,0.01298518180847168,0.01315913200378418,0.012832164764404297
2,0.25570968687534334,2025-08-24 11:24:11.997348,2025-08-24 11:51:26.586647,0 days 00:27:14.589299,20,,normal,6,zero,,0.003593917669469153,294,432,16,96,0.7614531005141727,pca,old,0.755934832754835,tanh,0.012376213073730468,0.012969422340393066,0.011143016815185546,0.013016200065612793,COMPLETE,0.012376213073730468,0.012969422340393066,0.011143016815185546,0.013016200065612793
3,0.112693552672863,2025-08-24 11:51:26.587023,2025-08-24 11:56:55.068936,0 days 00:05:28.481913,100,,normal,5,zero,,0.04669620740529656,5948,352,336,320,,raw,old,1.0291345330938984,logistic,0.013040804862976074,0.012888455390930175,0.013279056549072266,0.012954902648925782,COMPLETE,0.013040804862976074,0.012888455390930175,0.013279056549072266,0.012954902648925782
4,0.112693552672863,2025-08-24 11:56:55.069253,2025-08-24 12:02:40.394753,0 days 00:05:45.325500,100,,normal,5,nz,5.8733668003591766e-08,0.0006009208989093564,129,80,368,848,,raw,old,0.9564623006105633,logistic,0.013152464230855304,0.01296088695526123,0.013309240341186523,0.013187265396118164,COMPLETE,0.013152464230855304,0.01296088695526123,0.013309240341186523,0.013187265396118164
5,0.7797419667243958,2025-08-24 12:02:40.395064,2025-08-24 12:08:11.759581,0 days 00:05:31.364517,100,,normal,6,zero,,0.020672492838662945,4902,48,560,832,0.92848781305588,pca,old,0.9947535368647515,tanh,0.00874637762705485,0.0033570051193237303,0.010812020301818848,0.012070107460021972,COMPLETE,0.00874637762705485,0.0033570051193237303,0.010812020301818848,0.012070107460021972
6,0.31306452453136446,2025-08-24 12:08:11.759878,2025-08-24 12:13:42.319860,0 days 00:05:30.559982,100,,normal,8,zero,,0.902290355038375,303,160,32,544,0.531811142849276,pca,Glorot,,tanh,,,,,COMPLETE,,,,
7,0.112693552672863,2025-08-24 12:13:42.320165,2025-08-24 12:19:31.940725,0 days 00:05:49.620560,100,,uniform,8,nz,1.7286821158315726e-07,7.984786193040815e-05,2976,944,32,704,0.5603162141530791,pca,Glorot,,logistic,0.013053814570109049,0.013007330894470214,0.013015556335449218,0.013138556480407714,COMPLETE,0.013053814570109049,0.013007330894470214,0.013015556335449218,0.013138556480407714
8,0.112693552672863,2025-08-24 12:19:31.942165,2025-08-24 12:46:33.336753,0 days 00:27:01.394588,20,1.0252773110077433e-06,normal,5,zero,,0.010819702277292158,2651,960,400,672,,colnorm,old,0.7176438958158204,logistic,0.013125602404276529,0.013077855110168457,0.013045835494995116,0.013253116607666015,COMPLETE,0.013125602404276529,0.013077855110168457,0.013045835494995116,0.013253116607666015
9,0.8209839224815368,2025-08-24 12:46:33.337127,2025-08-24 12:52:16.807579,0 days 00:05:43.470452,100,,uniform,8,nz,3.0495251798820325e-05,0.07968268616303291,1813,208,320,256,,raw,old,1.432827266708205,tanh,0.006486638387044271,0.0034880638122558594,0.007721424102783203,0.00825042724609375,COMPLETE,0.006486638387044271,0.0034880638122558594,0.007721424102783203,0.00825042724609375
10,0.14480645954608917,2025-08-24 12:52:16.807888,2025-08-24 13:19:28.308938,0 days 00:27:11.501050,20,,normal,7,zero,,9.278261226540327e-05,117,112,672,320,0.9177342805737674,pca,Glorot,,tanh,0.013045183817545573,0.013186097145080566,0.01300375461578369,0.01294569969177246,COMPLETE,0.013045183817545573,0.013186097145080566,0.01300375461578369,0.01294569969177246
11,0.112693552672863,2025-08-24 13:19:28.311593,2025-08-24 13:25:12.698153,0 days 00:05:44.386560,100,,normal,6,nz,1.5178620982137476e-05,6.138743611911215e-05,6294,912,336,912,,raw,old,0.4880602306015901,tanh,0.013171648979187012,0.013025569915771484,0.013105249404907227,0.013384127616882324,COMPLETE,0.013171648979187012,0.013025569915771484,0.013105249404907227,0.013384127616882324
12,0.112693552672863,2025-08-24 13:25:12.698459,2025-08-24 13:52:25.039954,0 days 00:27:12.341495,20,,normal,6,zero,,0.037881959609401966,7519,160,176,64,,raw,Glorot,,logistic,0.012419422467549643,0.01302492618560791,0.012868380546569825,0.011364960670471191,COMPLETE,0.012419422467549643,0.01302492618560791,0.012868380546569825,0.011364960670471191
13,0.112693552672863,2025-08-24 13:52:25.040309,2025-08-24 13:58:23.219558,0 days 00:05:58.179249,100,,normal,7,nz,0.004083646289694694,0.00017587308626797383,3552,896,736,112,0.934529193152835,pca,Glorot,,logistic,0.013003969192504882,0.01309363842010498,0.01323716640472412,0.012681102752685547,COMPLETE,0.013003969192504882,0.01309363842010498,0.01323716640472412,0.012681102752685547
14,0.3617258191108704,2025-08-24 13:58:23.219856,2025-08-24 14:25:47.264297,0 days 00:27:24.044441,20,,normal,6,zero,,0.3044525615065604,204,704,176,352,0.5043995553501397,pca,Glorot,,tanh,0.011473663647969564,0.01159656047821045,0.010984683036804199,0.011839747428894043,COMPLETE,0.011473663647969564,0.01159656047821045,0.010984683036804199,0.011839747428894043
15,0.112693552672863,2025-08-24 14:25:47.264680,2025-08-24 14:54:33.090130,0 days 00:28:45.825450,20,,uniform,6,nz,4.5217557451024084e-07,0.00024928315599298995,515,512,176,752,,raw,old,1.1709311779111824,tanh,0.013175479571024577,0.013152050971984863,0.013227105140686035,0.013147282600402831,COMPLETE,0.013175479571024577,0.013152050971984863,0.013227105140686035,0.013147282600402831
16,0.112693552672863,2025-08-24 14:54:33.091655,2025-08-24 14:59:57.808800,0 days 00:05:24.717145,100,,uniform,6,zero,,0.00034912391835984966,2655,1008,352,736,,raw,Glorot,,tanh,0.013091031710306802,0.013102149963378907,0.013074493408203125,0.013096451759338379,COMPLETE,0.013091031710306802,0.013102149963378907,0.013074493408203125,0.013096451759338379
17,0.112693552672863,2025-08-24 14:59:57.809585,2025-08-24 15:28:24.327795,0 days 00:28:26.518210,20,,normal,6,nz,0.003098891758417325,0.0008440164593981861,1301,912,880,240,0.5561063925658498,pca,old,0.5462544338135313,logistic,0.013244191805521647,0.013272404670715332,0.013249421119689941,0.013210749626159668,COMPLETE,0.013244191805521647,0.013272404670715332,0.013249421119689941,0.013210749626159668
18,0.112693552672863,2025-08-24 15:28:24.328170,2025-08-24 15:56:42.908262,0 days 00:28:18.580092,20,,uniform,7,nz,0.0012361063948476514,0.00017047912451343645,270,480,992,624,,raw,Glorot,,logistic,0.013161547978719075,0.013174629211425782,0.013205313682556152,0.013104701042175293,COMPLETE,0.013161547978719075,0.013174629211425782,0.013205313682556152,0.013104701042175293
19,0.112693552672863,2025-08-24 15:56:42.908628,2025-08-24 16:23:44.343826,0 days 00:27:01.435198,20,,normal,8,zero,,0.8186484618563397,3702,224,896,720,,raw,Glorot,,logistic,0.002368402481079102,0.006586194038391113,0.00019884109497070312,0.0003201723098754883,COMPLETE,0.002368402481079102,0.006586194038391113,0.00019884109497070312,0.0003201723098754883
20,0.112693552672863,2025-08-24 16:23:44.345882,2025-08-24 16:29:23.578788,0 days 00:05:39.232906,100,,uniform,6,nz,0.0002247144159652352,0.5824613263289332,1377,96,176,32,,raw,Glorot,,logistic,0.012506000200907391,0.012782931327819824,0.013266825675964355,0.011468243598937989,COMPLETE,0.012506000200907391,0.012782931327819824,0.013266825675964355,0.011468243598937989
21,0.112693552672863,2025-08-24 16:29:23.579081,2025-08-24 16:35:07.438597,0 days 00:05:43.859516,100,,uniform,6,nz,0.0031762322412963125,0.0008525836944886396,895,656,352,992,,raw,old,0.8825031528075136,tanh,0.013158822059631347,0.012974739074707031,0.013286304473876954,0.013215422630310059,COMPLETE,0.013158822059631347,0.012974739074707031,0.013286304473876954,0.013215422630310059
22,0.112693552672863,2025-08-24 16:35:07.439906,2025-08-24 16:40:36.834352,0 days 00:05:29.394446,100,1.1440763747069189e-09,uniform,6,zero,,0.0013572916218580562,286,1008,1008,560,,colnorm,old,0.6363168365090601,logistic,0.013091731071472166,0.013129544258117676,0.01306452751159668,0.013081121444702148,COMPLETE,0.013091731071472166,0.013129544258117676,0.01306452751159668,0.013081121444702148
23,0.112693552672863,2025-08-24 16:40:36.834683,2025-08-24 16:46:03.668363,0 days 00:05:26.833680,100,,normal,8,zero,,4.3061830079117834e-05,102,96,800,16,0.9535186884098954,pca,old,0.4229283393084612,tanh,0.010092457135518393,0.012653684616088868,0.012959694862365723,0.004663991928100586,COMPLETE,0.010092457135518393,0.012653684616088868,0.012959694862365723,0.004663991928100586
24,0.11866129338741302,2025-08-24 16:46:03.668659,2025-08-24 17:14:27.867008,0 days 00:28:24.198349,20,5.659468770678343e-08,normal,7,nz,2.972205680742184e-07,6.15282914558757e-06,3796,128,800,288,,colnorm,Glorot,,tanh,0.013184873263041179,0.012923121452331543,0.013512492179870605,0.013119006156921386,COMPLETE,0.013184873263041179,0.012923121452331543,0.013512492179870605,0.013119006156921386
25,0.112693552672863,2025-08-24 17:14:27.867402,2025-08-24 17:41:27.972105,0 days 00:27:00.104703,20,,normal,5,zero,,0.001237123628998651,4732,752,992,160,,raw,Glorot,,logistic,0.013114126523335776,0.013221359252929688,0.013163518905639649,0.012957501411437988,COMPLETE,0.013114126523335776,0.013221359252929688,0.013163518905639649,0.012957501411437988
26,0.112693552672863,2025-08-24 17:41:27.972487,2025-08-24 18:09:53.707925,0 days 00:28:25.735438,20,,uniform,6,nz,0.00025273534942158024,1.5444453286934103e-06,443,832,48,704,0.5000924595149698,pca,old,1.6974991883625365,logistic,0.012948211034138998,0.012744426727294922,0.013187432289123535,0.012912774085998535,COMPLETE,0.012948211034138998,0.012744426727294922,0.013187432289123535,0.012912774085998535
27,0.112693552672863,2025-08-24 18:09:53.709093,2025-08-24 18:38:22.512125,0 days 00:28:28.803032,20,,uniform,5,nz,2.8653067848446513e-08,0.13594321102820803,100,64,960,832,0.5315053238870611,pca,Glorot,,logistic,0.012898755073547362,0.012771534919738769,0.013156819343566894,0.012767910957336426,COMPLETE,0.012898755073547362,0.012771534919738769,0.013156819343566894,0.012767910957336426
28,0.112693552672863,2025-08-24 18:38:22.512511,2025-08-24 18:44:04.806701,0 days 00:05:42.294190,100,,uniform,8,nz,2.195171270562009e-06,0.00019975831193664464,686,64,592,192,,raw,Glorot,,logistic,0.013001012802124024,0.012754201889038086,0.01313035488128662,0.013118481636047364,COMPLETE,0.013001012802124024,0.012754201889038086,0.01313035488128662,0.013118481636047364
29,0.112693552672863,2025-08-24 18:44:04.807014,2025-08-24 18:49:47.706424,0 days 00:05:42.899410,100,,uniform,8,nz,1.1354612839945856e-05,5.104214441669944e-05,474,816,576,16,,raw,old,1.84336145631759,tanh,0.012582945823669435,0.012932229042053222,0.013145804405212402,0.011670804023742676,COMPLETE,0.012582945823669435,0.012932229042053222,0.013145804405212402,0.011670804023742676
30,0.12406452149152755,2025-08-24 18:49:47.706721,2025-08-24 19:18:09.108742,0 days 00:28:21.402021,20,,normal,5,nz,3.4666480400355086e-05,3.0590198493981793e-06,1159,1024,560,320,0.5285715720343376,pca,Glorot,,tanh,0.013035583496093751,0.013160419464111329,0.013076424598693848,0.012869906425476075,COMPLETE,0.013035583496093751,0.013160419464111329,0.013076424598693848,0.012869906425476075
31,0.112693552672863,2025-08-24 19:18:09.110514,2025-08-24 19:23:36.184417,0 days 00:05:27.073903,100,,normal,7,zero,,0.0013178595061205047,329,544,624,736,,raw,Glorot,,tanh,0.013127867380777994,0.013079500198364258,0.013156509399414063,0.013147592544555664,COMPLETE,0.013127867380777994,0.013079500198364258,0.013156509399414063,0.013147592544555664
32,0.112693552672863,2025-08-24 19:23:36.184751,2025-08-24 19:29:01.950042,0 days 00:05:25.765291,100,,normal,5,zero,,8.060709675998e-05,273,592,848,816,,raw,Glorot,,logistic,0.01301445166269938,0.012946414947509765,0.013173365592956543,0.012923574447631836,COMPLETE,0.01301445166269938,0.012946414947509765,0.013173365592956543,0.012923574447631836
33,0.8318387508392334,2025-08-24 19:29:01.950373,2025-08-24 19:34:29.229203,0 days 00:05:27.278830,100,,uniform,5,zero,,0.3881631908547999,550,656,768,480,0.8360361547567354,pca,old,0.34952059690438664,tanh,0.006621146202087403,0.005297541618347168,0.007555675506591797,0.007010221481323242,COMPLETE,0.006621146202087403,0.005297541618347168,0.007555675506591797,0.007010221481323242
34,0.16577419638633728,2025-08-24 19:34:29.229507,2025-08-24 19:39:56.634315,0 days 00:05:27.404808,100,,normal,5,zero,,1.5698573371230564e-06,9702,16,848,784,0.9554456629821021,pca,old,0.8219145201736515,tanh,0.012104694048563638,0.00997624397277832,0.013069796562194824,0.013268041610717773,COMPLETE,0.012104694048563638,0.00997624397277832,0.013069796562194824,0.013268041610717773
35,0.112693552672863,2025-08-24 19:39:56.634604,2025-08-24 20:07:06.723148,0 days 00:27:10.088544,20,0.00023030123347169337,uniform,5,zero,,0.00022925779841068158,7530,624,304,272,,colnorm,Glorot,,logistic,0.01302809715270996,0.013199257850646972,0.012829947471618652,0.013055086135864258,COMPLETE,0.01302809715270996,0.013199257850646972,0.012829947471618652,0.013055086135864258
36,0.112693552672863,2025-08-24 20:07:06.725257,2025-08-24 20:12:47.711478,0 days 00:05:40.986221,100,,uniform,6,nz,0.007026571679037962,0.5761867715961069,345,480,560,336,0.9027008437002731,pca,Glorot,,logistic,0.010608665148417155,0.0130218505859375,0.013132524490356446,0.0056716203689575195,COMPLETE,0.010608665148417155,0.0130218505859375,0.013132524490356446,0.0056716203689575195
37,0.112693552672863,2025-08-24 20:12:47.711776,2025-08-24 20:18:16.679087,0 days 00:05:28.967311,100,,uniform,8,zero,,0.04691042508931178,325,320,656,880,,raw,old,0.7969697448675397,logistic,0.01319142977396647,0.013067960739135742,0.013406014442443848,0.013100314140319824,COMPLETE,0.01319142977396647,0.013067960739135742,0.013406014442443848,0.013100314140319824
38,0.112693552672863,2025-08-24 20:18:16.679433,2025-08-24 20:23:43.992535,0 days 00:05:27.313102,100,1.3392800430171726e-07,uniform,7,zero,,5.181088778462791e-05,1530,624,768,64,,colnorm,old,0.5361051597480313,logistic,0.012982590993245441,0.013241934776306152,0.012793588638305663,0.012912249565124512,COMPLETE,0.012982590993245441,0.013241934776306152,0.012793588638305663,0.012912249565124512
39,0.112693552672863,2025-08-24 20:23:43.992850,2025-08-24 20:52:08.050182,0 days 00:28:24.057332,20,,uniform,6,nz,2.7074231357934203e-07,2.7495142582401574e-05,3457,528,320,288,,raw,old,0.9842803384827483,logistic,0.01310109297434489,0.01322021484375,0.013056325912475585,0.013026738166809082,COMPLETE,0.01310109297434489,0.01322021484375,0.013056325912475585,0.013026738166809082
40,0.112693552672863,2025-08-24 20:52:08.050562,2025-08-24 21:19:06.740980,0 days 00:26:58.690418,20,,uniform,7,zero,,7.1487242727983216e-06,669,400,672,560,0.733548195301683,pca,Glorot,,logistic,0.013045223553975423,0.013075160980224609,0.01302039623260498,0.013040113449096679,COMPLETE,0.013045223553975423,0.013075160980224609,0.01302039623260498,0.013040113449096679
41,0.112693552672863,2025-08-24 21:19:06.741347,2025-08-24 21:24:47.666974,0 days 00:05:40.925627,100,,uniform,5,nz,2.172158274853957e-05,4.971380801717752e-05,489,848,896,752,0.6078982381999125,pca,old,1.570720193391757,logistic,0.013138969739278158,0.01318984031677246,0.01304473876953125,0.013182330131530761,COMPLETE,0.013138969739278158,0.01318984031677246,0.01304473876953125,0.013182330131530761
42,0.112693552672863,2025-08-24 21:24:47.667282,2025-08-24 21:30:18.615671,0 days 00:05:30.948389,100,,normal,6,zero,,5.05629522128911e-05,628,704,16,912,,raw,old,1.6729318569045701,logistic,0.013407278060913087,0.013390612602233887,0.013930916786193848,0.012900304794311524,COMPLETE,0.013407278060913087,0.013390612602233887,0.013930916786193848,0.012900304794311524
43,0.5674838900566102,2025-08-24 21:30:18.616015,2025-08-24 21:35:50.020725,0 days 00:05:31.404710,100,,uniform,7,zero,,0.004181806786036181,9187,128,272,528,0.5725305842963468,pca,old,0.6347679358457043,tanh,0.011134632428487142,0.0089522123336792,0.012026119232177734,0.012425565719604492,COMPLETE,0.011134632428487142,0.0089522123336792,0.012026119232177734,0.012425565719604492
44,0.11295161694288254,2025-08-24 21:35:50.021039,2025-08-24 22:04:26.762365,0 days 00:28:36.741326,20,,uniform,7,nz,2.560791683250174e-08,6.497661227159869e-05,996,448,944,160,0.878173217327606,pca,Glorot,,tanh,0.012914673487345379,0.012933731079101562,0.012970471382141113,0.012839818000793457,COMPLETE,0.012914673487345379,0.012933731079101562,0.012970471382141113,0.012839818000793457
45,0.7350806593894958,2025-08-24 22:04:26.762734,2025-08-24 22:32:48.946625,0 days 00:28:22.183891,20,,uniform,6,nz,4.2668947270063475e-06,0.009261598751419355,1303,240,864,224,0.7526980705455009,pca,old,1.2313563468120658,tanh,0.011488652229309082,0.010603809356689453,0.012335872650146485,0.011526274681091308,COMPLETE,0.011488652229309082,0.010603809356689453,0.012335872650146485,0.011526274681091308
46,0.19285484552383422,2025-08-24 22:32:48.947517,2025-08-24 22:38:36.355354,0 days 00:05:47.407837,100,,uniform,5,nz,3.29024119804691e-08,1.2532733251536745e-06,125,224,896,592,0.9280040816529784,pca,old,1.95298129373683,tanh,0.013115429878234863,0.013151097297668456,0.012937331199645996,0.013257861137390137,COMPLETE,0.013115429878234863,0.013151097297668456,0.012937331199645996,0.013257861137390137
47,0.28748388290405275,2025-08-24 22:38:36.355649,2025-08-24 22:44:06.838447,0 days 00:05:30.482798,100,,normal,5,zero,,0.00011442100841843391,306,128,672,816,0.7013913968225263,pca,old,1.2743207063277995,tanh,0.013027461369832356,0.012977004051208496,0.013100576400756837,0.013004803657531738,COMPLETE,0.013027461369832356,0.012977004051208496,0.013100576400756837,0.013004803657531738
48,0.7473871231079101,2025-08-24 22:44:06.838745,2025-08-24 23:12:19.530521,0 days 00:28:12.691776,20,1.5213799637263695e-05,normal,7,nz,0.00010849668078145311,0.04064835377827358,383,576,496,1008,,colnorm,Glorot,,tanh,0.011957724889119467,0.011273455619812012,0.012014675140380859,0.012585043907165527,COMPLETE,0.011957724889119467,0.011273455619812012,0.012014675140380859,0.012585043907165527
49,0.112693552672863,2025-08-24 23:12:19.530897,2025-08-24 23:40:57.383243,0 days 00:28:37.852346,20,,uniform,6,nz,0.0007388299612462084,2.6838463465390414e-05,258,192,128,848,,raw,Glorot,,logistic,0.012959186236063638,0.012823724746704101,0.012879228591918946,0.013174605369567872,COMPLETE,0.012959186236063638,0.012823724746704101,0.012879228591918946,0.013174605369567872
50,0.5662258267402649,2025-08-24 23:40:57.383601,2025-08-25 00:09:09.133512,0 days 00:28:11.749911,20,,uniform,8,nz,1.908237513615749e-06,0.009531024033067244,2537,288,272,80,,raw,old,0.27563829445908666,tanh,0.011384924252827963,0.012235355377197266,0.012035417556762695,0.009883999824523926,COMPLETE,0.011384924252827963,0.012235355377197266,0.012035417556762695,0.009883999824523926
51,0.2529032349586487,2025-08-25 00:09:09.134300,2025-08-25 00:14:54.101307,0 days 00:05:44.967007,100,,normal,8,nz,0.0005657840674477493,0.034360924836067806,2216,336,48,592,0.899069644786243,pca,Glorot,,logistic,0.009718068440755208,0.011297965049743652,0.006195378303527832,0.01166086196899414,COMPLETE,0.009718068440755208,0.011297965049743652,0.006195378303527832,0.01166086196899414
52,0.112693552672863,2025-08-25 00:14:54.101624,2025-08-25 00:43:15.554767,0 days 00:28:21.453143,20,,normal,8,nz,1.4738360525117118e-05,0.01606188977318872,768,832,896,544,,raw,Glorot,,logistic,0.013079237937927245,0.012935614585876465,0.01325223445892334,0.013049864768981933,COMPLETE,0.013079237937927245,0.012935614585876465,0.01325223445892334,0.013049864768981933
53,0.112693552672863,2025-08-25 00:43:15.555129,2025-08-25 00:49:01.931721,0 days 00:05:46.376592,100,6.415696825107625e-08,uniform,6,nz,1.463798032767135e-05,1.8880093046200602e-05,4520,656,624,544,,colnorm,old,0.33226944075447534,logistic,0.013137873013814291,0.013067173957824706,0.013088631629943847,0.013257813453674317,COMPLETE,0.013137873013814291,0.013067173957824706,0.013088631629943847,0.013257813453674317
54,0.112693552672863,2025-08-25 00:49:01.932052,2025-08-25 00:54:27.603474,0 days 00:05:25.671422,100,1.751843747942396e-08,normal,5,zero,,0.00039626846541448643,137,272,768,32,,colnorm,Glorot,,tanh,0.012858136494954426,0.012778544425964355,0.013188910484313966,0.012606954574584961,COMPLETE,0.012858136494954426,0.012778544425964355,0.013188910484313966,0.012606954574584961
