number,value,datetime_start,datetime_complete,duration,params_batch_size,params_dist1,params_iseed,params_l2_penalty_choice,params_l2_penalty_nz,params_lr,params_lr_anneal_start,params_nhid1,params_nhid2,params_nhid3,params_scale_heur1,params_scale_mult1,params_squash,user_attrs_avg_fit_criteria,user_attrs_ed_cl1_mean,user_attrs_ed_cl2_mean,user_attrs_ed_cl3_mean,state,avg_fit_criteria,ed_cl1_mean,ed_cl2_mean,ed_cl3_mean
0,0.8711856802304586,2025-09-02 19:43:22.622863,2025-09-02 20:17:51.209135,0 days 00:34:28.586272,20,uniform,8,nz,0.001976273939677935,0.01888913897506274,548,832,368,368,Glorot,,logistic,0.011217382219102645,0.012430826822916666,0.012493530909220377,0.008727788925170898,COMPLETE,0.011217382219102645,0.012430826822916666,0.012493530909220377,0.008727788925170898
1,0.6399425665537516,2025-09-02 20:17:51.210163,2025-09-02 20:49:29.981316,0 days 00:31:38.771153,20,normal,6,zero,,7.287875536659331e-06,2558,976,720,480,Glorot,,tanh,0.013122611575656466,0.013112823168436686,0.01309355099995931,0.013161460558573404,COMPLETE,0.013122611575656466,0.013112823168436686,0.01309355099995931,0.013161460558573404
2,0.6252854466438293,2025-09-02 20:49:29.981724,2025-09-02 20:56:13.910121,0 days 00:06:43.928397,100,normal,5,nz,0.005659923651826091,0.0024869546064083107,103,736,656,608,Glorot,,logistic,0.013114465607537163,0.013140559196472168,0.013120214144388834,0.013082623481750488,COMPLETE,0.013114465607537163,0.013140559196472168,0.013120214144388834,0.013082623481750488
3,0.46521369616190594,2025-09-02 20:56:13.916920,2025-09-02 21:28:03.730954,0 days 00:31:49.814034,20,uniform,5,zero,,4.392996964391159e-06,286,304,464,176,old,1.048938561776662,logistic,0.013069325023227267,0.012968937555948893,0.013079007466634115,0.013160030047098795,COMPLETE,0.013069325023227267,0.012968937555948893,0.013079007466634115,0.013160030047098795
4,0.8640856742858887,2025-09-02 21:28:03.731380,2025-09-02 21:34:46.766521,0 days 00:06:43.035141,100,uniform,8,nz,2.2013739783605834e-08,0.0014768815514442635,7994,688,768,256,Glorot,,logistic,0.011773188908894857,0.012840509414672852,0.012916366259256998,0.00956269105275472,COMPLETE,0.011773188908894857,0.012840509414672852,0.012916366259256998,0.00956269105275472
5,0.8596576253573099,2025-09-02 21:34:46.767201,2025-09-02 21:41:31.261785,0 days 00:06:44.494584,100,normal,8,nz,0.00017344787323769035,0.3329779126931672,5727,624,1008,256,old,1.0240609680153696,logistic,0.001849624845716688,0.002676725387573242,0.0025631586710611978,0.000308990478515625,COMPLETE,0.001849624845716688,0.002676725387573242,0.0025631586710611978,0.000308990478515625
6,0.6084145903587341,2025-09-02 21:41:31.262726,2025-09-02 21:48:11.709051,0 days 00:06:40.446325,100,normal,6,nz,2.5689072709426117e-05,5.276847581147895e-05,221,384,256,432,Glorot,,tanh,0.013092332416110568,0.01295010248819987,0.013191819190979004,0.013135075569152832,COMPLETE,0.013092332416110568,0.01295010248819987,0.013191819190979004,0.013135075569152832
7,0.8832428256670634,2025-09-02 21:48:11.709747,2025-09-02 21:54:36.956698,0 days 00:06:25.246951,100,normal,7,zero,,0.045402977968456694,3669,192,416,784,old,0.39496068952891183,logistic,0.008717364735073514,0.007617751757303874,0.009335517883300781,0.009198824564615885,COMPLETE,0.008717364735073514,0.007617751757303874,0.009335517883300781,0.009198824564615885
8,0.6558427015940348,2025-09-02 21:54:36.957114,2025-09-02 22:01:02.851621,0 days 00:06:25.894507,100,uniform,7,zero,,1.9670000815753223e-05,2947,1024,864,624,old,1.7685618590876564,logistic,0.013087749481201172,0.013079603513081869,0.013135949770609537,0.01304769515991211,COMPLETE,0.013087749481201172,0.013079603513081869,0.013135949770609537,0.01304769515991211
9,0.8791142304738363,2025-09-02 22:01:02.852367,2025-09-02 22:07:43.369190,0 days 00:06:40.516823,100,normal,7,nz,0.004713238483750317,0.026455682027908503,179,528,144,448,Glorot,,tanh,0.012333684497409396,0.012488007545471191,0.012442747751871744,0.012070298194885254,COMPLETE,0.012333684497409396,0.012488007545471191,0.012442747751871744,0.012070298194885254
10,0.8816714485486349,2025-09-02 22:07:43.369600,2025-09-02 22:41:00.092714,0 days 00:33:16.723114,20,uniform,5,nz,1.7399719380673092e-06,0.0060518290943611325,550,784,768,160,old,1.3898853516952139,tanh,0.012597481409708658,0.012838800748189291,0.012949268023173014,0.012004375457763672,COMPLETE,0.012597481409708658,0.012838800748189291,0.012949268023173014,0.012004375457763672
11,0.6354000369707743,2025-09-02 22:41:00.093150,2025-09-02 22:47:23.957061,0 days 00:06:23.863911,100,normal,6,zero,,0.00018131133577534945,391,688,448,320,Glorot,,logistic,0.013005561298794217,0.01307376225789388,0.012899359067281088,0.013043562571207682,COMPLETE,0.013005561298794217,0.01307376225789388,0.012899359067281088,0.013043562571207682
12,0.8862142960230509,2025-09-02 22:47:23.958024,2025-09-02 22:53:44.369146,0 days 00:06:20.411122,100,uniform,8,zero,,0.002472295306383974,2075,224,384,176,old,0.2686955279215667,tanh,0.012478073438008627,0.013175090154012045,0.012864907582600912,0.011394222577412924,COMPLETE,0.012478073438008627,0.013175090154012045,0.012864907582600912,0.011394222577412924
13,0.8889143069585165,2025-09-02 22:53:44.369545,2025-09-02 23:27:11.487653,0 days 00:33:27.118108,20,uniform,8,nz,1.784055631279747e-08,0.0028909398708427706,5014,896,784,752,old,0.2558892770414504,logistic,0.012473464012145996,0.012898921966552734,0.012823144594828287,0.011698325475056967,COMPLETE,0.012473464012145996,0.012898921966552734,0.012823144594828287,0.011698325475056967
14,0.8760428229967753,2025-09-02 23:27:11.488075,2025-09-02 23:33:32.124522,0 days 00:06:20.636447,100,normal,8,zero,,0.00700610875534594,456,592,912,784,Glorot,,tanh,0.012923849953545464,0.012916326522827148,0.012981891632080078,0.012873331705729166,COMPLETE,0.012923849953545464,0.012916326522827148,0.012981891632080078,0.012873331705729166
15,0.5491420725981394,2025-09-02 23:33:32.124928,2025-09-02 23:39:52.942722,0 days 00:06:20.817794,100,normal,6,zero,,9.318544447640828e-06,368,608,304,272,old,0.4837215553624952,logistic,0.013090968132019043,0.013071695963541666,0.013156692186991373,0.013044516245524088,COMPLETE,0.013090968132019043,0.013071695963541666,0.013156692186991373,0.013044516245524088
16,0.6285282174746195,2025-09-02 23:39:52.943155,2025-09-03 00:11:52.177446,0 days 00:31:59.234291,20,uniform,5,zero,,4.481465560938961e-06,450,928,160,832,old,1.9993692687863487,tanh,0.013094835811191134,0.013103604316711426,0.01303271452585856,0.013148188591003418,COMPLETE,0.013094835811191134,0.013103604316711426,0.01303271452585856,0.013148188591003418
17,0.6182287136713663,2025-09-03 00:11:52.178620,2025-09-03 00:18:15.644644,0 days 00:06:23.466024,100,normal,5,zero,,1.357272557085702e-06,1626,992,592,304,old,1.000636396400883,tanh,0.0130891932381524,0.013098955154418945,0.01313622792561849,0.01303239663441976,COMPLETE,0.0130891932381524,0.013098955154418945,0.01313622792561849,0.01303239663441976
18,0.6776425043741862,2025-09-03 00:18:15.645082,2025-09-03 00:50:08.780098,0 days 00:31:53.135016,20,normal,5,zero,,0.00047629753700197336,299,912,736,192,old,0.9803391648118072,tanh,0.01310341888003879,0.013065973917643229,0.013109803199768066,0.013134479522705078,COMPLETE,0.01310341888003879,0.013065973917643229,0.013109803199768066,0.013134479522705078
19,0.8936571677525839,2025-09-03 00:50:08.780505,2025-09-03 01:23:41.298655,0 days 00:33:32.518150,20,uniform,8,nz,1.3911845869625818e-08,0.005226421886733568,6103,896,976,560,old,0.21352968048963394,logistic,0.01181356112162272,0.012659986813863119,0.012514034907023111,0.010266661643981934,COMPLETE,0.01181356112162272,0.012659986813863119,0.012514034907023111,0.010266661643981934
20,0.8957857489585876,2025-09-03 01:23:41.299076,2025-09-03 01:57:04.988519,0 days 00:33:23.689443,20,uniform,8,nz,1.2199588059394355e-08,0.0769650793161218,4928,1024,736,688,old,0.2471110127882815,tanh,0.008791446685791016,0.008025010426839193,0.009515166282653809,0.008834163347880045,COMPLETE,0.008791446685791016,0.008025010426839193,0.009515166282653809,0.008834163347880045
21,0.895242969195048,2025-09-03 01:57:04.989457,2025-09-03 02:30:22.259670,0 days 00:33:17.270213,20,uniform,8,nz,1.1050555782101909e-08,0.0732601658766065,3972,1024,816,416,old,0.210919526949491,tanh,0.009199672275119357,0.008910179138183594,0.010192275047302246,0.008496562639872232,COMPLETE,0.009199672275119357,0.008910179138183594,0.010192275047302246,0.008496562639872232
22,0.09999999900658925,2025-09-03 02:30:22.260134,2025-09-03 03:03:37.413393,0 days 00:33:15.153259,20,uniform,8,nz,1.0008105235130407e-08,0.3561370975222723,6039,912,608,528,old,0.22437171249639215,tanh,,,,,COMPLETE,,,,
23,0.7937999765078226,2025-09-03 03:03:37.414139,2025-09-03 03:36:56.738843,0 days 00:33:19.324704,20,normal,8,nz,2.1724727094947852e-07,7.461180237421455e-05,3625,896,816,336,old,0.21604802145504418,tanh,0.013113988770378962,0.013141632080078125,0.013092239697774252,0.013108094533284506,COMPLETE,0.013113988770378962,0.013141632080078125,0.013092239697774252,0.013108094533284506
24,0.897857129573822,2025-09-03 03:36:56.739577,2025-09-03 03:43:35.101715,0 days 00:06:38.362138,100,uniform,6,nz,1.0717217503998855e-08,0.0896330727305625,1557,928,1008,784,old,0.6893833535048202,tanh,0.011541710959540473,0.011140942573547363,0.01172622044881185,0.011757969856262207,COMPLETE,0.011541710959540473,0.011140942573547363,0.01172622044881185,0.011757969856262207
25,0.7461702028910319,2025-09-03 03:43:35.102154,2025-09-03 03:50:15.420261,0 days 00:06:40.318107,100,uniform,6,nz,1.3716432862317632e-07,0.23210393500585524,882,1008,848,912,old,0.6928571333952185,logistic,0.0028145710627237954,0.004602948824564616,0.0023278395334879556,0.0015129248301188152,COMPLETE,0.0028145710627237954,0.004602948824564616,0.0023278395334879556,0.0015129248301188152
26,0.8964285453160604,2025-09-03 03:50:15.420681,2025-09-03 03:56:57.327347,0 days 00:06:41.906666,100,uniform,6,nz,1.0809382140996923e-08,0.0670758723724561,2143,848,912,448,Glorot,,tanh,0.010702106687757703,0.009947260220845541,0.011351863543192545,0.010807196299235025,COMPLETE,0.010702106687757703,0.009947260220845541,0.011351863543192545,0.010807196299235025
27,0.8948285579681396,2025-09-03 03:56:57.327782,2025-09-03 04:30:39.609506,0 days 00:33:42.281724,20,normal,6,nz,4.856955333821805e-07,0.11029885242739139,1184,896,1024,784,old,0.706986877022878,tanh,0.010382824473910863,0.009115338325500488,0.011297186215718588,0.01073594888051351,COMPLETE,0.010382824473910863,0.009115338325500488,0.011297186215718588,0.01073594888051351
28,0.8850570718447367,2025-09-03 04:30:39.609955,2025-09-03 04:37:23.117311,0 days 00:06:43.507356,100,uniform,7,nz,1.0760330430626865e-08,0.002120164987672212,4197,912,944,880,old,0.6826378768847289,tanh,0.012869689199659558,0.012858311335245768,0.012902379035949707,0.012848377227783203,COMPLETE,0.012869689199659558,0.012858311335245768,0.012902379035949707,0.012848377227783203
29,0.09999999900658925,2025-09-03 04:37:23.118548,2025-09-03 04:44:03.928373,0 days 00:06:40.809825,100,uniform,7,nz,2.333535793723238e-07,0.41827521620863783,1660,1008,1008,464,Glorot,,tanh,,,,,COMPLETE,,,,
30,0.8940142591794332,2025-09-03 04:44:03.929632,2025-09-03 04:50:26.913704,0 days 00:06:22.984072,100,uniform,6,zero,,0.05379871843659382,1129,816,784,544,old,1.412201844513822,tanh,0.011623541514078775,0.011301398277282715,0.012005925178527832,0.011563301086425781,COMPLETE,0.011623541514078775,0.011301398277282715,0.012005925178527832,0.011563301086425781
31,0.8695428768793741,2025-09-03 04:50:26.914143,2025-09-03 04:57:12.473758,0 days 00:06:45.559615,100,uniform,6,nz,1.1865953689015282e-08,0.0015385866733629418,1450,928,752,560,Glorot,,tanh,0.012970275349087186,0.012952287991841635,0.013030290603637695,0.012928247451782227,COMPLETE,0.012970275349087186,0.012952287991841635,0.013030290603637695,0.012928247451782227
32,0.8938571612040201,2025-09-03 04:57:12.474207,2025-09-03 05:03:57.100182,0 days 00:06:44.625975,100,uniform,6,nz,1.0602874960285461e-08,0.07633963925402135,574,560,960,976,old,0.6104368279071868,tanh,0.012253642082214355,0.012080073356628418,0.012358744939168295,0.012322107950846354,COMPLETE,0.012253642082214355,0.012080073356628418,0.012358744939168295,0.012322107950846354
33,0.8946999907493591,2025-09-03 05:03:57.100600,2025-09-03 05:10:40.216977,0 days 00:06:43.116377,100,uniform,6,nz,1.1037019596113844e-08,0.18612940631347272,1707,592,960,368,Glorot,,tanh,0.00840768549177382,0.006407260894775391,0.009902079900105795,0.008913715680440268,COMPLETE,0.00840768549177382,0.006407260894775391,0.009902079900105795,0.008913715680440268
34,0.8894285957018534,2025-09-03 05:10:40.217404,2025-09-03 05:17:23.660583,0 days 00:06:43.443179,100,normal,6,nz,9.773535179456234e-08,0.04881796694751409,934,912,912,480,Glorot,,logistic,0.010746664471096462,0.011460701624552408,0.01200401782989502,0.008775273958841959,COMPLETE,0.010746664471096462,0.011460701624552408,0.01200401782989502,0.008775273958841959
35,0.09999999900658925,2025-09-03 05:17:23.661051,2025-09-03 05:49:15.866668,0 days 00:31:52.205617,20,uniform,5,zero,,0.4755791631840118,5746,944,928,336,old,0.5656289159461131,tanh,,,,,COMPLETE,,,,
36,0.8944714268048605,2025-09-03 05:49:15.867088,2025-09-03 06:21:16.576871,0 days 00:32:00.709783,20,uniform,8,zero,,0.007486663486369894,2742,928,720,768,Glorot,,tanh,0.01216280460357666,0.011889100074768066,0.012311021486918131,0.012288292249043783,COMPLETE,0.01216280460357666,0.011889100074768066,0.012311021486918131,0.012288292249043783
37,0.8955571452776591,2025-09-03 06:21:16.577300,2025-09-03 06:53:08.751755,0 days 00:31:52.174455,20,uniform,7,zero,,0.07229336342507858,4330,912,768,768,old,0.20038244686317566,tanh,0.009240693516201444,0.008397658665974935,0.009944677352905273,0.009379744529724121,COMPLETE,0.009240693516201444,0.008397658665974935,0.009944677352905273,0.009379744529724121
38,0.8987571001052856,2025-09-03 06:53:08.752202,2025-09-03 07:24:53.421480,0 days 00:31:44.669278,20,uniform,7,zero,,0.012865472959322074,7813,784,624,864,old,0.599884414773587,tanh,0.011359903547498917,0.011025031407674154,0.011292417844136557,0.011762261390686035,COMPLETE,0.011359903547498917,0.011025031407674154,0.011292417844136557,0.011762261390686035
39,0.8916428685188293,2025-09-03 07:24:53.421933,2025-09-03 07:58:25.390655,0 days 00:33:31.968722,20,normal,8,nz,3.264122203415325e-07,0.1210909734543051,6959,960,320,944,old,0.7390795347338128,tanh,0.0049610137939453125,0.0033550659815470376,0.004448850949605306,0.007079124450683594,COMPLETE,0.0049610137939453125,0.0033550659815470376,0.004448850949605306,0.007079124450683594
40,0.8881142934163412,2025-09-03 07:58:25.391541,2025-09-03 08:30:18.125213,0 days 00:31:52.733672,20,normal,6,zero,,0.0018197766869185747,6178,656,464,816,old,0.6986406388757684,tanh,0.012393792470296225,0.012322545051574707,0.012299497922261557,0.012559334437052408,COMPLETE,0.012393792470296225,0.012322545051574707,0.012299497922261557,0.012559334437052408
41,0.8961428006490072,2025-09-03 08:30:18.126328,2025-09-03 09:02:10.441919,0 days 00:31:52.315591,20,uniform,7,zero,,0.0026719092245612113,9536,864,816,944,old,0.47657184198263514,tanh,0.012545810805426704,0.01261444886525472,0.012623826662699381,0.01239915688832601,COMPLETE,0.012545810805426704,0.01261444886525472,0.012623826662699381,0.01239915688832601
42,0.8753285010655721,2025-09-03 09:02:10.442651,2025-09-03 09:34:02.960806,0 days 00:31:52.518155,20,uniform,7,zero,,0.00019488504641917084,9872,992,768,1024,old,0.6156078352395784,tanh,0.013039350509643555,0.013019084930419922,0.01302178700764974,0.013077179590861002,COMPLETE,0.013039350509643555,0.013019084930419922,0.01302178700764974,0.013077179590861002
43,0.892014225323995,2025-09-03 09:34:02.961675,2025-09-03 10:05:48.247241,0 days 00:31:45.285566,20,uniform,7,zero,,0.004923145498705253,4723,480,304,720,old,0.5794903425577405,tanh,0.012150843938191732,0.012327313423156738,0.01189879576365153,0.012226422627766928,COMPLETE,0.012150843938191732,0.012327313423156738,0.01189879576365153,0.012226422627766928
44,0.09999999900658925,2025-09-03 10:05:48.247676,2025-09-03 10:12:28.216290,0 days 00:06:39.968614,100,uniform,8,nz,2.2335656450182206e-07,0.5946269306107674,2330,1008,912,944,old,0.5735023141625066,tanh,,,,,COMPLETE,,,,
45,0.8951999743779501,2025-09-03 10:12:28.216730,2025-09-03 10:45:48.379768,0 days 00:33:20.163038,20,normal,7,nz,4.917394496986648e-06,0.007367541034610128,6973,720,752,1024,old,0.8878838608725541,tanh,0.01154727405971951,0.010796864827473959,0.011787613232930502,0.012057344118754068,COMPLETE,0.01154727405971951,0.010796864827473959,0.011787613232930502,0.012057344118754068
46,0.8947285811106364,2025-09-03 10:45:48.380201,2025-09-03 10:52:31.330880,0 days 00:06:42.950679,100,uniform,6,nz,8.729565907368038e-08,0.01004731616674213,2917,832,1024,608,old,0.5666976757333931,tanh,0.0125376648373074,0.012662887573242188,0.012692729632059732,0.01225737730662028,COMPLETE,0.0125376648373074,0.012662887573242188,0.012692729632059732,0.01225737730662028
47,0.8962999582290649,2025-09-03 10:52:31.331703,2025-09-03 11:25:53.521236,0 days 00:33:22.189533,20,uniform,7,nz,1.0715473781896531e-07,0.009323821964797531,8340,816,560,720,Glorot,,tanh,0.010879755020141602,0.010176817576090494,0.010973374048868815,0.011489073435465494,COMPLETE,0.010879755020141602,0.010176817576090494,0.010973374048868815,0.011489073435465494
48,0.8958285252253214,2025-09-03 11:25:53.521671,2025-09-03 11:59:21.601754,0 days 00:33:28.080083,20,normal,7,nz,3.4795912616325617e-06,0.011752371492820567,8279,848,416,528,Glorot,,tanh,0.010255138079325357,0.009714802106221518,0.01035773754119873,0.010692874590555826,COMPLETE,0.010255138079325357,0.009714802106221518,0.01035773754119873,0.010692874590555826
49,0.8952856858571371,2025-09-03 11:59:21.602591,2025-09-03 12:32:52.469725,0 days 00:33:30.867134,20,uniform,7,nz,4.3273295989112633e-07,0.05346999040827171,1560,816,544,784,Glorot,,tanh,0.010421620474921333,0.00947113831837972,0.010628541310628256,0.011165181795756022,COMPLETE,0.010421620474921333,0.00947113831837972,0.010628541310628256,0.011165181795756022
50,0.8873570958773295,2025-09-03 12:32:52.470151,2025-09-03 13:06:22.102049,0 days 00:33:29.631898,20,uniform,7,nz,1.4762504540410648e-07,0.0013535278967038628,8094,768,448,736,Glorot,,tanh,0.012549479802449545,0.012327988942464193,0.01272126038869222,0.01259919007619222,COMPLETE,0.012549479802449545,0.012327988942464193,0.01272126038869222,0.01259919007619222
51,0.7748427589734396,2025-09-03 13:06:22.102784,2025-09-03 13:39:45.544306,0 days 00:33:23.441522,20,normal,7,nz,4.7087254875937086e-05,0.00017062878419096017,5404,960,224,608,Glorot,,logistic,0.012995216581556534,0.013062596321105957,0.013117154439290365,0.012805898984273275,COMPLETE,0.012995216581556534,0.013062596321105957,0.013117154439290365,0.012805898984273275
52,0.8962571422259012,2025-09-03 13:39:45.544728,2025-09-03 14:11:39.243182,0 days 00:31:53.698454,20,normal,7,zero,,0.048762527038434506,9246,800,432,560,Glorot,,tanh,0.006420691808064778,0.004996339480082194,0.006504495938618978,0.007761240005493164,COMPLETE,0.006420691808064778,0.004996339480082194,0.006504495938618978,0.007761240005493164
53,0.8923999667167664,2025-09-03 14:11:39.243619,2025-09-03 14:43:30.369387,0 days 00:31:51.125768,20,normal,7,zero,,0.07027142415982339,1976,848,256,352,Glorot,,tanh,0.008413592974344889,0.008275151252746582,0.008130311965942383,0.008835315704345703,COMPLETE,0.008413592974344889,0.008275151252746582,0.008130311965942383,0.008835315704345703
54,0.09999999900658925,2025-09-03 14:43:30.369815,2025-09-03 15:15:11.342482,0 days 00:31:40.972667,20,normal,7,zero,,0.4198272313598672,6551,960,576,512,Glorot,,tanh,,,,,COMPLETE,,,,
55,0.8981857299804688,2025-09-03 15:15:11.342938,2025-09-03 15:21:52.795061,0 days 00:06:41.452123,100,uniform,5,nz,1.6303730658252293e-07,0.0381898746736221,7077,752,752,800,Glorot,,tanh,0.010339736938476562,0.008977770805358887,0.010560552279154459,0.011480887730916342,COMPLETE,0.010339736938476562,0.008977770805358887,0.010560552279154459,0.011480887730916342
56,0.8808000087738037,2025-09-03 15:21:52.795498,2025-09-03 15:28:37.492648,0 days 00:06:44.697150,100,uniform,5,nz,1.3327197318618127e-07,0.0007195765415385995,6986,1008,752,848,Glorot,,tanh,0.012916511959499784,0.012865980466206869,0.012905001640319824,0.012978553771972656,COMPLETE,0.012916511959499784,0.012865980466206869,0.012905001640319824,0.012978553771972656
57,0.8834428787231445,2025-09-03 15:28:37.493092,2025-09-03 15:35:22.825163,0 days 00:06:45.332071,100,uniform,8,nz,1.0523193412834125e-07,0.00838462686856568,5053,624,592,800,Glorot,,logistic,0.011350976096259222,0.011352101961771647,0.01192323366800944,0.010777592658996582,COMPLETE,0.011350976096259222,0.011352101961771647,0.01192323366800944,0.010777592658996582
58,0.09999999900658925,2025-09-03 15:35:22.825595,2025-09-03 15:42:05.905683,0 days 00:06:43.080088,100,uniform,5,nz,8.705195917497587e-08,0.5509170855185868,8658,480,784,672,old,1.1887915500489623,tanh,,,,,COMPLETE,,,,
59,0.8866999944051107,2025-09-03 15:42:05.906153,2025-09-03 16:13:51.034364,0 days 00:31:45.128211,20,normal,5,zero,,0.12251098352955318,9849,688,384,320,Glorot,,logistic,0.0031943983501858185,0.0017554362614949544,0.005006710688273112,0.002821048100789388,COMPLETE,0.0031943983501858185,0.0017554362614949544,0.005006710688273112,0.002821048100789388
