number,value,datetime_start,datetime_complete,duration,params_batch_size,params_dist1,params_iseed,params_l2_penalty_choice,params_l2_penalty_nz,params_lr,params_lr_anneal_start,params_nhid1,params_scale_heur1,params_scale_mult1,params_squash,user_attrs_avg_fit_criteria,state,avg_fit_criteria
0,0.8021451711654664,2025-09-02 03:15:46.177015,2025-09-02 03:22:49.559636,0 days 00:07:03.382621,100,normal,6,zero,,0.06644070263467312,576,1008,Glorot,,tanh,0.009734773635864257,COMPLETE,0.009734773635864257
1,0.8199032783508301,2025-09-02 03:22:49.560249,2025-09-02 03:30:23.800188,0 days 00:07:34.239939,100,uniform,6,nz,1.5679864837306301e-06,0.010329503456436413,860,992,Glorot,,logistic,0.011047101020812989,COMPLETE,0.011047101020812989
2,0.7065322995185852,2025-09-02 03:30:23.801687,2025-09-02 03:38:00.292588,0 days 00:07:36.490901,100,uniform,5,nz,6.40146258964444e-05,0.00030057369809652877,6496,368,Glorot,,tanh,0.012357473373413086,COMPLETE,0.012357473373413086
3,0.6133226156234741,2025-09-02 03:38:00.293429,2025-09-02 04:12:12.315139,0 days 00:34:12.021710,20,uniform,5,zero,,0.003593917669469153,294,768,Glorot,,logistic,0.01296379566192627,COMPLETE,0.01296379566192627
4,0.8068387269973755,2025-09-02 04:12:12.315565,2025-09-02 04:48:04.485258,0 days 00:35:52.169693,20,uniform,5,nz,0.0021073356349450246,0.0004883418510092812,3543,800,old,0.9468231906318536,tanh,0.012646675109863281,COMPLETE,0.012646675109863281
5,0.1134677454829216,2025-09-02 04:48:04.485687,2025-09-02 05:24:03.258605,0 days 00:35:58.772918,20,uniform,7,nz,0.0008459908187981945,2.6032292780924524e-06,516,912,Glorot,,logistic,0.01311633586883545,COMPLETE,0.01311633586883545
6,0.38212904930114744,2025-09-02 05:24:03.261180,2025-09-02 05:31:23.316796,0 days 00:07:20.055616,100,normal,5,nz,0.0013862889345041907,0.00901468140166235,183,176,Glorot,,logistic,0.013252043724060058,COMPLETE,0.013252043724060058
7,0.824064564704895,2025-09-02 05:31:23.317262,2025-09-02 05:38:14.362970,0 days 00:06:51.045708,100,uniform,8,zero,,0.11805134855353049,216,368,Glorot,,logistic,0.006809401512145996,COMPLETE,0.006809401512145996
8,0.3942096889019012,2025-09-02 05:38:14.363393,2025-09-02 05:45:44.263941,0 days 00:07:29.900548,100,uniform,7,nz,2.815901764360598e-07,0.00036502361187062146,185,128,Glorot,,tanh,0.013068771362304688,COMPLETE,0.013068771362304688
9,0.6132742047309876,2025-09-02 05:45:44.264360,2025-09-02 05:53:00.316538,0 days 00:07:16.052178,100,uniform,7,nz,3.2255015584448746e-06,5.2941296150740716e-06,6626,816,Glorot,,tanh,0.013043618202209473,COMPLETE,0.013043618202209473
10,0.8265806913375855,2025-09-02 05:53:00.317007,2025-09-02 06:26:35.805917,0 days 00:33:35.488910,20,normal,7,zero,,0.09301680484393055,163,800,Glorot,,logistic,0.009625816345214843,COMPLETE,0.009625816345214843
11,0.808048403263092,2025-09-02 06:26:35.806646,2025-09-02 06:33:17.831040,0 days 00:06:42.024394,100,normal,6,zero,,0.018719434318834147,2052,656,old,1.4102645931727156,tanh,0.00968635082244873,COMPLETE,0.00968635082244873
12,0.625516152381897,2025-09-02 06:33:17.831954,2025-09-02 06:40:01.565315,0 days 00:06:43.733361,100,uniform,7,zero,,0.0005938211377977959,773,704,old,1.8120979733868956,tanh,0.012999010086059571,COMPLETE,0.012999010086059571
13,0.8270645618438721,2025-09-02 06:40:01.565742,2025-09-02 07:13:33.685316,0 days 00:33:32.119574,20,uniform,8,zero,,0.10299386757999246,157,656,old,1.8062074230594176,logistic,0.008964037895202637,COMPLETE,0.008964037895202637
14,0.1134677454829216,2025-09-02 07:13:33.685970,2025-09-02 07:49:48.022404,0 days 00:36:14.336434,20,normal,6,nz,9.199450334258862e-07,4.946343851929063e-06,127,416,old,1.9733953796831838,logistic,0.012976694107055663,COMPLETE,0.012976694107055663
15,0.5235322833061218,2025-09-02 07:49:48.022828,2025-09-02 08:23:25.753469,0 days 00:33:37.730641,20,normal,5,zero,,6.444478637143619e-06,8370,336,old,1.6001481198211065,tanh,0.01299896240234375,COMPLETE,0.01299896240234375
16,0.48172582387924195,2025-09-02 08:23:25.753910,2025-09-02 08:30:10.880381,0 days 00:06:45.126471,100,normal,5,zero,,5.149664340041324e-06,268,256,Glorot,,tanh,0.012919425964355469,COMPLETE,0.012919425964355469
17,0.8126774549484252,2025-09-02 08:30:10.881089,2025-09-02 08:37:17.342761,0 days 00:07:06.461672,100,normal,5,nz,2.6731334609132677e-07,0.020221744205079373,156,928,Glorot,,tanh,0.012393021583557129,COMPLETE,0.012393021583557129
18,0.8256452083587646,2025-09-02 08:37:17.343186,2025-09-02 09:10:48.123936,0 days 00:33:30.780750,20,uniform,7,zero,,0.057265109303175826,126,560,old,0.2702596726554056,logistic,0.011505746841430664,COMPLETE,0.011505746841430664
19,0.1134677454829216,2025-09-02 09:10:48.124789,2025-09-02 09:46:57.250932,0 days 00:36:09.126143,20,uniform,6,nz,2.6732795780647336e-07,1.477822781390903e-06,1057,800,old,1.5331641155476206,logistic,0.01308445930480957,COMPLETE,0.01308445930480957
20,0.14000000357627868,2025-09-02 09:46:57.251366,2025-09-02 10:23:21.203507,0 days 00:36:23.952141,20,uniform,5,nz,4.5217557451024084e-07,0.00024928315599298995,515,864,Glorot,,logistic,0.013104939460754394,COMPLETE,0.013104939460754394
21,0.5772419691085815,2025-09-02 10:23:21.203939,2025-09-02 10:57:12.280677,0 days 00:33:51.076738,20,uniform,6,zero,,0.00014593069348259346,9546,704,Glorot,,logistic,0.012937617301940919,COMPLETE,0.012937617301940919
22,0.599822610616684,2025-09-02 10:57:12.281137,2025-09-02 11:33:22.902303,0 days 00:36:10.621166,20,uniform,7,nz,2.61432346137729e-05,0.7712091002222098,167,336,Glorot,,logistic,0.0026334285736083984,COMPLETE,0.0026334285736083984
23,0.8672903776168823,2025-09-02 11:33:22.903040,2025-09-02 11:40:30.720108,0 days 00:07:07.817068,100,uniform,7,nz,4.2391310953230826e-07,0.3098891758417326,7717,288,Glorot,,logistic,0.0013387441635131837,COMPLETE,0.0013387441635131837
24,0.1134677454829216,2025-09-02 11:40:30.720544,2025-09-02 11:47:15.370031,0 days 00:06:44.649487,100,uniform,7,zero,,1.9973397341322524e-05,1337,448,Glorot,,logistic,0.013173580169677734,COMPLETE,0.013173580169677734
25,0.5195645451545715,2025-09-02 11:47:15.370778,2025-09-02 11:54:10.738866,0 days 00:06:55.368088,100,normal,8,zero,,0.001313336169200039,1126,480,old,1.4607765707779474,logistic,0.01304299831390381,COMPLETE,0.01304299831390381
26,0.46409679651260377,2025-09-02 11:54:10.739274,2025-09-02 12:01:19.590796,0 days 00:07:08.851522,100,normal,5,nz,0.002310508554631245,2.993279432713497e-06,212,208,Glorot,,tanh,0.012949466705322266,COMPLETE,0.012949466705322266
27,0.5584677577018737,2025-09-02 12:01:19.591621,2025-09-02 12:37:22.226906,0 days 00:36:02.635285,20,normal,7,nz,1.059684351920824e-06,4.77818774805122e-06,1609,464,Glorot,,tanh,0.013211417198181152,COMPLETE,0.013211417198181152
28,0.5940484166145324,2025-09-02 12:37:22.227645,2025-09-02 13:11:10.727895,0 days 00:33:48.500250,20,normal,5,zero,,0.00013828279283371964,8171,128,old,0.770792829309715,tanh,0.012448954582214355,COMPLETE,0.012448954582214355
29,0.4765000224113464,2025-09-02 13:11:10.728315,2025-09-02 13:17:54.161026,0 days 00:06:43.432711,100,normal,7,zero,,0.0006383400130841039,1462,128,Glorot,,tanh,0.01276381015777588,COMPLETE,0.01276381015777588
30,0.8163387656211853,2025-09-02 13:17:54.161998,2025-09-02 13:51:54.059735,0 days 00:33:59.897737,20,uniform,7,zero,,0.27683708072824537,143,912,Glorot,,tanh,0.008217740058898925,COMPLETE,0.008217740058898925
31,0.46853227615356446,2025-09-02 13:51:54.060164,2025-09-02 14:25:39.630451,0 days 00:33:45.570287,20,normal,7,zero,,4.170746904604951e-06,2075,240,old,0.8838063500464266,tanh,0.013046789169311523,COMPLETE,0.013046789169311523
32,0.7978387236595154,2025-09-02 14:25:39.631255,2025-09-02 14:33:10.348854,0 days 00:07:30.717599,100,normal,7,nz,0.00015673483443304014,0.14406368678586515,405,992,old,1.6217947263397825,tanh,0.008106398582458495,COMPLETE,0.008106398582458495
33,0.8227903723716736,2025-09-02 14:33:10.349592,2025-09-02 14:39:57.249310,0 days 00:06:46.899718,100,uniform,5,zero,,0.057020059203906834,281,400,Glorot,,logistic,0.0076290607452392575,COMPLETE,0.0076290607452392575
34,0.6096290469169616,2025-09-02 14:39:57.249999,2025-09-02 14:46:41.427076,0 days 00:06:44.177077,100,normal,6,zero,,1.8175550179742918e-06,2310,832,old,1.6535901776344464,tanh,0.013073086738586426,COMPLETE,0.013073086738586426
35,0.5412742137908936,2025-09-02 14:46:41.427762,2025-09-02 14:53:50.356585,0 days 00:07:08.928823,100,normal,7,nz,2.3881625663818028e-08,0.00030129831042670976,192,416,Glorot,,tanh,0.013172101974487305,COMPLETE,0.013172101974487305
36,0.6070322751998901,2025-09-02 14:53:50.357257,2025-09-02 15:29:36.324892,0 days 00:35:45.967635,20,normal,6,nz,3.042048190917116e-07,0.0024865729443567025,230,432,old,1.9863089596180703,tanh,0.012852096557617187,COMPLETE,0.012852096557617187
37,0.45267743468284605,2025-09-02 15:29:36.325333,2025-09-02 15:36:20.000661,0 days 00:06:43.675328,100,normal,5,zero,,0.00031934072317515473,583,176,old,0.7980273673000766,tanh,0.013361740112304687,COMPLETE,0.013361740112304687
38,0.8237581133842469,2025-09-02 15:36:20.001093,2025-09-02 16:09:50.261745,0 days 00:33:30.260652,20,normal,8,zero,,0.006015868242524775,614,480,old,0.21837927025566456,tanh,0.01267070770263672,COMPLETE,0.01267070770263672
39,0.1134677454829216,2025-09-02 16:09:50.262170,2025-09-02 16:43:51.996938,0 days 00:34:01.734768,20,normal,5,zero,,1.9422269127825716e-06,399,912,old,0.8895458827965552,logistic,0.013115310668945312,COMPLETE,0.013115310668945312
40,0.762806499004364,2025-09-02 16:43:51.997609,2025-09-02 16:50:42.346143,0 days 00:06:50.348534,100,normal,6,zero,,0.0020093447679859944,1510,976,old,0.7897342187886371,logistic,0.012255096435546875,COMPLETE,0.012255096435546875
41,0.3038871049880981,2025-09-02 16:50:42.359386,2025-09-02 16:57:38.180511,0 days 00:06:55.821125,100,normal,5,zero,,0.0013178595061205047,329,656,old,1.6891567488156214,logistic,0.01312849521636963,COMPLETE,0.01312849521636963
42,0.795322597026825,2025-09-02 16:57:38.180944,2025-09-02 17:04:20.056819,0 days 00:06:41.875875,100,normal,5,zero,,0.020520468795960502,5573,720,old,1.2385120108259946,tanh,0.005670976638793945,COMPLETE,0.005670976638793945
43,0.8248871445655823,2025-09-02 17:04:20.057246,2025-09-02 17:38:14.789247,0 days 00:33:54.732001,20,uniform,7,zero,,0.01077541132005978,1870,752,Glorot,,logistic,0.00959479808807373,COMPLETE,0.00959479808807373
44,0.8759839296340942,2025-09-02 17:38:14.790256,2025-09-02 18:13:45.163346,0 days 00:35:30.373090,20,normal,5,nz,0.002919765386742817,0.4080388969790123,813,192,old,1.977044803454637,tanh,0.03856172561645508,COMPLETE,0.03856172561645508
45,0.8856290817260742,2025-09-02 18:13:45.163769,2025-09-02 18:47:28.487917,0 days 00:33:43.324148,20,uniform,6,zero,,0.10467739650491467,8879,240,old,1.988181682835439,logistic,0.0003678560256958008,COMPLETE,0.0003678560256958008
46,0.8141774773597718,2025-09-02 18:47:28.488339,2025-09-02 18:54:50.544877,0 days 00:07:22.056538,100,uniform,8,nz,0.0009110543562389147,0.10750221368169545,280,512,Glorot,,tanh,0.008538579940795899,COMPLETE,0.008538579940795899
47,0.7184355139732361,2025-09-02 18:54:50.545296,2025-09-02 19:30:53.402547,0 days 00:36:02.857251,20,normal,6,nz,1.2137828511775467e-07,0.0005684434147264066,1175,816,Glorot,,tanh,0.012867975234985351,COMPLETE,0.012867975234985351
48,0.5636290311813354,2025-09-02 19:30:53.403209,2025-09-02 20:06:38.457172,0 days 00:35:45.053963,20,normal,7,nz,5.733827693309677e-05,5.079600868546174e-06,1084,480,Glorot,,tanh,0.013121747970581054,COMPLETE,0.013121747970581054
49,0.7886129260063172,2025-09-02 20:06:38.457606,2025-09-02 20:40:06.500285,0 days 00:33:28.042679,20,normal,5,zero,,0.010843892878441716,158,224,old,0.6646190292569847,tanh,0.011990952491760253,COMPLETE,0.011990952491760253
50,0.6167742133140564,2025-09-02 20:40:19.103113,2025-09-02 20:47:27.553510,0 days 00:07:08.450397,100,normal,6,nz,0.000194697733265765,0.0019162850142456203,235,672,old,1.6809867835351213,tanh,0.012972760200500488,COMPLETE,0.012972760200500488
51,0.8097903609275818,2025-09-02 20:47:27.553940,2025-09-02 20:54:38.773530,0 days 00:07:11.219590,100,normal,7,nz,2.7495142582401514e-07,0.05907447236904719,655,320,old,1.39075721911742,tanh,0.007480049133300781,COMPLETE,0.007480049133300781
52,0.6135161399841309,2025-09-02 20:54:38.774303,2025-09-02 21:28:40.327662,0 days 00:34:01.553359,20,normal,5,zero,,3.857174781334704e-05,3039,800,Glorot,,tanh,0.013037657737731934,COMPLETE,0.013037657737731934
53,0.8763871550559997,2025-09-02 21:28:40.328360,2025-09-02 22:04:36.629156,0 days 00:35:56.300796,20,normal,7,nz,3.386321498655938e-06,0.12264970522261864,2353,592,Glorot,,tanh,0.001252293586730957,COMPLETE,0.001252293586730957
54,0.1134677454829216,2025-09-02 22:04:36.629579,2025-09-02 22:11:53.755349,0 days 00:07:17.125770,100,uniform,8,nz,2.172158274853957e-05,4.971380801717752e-05,489,784,old,1.570720193391757,logistic,0.013123130798339844,COMPLETE,0.013123130798339844
55,0.6288709998130798,2025-09-02 22:11:53.756091,2025-09-02 22:45:43.854884,0 days 00:33:50.098793,20,uniform,6,zero,,1.2551410088649383e-06,146,1008,old,1.3354783582374978,tanh,0.013114833831787109,COMPLETE,0.013114833831787109
56,0.8169839143753052,2025-09-02 22:45:43.855308,2025-09-02 22:52:52.159322,0 days 00:07:08.304014,100,uniform,8,nz,0.001457454736002227,0.21160224376284129,194,368,Glorot,,tanh,0.005029749870300293,COMPLETE,0.005029749870300293
57,0.1134677454829216,2025-09-02 22:52:52.160051,2025-09-02 23:29:03.369660,0 days 00:36:11.209609,20,normal,7,nz,0.000345206216507449,1.0767903294947152e-05,3459,336,old,0.43178383268196363,logistic,0.013059163093566894,COMPLETE,0.013059163093566894
58,0.8156290650367737,2025-09-02 23:29:03.370101,2025-09-02 23:35:56.319753,0 days 00:06:52.949652,100,normal,6,zero,,0.314492368582759,402,464,Glorot,,tanh,0.0034066438674926758,COMPLETE,0.0034066438674926758
59,0.6064838886260986,2025-09-02 23:35:56.320187,2025-09-03 00:12:00.735701,0 days 00:36:04.415514,20,normal,5,nz,9.261598751419367e-05,8.30508083975526e-06,7406,752,Glorot,,tanh,0.013133406639099121,COMPLETE,0.013133406639099121
60,0.8218387603759766,2025-09-03 00:12:00.736371,2025-09-03 00:18:44.374086,0 days 00:06:43.637715,100,uniform,6,zero,,0.007050908081710695,5149,800,old,1.1831342969408847,logistic,0.01021745204925537,COMPLETE,0.01021745204925537
61,0.5585967898368835,2025-09-03 00:18:44.374528,2025-09-03 00:54:18.532405,0 days 00:35:34.157877,20,normal,6,nz,5.921401756691521e-08,3.2902411980469176e-06,315,432,old,0.537490790118223,tanh,0.013120794296264648,COMPLETE,0.013120794296264648
62,0.6160161375999451,2025-09-03 00:54:18.533135,2025-09-03 01:01:03.509226,0 days 00:06:44.976091,100,normal,5,zero,,0.00011442100841843391,306,832,old,1.2743207063277995,tanh,0.01306600570678711,COMPLETE,0.01306600570678711
63,0.819822633266449,2025-09-03 01:01:03.509653,2025-09-03 01:08:12.859730,0 days 00:07:09.350077,100,uniform,7,nz,0.0004064835377827357,0.11607285176566381,180,160,Glorot,,tanh,0.0064412117004394535,COMPLETE,0.0064412117004394535
64,0.1134677454829216,2025-09-03 01:08:12.874635,2025-09-03 01:42:30.623111,0 days 00:34:17.748476,20,uniform,6,zero,,1.382661221905772e-06,682,688,Glorot,,logistic,0.013061618804931641,COMPLETE,0.013061618804931641
65,0.8212419867515564,2025-09-03 01:42:30.623536,2025-09-03 01:49:19.643912,0 days 00:06:49.020376,100,uniform,6,zero,,0.07388299612462086,5783,864,Glorot,,tanh,0.005382966995239258,COMPLETE,0.005382966995239258
66,0.8676774263381958,2025-09-03 01:49:19.644353,2025-09-03 02:24:44.400937,0 days 00:35:24.756584,20,uniform,6,nz,1.908237513615749e-06,0.009531024033067244,2537,176,old,0.27563829445908666,tanh,0.006336379051208496,COMPLETE,0.006336379051208496
67,0.797451627254486,2025-09-03 02:24:44.401370,2025-09-03 02:32:01.637093,0 days 00:07:17.235723,100,uniform,8,nz,0.0003436092483606785,0.003563853576994704,2874,368,Glorot,,logistic,0.008528542518615723,COMPLETE,0.008528542518615723
68,0.8200323104858398,2025-09-03 02:32:01.637952,2025-09-03 03:08:23.057253,0 days 00:36:21.419301,20,normal,7,nz,1.4017302164881898e-08,0.0007937355347963972,4181,720,old,0.47843307409063596,tanh,0.012569928169250488,COMPLETE,0.012569928169250488
69,0.8079516291618347,2025-09-03 03:08:23.058081,2025-09-03 03:15:53.668633,0 days 00:07:30.610552,100,normal,8,nz,6.313429655245278e-05,0.0053832863402396,1641,528,old,1.8323299386798049,tanh,0.010700321197509766,COMPLETE,0.010700321197509766
70,0.6317903637886048,2025-09-03 03:15:53.669109,2025-09-03 03:23:18.314648,0 days 00:07:24.645539,100,normal,5,nz,2.859240358052314e-08,1.6731914187622226e-05,281,1024,Glorot,,tanh,0.01307663917541504,COMPLETE,0.01307663917541504
71,0.7316935777664184,2025-09-03 03:23:18.315099,2025-09-03 03:59:31.043309,0 days 00:36:12.728210,20,uniform,6,nz,1.792899246741057e-05,0.006913685110777846,169,672,old,0.49099531740265967,logistic,0.0126786470413208,COMPLETE,0.0126786470413208
72,0.6003548622131347,2025-09-03 03:59:31.043737,2025-09-03 04:34:08.892452,0 days 00:34:37.848715,20,normal,5,zero,,1.1247460343901707e-05,4428,720,old,1.9937895835839174,tanh,0.013142943382263184,COMPLETE,0.013142943382263184
73,0.5044838964939118,2025-09-03 04:34:08.893435,2025-09-03 04:41:10.529671,0 days 00:07:01.636236,100,uniform,5,zero,,1.464582346141168e-06,177,272,old,1.5722709633047176,tanh,0.01305406093597412,COMPLETE,0.01305406093597412
74,0.5054516315460205,2025-09-03 04:41:10.530110,2025-09-03 04:47:51.253418,0 days 00:06:40.723308,100,normal,5,zero,,3.14002547856668e-05,9486,272,Glorot,,tanh,0.013056731224060059,COMPLETE,0.013056731224060059
75,0.8251290798187256,2025-09-03 04:47:51.253839,2025-09-03 05:21:47.070588,0 days 00:33:55.816749,20,uniform,6,zero,,0.014690104852027007,5136,736,old,0.7244111194020812,logistic,0.00880272388458252,COMPLETE,0.00880272388458252
76,0.8182258605957031,2025-09-03 05:21:47.071020,2025-09-03 05:28:50.062498,0 days 00:07:02.991478,100,normal,7,zero,,0.016135003905995773,608,816,old,0.24615482133226763,tanh,0.012295722961425781,COMPLETE,0.012295722961425781
77,0.7111613035202027,2025-09-03 05:28:50.062934,2025-09-03 06:04:24.374362,0 days 00:35:34.311428,20,normal,6,nz,4.475886895022075e-05,0.003760901666790769,239,512,old,1.3150227734312128,tanh,0.012431979179382324,COMPLETE,0.012431979179382324
78,0.8284193992614746,2025-09-03 06:04:24.375200,2025-09-03 06:38:07.067452,0 days 00:33:42.692252,20,normal,6,zero,,0.413288193112604,117,192,Glorot,,tanh,0.004526329040527344,COMPLETE,0.004526329040527344
79,0.1134677454829216,2025-09-03 06:38:07.067895,2025-09-03 06:44:57.100187,0 days 00:06:50.032292,100,uniform,6,zero,,4.666393429270872e-05,2044,608,Glorot,,logistic,0.01304640769958496,COMPLETE,0.01304640769958496
80,0.1134677454829216,2025-09-03 06:44:57.100614,2025-09-03 07:18:27.800163,0 days 00:33:30.699549,20,normal,7,zero,,1.4858133199918598e-05,104,704,Glorot,,logistic,0.013068842887878417,COMPLETE,0.013068842887878417
81,0.6250161409378052,2025-09-03 07:18:27.800589,2025-09-03 07:25:40.374811,0 days 00:07:12.574222,100,uniform,7,nz,0.0010917302197331533,4.567042683767289e-05,2753,1024,Glorot,,tanh,0.013043379783630371,COMPLETE,0.013043379783630371
82,0.7905645370483398,2025-09-03 07:25:40.375264,2025-09-03 08:01:22.018687,0 days 00:35:41.643423,20,normal,6,nz,3.4742302962506327e-06,0.002421213170551697,551,992,old,0.9342401610196729,tanh,0.01267540454864502,COMPLETE,0.01267540454864502
83,0.7190968036651612,2025-09-03 08:01:22.019123,2025-09-03 08:08:28.732719,0 days 00:07:06.713596,100,uniform,6,nz,3.4195612894237447e-06,0.0006660670168108011,1054,912,old,1.2910307012265347,tanh,0.012977981567382812,COMPLETE,0.012977981567382812
84,0.1134677454829216,2025-09-03 08:08:28.733455,2025-09-03 08:43:04.212623,0 days 00:34:35.479168,20,uniform,8,zero,,2.9943331035742903e-05,2081,608,Glorot,,logistic,0.013135170936584473,COMPLETE,0.013135170936584473
85,0.48917744159698484,2025-09-03 08:43:04.213083,2025-09-03 08:50:21.318885,0 days 00:07:17.105802,100,normal,7,nz,0.0009664203736424487,0.0012275073218105353,137,208,old,0.4364618986912914,tanh,0.013057518005371093,COMPLETE,0.013057518005371093
86,0.4320967853069305,2025-09-03 08:50:21.319651,2025-09-03 09:26:22.686443,0 days 00:36:01.366792,20,normal,5,nz,7.176529559961988e-07,0.0010888556841503908,161,160,Glorot,,tanh,0.012898516654968262,COMPLETE,0.012898516654968262
87,0.8244516611099243,2025-09-03 09:26:22.686876,2025-09-03 10:02:20.728311,0 days 00:35:58.041435,20,normal,7,nz,0.0013027462719847785,0.00402905642351582,1771,848,old,0.5066073383181098,logistic,0.011301326751708984,COMPLETE,0.011301326751708984
88,0.6128548502922058,2025-09-03 10:02:20.728751,2025-09-03 10:09:01.854794,0 days 00:06:41.126043,100,normal,7,zero,,0.000527226544140301,490,784,Glorot,,tanh,0.013067960739135742,COMPLETE,0.013067960739135742
89,0.779241967201233,2025-09-03 10:09:01.855242,2025-09-03 10:16:31.707911,0 days 00:07:29.852669,100,normal,7,nz,4.927914403984057e-07,0.005114294799933329,2580,240,old,1.900553525203199,logistic,0.00587930679321289,COMPLETE,0.00587930679321289
90,0.6250967979431152,2025-09-03 10:16:31.708348,2025-09-03 10:50:40.143307,0 days 00:34:08.434959,20,normal,8,zero,,7.524656786929193e-06,4537,960,Glorot,,tanh,0.013116025924682617,COMPLETE,0.013116025924682617
91,0.7645645499229431,2025-09-03 10:50:40.143759,2025-09-03 10:57:51.350225,0 days 00:07:11.206466,100,uniform,8,nz,1.2366828847884485e-05,0.003199994318455447,243,816,old,0.8103987701683892,tanh,0.0129899263381958,COMPLETE,0.0129899263381958
92,0.8346290707588195,2025-09-03 10:57:51.350985,2025-09-03 11:04:57.190555,0 days 00:07:05.839570,100,normal,6,nz,1.02018999504668e-08,0.01739104575970968,7977,272,old,0.4062792499771365,tanh,0.004243803024291992,COMPLETE,0.004243803024291992
