number,value,datetime_start,datetime_complete,duration,params_batch_size,params_colnorm_thresh,params_dist1,params_iseed,params_l2_penalty_choice,params_l2_penalty_nz,params_lr,params_lr_anneal_start,params_nhid1,params_pca_energy,params_preproc,params_scale_heur1,params_scale_mult1,params_squash,state
0,0.5642903447151184,2025-08-19 16:21:29.286427,2025-08-19 16:25:27.270259,0 days 00:03:57.983832,20,,normal,8,nz,1.5463788579841117e-06,0.00016653461936159484,1323,832,,raw,Glorot,,tanh,COMPLETE
1,0.6640323003133138,2025-08-19 16:25:27.270821,2025-08-19 16:26:13.712441,0 days 00:00:46.441620,100,,uniform,8,nz,1.9236748753487186e-08,2.0547199328558902e-05,7073,592,0.6584180610844357,pca,Glorot,,tanh,COMPLETE
2,0.1774019425113996,2025-08-19 16:26:13.712665,2025-08-19 16:26:55.337908,0 days 00:00:41.625243,100,,normal,5,zero,,0.5659923651826084,3833,128,,raw,old,1.9857466391390506,tanh,COMPLETE
3,0.4059515694777171,2025-08-19 16:26:55.338360,2025-08-19 16:30:21.187392,0 days 00:03:25.849032,20,,uniform,8,zero,,0.0004181759315680524,1673,496,0.7936518167319924,pca,old,0.7411550703865422,logistic,COMPLETE
4,0.8264032602310181,2025-08-19 16:30:21.187890,2025-08-19 16:31:03.139670,0 days 00:00:41.951780,100,0.0005111785038494985,uniform,6,zero,,0.01772932380115616,3920,496,,colnorm,Glorot,,logistic,COMPLETE
5,0.8172580202420553,2025-08-19 16:31:03.140141,2025-08-19 16:34:44.195317,0 days 00:03:41.055176,20,,uniform,7,nz,2.754579187431946e-08,0.04731325254594746,1576,272,0.9395345807573379,pca,Glorot,,tanh,COMPLETE
6,0.11477417995532353,2025-08-19 16:34:44.195808,2025-08-19 16:35:29.109701,0 days 00:00:44.913893,100,,uniform,8,nz,4.347699888300888e-07,0.002194664177038812,147,1024,,raw,Glorot,,logistic,COMPLETE
7,0.8070968190828959,2025-08-19 16:35:29.109920,2025-08-19 16:36:12.052482,0 days 00:00:42.942562,100,0.00030649167289104257,normal,5,zero,,0.0816998127615149,1228,688,,colnorm,Glorot,,tanh,COMPLETE
8,0.8193387190500895,2025-08-19 16:36:12.052934,2025-08-19 16:36:59.233238,0 days 00:00:47.180304,100,,uniform,7,nz,0.0002645568202790849,0.02422873547786384,891,720,0.8913677959876881,pca,old,0.8538315683484765,tanh,COMPLETE
9,0.647983988126119,2025-08-19 16:36:59.233702,2025-08-19 16:37:42.862742,0 days 00:00:43.629040,100,,uniform,7,zero,,3.170750300370449e-06,3320,656,0.9406161231694635,pca,old,0.8029927440054692,tanh,COMPLETE
10,0.8738064368565878,2025-08-19 16:37:42.863189,2025-08-19 16:41:19.895102,0 days 00:03:37.031913,20,,normal,8,nz,0.002551744641784246,0.03420715013038941,7313,368,0.936638035172104,pca,old,1.3715103262460462,tanh,COMPLETE
11,0.4618868629137675,2025-08-19 16:41:19.895557,2025-08-19 16:42:00.816073,0 days 00:00:40.920516,100,,uniform,5,zero,,0.002472295306383974,2075,64,,raw,old,0.2686955279215667,tanh,COMPLETE
12,0.8847257892290751,2025-08-19 16:42:00.816271,2025-08-19 16:45:21.772421,0 days 00:03:20.956150,20,,normal,8,zero,,0.12633115655273697,7996,496,,raw,old,1.2383117176396174,tanh,COMPLETE
13,0.8223063945770264,2025-08-19 16:45:21.772866,2025-08-19 16:46:02.753180,0 days 00:00:40.980314,100,0.00026396605532175534,normal,8,zero,,0.0856956409647669,1799,288,,colnorm,old,1.2920153892124882,logistic,COMPLETE
14,0.8499516844749451,2025-08-19 16:46:02.753617,2025-08-19 16:49:19.723147,0 days 00:03:16.969530,20,1.9234441996304963e-05,normal,5,zero,,0.1914526965665586,1879,192,,colnorm,Glorot,,logistic,COMPLETE
15,0.8159516255060831,2025-08-19 16:49:19.726589,2025-08-19 16:52:53.079843,0 days 00:03:33.353254,20,1.2471437960535648e-06,normal,5,nz,1.3116339985565845e-05,0.002599150833651273,8061,416,,colnorm,Glorot,,tanh,COMPLETE
16,0.8215322295824686,2025-08-19 16:52:53.080300,2025-08-19 16:56:12.476325,0 days 00:03:19.396025,20,,normal,8,zero,,0.010380337279685294,6874,688,,raw,old,1.49020452407454,tanh,COMPLETE
17,0.8350645105044047,2025-08-19 16:56:12.480080,2025-08-19 16:56:57.629909,0 days 00:00:45.149829,100,,normal,8,nz,0.00999455049927107,0.010962757744893572,7460,224,0.5522837916814318,pca,old,1.3741932186500083,tanh,COMPLETE
18,0.8097257812817892,2025-08-19 16:56:57.630322,2025-08-19 17:00:31.956575,0 days 00:03:34.326253,20,,normal,8,nz,0.0003648604215928669,0.04336008155036685,1354,496,0.7632487122659962,pca,old,1.6420830002868618,tanh,COMPLETE
19,0.8429031769434611,2025-08-19 17:00:31.957078,2025-08-19 17:03:52.010852,0 days 00:03:20.053774,20,,uniform,8,zero,,0.032474312568223945,3068,128,,raw,Glorot,,tanh,COMPLETE
20,0.8522580663363138,2025-08-19 17:03:52.011274,2025-08-19 17:07:27.414641,0 days 00:03:35.403367,20,,uniform,5,nz,0.009124609780416472,0.47846906792405397,9805,528,0.9987879027489845,pca,old,1.1714877882439405,tanh,COMPLETE
21,0.8391129573186239,2025-08-19 17:07:27.415090,2025-08-19 17:11:01.309580,0 days 00:03:33.894490,20,,uniform,5,nz,0.009531654665787615,0.02675313853111061,4094,560,0.9968298462630386,pca,old,1.1295643943267746,tanh,COMPLETE
22,0.8873871167500814,2025-08-19 17:11:01.312088,2025-08-19 17:14:35.327306,0 days 00:03:34.015218,20,,normal,5,nz,0.0006685081630280547,0.30814130618109287,7255,512,0.9831070696063361,pca,old,1.197309091755559,logistic,COMPLETE
23,0.877709706624349,2025-08-19 17:14:35.329288,2025-08-19 17:18:08.791554,0 days 00:03:33.462266,20,,normal,6,nz,7.473224303239253e-05,0.2045171824529979,3890,592,0.8270902440461838,pca,old,1.3209825419507297,logistic,COMPLETE
24,0.8888871073722839,2025-08-19 17:18:08.792005,2025-08-19 17:21:42.237445,0 days 00:03:33.445440,20,,normal,5,nz,3.570852624573574e-05,0.21334655267787475,6326,736,0.807469716577134,pca,Glorot,,logistic,COMPLETE
25,0.8658387263615926,2025-08-19 17:21:42.237924,2025-08-19 17:25:16.257471,0 days 00:03:34.019547,20,,normal,5,nz,2.0229505640676504e-05,0.1020148545228882,3214,928,0.7038989226595374,pca,Glorot,,logistic,COMPLETE
26,0.8366451859474182,2025-08-19 17:25:16.258417,2025-08-19 17:28:50.875485,0 days 00:03:34.617068,20,,normal,5,nz,7.90180235191794e-05,0.035189872344737895,7058,400,0.8189108936362974,pca,Glorot,,logistic,COMPLETE
27,0.8851290742556254,2025-08-19 17:28:50.876234,2025-08-19 17:32:10.917126,0 days 00:03:20.040892,20,,normal,5,zero,,0.14924554294709944,4552,672,0.8366821120246702,pca,old,0.5276773979491501,logistic,COMPLETE
28,0.8905484080314636,2025-08-19 17:32:10.917612,2025-08-19 17:32:56.078454,0 days 00:00:45.160842,100,,normal,5,nz,1.2193077055260701e-05,0.3173016615180161,8836,704,0.8397946471139265,pca,old,0.5051058410953174,logistic,COMPLETE
29,0.8752097090085348,2025-08-19 17:32:56.078902,2025-08-19 17:33:39.333875,0 days 00:00:43.254973,100,,normal,5,nz,3.1655308536947674e-06,0.43415646236913863,5466,704,,raw,old,0.33702706449644904,logistic,COMPLETE
30,0.8949193557103475,2025-08-19 17:33:39.334094,2025-08-19 17:34:24.641474,0 days 00:00:45.307380,100,,normal,7,nz,7.581035137973102e-05,0.5937693936164916,5337,672,0.8399647316891168,pca,old,0.6549308859566287,logistic,COMPLETE
31,0.837790290514628,2025-08-19 17:34:24.641903,2025-08-19 17:35:09.925767,0 days 00:00:45.283864,100,,normal,7,nz,4.240615611418201e-05,0.09392467079937247,5196,1008,0.8342376611986295,pca,old,0.6006895402380538,logistic,COMPLETE
32,0.8252419034639994,2025-08-19 17:35:09.926211,2025-08-19 17:35:53.475359,0 days 00:00:43.549148,100,1.1035595133388481e-09,normal,7,nz,0.00010210035505923973,0.05382273653573172,8246,560,,colnorm,old,0.6779703905778999,logistic,COMPLETE
33,0.8230645259221395,2025-08-19 17:35:53.475631,2025-08-19 17:36:38.671256,0 days 00:00:45.195625,100,,uniform,5,nz,1.12948542823977e-05,0.03679369419376588,7410,560,0.8412215953033936,pca,old,0.2471826935060233,logistic,COMPLETE
34,0.8948226372400919,2025-08-19 17:36:38.671628,2025-08-19 17:37:23.338004,0 days 00:00:44.666376,100,,normal,5,nz,0.0002406366757960392,0.35337678836923575,9709,512,0.7584152153152512,pca,old,0.8685244703422343,logistic,COMPLETE
35,0.8894838293393453,2025-08-19 17:37:23.338421,2025-08-19 17:38:05.693203,0 days 00:00:42.354782,100,,normal,7,zero,,0.42957882463022923,7627,416,0.7421949682517682,pca,old,0.757270966053622,logistic,COMPLETE
36,0.8870322108268738,2025-08-19 17:38:05.693627,2025-08-19 17:38:47.214597,0 days 00:00:41.520970,100,,normal,7,zero,,0.22939821144456846,5552,432,0.698089104484554,pca,old,0.7539127504677852,logistic,COMPLETE
37,0.8238871097564697,2025-08-19 17:38:47.215040,2025-08-19 17:39:30.013474,0 days 00:00:42.798434,100,,normal,7,nz,1.416691950125189e-06,0.02433900392789184,3031,592,,raw,Glorot,,logistic,COMPLETE
38,0.8864516417185465,2025-08-19 17:39:30.013682,2025-08-19 17:40:12.239731,0 days 00:00:42.226049,100,,uniform,6,zero,,0.09340271856365986,7031,400,0.73580363360181,pca,old,0.7330344407498989,tanh,COMPLETE
39,0.8998386859893799,2025-08-19 17:40:12.240152,2025-08-19 17:40:56.666851,0 days 00:00:44.426699,100,,uniform,7,nz,0.00028822451130217525,0.6241708660900807,9245,400,0.7232807476888751,pca,Glorot,,logistic,COMPLETE
40,0.8890644709269205,2025-08-19 17:40:56.667289,2025-08-19 17:41:41.521451,0 days 00:00:44.854162,100,,uniform,7,nz,0.00034816757585912696,0.2326779703563526,4099,256,0.6262149493619197,pca,Glorot,,logistic,COMPLETE
41,0.8278548320134481,2025-08-19 17:41:41.521714,2025-08-19 17:42:26.057642,0 days 00:00:44.535928,100,,normal,8,nz,0.00024332225455340453,0.01542352289237046,6568,544,0.7266520201223771,pca,old,0.6055636991999775,logistic,COMPLETE
42,0.8816612561543783,2025-08-19 17:42:26.058076,2025-08-19 17:45:45.344682,0 days 00:03:19.286606,20,,uniform,7,zero,,0.22806986526047646,9898,272,0.7422939773391466,pca,Glorot,,logistic,COMPLETE
43,0.9009355107943217,2025-08-19 17:45:45.345558,2025-08-19 17:46:30.304867,0 days 00:00:44.959309,100,,normal,5,nz,0.00014869525671108486,0.48514978970628936,7593,768,0.7419357361490521,pca,old,0.8025912836490378,logistic,COMPLETE
44,0.8853064974149069,2025-08-19 17:46:30.305236,2025-08-19 17:47:15.127264,0 days 00:00:44.822028,100,,normal,5,nz,0.00017094840360518197,0.5415220026698897,5297,640,0.7556585047695271,pca,Glorot,,tanh,COMPLETE
45,0.8876936038335165,2025-08-19 17:47:15.127676,2025-08-19 17:47:59.987648,0 days 00:00:44.859972,100,,normal,5,nz,0.0002089737261888229,0.23562974721476437,7263,752,0.7794749252081419,pca,old,0.8518150825106411,logistic,COMPLETE
46,0.8251612782478333,2025-08-19 17:47:59.988129,2025-08-19 17:51:33.763516,0 days 00:03:33.775387,20,1.1336188220012038e-07,uniform,7,nz,4.4573192932893005e-05,0.01319255493706912,4124,544,,colnorm,Glorot,,logistic,COMPLETE
47,0.8277097145716349,2025-08-19 17:51:33.764285,2025-08-19 17:52:16.488925,0 days 00:00:42.724640,100,,normal,5,zero,,0.0502927911345526,5276,704,0.6614130951113285,pca,Glorot,,logistic,COMPLETE
48,0.8964516123135885,2025-08-19 17:52:16.489141,2025-08-19 17:53:01.418222,0 days 00:00:44.929081,100,,normal,6,nz,0.0003529654017483536,0.25598031158828466,8590,592,0.6972382210213157,pca,old,0.49665277557256554,logistic,COMPLETE
49,0.8956129352251688,2025-08-19 17:53:01.418677,2025-08-19 17:53:45.745595,0 days 00:00:44.326918,100,,normal,6,nz,0.0004975457482681337,0.22341722070670408,7192,320,0.6464163419643482,pca,old,0.9439444935715052,logistic,COMPLETE
50,0.8337903221448263,2025-08-19 17:53:45.746040,2025-08-19 17:54:30.392407,0 days 00:00:44.646367,100,,uniform,6,nz,0.0007949280748966457,0.06931604887380181,5337,656,0.6223006942630179,pca,Glorot,,logistic,COMPLETE
51,0.8518062432607015,2025-08-19 17:54:30.392679,2025-08-19 17:55:13.778209,0 days 00:00:43.385530,100,,normal,6,nz,0.00039049678808294856,0.7974452022361311,9059,288,,raw,old,1.9675747513487836,logistic,COMPLETE
52,0.8322258392969767,2025-08-19 17:55:13.778566,2025-08-19 17:55:55.929958,0 days 00:00:42.151392,100,,normal,6,zero,,0.05439360199249402,9132,928,0.655372375732458,pca,old,0.9275550010934066,logistic,COMPLETE
53,0.8880323171615601,2025-08-19 17:55:55.930370,2025-08-19 17:56:40.328216,0 days 00:00:44.397846,100,,normal,6,nz,0.0005534935350612071,0.16894192592751414,6958,512,0.6759564429328739,pca,old,0.8262419894573029,logistic,COMPLETE
54,0.8908225496610006,2025-08-19 17:56:40.328658,2025-08-19 17:57:25.577718,0 days 00:00:45.249060,100,,normal,8,nz,0.0004962612708403865,0.4142713355650527,1479,736,0.6834008514284958,pca,Glorot,,logistic,COMPLETE
55,0.8357903361320496,2025-08-19 17:57:25.578008,2025-08-19 17:58:10.883062,0 days 00:00:45.305054,100,,normal,5,nz,0.0004351794783996303,0.03366113548314151,4720,256,0.5034380486011643,pca,old,0.9427536210079935,logistic,COMPLETE
56,0.8791290124257406,2025-08-19 17:58:10.883423,2025-08-19 17:58:56.280042,0 days 00:00:45.396619,100,,normal,7,nz,0.00035233254052637297,0.1407892898587473,6515,448,0.7061223665477737,pca,Glorot,,logistic,COMPLETE
57,0.8476934432983398,2025-08-19 17:58:56.280459,2025-08-19 17:59:38.862317,0 days 00:00:42.581858,100,,uniform,8,nz,0.00022600878309159554,0.15567766114193066,7345,128,,raw,Glorot,,logistic,COMPLETE
58,0.8966773947079977,2025-08-19 17:59:38.862743,2025-08-19 18:03:12.610465,0 days 00:03:33.747722,20,,uniform,7,nz,0.0008669738046567128,0.7590920922563344,3773,400,0.7283287974100522,pca,old,0.86311357787049,logistic,COMPLETE
59,0.9013709425926208,2025-08-19 18:03:12.610929,2025-08-19 18:06:44.584521,0 days 00:03:31.973592,20,,uniform,7,nz,2.1813982370983365e-08,0.4256329324878004,2593,272,0.6086249320920784,pca,old,0.5730907715774936,logistic,COMPLETE
60,0.8693067828814188,2025-08-19 18:06:44.588397,2025-08-19 18:10:16.029820,0 days 00:03:31.441423,20,,uniform,7,nz,4.060412373365168e-07,0.7255089243777746,4012,400,,raw,old,0.5191645921732886,logistic,COMPLETE
61,0.889467736085256,2025-08-19 18:10:16.030273,2025-08-19 18:11:01.300309,0 days 00:00:45.270036,100,,normal,7,nz,1.8804343877493256e-08,0.14742945100729593,7736,608,0.5890142702557776,pca,old,0.6078762166967296,tanh,COMPLETE
62,0.9025160868962606,2025-08-19 18:11:01.300753,2025-08-19 18:14:34.478130,0 days 00:03:33.177377,20,,uniform,7,nz,8.639218748051198e-08,0.1951087891041538,5943,448,0.5961118492923939,pca,old,0.8427449438380655,logistic,COMPLETE
63,0.8856934905052185,2025-08-19 18:14:34.480605,2025-08-19 18:18:07.608892,0 days 00:03:33.128287,20,,uniform,7,nz,5.607060314079037e-08,0.6372656215397512,1151,128,0.5686414970143843,pca,old,0.9426220487079656,logistic,COMPLETE
64,0.8328064282735189,2025-08-19 18:18:07.609342,2025-08-19 18:21:43.317946,0 days 00:03:35.708604,20,,uniform,8,nz,1.2662678247473167e-08,0.008897993509680943,7119,192,0.6016178894082711,pca,old,0.8838902944340433,logistic,COMPLETE
65,0.8719515800476074,2025-08-19 18:21:43.321416,2025-08-19 18:25:17.845880,0 days 00:03:34.524464,20,,uniform,7,nz,3.945467037862941e-08,0.06857493934949475,4805,624,0.6178286101016242,pca,old,0.8796201407810349,logistic,COMPLETE
66,0.8510645429293314,2025-08-19 18:25:17.846343,2025-08-19 18:26:00.533710,0 days 00:00:42.687367,100,,uniform,7,zero,,0.0698178826501953,4540,512,0.6389146467813168,pca,Glorot,,tanh,COMPLETE
67,0.8709516326586405,2025-08-19 18:26:00.534190,2025-08-19 18:29:34.211372,0 days 00:03:33.677182,20,1.1820289517934509e-08,uniform,5,nz,1.4585680608505803e-07,0.1880246994955356,2795,432,,colnorm,old,0.9192643324354163,logistic,COMPLETE
68,0.9070483843485514,2025-08-19 18:29:34.211819,2025-08-19 18:30:19.342353,0 days 00:00:45.130534,100,,uniform,6,nz,1.0420854899447127e-07,0.9196254560052599,7754,320,0.6642737125962013,pca,old,0.4679363944776057,logistic,COMPLETE
69,0.8335806528727213,2025-08-19 18:30:19.342635,2025-08-19 18:31:03.745649,0 days 00:00:44.403014,100,,uniform,6,nz,2.1829515673561285e-07,0.025965206999267684,9815,256,0.687459141512684,pca,old,0.37293297611007337,logistic,COMPLETE
70,0.876532256603241,2025-08-19 18:31:03.746084,2025-08-19 18:34:39.493741,0 days 00:03:35.747657,20,1.0502353818311653e-06,uniform,7,nz,6.388904673329113e-08,0.15582046934157825,2528,384,,colnorm,old,0.4031251794230519,tanh,COMPLETE
71,0.8898870547612509,2025-08-19 18:34:39.497770,2025-08-19 18:38:14.886044,0 days 00:03:35.388274,20,,uniform,7,nz,9.98166406326006e-08,0.07488643067663424,7972,224,0.6261599191700511,pca,old,0.5507217688989972,logistic,COMPLETE
72,0.8957902987798055,2025-08-19 18:38:14.886514,2025-08-19 18:38:59.969585,0 days 00:00:45.083071,100,,uniform,7,nz,1.057075981631937e-08,0.26676058312847095,5858,400,0.6528239242677754,pca,old,0.6066718322284794,logistic,COMPLETE
73,0.904596745967865,2025-08-19 18:38:59.969960,2025-08-19 18:39:45.355811,0 days 00:00:45.385851,100,,uniform,7,nz,1.1235356470479041e-08,0.7296548972742941,6010,384,0.6894595156083612,pca,old,0.5046337044330865,logistic,COMPLETE
74,0.8835645119349161,2025-08-19 18:39:45.356259,2025-08-19 18:40:30.584343,0 days 00:00:45.228084,100,,uniform,8,nz,1.3305108045174868e-08,0.2398481727283307,2026,464,0.7121993468449169,pca,old,0.20071112808917768,logistic,COMPLETE
75,0.8852741916974386,2025-08-19 18:40:30.584782,2025-08-19 18:41:11.163095,0 days 00:00:40.578313,100,,uniform,6,zero,,0.5802306563678334,7653,272,,raw,old,0.44262696835238846,logistic,COMPLETE
76,0.867774228254954,2025-08-19 18:41:11.163301,2025-08-19 18:41:55.849477,0 days 00:00:44.686176,100,4.9282417050561946e-08,normal,5,nz,1.228204076480425e-07,0.6747002555226225,7125,960,,colnorm,old,0.5123238390450453,tanh,COMPLETE
77,0.8587257663408915,2025-08-19 18:41:55.849901,2025-08-19 18:42:40.310565,0 days 00:00:44.460664,100,,uniform,7,nz,1.681831212942246e-08,0.38763868226709414,6885,80,0.7106458373658465,pca,old,0.5396302087001934,tanh,COMPLETE
78,0.8881128629048666,2025-08-19 18:42:40.311014,2025-08-19 18:46:12.598200,0 days 00:03:32.287186,20,,normal,7,nz,1.3966109134821843e-07,0.18332736698364893,4038,288,0.7123671926724674,pca,old,0.5333294379461541,logistic,COMPLETE
79,0.9161451458930969,2025-08-19 18:46:12.598670,2025-08-19 18:46:57.440568,0 days 00:00:44.841898,100,,uniform,6,nz,1.0087612001356137e-08,0.7637082746334181,8462,576,0.5669707656173631,pca,old,0.5542603945985864,logistic,COMPLETE
