number,value,datetime_start,datetime_complete,duration,params_batch_size,params_dist1,params_iseed,params_l2_penalty_choice,params_l2_penalty_nz,params_lr,params_lr_anneal_start,params_ncode,params_nhid1,params_nhid2,params_nhid3,params_scale_heur1,params_scale_mult1,params_squash,user_attrs_ed_cl1_mean,user_attrs_ed_cl2_mean,user_attrs_ed_cl3_mean,user_attrs_ed_cl4_mean,user_attrs_ed_cl5_mean,user_attrs_ed_cl6_mean,user_attrs_ed_cl7_mean,user_attrs_ed_overall_mean,user_attrs_val_recon_loss_mean,user_attrs_val_recon_loss_std,state
0,0.9987092614173889,2025-09-02 03:15:50.943739,2025-09-02 03:20:11.242781,0 days 00:04:20.299042,512,normal,8,nz,2.8332666515127185e-08,0.00016653461936159484,1323,848,832,368,368,Glorot,,tanh,0.01306446393330892,0.013134400049845377,0.013220389684041342,0.013055046399434408,0.012961069742838541,0.012971997261047363,0.01311941941579183,0.013075255212329684,0.9987092614173889,0.007838531742593663,COMPLETE
1,0.9634116689364115,2025-09-02 03:20:11.243273,2025-09-02 03:25:10.570204,0 days 00:04:59.326931,512,normal,6,zero,,0.00044961887272172035,6583,912,832,416,640,old,1.8647617315080172,logistic,0.013071695963541666,0.01307221253712972,0.013108531634012857,0.013098359107971191,0.013136665026346842,0.013047138849894205,0.013038873672485352,0.01308192525591169,0.9634116689364115,0.0033136193411911893,COMPLETE
2,0.943120022614797,2025-09-02 03:25:10.570707,2025-09-02 03:27:51.827474,0 days 00:02:41.256767,512,normal,6,zero,,0.005616945781998589,902,128,224,672,640,old,0.7134517280441177,logistic,0.013039390246073404,0.013139804204305014,0.013058145840962728,0.012407223383585611,0.012956023216247559,0.013193567593892416,0.012609481811523438,0.012914805185227167,0.943120022614797,0.0020376713245751684,COMPLETE
3,0.6197657783826193,2025-09-02 03:27:51.827934,2025-09-02 03:32:31.036517,0 days 00:04:39.208583,256,normal,6,zero,,0.005680937610553498,2579,496,224,336,944,Glorot,,tanh,0.012932141621907553,0.012923836708068848,0.012991706530253092,0.013070623079935709,0.013092597325642904,0.013291279474894205,0.0108108917872111,0.01273043950398763,0.6197657783826193,0.001344036568165875,COMPLETE
4,1.0332425832748413,2025-09-02 03:32:31.036944,2025-09-02 03:37:51.183652,0 days 00:05:20.146708,256,normal,7,nz,0.00332977912693167,7.637327239040629e-06,114,176,576,608,864,Glorot,,logistic,0.01303549607594808,0.013118386268615723,0.013041496276855469,0.013028303782145182,0.013036449750264486,0.013152201970418295,0.012938698132832846,0.013050147465297151,1.0332425832748413,0.0005738710023158887,COMPLETE
5,1.0459067821502686,2025-09-02 03:37:51.184078,2025-09-02 03:45:42.592462,0 days 00:07:51.408384,256,uniform,5,zero,,2.754579187431952e-06,128,944,944,768,784,Glorot,,tanh,0.013140678405761719,0.013052026430765787,0.013156453768412272,0.01312716801961263,0.013151963551839193,0.013088583946228027,0.013103842735290527,0.013117245265415736,1.0459067821502686,0.0030545539280990067,COMPLETE
6,0.9751091798146566,2025-09-02 03:45:42.592899,2025-09-02 03:51:02.505303,0 days 00:05:19.912404,256,uniform,5,zero,,0.010155970644048225,323,624,128,944,1008,old,1.9540912485570676,logistic,0.013338009516398111,0.01312251885732015,0.01307229200998942,0.013178229331970215,0.013073364893595377,0.013094703356424967,0.0127946138381958,0.013096247400556291,0.9751091798146566,0.0056857275388052485,COMPLETE
7,1.029526670773824,2025-09-02 03:51:02.506411,2025-09-02 04:04:11.388467,0 days 00:13:08.882056,100,uniform,8,zero,,1.9670000815753223e-05,2947,624,928,1024,864,old,1.7685618590876564,logistic,0.013122995694478353,0.013116399447123209,0.013086636861165365,0.013188521067301432,0.01307364304860433,0.01309812068939209,0.013136982917785645,0.01311761424655006,1.029526670773824,0.0054449826584984365,COMPLETE
8,0.9237589438756307,2025-09-02 04:04:11.389237,2025-09-02 04:09:02.272601,0 days 00:04:50.883364,256,normal,5,nz,0.00022322339992933733,0.004226725354450022,160,432,448,784,560,Glorot,,tanh,0.013216574986775717,0.013101895650227865,0.013202428817749023,0.012889981269836426,0.01316539446512858,0.013074636459350586,0.01319587230682373,0.01312096913655599,0.9237589438756307,0.01529949369254152,COMPLETE
9,0.36507948239644367,2025-09-02 04:09:02.273355,2025-09-02 04:20:32.144737,0 days 00:11:29.871382,100,normal,5,zero,,0.7942211358209026,557,592,432,192,816,Glorot,,tanh,0.011232455571492514,0.010442733764648438,0.012308597564697266,0.012445529301961264,0.012382785479227701,0.010201970736185709,0.006571253140767415,0.0107979036512829,0.36507948239644367,0.004837423389118762,COMPLETE
10,1.0311301549275715,2025-09-02 04:20:32.145635,2025-09-02 04:26:39.283376,0 days 00:06:07.137741,512,normal,7,nz,6.886891123861803e-07,7.091274531602468e-06,1569,464,720,816,976,old,0.2755374402164064,logistic,0.01313173770904541,0.013028899828592936,0.013063510258992514,0.013046622276306152,0.013087948163350424,0.013025482495625814,0.013141314188639322,0.013075073560078938,1.0311301549275715,0.004086738130575845,COMPLETE
11,0.3997880121072133,2025-09-02 04:26:39.283810,2025-09-02 04:38:06.978753,0 days 00:11:27.694943,100,uniform,5,zero,,0.02326891288009884,2421,672,720,288,848,Glorot,,logistic,0.012996077537536621,0.012984792391459147,0.01305703322092692,0.012999653816223145,0.013048648834228516,0.012769977251688639,0.008130073547363281,0.012283750942775182,0.3997880121072133,0.0032837775744291,COMPLETE
12,0.40808194875717163,2025-09-02 04:38:06.979183,2025-09-02 04:41:22.277401,0 days 00:03:15.298218,512,normal,8,zero,,0.02099343416883146,6412,160,736,192,496,Glorot,,logistic,0.01293790340423584,0.012707352638244629,0.013020594914754232,0.01343536376953125,0.0130540132522583,0.012716730435689291,0.00819865862528483,0.012295802434285482,0.40808194875717163,0.0032890706028777805,COMPLETE
13,0.9760001103083292,2025-09-02 04:41:22.278435,2025-09-02 05:39:34.183193,0 days 00:58:11.904758,20,uniform,7,nz,0.00043594559063739585,0.00023118032388802064,2676,512,224,384,1024,Glorot,,tanh,0.012824535369873047,0.012901902198791504,0.013076504071553549,0.013087590535481771,0.013120293617248535,0.012990156809488932,0.012792388598124186,0.012970481600080219,0.9760001103083292,0.003990990373434778,COMPLETE
14,0.7830170392990112,2025-09-02 05:39:34.183625,2025-09-02 05:45:35.996609,0 days 00:06:01.812984,256,normal,5,zero,,0.00026913942522638486,9984,160,752,608,928,Glorot,,tanh,0.013086318969726562,0.01293806234995524,0.01309812068939209,0.013598243395487467,0.013200322786966959,0.012999494870503744,0.012978076934814453,0.013128377142406644,0.7830170392990112,0.003982884149281695,COMPLETE
15,0.3012455701828003,2025-09-02 05:45:35.997664,2025-09-02 06:43:06.839613,0 days 00:57:30.841949,20,normal,5,zero,,0.004324441653743999,8502,912,992,592,304,old,0.23980012043331808,tanh,0.013078689575195312,0.013002832730611166,0.013083457946777344,0.01302949587504069,0.013057947158813477,0.012825767199198404,0.011150081952412924,0.012746896062578474,0.3012455701828003,0.002577461744470228,COMPLETE
16,0.32100383440653485,2025-09-02 06:43:06.840057,2025-09-02 06:48:51.461434,0 days 00:05:44.621377,512,normal,6,zero,,0.02941609772629461,1486,864,928,832,416,Glorot,,tanh,0.012913664182027182,0.012969136238098145,0.013001203536987305,0.013099312782287598,0.013012290000915527,0.012881954511006674,0.011458714803059896,0.012762325150626046,0.32100383440653485,0.0028924920970825867,COMPLETE
17,0.4596629738807678,2025-09-02 06:48:51.462300,2025-09-02 06:53:09.479975,0 days 00:04:18.017675,512,uniform,8,zero,,0.019496797863316546,2803,128,640,1024,288,old,0.7474767295818554,logistic,0.013037403424580893,0.01301435629526774,0.013375202814737955,0.013122280438741049,0.013039986292521158,0.012974063555399576,0.009247064590454102,0.012544336773100354,0.4596629738807678,0.0022815112872732438,COMPLETE
18,0.26265767216682434,2025-09-02 06:53:09.480407,2025-09-02 07:51:01.500781,0 days 00:57:52.020374,20,uniform,8,nz,7.912564278229206e-06,0.5338198303764419,1880,976,944,816,352,Glorot,,tanh,0.010633428891499838,0.011380314826965332,0.011420647303263346,0.01238858699798584,0.010738174120585123,0.011203726132710775,0.006602644920349121,0.010623931884765625,0.26265767216682434,0.0033340935093169556,COMPLETE
19,0.22924186289310455,2025-09-02 07:51:01.501519,2025-09-02 08:47:33.997211,0 days 00:56:32.495692,20,uniform,8,nz,4.913054928253148e-06,0.10473797977329813,1494,656,784,736,560,Glorot,,tanh,0.01230760415395101,0.01257169246673584,0.012647032737731934,0.01274267832438151,0.012644449869791666,0.012352426846822103,0.008090535799662272,0.011908060028439476,0.22924186289310455,0.0006576399759086087,COMPLETE
20,0.26313665012518567,2025-09-02 08:47:33.997643,2025-09-02 09:46:01.300876,0 days 00:58:27.303233,20,uniform,8,nz,5.135502300560386e-06,0.5529241977447701,598,896,960,880,432,Glorot,,logistic,0.012383103370666504,0.01256402333577474,0.012610435485839844,0.012853503227233887,0.01248025894165039,0.012464563051859537,0.005085905392964681,0.011491684686569942,0.26313665012518567,0.016941755816117947,COMPLETE
21,0.2710295120875041,2025-09-02 09:46:01.301312,2025-09-02 10:44:28.471387,0 days 00:58:27.170075,20,uniform,8,nz,5.239312248505844e-06,0.7943482729305718,2029,976,1024,864,368,Glorot,,tanh,0.009827494621276855,0.010467012723286947,0.009941856066385904,0.011972268422444662,0.009009798367818197,0.010288278261820475,0.005980292956034343,0.009641000202723913,0.2710295120875041,0.0037282403722113423,COMPLETE
22,0.2265971302986145,2025-09-02 10:44:28.472191,2025-09-02 10:51:05.412711,0 days 00:06:36.940520,256,uniform,8,zero,,0.3618638154745876,1247,608,880,688,656,Glorot,,tanh,0.011983752250671387,0.012251536051432291,0.012598514556884766,0.012596805890401205,0.012499094009399414,0.012132763862609863,0.00845197836558024,0.011787777855282738,0.2265971302986145,0.000352136053544095,COMPLETE
23,0.5234807729721069,2025-09-02 10:51:05.413156,2025-09-02 10:58:20.401529,0 days 00:07:14.988373,256,uniform,8,zero,,0.006509462385517838,702,480,1024,944,480,Glorot,,tanh,0.013065616289774576,0.013083140055338541,0.013060728708902994,0.013025760650634766,0.01307821273803711,0.01301745573679606,0.012752175331115723,0.013011869930085683,0.5234807729721069,0.009487724095298975,COMPLETE
24,0.21717456976572672,2025-09-02 10:58:20.401956,2025-09-02 11:05:09.637046,0 days 00:06:49.235090,256,uniform,8,nz,2.664628243753044e-05,0.3471391322506366,2144,384,768,704,848,Glorot,,tanh,0.011404871940612793,0.012044111887613932,0.012510021527608236,0.0125657320022583,0.0124129851659139,0.011931419372558594,0.006631692250569661,0.011357262021019346,0.21717456976572672,0.0037232245820720904,COMPLETE
25,0.5235206683476766,2025-09-02 11:05:09.637931,2025-09-02 12:03:27.015905,0 days 00:58:17.377974,20,uniform,8,nz,3.277409387818764e-05,0.0042158891274042,1176,496,656,720,736,Glorot,,tanh,0.012971083323160807,0.013083179791768393,0.012986858685811361,0.012966434160868326,0.013071735699971518,0.013059020042419434,0.012380361557006836,0.012931239037286667,0.5235206683476766,0.004544009328274179,COMPLETE
26,0.3386247456073761,2025-09-02 12:03:27.016877,2025-09-02 12:10:23.242487,0 days 00:06:56.225610,256,uniform,8,nz,2.5217854328528264e-07,0.828103053208669,4436,176,736,880,896,Glorot,,tanh,0.00817720095316569,0.010448058446248373,0.010163029034932455,0.009301543235778809,0.01057263215382894,0.01025839646657308,0.00454258918762207,0.00906620706830706,0.3386247456073761,0.00586212837776751,COMPLETE
27,0.3238540093104045,2025-09-02 12:10:23.243262,2025-09-02 12:16:24.271026,0 days 00:06:01.027764,256,uniform,7,zero,,0.6873874775410846,1594,672,736,736,528,Glorot,,tanh,0.010946114857991537,0.011704206466674805,0.011796355247497559,0.012268900871276855,0.011633594830830893,0.011461774508158365,0.007777015368143718,0.011083994592939106,0.3238540093104045,0.010111068258915714,COMPLETE
28,0.20918624103069305,2025-09-02 12:16:24.271497,2025-09-02 12:28:06.564847,0 days 00:11:42.293350,100,uniform,8,nz,5.7729576443848264e-05,0.20615901571943002,1674,320,848,432,624,Glorot,,tanh,0.011994004249572754,0.012001792589823404,0.012402017911275228,0.012431979179382324,0.012363632520039877,0.01158301035563151,0.006741960843404134,0.011359771092732746,0.20918624103069305,0.0010420524873150543,COMPLETE
29,0.38042988379796344,2025-09-02 12:28:06.565315,2025-09-02 12:33:25.645973,0 days 00:05:19.080658,512,uniform,6,nz,0.00015057193475900653,0.01318052415599182,2093,320,960,384,816,Glorot,,tanh,0.013031760851542154,0.013130625089009603,0.013027667999267578,0.012849768002827963,0.013065616289774576,0.013040900230407715,0.011789043744405111,0.012847911743890671,0.38042988379796344,0.002608237231993227,COMPLETE
30,0.5226409037907919,2025-09-02 12:33:25.646407,2025-09-02 12:45:08.998883,0 days 00:11:43.352476,100,normal,5,nz,0.00850314216770212,0.13677831523175638,1666,304,768,608,368,Glorot,,tanh,3.059705098470052e-05,0.15867435932159424,0.1309922138849894,0.0022760629653930664,0.18023486932118735,0.018961191177368164,5.928675333658854e-05,0.07017551149640765,0.5226409037907919,0.002032334169454188,COMPLETE
31,0.19993761678536734,2025-09-02 12:45:08.999315,2025-09-02 12:56:51.523344,0 days 00:11:42.524029,100,uniform,8,nz,2.1456654367285786e-05,0.23473328789229086,2311,544,864,480,928,old,1.364205724545954,tanh,0.011960426966349283,0.012134671211242676,0.012630899747212728,0.012570897738138834,0.01250457763671875,0.011561234792073568,0.006647586822509766,0.011430042130606515,0.19993761678536734,0.0004834540941130712,COMPLETE
32,0.27393195033073425,2025-09-02 12:56:51.523775,2025-09-02 13:08:37.595059,0 days 00:11:46.071284,100,uniform,8,nz,6.6580991834695e-05,0.45567857286807206,1433,320,896,176,496,Glorot,,tanh,0.011623183886210123,0.009677886962890625,0.011826872825622559,0.012115716934204102,0.011946320533752441,0.009629289309183756,0.006830493609110515,0.010521394865853446,0.27393195033073425,0.0023544277530792865,COMPLETE
33,0.32938899596532184,2025-09-02 13:08:37.595487,2025-09-02 13:20:22.549131,0 days 00:11:44.953644,100,uniform,8,nz,7.221274670813602e-05,0.012949461507152489,2911,560,688,592,928,old,1.303604140612139,tanh,0.012920061747233072,0.012980818748474121,0.013028740882873535,0.012963016827901205,0.013072967529296875,0.012908458709716797,0.01054708162943522,0.01263159229641869,0.32938899596532184,0.003180705622703637,COMPLETE
34,0.3029463092486064,2025-09-02 13:20:22.556121,2025-09-02 13:27:37.286898,0 days 00:07:14.730777,256,uniform,8,nz,2.815390427987817e-05,0.36387275686023823,312,416,736,688,1024,Glorot,,logistic,0.0127561887105306,0.013002435366312662,0.013054807980855307,0.012879530588785807,0.01295145352681478,0.01287388801574707,0.005717118581136067,0.011890774681454611,0.3029463092486064,0.00794168088027652,COMPLETE
35,0.28622432549794513,2025-09-02 13:27:37.287590,2025-09-02 13:39:29.551937,0 days 00:11:52.264347,100,uniform,8,nz,4.464002435787205e-05,0.9283857106495265,2838,624,896,560,816,Glorot,,tanh,0.007915774981180826,0.007952411969502768,0.008722941080729166,0.010993361473083496,0.00970160961151123,0.007405002911885579,0.002703706423441569,0.007913544064476375,0.28622432549794513,0.0017171697732892414,COMPLETE
36,0.2532263398170471,2025-09-02 13:39:29.552836,2025-09-02 13:46:25.304973,0 days 00:06:55.752137,256,uniform,8,zero,,0.039563301780676845,2669,576,832,640,944,Glorot,,tanh,0.01274247964223226,0.012954990069071451,0.012993892033894857,0.012942115465799967,0.01288755734761556,0.012811621030171713,0.009614785512288412,0.012421063014439172,0.2532263398170471,0.0019104530173680231,COMPLETE
37,0.2809552351633708,2025-09-02 13:46:25.305439,2025-09-02 13:58:13.008922,0 days 00:11:47.703483,100,normal,7,nz,2.4141712483584453e-06,0.02805574217994328,2105,288,768,624,960,Glorot,,tanh,0.012887875239054361,0.01282958189646403,0.01302639643351237,0.012993534406026205,0.012872099876403809,0.012758731842041016,0.009995063145955404,0.012480468977065314,0.2809552351633708,0.000262850294655422,COMPLETE
38,0.5314243137836456,2025-09-02 13:58:13.009360,2025-09-02 14:56:50.653140,0 days 00:58:37.643780,20,uniform,5,nz,0.00042897475355944893,0.794927123770942,1532,736,832,384,752,old,1.1191318660245946,tanh,2.3603439331054688e-05,0.0007768869400024414,0.00016542275746663412,0.00026969114939371747,8.598963419596355e-05,2.4557113647460938e-05,2.8173128763834637e-05,0.000196332023257301,0.5314243137836456,0.0567621919601933,COMPLETE
39,0.26813329259554547,2025-09-02 14:56:50.653580,2025-09-02 15:08:34.540518,0 days 00:11:43.886938,100,normal,8,nz,1.9035118248792397e-05,0.03410244553848345,2070,224,912,368,944,old,1.3662514877908687,tanh,0.012763381004333496,0.01274418830871582,0.012969374656677246,0.013429522514343262,0.01294243335723877,0.012609759966532389,0.01011359691619873,0.012510322389148532,0.26813329259554547,0.0020885040894620416,COMPLETE
40,0.4023615022500356,2025-09-02 15:08:34.541750,2025-09-02 15:13:45.598244,0 days 00:05:11.056494,256,uniform,8,nz,0.0002772820270921221,0.5647383041738259,3526,624,624,144,912,old,0.9923636266589262,tanh,0.0066663821538289385,0.0005535284678141276,0.007726152737935384,0.009164889653523764,0.008760492006937662,0.000838001569112142,3.337860107421875e-06,0.00481611206417992,0.4023615022500356,0.004489264389437256,COMPLETE
41,0.2810903588930766,2025-09-02 15:13:45.599172,2025-09-02 15:19:57.730557,0 days 00:06:12.131385,256,uniform,8,zero,,0.6026421451604561,6504,544,784,624,720,old,1.457139494867429,logistic,0.01043093204498291,0.011243303616841635,0.011654535929361979,0.011903723080952963,0.011266787846883139,0.010878920555114746,0.00406483809153239,0.010206148737952824,0.2810903588930766,0.00028934339211795346,COMPLETE
42,0.28785157203674316,2025-09-02 15:19:57.730982,2025-09-02 15:27:01.799109,0 days 00:07:04.068127,256,uniform,6,zero,,0.6073521152263005,1848,496,928,768,688,old,1.4884091913963704,tanh,0.011264880498250326,0.011793891588846842,0.012050032615661621,0.012110273043314615,0.012006719907124838,0.011636773745218912,0.00850224494934082,0.011337830906822569,0.28785157203674316,0.005745985459370322,COMPLETE
43,0.2689383029937744,2025-09-02 15:27:01.799561,2025-09-02 16:25:04.153310,0 days 00:58:02.353749,20,uniform,8,nz,3.2702081126029865e-06,0.038250815238813574,3735,336,1008,560,544,Glorot,,logistic,0.012787461280822754,0.012938777605692545,0.01297291119893392,0.012869914372762045,0.012719472249348959,0.012511094411214193,0.006182233492533366,0.011854552087329684,0.2689383029937744,0.002718011616758913,COMPLETE
44,0.22844254473845163,2025-09-02 16:25:04.154338,2025-09-02 16:29:44.139867,0 days 00:04:39.985529,256,uniform,6,nz,7.00129543456053e-06,0.21619507619038936,2107,192,448,400,720,Glorot,,tanh,0.011586785316467285,0.011928121248881022,0.012641072273254395,0.011828303337097168,0.012470444043477377,0.011656641960144043,0.0045530398686726885,0.010952058292570567,0.22844254473845163,0.0014532835187547498,COMPLETE
45,0.4241099754969279,2025-09-02 16:29:44.140314,2025-09-02 16:34:24.386671,0 days 00:04:40.246357,256,uniform,6,nz,1.5795668486906242e-05,0.03222364344089026,624,208,528,272,704,Glorot,,tanh,0.013060172398885092,0.013186216354370117,0.013064344724019369,0.013299783070882162,0.013084212938944498,0.012501398722330729,0.010866006215413412,0.012723162060692197,0.4241099754969279,0.0066223740601093865,COMPLETE
46,0.2621033291021983,2025-09-02 16:34:24.387107,2025-09-02 16:38:57.326862,0 days 00:04:32.939755,256,uniform,6,zero,,0.36704005795857475,6064,416,304,304,480,Glorot,,tanh,0.007981816927591959,0.01017932097117106,0.011529803276062012,0.012135823567708334,0.011419177055358887,0.009911179542541504,0.001531839370727539,0.00924128010159447,0.2621033291021983,0.007537833994425972,COMPLETE
47,0.2834304968516032,2025-09-02 16:38:57.327791,2025-09-02 16:50:19.675041,0 days 00:11:22.347250,100,uniform,8,zero,,0.7994978204178084,2840,496,864,336,992,old,0.9640006530308248,tanh,0.009680469830830893,0.008514960606892904,0.010796268781026205,0.01160756746927897,0.011465668678283691,0.008179306983947754,0.005607207616170247,0.009407349995204381,0.2834304968516032,0.004758068203098965,COMPLETE
48,0.3129468460877736,2025-09-02 16:50:19.675512,2025-09-02 16:55:32.716208,0 days 00:05:13.040696,256,uniform,6,nz,2.1225711320195424e-05,0.7197359276861405,4170,144,640,576,768,Glorot,,logistic,0.009917537371317545,0.011025190353393555,0.011328498522440592,0.010205745697021484,0.010950724283854166,0.01068413257598877,0.0021790663401285806,0.009470127877734958,0.3129468460877736,0.006309435558486369,COMPLETE
49,0.31136636932690936,2025-09-02 16:55:32.716636,2025-09-02 17:00:10.551414,0 days 00:04:37.834778,256,uniform,6,nz,2.0782556175811185e-05,0.11129454501503566,2248,304,144,672,1008,Glorot,,tanh,0.012233376502990723,0.01266173521677653,0.01287527879079183,0.012863357861836752,0.012924989064534506,0.0127791961034139,0.001781145731608073,0.01115986846742176,0.31136636932690936,0.001531522934273169,COMPLETE
50,0.2747659385204315,2025-09-02 17:00:10.552277,2025-09-02 17:11:36.418077,0 days 00:11:25.865800,100,normal,8,zero,,0.3746157135047066,513,176,720,400,656,Glorot,,tanh,0.012304266293843588,0.012403011322021484,0.012728015581766764,0.01282207171122233,0.012607177098592123,0.012096683184305826,0.008805632591247559,0.011966693968999954,0.2747659385204315,0.012481927520069177,COMPLETE
