number,value,datetime_start,datetime_complete,duration,params_batch_size,params_dist1,params_iseed,params_l2_penalty_choice,params_l2_penalty_nz,params_lr,params_lr_anneal_start,params_nhid1,params_scale_heur1,params_scale_mult1,params_squash,user_attrs_avg_fit_criteria,state,avg_fit_criteria
98,0.4352419599890709,2025-09-03 08:37:13.717377,2025-09-03 08:44:43.657208,0 days 00:07:29.939831,100,normal,6,nz,0.0055234170190916485,0.8169081702485854,3565,800,Glorot,,tanh,,COMPLETE,
99,0.09835484176874161,2025-09-03 08:44:43.657682,2025-09-03 09:19:44.150784,0 days 00:35:00.493102,20,normal,8,zero,,0.5501402230622023,3851,1008,old,1.9855035551207383,tanh,,COMPLETE,
100,0.972451639175415,2025-09-03 09:19:44.151238,2025-09-03 09:26:54.323443,0 days 00:07:10.172205,100,normal,6,zero,,0.46805910398254674,1425,880,Glorot,,tanh,0.003788661956787109,COMPLETE,0.003788661956787109
101,0.9740000247955323,2025-09-03 09:26:54.324192,2025-09-03 09:34:14.687821,0 days 00:07:20.363629,100,normal,8,zero,,0.41803878133295946,7807,736,old,1.3834731625029877,tanh,0.0009839534759521484,COMPLETE,0.0009839534759521484
102,0.9722580909729004,2025-09-03 09:34:14.688276,2025-09-03 09:41:20.010052,0 days 00:07:05.321776,100,normal,8,zero,,0.19388040925949931,8836,688,old,1.067052334265491,tanh,0.0031622648239135742,COMPLETE,0.0031622648239135742
103,0.9785645365715027,2025-09-03 09:41:20.010505,2025-09-03 10:16:14.501743,0 days 00:34:54.491238,20,uniform,5,zero,,0.22197522014472365,3746,848,old,1.215674629865324,tanh,0.0009949207305908203,COMPLETE,0.0009949207305908203
104,0.9793548583984375,2025-09-03 10:16:14.502581,2025-09-03 10:51:16.438969,0 days 00:35:01.936388,20,uniform,5,zero,,0.11371760522086971,9029,768,old,1.1040938246442247,tanh,0.00167391300201416,COMPLETE,0.00167391300201416
105,0.9676774501800537,2025-09-03 10:51:16.439432,2025-09-03 11:26:27.203077,0 days 00:35:10.763645,20,normal,5,zero,,0.04448589474463582,9571,720,old,1.0096360657806303,logistic,0.001660776138305664,COMPLETE,0.001660776138305664
106,0.9790806651115418,2025-09-03 11:26:27.203523,2025-09-03 12:02:26.119649,0 days 00:35:58.916126,20,uniform,5,zero,,0.16877577422068335,6522,976,old,1.1132437104138475,tanh,0.001447010040283203,COMPLETE,0.001447010040283203
107,0.9789193749427796,2025-09-03 12:02:26.120098,2025-09-03 12:37:41.252945,0 days 00:35:15.132847,20,uniform,5,zero,,0.2542195041813392,5743,928,old,1.012461547013726,tanh,0.00045146942138671873,COMPLETE,0.00045146942138671873
108,0.9791129231452942,2025-09-03 12:37:41.253700,2025-09-03 13:12:24.629998,0 days 00:34:43.376298,20,uniform,5,zero,,0.13519879759509265,5650,928,old,0.933795663354792,tanh,0.002504587173461914,COMPLETE,0.002504587173461914
109,0.09835484176874161,2025-09-03 13:12:24.630467,2025-09-03 13:47:16.973319,0 days 00:34:52.342852,20,uniform,5,zero,,0.6966176476660141,5793,912,old,0.7791188139749805,tanh,,COMPLETE,
110,0.9323387622833252,2025-09-03 13:47:16.973774,2025-09-03 14:22:28.748382,0 days 00:35:11.774608,20,uniform,5,zero,,0.002251416736128171,4230,1008,old,1.0676614464743361,tanh,0.012513303756713867,COMPLETE,0.012513303756713867
111,0.9719032526016236,2025-09-03 14:22:28.749623,2025-09-03 14:57:24.560075,0 days 00:34:55.810452,20,uniform,5,zero,,0.07116647438959793,8897,976,old,0.9298766532871876,logistic,0.0019230365753173829,COMPLETE,0.0019230365753173829
112,0.9670806765556336,2025-09-03 14:57:24.560769,2025-09-03 15:32:17.785401,0 days 00:34:53.224632,20,uniform,8,zero,,0.012483423052120739,5129,944,old,1.0510265037426034,tanh,0.009653592109680175,COMPLETE,0.009653592109680175
113,0.9731451869010925,2025-09-03 15:32:17.785849,2025-09-03 16:07:13.522159,0 days 00:34:55.736310,20,normal,5,zero,,0.03740830044151491,9681,944,old,1.0588196718983767,tanh,0.005324316024780273,COMPLETE,0.005324316024780273
114,0.9725322842597961,2025-09-03 16:07:13.522944,2025-09-03 16:42:36.016068,0 days 00:35:22.493124,20,uniform,5,zero,,0.04647660490168486,1901,752,old,0.8635014721688566,tanh,0.007992410659790039,COMPLETE,0.007992410659790039
115,0.965435516834259,2025-09-03 16:42:36.017043,2025-09-03 16:49:58.335119,0 days 00:07:22.318076,100,uniform,8,nz,1.1195671591779506e-06,0.034983597293800815,5507,1008,old,1.1314580200267106,tanh,0.008880615234375,COMPLETE,0.008880615234375
116,0.9800322771072387,2025-09-03 16:49:58.335779,2025-09-03 17:25:03.959798,0 days 00:35:05.624019,20,uniform,5,zero,,0.1691330714234881,9084,656,old,0.6640990526049928,tanh,0.0005267143249511718,COMPLETE,0.0005267143249511718
117,0.9780484080314636,2025-09-03 17:25:03.960252,2025-09-03 18:00:03.489441,0 days 00:34:59.529189,20,uniform,5,zero,,0.05081924298090806,7216,624,old,0.569236986716912,tanh,0.004554486274719239,COMPLETE,0.004554486274719239
118,0.9784677624702454,2025-09-03 18:00:03.489882,2025-09-03 18:34:35.411874,0 days 00:34:31.921992,20,uniform,5,zero,,0.14176056873076132,4586,576,old,0.5080172547307432,tanh,0.0016774892807006835,COMPLETE,0.0016774892807006835
119,0.9633064866065979,2025-09-03 18:34:35.412653,2025-09-03 18:41:36.610490,0 days 00:07:01.197837,100,uniform,5,zero,,0.009086917601259533,8958,368,old,0.4556254850487962,tanh,0.00820612907409668,COMPLETE,0.00820612907409668
120,0.973258090019226,2025-09-03 18:41:36.611113,2025-09-03 19:16:18.916891,0 days 00:34:42.305778,20,uniform,5,zero,,0.011388158775331197,9698,512,old,0.551539825178081,tanh,0.0073634862899780275,COMPLETE,0.0073634862899780275
121,0.930854880809784,2025-09-03 19:16:18.917341,2025-09-03 19:51:41.718051,0 days 00:35:22.800710,20,normal,7,zero,,0.001892214763918704,4718,672,old,0.5931967361394958,tanh,0.012175345420837402,COMPLETE,0.012175345420837402
122,0.978290343284607,2025-09-03 19:51:41.718511,2025-09-03 20:27:03.427913,0 days 00:35:21.709402,20,uniform,6,zero,,0.1476278196866119,4441,816,old,0.6415002080823068,tanh,0.0025008201599121095,COMPLETE,0.0025008201599121095
123,0.9428387641906738,2025-09-03 20:27:03.428375,2025-09-03 21:02:40.018989,0 days 00:35:36.590614,20,uniform,6,zero,,0.0016454167482845825,6321,752,old,0.6183378281834937,tanh,0.012385082244873048,COMPLETE,0.012385082244873048
124,0.9797096967697143,2025-09-03 21:02:40.019451,2025-09-03 21:40:10.050450,0 days 00:37:30.030999,20,uniform,5,nz,6.728843766760982e-08,0.25052600682451587,9042,704,old,0.2967577406311399,tanh,0.0002849102020263672,COMPLETE,0.0002849102020263672
125,0.9772258281707764,2025-09-03 21:40:10.051119,2025-09-03 22:18:24.812000,0 days 00:38:14.760881,20,uniform,5,nz,3.54124191857938e-08,0.04334830733368026,4674,704,old,0.2794813950982275,tanh,0.0067807197570800785,COMPLETE,0.0067807197570800785
126,0.09835484176874161,2025-09-03 22:18:24.812791,2025-09-03 22:55:37.488249,0 days 00:37:12.675458,20,normal,5,nz,5.677445255466149e-08,0.6706735335273503,5360,656,old,0.24887705281642153,tanh,,COMPLETE,
127,0.9795806646347046,2025-09-03 22:55:37.488707,2025-09-03 23:33:27.402794,0 days 00:37:49.914087,20,uniform,5,nz,2.3826972043838878e-08,0.2681384609066945,8895,832,old,0.22639784465746188,tanh,0.00047109127044677737,COMPLETE,0.00047109127044677737
