number,value,datetime_start,datetime_complete,duration,params_batch_size,params_dist1,params_iseed,params_l2_penalty_choice,params_l2_penalty_nz,params_lr,params_lr_anneal_start,params_nhid1,params_scale_heur1,params_scale_mult1,params_squash,user_attrs_avg_fit_criteria,state,avg_fit_criteria
0,0.9228871107101441,2025-09-02 03:16:17.615042,2025-09-02 03:23:44.983158,0 days 00:07:27.368116,100,normal,8,zero,,0.012611815565767931,2659,832,old,1.1017912259422258,logistic,0.010013842582702636,COMPLETE,0.010013842582702636
1,0.9499194025993347,2025-09-02 03:23:44.983731,2025-09-02 04:02:16.781205,0 days 00:38:31.797474,20,uniform,6,nz,2.0547199328558857e-07,0.16396997761073914,743,192,old,1.2225775747269245,logistic,0.0012844085693359375,COMPLETE,0.0012844085693359375
2,0.14193548858165742,2025-09-02 04:02:16.781985,2025-09-02 04:09:12.805391,0 days 00:06:56.023406,100,uniform,5,zero,,9.506281571106352e-05,1011,288,Glorot,,logistic,0.01303846836090088,COMPLETE,0.01303846836090088
3,0.7143709897994995,2025-09-02 04:09:12.806236,2025-09-02 04:47:01.888077,0 days 00:37:49.081841,20,uniform,8,nz,3.340579416277081e-05,2.1049515830306782e-06,798,992,Glorot,,tanh,0.013118886947631836,COMPLETE,0.013118886947631836
4,0.9269838809967041,2025-09-02 04:47:01.888878,2025-09-02 04:54:13.075689,0 days 00:07:11.186811,100,normal,8,zero,,0.005680937610553498,2579,496,Glorot,,tanh,0.011334657669067383,COMPLETE,0.011334657669067383
5,0.9385161876678467,2025-09-02 04:54:13.076133,2025-09-02 05:29:16.264755,0 days 00:35:03.188622,20,normal,7,zero,,0.040058969243291886,2604,992,Glorot,,logistic,0.007365083694458008,COMPLETE,0.007365083694458008
6,0.14472581148147584,2025-09-02 05:29:16.265429,2025-09-02 05:36:19.359170,0 days 00:07:03.093741,100,uniform,8,zero,,1.2460411629798946e-05,6359,416,Glorot,,logistic,0.012998342514038086,COMPLETE,0.012998342514038086
7,0.7066290736198425,2025-09-02 05:36:19.359953,2025-09-02 05:43:18.538742,0 days 00:06:59.178789,100,normal,5,zero,,6.369821113063238e-06,9757,720,old,0.5115210082666259,tanh,0.013144969940185547,COMPLETE,0.013144969940185547
8,0.694887125492096,2025-09-02 05:43:18.539430,2025-09-02 06:18:15.148173,0 days 00:34:56.608743,20,uniform,6,zero,,4.4654883954691955e-06,3564,416,old,0.6601759155814514,tanh,0.012976741790771485,COMPLETE,0.012976741790771485
9,0.9013710021972656,2025-09-02 06:18:15.148996,2025-09-02 06:25:41.598572,0 days 00:07:26.449576,100,uniform,8,nz,1.5621204728163365e-06,0.0036346950323246753,538,928,Glorot,,tanh,0.012747716903686524,COMPLETE,0.012747716903686524
10,0.8218226313591004,2025-09-02 06:25:41.600109,2025-09-02 07:03:07.527275,0 days 00:37:25.927166,20,uniform,5,nz,5.7833085248908403e-08,0.0007135089719871662,487,576,Glorot,,tanh,0.012955856323242188,COMPLETE,0.012955856323242188
11,0.8326451897621154,2025-09-02 07:03:07.527716,2025-09-02 07:38:03.765220,0 days 00:34:56.237504,20,normal,8,zero,,0.00043340174043252305,365,976,old,0.273941419851531,tanh,0.013077473640441895,COMPLETE,0.013077473640441895
12,0.894677460193634,2025-09-02 07:38:03.765672,2025-09-02 07:45:11.127659,0 days 00:07:07.361987,100,uniform,5,zero,,0.006036687230540028,518,496,old,0.8331442788576597,logistic,0.011456918716430665,COMPLETE,0.011456918716430665
13,0.11364516615867615,2025-09-02 07:45:11.128107,2025-09-02 07:52:44.103661,0 days 00:07:32.975554,100,uniform,7,nz,1.367989792242663e-08,7.091274531602468e-06,1569,384,Glorot,,logistic,0.013120555877685547,COMPLETE,0.013120555877685547
14,0.8457903504371643,2025-09-02 07:52:44.104383,2025-09-02 07:59:46.252232,0 days 00:07:02.147849,100,normal,5,zero,,0.013094244682014585,301,160,old,1.3330847803202919,logistic,0.007649087905883789,COMPLETE,0.007649087905883789
15,0.7036774516105652,2025-09-02 07:59:46.252972,2025-09-02 08:07:12.925394,0 days 00:07:26.672422,100,normal,6,nz,1.2134601472469401e-05,0.0002887138756286331,121,592,old,0.33709258675285036,tanh,0.013114333152770996,COMPLETE,0.013114333152770996
16,0.9431774735450744,2025-09-02 08:07:12.925834,2025-09-02 08:14:11.341857,0 days 00:06:58.416023,100,uniform,7,zero,,0.0856956409647669,1799,352,Glorot,,logistic,0.0028456449508666992,COMPLETE,0.0028456449508666992
17,0.7118387460708618,2025-09-02 08:14:11.342577,2025-09-02 08:21:04.210322,0 days 00:06:52.867745,100,uniform,5,zero,,9.318544447640828e-06,368,576,Glorot,,tanh,0.01309950351715088,COMPLETE,0.01309950351715088
18,0.8613709807395935,2025-09-02 08:21:04.211033,2025-09-02 08:28:05.495362,0 days 00:07:01.284329,100,uniform,5,zero,,0.00026913942522638486,9984,928,old,1.1287749591948544,logistic,0.012567710876464844,COMPLETE,0.012567710876464844
19,0.9112742185592652,2025-09-02 08:28:05.496124,2025-09-02 09:05:17.258584,0 days 00:37:11.762460,20,uniform,7,nz,0.006148641099918832,0.022461343267204566,8862,832,old,0.4495867877664373,logistic,4.911422729492188e-06,COMPLETE,4.911422729492188e-06
20,0.44504839926958084,2025-09-02 09:05:17.259383,2025-09-02 09:42:45.086665,0 days 00:37:27.827282,20,uniform,6,nz,5.557110625815338e-07,0.8553545793157464,876,368,old,1.9062151263692741,logistic,,COMPLETE,
21,0.7690968155860901,2025-09-02 09:42:45.087421,2025-09-02 10:18:33.583759,0 days 00:35:48.496338,20,normal,7,zero,,0.4263388353958704,8676,992,Glorot,,logistic,0.008819508552551269,COMPLETE,0.008819508552551269
22,0.8947742223739624,2025-09-02 10:18:33.584215,2025-09-02 10:25:53.957980,0 days 00:07:20.373765,100,uniform,7,zero,,0.3071199067326472,787,560,Glorot,,logistic,0.0001669168472290039,COMPLETE,0.0001669168472290039
23,0.7950645446777344,2025-09-02 10:25:53.958455,2025-09-02 10:33:45.712543,0 days 00:07:51.754088,100,uniform,6,nz,0.001038088694812615,0.0015360429153979428,1670,176,old,1.519212088192107,logistic,0.010537147521972656,COMPLETE,0.010537147521972656
24,0.9661935806274414,2025-09-02 10:33:45.712989,2025-09-02 11:09:09.685031,0 days 00:35:23.972042,20,normal,5,zero,,0.06793630192755795,1150,864,Glorot,,tanh,0.007731056213378907,COMPLETE,0.007731056213378907
25,0.9471290826797485,2025-09-02 11:09:09.685806,2025-09-02 11:16:27.621979,0 days 00:07:17.936173,100,uniform,7,zero,,0.03026019456560183,6484,160,Glorot,,logistic,0.0007940530776977539,COMPLETE,0.0007940530776977539
26,0.7966451838612556,2025-09-02 11:16:27.622431,2025-09-02 11:52:11.261187,0 days 00:35:43.638756,20,normal,8,zero,,0.3300002732365341,957,880,Glorot,,tanh,,COMPLETE,
27,0.9505968213081359,2025-09-02 11:52:11.261648,2025-09-02 12:27:03.388310,0 days 00:34:52.126662,20,normal,5,zero,,0.013381490638651673,2217,752,Glorot,,tanh,0.010516881942749023,COMPLETE,0.010516881942749023
28,0.9599355220794678,2025-09-02 12:27:03.388978,2025-09-02 13:02:10.891330,0 days 00:35:07.502352,20,normal,5,zero,,0.016845477461941892,2911,736,Glorot,,tanh,0.009065198898315429,COMPLETE,0.009065198898315429
29,0.9724355101585388,2025-09-02 13:02:10.891773,2025-09-02 13:36:50.795839,0 days 00:34:39.904066,20,normal,5,zero,,0.05254707793804169,4815,656,Glorot,,tanh,0.00435950756072998,COMPLETE,0.00435950756072998
30,0.9614355206489563,2025-09-02 13:36:50.796572,2025-09-02 13:44:13.753154,0 days 00:07:22.956582,100,normal,5,nz,0.0001817411659345669,0.035368625067328456,3055,736,Glorot,,tanh,0.007286381721496582,COMPLETE,0.007286381721496582
31,0.9306129097938538,2025-09-02 13:44:13.753604,2025-09-02 13:51:37.535560,0 days 00:07:23.781956,100,normal,5,nz,0.0002448311312842924,0.009476298795180856,1893,480,Glorot,,tanh,0.010966610908508301,COMPLETE,0.010966610908508301
32,0.9373548984527588,2025-09-02 13:51:37.536005,2025-09-02 13:58:36.261711,0 days 00:06:58.725706,100,normal,5,zero,,0.024548725127243463,6022,688,Glorot,,logistic,0.006855082511901855,COMPLETE,0.006855082511901855
33,0.9677580952644348,2025-09-02 13:58:36.262154,2025-09-02 14:06:07.541198,0 days 00:07:31.279044,100,normal,8,nz,0.00010197673462680623,0.07456993190622056,9231,768,Glorot,,tanh,0.0039195060729980465,COMPLETE,0.0039195060729980465
34,0.9723709940910339,2025-09-02 14:06:07.542052,2025-09-02 14:13:38.580305,0 days 00:07:31.038253,100,normal,8,nz,0.00010920492083472753,0.5848684369539937,2913,816,Glorot,,tanh,0.0003888130187988281,COMPLETE,0.0003888130187988281
35,0.9716129302978516,2025-09-02 14:13:38.580750,2025-09-02 14:21:01.469028,0 days 00:07:22.888278,100,normal,8,nz,3.3451533687657634e-05,0.3824382754291461,7755,720,old,1.9681291967150307,tanh,0.0003307104110717773,COMPLETE,0.0003307104110717773
36,0.9709838986396789,2025-09-02 14:21:01.469488,2025-09-02 14:28:26.576844,0 days 00:07:25.107356,100,normal,8,nz,3.272371773251267e-05,0.35411807092358355,9819,960,old,1.9888062736049918,tanh,0.0005945920944213867,COMPLETE,0.0005945920944213867
37,0.9748064756393433,2025-09-02 14:28:26.577611,2025-09-02 14:35:24.747208,0 days 00:06:58.169597,100,normal,8,zero,,0.548504853822087,6972,864,old,1.9951665048724543,tanh,0.0004683494567871094,COMPLETE,0.0004683494567871094
38,0.09835484176874161,2025-09-02 14:35:24.747661,2025-09-02 14:42:22.375480,0 days 00:06:57.627819,100,normal,5,zero,,0.8971190546582611,7630,896,old,1.7089028019989958,tanh,,COMPLETE,
39,0.9605161666870117,2025-09-02 14:42:22.375925,2025-09-02 14:49:50.664958,0 days 00:07:28.289033,100,normal,8,nz,1.0578558445106892e-05,0.09092640316557954,3281,576,old,1.990729576237477,tanh,0.003519010543823242,COMPLETE,0.003519010543823242
40,0.9617581009864807,2025-09-02 14:49:50.665433,2025-09-02 14:56:49.920343,0 days 00:06:59.254910,100,normal,8,zero,,0.07851867784593128,3714,896,old,1.6408710653001604,tanh,0.005661177635192871,COMPLETE,0.005661177635192871
41,0.9754032492637634,2025-09-02 14:56:49.920793,2025-09-02 15:04:23.414377,0 days 00:07:33.493584,100,uniform,8,nz,2.6301383214254814e-05,0.5711843651080354,7359,944,old,1.998713009874802,tanh,0.0003885507583618164,COMPLETE,0.0003885507583618164
42,0.9690968036651612,2025-09-02 15:04:23.415079,2025-09-02 15:11:51.092347,0 days 00:07:27.677268,100,uniform,5,nz,1.0628578528958044e-05,0.15608124315991678,5270,992,old,1.9667645390946347,tanh,0.005151581764221191,COMPLETE,0.005151581764221191
43,0.9695645451545716,2025-09-02 15:11:51.093174,2025-09-02 15:19:19.113884,0 days 00:07:28.020710,100,uniform,8,nz,0.000268990501451834,0.4977490978226023,5713,768,old,1.9937619234511288,tanh,0.056965994834899905,COMPLETE,0.056965994834899905
44,0.09835484176874161,2025-09-02 15:19:19.114333,2025-09-02 15:54:18.701771,0 days 00:34:59.587438,20,normal,6,zero,,0.9854688902346563,5513,656,old,1.6801759693378528,tanh,,COMPLETE,
45,0.9670000314712525,2025-09-02 15:54:18.705674,2025-09-02 16:01:47.249637,0 days 00:07:28.543963,100,normal,8,nz,4.9238308809757264e-06,0.4099506237710979,458,656,Glorot,,tanh,0.005301761627197266,COMPLETE,0.005301761627197266
46,0.9338871598243713,2025-09-02 16:01:47.250394,2025-09-02 16:09:13.714868,0 days 00:07:26.464474,100,normal,6,nz,9.51524040175356e-05,0.05217926046364114,1979,1008,Glorot,,logistic,0.00845353603363037,COMPLETE,0.00845353603363037
47,0.9188387274742127,2025-09-02 16:09:13.715711,2025-09-02 16:16:39.389772,0 days 00:07:25.674061,100,normal,8,nz,0.0010507136326543612,0.005357247924411346,9381,720,old,1.9867503606823542,logistic,0.0073561429977416996,COMPLETE,0.0073561429977416996
48,0.9598548769950866,2025-09-02 16:16:39.390549,2025-09-02 16:23:42.593349,0 days 00:07:03.202800,100,uniform,8,zero,,0.016883500064376323,6350,928,Glorot,,tanh,0.009076881408691406,COMPLETE,0.009076881408691406
49,0.09835484176874161,2025-09-02 16:23:42.593809,2025-09-02 16:31:09.008928,0 days 00:07:26.415119,100,uniform,7,nz,1.304703132432882e-05,0.955245151445478,4703,848,Glorot,,tanh,,COMPLETE,
50,0.9745806694030762,2025-09-02 16:31:09.009392,2025-09-02 16:38:12.556840,0 days 00:07:03.547448,100,normal,6,zero,,0.5448618356366068,2954,816,Glorot,,tanh,0.0017822504043579102,COMPLETE,0.0017822504043579102
51,0.9747742176055908,2025-09-02 16:38:12.557295,2025-09-02 16:45:17.838781,0 days 00:07:05.281486,100,normal,6,zero,,0.5052449538963422,4016,960,Glorot,,tanh,0.0019891738891601564,COMPLETE,0.0019891738891601564
52,0.9700161576271057,2025-09-02 16:45:17.839224,2025-09-02 16:52:21.756612,0 days 00:07:03.917388,100,normal,6,zero,,0.1825508040911018,3712,864,Glorot,,tanh,0.005162358283996582,COMPLETE,0.005162358283996582
53,0.9745645403862,2025-09-02 16:52:21.757059,2025-09-02 16:59:24.603625,0 days 00:07:02.846566,100,uniform,6,zero,,0.41556592545123516,4283,816,old,1.5291424127249338,tanh,0.0022442817687988283,COMPLETE,0.0022442817687988283
54,0.9651935815811157,2025-09-02 16:59:24.604325,2025-09-02 17:06:31.582049,0 days 00:07:06.977724,100,uniform,6,zero,,0.037942378008896355,7550,640,old,1.493825309953797,tanh,0.00619659423828125,COMPLETE,0.00619659423828125
55,0.9467097282409668,2025-09-02 17:06:31.582862,2025-09-02 17:13:35.832463,0 days 00:07:04.249601,100,uniform,8,zero,,0.07879153115997123,2546,864,old,1.5606688366198942,logistic,0.005630350112915039,COMPLETE,0.005630350112915039
56,0.9762258291244507,2025-09-02 17:13:35.833223,2025-09-02 17:20:37.808127,0 days 00:07:01.974904,100,uniform,8,zero,,0.6078414660284388,4590,992,old,1.578167495071594,tanh,0.0012461423873901367,COMPLETE,0.0012461423873901367
57,0.27279033064842223,2025-09-02 17:20:37.808853,2025-09-02 17:27:45.522124,0 days 00:07:07.713271,100,uniform,6,zero,,0.7394442007011786,1154,944,Glorot,,tanh,,COMPLETE,
58,0.9768226027488709,2025-09-02 17:27:45.522575,2025-09-02 18:02:42.463097,0 days 00:34:56.940522,20,uniform,7,zero,,0.21643038864662567,2399,912,old,1.598525429820899,tanh,0.0016964435577392577,COMPLETE,0.0016964435577392577
59,0.973258090019226,2025-09-02 18:02:42.463556,2025-09-02 18:38:39.111299,0 days 00:35:56.647743,20,uniform,7,zero,,0.20097398702176208,864,672,old,1.586719210694136,tanh,0.003717851638793945,COMPLETE,0.003717851638793945
60,0.09835484176874161,2025-09-02 18:38:39.111736,2025-09-02 19:13:24.092435,0 days 00:34:44.980699,20,uniform,7,zero,,0.6261425602562447,2954,992,old,1.7073141556697524,tanh,,COMPLETE,
61,0.09835484176874161,2025-09-02 19:13:24.093491,2025-09-02 19:50:31.486227,0 days 00:37:07.392736,20,uniform,8,nz,0.007969709860514861,0.7438806493095836,2597,1024,old,1.5237205158437797,tanh,,COMPLETE,
62,0.09835484176874161,2025-09-02 19:50:31.486676,2025-09-02 19:57:48.247684,0 days 00:07:16.761008,100,uniform,8,zero,,0.9892176275869383,3815,784,old,1.4790171619471546,tanh,,COMPLETE,
63,0.9653064846992493,2025-09-02 19:57:48.248126,2025-09-02 20:04:57.450989,0 days 00:07:09.202863,100,uniform,5,zero,,0.13609005432148133,1150,960,old,1.6686879940861816,tanh,0.007661843299865722,COMPLETE,0.007661843299865722
64,0.9707903504371643,2025-09-02 20:04:57.451438,2025-09-02 20:11:53.067211,0 days 00:06:55.615773,100,normal,6,zero,,0.33716530175263126,2592,976,old,1.3199525112229362,tanh,0.003721308708190918,COMPLETE,0.003721308708190918
65,0.9534355282783509,2025-09-02 20:11:53.067885,2025-09-02 20:18:53.109840,0 days 00:07:00.041955,100,normal,6,zero,,0.17905994036847808,1613,656,Glorot,,logistic,0.002761101722717285,COMPLETE,0.002761101722717285
66,0.9270806550979614,2025-09-02 20:18:53.110511,2025-09-02 20:54:18.993020,0 days 00:35:25.882509,20,uniform,6,zero,,0.010250512719268043,921,960,old,1.7181401738966335,tanh,0.01219944953918457,COMPLETE,0.01219944953918457
67,0.9670806765556336,2025-09-02 20:54:18.993475,2025-09-02 21:01:26.018989,0 days 00:07:07.025514,100,normal,7,zero,,0.11480296116721764,2171,960,Glorot,,tanh,0.007207727432250977,COMPLETE,0.007207727432250977
68,0.9700322866439819,2025-09-02 21:01:26.019444,2025-09-02 21:08:22.836892,0 days 00:06:56.817448,100,uniform,7,zero,,0.264855516087404,2465,896,old,1.9969985511404635,tanh,0.004446983337402344,COMPLETE,0.004446983337402344
69,0.09835484176874161,2025-09-02 21:08:22.837347,2025-09-02 21:15:20.086964,0 days 00:06:57.249617,100,uniform,6,zero,,0.7635452270197212,2001,800,old,1.3290110339925676,tanh,,COMPLETE,
70,0.5287580952048302,2025-09-02 21:15:20.087426,2025-09-02 21:22:45.284975,0 days 00:07:25.197549,100,uniform,8,nz,2.2786409542494937e-07,0.291630579234537,6706,992,old,1.6890072482427299,logistic,0.0004205942153930664,COMPLETE,0.0004205942153930664
71,0.941322636604309,2025-09-02 21:22:45.285432,2025-09-02 21:29:43.094427,0 days 00:06:57.808995,100,uniform,7,zero,,0.03022502722065463,736,480,old,1.507006924434632,tanh,0.010710310935974122,COMPLETE,0.010710310935974122
72,0.09835484176874161,2025-09-02 21:29:43.095114,2025-09-02 22:05:15.096306,0 days 00:35:32.001192,20,uniform,7,zero,,0.6537250996393958,2888,448,old,1.5614263287934673,tanh,,COMPLETE,
73,0.09835484176874161,2025-09-02 22:05:15.097119,2025-09-02 22:41:55.749977,0 days 00:36:40.652858,20,uniform,7,nz,1.035825810628815e-08,0.8607110054555787,692,688,old,1.6816490674104823,tanh,,COMPLETE,
74,0.958564555644989,2025-09-02 22:41:55.750434,2025-09-02 23:16:41.184452,0 days 00:34:45.434018,20,uniform,7,zero,,0.1321304375069259,346,560,Glorot,,tanh,0.007775259017944336,COMPLETE,0.007775259017944336
75,0.09835484176874161,2025-09-02 23:16:41.184902,2025-09-02 23:53:56.036146,0 days 00:37:14.851244,20,normal,6,nz,3.8029671230636755e-07,0.9360961561608271,5048,992,Glorot,,tanh,,COMPLETE,
76,0.9252258181571961,2025-09-02 23:53:56.036872,2025-09-03 00:29:06.011406,0 days 00:35:09.974534,20,uniform,7,zero,,0.012337601880593017,526,528,old,1.2636151292349072,tanh,0.012003803253173828,COMPLETE,0.012003803253173828
77,0.27351613640785216,2025-09-03 00:29:06.011854,2025-09-03 01:04:01.502638,0 days 00:34:55.490784,20,uniform,7,zero,,0.6470836143970299,411,768,old,1.6764393427544033,tanh,,COMPLETE,
78,0.9755000233650207,2025-09-03 01:04:01.503395,2025-09-03 01:39:01.301374,0 days 00:34:59.797979,20,uniform,6,zero,,0.11481483214117533,3484,912,Glorot,,tanh,0.0035414695739746094,COMPLETE,0.0035414695739746094
79,0.924935495853424,2025-09-03 01:39:01.302111,2025-09-03 02:15:47.642298,0 days 00:36:46.340187,20,uniform,6,zero,,0.00435356808968156,2044,976,Glorot,,tanh,0.012342047691345216,COMPLETE,0.012342047691345216
80,0.9567097187042236,2025-09-03 02:15:47.642738,2025-09-03 02:22:44.747801,0 days 00:06:57.105063,100,normal,7,zero,,0.08915739503655053,4176,976,old,0.9067110362038086,logistic,0.0038887739181518556,COMPLETE,0.0038887739181518556
81,0.9651613235473633,2025-09-03 02:22:44.748266,2025-09-03 02:29:43.691473,0 days 00:06:58.943207,100,uniform,8,zero,,0.05503038062194069,3553,1008,old,1.3982557892020784,tanh,0.008306646347045898,COMPLETE,0.008306646347045898
82,0.15977420210838317,2025-09-03 02:29:43.691917,2025-09-03 03:05:03.385944,0 days 00:35:19.694027,20,uniform,6,zero,,0.9931860981962561,2795,832,old,1.723415918837709,logistic,0.0006075382232666015,COMPLETE,0.0006075382232666015
83,0.9720484137535095,2025-09-03 03:05:03.386702,2025-09-03 03:12:12.658368,0 days 00:07:09.271666,100,normal,8,zero,,0.1828956734544707,8807,912,Glorot,,tanh,0.004459023475646973,COMPLETE,0.004459023475646973
84,0.9768064737319946,2025-09-03 03:12:12.658809,2025-09-03 03:46:57.076013,0 days 00:34:44.417204,20,uniform,6,zero,,0.12267711900510683,4804,976,Glorot,,tanh,0.0028755903244018556,COMPLETE,0.0028755903244018556
85,0.09835484176874161,2025-09-03 03:46:57.076470,2025-09-03 04:21:51.331311,0 days 00:34:54.254841,20,uniform,8,zero,,0.38097114857633324,6966,912,Glorot,,tanh,,COMPLETE,
86,0.9225161671638489,2025-09-03 04:21:51.331752,2025-09-03 04:56:53.115024,0 days 00:35:01.783272,20,uniform,6,zero,,0.2250183059031798,4107,992,Glorot,,logistic,0.0006922006607055664,COMPLETE,0.0006922006607055664
87,0.09835484176874161,2025-09-03 04:56:53.115475,2025-09-03 05:04:07.921079,0 days 00:07:14.805604,100,uniform,6,zero,,0.9142356213500794,8919,768,Glorot,,tanh,,COMPLETE,
88,0.09835484176874161,2025-09-03 05:04:07.921550,2025-09-03 05:39:27.861305,0 days 00:35:19.939755,20,uniform,6,zero,,0.9738808763922362,4121,896,Glorot,,tanh,,COMPLETE,
89,0.9718226075172425,2025-09-03 05:39:27.861767,2025-09-03 06:14:26.678318,0 days 00:34:58.816551,20,uniform,7,zero,,0.03338935199791062,6929,720,Glorot,,tanh,0.005189347267150879,COMPLETE,0.005189347267150879
90,0.9663387417793274,2025-09-03 06:14:26.679097,2025-09-03 06:52:07.721582,0 days 00:37:41.042485,20,uniform,6,nz,8.215020027565723e-07,0.04191457596560678,1809,896,Glorot,,tanh,0.008182334899902343,COMPLETE,0.008182334899902343
91,0.9647419691085816,2025-09-03 06:52:07.722041,2025-09-03 07:27:03.354984,0 days 00:34:55.632943,20,normal,6,zero,,0.014535196216363079,4936,1008,Glorot,,tanh,0.009125614166259765,COMPLETE,0.009125614166259765
92,0.9742580890655518,2025-09-03 07:27:03.355757,2025-09-03 07:34:06.583027,0 days 00:07:03.227270,100,normal,5,zero,,0.4497490808802722,2201,1008,Glorot,,tanh,0.003569149971008301,COMPLETE,0.003569149971008301
93,0.09835484176874161,2025-09-03 07:34:06.583488,2025-09-03 07:41:13.869041,0 days 00:07:07.285553,100,normal,5,zero,,0.9400032162426496,1500,944,Glorot,,tanh,,COMPLETE,
94,0.09835484176874161,2025-09-03 07:41:13.869711,2025-09-03 08:16:16.431398,0 days 00:35:02.561687,20,uniform,5,zero,,0.5560683242374254,2070,944,Glorot,,tanh,,COMPLETE,
95,0.9203871250152588,2025-09-03 08:16:16.431845,2025-09-03 08:23:13.026932,0 days 00:06:56.595087,100,normal,5,zero,,0.20138031510643012,1690,1024,Glorot,,logistic,0.0008393287658691406,COMPLETE,0.0008393287658691406
96,0.9184516310691834,2025-09-03 08:23:13.027385,2025-09-03 08:30:11.319788,0 days 00:06:58.292403,100,normal,5,zero,,0.0022880439737117788,2840,976,Glorot,,tanh,0.01253817081451416,COMPLETE,0.01253817081451416
97,0.25659678131341934,2025-09-03 08:30:11.320559,2025-09-03 08:37:13.716902,0 days 00:07:02.396343,100,normal,6,zero,,0.6588858574908006,9042,864,Glorot,,logistic,0.0011265993118286133,COMPLETE,0.0011265993118286133
