number,value,datetime_start,datetime_complete,duration,params_batch_size,params_colnorm_thresh,params_dist1,params_iseed,params_l2_penalty_choice,params_l2_penalty_nz,params_lr,params_lr_anneal_start,params_nhid1,params_pca_energy,params_preproc,params_scale_heur1,params_scale_mult1,params_squash,user_attrs_avg_fit_criteria,state,avg_fit_criteria
0,0.5204193949699402,2025-08-23 05:23:42.625547,2025-08-23 05:24:33.882412,0 days 00:00:51.256865,100,,normal,6,nz,0.005020847175011941,0.28678812614035476,266,80,,raw,old,0.7186620787543885,logistic,0.0012351274490356445,COMPLETE,0.0012351274490356445
1,0.44414518475532533,2025-08-23 05:24:33.884252,2025-08-23 05:28:32.306338,0 days 00:03:58.422086,20,6.404970863644254e-07,uniform,7,zero,,0.002727419843207111,355,224,,colnorm,old,0.7651904189827918,tanh,0.012611603736877442,COMPLETE,0.012611603736877442
2,0.889048433303833,2025-08-23 05:28:32.308147,2025-08-23 05:29:21.648090,0 days 00:00:49.339943,100,3.6201072407748306e-07,normal,8,zero,,0.5405177223050418,2318,656,,colnorm,old,1.4530888343305441,tanh,0.00010597705841064453,COMPLETE,0.00010597705841064453
3,0.22485485076904296,2025-08-23 05:29:21.649939,2025-08-23 05:30:09.393176,0 days 00:00:47.743237,100,,normal,5,zero,,0.0003086104554138934,785,480,,raw,old,0.4979025208384174,tanh,0.013048267364501953,COMPLETE,0.013048267364501953
4,0.5419193744659424,2025-08-23 05:30:09.393469,2025-08-23 05:30:57.688297,0 days 00:00:48.294828,100,,uniform,6,zero,,0.0753316189564453,715,288,,raw,old,0.842727131035182,logistic,0.007387042045593262,COMPLETE,0.007387042045593262
5,0.5682742118835449,2025-08-23 05:30:57.688575,2025-08-23 05:31:47.833807,0 days 00:00:50.145232,100,,normal,7,zero,,0.13862889345041887,116,144,0.9709046340957243,pca,old,1.6080142723828008,logistic,0.006686735153198242,COMPLETE,0.006686735153198242
6,0.3376451671123505,2025-08-23 05:31:47.834044,2025-08-23 05:35:47.768681,0 days 00:03:59.934637,20,,uniform,7,zero,,1.8560837352965355e-06,103,688,0.5841376526836222,pca,Glorot,,tanh,0.013162827491760254,COMPLETE,0.013162827491760254
7,0.5537580728530884,2025-08-23 05:35:47.770450,2025-08-23 05:36:38.202345,0 days 00:00:50.431895,100,,uniform,6,zero,,0.0045466213818785945,5559,256,0.9962788595863201,pca,Glorot,,logistic,0.009268546104431152,COMPLETE,0.009268546104431152
8,0.1431612938642502,2025-08-23 05:36:38.204875,2025-08-23 05:40:41.214084,0 days 00:04:03.009209,20,1.3368559695948625e-06,normal,5,zero,,1.7286821158315763e-05,6875,560,,colnorm,Glorot,,logistic,0.013194131851196288,COMPLETE,0.013194131851196288
9,0.2935806572437286,2025-08-23 05:40:41.215844,2025-08-23 05:44:45.401713,0 days 00:04:04.185869,20,3.2487879589717105e-05,uniform,8,nz,1.7289062457084353e-08,0.008683638175257328,196,64,,colnorm,Glorot,,logistic,0.011390018463134765,COMPLETE,0.011390018463134765
10,0.48259679079055784,2025-08-23 05:44:45.402061,2025-08-23 05:48:36.218411,0 days 00:03:50.816350,20,3.7695952432846887e-06,uniform,5,zero,,0.005988265244732958,304,96,,colnorm,Glorot,,tanh,0.011804890632629395,COMPLETE,0.011804890632629395
11,0.2925967812538147,2025-08-23 05:48:36.218731,2025-08-23 05:52:28.534102,0 days 00:03:52.315371,20,,uniform,7,zero,,2.205572604793678e-06,1299,112,0.9177342805737674,pca,Glorot,,tanh,0.013055801391601562,COMPLETE,0.013055801391601562
12,0.8674355030059815,2025-08-23 05:52:28.534376,2025-08-23 05:53:18.185482,0 days 00:00:49.651106,100,,uniform,8,zero,,0.6463670471704025,645,384,0.6854374496447422,pca,old,0.6411968347530046,tanh,-0.00022461414337158204,COMPLETE,-0.00022461414337158204
13,0.1349838748574257,2025-08-23 05:53:18.185699,2025-08-23 05:54:10.804332,0 days 00:00:52.618633,100,2.4464011566467275e-05,normal,7,nz,6.580761756952406e-06,3.529805211191061e-06,1037,544,,colnorm,old,1.9071709329056934,logistic,0.013089799880981445,COMPLETE,0.013089799880981445
14,0.3154838800430298,2025-08-23 05:54:10.804604,2025-08-23 05:58:12.710625,0 days 00:04:01.906021,20,4.53231249709737e-06,uniform,6,zero,,0.0008232511308055879,1021,416,,colnorm,Glorot,,logistic,0.012650251388549805,COMPLETE,0.012650251388549805
15,0.11369355171918868,2025-08-23 05:58:12.712546,2025-08-23 06:02:28.323445,0 days 00:04:15.610899,20,0.00022796177218519458,normal,5,nz,4.566335943744083e-08,9.86923632335542e-06,483,544,,colnorm,Glorot,,logistic,0.013601422309875488,COMPLETE,0.013601422309875488
16,0.8873548865318298,2025-08-23 06:02:28.323720,2025-08-23 06:03:17.596626,0 days 00:00:49.272906,100,1.189274263546075e-06,uniform,6,zero,,0.025365537259255194,4125,816,,colnorm,old,0.48948637724712935,tanh,0.007595491409301758,COMPLETE,0.007595491409301758
17,0.11366129368543625,2025-08-23 06:03:17.596851,2025-08-23 06:07:31.079812,0 days 00:04:13.482961,20,,uniform,6,nz,1.4593069348259313e-06,4.8725813807672996e-05,872,496,,raw,Glorot,,logistic,0.013333940505981445,COMPLETE,0.013333940505981445
18,0.09972580820322037,2025-08-23 06:07:31.080142,2025-08-23 06:11:47.473144,0 days 00:04:16.393002,20,0.0003658052095178819,uniform,5,nz,2.61432346137729e-05,0.7712091002222098,167,560,,colnorm,old,0.8772453453841234,logistic,,COMPLETE,
19,0.1422096833586693,2025-08-23 06:11:47.473420,2025-08-23 06:12:38.360156,0 days 00:00:50.886736,100,,normal,7,nz,4.271037808365358e-05,1.9595449161099905e-06,6790,112,0.8283523401966375,pca,Glorot,,logistic,0.012932515144348145,COMPLETE,0.012932515144348145
20,0.33982259035110474,2025-08-23 06:12:38.360381,2025-08-23 06:16:39.395726,0 days 00:04:01.035345,20,,uniform,7,zero,,0.00029956802319562316,1957,592,0.6083709951450864,pca,Glorot,,logistic,0.012854576110839844,COMPLETE,0.012854576110839844
21,0.11366129368543625,2025-08-23 06:16:39.395993,2025-08-23 06:20:42.711795,0 days 00:04:03.315802,20,8.497871339273834e-07,normal,5,zero,,2.786929921862278e-06,293,1024,,colnorm,old,0.9114986472254265,logistic,0.012882876396179199,COMPLETE,0.012882876396179199
22,0.7035323023796082,2025-08-23 06:20:42.712091,2025-08-23 06:24:54.174914,0 days 00:04:11.462823,20,,normal,5,nz,7.842857048400411e-08,0.02247144159652349,1071,272,,raw,Glorot,,tanh,0.008175063133239745,COMPLETE,0.008175063133239745
23,0.4023709774017334,2025-08-23 06:24:54.175183,2025-08-23 06:28:53.424073,0 days 00:03:59.248890,20,,uniform,8,zero,,0.00013828279283371964,8171,896,0.5079552056222199,pca,Glorot,,logistic,0.012885975837707519,COMPLETE,0.012885975837707519
24,0.2515967845916748,2025-08-23 06:28:53.424326,2025-08-23 06:29:42.478643,0 days 00:00:49.054317,100,1.6627948650580708e-06,normal,7,zero,,0.0013572916218580562,286,640,,colnorm,Glorot,,logistic,0.01315929889678955,COMPLETE,0.01315929889678955
25,0.8018064618110656,2025-08-23 06:29:42.478865,2025-08-23 06:30:32.534791,0 days 00:00:50.055926,100,,uniform,8,nz,3.858423808425208e-06,0.29190611010470696,744,96,0.9535186884098954,pca,Glorot,,tanh,0.00041735172271728516,COMPLETE,0.00041735172271728516
26,0.11366129368543625,2025-08-23 06:30:32.535021,2025-08-23 06:31:20.494782,0 days 00:00:47.959761,100,,normal,5,zero,,0.00027076433920494625,203,512,,raw,Glorot,,logistic,0.012991642951965332,COMPLETE,0.012991642951965332
27,0.11366129368543625,2025-08-23 06:31:20.495070,2025-08-23 06:32:10.115728,0 days 00:00:49.620658,100,,normal,6,zero,,8.177437067311106e-06,126,880,0.8495971274555434,pca,Glorot,,logistic,0.013129758834838866,COMPLETE,0.013129758834838866
28,0.34733872413635253,2025-08-23 06:32:10.115953,2025-08-23 06:32:59.168776,0 days 00:00:49.052823,100,5.662291912711977e-08,normal,7,zero,,1.8175550179742918e-06,2310,800,,colnorm,old,1.6535901776344464,tanh,0.013228869438171387,COMPLETE,0.013228869438171387
29,0.11366129368543625,2025-08-23 06:32:59.169007,2025-08-23 06:37:00.037987,0 days 00:04:00.868980,20,7.544527667506924e-06,uniform,7,zero,,2.1255211024653712e-06,2609,720,,colnorm,Glorot,,logistic,0.013089728355407716,COMPLETE,0.013089728355407716
30,0.370693564414978,2025-08-23 06:37:00.038260,2025-08-23 06:41:01.412547,0 days 00:04:01.374287,20,,uniform,7,zero,,3.0420481909171226e-05,5892,1024,0.5003456763160243,pca,Glorot,,tanh,0.012917637825012207,COMPLETE,0.012917637825012207
31,0.11366129368543625,2025-08-23 06:41:01.412806,2025-08-23 06:45:01.746920,0 days 00:04:00.334114,20,,normal,8,zero,,0.00021951712705620135,200,432,,raw,Glorot,,logistic,0.012938094139099122,COMPLETE,0.012938094139099122
32,0.34741936922073363,2025-08-23 06:45:01.747234,2025-08-23 06:45:50.883362,0 days 00:00:49.136128,100,5.143782444317332e-05,uniform,7,zero,,8.419872737053124e-06,1264,768,,colnorm,old,1.7604849969291174,tanh,0.013253021240234374,COMPLETE,0.013253021240234374
33,0.4737419605255127,2025-08-23 06:45:50.883591,2025-08-23 06:46:40.185160,0 days 00:00:49.301569,100,6.315839996288766e-08,uniform,8,zero,,0.008885188322966437,262,864,,colnorm,old,1.158454344679856,logistic,0.012584781646728516,COMPLETE,0.012584781646728516
34,0.44511292576789857,2025-08-23 06:46:40.185386,2025-08-23 06:47:29.519435,0 days 00:00:49.334049,100,,normal,6,zero,,0.0013178595061205047,329,736,0.7980091449630146,pca,Glorot,,tanh,0.013090014457702637,COMPLETE,0.013090014457702637
35,0.515516173839569,2025-08-23 06:47:29.519654,2025-08-23 06:51:43.641971,0 days 00:04:14.122317,20,,normal,5,nz,0.0020457025186879554,0.0008907661777157554,5633,592,,raw,Glorot,,tanh,0.01220858097076416,COMPLETE,0.01220858097076416
36,0.42498388290405276,2025-08-23 06:51:43.642242,2025-08-23 06:55:43.479716,0 days 00:03:59.837474,20,,uniform,6,zero,,0.000289020414220305,2510,640,,raw,old,1.7872580074114737,tanh,0.01304612159729004,COMPLETE,0.01304612159729004
37,0.6311774492263794,2025-08-23 06:55:43.479977,2025-08-23 06:59:40.694053,0 days 00:03:57.214076,20,,normal,7,zero,,0.038617909479397895,2406,240,,raw,Glorot,,logistic,0.003437662124633789,COMPLETE,0.003437662124633789
38,0.5085161328315735,2025-08-23 06:59:40.695825,2025-08-23 07:03:54.853789,0 days 00:04:14.157964,20,5.66392477238153e-07,normal,8,nz,2.2300306597582873e-07,0.003956910799827261,385,880,,colnorm,old,1.8086888792032279,logistic,0.01283247470855713,COMPLETE,0.01283247470855713
39,0.11366129368543625,2025-08-23 07:03:54.854065,2025-08-23 07:04:41.039830,0 days 00:00:46.185765,100,,uniform,6,zero,,2.670557841476819e-05,4078,80,,raw,Glorot,,logistic,0.01256101131439209,COMPLETE,0.01256101131439209
40,0.09972580820322037,2025-08-23 07:04:41.040069,2025-08-23 07:05:33.022560,0 days 00:00:51.982491,100,2.2760628803348567e-07,uniform,6,nz,5.255646535131508e-06,0.675245206911214,1213,592,,colnorm,old,1.1325084528478357,logistic,,COMPLETE,
41,0.18059678077697755,2025-08-23 07:05:33.022786,2025-08-23 07:09:44.822804,0 days 00:04:11.800018,20,,normal,8,nz,0.00027096302515269757,6.755891258918345e-06,3527,160,0.628236311918623,pca,Glorot,,logistic,0.013189911842346191,COMPLETE,0.013189911842346191
42,0.8380645513534546,2025-08-23 07:09:44.823079,2025-08-23 07:10:34.421597,0 days 00:00:49.598518,100,1.3193211738078216e-08,uniform,7,zero,,0.04660634921932745,822,304,,colnorm,Glorot,,tanh,0.004671835899353027,COMPLETE,0.004671835899353027
43,0.5010967791080475,2025-08-23 07:10:34.421896,2025-08-23 07:11:22.223602,0 days 00:00:47.801706,100,,normal,8,zero,,0.028510631616419233,299,496,,raw,old,1.4602045362651164,logistic,0.01057446002960205,COMPLETE,0.01057446002960205
44,0.8653871059417725,2025-08-23 07:11:22.223830,2025-08-23 07:15:23.471737,0 days 00:04:01.247907,20,1.6102603720059748e-08,normal,7,zero,,0.23382891630134822,237,432,,colnorm,Glorot,,tanh,0.002214193344116211,COMPLETE,0.002214193344116211
45,0.13130645751953124,2025-08-23 07:15:23.472017,2025-08-23 07:16:15.667081,0 days 00:00:52.195064,100,,uniform,7,nz,2.172158274853957e-05,4.971380801717752e-05,489,752,0.9300557916705414,pca,old,1.570720193391757,logistic,0.012969684600830079,COMPLETE,0.012969684600830079
46,0.2102580726146698,2025-08-23 07:16:15.667313,2025-08-23 07:20:16.362805,0 days 00:04:00.695492,20,,normal,6,zero,,0.0014352166121342712,578,704,,raw,Glorot,,logistic,0.012902021408081055,COMPLETE,0.012902021408081055
47,0.8827419877052307,2025-08-23 07:20:16.364506,2025-08-23 07:21:05.511407,0 days 00:00:49.146901,100,5.686551670725622e-09,normal,6,zero,,0.14574547360022277,444,816,,colnorm,Glorot,,tanh,0.006177711486816406,COMPLETE,0.006177711486816406
48,0.864258074760437,2025-08-23 07:21:05.511652,2025-08-23 07:25:02.819171,0 days 00:03:57.307519,20,,normal,6,zero,,0.31593794654852525,199,192,,raw,old,0.9795852210443081,tanh,0.001097869873046875,COMPLETE,0.001097869873046875
49,0.8275968194007873,2025-08-23 07:25:02.820851,2025-08-23 07:29:03.425225,0 days 00:04:00.604374,20,,uniform,6,zero,,0.014478999776695603,3301,592,,raw,Glorot,,tanh,0.007951116561889649,COMPLETE,0.007951116561889649
50,0.48498388528823855,2025-08-23 07:29:03.425487,2025-08-23 07:33:06.508910,0 days 00:04:03.083423,20,,normal,7,nz,0.001367883087079219,0.0015992224831826354,417,576,0.8305571634778848,pca,Glorot,,tanh,0.012843561172485352,COMPLETE,0.012843561172485352
51,0.32977420687675474,2025-08-23 07:33:06.509162,2025-08-23 07:37:21.560166,0 days 00:04:15.051004,20,1.8776734741187351e-06,normal,6,nz,5.921401756691521e-08,3.2902411980469176e-06,315,368,,colnorm,old,0.537490790118223,tanh,0.013196301460266114,COMPLETE,0.013196301460266114
52,0.5667258024215698,2025-08-23 07:37:21.561961,2025-08-23 07:41:34.836690,0 days 00:04:13.274729,20,,uniform,5,nz,1.9712592377567804e-07,0.08237999780283811,1317,672,,raw,old,0.31677426868467073,logistic,0.008327722549438477,COMPLETE,0.008327722549438477
53,0.25233871936798097,2025-08-23 07:41:34.836964,2025-08-23 07:42:27.651652,0 days 00:00:52.814688,100,,normal,8,nz,0.003032927057275183,0.002064925722505891,279,144,0.9220608878872901,pca,old,1.8296397535659579,logistic,0.01310417652130127,COMPLETE,0.01310417652130127
54,0.32422582507133485,2025-08-23 07:42:27.651883,2025-08-23 07:46:26.606130,0 days 00:03:58.954247,20,,normal,6,zero,,4.364350063664588e-06,2385,144,0.5109065798514173,pca,old,1.1246290766943483,tanh,0.013004517555236817,COMPLETE,0.013004517555236817
55,0.5603870987892151,2025-08-23 07:46:26.606388,2025-08-23 07:50:28.156647,0 days 00:04:01.550259,20,,uniform,6,nz,1.908237513615749e-06,0.009531024033067244,2537,80,,raw,old,0.27563829445908666,tanh,0.00699000358581543,COMPLETE,0.00699000358581543
56,0.8829677939414978,2025-08-23 07:50:28.156946,2025-08-23 07:54:39.075917,0 days 00:04:10.918971,20,,normal,8,nz,2.2686734297293006e-07,0.044015123416251516,5285,336,0.899069644786243,pca,Glorot,,logistic,-0.00011780261993408204,COMPLETE,-0.00011780261993408204
57,0.11366129368543625,2025-08-23 07:54:39.076188,2025-08-23 07:58:38.656002,0 days 00:03:59.579814,20,8.474425126846829e-09,uniform,6,zero,,2.3267466313431546e-06,2508,496,,colnorm,old,0.49831885853583435,logistic,0.013333845138549804,COMPLETE,0.013333845138549804
58,0.2618387222290039,2025-08-23 07:58:38.656261,2025-08-23 08:02:54.106663,0 days 00:04:15.450402,20,,normal,6,nz,1.8880093046200592e-07,8.506886477584808e-05,9312,384,,raw,old,0.2955716745211142,tanh,0.012907123565673828,COMPLETE,0.012907123565673828
59,0.5037580788135528,2025-08-23 08:02:54.106962,2025-08-23 08:06:56.933152,0 days 00:04:02.826190,20,,uniform,5,nz,4.856008981034457e-08,0.027446004592120654,110,64,0.5380208887710339,pca,Glorot,,tanh,0.009533500671386719,COMPLETE,0.009533500671386719
60,0.3824193775653839,2025-08-23 08:06:56.933420,2025-08-23 08:07:46.083954,0 days 00:00:49.150534,100,2.4904386492746227e-07,normal,5,zero,,0.0003194464171832185,9843,592,,colnorm,Glorot,,logistic,0.012946653366088866,COMPLETE,0.012946653366088866
61,0.3211613118648529,2025-08-23 08:07:46.084186,2025-08-23 08:11:47.115739,0 days 00:04:01.031553,20,0.00012128489198477746,uniform,7,zero,,1.8484584489544195e-05,632,544,,colnorm,old,0.423959085886948,tanh,0.013089990615844727,COMPLETE,0.013089990615844727
62,0.511919367313385,2025-08-23 08:11:47.117320,2025-08-23 08:12:42.904224,0 days 00:00:55.786904,100,,normal,8,nz,2.5236754008824133e-06,0.017500812566383212,291,1008,0.6221741311187055,pca,old,0.37547167088158373,logistic,0.012370061874389649,COMPLETE,0.012370061874389649
63,0.22387097477912904,2025-08-23 08:12:42.904455,2025-08-23 08:13:32.306055,0 days 00:00:49.401600,100,5.794228607829461e-09,normal,6,zero,,0.0013694301399500603,144,992,,colnorm,Glorot,,logistic,0.012934064865112305,COMPLETE,0.012934064865112305
64,0.2561129152774811,2025-08-23 08:13:32.306284,2025-08-23 08:17:31.380708,0 days 00:03:59.074424,20,5.624930936473373e-08,normal,6,zero,,0.2299092964953523,4085,480,,colnorm,Glorot,,logistic,,COMPLETE,
65,0.5338709950447083,2025-08-23 08:17:31.381006,2025-08-23 08:18:23.377001,0 days 00:00:51.995995,100,,normal,8,nz,0.00010117448303144918,0.0015824828278696483,7447,560,0.7207643000146433,pca,Glorot,,logistic,0.01184241771697998,COMPLETE,0.01184241771697998
66,0.4248064696788788,2025-08-23 08:18:23.377225,2025-08-23 08:22:23.512799,0 days 00:04:00.135574,20,,normal,6,zero,,0.0062942794473880076,178,432,0.9635306762764995,pca,Glorot,,logistic,0.012650275230407714,COMPLETE,0.012650275230407714
67,0.5300645291805267,2025-08-23 08:22:23.513075,2025-08-23 08:26:33.135669,0 days 00:04:09.622594,20,,normal,7,nz,3.83410000719568e-08,0.8998828949752957,280,208,,raw,old,1.4121636882810773,logistic,0.0016954898834228515,COMPLETE,0.0016954898834228515
68,0.8497097015380859,2025-08-23 08:26:33.137524,2025-08-23 08:30:46.911254,0 days 00:04:13.773730,20,1.6514020850636604e-05,uniform,6,nz,1.6919226390788936e-06,0.029120432139338345,8411,864,,colnorm,old,0.4097929964164301,logistic,0.006095075607299804,COMPLETE,0.006095075607299804
69,0.3446613013744354,2025-08-23 08:30:46.911542,2025-08-23 08:31:38.528630,0 days 00:00:51.617088,100,,normal,5,nz,4.946237180283475e-07,3.629260674519555e-05,1627,368,0.5447326219797635,pca,Glorot,,tanh,0.013147687911987305,COMPLETE,0.013147687911987305
70,0.8807097315788269,2025-08-23 08:31:38.528852,2025-08-23 08:35:53.383813,0 days 00:04:14.854961,20,1.8998574299556565e-06,normal,5,nz,2.6377843786993484e-05,0.2079803493818124,3980,640,,colnorm,Glorot,,tanh,0.0011060237884521484,COMPLETE,0.0011060237884521484
71,0.836854875087738,2025-08-23 08:35:53.384089,2025-08-23 08:39:51.691680,0 days 00:03:58.307591,20,,normal,7,zero,,0.09664203736424475,1907,144,0.7301287849936867,pca,Glorot,,tanh,-6.861686706542969e-05,COMPLETE,-6.861686706542969e-05
72,0.881887149810791,2025-08-23 08:39:51.691939,2025-08-23 08:40:43.450153,0 days 00:00:51.758214,100,4.207878122546038e-09,uniform,5,nz,0.00018155148692324314,0.03984443155062022,3827,832,,colnorm,old,1.8998109343399925,tanh,0.0049779415130615234,COMPLETE,0.0049779415130615234
73,0.20604839622974397,2025-08-23 08:40:43.450377,2025-08-23 08:41:34.293620,0 days 00:00:50.843243,100,,normal,8,nz,5.272265441403007e-06,0.00024266163128750429,188,576,,raw,Glorot,,tanh,0.013359403610229493,COMPLETE,0.013359403610229493
74,0.09972580820322037,2025-08-23 08:41:34.293914,2025-08-23 08:45:48.220884,0 days 00:04:13.926970,20,0.00022365943243466224,uniform,7,nz,0.001036660908766282,0.46613504001648925,1720,304,,colnorm,old,1.2458446602157183,tanh,,COMPLETE,
75,0.1411290407180786,2025-08-23 08:45:48.221152,2025-08-23 08:46:37.781482,0 days 00:00:49.560330,100,,uniform,6,nz,0.0017739514609055758,3.4572239646567794e-06,6448,32,0.7828921161599743,pca,Glorot,,logistic,0.012663865089416504,COMPLETE,0.012663865089416504
76,0.5663548469543457,2025-08-23 08:46:37.781712,2025-08-23 08:50:38.599143,0 days 00:04:00.817431,20,1.0830850649386334e-07,uniform,8,zero,,0.022318938788123494,1279,608,,colnorm,old,0.7851688960347685,logistic,0.011269307136535645,COMPLETE,0.011269307136535645
77,0.5318709969520569,2025-08-23 08:50:38.599396,2025-08-23 08:51:30.714792,0 days 00:00:52.115396,100,,normal,7,nz,1.5551139170468825e-07,0.0039509825139392215,435,1024,0.7259795689462522,pca,old,1.7259387861118338,logistic,0.012591195106506348,COMPLETE,0.012591195106506348
78,0.5271774530410767,2025-08-23 08:51:30.715025,2025-08-23 08:52:19.262900,0 days 00:00:48.547875,100,6.862365405731616e-07,normal,7,zero,,0.005523938552884372,499,432,,colnorm,Glorot,,tanh,0.012686896324157714,COMPLETE,0.012686896324157714
79,0.39208065867424013,2025-08-23 08:52:19.263135,2025-08-23 08:53:08.844469,0 days 00:00:49.581334,100,,normal,7,zero,,0.0002997657084618961,1223,800,0.9226718983705813,pca,old,0.6444303612007551,tanh,0.01301419734954834,COMPLETE,0.01301419734954834
80,0.8841129541397095,2025-08-23 08:53:08.844768,2025-08-23 08:53:58.216148,0 days 00:00:49.371380,100,2.7305701283776972e-08,uniform,8,zero,,0.22752807734610944,1440,528,,colnorm,old,0.739658355926474,tanh,0.002565741539001465,COMPLETE,0.002565741539001465
81,0.8688225984573364,2025-08-23 08:53:58.216373,2025-08-23 08:54:47.079287,0 days 00:00:48.862914,100,7.698088393318814e-08,normal,5,zero,,0.03293547698396798,3749,448,,colnorm,Glorot,,tanh,0.0033733606338500976,COMPLETE,0.0033733606338500976
82,0.24687097370624542,2025-08-23 08:54:47.079516,2025-08-23 08:59:01.029866,0 days 00:04:13.950350,20,,uniform,7,nz,5.719200901848992e-07,0.00302353028482557,545,368,,raw,Glorot,,logistic,0.012787079811096192,COMPLETE,0.012787079811096192
83,0.509580671787262,2025-08-23 08:59:01.030143,2025-08-23 09:03:00.495444,0 days 00:03:59.465301,20,,uniform,5,zero,,0.012347585205237686,1014,560,,raw,old,1.846507010932338,logistic,0.010480475425720216,COMPLETE,0.010480475425720216
84,0.5069677472114563,2025-08-23 09:03:00.495705,2025-08-23 09:07:00.580130,0 days 00:04:00.084425,20,,normal,6,zero,,0.0005770654742582456,4586,976,,raw,old,1.0590325655622437,tanh,0.012866568565368653,COMPLETE,0.012866568565368653
