number,value,datetime_start,datetime_complete,duration,params_batch_size,params_colnorm_thresh,params_dist1,params_iseed,params_l2_penalty_choice,params_l2_penalty_nz,params_lr,params_lr_anneal_start,params_nhid1,params_pca_energy,params_preproc,params_scale_heur1,params_scale_mult1,params_squash,state
0,0.756048321723938,2025-08-19 16:21:29.169166,2025-08-19 16:22:32.526746,0 days 00:01:03.357580,100,,uniform,7,zero,,0.007884525123125251,6716,224,,raw,old,1.0971381738355623,tanh,COMPLETE
1,0.5100806554158529,2025-08-19 16:22:32.527279,2025-08-19 16:23:16.803685,0 days 00:00:44.276406,100,,normal,5,nz,1.2727312160386438e-06,9.666315621818178e-06,8814,544,0.6429627069533147,pca,old,1.6902914737306785,logistic,COMPLETE
2,0.5081129471460978,2025-08-19 16:23:16.804150,2025-08-19 16:23:57.798571,0 days 00:00:40.994421,100,5.725104756286157e-07,uniform,7,zero,,5.869278864497565e-05,184,496,,colnorm,Glorot,,tanh,COMPLETE
3,0.5164999564488729,2025-08-19 16:23:57.799041,2025-08-19 16:27:30.233589,0 days 00:03:32.434548,20,,uniform,6,nz,8.678091639851699e-08,0.0051580133181241905,4838,880,,raw,Glorot,,logistic,COMPLETE
4,0.7685805956522623,2025-08-19 16:27:30.237382,2025-08-19 16:28:11.693733,0 days 00:00:41.456351,100,,uniform,6,zero,,0.506580933766905,1008,768,,raw,Glorot,,logistic,COMPLETE
5,0.5015645027160645,2025-08-19 16:28:11.694116,2025-08-19 16:28:51.763711,0 days 00:00:40.069595,100,,normal,8,zero,,5.4824957901716925e-06,3888,896,,raw,old,1.4796032046284098,logistic,COMPLETE
6,0.5038871169090271,2025-08-19 16:28:51.764195,2025-08-19 16:32:19.290643,0 days 00:03:27.526448,20,,uniform,6,nz,0.00010057276025489289,0.05733185114313379,136,96,,raw,old,0.30238424068926784,logistic,COMPLETE
7,0.5015645027160645,2025-08-19 16:32:19.291114,2025-08-19 16:33:00.031498,0 days 00:00:40.740384,100,4.380280035335685e-08,uniform,7,zero,,9.1979727922209e-05,258,80,,colnorm,Glorot,,logistic,COMPLETE
8,0.5015645027160645,2025-08-19 16:33:00.031880,2025-08-19 16:33:46.031551,0 days 00:00:45.999671,100,,uniform,5,nz,0.0005496752850382062,1.0499376555071792e-06,532,416,,raw,Glorot,,tanh,COMPLETE
9,0.5015645027160645,2025-08-19 16:33:46.032001,2025-08-19 16:34:34.009860,0 days 00:00:47.977859,100,,uniform,7,nz,0.0001098032289869049,1.5164331101171383e-05,355,992,,raw,Glorot,,logistic,COMPLETE
10,0.5219999551773071,2025-08-19 16:34:34.010290,2025-08-19 16:37:50.844076,0 days 00:03:16.833786,20,,normal,6,zero,,0.7871964951644287,1573,672,0.9956846478337698,pca,Glorot,,tanh,COMPLETE
11,0.5179516474405924,2025-08-19 16:37:50.847016,2025-08-19 16:38:30.472686,0 days 00:00:39.625670,100,,uniform,8,zero,,0.0068382162445306295,1222,272,,raw,old,0.8078541493144078,tanh,COMPLETE
12,0.6256615122159322,2025-08-19 16:38:30.472871,2025-08-19 16:39:09.035099,0 days 00:00:38.562228,100,,uniform,6,zero,,0.40611441567449,2621,704,,raw,old,0.9759061539819556,tanh,COMPLETE
13,0.7140000462532043,2025-08-19 16:39:09.035515,2025-08-19 16:39:49.124736,0 days 00:00:40.089221,100,,uniform,7,zero,,0.055850039063987486,671,288,0.5455165530861601,pca,old,1.273148944256613,tanh,COMPLETE
14,0.5055322647094727,2025-08-19 16:39:49.124993,2025-08-19 16:40:27.136312,0 days 00:00:38.011319,100,,uniform,6,zero,,0.0007986397211656458,9060,720,,raw,Glorot,,logistic,COMPLETE
15,0.7458870013554891,2025-08-19 16:40:27.136649,2025-08-19 16:43:42.450364,0 days 00:03:15.313715,20,0.0009092231970873717,normal,7,zero,,0.07039878355501994,2242,272,,colnorm,old,0.6268284040628158,tanh,COMPLETE
16,0.5260483821233114,2025-08-19 16:43:42.450800,2025-08-19 16:44:20.681835,0 days 00:00:38.231035,100,,uniform,5,zero,,0.0018748878255747659,809,608,,raw,old,1.1998341178452763,tanh,COMPLETE
17,0.7687742908795675,2025-08-19 16:44:20.682120,2025-08-19 16:44:58.708946,0 days 00:00:38.026826,100,,uniform,8,zero,,0.20612876204490535,3883,800,,raw,Glorot,,logistic,COMPLETE
18,0.7725161711374918,2025-08-19 16:44:58.709354,2025-08-19 16:48:11.480838,0 days 00:03:12.771484,20,0.00040546929729066874,normal,8,zero,,0.2141953040317762,2543,832,,colnorm,Glorot,,logistic,COMPLETE
19,0.778000017007192,2025-08-19 16:48:11.481274,2025-08-19 16:51:22.664962,0 days 00:03:11.183688,20,0.000996893275919938,normal,8,zero,,0.13660143685862272,3465,816,,colnorm,Glorot,,logistic,COMPLETE
20,0.5502095619837443,2025-08-19 16:51:22.665408,2025-08-19 16:54:45.081748,0 days 00:03:22.416340,20,0.0007252137930504557,normal,8,zero,,0.022470394330087264,2176,976,,colnorm,Glorot,,logistic,COMPLETE
21,0.7727258006731669,2025-08-19 16:54:45.085299,2025-08-19 16:58:04.703727,0 days 00:03:19.618428,20,3.0343305428141258e-05,normal,8,zero,,0.17495619060333983,4260,832,,colnorm,Glorot,,logistic,COMPLETE
22,0.7709838549296061,2025-08-19 16:58:04.704171,2025-08-19 17:01:13.583158,0 days 00:03:08.878987,20,8.868050248923616e-05,normal,8,zero,,0.24353817625030572,5172,864,,colnorm,Glorot,,logistic,COMPLETE
23,0.7789193987846375,2025-08-19 17:01:13.583629,2025-08-19 17:04:23.227865,0 days 00:03:09.644236,20,3.679070664598436e-05,normal,8,zero,,0.13201810267344097,2996,816,,colnorm,Glorot,,logistic,COMPLETE
24,0.5445805191993713,2025-08-19 17:04:23.228314,2025-08-19 17:07:35.138404,0 days 00:03:11.910090,20,1.1122845501920448e-05,normal,8,zero,,0.0271262281941483,1619,976,,colnorm,Glorot,,logistic,COMPLETE
25,0.5136612256368002,2025-08-19 17:07:35.138860,2025-08-19 17:10:48.653970,0 days 00:03:13.515110,20,1.0158551744702198e-05,normal,8,zero,,0.0016338978300868398,3384,624,,colnorm,Glorot,,logistic,COMPLETE
26,0.5143064260482788,2025-08-19 17:10:48.656757,2025-08-19 17:14:13.859680,0 days 00:03:25.202923,20,1.7720963472623948e-05,normal,8,nz,0.006995695414287235,0.0004475949382471403,6632,768,,colnorm,Glorot,,logistic,COMPLETE
27,0.7748709519704183,2025-08-19 17:14:13.860130,2025-08-19 17:17:26.422652,0 days 00:03:12.562522,20,1.230619968861929e-06,normal,8,zero,,0.12224399319839001,4921,928,,colnorm,Glorot,,logistic,COMPLETE
28,0.5207741657892863,2025-08-19 17:17:26.423097,2025-08-19 17:20:44.480599,0 days 00:03:18.057502,20,5.935753108526932e-07,normal,8,zero,,0.013365889196547655,1549,912,,colnorm,Glorot,,logistic,COMPLETE
29,0.7733548482259115,2025-08-19 17:20:44.481348,2025-08-19 17:24:08.614240,0 days 00:03:24.132892,20,2.0275642199964826e-09,normal,8,zero,,0.10221789557062144,6507,1008,,colnorm,Glorot,,logistic,COMPLETE
30,0.696016252040863,2025-08-19 17:24:08.614694,2025-08-19 17:27:22.990777,0 days 00:03:14.376083,20,2.3576171263155377e-06,normal,8,zero,,0.8938865443285898,2823,928,,colnorm,Glorot,,logistic,COMPLETE
31,0.7758549054463705,2025-08-19 17:27:22.991644,2025-08-19 17:30:36.325726,0 days 00:03:13.334082,20,1.3359195658024005e-09,normal,8,zero,,0.07277056430174521,6998,1024,,colnorm,Glorot,,logistic,COMPLETE
32,0.768645187218984,2025-08-19 17:30:36.326184,2025-08-19 17:33:54.073386,0 days 00:03:17.747202,20,3.0568012233983716e-08,normal,8,zero,,0.037838262587184264,9762,944,,colnorm,Glorot,,logistic,COMPLETE
33,0.7004356185595194,2025-08-19 17:33:54.073822,2025-08-19 17:37:05.114988,0 days 00:03:11.041166,20,,normal,5,zero,,0.01399494228916756,5634,496,0.8765405508658164,pca,Glorot,,logistic,COMPLETE
34,0.773322582244873,2025-08-19 17:37:05.117823,2025-08-19 17:40:30.835857,0 days 00:03:25.718034,20,9.982312405358809e-05,normal,8,nz,1.8052068153152047e-08,0.11323104922293224,7490,1024,,colnorm,Glorot,,logistic,COMPLETE
35,0.5150967439015707,2025-08-19 17:40:30.836722,2025-08-19 17:43:43.799914,0 days 00:03:12.963192,20,1.2705772995969314e-09,normal,8,zero,,0.004058108784165685,3166,768,,colnorm,Glorot,,logistic,COMPLETE
36,0.7690484126408895,2025-08-19 17:43:43.800366,2025-08-19 17:46:59.651437,0 days 00:03:15.851071,20,5.0856455424564834e-08,normal,8,zero,,0.3078626925586099,4756,400,,colnorm,Glorot,,logistic,COMPLETE
37,0.7708870967229208,2025-08-19 17:46:59.651881,2025-08-19 17:50:21.956471,0 days 00:03:22.304590,20,3.5791222299891276e-06,normal,8,zero,,0.10958624661191228,7707,864,,colnorm,Glorot,,logistic,COMPLETE
38,0.5123225847880045,2025-08-19 17:50:21.956916,2025-08-19 17:53:43.431142,0 days 00:03:21.474226,20,,normal,5,nz,1.1840472892803598e-06,0.00021044242889034246,2009,928,0.7689767473142841,pca,Glorot,,logistic,COMPLETE
39,0.6648873488108317,2025-08-19 17:53:43.431598,2025-08-19 17:56:56.175583,0 days 00:03:12.743985,20,1.878607790580836e-07,normal,8,zero,,0.014203404297277754,5606,560,,colnorm,Glorot,,logistic,COMPLETE
40,0.7710322737693787,2025-08-19 17:56:56.176334,2025-08-19 18:00:21.090794,0 days 00:03:24.914460,20,0.00017002229063959253,normal,8,nz,4.3016850244884286e-06,0.5074043425595473,3667,752,,colnorm,Glorot,,logistic,COMPLETE
41,0.7759032448132833,2025-08-19 18:00:21.095476,2025-08-19 18:03:33.983611,0 days 00:03:12.888135,20,1.3831066536087042e-09,normal,8,zero,,0.11405525653452275,6630,1024,,colnorm,Glorot,,logistic,COMPLETE
42,0.770241936047872,2025-08-19 18:03:33.984058,2025-08-19 18:06:47.461871,0 days 00:03:13.477813,20,7.491406597213685e-09,normal,8,zero,,0.04564303798126101,6377,1024,,colnorm,Glorot,,logistic,COMPLETE
43,0.7741613388061523,2025-08-19 18:06:47.463811,2025-08-19 18:10:00.273368,0 days 00:03:12.809557,20,4.906977402368121e-09,normal,8,zero,,0.08370214580938128,4594,960,,colnorm,Glorot,,logistic,COMPLETE
44,0.7676451802253723,2025-08-19 18:10:00.273818,2025-08-19 18:13:11.465372,0 days 00:03:11.191554,20,5.461394032994937e-09,normal,8,zero,,0.4978649429496071,9572,896,,colnorm,Glorot,,logistic,COMPLETE
45,0.7700806260108948,2025-08-19 18:13:11.465820,2025-08-19 18:16:22.027397,0 days 00:03:10.561577,20,1.6853481483561347e-07,normal,7,zero,,0.15268910411823905,7972,848,,colnorm,Glorot,,logistic,COMPLETE
46,0.5215322971343994,2025-08-19 18:16:22.027846,2025-08-19 18:19:59.230304,0 days 00:03:37.202458,20,,normal,6,zero,,0.004271449668941306,123,960,0.5108215403046106,pca,old,1.9526415524024556,logistic,COMPLETE
47,0.7229516903559366,2025-08-19 18:19:59.232876,2025-08-19 18:23:40.694185,0 days 00:03:41.461309,20,4.403531560336907e-05,normal,8,zero,,0.025759465831185418,2976,672,,colnorm,Glorot,,logistic,COMPLETE
48,0.5111452341079712,2025-08-19 18:23:40.694650,2025-08-19 18:26:54.364749,0 days 00:03:13.670099,20,3.254267490660746e-06,normal,5,zero,,0.8242720776235312,4074,144,,colnorm,Glorot,,tanh,COMPLETE
49,0.5015645027160645,2025-08-19 18:26:54.365193,2025-08-19 18:30:19.518992,0 days 00:03:25.153799,20,1.4901325396132884e-08,normal,7,nz,0.009254997261421276,2.0751050240843277e-05,438,896,,colnorm,old,0.33509681222468135,logistic,COMPLETE
50,0.7481935620307922,2025-08-19 18:30:19.522563,2025-08-19 18:33:31.748244,0 days 00:03:12.225681,20,1.9349490563694876e-07,normal,6,zero,,0.04741612401756799,1860,800,,colnorm,Glorot,,tanh,COMPLETE
51,0.7788549264272054,2025-08-19 18:33:31.748699,2025-08-19 18:36:42.749082,0 days 00:03:11.000383,20,3.356608244754909e-09,normal,8,zero,,0.07957755064062433,4873,960,,colnorm,Glorot,,logistic,COMPLETE
52,0.7686774929364523,2025-08-19 18:36:42.749538,2025-08-19 18:39:55.274055,0 days 00:03:12.524517,20,1.0596673665301916e-09,normal,8,zero,,0.3266600732273497,5723,992,,colnorm,Glorot,,logistic,COMPLETE
53,0.7747258146603903,2025-08-19 18:39:55.274514,2025-08-19 18:43:08.458309,0 days 00:03:13.183795,20,2.7921985242969075e-09,normal,8,zero,,0.06421873836673694,4638,1024,,colnorm,Glorot,,logistic,COMPLETE
54,0.7896774013837179,2025-08-19 18:43:08.458767,2025-08-19 18:46:19.746712,0 days 00:03:11.287945,20,,normal,8,zero,,0.1468696389266862,7026,816,0.7535276038687228,pca,Glorot,,logistic,COMPLETE
55,0.5017419159412384,2025-08-19 18:46:19.747157,2025-08-19 18:47:00.404297,0 days 00:00:40.657140,100,,normal,8,zero,,2.225215781839369e-06,7977,800,0.7458991302385909,pca,Glorot,,logistic,COMPLETE
56,0.5227903326352438,2025-08-19 18:47:00.404559,2025-08-19 18:50:13.491762,0 days 00:03:13.087203,20,,uniform,8,zero,,0.010131754981513537,1083,688,0.7811526425245623,pca,old,0.551789429629734,logistic,COMPLETE
57,0.5210162003835043,2025-08-19 18:50:13.494486,2025-08-19 18:53:26.487606,0 days 00:03:12.993120,20,,normal,8,zero,,0.027631836517751446,180,432,0.6557084686221546,pca,Glorot,,logistic,COMPLETE
58,0.5384355982144674,2025-08-19 18:53:26.488051,2025-08-19 18:56:40.516005,0 days 00:03:14.027954,20,,normal,8,zero,,0.5010960082022166,3743,736,0.9022588382839435,pca,Glorot,,tanh,COMPLETE
59,0.7718226114908854,2025-08-19 18:56:40.516473,2025-08-19 18:57:19.737130,0 days 00:00:39.220657,100,,uniform,7,zero,,0.17910603063613195,6736,640,,raw,Glorot,,logistic,COMPLETE
60,0.521645168463389,2025-08-19 18:57:19.737540,2025-08-19 19:00:31.988636,0 days 00:03:12.251096,20,,normal,6,zero,,0.006867617413864408,2449,816,0.6694238601441787,pca,Glorot,,logistic,COMPLETE
61,0.7743387023607889,2025-08-19 19:00:31.994370,2025-08-19 19:03:44.201437,0 days 00:03:12.207067,20,0.0002820402594386589,normal,8,zero,,0.1474809430828892,5081,880,,colnorm,Glorot,,logistic,COMPLETE
62,0.7767903804779053,2025-08-19 19:03:44.203761,2025-08-19 19:06:56.514457,0 days 00:03:12.310696,20,1.209331375341072e-08,normal,8,zero,,0.07701468517968088,5977,944,,colnorm,Glorot,,logistic,COMPLETE
63,0.7681128780047098,2025-08-19 19:06:56.517270,2025-08-19 19:10:08.871193,0 days 00:03:12.353923,20,2.7191402407851826e-09,normal,8,zero,,0.23823742356431907,8726,976,,colnorm,Glorot,,logistic,COMPLETE
64,0.7743064959843954,2025-08-19 19:10:08.871643,2025-08-19 19:13:25.428581,0 days 00:03:16.556938,20,1.0481535409804492e-08,normal,8,zero,,0.07224907209919892,5983,992,,colnorm,Glorot,,logistic,COMPLETE
65,0.771048386891683,2025-08-19 19:13:25.431494,2025-08-19 19:16:35.680383,0 days 00:03:10.248889,20,1.9126711135831418e-08,normal,8,zero,,0.03863131834188128,6908,864,,colnorm,Glorot,,logistic,COMPLETE
66,0.5546122590700785,2025-08-19 19:16:35.683493,2025-08-19 19:19:43.030430,0 days 00:03:07.346937,20,,normal,8,zero,,0.017073174988544933,3428,16,,raw,Glorot,,logistic,COMPLETE
67,0.786709705988566,2025-08-19 19:19:43.030863,2025-08-19 19:23:07.746513,0 days 00:03:24.715650,20,0.0007604704007703321,normal,5,nz,2.6000833728336705e-07,0.33508595522731005,4325,944,,colnorm,old,1.9886488550407349,logistic,COMPLETE
68,0.7115161816279093,2025-08-19 19:23:07.746965,2025-08-19 19:23:50.739035,0 days 00:00:42.992070,100,,normal,5,nz,1.483465170329874e-07,0.3377961770302602,3916,928,0.8677192935044522,pca,old,1.9802560020560576,tanh,COMPLETE
69,0.7746774355570475,2025-08-19 19:23:50.739337,2025-08-19 19:27:15.115377,0 days 00:03:24.376040,20,0.0007076233805114908,uniform,5,nz,1.5204619620016175e-07,0.6682336193816363,2668,896,,colnorm,old,1.6491953219228708,logistic,COMPLETE
70,0.7791290481885275,2025-08-19 19:27:15.115824,2025-08-19 19:30:40.221863,0 days 00:03:25.106039,20,0.0004469975266507946,normal,5,nz,2.7452472393648674e-05,0.2581253060200042,4308,784,,colnorm,old,1.5346424370471234,logistic,COMPLETE
71,0.7799193660418192,2025-08-19 19:30:40.222329,2025-08-19 19:34:04.806151,0 days 00:03:24.583822,20,0.0007460213238235962,normal,5,nz,2.4170289458284846e-05,0.2419823283686558,4287,832,,colnorm,old,1.7266266592537367,logistic,COMPLETE
72,0.779903252919515,2025-08-19 19:34:04.806616,2025-08-19 19:37:27.648849,0 days 00:03:22.842233,20,0.00040245508741901546,normal,5,nz,2.7080942328497563e-05,0.25718951660189204,4276,832,,colnorm,old,1.7469336496387644,logistic,COMPLETE
73,0.7809678117434183,2025-08-19 19:37:27.652426,2025-08-19 19:40:54.495142,0 days 00:03:26.842716,20,0.0008577685652089066,normal,5,nz,2.9404303473903798e-05,0.41349997158732527,4455,784,,colnorm,old,1.770585633690561,logistic,COMPLETE
74,0.7812419136365255,2025-08-19 19:40:54.499545,2025-08-19 19:44:20.036001,0 days 00:03:25.536456,20,0.0003703644255838696,normal,5,nz,3.024931484064688e-05,0.2562954320077089,4279,784,,colnorm,old,1.7633320284813958,logistic,COMPLETE
75,0.7788549264272054,2025-08-19 19:44:20.039706,2025-08-19 19:47:46.378421,0 days 00:03:26.338715,20,0.00048106406872528405,normal,5,nz,3.103847932269677e-05,0.28878537149626393,4271,704,,colnorm,old,1.7601861671646764,logistic,COMPLETE
76,0.7804677883783976,2025-08-19 19:47:46.382196,2025-08-19 19:51:09.185869,0 days 00:03:22.803673,20,0.00025373379751320247,normal,5,nz,1.982862858685433e-05,0.6503297753788582,3121,784,,colnorm,old,1.8269482693601917,logistic,COMPLETE
77,0.6765644749005636,2025-08-19 19:51:09.186337,2025-08-19 19:54:32.842198,0 days 00:03:23.655861,20,0.00026930556755279806,normal,5,nz,2.376362890300453e-05,0.9796697604902979,3232,784,,colnorm,old,1.7969622336154147,logistic,COMPLETE
78,0.7782581051190695,2025-08-19 19:54:32.845555,2025-08-19 19:57:57.177546,0 days 00:03:24.331991,20,,normal,5,nz,1.2253889773045427e-05,0.5884440625649067,4406,736,,raw,old,1.55741257082615,logistic,COMPLETE
79,0.781645139058431,2025-08-19 19:57:57.181825,2025-08-19 20:01:18.985062,0 days 00:03:21.803237,20,0.0009918101405035902,normal,5,nz,4.488179174993658e-05,0.41564140700656393,5433,848,,colnorm,old,1.8562696321850196,logistic,COMPLETE
